review,rating
mantap gampang dipasangnya..thank  recomended,5
"Produk sudah sampai, dikotak braket tertera untuk TV 32-40, tapi udah chat penjual katanya bisa untuk ukuran 43, tapi tidak semua tipe tv, Alhamdulillah bisa untuk TV LG 43', terimakasih...",5
"Barang ok, dikira agak besaran ukurannya ternyata ngepas banget untuk uk tv 43inch, mudah2an kuat dan awet, makasih ya",5
"sori baru ngasih ulasan.  bracket nya bagus. tapi harus ngakalilin lgi baut.a ke panjagan.  tpi oke lah. 
kurir nya jga ramah ",5
"Sampai tepat waktu dan harga bersahabat ...
Mantull bossku 游때游때游녧游녧游녨游녨
Blum dipasang tvnya semoga aj cocok dan kuat 游때游때",5
"pengiriman sangat cepat, pesan tgl 17-04 pagi, nyampe tgl 18-04 siang. terima kasih lazada juga tko yg menjual semoga kalian makin jaya! trima kasih",5
Bagus pas buat tv 32in saya. Besinya juga kuat hanya sayang banget fischer yg dikasih kurang jd tidak bisa dipasang semua bautnya harus diakalin. Tingkatkan lagi 游똂游낕,4
"paket diterima dengan baik, packing rapi, rekomended seller deh...",5
kecepatan pengiriman dan kualitas sama seperti gambar.. ,5
bagaimana pasangnya ini tv 43 inc breaket nya kecil  ,5
no 1 seller.  thnks lazada.  sukses trs,5
barang bagus..sesuai pemesanan kurir ramah..,5
Sesuai pesanan..thanks LAZADA & Seller,5
"mantab respon cepat pengiriman cepat terimakasih buat sellernya dan lazada
goodjob puas saya游녨游녨游녨游녨游녨",5
"barang dah datang cepet pengirimannya makasih kurir ramah
",3
ukurannya gak sama admin.katanya bisa buat lcd 32',1
"Alhamdulillah, barang sesuai dengan yang diinginkan, sudah dipasang, respon juga baik, terimakasih ",5
blm dicoba semoga cocok dan kuat..,5
"mantul barangnya, semoga awet 
makasih seller semoga sukses selalu",4
sessue pesan ,5
Mksih barangnya dah sampe kurirnya ramah.. Moga awet dan usahanya laris manis y... ,5
barang bagus sesuai pesanan,5
ya sangat baik pelayanan kurir dan cocok barange,5
Barang sudah diterima sejak lama. Cepet sampenya.   Sudah langsung dipasang dan hasilnya ok.,5
mantap murah bagus,5
"barang standar
kurir baik sdh langganan",3
"Real pict,pengiriman cepat sebelum estimasi.Bahan tebal 游녨.",5
mantab bos sesuai dengan pesan...pokonya luar biyasa,5
Barang nya mantul 游녨游녨,5
Mantaf cepat banget.... Thx tuk semua,5
"thanks ya lazada, semakin asik aja belanja disini, udah kurirnya ramah, barang nya dipack rapih, puas deh belanja disini mksih y",4
"Barang sudah mendarat dengan rapi, barang sesuai pesanan material cakep dan tebal dan kurir ramah Tank's lazada",5
mantappp ,5
"thanks seller & kurir, item sesuai pesanan dan nyampe tepat waktu",5
ok,5
"pol
",5
barangnya bagus,5
bagus pas di tivi saya yang 43,5
Barang sudah sampai,4
belum dipasang nanti kalau bagus ditambah lagi bintang nya,3
"maaf bru ksih ulsan ,brang ok dn terimaksih lazada smga tambh sukses
",5
cepat mantab..,5
"kirain bracketnya gd ternyata kecil tp over all dengan harga segitu cukup memuaskan 
",5
"barang bagus, pakingnya rapi",5
Good,5
mantul,5
bagussss,5
brg bgus ,5
SIP 游녨,5
