review,rating
Barangnya bagus dan berfungsi dengan normal tp proses untuk pengiriman barangnya yang lama sekali,4
"Respon seller agak lambat tp terbayar oleh proses pengiriman yg cepat oleh kurir, kualitas produk yg diterima dan harga yg bersahabat, produk sdh dites semalaman dan berfungsi dengan baik",5
pengiriman lama sekaleeee lebihin dr estimasi seller ga komunikatif untung barang berfungsi maap kalo kasih bintang 3 ,3
semburan uap kecil,5
the bestlah,5
Barang Bagus.. sesuai ekspektasi.. ,5
brang sudh di tes.tdk ada kendala,5
barang bagus sesuai pesanan kami,5
kita bl 2 alat tp  yang  satu tidak berfungsi ,1
"barangnya kurang memuaskan,
kurang bermanfaat",5
bagus saya kira kecil rupanya 1 liter mantap,5
"kak ini rusak atau gimna iya 
soalnya uap nya belum keluar",5
bagus ,5
