review,rating
Kerennn pengirimannya cepett,5
kerennnn barang sesuai dengan pesanan,5
"barang sesuai dengan pesanan,seler nya juga sangattttt ramah",5
"barang sesuai pesanan, selerrrrr nya ramah banget pengiriman nya pun sangat cepat kerennnnnnnn",5
"mantappp inii barangnyaa datang cepett, sesuai pesanan jugaa, barang yg kosong langsung dikabarin sellernya, kerennn bangettt",5
kerennnnnnn pengirimannya sangat cepat ,5
kerennnnnn barang sesuai dengan pesanan seler nya juga sangattttt ramah ,5
mantaappppppp barang sesuai dengan pesanan ,5
"barang datangnyaa cepett, sesuai pesanan jugaa, kerennn pokoknyaa pastii next order",5
