review,rating
"barang sesuai pesanan, seler nya pun sangat ramah kalau ada stok barang yang kosong langsung di kabarin kerennnnnn",5
"barang sesuai dengan pesanan,seler nya juga sangattttt ramah, pengiriman nya sangattttt cepat",5
"Kerennn barang datang sesuai pesanan, next pasti order lagii pokoknyaa",5
"mantappp barang datang sesuai pesanan, puass bangettt, next pasti order lagiii",5
"Kerennn pengirimannya cepet, barangnya sesuai pesanan, next pasti order lagi pokoknyaağŸ¤—",5
kerennnnnnn barang sesuai dengan pesanan seler nya pun sangat ramah,5
kerennnn barang sesuai dengan pesanan ,5
"kerennnnn barang sesuai dengan pesanan, seler nya pun sangat ramah kerennn ",5
 barang sesuai dengan pesanan seler nya juga sangattttt ramah kalau ada stok barang yang kosong langsung dikabarin kerennnnnnnn ,5
Mantapppp barang sesuai dengan pesanan seler nya juga ramah banget kalau ada stok barang yang kosong langsung di kabarin kerennnnn,5
kerennnnnn barang sesuai dengan pesanan harga nya juga terjangkau ,5
kerennnnnnn pengirimannya cepett ,5
kerennnnnn barang sesuai dengan pesanan seler nya juga sangattttt ramah ,5
kerennn barang sesuai dengan pesanan,5
kerennnn barang sesuai dengan pesanan,5
