review,rating
mantaappppppp barang sesuai dengan pesanan ,5
"kerennnnn barang sesuai dengan pesanan, pengiriman nya pun sangattttt cepat",5
Barang sesuai dengan pesanan seler nya pun sangat ramah,5
"barang sesuai dengan pesanan,seler nya pun sangat ramah,",5
"barang sesuai dengan pesanan,seler nya pun sangat ramah,pengiriman nya pun sangat cepat",5
kerennnnnnnn barang sesuai dengan pesanan ,5
"barang sesuai dengan pesanan,harga nya pun sangattttt terjangkau kualitas terjamin pengiriman nya pun sangattttt cepat ",5
"Kerennnn barang sesuai dengan pesanan, seler nya ramah banget kalau ada stok barang yang kosong langsung di kabarin ",5
"kerennnn barang nya sangattttt bagus, pengiriman nya pun sangattttt cepat ",5
"barang nya sesuai dengan pesanan,toko nya sangattttt amanah, seler nya juga ramah banget",5
barang realpict pengiriman nya sangattttt cepat ,5
"barang sangattttt bagus,pengiriman nya juga sangattttt cepat",5
kerennnnnnn barang sesuai pesanan ,5
