review,rating
"mantappp barang sesuai pesanan, pengiriman cepettt, sellernya juga ramah, barang kosong langsung dikabarin, kerennn",5
"pengiriman nya sangattttt cepattttt,seler nya juga sangattttt ramah ",5
Mantappp barang datang sesuai pesanan,5
"pengiriman nya sangattttt cepat, seler nya pun sangattttt ramah",5
"Kerenn pengirimannya cepet, sesuai pesanan, next pasti order lagi pokoknyaağŸ¤—",5
pengiriman nya sangat cepat,5
"kerennnnnnn barang sesuai dengan pesanan, pengiriman nya pun sangat cepat ",5
"mantappp barang sesuai dengan pesanan,harga nya juga sangattttt terjangkau kualitas terjamin pengiriman nya pun sangattttt cepat ",5
"Barang sesuai dengan pesanan, pengiriman nya sangat cepat, seler nya ramah banget kalau ada stok barang yang kosong langsung di kabarin kerennnn",5
mantaappppppp datangnya cepettt sesuai pesanan ,5
"mantulll sellernya ramah, barang kosong langsung dikabarin, kerennnnn pokoknya ",5
kerennnnn barang sesuai dengan pesanan,5
kerennnnn barang sesuai dengan pesanan,5
"barang nya sangattttt bagus, pengiriman nya pun sangattttt cepat ",5
