review,rating
"kerennnnnn barang sesuai dengan pesanan,seler nya juga sangattttt ramah kalau ada stok barang yang kosong langsung dikabarin ",5
"Kerennnn barang sesuai dengan pesanan, seler nya pun sangat ramah",5
"Kerennn pengirimannya cepet, barangnya sesuai pesanan, next pasti order lagi pokoknyaağŸ¤—",5
"kerennn barang datang sesuai pesanan,pengiriman nya pun sangat cepat",5
"Kerennn pengirimannya cepettt, barangnya juga sesuai pesanan, sukaaa pokoknya ",5
"kerennn sellernya ramah, barang kosong langsung dikabarin, mantappp",5
"Barang sesuai dengan pesanan, pengiriman nya pun sangat cepat",5
kerennnn barang sesuai dengan pesanan seler nya pun sangat ramah,5
"kerennnnnnn barang sangat realpict, seler nya pun sangat ramah",5
"kerennnn barang sesuai dengan pesanan, seler nya juga sangat ramah,pengiriman nya pun sangat cepat",5
barang realpict pengiriman cepat seler nya juga sangattttt ramah kalau ada stok barang yang kosong langsung dikabarin kerennnnnnnn ,5
barang realpict pengiriman nya sangattttt cepat seler nya juga sangattttt ramah ,5
"mantull barang datang sesuai pesanan, sellernya juga ramah, kerennnnlah",5
pengiriman nya sangattttt cepat ,5
"kerennnnnnn barang nya sangattttt bagus, seler nya juga sangattttt ramah",5
"Barang nya sangat baguss, seler nya juga sangat ramah, kerennnnnn",5
