review,rating
"Kerennn barang sesuai dengan pesanan, seler nya pun sangat ramah kalau ada stok barang yang kosong langsung di kabarin kerennnnn",5
"kerennn pengirimannya cepett, barang datang sesuai pesanan, sukaaaa",5
pengiriman nya sangattttt cepat ,5
"Kerennn barang datang sesuai pesanan, puas bangettt pokoknyaa",5
"pengirimannyaa cepett, datang sesuai pesanan, kerennn pokoknyaağŸ‘",5
"mantappp barang datang sesuai pesanan, pengirimannya juga cepettt, sukaaa pokoknyaaa",5
kerennnn barang sesuai dengan pesanan seler nya pun sangat ramah ,5
barang realpict pengiriman nya sangattttt cepat seler nya juga sangattttt ramah ,5
mantaappppppp barang sesuai dengan pesanan ,5
"kerennn barang sesuai dengan pesanan, pengiriman nya pun sangattttt cepat ",5
"barang realpict, datang sesuai pesanan, kerennnlah ",5
kerennnnnn barang sesuai dengan pesanan seler nya juga sangattttt ramah ,5
kerennnnnn barang sesuai dengan pesanan seler nya juga sangattttt ramah ,5
kerennnnnn barang sesuai dengan pesanan,5
"Barang nya sangat bagus, pengiriman nya sangat cepat",5
