review,rating
paket dah sampai jilbabnya bagus bahannya adem..tapi syng aku pesen 4 yg 2 warna bener yg 2 lagi ga sesuai tapi gpp aku ttp suka lain kali lebih teliti lagi makasih seller n lazada kurirnya udah langganan...,5
Hijabnya bagus bahannya halus gag kaku mudah di bentuk recomended banget dh. Kurir jg ramah sopan baik top dh lazada ,5
paket sdh sampai jilbabnya baguuuuus banget ga nyesel deh beli di toko ini..sellernya ramah sesuai lagi yg aku pesen..jadi aku pesen lagi deh makasih selller n lazada abang kurirnya udah langganan..,5
Klu untuk urusan hijab segi empat UMAMA g ada lawan dah real pic size mantab pas paket cepat tdk mengecewakan sukses seller dan lazada kedepannya ,5
mksi kak.. bahan nya Bagus.. istri saya suka,5
barang nya bagus bahan nya juga mantuulll makasih Lazada bang kurir nya juga ramah,5
"ok sesuai dengan pesanan, pengiriman ok
kurir jg ok langgananğŸ‘ğŸ‘",5
Yg satu bahanya bagus yg satu kasar ky yg kena sikat  paku mrotol,3
realpictt mantull,5
alhamdulillah. suka dengan motif pilihan mimin. thanks,5
