review,rating
"ALHAMDULLILAH DATANG DENGAN SELAMAT.. 
Harus sabar, Pengiriman Sangat cepat...
BISA BUAT LANGGANAN, HARGA BERSAHABAT.. bagus semoga awet pas dipakai.. 
TERIMA KASIH. 
LAZADA Kurir dan seller 
SEMOGA SUKSES SLL BUAT ANDA.. ",5
"Kompor nya ga nyala trs pas selang di pasang ke gas kompor nya bunyi,tolong dong kalo bisa tuker sama yg bnr",2
"makasih, barang nya bagus",5
Barang realpict pengiriman cepat n kurir ramah makasih lazada🙏,5
"ok barangnya tp lom di coba
",5
barang nya bagus bngtt mksh ya😘,5
"trm ksh barang da smp dengan selamat tp barang blm di coba udah""an bagus kunir nya ramah ",5
"okkkee brg mantul
",5
bagus tapi belum terpasang .mksih lazada ya,5
good.. trimaksih,5
