review,rating
Barang dh sampai alhamdulillah kompor oke. Makasih lazada ,5
Paket sudah di terima dg bsik terimakasih Lazada dan mas kurirnya semoga sukses,5
"terimakasih,,,brg sdh di terima,packing rapih dan sesuai pesanan",5
"Sgat mengecewakan,kompor rusak dijual hdechğŸ¤¦ ",1
packing rapih barang mendarat dgn baik,5
brg sesuai hrg,5
terima kasih barang sudah saya terima dengan baik.. packing rapih,5
"Barang sudah sampai pas dan sesuai keinginan, kurirnya ramah dan cepat, terimakasih lazada",5
ok,5
