review,rating
Nice prettyyyyy,5
Sue banget taunya pelastik ikan asin mentang mentang murah murahan banget ga alayak peke kuriranya judus banget ogah banget di kirim sama tu kurir,1
"Barang dikirim tepat waktu, dikemas dengan rapih dan kondisi barang baik.. Barangnya tipis, sesuai dengan harga.. Kurirnya juga ramah dan sopan, sudah sering mengantar barang pesanan dari Lazada ke rumah.Terima kasih Lazada.. ",5
"ğŸŒŸ sudah mewakili ulasan sy
",5
"mantap,sangat membantu anak saya yang takut keramas.thx  seller",5
barang sesuai.makasih,5
Makasih barang sdh sampai,5
