review,rating
gmn cara kerjanya? kok dikomputer ga ada namanya.. bantuin cara kerja barang trsebut biar bisa brfungsi... trima kasih,5
"alhamdulillah sangat recomended, barang kami terima dengan baik dan sesuai pesanan. dibimbing sampai bs menggunakan alatnya. terima kasih lazada dan ",5
scanner tdak bsa,2
"alhamdulillah, paketnya udah sampai dengan aman dan cepat, kurirnya juga ramah, adminnya juga sabar banget....sekarang udah bisa ngontrol stok danharga di toko ku...makasih lazada ",5
sopernya ko engga ada apa harus di donload ,5
"Alhamdulillah paket telah mendarat dengan baik, pengiriman cepat,  fast response, recommended seller.",5
"barangnya sesuai gambar,  program mantap walau awalnya masih membingungkan. pokoknya ga nyesal lah klo pesan",5
"recomended,sudah bisa digunakan,kaknya juga ramah bantu sampai bisa digunakan
thanks",5
alhamdulilah paket dah sampai smoga bermanfaat,5
Bagus dan sangat membantu,4
Barang sdh dterima mudah²n awet,5
"bagus.. lancar jaya untuk pnggunaan.. respon pnjual baik, packaging aman",5
pengiriman cepat.. belum dicoba..,5
"barangmantul bozku.. 
tp scan barcode blom dicoba.  smoga bs berfungsi smuany. 
",5
seller mantap...sgt profesional..jgn ragu deh. ,5
barangnya bagus. saya sangat puas.,5
"paket sdh smpe semoga berguna, tp blm kami coba pelayanannya ramah ok lah ",5
"mantap, mudah2an bermanfaat",5
bagus sesuai dengan yg di harapkan,5
mudah mudahan bermanfaat,5
produk bagus.. sesuai harapan.. respon cepat.. ga pake mahal,5
barang tidak mengecewakan respon penjual cepat terbaik pokoknya,5
ok. saya puas.. cepat sampai,5
ok,5
