review,rating
"barangnya tdk sesuai saya belinya Zjiang 5802 sesuai iklanya ada USB + Bluetooth  tp yang di kirim Zjiang Type 5809 gak ada USB dan harganya lbh murah, bagaimna pertanggung jawabnya Barcode Zone 
saya kecewa, ",1
"makasih buanget sangat sangat membantu usahaku
walau pengemasannya lama pi ga nyesel beli di toko ini dan sukses selalu buat tokonya",5
"walaupun harus menempuh waktu yg panjang agar bisa terhubung ke hp krna udh nyoba pin 0000 dan 1234 tpi tetap tdk bisa terhubung. tpi it's okelah , skrg sudah bisa di gunakan dan bagus juga barang nya",3
"pesanan sesuai, sangat memuaskan. makasih kak.",5
barangnya beda dengan yg dipesan,5
"Alhamdulillah,brang ny SDH sampai.trimksih lazada
",5
sdh sampe dan bs lgsg utk ngeprint,5
"barangnya sesuai,,, cepat  nyampe makasi lazada",5
"barang sesuai dengan deskripsi cuman belum di coba karena GK tau cara nyeting di PC nya..
",5
thanks.... sesuai pesanan,5
sip,5
