review,rating
makasih lazada barang'a ori ,5
"mksh seller,pesananku lengkap smuanx.jd langganan ntr ak bli kosmetikny.krn kmrn2 pesan 2 yg dtg 1.mksh bnyk..
bt bg kurirny da langganan jga,baik dan ramah",5
biar bintang yg berbicara,5
"Barang sesuai pesanan,,tidak ada yg kurang.. terima kasih",5
"mantul banget,,,barang yg d pesen juga sesuai harapan,,,gk nyesel blnja di sini",5
memuaskan ğŸ–¤,5
nude ringan,5
"paket sampainya lamaa... Packing nya ga pakai dus, alhasil lipstik patah didalem, ",3
top dech biarkan bintang yg bicara ,5
Sip lah,5
mantep,5
RealL pick,5
