review,rating
"HELLO Clio. Saya sudah konfirmasi di chat bahwa saya beli 2 buah Mad Matte ini, shade Natalie Red (01) dan shade Chai Tea Latte (08), tapi kenapa yg dikirim hanya yg 01 dua2nya??? Kan sesuai instruksi saya disuruh konfirmasi di chat mengenai pilihan shade yg mau dibeli. Udah konfirm malah salah dikirimnya gimana ini? Saya mau ganti pokonya yg 1 lagi ke shade 08 gamau tau!",1
"Warna merahnya bagus banget, formula juga ok meski matte tapi ga buat bibir jd kering. Berasa ada wangi manis2 kayak coklat tp ga ganggu si",5
"Diterima barang tulisan TESTER , kesel banget awalnya masa dikasih tester jdi sy complain ke Clio jdi akhirnya sy hrus kirim kembali barangnya kemudian bru mereka kirim yang baru. Promonya jadi ga dapet deh dan kena biaya ongkir kirim balik k sna. Lain kali tolong di cek baik2 dan lebih hati2 lgi dlm memilih brgn untuk customers. Thanks",5
produk sesuai pengiriman lama banget tp gpp bagus ringam enak dipakai ,5
The best tint I ever try!! the matte texture isn't too dry! n it stays all day in my lips,5
bagoss bngt warna nyaaağŸ˜­ğŸ’œ,5
sesuai sama pesanan,4
"pengiriman lama, warna bagus",5
Bocor smpe ke kotaknya.kayak lipcream bekas.,2
"Warna ok, tp kalo udah lama di bibir jd kering dan ngelupas",3
Good :),5
