review,rating
"halo kak barang nya bagus bgt sumpah cantik pigmented pokonya Pill ,btw next Adain produk thailand gini LG dong kaya sivanna ,kiss beauty ,odbo,any lady yg banyak aku bakalan langganan soalnya packing nya jg tebel bgt luv itttt 🍓🍑",5
Lipstik nya bagus bangetttt.. tapi aku gak suka.. gak tau kenapa hehe. Jd aku kasih ke temen aku deeeehhh hehe,5
"Yeeeeeyyy paketnya udah sampai, maaf baru kasih ulasan, soalnya baru d buka 😅..
Paketnya aman sentosa, gak ada yg rusak...makasiiih banyaakk🙏🙏..mudah²an jd langganan yaa 😉",5
"sdikit kecewa ,kirain yg satu nya warna nya merah bata eh malah d bibir warna nya pucat ,tpi yg no 6 bagus la d bibir cocok ,maksi lazada 😊",5
"Pengirimannya the best cpt bgt, pesen kemaren siang dtg siang ini.. 😂 Lipcream teksturnya bgus ringan, tpi sygnya agak lengket ya tpi bagus wrnanya sesuai gambar,, trus mba kurirnya ramah,, prtahankan 👍 Terimakasih 🙏🙏",4
"Alhamdulilah..senang dan puasss belanja disini,barangnya oke oke..kurirnya pun pd ramah..trmksh LAZADA..",5
"apaan sih ga guna nih toko, pesen lipstik datang mascara, udah respon lama, gimana dong ga ke pake nih, males belanja disini ngerusak nama lazada ajah",1
bagusssssss 👍👍👍,5
"Alhamdulillah Paket saya sdh sampai,, Dan order ke 2 Jadinya,, selalu suka dgn lippGloss NY.... Langganan Dan selalu amanah yah... 😍😍",5
fiks lipstik nya bagus bgt ga nyesel beli 3 sekaligus makan+minum aja nggk ke apus lipstik nya😍kurir nya ge baik bgt 😁,5
"Alhamdulillah paketnya sampai dengan selamat, sesuai sama pesanan semua,.. sya sdh 2x pesan alhamdulillah tdk mengecewakan.. makasih seller, n mksih kurir",5
"Suka banget warna nya transferproof juga, klo gk dipake makan minum cukup tahan lama makasih banget next order lagi disini",5
sebenarnya pengen warna cerah yang 1 nya kan pesan 2 cuma karna warna bibir smuanya ywd gpp lah yg penting lipstiknya bagus cantik kok mungkin laen kali pesan dapat warna cerah makasih ,5
"Alhamdulillah barang sudah sampay, agak lama sih pengiriman nya, tp puas barang bagus. Mksih lazada, dan kurir yg baik dan ramah. Maju tetus lazada",5
sukaaaaaa banget,5
"Sangat puasss,sedikitpun gak ada rasa kecewa😍
Packing rapih,barang cuco,pengiriman cepat dan kurir ramah😇",5
"Paket udah sampe, sempet degdegan takut yg dateng warnanya gak sesuai harapan. Taunya keren banget. ",5
"okkkk bngtt
",5
Bgs liptiknya ga luntur cma wrnanya ajh terlalu tua tpi aku suka mksh lazada,5
"pengiriman cpt tapi warna yg d harapkan kurang sesuai gpp lah masi bisa d pake kok 
makasi",4
"Maaf baru bisa kasih ulasan,tolong toko ini kan saya pesan dua lipstik (lipcream karite & lipcream KB unicorn) tpi kok cuma satu yg dtng?tolong dong! Nnti klau sya pesab make up di toko ini lagi datang ka lipcrean sya satu yg sebelumnya tdk dtng kann klau begini saya yang rugi udahh bayar masa barangnya nggak ada",5
"Bagus bgt warna nya pas buat sya ga terlalu ngejreng walaupun random ,  jdi gampang buat di ombre liptint, seller nya baik n ramah, trmksh lazada😍😊😋",5
"kcewa sy dpt wrna gx jels dipke di bi""r keliatn pucat,,jd gx kepke deh,,,buat kuriry mksih dh ngnterin,,,",2
"Barang nya udah sampe, terimakasih",5
mantul..warna nya menarik.saya suka,5
mntap tap mntap bgt gan 🥰🥰🥰🥰,5
realpicttt dehh,5
"maksih lazada barang nya bagus
",5
beli 2 datang nya cuma satu,1
lumayan bagus ,5
lipstik sesuai bgt,5
"sesuai pesenan, lipstick nya cakep",5
"bgs aku ska mantap pokonya lipcreamnya ringan di bbr,cmn pengnya wrnanya mereh bata 22nya tp ga pa lah nek order lg,,☺️",5
"Barang mendarat tadi siang udah aku coba dan hasilNya cantik,matte, Tapi sayang ada yang pecah satu:( over all okeh pengiriman lama kurirnya ramah terima kasih:)",5
"Sesuai pesanan,,lipstik nya ok bagus,,ada wanginya. Cuma pengen no2 dikirim no3. Dan pengiriman Nya Lmaaaaaaa",4
"No.2 warnanya aneh klo d aplikasikan k bibir jelek bngt, tapi enak di Pake lipcrem nya cuma sayang warna nya q ga suka ",3
"Alhamdulillah barang nyampe lipstik nya bagus wangi jga, tpi warna nya kurang suka tpi gpp
makasih lazada",5
"lipstiknya  bagus bangt  wangi  sesuai gambar dah yg ke 6 kalinya saya beli di toko HARIESTA  dah langganan kurirnya juga dah langganan pokoknya top deh
",5
Paket sudah sampai..tpi pengiriman nya aga lama ya heheh.. Produk baguss saya suka wangi nya juga enak..  Di pake nya aga lengket sedikit si tpi gpp ,5
Sukaaaa banget sama lipsyiknya harga murah kualitasss gamurahan jatuh cinta sama lipstik velvet matte♥️😍💄💄🤗🤗,5
"pengiriman lama,packing kurang rapi cuman di bungkus krtas doang jadi pas di terima udah robek tapi untung barang nya ngga rusak,lipstik nya lumayan lah ",5
barang sampai dgn utuh. tp wadah lipstik nya bocel sedikit ujung bawahnya tp gapapa. warna nya juga bagus dan wangi nya suka.,4
"Knp wrnanya g sesuai, psn yg oren d ksh wrna apa x tuh, jdnya ke bibir g cocok say, lain x jngn d cek dlu klo mau order",3
makasih lazda barng ny udh nympe. barang ny suka banget sesuy sm gambar.aku blnja dari lzadha selalu memuaskn gk pernah kecewa. jg g lupa sama kurirny makasih banyk.,5
alhamdulillah pketnya udh smpekk kurir nya tetap warna lipstiknya juga cntikk gak kecewa pokoknya smga jdilangganan yo,5
"suka bngtt!
rasa permen, tahan air, dan warna cocok.😍
tp emg dr sananya gk da kotak lipstiknya ya..?
",5
Leher ring ny pecah pas d buka dr packing ny gak tau ny tumpah gmn ini ?? Lain kali d perhatikan LG ya packing ny tp lipstik ny bagus gak lengket bau ny jg enak cuma packing ny aja kurang teliti,3
warna nya ini syukaaa sekaliii,5
Pokonya the best,5
Udh pingiriman nya lma.. Ee mlh dateng ny warna nya sama lgi.. Padah mah udi bilngin warna nya campur... ,3
barang sesuai gambar 👍👍👍,5
Kirimnya RANDOM tp warnanya kurang cocok di saya . Tetep bagus sih harganya juga murah bangett...mau pesen lagi ko skrg udh ga ada yaaa...,5
paket sdh mendratt.. tp syg yg dtg bukn wrna yg ku pesen.. tp gpp lh dri pda mubajir.. tanks leselerr.. ,5
Realpict sesuai digambar..mksh😊,5
alhamdu4JJI real pick.trims kk.good luck truz..,5
ini asli bgus banget ,1
"barangnya real pict bngt,kurirnya jga ramah 👍",5
warna nya oren bagus sh ringan dibibir enak bngt 👍,5
"mksh k,, udh langganan q suka smua lipstik.nya matte bagus dan wangi",5
"brg dtg dg baik. brg memuaskan, 
pas dpakai langsg kering, 
kurir baik ",5
hasilnya bener2 waw realpict bagus banget kurirnya jg ramah 😍,5
"bagus bgt lipstiknya warnanya aku suka,  sesuai pict bgt,  i love it 😍",5
"maaf,terlalu kering di bibir saya,tapi bagus warnanya,trimakasih",4
"realpict, saya suka sama warnanya ",5
mantul..lipstik nya ringan di pake makasih lazada untuk Abang kurir nya udah langganan,5
Alhamdulillah baraangg sesuaaii baguusss bngtttt🤗🤗🤗sayaa syuka saya syuka,5
"Bagus bgt,, saya suka, saya suka... 😍",5
"barangnya bagus😘gak nyesel pokoknya beli di toko ini...tetap pertahankan yah kualitasnya ,😍😘",5
"Alhamdulillah barang nya udah sampe Yaa kakkkk, enggak rugi lah pokoknya",5
barangnya realpic bgt warnanya juga kalem ga bakal kapok belanja di sin😊,5
"lipcreamnya warnanya  bagus, wangi 👍
makasih reseller dan lazada  🙏❤",5
bagus bgt warnanya wanginya aku suka bangett,5
bagus banget datengnya cepet kurirnya ramah banget,5
"Suka bangat,,mksh lazada",5
lipstik nyh baguss bnget..,5
"keren lipstiknya.real pict
",5
baguss bangettt makasih yaa kak🤗,5
lipstik nya bagus saya kira lipgloss lembab ternyata matt yaa tp g pp saya suka,3
aku suka banget lipstik nya 😍,5
"sumpah ini tuh bagus banget.sesuai expetasi kurirnya langganan thank's lazada,seler,dan kurirnya",5
sumpah ini tuh bagus banget😍 ,5
bagus syyuukaaa...pertahankan,5
"bagus banget ,warna jg pas banget yg di kirim,,, makasih sis ,,,",5
memuaskan😍,5
real pick banget de pokok nya,5
baguss suka,5
suka bgt lipstik nya ... bagus 😊❣️,5
"real pict harga oke
kurir nya ramah udah langganan juga 
makasih lazada dan seller",5
"lipsticknya lumayan berat dibibir,, wangi tapi gak apa2 suka
",5
"lucu parah,gak ngecewain:)",4
barang oke terimakasih lazada..,5
"Lumayan lah sesuai harga🙂🙂
terimakasih ",4
"Mantap, terimakasih",5
"Bagus dan lucu dengan harga semurah itu, yg mau lgsg aja beli ya gausah ragu",5
lumayan dengan harga murah,4
"baguss, sesuai dengan pesanan ",5
"Realpick loh ya🥰😍,
Maaci lazada dan toko nya😊",5
ok bagus lucu bgt aku suka. tapi pengiriman lumayan.😊,5
bagus sesuai gambar..,5
"paket mendarat dengan baik, cantik, suka bngt, makasih semuanya💙💜",5
"Benar""bagus banget warna ny,,ada wangi ny juga",5
"Thanks , aku suka..
",5
"
brang nya uda smpai bgus mksh lazada.
",5
Barang tidak ada yg kurang mantul ❤,5
baguss nihh kalo gini kan ,5
biar bintang yang berbicara,5
warnanya bagus...tp d pakai lengket...gk kering kayak yg lain...,4
bagus pokoknna ,5
bagus mate ,5
"huhhh suka bngt real pict, amanah bbgt dahk maksih buat lazana. next order lagi.. sukakk bangt",5
suka banget lucu😍,5
"murah meriah tapi mewahh, worth it bgt buat anak sekolah, terimakasih!!",5
real pict sukaa❤️❤️,5
"dmen kabeh,uis langganan,syyyuuukkaaa,",5
barang nya bagus mkasih yh lazada,5
bagus warnanya,5
Trimakasih ...,5
SALAH WARNAAAAAAA,1
"mantulll, nexs order lagi",5
realpict..thnks.,5
"barang sudah sampai, warnanya bagus. terima kasih lazada",5
"makasih brg.a real pict bgdd ,, kurir.a pun dah langganan ,,.🙏",5
Warna nya cantik bgt😍murah tpi ga murahan. Mksh seller dan kurirnya juga😊,5
udah sering order bagusss,5
basis bangat2222 aku suka tahan lama lagi😍😍😍😍,5
"Alhamdulilah suka banget lipstiknya bgus bngett, mksih lazada 😍",5
sudah ku terima paketnyaa. aslii bagus banget matte lagi ringan juga di bibirr,5
mksh  hariesta bagus warnanya,5
terthebest❤love bgt warna perfect semua wangi jg uuuu uhh😍❤langsung jatuh cinta,5
"lipcream nya bagus,pengirimannya cpet psen tgl 1 tgl 3 udh nyampe mksihhh suka banget😍😍😍😍😘",5
alhamdulillah barangnya udah nyampe😍,5
"terima kasih paket nya udah sampai, barang nya sngat bagus,  pkok nya puas banget deh",4
"nahh gini dong, kan sesuai dengan pesanan 😍
gk pernah bosen pesen lips ini 🤩😍",5
velvet mate nyahh sayaa sukaa sya sukaaa,5
paketnya lecek arghhhh,3
bagus banget lipcreamnya 😍😍langsung falling in love deh😂,5
"kali ke 2 gw bli di sini ,, good lah ",5
"🤩🤩kesemsem realpic juga mksihhh ....
",5
baguss bangetttttt,5
Mantul x 😍😍,5
"toko langganan, tidk pernah kecewa ",5
baguss realpict suka bngettt😍,5
"perasaan pesennya bukan yg kemasan itu, beda dari yg kmaren",5
bagusssssss,5
dapet no 1 tapi di bibir jadi warna pink. kirain warna natural ,5
Suka bnget 😍 mau pesen lagi ,5
"kecewa, tdak sesuai gambar, pembungkus nya udh terbuka dluan sebelum dibuka",1
Barang nya cepet nyampe realpict tapi agak sedikit kecewa pesen nomor berapa yg datang nomor berapa,5
"bagus dan puas,,",5
Barang mendarat dengan selamattt😍 Terimakasih banyakkkk💓,5
"Allhamdulillah baguss bangett ,nyaman dan ringan + ngga lengket 😍 Terimak",5
"bagus utk di ombre,tp kalo utk full di bibir kurang~ ",5
"Pengiriman nya lama.  Tapi barang nya ok. Kurir nya juga ramah, sopan.  Mksh lazada",5
perasaan digambar cuma sampe nomer 6 ya kok punya aku nomer 9 ya😅,3
warna lipstick ny bgz bgt aku suka.buat abang kurir ny mksh jg ya.kurir ny ramah bgt,5
👍,5
bagus,5
"Tdk bgus
S",5
"pesen warna oranye semua yang datang merah bata dan merah bibir, tidak sesuai pesanan",5
🖒,5
ok pick baget amanah terus...lazada,5
mntulll.realfict..cpt kering g nmpellll.top msrkotop,5
"Maksih lazada barang nya sudah sampe,,warna nya bagus ,wangi lagiii ",5
warna tidak sesUay cUkup kecewa,5
gak nyesel deh pokoknyaaa... lipcream nya gak lengket Terima kasih 🙏💕,5
aku suka bngt sma lipstiknya matte lagi sama wangi lagi lipstiknya itu,5
bgus sesuai gmbr wangi juga lipgloss nya 😍❤🙏,5
warna nya hampir sama,3
"beneran matte, ringan, ga lengket (warna no 1)",5
👍👍👍👍👍👍👍👍,5
sukak banget 😊😊,5
"Pesennya no 3 yg dtang no 4 tpi gpp lahh ttep suka😍makasih lazada
",4
bagus bgt 😍😍 suka betull saya,5
Ini orderan yang ke 3. Sangat bagus,5
"barangnya udh nympe dgn aman, terima kasih lazada",5
Bagus banget,5
barang Oky real pich kurir jg ramah tarima kasih ,5
warna bagus2 sesuai pesanan mksih lazada,5
suka banget liptik nya harum pula,5
suka banget sama warnanya...,5
Lipstiknya aku suka banget ,5
Bagus walaupun random suka bgt sama warna nya,5
"bagus sihh . cuma oranye nya cerahh bangettt 😬😵
mau nya yng oranye agak tua .",3
ok sesuai pesanan😙,5
Alhamdulillah barang sudah sampai,5
"bagus sih tp terlalu muda di bibir saya 
sayangnya ga bs pilih nomornya ",5
"Bagus banget, sesuai pic guys😻, tapi belum aku coba semoga bagus juga kualitasnya🙂",5
relipic pengiriman y cpt,5
"wangi,ga lengket..😍😍😍suka bgt,,tanks lazada,,kurir langganan...ramah ",5
Barangnya bagus.. Sangat memuaskan.. Warnanya juga pas di kulit aku.. Terimakasih lazada,5
sumpah realpic bangett seneng bangett ih warnanya juga aku suka walaupun random makasih kak:),5
bagus...keren ok lah lipstiknya,5
"mkasih ya, barang nya udah nyampe.. 
puas bngt mskipun kurang satu pensil alis nya😀😀",5
"maaf baru bisa kash ulasan,mantul deh pokonya amanah banget, kurir langganan ramah",5
Syukakkk 😍💜💜,5
bagus,5
😍😍😍,5
"bagus banget ,saya sukaa ",5
Maksih parang nyh udh sampe bagus lagih..... ,5
ganyesel sumpah bagus banget makasih lazada ,5
Ok,5
bagus.,5
😍😍😍😍,5
lipstik nya keren banget warna nya sya suka.kurir nya jg ramah.terimakasih lazada sukses terus ,5
Bagus pake banget 😍😍,5
realpic 👍,5
Paket dah sampe tpi menor bngt tpi anak sya suka,5
"makasih paket nya udah nyempe dengan selamat pengiriman nya juga cepet , produk juga bagus",5
top markotop dah pkoknya,5
"suka banget
",5
lumayan suka sama warna lipstik ny,4
bagus bgtt lipcream nya warna nya nude nya juga kalem sangat ekspetasi bgtt deh😊,5
lipcream nya bagus ..,5
bagus sesuai,5
Ga sesuai banget sama gambar.. Kecewa bangeeet,1
sangat memuaskan,5
"👍👍👍this NT order LG buat kurirny thks bnyk ud langganan 🙏
",5
bagus banget....warnanya jga sesuai dgn yg d pesan..terimaa kasih lazada,5
bgus bngt ....dpakai'a ringan bngt,5
Bagus barangnya sesuai pict,5
bagus banget,5
bagus banget,5
Ya allah ini lipstik nya baguss bangett ...suka sekalii..yg blum coba harusss nyobain...,5
Lipcream nya baguss sesuai dengan pesanan 😊,1
"lipstikx bagus,,lain kali order lagi",3
Bagus suka mksih lazada mksih seler mksih juga kurir,5
😘😘😘😘🙏🏻,5
bagus Sihh Tapi Sayang Salah Warna Saya Mintanya Orange Yang Datang Ungu Muda,4
"ok dan sangat recomended pesanan nya,terima kasih seler,kurir,lazada",5
terimakasih lazada barangnya bagus,5
"warna lipstik nya bagus ,dan pengiriman cepat 👍",5
wrnq lipstik kurang sesuai krna wrnany mlh orens,5
lipstik  mantul,5
lipstik nya bagus aq syukaa next order lg,5
"pokonya ok.terima kasih lazada
",5
syukak barangnya sesuai yg dipesan lain kali aku pesan lebih banyak lgi,5
pesen yg no 1 dtang no 3 wadaw ,5
Sukaa bangettt pkonya next order lagiii🤗,5
BAGus warna ya,5
Next odder lagi..moga cocok,5
"ok punya... recommended buat kalian yg mau beli.
thanks seller & lazada, Abang kurir ",5
Sangat bagus,5
sesuai gambar,5
warnanya tudak sesuai kak tpi kurir nya ramah,5
lipstik nya lengket ,5
keren banget,5
bagus lipcream nya,5
Realpict 😊 trimaksih ka,5
"wow keren,maksi lazada,brang telah sampay kurirnya juga ok",5
"lipstik ny bagus banget..pengemasan jg rapi dan aman.
",5
"maaf baru ngasih ulasan, barang ny bagus reall pict
",5
Puasss bangett baguss😍😍,5
"mantull deh, abang kurirnya udh langganan makasi ya ",5
"bagus sih, tp blm dicoba.",5
"seneng bangett 
sesuai gambar dan reel pick
dan wangi nya enak"" banget terima kasoh lazada❤️❤️❤️",5
Pengiriman sangat cepat,5
Sesuai brg nya mkch..,5
"baguuusss banget , wangiiiii ",5
paket dh aku terima kurirnya baik dn ramah sukses selalu lazada,5
"barangnya Ok bgt untuk harga segituuu, mantaapp, thank lazada 👍👍",5
bagus banged😍🤗,5
gsjaamamakk,5
lipstiknya bagus dan wangi kurirnya juga ramah makasih lazada ,5
"barang nya sangat bagus, reallfict",5
saya puas beli di sini😍😍😍😍😍,5
warna nya ok bagus banget puas pokok nya,5
caik bgt lipstik ny,5
sumpah aku suka banget dengan warnanya,5
suka bnget😍,5
lipcream nya bgus😍wangi lgi😍2hri pesen pkt ku sudah sampai😘,5
"paketnya rapih, kurirnya baik,  pengiriman barang baik, respon penjual baik ",5
Bagus amanah seauai pesanan..,5
"Lipstiknya kering bgt dibibir warnanya ngejrenng lgi
",2
barang bagus sesuwai gambar,5
"sumpah warna nya cantik bet, tapi baru di pake 2 hari udah ada yang nyuri😭😭",5
ini asli bguz.. ga kering tapi mate.. lembut bgt d bibir .. abang kurir ssopan.,5
"mksih barang bagus paking rapih kurir nya ramah 
mksih Lazada 😊",4
Sesuai gambar🥰💜,5
pesen 3 ko yg datengnya cuman 2 sihh?? trs tidak sesuai lagi.,2
barang udah datang kemarin kaka . terimakasih 🙏🙏,5
sedikit kecewa tdk sesuai pesann ..lain x di cek dlu warnanya,2
recomended bangettt,4
baguss banget,5
suka banget warna nya ,5
yg dateng nya no 6 ga suka lipen warna merah bngeut pengen nya no satu atou dua 😵,2
"bagus bgt,,pengen warna oranye tapi yg dtng PING,,tapi gpp bagus lipstik nya",5
alhamdulillh mau pesen lagih ahh bagus banget suami juga suka g lengket kurir nya sodara pula 🥰,4
terimakasih lazada pekingnya rapi banget cepet LG nyampainya,5
"warna nya gitu banget
iya sih gk cepet luntur",3
kurang memuaskan😔,5
Bagus bangetttt makasih lazada❤️,5
"sangat bagus saya suka
kurirnya jga ramah",5
bagus kok barang nya,5
"barangnya bagus, walau agak terlambat tapi sesuai dengan keinginan saya.. terimakasih lazada😊",5
Terimakasih paketnya udh nyampe ...warna lipstick nya bagus😊real pict,5
warna lipstik nya gk suka kecewa banget ,5
baguss makasih,5
Sudah 4 kali pesan tdk prnh mengecewakan..terima kasih ,5
Makasih kak lipsticknya sama suka😍😍,5
"listiknya wangi enak harum..sayang nya ga matte.

kemasan rapi n ok",5
maap lazadah baru bisa kasih ulasan sya suka bnget warna listik ny,5
syuka banget kak 😍😍makasihhh,5
Anakku suka,4
"liptint nya wangii,,tqu",5
pengiriman lumayan lama Dan bagus bgt si,5
warna nya bagus tapi awalan nya kurang nyaman make nya,5
"suka , wana nya bagus dipake ",5
pengirimannya cepet. lipstiknya lumayan lah ,5
pengiriman cepat,5
sukaa bngttt warnanya jugaaa bagus,5
"barang nyaa bagus

",5
bagus buat bibir,5
suka. tpi wrn ny GK dpt yg mrah tpi GK pp,4
lumayan si cma terlalu met bgt wrna nya ,5
bagus bgt yg dtng sesuai yg diinginkan pdhl random,5
"real fick
tahaN lama",5
"Sangat2 memuaskan, datangnya juga cepat🤗",5
barangnya oke,5
"suka bngtt warnanya , mksh ya lazada ",5
warnanya bagus enteng dibibir ga bikin dower😍,5
makasih kak udh sampai barangnya enak dipakai dan lembut dibibir,5
puas bnget ama lipstiknya 😍 kurirnya jg ramah ,5
"Wrnanya lucu, enk jga dipkenya😍",5
bagus banget,5
"mantul , ringan bgt dibibir dan ga cepet pudar juga..",5
"mantap. 

Bagus di bibir. 
saya suka 
saya suka",5
"warna nya sama semuanya padahal pesen nya beda"" 😞",5
Bagus bgt❤️,5
bagusss😍😍,5
"selalu terbaik
",5
kukira liptin. ga cocok dibibir terlalu kering .,5
bagus keren banget,5
bagus keren banget,5
makasihh kak lipsticknya realpict 😍 puas banget kakk,5
sangat  memuaskan... jtuh  cinta  sma  lipstick  bus😊😊,5
"anaku .suka bagus
",5
bgus bngtttt😍,5
sesuai harapan kok bagus bgt,5
Bagusss bgtttt ,5
Cakep d bibir... V nempel d gelas,3
Sangat bagus ,5
Baguss bangettt lipstik nyaa😍😍😍,5
"Cucok banget warnanya..
Mantulll...
Next order lagi deh..",5
"kualitas bagus,, tetapi pengiriman lama sekali",5
Pengiriman nya agak lama,4
"bagus banget warna nga , produk memuasakan hanya saya pengiriman nya lama beli",5
"baguss,trus wanginy enak banget❤️❤️",5
bagus kak barang nya,5
bagus saya suka,5
Terus aja d kirim nomr 3 kmrin nomr 3,5
"makasih brang ny udh dtang, saya suka real pict bnget rekomandad dh",5
bagus sagat bagus,5
Warna bagus bangetttt,5
lumayan bagus buat harga segitu... tapi sayang dibibir lengket bgt🙁 ,4
"pesen 3 kenapa yg datang 2.
barang dengan harga 3
saya pengen kirim 1lgi
kurir sih ramah",2
Mantap deeh sesuai pesenn ,5
suka sesuai pesananku mksh ..,5
cantik2 wrnanya aku sukaaa,5
lipstik nyh bagus suka sama warna nyh,5
ya lumayan lah ,5
Jelekk banget,1
wrna nya salah kirim....,3
sesuai suka sama Warna lipstiknya😍,5
Alhamdulillah bagus,5
bagus bangeeeet,5
"sesuai pesanan
",5
bagus bgt😘,4
"hsil lipstick ny matte,,wrna ny sesuai .",1
bguss bngett,5
Baguss bgtt sukaa bgtt pokonyaa the bestt😍😍😍kurirnya juga ramahh😂,5
"suka bngett alhmdllah baik"" smua brangya smpe dengan selamat",5
bagus oke barangnya👍,5
lumayan lah ,5
keren banget nyaman dipake nya ringan pokonya good lah nanti beli lagi disini ,5
lipstiknya sih bagus cmn saya pesen no 2 yg datang bukan,5
packagingnya ga wort it,3
sudah diterima dgn baik 👍,5
warnanya bagus cuman agak kering dan pecah aja kalau gak pake lipbalm but over all bagus,5
"realpick ,mksih lazada .",5
paket nyh baru saja datang😁🤩Tapi sedikit kecewa warna Nyh tidak sesuai dengn pesanan😤,5
"yahh lumayann lahh ok lahh,, thankyouu",4
warnanyah glp,3
"sesuai permintaan, mantap...cuman agak Lama proses nya.",5
bgs sy suka . wangi juga ,5
ga ragu belanja lagi di sini......mantul okè barang ea harga sesuai.....kurir dah langganan ,5
aku sangat suka😍,5
"aku sudah sering pesen ini,dan alhamdulillah nya tidak pernah mengecewakan,trimakasih lazada",5
👍👍👍goodlah...,4
"mantap puas skli di toko in belanja,pengen order lgi to brngx kosong",5
barang sesuai ,5
"ga sesuai yg d gmbar,kecewa",1
warna nya sesuai lembut d bibir..,5
suka wrnanya. gak kecewa,5
"kecil mungil,tp aku suka",5
bagus banget wangi pula,5
bagus saya suka warnanya tp lengket dibibir,4
ini liptbam nya bagus gampang kering tapi tajam lama,5
warnanya nude bingit cocok sm warna kulit aku,5
sangat memuaskan pokonya seller fast respon,5
makasih kk q suka suka suka wlw pesen no 5 sama 6 yg ada 4 sama 2 tapi q suka suka😘😘😘😘😘,5
mantul pokoke,5
bagus bagett,5
sesuai pesanan,5
Cantik bnget warnanya enteng fi bibir,5
bagus banget lipstik nya ,5
"Realpict, krna kirim random wrna nya gasuka terlalu pucat",2
warnanya kurang bagus terus juga kering dibibir. ngga bikin lembap..,5
barang nya sampai dengan selamat dan puas sama barang nya.,5
Bagus cuman Cepet ilang sesuai lah yah sama harga👍,5
lengkel di bibir,2
suka.. cmn warnanya aja yg terlalu cerah,5
"Lipstik ny encer bngt d pake harus d aplikasikan sama yg lain
Tp gpp realpik ko",5
terima kasih nyampenya cepet😍kurirnya ramah langganan juga💓tp lipcreamnya di pake berat:),5
alhamdulilah trima kasi lazada..,5
sangat memuaskan,5
Mantap sekali👍😊😊😊😊,5
"terima kasih brang nya bagus
",5
bagus n suka bangettt!,5
Maksih Kka lipstik nya bagus pas di gambar 😊😊,5
harga sgtu lumbyan bgus tpi luntur tpi enak d pkai ,4
"sesuai pict, trimakasih lazada, seller, and kurir",5
"Terimakasih,  suka",5
baguss bangett,5
Warna nya suka sekali padahal random ya 💕,5
"barang yes 
kurir yes ",5
warna nya cantik cm lengket dan bikin kering aja tp liat lg harganya aja wkwkw murmer,4
ga mengecewakan gooood deh,5
"warnanya cantik dan wangi suka, makasih lazada.",5
minta no 1 dikirim no 4 aduh😅,5
 barang nya baguss aku sukaa,5
Pesanan sudah diterima sesuai pesanan terima kasih lazada,5
"wauu banget, warna sesuai selera. kek lipcream😍",4
bagus si . cuman aku dapet warna yang kurang pas di bibir aku yang agak gelap  ..  makasih  ,3
warna bagus,5
"agak lengket ,baunya bikin pusing ..tp ga papa lah harga segitu",5
"listrikny bagus aq suka, cuma sayang warnanya Ga sesuai ama yg aq pengin aq d kasih warna coklat 😂",5
bagus pokonya 🥰,5
"barang bagus trimakasi lazada semo
ga semakin sukses ",5
"boro2 tahan  lama listip yg ada luntur bong bgt yg jualan. gak jujur
",5
lipstiknya kering bgt,5
Barang YESS bngeut cepet pula sampai 👍👍👍,5
mantulll...cuma aku pengen 2 malahan warna random,5
bagus tp sy mesen wrna salem malah coklat yg dkrim wrna pucat dibibir,5
bagus lipstiknya warnanya juga bagus kurirnya ramah makasih👍👍👍👍👍,5
bagus lipstiknya warnanya juga bagus kurirnya ramah makasih👍👍👍👍👍,5
matte bangett dipake nya nyaman jugaa makasihh lazadaa ,5
warna g sesuai sm yg di pesan tp gpp thanks y,5
"Suka banget lipstik y,harum tapi aga kecewa sama warna y tadi ya mau no 3 ini malah no 4",5
wlpn random ttp bgus👍,5
Paket Belum Sampeeee Udah 1minggu... 😡😡😡😡😡😡,5
bagus ko lipcream nya💖dia diaplikasiin kebibir dikit aja lgsg rata kesemua bibir🥺🥺,5
"mantaap, cuma gabisa milih warnaaa sih ",5
"Makasih lazada paketnya sudah sampai cepat bgt,lipglos nya wangi bgt warna sukak❤️",5
"suka bgt wrna'y... 😍
ga lengket.. ",5
aku sukaaa barangnya😍😍,5
"bintang yang berbicara ...wangi lipstik nya juga 
#happyshopping",5
Saya beli 3 yang Dateng cuman 1 gimana ini ,3
"Barang nya udah sampe, bagus, saya suka tp c abang paket nya kurang ramah ",5
sesuaiii...bagus bget,5
"warnanya bagus cocok banget dibibir aq ,,suka banget pokoknya 



",5
Uh barang nya realpict trus Lipcream nya wangi permen🥺💓💓😚😚😚😚😚😚😚😚😚😚😚😚😚😚😚😚,5
"liptintnya bagus saya sukaaa
",5
sangan memuas kn cocok bnget buat aku,5
baguss bangett warna nya😍,5
Cakep warna ya 👍👍👍saya suka,5
tq Lazada...,5
bagus tp tdk sesuai no nya,5
Bagus bener2 g cpt luntur siang SMP besoknya lg luntur sedikit aja tp msh merah cakep dah,5
lipstik kurang bgus.. cpt hilang warna di bibir... ,5
"barang nya sudah sampai dari kemaren ka,warna nya",5
thanks lazada....barangnya ok,5
"bagus recommended, cmn pengiriman nya agak lama tp gpp krn lg kyk gini kondisi nya 🙃",5
"Bagus banget sesuai lah dgn harga segitu ga mengecewakan, terus amanah yaaa",5
"suka bgtttttt sama warna nya, bagus bgtttt wangi gak lengkett😍",5
