review,rating
"lipstik nya lumayan bagus,,tpi aku kecewa ,masa pesen 2 yang datang cuma 1 ,jualan yang bener dong,yang amanah.",2
"yeeeyy paket dah dteng,soal warna aku suka😉mudh2n cocok di bibir,trimakasih seller dan mas kurir y,yg udh langganan bgt,jngn bosen2 yah nganter paket 😊",5
"warnanya ngjreng banget di bibir, so far bagus sihh..terimakasih
",5
👌👍 sesiai harga,5
" lumayan lama juga pengiriman nya,tpi nggamasalah sih .. barang y bagus banget mksih Lazada",5
bagus banget lipstik nya😍,5
sdh smpe bagus deh wangi lg,5
"Aku sangat syuka 
Nyesel cmn beli satu ",5
mantul.. mantul.. mantul.. ,5
"syuka bngt , makasih lazada 😘",5
"barang sdh sampai,bagus kurirnya jg ramah.makasih lazada",5
"_Thanks. Pesanan Ku Udah Sampe
Warna Nya Bagus Dan Cocok Banget Buat Yg Bibir Ny Item.
",5
"pesannya apa si kirim apa hahaha🤣ngakak aku;( seller nya d cht gk bls cuma di read doang🤣🤣orng paketan bwt org lain trus harus ganti rugi, gk enak bngt aku. emng sih harga nya gk sbrpa, tpi yaudahlah. lain kali teliti dong!",1
pengirimannya sangat cepat dan rapih. ini saya masih belajar sih pake lip yg cair gini tapi warnanya bagus dan wangi sekali.  ,4
"bagus sich lipcream ny,, cuman terang bgt warna ny..",4
lumayan bagus,5
"baguss, tpi ada 1 yg ga cocok warnanya ",4
"setelah aku pake beberapa hari lipstik nya bibir aku jadi seperti itu😭 aku nyesel banget beli nya😭 sakit nya minta ampun, sampe gak bisa makan😭 bu
at kalian hati"" ",1
sesuai dengan pesanan ya,5
"suka banget sama warnanya,trus lipen nya jga ringan di bibir gak luntur lagi😘😘😊",5
"Terimakasih..
Sangat memuaskan🥰",5
"barangnya bagus banget, wangi lagi ,pokonya endor buat d pake ga kecewa sama sekali,warna nya sesuai banget😍😍 tq lazada😚🤩",5
bguss bnget,5
"cantik bgt warnanya,,aku bgt nih,,like deh👍👍👍😍ga bikin kering di bibir,mkasih lazada..🙏",5
"Bagus lipstiknya engga kecewa,makasih lazada",5
Saya pesan lipstik nya 3 v kanapa yg dteng cman 1...yg amanah donk..kak,1
enak banget wangiiinya,5
Barangnya sudah datang dengan selamat 😍 ,5
"bagus banget suka dech dengan warna kalem nya,, packing nya lumayan, pengiriman juga lumayan, dan maksih abang kurir nya ramah.. makasih juga lazada",4
suka banget sama warna nya  sejatuh cinta ini😍😍😍 ringan banget di bibir makasih lazada mas kurir SMA seller,5
"Bagus sih,tpi syg,yg q pesan  wrna nya rada ke orens2an tpi malh yg dtang warna velvet nude Random lg,,,,,ya udah lah,mksih",4
"makasih ka,aku suka lipcream nya warna nya bagus²,,jdi pengen pesan lagi tpi pengen no 01n 02 alnya yng nie no 03 n 04,,makasih lazada n seller 🥰👍🏼",5
"sukaaa, Klo terlalu banyak dipake warnanya jelek tapi klo sedikit bagus. itu untuk dibibirku sih.. pkoknya murah cuman gak murahan🥰 Dan tempatnya juga lucu banget ya ampun",5
mantap,5
Inginnya si yang warna seperti yang di gambar tapi yang di kirim warna oren terang wkwkwk its ok bagus ko cuma langsung di kasih aja ke sodara.,5
Liat gua mesen apa dikasih apa jelas jelas di gambar dpt 6pcs lipstik lah pas dateng malah liptip ecek2 sumpah nyesel w beli disini ga recomended!!!! JANGAN PERNAH BELI DI SINI DAH!!!,1
"harga murah kualitas sngat baik, nyaman di pakai pengiriman nya cepat, baunya jg wangi😂😂 next order lg😍",5
"mkasi ka lmyan si,  tp syg nya warna orenss smua tp pas aku ple tmn2 ku bang bgus si hehe.  suka bgt sm Wanginya 🥰",4
maaf baru sempet kasih ulasan...barangnya sudah sampai alhamdulillah di packingnya rapih sesuai harapan...lipcream nya pun bagus ringan di bibir dan ngga luntur walau habis makan/minum dan yang bikin makin suka itu wanginya😁😁 abang kurirnya juga ramah...makasih Lazada ,5
bagus lipstik nya.. di pke nya enteng di bibir gc ngelupas.. cepet kering lagi... di pke buat mkn ajh gc cpet luntur... puas pokok nya.  mksih lazada,5
"suka sama produk yang 1 ini, gapernah kecewa. udah yang keberapa kalinya saya order diLazada tapi gapernah tuh KECEWA",4
Like it ,5
"inih toko rekomended banget gayess, semuanya realfick   , engga ada yang salah  tengkiuh lazada sama aa kurir nyah 😁🙏",5
". Lipstik nya suka bnget,wangi dan gak mdh luntur lagii,paking nya jga rpih,tpi kurir nya jutek,bukan kurir lanģganan",5
"Barang nya baru aja sampe,buat reseller nya ramah respon nya baik sangatttttttttttt😍 buat kurir nya baik bgtttt,padahal udah malem ujan pula tapi tetep nganterin sampe depan rumah😍",5
"makasih ka paket nya dh nyampe tdi siang,pengiriman nya cepet banget pesen kemaren sekarang dh nyampe n packing nya rapi ga da yng rusak,lipcream nya cie bagus n wangi cuman warna nya aja ga suka terlalu kalem pas aku pke lipcream nya ke muka aku tu jdi keliatan aga pucet ga cerah ",5
aku suka lipstik ya wangi harum sesuai kyk yng di gambar saya pun juga sangat suka bngt pelayanan ramah baik . 😊🙏,5
"ya Allah puas banget sama lipstik nya, meskipun harga nya murah, tapi kualitas nya ga murahan, mna wangi lagi, cinta bngt pokonya😍",5
"Alhamdulillah paketnya udah sampai kemarin Peking aman,kurir nya baik cuman pengiriman nya agak lama,, terima kasih Lazada",4
"lipcream ya udh nyampe kk harga murce tpi puas 
,,, langsung tak pakaiii , udh wangii enak d pakinya ,,, ke bibir brasa nyaman , pertahankan kwalitasnya ",5
"yeeeyyy akhirnya paketannya datang dengan tepat waktu, barangnya mulus, kurirnya ramah, semoga selalu amanah terus lazada",5
recomend banget asli...warnanya sebagus ini..gak lengket langsung kering tak gak bikin bibir jadi kering dan waterproof banget...dibuat makan gak ilang juga...gak nyesel pokoknya belanja di lazada...makasih kurir dan lazadanya 😊,5
"mantul sih ini mah dengan harga segitu baru aku coba warna nya bagus .. kepengen nya no 3 dapet nya no 5 gpp bagus juga 
mau pesen lg tp ko udah ga bisa yaa 
makasih lazada dan mas kurir langganan",5
"Lipcreamnya suka bgt.. Apalgi yg velvet kiss beautynya pas d bibir aku warnanya dan ga lengket.. Tpi klo yg lip cream karite nya lengket dan orange bgt thanks kk seller, lazada dan pak kurir langganan good job",5
"pesen 10pcs dtg semua sesuai harapan, asli suka bagtt kalo gini terusss, packing pake buble wrp lgi hheh",5
"udah d terima tapi barangnya belum ada. mungkin d galang terlebih dahulu sama kurirnya soalnya udahh langganan,d chat d wa katahya tenang aja soalnya kemari hujan deras gak henti². moga hasilnya memuaskan😁baru datang moga puas dan cocok hasilnya",5
"Suka banget,lipcream nya bagus banget suka😍pengiriman cepet,kulir nya ramah.puas banget belanja di lazada",5
"sumpah nyesell bngt belanja disini saya tuhh pesen 1 lipcream hayasa girl 1 kissbeauty nude, lah ini kenapa malah yg dikirim kissbeauty dua² nya cobaa gak udh gitu warna kissbeauty nyaris sma kaya gak ada bedanya tpi dibarangnya beda nomer tpi  sma warnanya, gak amanah bngt kesel gk lagi² belanja disini, pengemasannya juga jelek bngt cuma dikasih kertas doang gak ada babelwrapnya kecewa bngtt sma ini toko!!!!!!!!",1
"aku fikirr bakalan dpet warna yg cantikk, aku kurang sukaa warna ini😔 tpi gpp lahh pengiriman lama tpi okelahhh",4
"Random aku dapat Yg no 5 warnanya baguss wangii pula, tapi ini jatohnya kek lip matte gitu, gk glossy",4
alhamdulilah barang sudah sampai. abang kulir ya ramah. lipstick ya bagus ga lengket di bibir.. warna ya aq sukak.. ,5
"Alhamdulillah barang sudah sampe... pengiriman cepat... kualitas bagus, lipstik nya juga wangi,,mksh lazada n seller n kurirnya jg...next order",5
"Pengiriman nya super cepat, kurir nya ramah, barang nya sesuai digambar..sumpahh bau nya enaakk banget, udh gitu wangi, warnanya bagus..thx lazada. Semoga jualan nya lancar ya ka, next klo lipcream nya sdh habis aku mau order lg hehehe😂",5
"makasih ka barang nya dungguh bagus
saya sukaaa....
dan makasih abang kurir nya juga dah ramah baik pula 😊",5
"bagusss bangeet ga nyesell beli disini, aku sukaa bangeeet beli disinii dijamin udh murah meriah ga bakal nyesel",5
"terimakasih kak barang nya sudah tiba,warna juga bagus banget,abang abang kurir nya juga ramah banget,gak bakal nyesel kk belanja di toko ini🤩",5
"trimakasih barang nya bagus realfic yah,dan kasihan kurir nya malem malem kirim paket nya, ramah lagi ,trimakasih lazada,ini aku post 1 foto aja ",5
"Lipstik nya bagussss bangett, wangi lagi, wanginya kaya jasjus melon gitu pkonya enak wanginya, warnanya juga bagus walaupun dikirim random, respon penjualnya ramah, dan pengirimannya cepet bangettt baru kmren pesen eh sekarang udah nyampe aja, tengkyuuuuuuu next mau order lagi jadinya 💙",5
"udah pesenan lama, lewat 2 minggu dri pengiriman, pas dtg kecewaaa, jelas"" pesan 10 di kirim 6 
tanggung jawab 4 nya kirim lagi gkush balikin dana kirim barang aja 😡😡😡😡😡😡😡😡
udah 2x saya kecewa yaa 😡",1
pengennya yang panjang malah kecil tapi soalnya aku salah pilih tapi gpp makasih lipstiknya bagus next order lagi😊😘,5
"warna nya kalem, ga kering di bibir dan wangi serasa lg mkn buah semangka ,...top bnget dengan harga segtu ",5
kayaknya bakalan order banyak lagi nii soalnya wangi bangett dah udah gitu Amanah lagi😍💖💖💖🔥🔥🔥,5
"makish lazada pket ny sdh dteng. 
kpetan ny rapih dan liptik ny sya ska bnget dgn warna ny, dan mas kurir ny sdh lngganan baik ramah pula, mkasih bnyak dah poko ny.🙏😊",5
"barangnya udah sampe, wanginya enak cuman satu lagi terlalu merah buat aku....tapi gak gak apa"" lah karna random, suka banget ☺☺☺",4
"pket sudah tiba,lipcream nya wangii bngtt aku suka kya wangi bubble gum gtu warnanya jg aku suka cantik bngt warnanya tpi sygnya lipcreamnya agak lengket aku ga trlalu suka sma lipcream yg lengket tpi gpp brngnya ckup bgus dn memuaskan untuk hrga sgtu yg bnr2 murmer tpi banyakkk thankssss lazadaaaaa,btw stiap kli aku mesen brng di lazada psti kurirnya slalu yg ini mantap deh kurirnya baik bngttt",5
"sebelumnya terimakasih barang sampai dengan cepat,paking rapih
lipstik sangat bagus jika di lihat harga segitu
tapi temulawak krim malam 2 2 nya tumpah
terus yang asli ada gambar padi timbul dan warna cream agak kuning ini mah putih mengkilap :(
tapu semoga cocok bukan yang kw kw banget
trimakasih",5
"puas banget, cocok sama warna nya gak salah pilih,wangi lg,kurir nya ramah baik,nyesel cuman beli 1😪,Langsur order lagi ahh",5
Terimakasih lazada paket ya sudah datang saya sangat suka lipcream kiss beauty ya bagus terimakasih juga untuk kurir ya baik...,5
"alhamdulilah Saya Udah memesan Udah 3 Kali di toKo Ini Dan alhamdulilah amanh😍😍 Dan Makasih kka Udah di Beri bonus bedak nya nantI Saya akan order kembali di kka,,Jangan lupa beli di toKo INI lipstick nya Juga bagus",5
"Alhamdulillah paketnya sudah nyampe ,aku suka sma lipstick nya wangi+gampang kering . sama kurirnya jiga ramah banget😍 maksih lazada  
pokonya lain kali aku mau pesen lagi😍🙏
",5
"kk ini kok pesanan nya gk sesuai ya, saya gk mesen yg lipntin sasimi kok di kirim yg ini? pesanan saya yg 2 nya gk sesuai nihh",5
lipstiknya bagus d pke nya juga enak ringan...cuman tdi nya syh ingin wrna merah bata v gx bisa...v gx fpa deh wrna inh juga bagus,5
"alhamdulilah paket ku mendarat dengan baik, lipcreamnya juga realpict aku sukaa bangettt. pengen pesen lagi jadinya, kurirnya seperti biasa yg sering nganter barang kerumah jadi udah lumayan kenal. thanks lazada",5
"Wow.... Suka banget deh harga murah barang ok
Gak nyesel deh belinya. Barang dateng dengan cepat sesuai dengan gambar. Kurirnya juga ramah. Sukses Lazada",5
"awalnya si saya kecewa,prtamanya saya memesan lipcream velvet matte tpi gagal dlm pengirimannya dan yg keduanya Alhamdulillah sampai drmh😂😂",5
jangan ragu blanja di sini gaes broduknya di kirim semua gk ada yg kurang gk ada yg salah neks order lg,5
"bgus cuman mau nya warna yg nude eh mlh dpt nya no 6 dua2 nya, yg satu merah ke pink2an, yg satu merah bata hmmm gpp deh 🙏❤",5
"barangnya udah sampe. liptintnya bagus, lipcream juga bagus tapi karna random jadi dapet yang rada pucet.. gapapa deh yg penting liptintnya bagus..",5
"Paket syudah mendarat td sore dengan aman..yg d dapat warnanya cantik2 no 1,3,5 thanks kk seller,lazada langgananku dan pak kurir good job",5
Bikin kecewa pesen 2pcs dikirim cuman 1.. udah di bayar sesuai 2pcs tapi yg di terima cuman 1..seller di chat ga di respon2.. ga amanah jualan nya.. semoga berkah aja yaa buat seller nya,1
bgussa huuuuu parahhhh udh 3 klo pesen ini mau pesan lg mantulll warna nya nude bgt di bibir aku cocokkk  maaciwww lazadaaaaa 😍😍😘😘❤❤🙏,5
"pokokx brangx bagus, suka banget,,,",5
"baguuuus.... warna nya pas.. aqu sukaaa... mksh lazada.. langganan qu
",5
saya pesen warna apa yang datang beda😡👿,3
"sampai sesuai dengan gambar
",4
"Lumayan bgus lachh,,,tp syang gx sesuai harapan",5
aku suka banget ka sama warnanya pas dipake juga ringan banget ke bibir😍,5
ko pink 😫 yg datang ya kenpa slah barang gni 😡udh lama datang ya barang salah kecwain bgtttttt😭,5
makasih lazada makasih juga tokonya,5
real pick donk soal warna bintang yg bicara,5
Makasih Liptinsnya bagus,5
asli aku terkejut banguss bangt soa nya warna nya aku syuka 😍😍maksih ya lazada ,5
"aku sukaaaa🤗🤗
trimakasih lazada & abg kurir😊
",5
top markotop listip cream ny bgus bnget  mksih bos ku semoga mkin sukses sellu abng kurirny baik lg ,5
"real pict,sesuai pesenan,wangi jg😋",5
sangat bagus velvet nya 😘😘,5
"paket sudah nyampai dg slmat ssuai dg pict....... 
",5
warna bagus pokoknya sukaaaaaaaa...,5
"barang bagus,warnanya juga lucu,harga murah,pengiriman juga cepat👍🏻",5
Bagus banget😍,5
Pngen nya wrna oren tapi gpplah ini juga bgs,5
Makasih barang nya dah sampai bagus banget dipake dibibir aku.  Gak nyesel deh dah belanja disini,5
ini udah orderan kesekian x nya... selalu puas...,5
ini udah orderan kesekian x nya... selalu puas...,5
ini udah orderan kesekian x nya... selalu puas...,5
"bagus banget ,gak nyesel beli disini 😍",5
bagus bangat trimakasih lazada😍😍😍,5
brang nya tidak sesuai pesenan pesen warna bbir dateng nya warna nya gelap kecewa ,5
Suka banget sesuai dengan pesanan uwuu>< lipcream nya juga wangi..,5
"puas sama brng nya,  aslii sma yg di blii",5
Kecewa !! Pdhal udh di chat wrna'ny jgn disamain..tau sih random..! se'nggk'ny lah jan disamain.. udh proses pngiriman'ny lama.. untung wktu pngriman cm shari.. itu ge di chat dulu bru diambil kurir'ny.. pdhal produkny bagus wangi candy.. cm sngat disyangkn sm pnjual'ny!! ,3
"bagusss...mksh udh dteng ,tpi pengirimannya lamaaa bgt alhmdulillah minta no 06 . .dtngnya pas no 6  .cuma mhn responnya yg cpt...",5
Mayan lah.. dpt no 6 yg Velvet matte SMA no 1 yg kiss beauty Lipgloss .. mantull tp wanginya ..kuat bgt..pas diaplikasikan tp lama lama udh ga kecium baunya,5
"kurang teliti , saya order lipstik 2 pensil alis 3 tapi yg dateng pensil alis 4 lipstiknya 1 . dan sy bayar sesuai pesanan 😲",3
"terima kasih Lazada Sudah mau ngirim saya dengan sellamat dan Kurir nya baik😊.. Terima kasih sudah tidak mengecwakan pellangan nya☺


Sukses sellalu Lazada😘",5
"Btw ini yg psn tmn aku tpi aku pake juga siii 
Warna nya juga bagus 
Kalem kalem gimana gituuu ",5
bagus real pict aroma nya wangi dan pengirimannya juga ceoet terima kasih lazada 😊🙏,5
Bagus sih ..tpi kalow di pake trus bibir sayah belah 2...,3
"bagus warnanyaa ,aku sukaaa ",5
"warnanya suka tapi wanginya ga suka
",5
"kecewa deh aku kn pen no 4 knpa dateng no 2
",5
ko dtangnya warn orens pngn yg kecoklatan tpi ok relpic,5
real pict barang baguss😍😍😍😍,5
paket nya sdh smpe dn lipstik nya keren bgus n wrna oke bnget wangi jg aroma nya..Lazada oke bget seller jg amanah..sukses sllu...,5
tq sesuai realpict ,5
bagus ringan di bibir.. ,5
realpic ok brng nya bagus,5
"bagus tapi pengiriman nya agak lama,,tapi barangnya bagus kok.",5
sya pesen lifen mate ini tpi ko ga ada sih tpi uang nya udh di kasih ke kurir,5
Bagus ak suka mkasih lazada 😊,4
belum sampe ko pemberitahuan nya sudah d terira,5
"mantap, lipstik x wangi,mate banget👍kurirx baik",5
sya suka bget sesuai pilihan...mkash bnyk,5
cucoook lahh mantap...,5
bgus aku suka mksh lazada     ,5
Lipstik ya bgs ak suka warna ya ..  Di pke ya gx lengket   ringan di bibir ,5
puas deh pkoknya,5
"realpict pengiriman cepet,,kurir udah langganan😅",5
"bgus...pengirimanya cepat dan ok!
wrnanya terang:) + dan tahan lama",5
bagus pokonyah GK nyesel deh,5
maaf baru ksih ulasan... lipstik nyahabgus banget... pokok nyah best deh buat harga sgitu,5
bagus banget ringan banget dibibir ,5
ini random ngirimnya,5
realpict lipstiknya ok,5
wangi lipstik nya,5
lipstiknya bagus ringan di bibir & cepet bngt keringnya aqu puas deh pokoknya mksh ,5
barang bagus sesuai,5
suka .ringan d'bibir wrna.a jga cantik😍,5
warna sesuai pict kualitas bagus meski harga murah paket rapih kurir baik makasih kakak,5
Mlsh ya barang dh sampe dengan aman,5
sesuai dengan pesanan,5
realpick bngt asli cakeppp,5
sesuaii pesanan,5
gaktau harus bilang apa ini BAGUS BGTTTTTTTTTTTTT,5
Kualitas produk sangat baik,5
"aku suka enak di pake nyh  maksih lazada

",1
"kalo yang ini bener bener bikin kecewa dan bikin takut mau order lagi,masalahnya lain yang di pesen lain yg sampe kecewa
",5
alhamdulilah barang nya dah nyampe dan sesuay gambar pengiriman nyah juga cepat kulirnya juga sangat ramah,5
"Barang ril pic sesuai gambar, pengiriman lebih cepat dari perkiraan.... tidak ragu deh gan en sis belanja di seller ini 😊, sukses selalu buat seller dan LAZADA.",5
lipstik nya udh nyampe sesuai pesanan n warnanya jg bagus dpake jg enak..wangi bgd lip nya ..thanks Lazada n Kiss Beauty 🙏🙏😊,5
"Bagus bngtt warnanya, Wanginya enak, dipake dibibir juga soft bngtt, tahan lama, pengirimannya juga cepett,  pokoknya the best bngtt😍",5
"sukaaa bgtt barangnya bgus, kemasannya rapih, kurirnya juga ramah, barangnya g mulus g pecah g rusak shadenya sesuai real pict pokoknya",5
Maaf baru kasih ulasan barang tidak sesuai yang diinginkan saya kan minta nya yang merah cabe ko ini di kasih nya warna ping gelap ga suka ,1
saya pesan 2 minta warna nya di samain tapi di kasih beda warna..mana yang satu lagi warna nya gk cocok..  tapi untung nya yang satu lagi bagus warna nya jadi gapapa lah.. ,5
"Alhmdllh barang y udh smpai dgn aman,lipstik y bagus,suka bgt tp syg aku pngn yg kiss me tp g dpt,tp ydh g pa²,mksh ya lazada,mksh jg abg kurir,sukses trus buat smuaa..
",5
bagus sipp ,5
bagus lipstikya puas dgn hasilnya...😍😍,5
minta warna merah datang nya hijau..gimana gak realpick,3
ga sesuai gambar,4
wrna ny bagus mate,5
Sukaaaaaaaa bangetttt wangi ,5
"makasih ,barang nya bagus perngiriman nya juga cepat😍",5
"tqq barang bagus,tqq seller kurir and lazada good job👍",5
Makasih byk ya.. warnanya suka bgt dh...,5
"maaf baru ngasih ulasan,lipstik y bagus dan gk luntur alias tahan lama wlu pun d pke mkn ttp gk luntur sma sx,,,than seharian mandi jg ttp gk luntur sampe"" aku gosok"" biar bersih😃pkok y gk nyesel pke lipstik kiss beuty,wangi lg lipstik y😘",5
"maaf baru kasih bintang😁
karna baru aku ambil brngnya d rumah...
Alhamdulillah sesuai keinginan ... bagos memuaskan... terimakasih lazada🙏",5
"biar bintang yg berbicara sayang agak lama dateng nya mungkin krn bayar di rumah kali ya,,tolong klo bisa mah di percepat walpun kita bayar di rumah juga..",5
"Bagusss banget wangii juga lipcreamnya tpi sayang warnanya ga cocok dibibir aku:(agak berat dibibir nempel"" gtu tpi sukaaaa🥰",5
"Barangnya bagus real pict lagii😍😍 suka bgt😍😍 tapi pengirimannya yang lama bngt:"" tapi gpp lah puas ko sama barangnya",4
"bagus lipglosnya 😍rapi juga bungkusan, kurirnya baik,insyallah jdi langganan disini😊pokoknya mantap say😍",1
Alhamdulillah paketnya udah nyampai tdi sore sesuai sama pesanan makasih banyak buat seller sama kurir nya sukses trs lazada,5
I like it😍,5
"Sukaaa bangettt😍😍
Jadi nggak sia2 nungguin nya walaupun lama😊",5
"dikit isiny. mintanya yg karite, dtg nya yg begini. packaging nya bedaa.. mau dibalikin ajadeh",1
makasih banyak..memuaskan syekaliiii..smoga planggan ku yg psen puas juga..pasti langganan ke toko ini kalo bagus gini mah😘,5
"god job cpt sekali d kirim ,gk peduli besok lebaran mksh byk seller,kurir jd kan gk kecewain org lipglossnya pas dg keinginan meski random😍",5
"Bagus aku juga dulu pernah beli kemren no 4 bagus, sekarang mesen 2, datang nya no 5 dan 6 bagus juga ko😇",5
"warna lipcreamnya gk secerah yg digambar , tapi saya suka , nyaman dipakai ,wangi lagi ,,, makasih buat abang kurirnya ,,, makasih lazada .. ",5
"Lipcream bagus banget sesuai yang aku mau tapi baunya aku kurang suka hehe,terus juga pengirimannya lama bangett",5
maaf baru kasih ulasan lipcream nya bagus wangi lagi makasih seler lazada bang kurirnya dah langganan,5
"Sedikit lengket pas di bibir, tapi warna nya pas banget, bagus, lucu😭😭, pemaketannya juga aman💛💛",5
Makasih ya barangnya bagus kok aku suka dan pengiriman nya juga cepet cuma 3 hari cuman kasian aya sama mas kurir nya ujan ujanan sekali lagi makasih ya atas barang nya,5
"Gila suka banget sama lipcream nya dong, walaupun dikirim random tapi emng bagus. Makasih ❤️",5
"Real pict Laaah brngnya 😍 Yaah meskipun kalo dipakai terasa Aga lengket , It's oke 😉 Aku sukaaa 😍😍😍 . makasihhh Lazada .. kurirnya Juga Ramah 😊 ",5
packing rapih....warnanya jg baguss...syukaaaa,5
mksh lazada mksh juga toko yg sudah berjualan saya sangat puas lipstik nya bagus banget warna nya poko nya cuco.. 😍😍,5
terimakasih ya.. maaf baru ngasih ulasan.. lipgloss nya real fice penggunaan nya juga ringan d bibir  pokonya aku suka 🤗,5
"Ya ampuun..d kirain lipcream'y bagus,soal'y liat ulasan bnyk yg bilang bagus,tp pas sy coba kok kering bgt d bibir,ga nempel d bibir😢maaf ya sy ksih bintang 3,packing jg seada'y,cm pake amplop coklat kecil,sy terima paket'y robek d bagian blkg😔utk kurir udh langganan",3
Bagus banget wangi dan cocok di pake. Dan sesuai pesanan padahal kata kakanya random tapi pas aku chat pengen yang nomor 1 dan 2 dan alhamdulilah di kirim juga.  Barang juga selamat ngga ada cacat.  Makasih banget,5
kecewa bngett brang saya kurang 10 tpi seller gak mau bertanggung jawab ... biasanya klo ada kekurangn gini sayya chat seller nya .. seller nya mau tanggubg jwb bru d toko ini yg gak percya brng ny kurbg .  buat apa saya bohong .  smpe kpnpun saya gak ikhlas rugi besarr ... 😈😈😈😈😈😈😈😈😈😈😈😈😈😈😈😈😈😈😈😈😈😈😈😈😈😈😈😈😈😈😈😈😈😈😈😈😈😈😈😈😈😈😈😈😈😈😈😈😈😈😈😈😈😈😈😈😈😈😈😈😈😈😈😈😈😈😈😈😈😈😈😈😈😈😈😈😈😈😈😈😈😈😈😈😈😈😈😈😈😈😈😈😈😈😈😈😈😈😈😈😈😈😈😈,1
"paketnya sudah sampe😍lumayan cepat datengnya 
wanginya harum buah2an pokonya suka deh,nyesel beli satu☺️terimakasih Lazada sukses terus buat toko Herista
",5
bagus bgt🥰,5
alhamdulillah bagus lipstuknya aku suka ,5
pengiriman cepat harga terjangkau so far bagus lah walaupun dikirimnya random thnks seller thnks lazada,5
kcewa masa yg dtg 06 udh bgtu wrna nya oren:(mas kurir langganan.,5
Lipcreamny bagus warnany juga bagus...  tdak mngecewakan....,5
mantap bagus,5
suka bnget trus tahan lama juga,5
lipcream nya enak wangi lagi syg wrna nya g cocok di Q jd terlihat tua,5
"makasih lazada,,, barang nya sesuai
",4
terimakasih barang sudah sampai dan memuaskan .  :),5
lengekettt ,2
"suka lipcrem ny, bgs saya suka mksh",5
"bgussssssssss saya suka bnget ,  ",4
bagus cih produk'a cuma aga trsa lengket d bibir,5
"bagus kak 
makasih ya",5
"sudah saya terima dengan baik.
terima kasih seller...",5
maciwww cntik lipstik ny😍,5
wrna ny mate bgt keren,5
Pesen yang mn datang yang mana,2
lipgllos nyaa enak di bbir,5
oke lah walau murah warna random tapi bagus aku suka,5
barang ny bagus ,5
barang ny bagus,5
jelek perih ke bibir sya😭😭,5
"suka banget sama warna lipstik nya bagus ntar law dh abis mau order lagi 😊,,makasih buat mas kurir nya baik banget dh mau bayarin dulu pket aku di karna kn aku nya gie mudik dulu,,af ya mas dh nyusahin 🤭😊",5
"real pict!  keren banget pokoknya.. walaupun bru sampe yg harusnya sampe kemaren, tp smua kebayar pas buka paketnya hasilnya memuaskan banget.. recomended banget deh harga murah tp gak murahan.. thanks lazadaa... 💕",5
nyesel cuma pesan satu mao pesan lagi eh stok'nya abis lipcream'nya bagus banget warna'nya cantik warna yang saya suka😍,5
"emg  lipcream kiss beauty mh dr dl emg pling bagus. cuma ngirim nya klamaan say,berharap wrna yg agak nude tp dptnya wrna pink keunguan.  curiga ini seller nya sama ya dgn bohay Cos . ",5
"ih kece badai...mantap bngtttttt pokoknya.....
thank lazada....thnkkk bbng kurir yg udah lngganan...",4
Bagus bangt lipstiknyaa.. sumpah saya suka bahkan nyesel pesen cuma 1 soalnya ibuku juga kepengen. Kan tadinya cuma coba2 eh ternyaata... nex time pesen lagi yaa... makasih lazada dan sellernya yang amanah... keren...,5
"Demi allah sy kecewa pesan dua yg dtg satu semoga toko nya berkah, jualan gak jujur bgt nyesel sy beli disini ",1
Barang nya udh dtg lebih cepat dri yg ditentuin. Realpict. Pokony sangat sangat puas trimakasih lazada. Dan mas kurirnya makasih banyak,5
"Alhamdulillah barang nya bagus, lipstik nya jugaa ringan ya cuman warnanya aja yang beda tapi nda papah lah,makasih Lazada ",5
"puas bngt,bngt,bngtttt!!!barangnya oke walaupun maap ngomong harga segitu tapi kualitasnya nomor satu thank lazada😍",5
tank lipcrem nya udh nyampe walaw lamaaaaa banget kirimannya..tp lumyan bagus kipcremnya tahan minyak dn air😁😁😁,5
maaf baru kasih ulasan..warna lipstiknya q suka banget ccok jg sama bbir q..abang kurir'a jg udh langganan makasih lazada n seller,5
 Lain kali kalau ada barang yang kosong coba uangnya diselipkan didalam paket. Jangan pakai pengembalian dana segala. boroboro dana balik dari tadi sore saya tungguin gada saldo masuk sepeser pun. Udah ribet rugi pula! Kan lumayan 22ribu,1
