review,rating
"Barang sdh sy terima, gambar sesuai, terima kasih dan sukses selalu untuk Lazada dan tokonya ğŸ‘",5
tas bagus realpict nya sangat memuaskan kereeen,5
"Sumpah ini tas nya bagus bangat,cuma pengiriman nya agak lama dan makasih juga buat abang kurir nya bisa di ajak kerja samağŸ˜Š",5
real pick 1000% dijamin bagus barang nya thnks kk sll amanah ya,5
tasnya bagus aku suka banget.puas belanja d toko ini,5
realpict barangny terimksih lazada....semoga slalu amanah yj,5
Tasnya keren banget..realpict...ya walaupun pengiriman lama tidak sesuai estimasi..but all it's ok,5
"
bagus aku suka",1
Cukup memuaskan sesuai dengan harga,5
"tasnya bagus,,realpict. sangat suka .",5
bagus bingit...cucok,5
"Alhamdulillah tasny bagus, bahannya tebal, pengirimannya cepat",5
Bagus barang nya saya suka 100 ,5
"bagus banget real pict pokoknya jangan ragu buat pesan bebb...!!!
",5
"Kurir ramah, dibungkus rapi n tepat waktu",4
bagus banget sama persis sesuai gambar,5
