review,rating
"Alhamdulillah barang udah sampe ,barang mantul sesuai pesanan ,bahanya jga bagus 
cepet bngt lagi se hari lngsung nyampe , 
terimakasih lazdaa :)",5
"pecinya kecil banget ga bs d pake,klo peci dan ban motor rasanya udah kapok ah",5
allhamdulilah dah nyampe barang lumayan dengan segitu ,4
"paket nya sudah kami terima dan sesuai gambar, kurir nya ramah, terima kasih lazada...sukses terus ya..",5
ğŸ‘,1
bagus cpt dteng ny kurirny baik,4
"bagus banget,bahannya lumayan untuk hrga segitu",5
