review,rating
"pengiriman cepat, barang sesuai gambar
terimakasih.",5
"rajutan nya rapih, kualitas nya ok",5
"peci nya bagus, gak nyesel beli disini
thanks gan",5
"barang sesuai gambar, kualitas mantap
recommended pkok nya..",5
"pengiriman cepat, kualitas barang bagus.",5
"kualitas barang bagus, sesuai gambar. mantap",5
"kualitas gak mengecewakan, pengiriman jg cepat.
terimakasih",5
"alhamdulillah, bahan nya lembut, sesuai pesanan. 
makasih",5
"barang sesuai pesanan, kualitas mantap.
trimakasih gan",5
