review,rating
mantap kakk barang bagus pokoknya barang recommend banget dehh,5
Suka sama barangnya ori semua kualitas produk sangat baik produk original harga produk sangat baik kecepatan pengiriman sangat baik yang penting respon penjualnya sangat baik pokoknya mantappp,5
"pesanannya sudh sampai, pengiriman cepat, respon cepat sukses terus gan",5
"Sudah sampai kak,respon cepat,pengiriman cepat,barangnya bagus berfungsi dgn baik",5
"barang sudah sampai ,no cacat no minus terimakasih sellerğŸ˜‡",5
Produknya Bagus Bangat Puas .Terima Kasih Banyak ,5
"mantap kak produk nya bagus 
respon baik
pengiriman cepat",5
mantap gan,5
