review,rating
"mantul jam nya seneng banget pokonya, makasih lazada seneng bisa belanja ditoko ini ,semoga tambah sukses jaga terus kualitasnya ya
",5
"produk bagus harga murah dan terjangkau
respon penjual baik dan pengiriman juga cepat",5
"jam mantap bagus,,,,cuma ada sdkit kendala,,,dalemnya agak rusak dikit....tpi gg apalah,mngkin salah dipengiriman...thankz lazada dan seller maju terus....",5
"mantab dah barang bagus banget, pengiriman cepat. saya sudah langganan lazada gak akan berpindah yg lain.",5
pesen suunto yang dateng casio tapi gpp lah bagus ko ini juga makasih lazada ,5
barang sampai tapi belum di liat karna masih di tempat kerja semoga bagus dan awet,5
