review,rating
"Ini apa coba gk sesuai gambar paketanya gk ada pelindung kuat 
Kecewa saya padahal udah chat penjualnya SESUAI GAMBAR dan akhirnya ",1
"sedikit kecewa,,krn jam yg saya pesan wanita 1 laki2 1 yg datang malah laki2 semua..trus blngx jamnya sdh diatur sesuau dgn alamat pembeli tpi kok yg saya pesan nggak diatur sih..",3
"Jam ny Bagus, anak saya sangat suka, kurir ny ramah baik lg, saya pesan 4 Bagus semua",5
Tidak sesuai dengan pesanan yg ada di gambar ,5
jam nya sgat bgus,5
bagus,5
baguss,5
Lumayan,4
