review,rating
jam nya bagus cuma gk tw cara seting nya,4
"kurir nya sih baik..tapi kece pesen nya Warn ungu satu wrn hitam satu biru dua hijau satu.d kirim ungu semua.mana buat anak cowo smua.kecewa bgt ga bkalan blnja lg d sni.kl g ada kbrin dlu.wlw pun murah tp uang harus d hargai.paham
",1
ada harga ada rupa ya... gak ada manual instruction nya jadi gak tahu gmn cara merubah jam dan menit yg sesuai,3
thanks lazada this watch very nice,5
Bagus tp packing krng aman. Trima ksh,4
"barang bagus, masih bisa nyala pas nyampe, barang aman gak rusak :) ",5
kcewa bnget tali nya gampang lepas,5
Jam nya gak bisa di atur. . . ,5
"barang udah sampai, sangat puass",5
bgus brang.a toop dehh,5
"jam nya ok, saya suka..",5
terimakasih,5
lmyan lah.. dengan harga segitu,5
ko waktu nya kaga sesuai ya,5
"kekecilan, terus ga bisa d rapetin",3
trm ksh sdb sy trma,5
"Mantap, Barang sesuai,makasih lazada",5
jamnya bagus sy suka tank's lazada?ğŸ‘ğŸ˜,5
jam LED nya ok bgt...kualitas bagus,5
barang tidak sesuai gambar talinya tidak bisa dipakai ,1
Barang sesuay pesanan poko nya mantap,4
mantap,5
lumayan,3
good,5
mantulll,5
mantuullll,5
mantap,5
manyan,5
