review,rating
Bagus banget aku sukağŸ˜Š,5
"Parah banget ini olsop mesen jam yang mana dikirim nya yang mana kalo gak ada chat kastemer bukan asal kirim asal dapet duit udah gitu saya pesen 8 jam 4 jam kagak jalan udah di ganti batre tetep gak jalan rusak mah gausah di jual dong 
Bikin pengen ngata ngatain aja ni owner olsop gak bener ",5
bagus sih tp ngelem nya gk rapih berantakan ,4
"jam nya bagus, tapi strap nya bahannya keras...mudah2an awet yaaa...makasih seller",5
bagus bgt sy suka,5
"sesuai ' bagus dgn harga segitu TDK murahan ..
  pokoknya sya suka tetap amanh buat toko in produk..
sukses selalu",5
"maaf br ksh ulasan bagus jamnya aku suka pertahankan trs ya biar amanah tank untuk toko dan lazada mksh juga untuk kurirnya sangat ramah karena udah langganan juga 
",4
"gak sesuai,  di pesen putih untuk cewek tapi yg dateng jam cowok warna itam dengan ukuran besar lagi! padahal udah langganan bgt sma toko ini. katanya mau di ganti di pengiriman berikutnya,  hmm liat aja ntar di pesanan berikutnya",1
Sangat mengecewakan. Jangan lagi beli ditoko ini. Barang tidak sesuai pesanan.!!!,5
ga sesuai Ama pesanan. saya mesen nya warna hitam yang nyampeknya model lain. mengecewakan,5
RUSAK,1
Beberapa barang yang saya order nggak dikirim,2
