review,rating
maap ka sya bru ngasih ulasan sya kcwa bnget brang nya ga sesuey dngan pesanan msa sih psn wrna pink di ksih wrna abu ga ngeliat bkn ini kya orang penipu klo di psr sya model tas bgini mh hrga nya juga cmn 25 ribu nyesel sma skli,5
paketanya sudah sampai. tasnya lumayan bagus sesui harga. maaf baru kasih ulasanya. makasih ya lazada. ,5
map yah baru kasih ulasan tas nyah bagus banget aku suka cuman sayang pesen warna green datang abu tapi gk pp yng pnting bagus makasih lazada,5
gimana sih pihak tokonya ,2
"bagus si tas nya. cuma salah warna, minta warna green yg datang malah warna abu...",5
"Bagus, istriku suka bgt",5
Mantap,5
