review,rating
cucok.. mertua pun suka.. hehehe,5
tas nya bagus saya suka warna nya yg saya ingin kan makasih lazada,5
kecewa banget kenapa paketnya bukan seperti yg saya harapkan yg paling kesel saya harus bayar dg harga yg tidak sesuai dg tas yg saya pesan,5
"cakeyppp bgt tas nya, tapi harusnya jgn di lipat utk pengiriman nya. but....so far smuanya bagus .....sukakkkkkkkkk bgt",5
"mintanya biru dikasihnya coklat.
tapi ngga ppha bagus ko ",5
lucu tasnya kcl bnget.,4
Cukup bagus ,5
"real pic, sangat memuaskan ",5
Suka tasnya bagus,5
Barangnya bagus Dan sesuai gambar,5
bagus,5
