review,rating
"sesuai pesanan, moga fungsinya pun sesuai
makasih seller dan kurirnya, moga ga mengecewakan",4
Sangat sesuai dgn spesifikasi produk.,4
barang yg d kirim setelah d pasang g sesuai sama ukuranya...kapok saya beli d toko itu...g jujur orgnya...PENIPU!!!,1
"barang,a sesuai packing rapih",5
"proses cepat pengiriman cepat,,,,, mks bos,,,, ",5
Pesannya jaring emprit datang nya jaring buat gajah,3
barang tidak sesuai katanya 5.9×90 meter .yang di terima cuma 5.9 x 30 meter sisa nya yg 60 meter kemana,5
alhamdulillah realpict,4
paket sudah di terima terimakasih,5
"Barang tidak sesuai hharapan ,tpi ya udahlah",3
om yang benar akan nih barang yah katayah 5.6 90 meter ko yang datang cuman 6,2
"pesanan sip terimakasih
lanjutkan",5
paket mendarat dengan cepat dan allhamdulilah barang pun tdk ada yg cacat sukses untuk lazada dan toko nya,5
Terima kasih,5
pesen jaring emprit yg Dateng jaring blekok...,5
Jaringnya ke gedean burung pipit masih lolos,1
barang bagus banget ,5
barang bagus packing rapih,5
trimh ksih paketnya uda di terimah,5
pajang y blm tau brp mtr x ,5
lumayan tapi terlalu halus,3
saya pesenya jaring emprit ko yang datang jaring perkutut ,5
barang ok,5
barang sesuai pesanan terimakasih,5
barang bagus pengiriman cepat kurir ramah,5
"tidak sperti contoh,..kecewa",2
barang ok paking rapi kurir ramah,5
Pengiriman agak lambat..,5
"barangnya cocok  sesuai dg gambar
",5
barang tidak sesuai... tidak bisa dipakai buat burung emprit,3
Barang sudh mndrat kmren. Tnks,4
"lumayan... walaupun senarnya kecil banget kaya rambut ,mudah mudahan aja awet... ",3
ok paket udh nyampe,5
"Alhamdulillah pesanan di packing rapih seller nya pun sangat baik 
",5
terima kasih pak kurir pelayananya lumayan cepat,5
sesuai,5
barang ok,5
"lumyan
",3
Good job,5
cakep,5
