review,rating
"Barang sudah sampai, cukup memuaskan. Sayang blum bisa tes kekebun,",4
"alhamdlilah brang telah sampai dg slamat + kondisi barang sesuai n pengiriman'a pun termsuk cpat.. 
smoga awet n sukses slalu gan, smoga menjdi penjual yg amanah bgtu jg dg team lazada
^_^",5
"barang udah mendarat selamat dan berfungsi dengan baik pengiriman tepat kurir ramah,terima kasih lazada",5
barang BAGUS pengiriman juga cepat thaks,5
Makasih barang udah sampai dgn baik ,5
mantap sesuai deskripsi n berfungsi dg baik thanks seller n Lazada ,5
bagus sesuai diskripsi dan cepat,5
Terimakasih barang sesuai cuman pengiriman nya lama baget,5
mantap thanks lazada,5
barang dah nyampe dengan selamat.kurir oke. tapi kok ph tanahnya jarum ngak bergerak alias meneng bae,5
Alhamdulillah PH nya sudah sampai n sudah d coba sangat berguna untk mengukur keasaman dan ke gemburan tanah ,5
bintang yg bicara aja....,5
ğŸ‘,5
bagus,5
mantab,5
terimakasih pesanan sampay dengan keadaan sehat utuh pokoe mantap lah ,4
"Barang mendarat dengan mulus, ",5
Paket diterima dengan baik. Kurir sangat membantu,5
Barang udah nyampe.. sesuai gambar... thanks...,5
"barang ok sesuai, fungsi ok",5
Berdungsi dgn baik.. tq,5
alhmdulillah barangnya sudh sampai dan berfungsi semga sukses sllu.jgn ragu belanja di tokoh ini...,5
Real pict n berfungsi baik..tq,5
mantull gan,5
lumayan lah untuk harga segitu,4
barangnya mndarat sempurna dg kondisi yg ckup baik..thanks!,5
"mantab
",5
ok,5
