review,rating
"Barang Sudah diterima sesuai pesanan... 
dan sudah di cobaa... ",5
"terima kasih, barang sesuai dan berfungsi dgn baik ğŸ‘ğŸ‘",5
barang sesuai pesanan...berfungsi baik,5
barang bagus dan pengiriman cepat,5
barangnya bagus sesuai dengan yg digambar saya suka,5
"mantappp Lazada terima kasih
",5
mendarat dngan selamat dan sesuai makasih semua,5
"barang sesuai dan berfungsi, kurir ok, kemasan bagus, pengiriman cepat, terima kasih",5
"barang sudah diterima bgus sesuai di gambar
",5
sesuai...,5
Bagus,4
mantap ,5
