review,rating
"Antara yg didisplay dan yg dikirimkan berbeda, bukan sekedar warnanya tetapi kayaknya kualitasnya juga berbeda, ujung spuyernya plastik, sementara yg didisplay Kuningan.
pengen kasih penilaian negatif gak tega, jadi netral aja, semoga bisa meningkatkan pelayanannya",3
"Paketnya sudah diterima, di prosesnya cpt kak mantap. cuma pengirimannya lama JNE biasanya paling lama 3 hari udah sampai tujuan tapi ini lama. Soal Kualitas Real Pict Bagus dan sesuai orderan customer.",5
"mantabh lah. 
maaf baru ngasih ulasan. sibuk",4
barang udah sampe tapi ga ada setelan buat besar kecilnya air keluar,5
top sesuai...joss..belinya disini aja..!!!,5
"mengecewakan barang rusak 
ga bisa di gunakan tombol buat nyemprot ga berpungsi suruh unggah video ga bisa kekirim hadeeeh",2
barangnya uda sampe bagus pengiriman cepat,5
mksh lazada paket nya dh di trm ,5
"barang sudah sampai,bagus sesuai deskripsi, thanks lazada thnks seller",5
Makasih ! Barang sampai selamat hehehe jangan ragu mesen di sini,5
"Barang cepat sampai,, dan bagus juga barangnya.. good lazada... ",5
"Jebol bos, baru di pake 3 kali",1
ok barang dah sampe ,5
mantap berfungsi dengan baik... thx,5
makasih barang dah nyampe,5
brng nya ok,5
mf bru ksih komen...ok lh barang ya bgus pya ..sesuai sama pesanan dan gambar...sukse slalu.deh,5
barang sudah datang.  sesuai dengan harapan.  ,5
"barangnya bagus, terima kasih seller dan lazada",5
"sesuai pesanan , berfungsi baik .  good",5
mantul,5
yahui,5
ok,5
