review,rating
"mantap barang sesuai pesanan ,terima kasih lazada.. ",5
barang sesuai gambar mantul ,5
barang sip pengiriman lambat,5
barangy bgus sya suka,5
"product sesuai pesanan,respon penjual baik,kurir ramah,pengiriman cepat....The best lazada...mksh...ğŸ™",5
"Barang Ud sampai gan, 
Sangat murah dan istimewa barangnya. Saya ud beli ke 2 kalinya dan ga kapok. soalnya Baranya Bagus dan Murah.., Setelah unboxing beuh sesuai harapan.. joss

Sukses terus indokeran",5
Bagus. Berfungsi dengan baik. Pengiriman cepat juga. Makasih seller,5
mantul,5
"mantaaap
",5
