review,rating
"good , brg cepat smp , sesuai pesanan, love Lazada",5
guntingx kecil baru tajam saya sangat suka mks lasada dan kurirnya ramah jangan sekali2 kecewakan pembeli.mantap,5
"barang sesuai dengan yang di gambar, terimakasih sailer ",5
Real pict..  Bagus,5
paket di terima express dan sudah di gunakan juga.guntingnya bagus dan sangat tajam,5
Barang sesuai gambar bagus saya suka,5
"sesuai ekspektasi, tajam dan memuaskan.
",5
mantul barangnya,5
guntingnya ok tajam. cuma tk sesuai dgn kemauan saya. ukurannya kecil. saya mau memotong buah pinang. lain kali buat keterangan ukurannya.,1
"Waw keren bangat  gunting dahan tajam tdk mengecewakan trimakasih buat toko yg telah menjual produk ini semakin sukses

",5
Barang oke kurir juga baik   respon cepat pokok y mantul,5
barang sesuai pesanan bagus.memuaskan .cuma barang smapi agak Lama.,4
real pick..moga aja tajem ya..thanks seller and lazda..,5
"paket sudah saya terima 
makasih ",5
"Bagus tapi sayang pengiriman lama , kurirnya baik sudah langganan ",5
markotop,3
barang bagus...smoga tahan lama,5
gunting dahan sdh digunakan dan berfungsi. terima kasih,5
terima kasih banyak lazzada... barangnya sesuai sekali,5
"paket sudah diterima, okğŸ‘",5
barang sudah diterima...makasih semuanya,5
"barang bagus., sesuai pesanan bravo uk seller nya thks juga lazada pengiriman nya cepat sampai",5
"gunting nyaman tajam tapi pengiriman lama
",5
"Barang bagus, gk karatan kq.. Oke lah pokoknya ",5
"guntingnya mantaaab cuy, tajeem",5
"Tajam luar biasa,harga mumer,thank seller dan lazada",5
Alhamdulillah sudah sampai bagus tajam,5
Mantap oke,5
