review,rating
"WUMIE murah, dapat menempatkan perhiasan tangan untuk mengambil tempat, mudah dan tidak mudah hilang. Puji.",
"Sangat bagus, diterima, sangat Indah, dan lapisan ganda, menunggu ha untuk membeli barang-barang ini dipasang, tidak lagi takut Perhiasan akan hilang di masa depan, rekomendasi direkomendasikan rekomendasi",
"Kualitasnya terlihat sangat bagus, itu benar-benar Indah, jika tidak Perhiasan, saya masih ingin memulai warna lain, itu juga memenuhi persyaratan Walter.",
"Barang diterima, saya sangat menyukainya, Saya menginginkannya, harga tidak mahal. Atau kulup,, warna juga sangat Indah. Saya mengirim gambar untuk saudara perempuan saya. Rasanya sedikit, Anda harus mengeringkannya selama beberapa hari.",
"Kompak elit, mudah Penyimpanan, Keseluruhan bagus, ornamen tidak banyak, digunakan untuk Penyimpanan adalah cukup, juga sangat praktis. Kerugiannya adalah bahwa Perhiasan dari Sekatan dipasang sedikit ukuran tidak sama, dan lebar di kedua sisi sempit, tetapi tidak mempengaruhi penggunaan. Kotak memiliki rasa yang besar, menempatkan dua TW, dan pilihan hati-hati untuk hidung sensitif. Selain rasanya yang besar, rasio performa masih OK.",
"Pekerjaan warna Sangat bagus, nilai uang, kecuali tempat di mana sisipan tidak terlalu Perfect, apa yang lain?",
"Kotak penyimpanan diterima, dan gambar ACCORD, sangat bagus, lapisan ganda dapat menempatkan banyak hal, Perhiasan ini memiliki rumah!",
"Ibu. Ini juga. The. Ini harga untuk Beli ini kotak perhiasan ini biaya Raja untuk toko gila call mengatakan tidak ada rasa palsu, tutup dari hal-hal yang selalu akan sedikit rasa, tapi Aku hanya membuka beberapa jam untuk menyebarkan seperti aroma dapat spray point parfum Yan nilai sehingga penyimpanan tinggi kotak bisa Aku membeli perhiasan keinginan lebih kuat. Ha ha ha ha",
"Dan gambar sebagai. Tidak ada perbedaan warna warna dan Aku keberatan pola juga dan memperkenalkan dari, ini memiliki sedikit rasa terbuka harus.",
"Merah muda yang indah dengan harga murah bagus, tapi juga praktis, bisa",
"Berat bagus harga harganya murah, jadi saya bisa melihatnya sendiri, puas.",
"Sangat elit Kotak, lebih baik dari yang dibayangkan, tidak berbau, sangat bagus",
"Ya, dua lapisan kualitasnya sangat bagus dan akan terus merendahkan",
Bayi menerima Super seperti WUMIE murah dan berkualitas baik,
"Keinginan Tahun ini, upaya untuk mengisi ini Kotak kecil",
"Bayi yang diterima itu, kualitas cukup baik, dengan begitu besar, dapat meletakkan banyak dekorasi.",
"Barang sudah diterima, saya suka, Baby bagus,",
"Warna sangat Indah, Kapasitas besar, sangat puas dengan belanja",
"Bayi sangat baik, Putih dan Lembut Putih dan Lembut, kualitasnya sangat bagus, sangat puas!",
Mari kita lihat belanja Taobao pertama kali.,
Sangat Indah. Sangat praktis. Ada juga kunci kecil. Saya bisa menaruh bayi saya di masa depan.,
"Sangat bagus, berikan hadiah ulang tahun warna lebih baik dari yang diharapkan, gadis wanita ~",
Menempatkan Cincin tempat terlalu kecil yang lainnya semua baik,
Bayi menerima benar-benar adalah high-end atmosfer penyimpanan luas sangat masuk akal. Sangat Suka!,
Baik Melihat perhiasan kunci memiliki tempat Induksi,
Ini indah dari hal yang banyak seperti,
Suka,
Itu baik,
Baik,
