review,rating
"Kotak Perhiasan terlihat baik-baik saja, ini ada dua masalah tidak puas dengan foto item video 4 di dalam kotak kecil kisi dari untuk saya tapi tidak seperti yang ditunjukkan. Yang kedua adalah liontin sisi besar datang terpisah.",
"Sangat baik, sangat indah, AKU berharap ada ukuran yang lebih besar dari, karena sedikit bagaimana SAYA bisa cocok untuk Berikutnya WANITA dari semua perhiasan?",
"Kotak Hadiah untuk melindungi baik berguna polistirena yang dapat diperluas tetap dalam penyimpangan, penjual juga membantu dalam penjualan, baru belum menerima, DI JALAN",
Membeli ini mengakomodasi kotak pertama Untuk my dressing-meja dan rapi dan indah! Sangat puas dengan ~,
Penjual sikap pelayanan yang baik ~ Bayi juga Bang Bang da! Akhirnya tidak harus kekacauan ~ Layak membeli ~ O (* //// â–½ //// *) q,
Kualitas Produk: Baik clip-on tidak nyaman menempatkan begitu memiliki beberapa menempatkan kotak-kotak laci di. Mesin untuk memotong rambut yang juga diletakkan lebih tinggi.,
Bayi menerima indah murah hati sangat indah Putri sangat seperti kemasan sangat kuat utuh untuk Xinjiang Terima Kasih. Robam!,
$94 Harga terjangkau uang daripada di membeli rumah dengan harga murah banyak di tangan ketika masih rusak gas mati Aku rumah ini benar-benar menghargai ini harga uang,
Ada goresan jelas. Dan penjual goresan itu norma. Pikiran perawatan bayi pesanan.,
"Memberikan buruk pintu, tapi penjual juga contoh yang baik dari penggantian",
Tidak layak harga cacat,
Bayi diterima. Praktis. Mengatur baik. Semua untuk membelinya,
Untuk mengatakan apa yang...ğŸ¤·â€â™€ï¸,
Baik anting-anting akhirnya dapat mekanisme.,
