review,rating
barang rusak di kasi saya gimna ini tolong siapa yg ber tanggung jawab saya beli mahal2 di kasi barang gak jelas barang rusak,5
mantap jam tanganya sesuai gambar makasih lazada ,4
"sangat bagus, jamnya sesuai, packing rapi, pengirimnya jga ramah, gak nyesel beli di toko ini
",5
"mantpss 
sesuai pesanan
maap ya buat bg kurir 
jdi bolak balek heheheh 
the best la buat kurirnya ",5
senqng sekali,5
saya sagat puas belanja di sini,5
Paket Jam Sudah Datang Sesuai Dengan Gambar ⭐⭐⭐⭐⭐ Recomended Seller Untuk Lazada Smoga Sukses Selalu ,5
asu jam mati gh d jual ....,1
