review,rating
"barang pesanan ku datang dgn selamat ,mulus ,rapi , dan tak bercacat sedikitpun, walaupun pengiriman lama tapi gpp sabar menunggu dan hasilnya bagus banget, puas belanja disini, tingkatkan terus pelayanan nya .. pokoknya tidak nyesal belanja disini, no tipu tipu, sesuai dgn gambar. ",5
"Jam sdh sy terima dalam kondisi sempurna. Real picture. Perasaan saya bahagia sekali krn fakta sesuai dgn harapan. Jam asli bukan kw kw. Trimakasih lazada, semoga sukses selalu.
",5
Pesanan udh sampai kwalitas baik dn sesuai dgn pesanan yg di minta,5
Pengiriman agak lama... Tapi barang bagus... Harga mantaaap... ,5
