review,rating
"makasiiiiiiiiiiihhhhhhhhhhhh,makasiiiiiiiiiiiihhhhhhhhh,makasiiiiiiiiiiiihhhhh.",5
"makasih lazada,,paket dah sy terima..semoga tikus"" di rumah sy pada pergi..buat bang kurir ğŸ‘ makasih",5
realpick..ok,5
top pesenan cepet bnget nympe nya makasih juga benerin lho beli satu dpt satu,5
dikira gede2 gak taunya kecil uda langsung di sebar ,5
mudh2an aj tikus ny pd tkut ye...oke thnkz lazada kau selalu dhti â™¥â™¥â™¥â™¥â™¥,5
barang yg dipesan tidak ada.,2
barang dah nyampe tp lum dcoba.,5
pengirimannya cepat...,5
Siip.udah nyampe cepet datang nya. Kurir nya ramah,5
sya kscewa brang'y tidak sama dngan gambar,5
"mksh seler , kurir ninja & lazada",5
"kamper ya digambar warna warni.tp dtngnya putih semua

",3
paketnya udh nyampe beda sm gambar gk berwarna blm d cb ,3
"beneran dapat promo beli 1 gratis 1
penjual sangat ramah.. lain kali mau belanja d sini lagi deh..",5
harum wangi,5
"Barang udh dtg tp blm dicoba ,, semoga berhasil",4
bagus,5
sip,5
