review,rating
"mksh gan,brng sdh diterima semoga berhasi stlh di Coba?",5
"sesuai pesanan ,packing rapi ,pengiriman lama maaf tidak bisa kasih photo karena itu buat pesanan blm di coba",5
pengiriman barang cepat kurirnya juga ramah yg pasti mh kualitasnya barangnya oke juga sangat manjur ga nyesel deh belanja di lazada,5
sudah saya pake ternyata bagus dan ampuh ,5
"pesan sdh diterima, knp kok lama ya....",5
pengiriman lama,3
racun ny manjurrrr bikin sempoyongan tikus ny .. muantappppp ... dah ğŸ‘Œ,5
Mantap margatappp...ğŸ–’,5
"Amat sangat lamaaaa ke buru tikus punya cucu baru dateng,,, kurir nya ramah trmksh lazada ",5
Pekingan rapih...,5
"ya ini blm kelihatan hasilnya tikus mati apa tidak ,trims kirim tepat waktu",5
bagus....cukup,5
Pembasmi hama nya bagus tikus langsung mati,5
Belum nyoba c ok g obatnya.semoga ok makasih,5
lom dicoba,5
ampuh,5
