review,rating
maaf bru ngasih ulasan mau lihat hasil y teryata ampuh tikus y mati di tempat mau pesan lgi abang kurir y juga baik ,5
"sempet salah kirim.. yg dikirim barangnya beda, tp penjual bertanggung jawab sekali, di pandu pengem balian barang retur, tidak kena biaya. dan kiriman penggantinya sudah sampaii. alhamdulillah.. tq sealer.. belum di coba bbarang baru dateng.. ",5
"emang top markotop ini barang,baru dicoba semalem aja tikus udah mati 2,besoknya eh bertambah lagi 2.siiip dah produknya.sayang gak sempet upload soalnya tikus keburu dibuang 游때",5
"mantap... mlm di sebar,,pagi nya lngsng bnyak bgt korbannya... si omen nye terperangkap... horeeee...
makasih lazada and seller nya... top top markotop",5
pembelian kedua...sdh membuktikan hasil...lgsg strike 17ekor...游때游때游녨游녨,5
mantap puaaaaas bingittt,5
produksnya bagus dan udah ada hasilnya游녨,5
ngeri wak....jam 2 malam di pasang racun nya...pagi2 tewas 3 ekor....mantabbbbb,5
"Tokcer belum ada 30""menit sudah 2 tikus yg mati游녧游녧游녧游녧 produk mantuL tuL tuL tuL",5
mantap racunnya. langsung dapet 1 babon n 1 anakan.. packing rapi. harga flashdeal serasa harga normal di lapak lain.,4
Blum di coba tp mudah2n mantul,5
Mp bru ngasih ulasan.. Kirain ga jetu.. Racun tikusnya.. Langsung mati di yempat jga tikusnya.. Bagus bnt ini racun.. Mksh lazada.. Mksh jga buat kurirnya... Baik bngt,5
Ampuh banget tikusnya modar 游녨skrang dh pesen lgi mksh lajada aq puas banget,5
racunnya ok ... jd puas liat tkus pd mati ... kurirnya langganan ,5
malam di Pasang pagi nya baru ketemu 3korban tewasss,5
"ini bari racin tikus yg mujarab,dapat 5 ekor mati skaligus,mantappppp !!!",5
"Bagus...
dapat 3 tikus yg mati...",5
游녨游녨游녨游녨游녨游녨,5
" 100% mantul, ampuh cuuuy. padahal makannya cuma dicolek doang. matinye 2 sekaligus... modar",5
"melalui amail katanya sudah dibatalkan tapi ttp dikirimkan jg walaupun lama... 

",5
"senang berbelanja di toko ini penjualnya amanah
",5
"walaupun isi nya cuma sedikit
tapi tikus nya yang pada mati banyak
mantap dah
makasi lazada",5
Tokcer sih... Langsung dapet 6 mangsa,5
langsung dicoba dan sudah ada korban,5
barang sesuai pesanan,5
bagusss nih dalam 2 hari 5 tikus yg mati游녧,5
"Barangnya dah sampai, mantul
Abang kurir ramah
Thanks lazada",5
lamaaaaaa bnget ini ma pengirimany lamaaaaa bnget udah lma ada lg brng yg tdk ada tdk dksh info parahhh bnget dach,2
"mantul tikus mati banyak banget pake racun ini, mau beli lagi, terima kasih Lazada, terima kasih kurir langganan yg super baik",5
bagus.. kurirnya baik ,5
barang sdh sampai dn tikus ny tepar smua mntepp 游녨游녨,5
"trimakasih seller ramah, cekatan, pengiriman cepat, memuaskan, dan recommended 游녨游녨",5
"Ampuh banget n untungnya metong dkt, jd g susah cuang bangkainya. Recommend, mo order lg ah. Thx seller, thx Lazada",5
"Maaf baru sempat beri ulasan,, paket ny sdh sampai kmrn sore tp saya blm coba,, mudah2an bermanfaat& smg ampuh,,pengiriman ny sesuai estimasi kurir ny baik,,terima kasih  untuk smua smg sukses sllu ",4
"Kalo racun tikus ini mah gak diragukn lg.. pernah nyoba soalnya  target lngsung mati ditempat.. Top markotop pokoknya
",5
"belum di coba,kirain isinya banyak,ternyata kecil,sedikit,kasihan sama kurirnya,malam baru nyampe,mana hujan lagi游땬",2
mantep racun tikus ya. di pasang 5 menit tikus ya langsung mati d tempat. mkasih lazada.. ,5
kirain besar paketnya...tp gak papa...semoga manjur...hama tikusnya bs hilang...游때,5
"Barang nya sudah saya terima bungkusan rapih cuman isi sedikit ya tapi masih belum dicoba mudah2han ada reaksi 游땏
Terimakasih Lazada 游똂游땢",4
"ternyata barangnya kecil, kayak pewangi sachetan. blm dicoba, semoga manjur buat basmi tikus.",4
untuk yang tikus berukuran besar masih belum ampuh..,4
blm di coba semoga 100 %,4
"sebungkus doang, semoga aja ampuh",5
kecewa...order 3 dikirim 1...,1
belum dibuka semoga ampuh,4
racuny top markotop oke banget tikusny mati,5
Mantap buat omen mabok langsung mati di tempat.trims,5
"mantap langsung mati tikusnya,terima kasih lazada",5
racun ny ampuh.... sekali pakek tikus nya pada pingsan... ,5
paket udah diterima gan,5
barang sudah sampai belum sempat di pakai,5
"mantab tikusnye pade modar.... , 
",5
Racun tikusnya kecil bngt bungkusnya..kirain besar Rugi Pembeli ini mah 游뱗游뱗游뱗,2
"ok paket sdh mendarat,lom d coba mudah""an MANJUR",5
g mati mati tikusnya,3
"terima kasih Lazada..
barang nya sdh sampai & sesuai dgn pesanan..
kurir nya pun ramah..",5
racunnya ok ... puas liat racun pd mati ...kurirnya langganan ,5
UD beli yg ke2 x nyaa ampuh tikusnya lgsg klepek2 heee.. mksh yaa,5
ok brang mntep,5
Terima kasih lazada barangnya sudah diterima ,5
"mantap bos, langsung tepar",5
blum d coba klo sukses...bli lgi ,5
"Kasih Bintang 5 Deh Kemasannya OK, Mudah Mudahan Hasilnya Juga OK",5
Mantap ini racun tikus ,5
mantap...mati semua tikus....,5
"bagus tikus mati dlm seekejap aman ga ada tikus goood
",5
ampuh ni racun tikus nya,5
terima kasih sdh sampai,5
thanks yaa.....good.....,5
eh manjur dong pake ini 游때 suka banget makasih 游봃,5
tikus pd mati,5
blm dicoba smoga berhasil kemasan rapih.,5
"pedahal beli nya 1, tapi kurir nya mnta ongkir lagi g jelas ",5
"maaf baru ksih ulasan, product ok respon cepet, kurirnya jg ok maksh buat semuanya",5
sesuai harapan,5
Bener asli tikus got lgsg mati ditempat,5
blm dcb dan dpke guys .kcl kmsn nya ,4
Mantull...udah dapet 2 yang mati...,5
"paket datang cepat, belum dicoba ke tikus, beli buat jaga2",5
"udh samapai,tp blm di buka. smoga dpt yg asli dn paten membasmi tikus",4
"Nice, cuma ga tau, tikusnya dah koid atau belum, ga nemu bangkainya",5
Untuk racunnya cepat sampai kurirnya ramah namun racunnya belum dicoba,5
barange Joss,5
belum di coba sih... mudahan ampuh,5
Racun nya sangatt ampuhh,5
bagus .tikus ya langsung mati .top,5
mantap 1 bungkus dapat 4 tikus langsung,5
paket dah nyampe tp blom di coba,5
mantul sekali beli 4 langsung mati,5
ok blom dicoba buat tuh tikus mdh2n ampuh y,5
mudh2hn tikus dirumh pda mati,5
barang Sdh Sampai...Thx...,5
"top markotop tikus langsung mati
",5
bgs tp gk tau tikusnya mati dimn tp sdh berkurang sih,5
racun tksya ampuh tks di rmh pd mati alias is ded trma ksh lajada,5
kirain isinya banyak taunya dikit banget...hihi,5
barang sudah sampai,4
belum dicoba ,4
Barang sangat bgs dan memuaskan!,5
"sangat kecewa, saya pesen 5 yg datang cuma satu bungkus sisanya yg 4 bungkus giman",5
ok,5
Bagus,5
oke,5
bagus,5
Lm,5
"keren
",3
Bagus,5
mantaaab,5
ok,5
ok,5
