review,rating
"Maaf baru ngasih ulasan sengaja pengen nyoba khasiatnya dulu. Emag bener aku punya kolestrol tinggi minum teh herbal ini enakan ga pusing"" bgt kepala entengan terimakasih seller",5
"Liat badan langsing itu rasanya bahagia ,kalian harus konsumsi teh ini jg. Manfaat nya banyak, sejak sya minum teh ini ngk hanya BB saya aja yg turun. Tapi kaki saya yg sering asam urat jg ikut sembuh",5
"pengiriman cepat seller jg ramah banget. emang mantap produknya, dari badan sya yg gemuk sekarang jadi lebih ideal. ga di ragukan lagi, ",5
"sellernya ramah, hasilnya memuaskan. dari badan sya yg gemuk.. jadi lebih langsing krn konsumsi teh ini.",5
"Udah 3 kali order di sini. Tokonya amanah dan seller jg ramah pengiriman cepat. Ini stelah minum seminggu udah ada perubahannya, yg awalnya wajah sya bulat dan BB sya 60 sekarng jadi 48. Sesuai yg sya inginkan mantap",5
"Emang teh pelangsing ampuh,yg awalnya gemuk banget.. berkat teh ini badan jadi lebih ideal. Produk jg ori realpict. Terimakasih lazada , seller jg ramah",5
Pesanan dh datang to blm ada perubahan msh baru mks lazada,4
"tehnya enak , baru konsumsi 3 hari berat badan udah turun 8 kg. ",5
"mantep. kualitas banget
",5
"brang nya real pict. Terima kasih banyak, bermanfaat juga, next order
",5
"brang nya real pict. Terima kasih banyak, bermanfaat juga, next order
",5
minum teh ini sya seimbangkan dgn olahraga rutin.. diet saya lebih  maksimal hasilnya. ,5
"sangat memuaskan, langganan ku emg, besok saya order lagi",5
