review,rating
"Awalnya ragu tapi setelah mencoba berat badan jadi turun.. Produk benar-benar original
Terimakasih seller",5
"Tidak ragu untuk beli di toko ini, karena semuanya original dan herbal.. Benar benar rekomendasi dari pada toko lain ",5
benar benar pelangsing bb ku skrng sudah trun beda dri toko lain kemarin aku beli tpi ga sama kaya yg ini.. toko ini bener bener original,5
"BB turun setelah mengonsumsi produk ini, awalnya susah banget buat nurunin tapi nyoba produk ini ternyata hasilnya sudah kerasa",5
"ketika mengonsumsi produk ini hasilnya udah kerasa bb yang asalnya 55 skrng mnjdi 52, benar benar original",5
"Selalu andalan di toko ini.
Udah Program -+ 2Bulan sekarang badan udah jadi Ideal.
Good banget . Sukses selalu buat toko resmi Herbal",5
"alhamdulillah BB aku turun setelah mengonsumsi produk ini, produknya benar benar original",5
"ternyata kerasa hasilnya keliatan yang awalnya bb 50 skrng turun 48, cocok banget dahh pkoknya",5
"Benar benar BB turun, cocok banget
Mantabb, seller ramah juga",5
"Paket diterima dengan baik, packing rapi, seller ramah
Terimakasih ",5
