review,rating
aku tepatin janji kalau aku berhasil aku kasih ulasan kalau ga berhasil gak aku kasih alhamdulilah seminggu turun 6kg makasih banget yah productnya ampuh aku mau order lagi dan sklian aku ajak temenku untuk beli hehe.pokonya the best deh productnya ga nyesel serius ğŸ˜ğŸ˜,5
"paket udh sampe dan isi 10 cap.. 
belum d coba.. 
pengiriman lbh 3 hari dri wktu yg d perkirakan.. ",4
isi ya dikit cuma 10 kapsul neks ngk masalah yg penting hasil y moga cocok ,5
belum.di coba mudah2an bb turun,5
