review,rating
"pengirimannya cepat dan kurrinya jg ramah,semoga cocok dengan produknya,makasih lazada sukses terus ,,,",5
"ini kali ke 2 nya saya pesen, cepet bgt pengiriman nya...udh gitu bebener ngaruh bgt lho...seminggu turun 2kg, maka nya saya repeat order teruz游녨",5
oke barangnya cepat sampai.terimakasih lazada. ,5
"alhamdulillah flimty nya udh sampe mau di coba dlu reaksi atau ngak, exp nya msih lama 2022",5
maaf baru kasih ulasan,5
barang sesuai harapan,5
paket mendarat dengan aman,5
"bagus  ,kurir nya baik dan pengiriman rapi, makasih lazada",5
"yeeeaaa... paketanku udh datang, real pist
belum nyoba sihh, tp smoga cocok bisa turunin BB q yg Monthok ini 游땔游녧
makasihh Lazada游땢",5
"Alhamdulillh...paketny cept sampainy... ud langgann d toko ini,.....Pokokny g kecewa kurir ramah.
",5
barang sudah sampai thanks.,5
mksh lazada maaf baru ksh ulasan paket dtng sore malam & pagi sebelum mkn sdh aq coba ternyata tokcer 游녨游녨,5
"Mnum ini BAB ku jdi lancar, udh turun 1kg, mudah""an mencapai target",5
"paket udh nyampe..
pngiriman cpt bngt..
kurir nya jga ramah, makasih..",5
"makasih kak barang dah smpe cepet bgt nyampenya. pertama kali nyoba moga aja bisa ngecilin perut buncit nya. 

babang kurir nya ramah .mksh byk kak 游땘游땘游봃游봃游똂游똂",5
"barang nya sesuay pesanan terima kasih iya,  puas banget belanja d sini,  mudah2 cocok iya 游땘游땘游땘游땘游땘游땤游땤游땤游땤游땤",5
"paket dah  mendarat di tangan ...paking rapi bersegel ...kurir ramah ,mudah2an berat badan bs turu ..mf blm mencoba .baru mau ..tp lazada ok ...mksh lazada .",5
Packing bagus dan cepat sampai...baru pertama kali coba ini mudah2an berhasil menurunkan bb aku ini游때,5
paket mendarat dengan selamat. thanks ,5
packingnya kurang amann,3
"pesennya rabu, minggu udah sampai. alhamdulillah. siap dicoba suami, semoga khasiatnya sungguhan.",5
"thnx u laz ats pngiriman ny, stiap q psn sllu mntp packingan ny n wkt ny jug cpt....smoga q sukses dlm program diet q y n buat laz sukses sllu, jgn lp klu ongkir ny jgn mhl2 y ntr bz jd k'lain hti q ny 游때游때游때 hehehhee",5
"pake sudah di terima, packing rapih游녨rasa nya seger, semoga cocok bisa membantu prosea dier saya...",5
"Thanks brgnya udh sampe,,,walau aga lama",5
sangat suka pelayananya,5
harganya naik terus ya..,5
pengiriman sangat cepat senang sekali,5
Alhamdulillah pengirimanya cpt ,5
pokonya mantuuuuuul,5
"aman sampai sini makasih
",5
pengiriman cepat packing rapi mudah mudahan amanah,5
"paket sudah diterima, hasilnya lancar buang air besar nya",5
bab sehari 3x...   mdhan2an cocok,5
terima kasih barang sampai dengan selamat,5
Sipp... Mksh lazada游녨游녨,5
mantap baru 2 hari minum bab lancar BB turun 1kg,5
 Hy Ka aku kan lagi datang bulan bisa di minum gak pas datang bulan ,5
"maaf baru ngasih ulasan ya, brgnya udh nympe sesuai pesanan bahkan lebih cepat dari waktu estimasinya, kurirnya juga ramah. terima kasih lazada",4
packing nya rapi dan sangat memuaskan. makasih lazada 游녨,5
terima kasih barang sudah sampai di tempat,4
" brg sesuai,semoga bisa lekas turun bb q mksih lazada",5
"mantap abiss,,  ",5
Paketny ud nyampe.... pengiriman cept..Jdi langgann d toko ini....Kurir ramah.Mksih lazada...,5
"mudah2an cocok,mksh lazada&seller",5
"Barang sudah saya terima ....Sudah 4 box sy pesan d toko ini...Barangnya ori.....Bagus pertahankan y.........flimty sangat membantu menurunkan berat badan saya.....Pokoknya is the best deh .....游녨Barang cept sampainya,pdahal lebih cepat tempat saya ngajar,karna libur belajar d rmh sy jdi pesan alamat d rmh......& mksih tuk kurirny baik.....",5
aku bisa susah bab tpi minum ini babnya jdi lancar.uda hbd satu stenga 23 bungkus bb turun 2 kg harusnya bargin sma olahraga t,5
"Maaf ...Sy g sempet fhoto.....Yg pastinya sy seneng bnget...Minum flimty sangat membantu sekali buat  program diet sy...
 Alhamdulilah selama 2 bulan,berat bdan saya turun hampir 9 kg....Tp ini blm maksimal turunnya... 
Sy mau nurunin berat badan sy lgi.....Pokokny flimty no satu...游녨",5
"kiriman cepat dan rapi,cmn d bungkusnya pakai kertas kartun gak pakai dus..biarlah yg penting brngnya utuh dan srmoga hasilnya memuaskan..",5
alhamdulillah paket sudah sampai..pacing rapi tpi agak kecewa sama jasa pengiriman nya krna gak di antar paket ny sampai dirumah.terpaksa harus ambil sendiri di kantor jne. ,5
"Flimty hasilnya memuaskan...Berat badan saya turun 8 kg dalam satu bulan.
Flimty sangat membantu sekali...
",4
alhamdulillah barangnya sudah sampai.pengiriman sangat cepat.kwalitas barang ori.pokoknya puas belanja ditoko ini,5
Paket sdh sampai. Paking rapi dan aman. Produk baru coba dan paginya buang air besar jadi lebih lancar,5
Mf br kasih ulasan.  Sy cb dl.  Ternyata ccok dan enak rasa ny.  Bab na  jd lancar.  Plmty top bget terimkasih lazadaku.  Semog sukses trus.  Toko ny sllu amanah.  . Paking ny rapih.  Ramah.  Ok bget deh..  Nextam order lg.  ,5
Barangnya sudah sampai semoga suamiku cocok minum ini 游때 packing rapi... thx Lazada ,5
mksh lazada,3
"packaging rapihh, produk asli, pengiriman cepat 游똂游녨",5
Pengiriman cepat . Coba baru pertama order . Semoga cocok nanti bisa order lagi,5
Barangnya udah sampe tokonya amanah banget sesuai dengan pesanan makasihhh lazada,5
jangan ragu pesen flimty dtoko ini ,5
sama sekaliii tdk adaaaa perubahannnnn,5
makasih barang y uda dtg cpt bgt semoga cocok游쓇릧,5
"paketnya kardusnya penyok2
isinya untungnya gk rusak
",4
sip banget....,5
Nggak ada perubahan,1
"packingan rapi, mantull. semoga sesuai khasiat",5
"Mudah""an cepet turun bbnya .",5
"bungkusnya rapih, saking rapihnya. susah di bongkar 游땑",5
Bagus obatnya,5
"makasih dah dateung,moga manjur",5
"blom d coba smoga ccok
",3
barang sudah sampai...sesuai pesanan,5
mantul. bner2 manjur,5
sangat puas bagus ,5
"bagus.. 






",5
masih dicoba,5
Barang ok tapi Ko Dateng nya cuma 15 sachet ,4
bgus..mo beli lg,5
"cepat,rapi,ramah
T.O.P B.G.T",5
lazada mantabs,5
Barang sesuai pesanan pengiriman cepat ,5
"itsss gooddd
",5
obat ya bagus bab aq lancar,5
tepat wkt. kurir ramah. packingnya bagus,5
aku baru minum satu sachet,5
"seller respon cepat,  pengiriman ny juga cepat,  rekomended",5
blm ada promo LG ya..PGN beli lg,5
"sangat puas, pesanan sesuai dengan gambar",5
Narang oei puas,5
"ok mantap! barang sampai dengan ceapat, belum dicoba sih, smoga manjur n trimakasih",5
terima kasih barang y udah sampe cepet banget,5
barang ya sesuai pesan mudah berhasil ya,5
"barang sdh sampe, kurir baik dan sopan, mksh",5
mantull kalau cocok belanja lagi pengiriman cepat nympe 游똂游낕游녨游낕游녨游낕游녨游낕,5
"Sangat bagus, buang air jadi teratur ",5
"barang bagus packing aman sangat bagus 
ibu saya sangan senang 
pengiriman nya cepat ",5
"packing rapih , respon penjual sangat cepat 

",5
mantap pengiriman cepat diproses.. barang ny asli.. recommended ...,5
"barang udah sampai cepet juga...mudh"" han cocok..makasih lazada emng terbaik amanah..游녨游녨游녨游녨",5
tokcer...perut mulai mengecil..mau order lagi,5
"produk murah tp g murahan,ini bnran ori. lumayan bwt nurunin bb sya. makasih seller游땕",5
mantap,5
good 游녨,5
mantap coy,5
good,5
游녨游녨游녨,5
ok ,5
mantul,5
游녨游녨游녨,5
游녨游녨游녨,5
Bagus sip,5
