review,rating
"Pengiriman cepat~ Order tgl 3, tgl 4 sudah sampai di rumah paketnya. Packing rapi dan aman. Moisturizer ini ringan untuk kulitku yg berminyak tapi tetap lembab buat kulitku yang dehidrasi. Kalau di mukaku pas lg keluar whitehead, tinggal kasih moisturizer ini 2-3 layer, pasti langsung hilang whitehead'nya. So doi ngebantu banget buat kulitku yg acne prone.

Thankyou Clinique~",5
good,5
"Sampai jg pesenan 11.11 aku.. Untuk yg ini sedikit lebih lama dari pemesanan ak di laz mall yg lain, tapi gapapa.. i still excited terima paketnya. ğŸ˜ğŸ˜
seneng bisa dapet gifts nya,, yg kalo beli di toko langsung pasti gak ada dapet.. trs packagingnya pun rapi n berasa special dong dibanding beli di toko langsung.. thank you clinique indo.. ",5
Kecewa bangeeet... beli produk di lazada karen melihat promo dapat gift.. beli tanggal 9 november karena sudah melihat ada promo 11 november. Ternyata gift tidak diberikan dengan alasan promo hanya untuk pembelian tgl 11 november. Pembodohan publik banget ini. Terjebak dengan iming2 promo. Keterlaluan.. kecewa berat.. lazada sangat mengecewakan.. ,1
"Packagingnya rapi sekali, dipakaiin banyak buble wrap supaya barang sampai dengan selamat. ",5
"Great purchase, will repurchase.",5
"Original clinique. Packing rapi. pengiriman cepat.
Hadiah sesuai promo",5
"packing rapi sekali, senengnya dapat free gift..thanks
",5
