review,rating
produk oke pengiriman juga cepet bgtt sekarang udh gaperlu pake sapu biasa sekali dorong langsung bersihhhh makasih seller ,5
thank u barang lengkap pengiriman cepattt top deh buat seller ,5
makasihh barangnya sudah sampai cepet banget sumpahh barangnya juga berfungsi dengan baik sip dehhh,5
sapunya berfungsi dengan baik warnanya pink lucu baguss recommended ,5
top banget deh blanja di toko ini suka bgt sama sapunyaa berfungsi dengan baik makasih yaa,5
suka banget packing oke kualitas barang oke next pasti order lagi makasih seller,5
baguz,5
Makasih paketnya dah nyapai kurirnya yang sering ngantar keu aku,5
