review,rating
Akhir nya paket nya datang juga meskipun lama pengiriman nya tapi nga apalah sapu nya bagus buat pak kulir  makasih bgt udah dianterin paket nya buat toko nya semoga makin laris buat lazada makasih,5
"udh trm pket ny,smg awt dan mksh buat kurir ny",5
"paketan sudah sampai ,,makasi seller recomended banget makasih kurir dan lazada",5
"maaf baru kasih uladan,real pict paket mendarat dgn selamat,thank lazada dan mas kurir nyağŸ™",5
pokonya recomen banget dech,5
bagussss... ,4
good sesuai pesanan,5
udh sampe kok bgs,5
sapunya baguss ok,5
sapunya bagus gagang nya kayu semoga bisa awet sapunya terimakasih seller,5
sapunya bgs sesuai gambar kurirnya jg baik,5
barang sdh sampe n kondisi bagus ,5
"Paket mendarat dengan selamat ,,sesuai pict,,recomended seller ,,makasih lazada ",5
puas â˜ºï¸,5
mantuuul,5
