review,rating
ternyata imut bgttt.... inimh buat maenan bocah,5
"produk sesuai deskripsi,,satu paket dgn bonusNy",5
"lumayan lah buat mainan bocah, kirain gede..",5
produknya bagus kemasan baik dan rapih,5
"makasih ya gan pesanan dh sampe,packing rapi dan cepat sampai mantab ",5
Kurang Mantul....Barang'a Kecil Banget...!!!,2
"imut sekali,  terima kasih lazada n seller ",5
seroknya datang dlm keadaan patah,4
"baru kli ni kecewa sma brang yg d psen.. 
.ngga real pict",5
"barang bagus, sesuai dengan gambar, estimasi pengantaran tepat waktu.",5
brang y ok.cma kecil bnget y.,5
Bonusnya tdk dikasih. ,2
