review,rating
"Produk real pict,kurir ramah,pengemasan rapi dan aman di lapis buble warp.
Pengriman cepat pesan hari sabtu langsubg d proses,recomend deh buat pembeli yg gk suka nunggu lama.
Sukses terus mnc shop.semoga tmbh sukses.
",5
barang bagus sesuai deskripsi,5
"pengiriman rapi, respon cepat.",5
ternyata ember kecil. tongkatnya g bs dilurusin. g ada box aslinya dan g ada petunjuknya. ada bagian yg retak,5
barang bagus sudah saya pakai berkali kali tetap oke,5
ad yg pecah emberny kurg bgus,1
Barang  bergungsi dgn baik....,5
