review,rating
"pengiriman cepat, packing rapih,, semua OK tp lum nyoba dpasang, mksih Lazada & seller ğŸ‘Œ",5
Barang nya dh sampai rapih pula..kurir nya dh langganan,5
"Alhamdulillah cpt bngt smpenya,,, baru aja sampe,, blm saya buka, kurirnya ga ada info, jadi kebetulan sy lagi di luar ampe bru2 pulng,, ternyata kurirnya bkn yg biasa kirim ke aku,, kasian kurirnya masih bnyak paketan 19 paketan lagi,, 
semoga aja ga mengecewakan barangnya, aku kasih bintang 5,, paketan blm aku liat",5
"baguss nih seauai pesanan, semoga dalemnya gaada yang lecet baguss suka banget, murah lagiii",5
"paket dh smpe  Realpict, sesuai harapan. mksh Lazada, Seller jg kurirnya",5
"alhamdulillah pengiriman lebih cepet dari perkiraan, barang sesuai, enggak ada cacat... ",5
bagus suka semoga g mengecewakan pas di pasang,5
Mantap coy mau pesan lg ah tanks,5
bagus,5
