review,rating
"kak salah kirim, orang mintanya hello Kitty di kasihnya yang lain",2
mantap dah poko ya,5
"mksh ea ka paket'a sudah sampai,,,semua'a sesuai pesan'n,untuk kurir'a pun ramah,mksh lazada",5
sangat sangat kecewa walpapernya dateng nya gak sampe 10 meter tau taunya cuman sampe 1 m saja saya sangat menyesal,5
sesuaii bgtt..puass pokokeğŸ¤—,5
"Yesel,gambar ya burem",3
Kecewa banget Gambar ya burem,3
pokoknya gk bosen2 belanja di lazada mah,5
"pesen motif helllo kity dikasi motif garis"" Kalo gak ada jangan asal kirim 
",1
"bagus ,cuma agak lecet dikit",5
puas bngt tp msh kurang bakalan repeat order LG ,5
mksh pketan udh sya trima.,4
baguuus cantik,3
real pic ,5
mantap dah poko ya,5
Matap,5
"barang nya bagus sangat memuaskan
",5
