review,rating
"Oke barangnya...sesuai gambar, cm besi bagian penyangga agak bengkok dikit...btw ga masalah sih",5
"sudah sampai bgus, udh dirakit. tp knpa ngk pkai bubble wrap, jdnya agak rusak kardusnya.",5
"Suka banget , real picture",5
Paketnya sampe satu hari setelah aku transfer which is cepat sekali..dan barangnya sesuai ekspektasi. Anakku pun senang mainnya. Tks yah!,5
"makasih lazada.. barang sudah sampai dan kondisinya masih bagus.. kurirnya jg ramah.. baik walau udah pusing nyari rumah ga ketemu"".. anakku jg suka bgt.. mudah""an nnti belanja lgi ga kecewa yaa.. untung kmarin beli pas disc 12-14des jdi lebih murah..",5
"ayunannya kokoh, cocok banget buat ajarin anak makan sambil duduk. recomend banget, packaging bagus sesuai deskripsi dan tidak ad cacat sama sekali",5
pihak pengirim ( JNE )  pelayanan tidak sesuai dengan biaya ongkos kirim,3
belum d pakai dan belum d buka,5
bagus puas bangetttt.....  pokonya TOP deh.. terimakasih lazada ,5
"puas pesan disini... sellernya sangat amanah , top pokoknya ",5
"Mohon ditanggapi, pesan produk pliko baby chair dr tgl 13 desember 2017. Sampai sekarang tgl 03 januari 2018 belum sampai-sampai. Tolong ya di followup, di cso belum ditanggapi jg. Terimakasih",1
terima kasih ,5
"pengiriman cepat,.packing bagus ,.hanya barangnya belum dibongkar.",5
Kurang empuk bagian kursi ayunan.,3
"sampai dalam 1 hari, packaging oke dan barang dalam kondisi bagus. thanks",5
"tapi cuma ada 3 karet penahan agar tidak geser... 

karet satu tidak ada",4
bgs,5
bagus,5
Disini tulisannya stok tersedia.. di klik beli skarang brang kosong false..,1
