review,rating
"barang tidak sesuai pesanan, sangat mengecewakan, yg dipesan sejadah busa yg dapat sejadah biasa",1
bagus bhan nya tebal,5
kecewa ga sesuai pesana...yang saya pilih....jauh...,5
"Sejadahnya tebal,warnanya tidak cerah,cuma yang bikin saya kecewa karena coraknya tidak sesuai yang didislay,jadi walaupun datangnya cepat,saya tidak puas :(",2
"barang nya bagus , lengkap , packing nya rapih , kurir nya tepat dan ramah , lebih banyak kurir yang seperti itu yah mantap , maaf fa bisa psang photo nya",5
"mantep kain,x tebal",5
"sesuay dengan barang y,,,,mantullll,...",5
