review,rating
mksh lazada barangny udh mendrat dengn baik..barangny bgus sesuai gamabr..udh lngsung dipake buat abg kurirny mksh..kurirny baik,5
"barangnya sudah sampai dengan cepat, kurir nya ramah, barang real pict, sesuai dengan harga, toko nya amanah. terima kasih lazada",5
"paket datang dengan kondisi baik , barangnya baguss sesuai  yg saya harapkan 游땕 , kurir juga ramah ...  游녨游녨游녨游녨 terima kasihh",5
"Maaf baru sempat kasih ulasan,efek sibuk游때
Paketnya sudah sampai,,produk sesuai gambar,produk tidak ada yang kurang,pengemasan mantap pokoknya suka belanja di toko ini,kurir pun ramah,,next order lagi yaa 游땕游땕游땕",5
"alhamdulillah barang smpe dgn packing rapi sesuai keinginan, realpict deh bahan nya jga lembut lumayan tebel, anak saya suka bisa maen n tidur dgn nyaman di sofa ini. thanks lazada, kurir nya jg sopan n ramah",4
"barang sesuai gambar dan bagus, pengantaran sesuai tanggal dan kurirnya ramah terima kasih lazada seneng belanja di lazada.",5
"Alhamdulillah paket sudah sampai agak cepat,barang pict dan kemasan juga rapi,tinggal nunggu kehadiran si kecil. makasih lazada",5
"kasurnya bagus...
anak saya senang kali tidurnya
pak kurirnya ramah...
walaupun agak lama datangnya....
sempat kecewa Alhamdulillah puas dengan kasurnya....",5
"barangnya bagus, empuk terimakasih lazada",5
barangnya bagus..  empuk...,5
Sofanya bagus bangeeeettt..real pict 游봃 pengirimannya jg cepet 游녨,5
"barang nya bagus banget.
bakalan jadi Langanan ni..
",5
sesuai dan pengiriman pun cepat,5
Sesuai pesanan mantap,5
"mantap 游땕 kurir nya sopan ramah 
",5
langsung pules  bobok y,5
"barang nya bgus real pic pkonya mh ,gk bkln kecewa",5
Sofa bayinya bagus bgt...halus bahannya..real pict...makasih HADA COLLECTION,5
barang mantuuul thank's LAZADA thanks Ninja,5
bagus 游뱅游녨,5
"Trima kasih lazada...maap gak difoto,tp barang nya realpict kok,sesuai yg saya pesan..semoga lazada tetap bisa menjaga kepercayaan pelanggan..游땘游땘游땘trima kasih游똂游똂游똂",5
barang nya bagus cuma tengah nya sma skali ga ada busa nya jdi pantat byi ku kurang nyaman buat duduk,4
"Bagus, realpic, pengiriman juga cepat",5
cepat sesuai orderan,5
sangat memuaskan ....terimakasih lazada,5
mantul pak eko,5
"alhmdulilah pengiriman cepet dan datang sesuia pesana,, pokonya tidak mengecewakan游땢游땢",5
mntap kasur y bsar dan lmbut pas buat anak sya,5
"Barang sudah sampai,  sesuai gambar,  pengiriman cepat",5
"bagus, bahan lembut.. mkasih lazada",5
paketnya udah sampek dan bagus sesuai makasih ya sya suka ,5
mantap游녨游쮫릠꽳릠꽳릠꽳릠,5
"barang nya bagus bngt makasih lazada
",4
pesanan nya puas bngt,5
"suka banget, mksh游땘游땘游땘游땘游땘游땘游땎游땎游땎游땎",5
"bagus, empuk dan lembut游땘trm ksh",5
barang bagus,5
good .bahan bagus,5
"barang nya sdh sampai ,bagus lgi 
semoga bisa jdi langanan ",5
"barangnya bagus, oke banget. cepet lagi. makasih lazada",5
"Barang sesuai gambar, kualitas oke",5
cakep dede nya suka dan nyaman.,4
"Alhamdulillah sofa nya bagus 
",5
mantaap sesuai gambarrrr...love lazada..,5
apik banget kasure alias top markotop bgus bngt jgn ragu y beli disini ,5
alhmdllh memuaskan pas dengan kahayang hehee,4
bantal nya bagus recomend banget,5
"realpict yes..
thankyou, pertahankan yaa游녨游낕游녨游낕",5
barang udah smpai tapi belum dibuka.,5
"barang sesuai pesanan dan pengirimannyapun cepat 
pokoknya puas banget",5
"Alhamdulillah..barang nya tidak mengecewakan..
thanks...",5
barangnya bagus baby ku suka bobo di situ.mkasih lazada,5
bagus bahannya ...makasihhh,4
"barang bagus,sesuai dengan pesanan",5
mks sesuway harapan saya sangat senang sekali semoga yg jual selalu seperti ini yg amanah,5
makasih pengiriman sesui pemesanan,5
"bagus
anak qw suka
jadi nyenyak tidur x
",5
bagus,5
real pick,5
good游녨,5
cantik ,5
bgus,5
good laah,5
Baguss bgt,5
"Bagusss sih , tapii isian dalam sofanya kurang banyak jdi kempes dan gak tebal , 游때游때游때游땕游땕游땕游땕",5
bagus sip deh,5
sofa byinya sangat bgus.pknya gak nyesel belanja di lazada...mksih lazada,5
"pengiriman melebihi estimasi dari lazada, barang sebenarnya bagus hanya saja isian kurang padat.",3
"lebih Bagus aslinya, pengiriman nya cepet, yg jualan juga ramah 游때",5
"alhamdulillah barang udah nyampai,  paking rapi barang sesuai pesanan terimakasih. ",5
"mantul
",5
siip good,5
