review,rating
barang dah nyampe tapi saya kecewa denganwarna minta warna biru ko yg di kirim warna kuning ,5
"Barangnya bagus sih realpict cuma salh warna pesan warna biru di kirim warna kuning,lain kalo tolong lebih teliti,seblum di kirim tolong dibteliti dulu. ",5
sdh sampe barang sesuai dgn bambar trims lazada,5
sdh sampe barang sesuai dgn bambar trims lazada,5
"barang tebal, lembut,harga murah,aku senang,pesan lagi 50 pcs kak untuk pasien  covid 19",5
kerenz.. handuk nya jumbo dgn harga terjangkau. kalo beli di luar masih 60 rb an. pdhl kelihatan nya kecil di gambar. seller mantap gan.. ,5
sesuai pas deh sama harganya,5
"barang sesuai gambar
Ok sip
",5
Mksiih..handuknya tebel bagus bgt..,4
Pesan warna navi d kirimnya kuning males banget.. Gde kererangannya besar d kirimnya kecil.. ,1
bagus kainnya tapi kecewa pesen biru dikirim kuning,5
Mantap,5
