review,rating
"allhamdulillaah,,,psenan ny udh dteng td siang,,,
cpet bnged pngirman ny,,,kmren psan hri nee udh nyampe,,,Real pick bnged,,,bhan ny halus,,,the best dch pkok ny,,,
kurir ny jga udh langganan bnged,,,mksih yo,,,",5
Mantap sesuai pict rekomendasi banget terimakasih sealler dan lazada kurirnya juga sopan.,5
"bagus, bahan lembut kurir ramahh..
hatur nuhun",5
"Barang bagus lembut, datang sesuai pesanan.. kurir ramah 
thanks seller",5
barang nya mantap sesuai gambar,5
sukaa.... sukaaa.... sukaaaa  the best pokoknya.  ,5
handuknya pas ccok lgi sma kaya yg digambar,5
real pict walaupun agak kecil g ap lah karna sesuai sma harga,5
maaf br ulas...sesuai pesanan..pengiriman cpt,5
seusai keinginan,5
Makasih sesuai pesanan,5
"handuk nya bagus,,, semoga awet... makasih seler",5
Alhamdulillah ga kecewa,4
"gk sesuai pesanan rijek pula handuknya
",5
"real fick , saya suka banget ğŸ˜ğŸ‘",5
bagus,5
