review,rating
"barang udah nyampe tapi saya kecewa ,tidak sesuai dengan gambar ,kurirnya ramah trimakasih lazada


",2
"Kecewa, krna brang yg dtng tdk ssuai pesanan",2
"Alhamdulillah sesuai dg harganya,,, bagus,, ",5
"barang lumayanlah bisa d pake sesuai harganya. respon jga baik manis /cuma sy agak kecewanya seller g sportip. masa pesan transsksi barang dan pembayaran 4 . pas dikirim di  kurangin 1.  terus g ada tanggung jwb lgi. terus sph yg menanggung jwbnya kl udh begituh?? y emg sih harga brp sih?!!!!!! tpi bukn mslh duit brpa nya ini sih kl kitamh. keseportipan dan menjalin kepercayaan dan tnggung jwb intinya...jngn saling mengecewaknlah.
",4
Brangny tdak sesuai di gmbar modelny kyny handuk prinsip kecewa,5
"Handuknya tdk sesuai dg gambar kecewa sekali, untungnya kurir sdh langganan",5
paket udh saya terima coraknya bagus sesuai pesannan sayangnya tipis tapi saya suka jg terima kasih,5
"alhamdulillaah barangnya sudah sampai ,sesuai dgn pesanan mantap pokoknya dah lazada",5
"bahannya keras, tdk nyerap air


",3
yg dtg ga sesuai,3
pengiriman agak lama klau pakai ninja ,3
kecewa tidak sesuai dengan contoh dan tdk menyerap air,1
ya sesuy  pesanan,5
terima kasih paket ny da d terima lazada walaupun pengiriman ny lama,4
bagus,5
maaf ..kok gak sesuai gambar yaa..yg dateng beda sama yg dipesen,3
sesuai harga,5
"toko yazqurr memang mantapp..
amanahh..",5
"alhamdulilah pesanan handuk,nya udah nganpe.ya lumayan bagus lah harga segitu..terimakasih lazada",5
