review,rating
pesen ijo kenapa yang dteng malah biru,5
"terimakasih.. handuk nya bagus bngat dan sangat tebal.
nggak nysal beli nya. top",5
ukuran nya tidak sesuai.. di deskripsi lebarnya 70cm tapi ternyata cuma 60cm.Belum di coba semoga handuknya nyerap air ,3
"kirain ukuranny besar rupanya kecil,y udah lh smogs aja handuk ini bs menyerap air,dan mintak warna coklat dikirim warna navy tp ga apa2lh ",4
"recommended seller,ini toko top markotop seller nya sangat sangat bertanggung jawab,semoga selalu dimurahkan rejeki nya dan toko nya makin sukses,sekali lagi terimakasih buat seller en lazada",5
barang tidak sesuai foto,3
lmyn.. ,3
pesen warna chlat kirim merah,4
"g sesuai pesanan,minta warna army dikasih biru",5
pesen coklat yg dtng merah.. g ppa.. yg pnting kwalitasnya bagus .. bagus alhmdulillah..,5
barang mantap.  bagus banget,5
bagus mantep gan,5
AlhamdulillahğŸ‘,5
harga dan kualitas sesuai,5
tak sesuai gambar,3
