review,rating
"barang sudah sampai dgn cepat,brg bgs sy suka sekali sama dgn yg sebelumnya,mksh seller mksh lazada semoga amanah trs ya",5
"Alhamdulillah barang nyampe dgn baik, barang bagus sy suka bgt.... trmksh seller mksh lazada semoga amanah trs ya",5
paketan nya udah sampe mkasih bgt kk seler bagus bgt pokonya kpan2 order lagi mksih lazada dan ms kurir ,5
"barang ok bagus,  pengiriman cepet sekali. ",5
sangat bagus,4
"gorden terlalu panjang...tapi oke banget kok walaupun terlalu panjang..
",5
bagus bgt...mantuL,5
"Kecewa banget, barangnya tidak glowing seperti dalam gambar dan pengiriman nya juga sangat lama",5
