review,rating
bahan bagus sesuai gambar...pengiriman super cepat....makasih seller makasih lazada,5
"alhamdulillah gorden sudah smpai.
produk sesuai deskripsi. bahan tebel. jahitan rapi. sesuai gambar. puas bgt. semoga selalu amanah. jazzakallah khair. Dan kurirnya sopan bgt. semoga semua abang2 kurirnya kyak dia",5
Bagus banget gordennya,5
Bagus banget. Recommended Toko.,5
Gordennya sudah datang sesuai gambar dan saya cukup puass trimakasih,5
"Bagus banget,realpict dan kainnya tebal ",5
"Kenapa kirim 1 gorden aja?
Di gamabarnya itu 2!
Penipu ,tida beli lagi dari lazada ,delete",5
"Realpict , thankyou Lazada+GORDENG CANTIKğŸ˜",5
"Realpict, Thankyou lazada+GORDENG CANTIKğŸ˜",5
cantik bgt. nntik aku pesan lagy..... kualitas bagus bgt,5
"Thx gan, goden motif awan sudah saya terima. ",5
bagussssaa,5
