review,rating
Kualitas bahan dan warna sesuai promosinya hanya saja sayangnya ukurannya tidak sesuai dengan yg diminta... yg diminta sesuai order 5XL yang datang 4L... itupun angka 4 nya tulisan tangan...,3
bahan sangaaat jeleek..tipiiis..pesen ukuran 5L harapannya bisa longgar..ini malah gak muaat..sangaat kecewa..mau tukar ,2
mina warna biru yg dtg pink. oceeee,5
sukaaaa ssekaliiiii.....,5
Pesanan sesuai dg gambar... walaupun lebih sehari dr estimasi pengiriman... tp gpp yg penting barang ok,4
kita pesen biru dtgnya merah fanta,5
"bahan bajunya tipis. jahitanya juga kurang rapih, jahitan di hijabnya sobek.. kecewaaa",2
Ukuran baju passs..,5
