review,rating
"oke mantap, makasih lazada, makasih buat kurirny",5
yg ditgu2 akhrna dtng jg wlpn lma bgt ....mudah2n ori sabun bambona.buat kurirnya baik n ramah.mksh sukses sllu ,5
sabunnya ok makasih lazada,5
"barang bangus original,pengiriman cepat,makasih Lazada.,,kurirnya baik ğŸ‘ŒğŸ‘",5
sesuai bngt ,5
"Paket saya terima rapi,  kurirnya jg baik... Kurang cepet aja pengirimanya... ",5
Bagus sama kaya d gambar nya,3
terimakasih.semoga cocok biar jadi langganan,5
pengirimannya cepat,5
"bintang 4 dlu, blom tau hasil nya gimana nanti, semoga ccok ajah",4
