review,rating
"Mf br kirim ulasan,paketnya dah ktrma tp ko sbn bt cuci muka yg dtgnya,psnnya kan sbn bt gatal""emang sm gitu?",5
"paket nya sampai,, maaf telat ngasih ulasan nya.. 
smoga ccok buat aku,,  makasih lazada and kurirnya.. ",5
"maksiih barng udah sampe pengriman cepat gak Lama 
barng bagus sesuay mudah2an aja cocok pertma kali nyoba ",5
"keren ya pengiriman cepat, insyaallah ori , hrga oke  mudah2an cocok .pak kurir ok  bgtt . thank lazada",5
bagus banget asli,5
barang nya bagus relpict,5
top markotop,5
terima kasih,5
barang sesuai pengiriman cepat ,5
selalu puas pesan d toko in pokoknya top,5
selalu memuaskan 😍😍,5
pmblian k 2... sesuai 👌👍👍,5
sesuai brng nya,5
sabun nya wangi dan asli original makasih lazada makasih juga buat kurir nya. bakal langganan deh ,5
Mantapp...👍👍👍,5
maaf baru kasih ulasan enak dipake y semoga cocok trmksh seller trmksh lazada,5
udh hmpir 2mnggu pake v blm ad perubahan😔😔,5
maap br kasih ulasan  sy cocok sm sabun y makay oder lg,5
"original beneran , 1 bar utuh ...😍",5
terimakasih Lazada barang nya sesuai sama yang digambar....,5
mantull sbun nya ori kurir nya juga oke sopan,5
"bgus bgt aku suka bgt,semoga cocok,biar aku order lgi",5
sabunya ori ga usah ragu beli dsini,5
sabunya ori ga usah ragu beli dsini,5
realpic oke banget barang ny ,5
"packing rapi💕💕Tq untuk tokoh nya,lancar truss yah😍😍",5
pengiriman cpt ..realpict ,5
terima kasih paketnya sdh di terima,5
barang sudah sampai .cocok pengiriman juga cepett .maksih lazada😍,5
"alhamdulilah pengirimannya cepet bgt, kayanya sih asli smoga aja cocok sma anak saya",5
Paketannya baru sampe smoga cocok dan kurirnya ramah good,5
"sesuai pesanan, makasih😍",5
okeeee deee ,5
"Paket sudah datang sesuai pesanan,trims",5
sabunnya cocok dimuka aku,5
"Terimkasih barang real pick , Toko amanh bgt sesuai pesanan
Trmksh lazada , Bkl jdi langgan trus dech ",5
"recomended!
untuk bruntusan bisa calm dalam sehari.
tapi untuk jerawat batu agak lama si
wajah saya jadi lebih halus dan bersih baru pemakaian 3 hari👌",5
makasih barang sudah nyampe 😊😊,5
Terimakasih pesenana udah sampai,5
mantap pokonya,5
"terimakasih, sabunya sangat bagus dan original ",5
dalemnya asa beda sama yg biasa beli ,5
cepet banget dateng nya,5
makasih lazada seleler brng y bagus sesuai untuk Abang kurir y udh langganan ramah👍,5
Cuma di pengiriman nya yang lama banget. hampir semingguan,4
cepet barang sesuai memuaskan,5
mantappp...barang ory+harga lbih murce...pkoknya puasss bngt..bisa jd langganan deh..,5
blum di coba smoga ajh cocok klo cocok order lagi kemasan bagus gk ada yg cacat ,5
mksh brng nya sudh sampai..smga hslnya bgus biar jd langganan dsni,5
"Mksih Lazada , top pokonya ",5
paket sabun bamboo charcoal nya enak dpake buat bdn jg....psti bkl bli lagi,5
sabun nya baguss aku suka semoga sukses terus,5
original dan mantap. langganan ya 🥰,5
cocok dng kulit saya jerawat pd hilang,5
"Alhamdulillah sabunnya sudah sampai, kurirnya ramah, udah biasa kirim kesini👍👍👍",5
semoga cocok ,5
ko saya pake jadi ada jerawatnya ya,5
maf baru kasih ulasan moga cocok,5
"dtngnya lbh cpt dr perkiraan barang ori, pengemasan lmyn rapi, ok lah👍",5
"GAK ORI😐AKU UDAH COBA MALAH KELUAR JEWARAT SEMUA !! 😒KESEL BANGET, MALAHAN SABUN KESUKAAN SAYA INI TU!😐😒

",1
fine2 aja sech,3
lom tau hasilnya sehhh,5
mantap..selalu cocok pake produk msi,5
sabun ny wangi tp blm ada perubahan. blm x ya hehhe  mksh seller laz and kurir ny,4
semoga next order lagi kalo cocok,5
"barangnya udah sy terimah  memesannya bagus.. baru barangnya utuh satu 😍😍 makasih banyak
",5
Baru mau coba,3
"udah smpe paket ny' blom coba sih mudah""an cocok...trimakasih 🙏",5
semoga cocok,5
maaf baru kasih ulasan terimakasih,5
"terimakasih Lazada, pesanan saya terima dalam kondisi sangat baik, ",5
"paket sudah sampai, baru mau coba mudah2an hasilnya memuaskan.. pas dipake langsung ke muka kaya masih ada arang2nya gitu, pas dibilas langsung bersih agak glow ",5
Alhamdulillah paket nya udh nympe cepet bngt br pesen kemaren sudah sampai. Mksh lazada and kurirnya,5
Barang nya okee banget...pengiriman nya juga cfet..top fko nya ...ga nyesell belanja di lajada..Abang kurir nya ..juga baikk,5
pertma cb...semoga cocok,5
sabunx wangi pokokx kasih bintang lima,5
Pesen yg ke sekian kalinya gk prnh kecewa,5
bagus ori barang nya,5
makasih buat seller paketnYa udh sampe🙏,4
sabun fuul n mantap ..semoga cocok d wajahku ...kurir.a baik n sabar ,5
allamdulilah barang udah sampai di tempat  makasih lazada,5
baru mau dicoba,5
Brang ori👍👍👍👍,5
"paket datang cepat sekali,  barang asli bagus,  terima kasih lazada. ",5
Barang bagus kurirx baik. Manu terus lazada... Semoga sukses selalu. ,5
biarkan bintang yang berbicara,5
bqgus cocok,5
bagus barang ORI,5
"paket udah di terima,terima kasih lazada",5
trima kasih lazada barang nya sesuai pesanan good,5
blm keliatan hasilny,4
😁😁😁😁😁😁,5
"oke lah sesuai dengan barang nya 
makasih Lazada ?",5
Maanntaaffflah..... ,5
order yg kedua kalinya semoga bermanfaat 😍,5
pengirimanya lumayan cepat isinya penuh kurirnya langganan😁 saya kasih bintang 3 dulu semoga cocok,3
"pengiriman cepat,sabunnya cocok dan wangi",5
"Barangnya ralpic,, smoga cocok aj,,. 
Mksih buat lazad, saler, dn kurirnya",5
sip pokok nya ini udh kedua kali nya order di toko ini bisa jd langganan 👍 God job,5
"bagus,sesuai pesanan,top",5
sesuai dengan pesanan,5
biar bintang yg berbicara ⭐⭐⭐⭐⭐⭐⭐,5
pengiriman cepat packing rapih makasih ka .. sukses selalu.👍,5
maksh lazada,5
bagus.enak d pake nya.lembut.,5
kulit muka saya malah jadi jerawatan ,3
alkhamdulilah dah nyampe buat pk kurir dah langganan ,5
barangnya bagus pokoknya jos,5
Alhamdulillah..sudah dipake n cocok ke wajah aku.. jerawat pun lgsg kempes..,5
barang ok punya top,5
"maaf baru ngasih ulasan,barang sesuai harapan trims LAZADA",4
"baru nyoca blom keliatan hasil nya...
",4
realpick Alhamdulillah 🥰 tencuuu semuanya,5
Oke mantap pengiriman cepat maaf baru ngasih ulasan,5
makasih lazada sabun nyah dh datang moga cocok.. 😊😊,5
datangnya cepat alhamdulillah mudah2an cocok,5
pengiriman cepet bgttttt,5
brpa lama bru ad perubahan ..ko flek hitamnya gak hilang2,5
bagus harum sabunnya,5
Pokoknya mantul nich sabun udh langganan beli disinii kualitas tolng pertahankan,5
paking rapih.brang bagus...kurir ramah ..mkasih lazada,5
produk cocok dengan kulit. bikin berkilau. heheheh. bintang berbicara,5
barang EA dah  yampe barusan mudah 2 cocok makasih Lazada ☺️☺️,5
"Mantappp bangett habis make sabun ini wajh makin cerah kenyall lgii, pokoknya top bangetttt ",5
Alhamdulilah sabunya dah nyampe aku suka mkasih semoga kedepn nya lebih baik lagi,5
Alhamdulilah sabunya dah nyampe aku suka mkasih semoga kedepn nya lebih baik lagi,5
blum d coba.. tp pengiriman cepat..,5
sudah sampai,5
"barang,y udah smpe,,mksh lazada",5
sesuai harapan,5
"Barang bagus, kurir ramah, dan Mudah2an cocok",5
Udah hampir sebulan blm ada efeknya🙃,3
"Pengiriman tepat waktu, moga cocok, nanti langganan, kurir baik udah langganan juga",5
"lupa aplodt

paket nya udh smpai packing nya jg rapi

mantul dh pkok y",5
"Makasih laszsda aku puas banget.cocok

",4
sabun nya cocok banget di kulit aku .. next order lagii ahh🤗🤗😘,5
mantap bangget ,5
Mantap sabun nya,5
Mantap sabun nya jerawat pada kering,5
sabun'y original..sukaaaaaaaa🤗😍bakal langganan,5
Mav y br ksh ulasan sabun ny mang Dr dulu top markotop,5
barangnya bagus realpict recommend lembut diwajah mantep jerawat ilang .,5
sabun nya sdh di trima mksh. ,5
belum ada perubahan yah,3
mkasih lazada ini order yang ke dua kalinya😊,5
sabunny ok..brg bgus rapih..trimksih..kurir jg ramah krna dh langganan,5
barang ok thank lazada,5
sesuai pesanan semoga aja cocok 😘,5
"sabun ny sudah datang,mau coba dlu klu  cocok pesen lgi..",5
"pengiriman nya agak lama, tapi barangnya sesuai 🥰 maaf gak sempet foto",5
mksih pas banget cucok,5
"Pengiriman cepat ,produk ori ... Kurirnya juga ramah ",5
Saya Suka Baru Sekali Udh Ada Perubahan nya ...Tangan Saya Juga Wangii🥰😘,5
barang bagus mantap👍,5
puas banget...terimakasih lazada.. ,5
alhamdulillah paketnya udah nyampai.mudah mudah cocok ya pokoknya barang ori top banget,5
"trimaksih kirimannya sdah keterima maaf baru kirim ulasan 
",5
"barang'a real pict & sesuai dengan k'terangan'a, terima kasih lazada & seller'a 😊..",5
rekoment bgt lah..  👍👍,4
barang real pict,5
paket datang dgn aman tp bisa gak di pake buat anak kecil buat badan,5
"lazada,,,sangat,sangat amanah trima kasih lazada",5
"bagus bgt sabunnya👍
bener"" orii 😍",5
ori enakk dpke. ,5
yg wangian Jang 😅😍,5
barang nya realfict sabun nya wangi penjual nya amanah kurirnya baik terima kasih ya,5
"Maksihhh,tetap amanah ya kaa,semoga cocok dimuka kuuu😍.",5
rapih kemasan nya ,5
ok barang sdh tiba semoga membawa berkah,5
Terima kasih 🤗👍,5
"packingnya rapi,kurirnya jg ramah👍👍",5
semoga cocok...  baru kllie nyoba,5
Semoga cocok ya,5
Best seller,5
Best seller,5
akk dah cocok pke sabun mambo ini trimaksih lazada,5
pengiriman cepat ..sllu langganan d toko ini terimakasih lazada ..,5
mksh brangny dah nyampe..blm dicoba...smoga aj cocok..,5
barang oke banget...,5
semoga selalu amanah Lazada ,5
brang mantap bosqu.,5
petan dah sape sabunnya wangi bgt pasa yg di gambar masnya dah langgan ,5
suka bgt sama produk nya tapi kok pengiriman nya lama bgt😆😂,3
"original, mantap 🤗🤗",5
cepet sesuai pesanan mudah2n cocok....,5
mantap pokoknya kurirnya jga ramah,5
"mantap lazada Barangya tapi pengirimanya dipercepat Sedikit
",5
"Bagus sabunnya ga mengecewakan, pengiriman cepeet 😍",5
barang nya sesuai memuaskan,5
pokonya bagus pake bangetttttttt😗😗😗😗😗😗,5
ok barang ORI ,5
"sabun nya gede,,, mudah2 an ku cocok make nya,,,, bsa order lgi 👍😘
",5
Good barang ori,5
Barang ori...pengiriman ok,5
"Alhamdulillah barang dah sampai, moga cocok ya di pakainya, kurir baik, bungkusnya juga rapi,makasih lazada",5
"udh dateng barangnya, enk dipake nya, semoga cocok di aku, jadi bisa beli lgi disini, pengiriman cepat.",5
"real pict. 
Alhamdulillah dah sampe
semoga hasilnya bagus 
mau dicoba dlu kalo da hasil pasti order lagi😀
",5
"bagus, semoga cocok, tapi pas kurir ngasih ke saya dalam keadaan penyok sabun nya tapi ngk Papa sih bagus sabun nya semoga cocok",5
wah jgn diragukan beli disini mantap amanah bngt sering bei disni tidak dikecewakan pokoknya amanah dah......😚👏👏👏👏👏,5
"semoga sabun nya cocok.
kalo cocok next order lagi.
pengemasan rapi walaupun cuma beli satu.
makasih seller and kurir nya",5
maaf ya ya baru kasih ulasan... barang okeh bigits lah cocok dkulit ku... mksh seller n lazada. pengiriman cepet abng kurir ramah,5
"baru mau nyoba, smoga cocok & smoga bnr2 ori produk'a biar next jd bs langganan,, lgsng cumuk dgn sbn'a prtma x agak perih dkit, mdh2an bs membantu mencerahkan wajah'q,, tp pengiriman lumayan jg yah 4hr baru sampe😌",5
"akhirnya barangnya datang jg mudah"" cocoknya abang kurirnya baik ramah. aku puuaaas belanja d sini makasih lazada .",5
"maaf y mba baru bls... heeheee
paketan mendarat dgn selamat bungkusnya utuh kurir nya ramah saya kasih bintang 5",5
"barang sudah sampai. sabunnya juga sudah 2 Minggu saya pakai Alhamdulillah jerawatnya kempis semoga bekasnya juga ikut menghilang. makasih lazada
",5
"paket nya td sore da smpe, mudahan ccok dan bs jd langganan dtoko ini y.. 
tuk kurir, sprti biasa Sangat Ramah. ",5
"kemarin kalo gak di chat mungkin gak dikirm"" .. saya ngechat lngsung dikirim . dan cepet . tlong buat admin nyaa lebih teliti lg kalo ada pesanan . barang bagus thanks",5
"prodaknya Bagus, say Suka 'nexs saya Alan pesanan kembali,,,  Perbedaan di manah say a pun Ada,  trimakasih prodaknyaah ",5
"Cepet banget nyampe nya🤗uwuww makasih lazada, reseller dan kurir🤗,, belum di cobain sih semoga aja cocok🤗🤗😘",5
"Alhamdulilah udah sampai,meskipun dipemberitahuan paketnya dibatalkan,malah double belinya tapi nda papa ko",5
"maaf baru kasih ulasan,alhamdulilah paket nya sudah sampe kurir ramah sudah langganan makasih seler lazada,dan mba kurir yang sudah anter paketan,..",5
"terima kasih... pengiriman nya cepat sekali... 
Kurir nya udah langganan,  jujur & amanah... 
sabunnya blm dicoba, tp mudah mudahan cocok... biidznillaah... ",5
udah langganan d toko ini.. selalu memuaskan.. ngk prnah kcewa.. pertahankan ya.. smga sukses selalu buat toko ini.. terima kasih lazada.  seller. n. mas kurir 😊,5
"Alhamdulillah pengiriman nya cepat kurir nya juga udah langganan,,mudah mudahan sabun nya cocok dan bermanfaat buat muka ku terima kasih lazada 😊",5
"barang udah sampe, ini yg ke dua kali'a aku pesen tdk mengcewakan pokok' good dah, mudah2an amanah truuusss ya...pngiriman cepet lgii",5
terimKSih pord originL smg ikhtiAr ngilNgin flek bisa cpt hu ilang kurir langganan baik bgt mksh lzAda,5
"Barang sangat memuaskan, realfict banget bukan kw harga lebih ringan, pengiriman cepat.. Pokonya amanah!! 
Next order lagiii🙂",5
"terimakasih paket y dah sampe kemaren siyang, baru ertama kali saya mu nyobak moga cocok ni sabun y buyar bisa jadi langganan",3
bagus...ini udah kedua jaki nya saya beli..barang mulus..paking rapi...kurir nya baik udah biasa nganterin k rumah..makasie lah poko nya bwt lazada..,5
ORI MSI ... Abang kurir JNE top banget udah malam pun masih dibelain dikirim kerumah padahal besok pun tak apa .,5
100% barang rapih dan kurir ramah baik,5
goodddd banget,5
belinya 1 dikirim nya 2🤦🏻🤦🏻,5
barang ok....👍👍,5
mantap.... next order lgi,4
sesuai pokok nya semoga cocok👍,5
"bgus sabun nya wangi LG,,mudah""an cocok ",4
pengiriman lumayan dan kurirnya ramah,5
"sabun nya mantap,, asli bkn kaleng kaleng😇 klo habis next mau order lagi di sini❤️",5
top... bgt👍👍👍,5
barang sesuai dngn pesanan...good job buat kurirnya cekatan ud langganan kurirny.thanks lazada,5
baru dicoba semoga hasil ny bagus..,5
"mantap makasih lazada 
",5
mantul lh poko nya aku suka 😍😍😍😍😍😍😍😍,5
sabunn bguss dan memakay sbun in muka jdi tdak berbinyak dan ta mdah cerawat,5
baru mau mencoba..semoga aj cck..pengirimn n respon seler baik..trimksh,5
uuuu memuaskn,5
sory baru ulasan😊,4
"Allhamdulillah barang udah nyampe baguss sesuai dengan yang digambar, packingnya rapih makasih lazada seller dan kurir:) ",5
"alhamdulillah..paketannya udah sampai
muda2 han coco
makasi lazada dan reseller dan mas kurir nya🙏🏻🙏🏻🙏🏻",5
maaf ksh ulasannya telat..packing rapi & abang kurirnya ramah.sabunnya bagus bikin kulit bersih.thanks,5
"Jerawat saya lumayan agak hilang, dan kulit saya menjadi agak putih👍dari yang sebelumnnya. Intinnya rekomended lah untuk kamu yang jerawatnya banyak",5
"packing rapi kurir ramah barang original, harga mantap, terus pertahankan pelayanan dan kualitas y, aq mau pesan lagi dlm jumlah banyak.. boleh kah sy langsung datang ke toko untuk membeli langsung",5
"barang nya sudah sampe..oke.
tapi saya kurang suka sma kurir nya kalu bisa mah g usah d pake lgi itu kurir nya..g sopan.sma g sabar..",5
trima kasih lazada peket y dah sampai..reyal fik ak suka pakek sabun in walau tidk bikin putih tapi untuk komedo musnah.dan rasa lembut dn enak dipakek...,5
"Alhamdulillah paket nya sudah sampe , makasih lazada & kulir nya pun baik 😁


maaf ga bisa posting gambar nya susah ga masuk"" 🙏",5
"sabun nya ori ,, no tipu2 . enak bgt di pakenya cocokbuat kulit aku yg sensitif.. makasi buat yg jual udah amanah. makasih lazada",5
Akhirnya yg ditunggu2 datang. Packingnya rapi dan pengirimannya sesuai estimasi. semoga cocok disaya. Makasih lazada.,5
"khasiatnya sehari langsung kerasa, kulit jadi lembut lembab ga kering, aku punya alergi juga jadi berkurang jadi sembuh pdhl tdnya kulit suka gatal gatal, pakai sabun ini sembuh, top👍",5
makasih lazada barang nya bagus Peking nya jga rapih kurir nya ramah moga hasil nya memuaskan Iyah 😘😍,5
sabun nya bagus di.wajah mulus.bgt trsvharumnya juga wanggi.bgt pokok nya gg pernah kecewa sama.lazada,5
"Maap baru kasih ulasan, sengaja mau tau dulu hasil nya, dan ternyata bener jerawat ku hilang.. terima kasih. abang kurir nya pun ramah. poko nya bintang yang berbicara...",5
maaf lmbat mosting.mksaih lazada pket ny dah nyampe..biar aga lmbat tp maksih y..mudah2 sabun ny cocok wat istri say..klu cocok sy order lg..,5
"allhmdulilah paket udh sampe, pengemasan sangat rapih, abang kurirnya jg sangat ramah, ga ada bosenya blnja di lazada🤗, sukes sellallu Lazada☺️",5
wangi bangget guys sabunnya harum lembut ke kulit bikin nyaman baadan jadi halus 🤗🤗🤗😍😍😍terimkasih lazada,5
"maaf saya telat memberi ulasan, untuk kurirnya sendiri baik ramah. dan untuk sabunnya sendiri tdk ada perubahan bagi saya bahkan sabunnya pun sudh habis, ",5
Sabunny bnyak nipuny.....nyesel bli sbun ini...ktanybisa ngilngin bks cacar..dipake kmuka perih ....bkin kulit trluka bkin kerin kulit kya sisik ikan,2
"m'f baru ngasih ulasan barangnya dah nyampe, mksih banget, pengiriman sesuai estimasi, kurirnya dah langganan baik sopan, mksih lazada",5
"lebih gede yang saya kira, Saya sudah cek menurut saya ini Ori ya. semoga aja Ada perubahan di wajah Saya:)))",5
"maaf baru kasih ulasan,, sabun nya wNgi mudah""an ccok ya,, trimakasih seler dan lazada juga bang kurir langganan nyai",5
"wahhh,,, real picture sya suka sekali makasih y mb n toko'y amanah no tipu"",,,,buat bang kurir'y udh langganan saya rmah org'y makasih,,",5
Maar baru kasih ulasan ga kecewa blanja d toko ni buat langgam ini si kurir y ramah dan baik trimakasih Lazada 😘😘😘,5
maaf baru kasih ulasan barang sudah sangat rapi ga kecewa deh pesen di toko ni aku kalau pesan LG pasti k toko ni kurir y ramah bgt,5
"Alhamdulilah pesanan udah di terima..cuma yg di pesan buat gatal2...eh yg datang buat jerawat
kasih bintang 3 dulu..",5
mf baru kasih ulasan sabun nya cepet d kirim nya ok bgtt utk toko nya👍👍👍👍 kulir nya ramah Krn udah langganan makasih lazada sukses selalu aminn,5
pengiriman cepat sabun y juga bagus 😍😍😍😍😍😍😍😍😍😍😍😄😍😍😍😍😍😍😍😍😍😍😍😍😍😍😍😍😍😍😍😍😍😍😍😍😍😍😍😍😍,5
"alhamdulilah paket udh sampe,, packing rapi,tepat waktu,kurirnya jg ramah bbget,,, thanks lazada,,,
",5
"baru kasih ulasan alhmdllh dah keterima,, kemarin bang kurir nya sampei ujan""n ,mksh ya bang kurir dah langganan ",5
"pket ny uda datang  alhduliillah cpt gk nunggu lma jd aq suka.kulirnya langganan .smoga cocok sama sabun ini klo cocok dn hilng berjerwat ny saya pesen lgi..

TERIMAKASIH LAZADA ",4
"sory baru kasih ulasan, sabun,y wangi, untuk hasil,y blom tau ya karena baru d pake, thanks lazada ...",5
sabun bambonya udah mendarat dngan aman ..kurir sopan bnget pengiriman cepat trima kasih lazada dan ninja,4
paket ny udh nympe..alhmdllah ini yg ke 2xbeli sabun ini ternyata cocok ..noda htm di wajah mulai pudar ...,5
makasih...sabunnya enak dipakainya...next pasti order lagi...,5
mksh lazada sesuai pesanan wangi sabun nya😍,5
mantap sesuai pesanan... pengiriman a pun cepat,5
barang nya ok punya pelanggan aku suka kurir nya udah langganan makasih lazada ,5
barang nya bagus banget pelanggan aku suka kurir nya ramah makasih lazada,5
Barang nya bagus ga nyeselll deh dan kurir. Nya jga ramah and baik,5
recomended. best seller👍,5
"barang dah nyampe, pengiriman cepet, makasih lazada makasih tokonya",5
amat sangat memuas kan,5
"sangat memuas kan,,saya udah seting order,,dan allhmdllh cocok,,",5
😍😍😍😘😘😘,5
sesuai dengan pic mudah mudahan sabun nya cocok diaku nya makasih seller dan lazada dan abang kurir nya juga ,5
kasih bintang 4 dlu kalo nanti bgs hasilnya baru bintang 5,4
oke sesuai pesanan,5
brng dah Sampek dlm nya top dek amanah bgt  kurir nya langganan,5
sesuai pesanan👍🏻👍🏻,4
Alhamdulillah. cepet pengirimannya.,5
Lumayan bagus,4
Realpict. Memuaskan sekali😍,5
sesuai pesanan,5
sesuy pesanan,5
"maap br ks ulsan sabunya ori cuma mukaku ngk ccok jd jerawat, tp brg bgus bgt top markotop",5
"pengiriman cepet, mudah mudahan cocok sabunya",5
barang natul,5
Bagus bagus bagus bagus ,5
Alhamdulillah sesuai pesanan 👍👍 kurir biasa aja,5
"beli yang ke 3 kalinya alhamdulillah cocok, kurirnya rama",5
terimakasih,5
"Semoga membawa hasil yg maksimal,,nanti pesan lagi kalau sdh cocok
",5
bintang yang berbicara 👍,5
Thankyou for seller.. Suka bngt barangnya dan cpt bngt pengirimannya,5
"Pngrimn cpat ,,smoga produk ny ori...",5
Tanks barang sudah sampai semoga cucok,5
realpic barangnya trus abng kurir udh langganan n sabunnya wangi banget..👍,5
pemesanannya cepat dan sesuai dgn keinginan saya...dan kurir nya jg baik dan ramah,5
Top bgt brgnya ori,5
"sabun'y wangi, semoga cocok yah....trmksh seller dan lazada....",5
"semoga cocok, trima kasih",5
Good. Pengiriman jg cepat. Tks,5
sy ksh 4 dl..karna blm dcoba..smoga cocok jd bs order lg...,4
recomended ,5
terima kasih paket nya dh sampe cepet bngt ya kurirnya juga dh langganan trims,5
semoga cocok yaa kk dengan sbunnya,5
"udah sampe
",5
barang nya udh keterima .. blom d ak coba moga ajha cocok,5
"maaf br ulas... ini dh yg k 2 x ny aku pesen,alhamdulillah cocok n suka bgt sm wangi ny... 🤗😘",5
"semoga ajj cocok d muka sy baru pertama pake aambun bamboo.mksh lazada
",5
alhamdulillah paket udh samp...mas kurir baeee bngt...alhamdulillah hasil nya bagus dwajah aq..,5
barang nya bagus,5
"thanks barang sudah d terima
",5
"baru pertama pesan.. smoga cocok yaa..
mksih Lazada..",5
maaf baru kasih ulasan sabunya ORI guys dwuh nyesel baru beli sekarang makasih ya lazada,5
"Barang bagus sesuai dengan pesanan , makasih lazada selalu Amanah",5
mksh lazada paket.nya dh sampai ,5
real pict 👍👍👍,5
"pengiriman nya lama banget🤦‍♂🤦‍♂🤦‍♂

",1
Pengiriman cepat..real pick..kurir baik dah langganan..terima kasih,5
"mantul.pokonya mh nie sabun, udah order yg ke 3xnya, sabunya bagus wangi terimakasih lazada",5
mantull asli banget ,5
Tolong pengemasannya agar lebih sefti lagi,5
Sabun.a bagus,5
"jl bs LBH ceper Lg 
",3
mantull pokoknya.. mff baruu kasih ulasan skrg😁paketan rapihhh kurir juga ramahh semoga jadi langganan yahh,5
"Paket Udah Aku terima, smoga cocok, Kasian mas kurir2 walaupun kmlman dia ttp ngnterin sampe rumah, Thank mas kurir yg baik",5
Alhamdulillah barang y sudah sampai sabun y utuh kurir y ramah bgt trimakasih lazada saya sangat puas blanja d lazada😘😘,5
"maaf baru kasih ulasan... setelah bberaa hari di pake sabun nya enak banget, cocok di wajah aku... makasih yaaa sudah amanah no tipu tipu ",5
"bintang 4 dulu deh soal'y baru pertama x pesan, alhmdulillah barang nyampe tepat waktu... makasih lazada",4
"puas bangettt blanja di toko ini ,saya sudah order kesekian kalinya poko nya sesuai dech real fict bangettt thanxs ya semoga toko nya makin maju ",5
"makasih lazada saya senang belanja dilazada,produk y sesui dengan gambar,mudah2 sabuny cocok Jadi bisa langgan,buat nang kurir y makasih banyak udah nganterin paketan q....thanks you",4
Alhamdulillah..anakku yg balita biang keringatnya yg susah bngt hilangnya..pas menggunakan sabun bamboo dngn rutin ga pernah muncul lgi..gatal2 hilang..anakku yg remaja juga make..sy juga make..buat langganan toko ini y..habis slalu pesen lgi..mksih lazada🙏😍,5
"Paket nya cepet bngt nyampe nya, cuma 1 hari, alhamdulillah mkasih lazada yg selalu memuaskan mas kurir nya juga dah langganan, maaf ngasih ulasan nya telat, pertahan kan kuwalitas dan amanah nya",5
"alhamdulilah sabun nya bagus..ini ngorder yg ketiga kalinya..cepat jg pengiriman nya..kurirnya jg ramah ,jd langganan di lazada....",5
"ke 2x nya ga kecewa mantep banget mantul pokonya datangnya punn cepet pokonya bintang yang berbicara , pertahan kan sprti ini terus ",5
"sabun telah di terima dengan baik,, sudah 2 kali sy beli di sini alhamdulilah tidak mengecewakan sy sangat senang 😊😊",5
"sabun nya udah nyampek cepat sekali
moga aja cocok ",5
maksih paket nya udah sampe...kren,5
teop de lazada,5
Barang sampai smoga cocok ,5
sabunnya bagus rekomen banget ,5
Barangnya udah tp saya blm coba,3
Mksh sabun nya. maaf gan ga smpt foto BKN pnya saya pribadi pesenan orang mksh smga skses sllu,5
cepat sampai.. kurir langganan.. ramah santuy banget.. ok deh ,5
sabun ny bgus bgt bkin kulit lmbut dan wangi😊😊,5
"mantull sabun ny,pengiriman cepat😊",5
semoga cocok,3
sangat baik sekali,5
Mksh lazada pesann nya sudah smpe semoga sabun nya cocok di muka aku,5
"mudah""an cocok sabunnya dgn keinginan aku, terima kasih lazada",5
lama datangnya barangnya,5
"Trimakasih, pketnya da nyampek, sesuai pesan👍",5
Paketnya sudah sampai kurirnya jg ramah trimakasih lazada,5
"barang nya sudah nyampe,cuman pengiriman lama bnget hampir kecewa",5
"barang sesuai pesanan,mantap",5
paket dah mendarat dan ga kurang toko nya amanah pertahan kan teruZ ,5
mkasih lazada kulit sabunya cocok untuk kulit saya,5
makasi dah nyampe,5
"alhamdulillah paket nympek,telat",4
"barang ok,,cma pengiriman agak lama",5
"brg sdh ditrima..
makasih lazada..
👍👍👍",5
mksh barang cpt sampe pengemasan rapi sabun y ori kurir ramah mksh lazada n seler,5
mantap,5
"alhmdlh pengiriman sangat cepat,paking ny rapih,kurir ny juga sopan,d coba dulu y sabun bamboo msi ny mudh2an cocok,trmks lazada ",5
"barang sampai dngn Aman, packing rapi,,,
alhamdulillah ad perubahan yg baik,,,
kurir sopan,pengiriman tepat waktu🙏😊",4
alhamdulillah brang dah nyampek...kurir x juga ramah...sesuai ya kak pesanan saya...makasih lazada puas brlanja di sini,5
"maaf sya ko ga ccok ya pke sabun bamboo mlah tmbah jerwatan awalnya sh ga jerawat sy mau cb buat ngilangin flek tp yg ada malah jerwat yg tumbuh,kurir baik cepat pengirimnya ",4
"sabun'a wangi d badan bwd gatel"" d kulit ampuh jg loh, kemarin kulit leher kena herpes luka'a hampir sembuh n agak gatel gtu..terus coba mandi pake sabun bamboo allhmdlh GK gatel lg loh
",5
