review,rating
"Alhamdulillah barang udah nyampe , kirain lama dteng nya . eh ternyata cepet cuman 2hari . thanks lazada",5
"alhamdulillah udh 2x blanja dsini gak prnah kcewa, brang sesuai, cma skrang pngiriman agak lambat dri biasanya, tpi gk ppa trimakasih lazada",5
"makasih ya sist. baru pesen kmaren hari ini udah sampe. 
pas nyampe sore pas bnget mau mandi sore sabunnya wangi dan seger, smoga cocok ya dan klau bagus dan ampuh psti pesen lagi. Thanks

cepat dan rapih",5
"Untuk produk original. hanya saja menyayangkan sikap kurir, kalau bisa ganti expedisi saja barang di titipkan di oranglain tidak sampai ke tangan saya langsung.. itu sangat buruk!",5
"alhmdulilh paket yh dah sampe sabun yh wanggi mudah"" hn jerawat ku bersih kurir yh dah langanan mksih lazada ",5
"Alhamdulillah pengiriman cepat kwalitas terbaik,, sesuai amanah mksh reseller n bang kurir'y the best 👌,,nnti next order lg👌",5
"brang sampai dengan selamat, pakingnya rapih alhmudlillah ngak ada yg cacat pokoknya bakalan jd langgan deh😁
maksih buat kk leselrnya ramah dan bg kurirnya udah langganan dehhh 😍",5
"lusuh bgt kena ujan😢kasian mba kurir nya kehujanan...makasih yah lazada brang tdk cacat hnya bngkus nya aja yg lusuh kna air hujan.mba kurir nya makasih dah bela""in pas lg ujan dres😍poko nya seler nya amanah aku dah langganan d sini dah sering blnja d sini...dan makasih mba kurir,n makasih lazada😘",5
Sabun Nambo carcol udah nyampe...semoga cocok bwt semua keluarga ku..mas Kuril yg nganter nya semangat bang...,5
"Allhamdulillah udah sampe blm coba semoga ajja cocok dengankasiatNya kalo top saya tambah bintang dan orderLagi....makasih seller dan lazada Abangkurir laNgganan kenapa kaga darikemarin ajja sekalian paketNya😂🙏
sukses terus buatsemua yg selalu jagaAmanah😘😘",3
thanks lazada...barang dah sampe cpt bgt...real pict jg...mas kurir dah langganan...pokoknya top deh,5
sabunnya sudah datang langsung dicoba... beneran bagus sabunnya dimuka terasa halus terlihat lebih cerah... pengirimannya juga cepat banget... kurirnya sudah langganan...,5
Barang sesuai dengan pesanan dan terdaftar di bpom...Baru pertama coba sabunnya wangi dan lembut dikulit mudah2n cocok ,5
Sumpah... Pengirimanya cpt bgt.. Barangnya real sma kyk digambar... Gak nyesel belinya... Cma produknya blm dicoba.. Mudah2an cocok... Trma ksih seller dan lazada... Kurirnya jga ramah.. Pokoknya top lah untuk toko ini 👍👍👍,5
"paketan mendaarat dg baik sempurnaaa.... 
terimahkasih lazada kuu makin cintaa 😘😘😘
buat kurir nya thanks Yaa selaluu ramahh ",5
"pesanan sampai paking aman ,saya kasih bintang 4 dulu soalnya belum dicoba semoga cocok dan hilang bekas jerawat nya flek hitam ,nanti kalau cocok order lagi makasih 

",4
"alhamdulilah cepet banget datang nya ini orderan ku yng ke sxn kali nya ,trima kasih buat toko ,N bang kurir nya🙏",5
"paket sdh sampai,paking rapi,pengiriman standar,tp blm bnyk perubahan,trimakasih lazada jg bwt tokonya,tingkatkan trs pelayanan dn kwalitas brng 🙏",4
"barang nya sudah datang sblm estimasi😊 mksih yaaa buat abg kurirnya , sma Tokonya jg smoga lancar dn sllalu amanah
estimasinya tgl 3, tp tgl 1 udh dtang alhmdulillaj",5
top banget poko nya seller dan lazada amanah banget barang realpic dan utuh bang kurir nya jg ramah sukses ya,5
Thank lazada paket nya udah dateng..packing nya rapih pake bublle warp pula..abang kurir nya ramah..semoga aku cocok pake ini ,5
barang udah sampe mksh seler lazada jg kurirnya sempet sms dulu karna blm ketemu kita mdh2an cocok sabunnya dan berkhasiat aamiin,5
"Alhamdulilah paket sudah di terima,baru mau nyoba pake sabun msi ini,semoga cocok,kurir ramah sudah langganan,terimakasih kk kurir dan kk seler",5
"mksh lazada, sabun colet nya udh nyampee,, wangiii😁😁😊😊😂😂😂😅",5
👍👍👍👍👍👍👍👍👍👍👍👍👍 recommended . terimakasih 🙏🙏,5
sampai dgn slmat..bru prtma coba smga cocok....dan kurirnya ramah ..terimkasih lazada,5
pengiriman cpt cuma 1hari.. sabun nya satu btg full  ❤️,5
dh nyampe kak mksih barang bagus 👍👍👍,5
"sesuai pesanan...

terimakasih lazada",5
barang nyampe ...mudah2an cocok ,5
alhamdulillah sdh mendarat smoga cocok...mks lazada om kurir nya baik jd langganan dehh🤭🙏,5
Paketnya udah sampai 🙏😊sabun nya sesuai deng yang di gambar terimakasih Lazada 🙏😊😊GBU😇,5
"Mantap mendarat dengan aman, packing rapihh",5
trimaksih ordeer yg ke 2 pesenan sesaui  & bg kurinya jg langganan,5
"mksh barang dah saya trima,moga bermanfaat,dan ada hasilnya.m",5
"cepet bangettt 🥰
",5
"paket nya udh nyampe kemarin sore, langsung di coba sabunya lembut juga Wangi suka pokonya mah. ",5
Mantap realpict,5
"Makasih lazada,,sabun nya realpick pengirimnya jga cpt nextime order lagi",5
Sudah nyampe thanks bngt,5
paket sudah sampe terima kasihh Walaupun pengiriman nya agak lama heheh,5
Packing nya rapii yaa mudah²han aja cocok buat kulit aku😍😍😍,5
barang sesuai n memuas kan.,5
"Sudah sampai sesuai pesanan dan full 1 kotak . Next mau order lagi, terimakasih",5
realpict ya gaesss makasih reseller dan Abang kurir,5
"mkch ya lasada n but krirny???
brangny real pick trbungkus rapi pula
tdk ad yng cacat pula.",5
"alhamdulillah barangnya sampai,senang sekali",5
alhamdulilah paket telah diterima dan ternyata hasilnya memuaskan dan brangpun ori bkn plsuu😘,5
Alhamdulillah syudah sampai terima kasih 😊,5
Biar bintang yg berbicara. ,5
"barang nya ori mantul dah. kuruir nya jga baik, ramah jga",5
Allhamdullliah sabun bambo x dah datang .Makasih lasada makasih jg mas kurir 🙏,5
"terima kasih barang sudah di terima sesuai est 
",4
"fleknya gak ilang2, padahal udah rawat bangat.",5
"paket sabun nya udh sampe alhamdulillah...semoga cocok aq pake sabun ini ..klo cocok pasti aq berlangganan d toko ini.untuk packing nya rapih..sabun nya jga sesuai dgan d gambar.kurirnya baik, sopan.trimakasih untuk seller dan lZada dan untuk mas kurirnya.sukses slalu",5
"terimakasih lazada manap pokonya mh.. makasih juga buat kurirnya
",5
amanah yaa. terima kasih lazada. terima kasih juga untuk kurirnya yang baik dan ramah,5
sabun nya udah dateng mudah2 cocok..pengiriman nya cepet trima kasih lazada👍,5
Barang sampai juga tidak ada yg krg satu pun packing rapi,5
ternyata bener 1full..😍😍,5
terimakasih barang nya sudah datang sesuaiy pesanan,5
sudah order yg k 2 kali nya..sllu puas sma barangnya👍❤,5
mksih y ka 👍🙏,5
"Wow mantap! ini tuh bnr.n 1 batang full.👍
makasih seller, makasih lazada!",5
alhamdulilah sudah sampai mudah mudahan cocok,5
sesuai 👌👍👍,5
"sudah sampai, smoga cocok",5
semoga cocok🙏,5
barang memuaskan packing rapih kurir ramah pokonya puas belanja di toko ini😍,5
 sabun nya wngi  baru mau di coba kalo cocok pasti beli lagi,5
paket sudah mendarat kurir dah langganan mudah2n sabunnya cocok di kulit saya..,5
terimakasih barang sudah datang kemasan rapi pake bublecrup..semoga cocok di anakku 😊,5
"alhamdulillah..paket nya udah saya terima.
ori lagi..persis kayak punya drumah..😍😍😍
puaa pokok nya. pengiriman nya juga cepat..",5
"pengiriman cepet, semoga cocok",5
mantaapp harga dan barangnya sangat memuasakan... makasih sellerr makasih lazada.. 😚,5
puuuuuuuuuaaassssssssa👍👍👍👍👍👍,5
udah sampai🤗terimakasih,5
ini yg keenam kalinya saya beli sabun saya suka relfick bungkusnya jg rapi terima kasih nanti kl udah abis sabunnya order lg ,5
sabun baru sy coba buat beby sy ini beneran 1 batang ful...nt sy mau pesen lagi...kulirnya udh langana,5
"sabun. nyah udah sampe dengan selamat baru mau coba mudah""an cocok ",5
"udh nympe packet nyha, moga aja cocok ",5
terima kasih udah saya terima  sabunya  semoga cocok dan kulir nya juga baik dan juga tetangga saya kulit nya juga 👍,5
"Maaf kaa sebelumya , saya pkai sabun iki bekas jerawat hilang , Tapi kemarin saya buat maskeran kok perih Trus kulitnya malah kering Nglupas Jadinya gosong . Ini knapa ya kak??",5
"maaf baru kasih ulasan, barang sesuai pict, mantul bgt deh, makasih lazada, mkasih seller bisa jdi langganan nih.... makasih kurier nya udah langganan juga.",5
.udah 2x beli d sini...tpii Masyaallah 😍 .barangnyaa bgus2 tdk ada yg cacat😍😍😍 ..yaaa walaupun pengiriman yg ke-2 agak telattt🙁,5
"sabun nya udah sampe,sabun original sdh terdaftar bpom pula,semoga cocok buat suamiku😁klo cocok insaallah pngn pesan lagi disini,pokoknya puas deh mksh seller jga abang kurir jne nya yg ramah👍",5
barang sudah sampai kemarin...barang nya bagus..baru satu kali pake ntar kalo sambun nya cocok saya pesan lagi...kurir nya pun Tetangga saya😅,5
"alhmdulilahhh barang sudah sampaii .. 
dan kulirnyhh baik lagii .. thanks lazada😘😘ngk sia² aku pake sabun ini",5
makasih barang nya udah datang bungkus nya raou ga ada yg kurang..makasih buat yg nganterin nyabjuga baik,5
"barang sudah sampai sesuai pesanan, pengiriman sesuai tanggal pengiriman.. dan kurirnya ramah.. mksih untuk seller dan lazada..",5
pas sabun nya dateng langsung di coba buat cuci muka ternyata lumayan bagus sabun nya udh gtu dimuka jg enak semoga aja cocok sm sabun nya soalnya baru pertama kali pake,5
"kurir nya udah langganan nyampe nya cepet bnget kurang dari estimasi ,sabun nya bagus aku udah cocok sama sabun ini dan sabun nya pun sampai dengan selamat packing nya super rapih aman pula karna pake bubble crap jdi gak takut patah sabun nya pokok nya puas deh ",5
"terima ksh sdh smp sabunnya,sangat amanah sekali...semoga muka sy bersih dr jerawat dan flek hitam🙂",5
"alhamdulilah pket nya tlah smpai,dngan hrga segitu dn maanfaat nya bnyak bnget
ya wlaupun sya blm coba🤭🤭,smoga cocok
terimakasihh😊😊",5
alhamdulillah..barangny sdh sampai bner2 ori..sukses trus buat tokony..buat kurirny baik terima kasih..,5
"sabun ya asli di jamin gk kecewa anak"" aku pake sabun ini bersih badan ya gatel"" ya ilang gk kecewa sm prodakya dn lazada ya kurirya juga baik cpt pengirimannya makasih lazada nanti saya pesen lg y",5
"maaf Bru ksh ulasan bis coba dulu bos ku alhamdulilah ada reaksi dibadan enak g.terlalu gatal pokonya rilgood 👍deh mudah mudahan bermanfaat ya buat toko sukses🙏
",5
mksih ka psanAn udh nyampe.. produk SGT bgus sabunnya ori harum LG.. moga z cocok buat suami sy..  pokonya puas deh..,5
makasi mbaa sabun bamboo nya udah dateng.  langganan deh pengirimannya cepet walaupun cuma satu. 👍 sukses sllu buat seller.. ,5
"ahkirya yg di tunggu2 sampe jga,,
mudah2n aja ccok pke ini,,,
mkasih lazada,mkasih jga mas kurir langganan yq ramah+sopan,,,",5
mf baru ksih ulasan..pket udh sampai mksh buat abng kurir.mksh jg ladaza..moga berhasil pakai sabun ini,5
"terlambat memberikan ulasan nya,,maaf buat lazada,,packing ny rapi,kurir ny ramah,walaupun proses pengiriman agak lama,tpi puas dengan hasil nya...terimakasih lazada....",5
Sabunnya oke.. Harganya sesuai de ngan isi dompet... Jangan di naikin lagi y harganya biar pelanggannya makin banyak... Trimakasih lazada,5
"barang da sampe. barang oke. sales langganan. baik, ramah pokok,y top dah. buat yg laen klo mau belanja disini aja.",5
"terimakasih lazada pesanan sdh saya trima dgn cpt
kulirnya juga baik... sukses dech buat tokonya juga lazada  👍👍👍",5
"Sabun nya udah dateng tadi siang sekitar jam 11, ori ya tadi sore udah di pake😁, di kemas dengan sangat baik, isi nya pun masih sangat bagus sekali, terimakasih untuk pelayanan dari toko ini sangat memuaskan😍👍, kurir nya pun udah langganan 😁",5
mantap,4
paketnya udah datng pngirimnnya rpih cepet juga.. sabunnya cucok meong real pict cocok bgt di muka aku mksh lazada next time aku order lg.. 🙏👌👍,5
"Paket udah nyampe, makasih lazada & seller, sangat puas tpi pengiriman tumben agak lambat, mas kurir langganan sangat ramah",5
"maaf baru kasih ulasan,karna qu coba dulu sabun nya,,memang lembut d kulit wangi lagi,kulit baik makasih lazada n seller👍",5
paketnya udh datang.. ORI.. kurirnya jga temen suamiku 😃 next order lagi.. trimakasih seller terimakasih lazada,5
"sangat puasssss,,,pengiriman cepat,barang realll,,kurirnya dah langganan..makasih lazada ..pertahankan.!!
",5
keren produknya rapih kemasan nya itulah mengapa saya selalu pesan di lazada kurirnya juga ramah tapi sorry saya sedikit cuek karna saya LG main game😁,5
sudah order yg ke sekian kali nya . tidak prnh kcewa.. brg baguss muluss dan mas kurir nya sllu nympe dpn rumah.. terima kasih lazada.. seller n mas kurir selalu pke bubblewrap pula,5
"suka bnget amanah sabun nya satu batang ga tipu2,, prtahankan yaaa ka biar konsumen smkin puas n ga kapok lg,, respon cpet juga pokonya debess ",5
memuaskan..sabun nya original wangi lagi smoga cocok di pakainya..di bungkusnya pun rapi..trima kasih lazada,5
"bener"" cocok bgt sama sabunnnya,untuk yg ke 3x aku pesan dan sllu puas dgn barang yg ori
ini aku kasih testi selama pke sabun bammboo",5
aku udah berapa kali pesen dan memuaskan banget packing nya rapih pokoknya nggak ngapok buat pesen terus 😘,5
"mau cerita duku doungs aww><
kan aku punya bibi trus namanya ela dan nama ela dikampung aku ada 2 klo bibi aku rt 02 klo yg stu lgi rt 03 nah teh ela yg rt 03 dia kaj psn sabun ini trus kurirnya mlah dteng kerunah bibi aku'(mungkin karena bibi aku sering bngt blnja dilazada jdi kirainnya sbunnya pesenan bibi aku trus kurirnya gliat rt² nya jdi slah kirim deh pketnya yaudh pketnya udh dibka sma bibi aku yg stunya bi nia ehh pas bibi aku bi ela udh pulang kerja dia kgt trus bilang
perasaan bibi gapesen pket ehh bnr pas dibca rt nya juga beda tdinya sih mau dikembaliin keorgnya tpi nomor hapenya udah robek jdi gbisa ditelpon yg punyanya yauda sma bibi aku dipke aja🤣bibi aku sma mamah aku kgt nasa sabun ini harganya murmer bngt🤩😽😭klo kata mmh aku harganya mhl bngt klo dipsr yaudh weh mumpung disini murah aku pesenin sbunnya ehh pas dtg allhamdulillah dong brg bgus bngt udh gitu brgnya udah aman dipakai udh bpom lho yuk dripada mahal beli dipsr mnding bli ditoko ini murmer bgt dn bgus💖",5
barang nya udh sampe.cepet juga kiriman nya.maju trus lajada udh langanan..kurir nya juga udh kenal.,5
terimakasih ...paket udah di terima....dan lebih cepat yg harusnya tgl 6 ternyata tgl 5 udah sampai...puas..jasa pengiriman ok..👍,5
"maaf baru sempat kasih ulasan.,, barang sudah di terima, pengiriman lebih cepat dari estimasi, sudah di coba enak di muka, kalau cocok flex hitam di wajah hilang nanti langganan,, ",5
"thkz
",5
"Alhamdulillah barang sdh smpai, sesuai pesanan, maaf baru sempet ngsh ulasan, terimakasih lazada sukses slalu..",5
mksih lazada  barang sesuai pesanan 👍,5
sesuai pesanan pengiriman 3 hari doang ,5
Alhamdulillah paket udh nyampe baguss sesuai dengan yang di gambar packing ya jga rapih makasih Lazada seller 🙏,5
"MAap baru ksih ulasan,alhamdulillah sabun bambo y dtng tpat waktu ,aq ska sma sabun y,udh abis 3 sma ni loh.mkash lazada....",5
lop😍,5
"wanginya beda ya sama pertama x order ,,kenp tiap pertama x pake kulit jd beruntusan n
  kulit kering 
",4
telah diterima sabun bambunya trimakasih..cepat pengirimannya.untk seller...Laz...curir...sucses terus ya....,5
maaf baru kasih ulasan🙏 sabun nya realpict tapi udh mau 3minggu blm ada perubahan juga☹️berentusan di dahi ku masih blm hilang malah numbuh trus jerawat,3
"barangnya bagus sesuai gambar,kurirnya ramah,pokonya bwt lazada top bangeeeet amanah gk pernah kecewa stiap blanja d sini,👍",5
pengiriman sesuai tgl dan barang datang sesuai pesanan..paket rapi....klu hbs mw pesan lg....mksh lazada...,5
"sabunnya wangi,pengiriman cepet,dan sabunnya gede haha,,, biasanya sabun buat muka tuh imut2 bentukannya.. ok sekian review dari saya, makasih seller ntar kalo hasilnya bagus pasti beli di sini lagi dah",5
"Maaf baru kasih ulasan, soal'y coba dulu dan alkhamdulillah ada perubahan jerawat mulai kering semoga cocog",5
🙏🏻maaf bru kash ulasan paket nya udh datang sesuang gambar tpi saya belm coba mudh2cocok  makash lazada mkash seller..,5
"Ma,af baru ngasi ulasan sekrng,udah abis satu ko gk ilang y jerawatnya,tapi sy coba satu LG barang kali klo udah abis 2 jerawatnya bisa ilang.",3
"Akhirnya barangnya meluncur dengan aman,  Terimakasih Reseller the best pokoknya... 
nggak nyangka sabun ya bener"" Ori sekarang jerawat aq makin hilang 🤩 👍 ",5
sabun bagus muka sy uda keliatan bersiiih nya Tx ya..kurir nya biasa ya uda langanan sy ya gus hehe ,5
bismilah mudh2an cocok sm sabun ini utk ngilangin milia d bwah mata aku 😥 skrg bru mau coba .. klo cocok next order lg jd langganan tp d liat dr sabun nya sih enak lembut sm wangi ☺,5
"pengirim nya lama ,tapi barang sampai ke konsumen dengan selamat dan gak tau itu sabun nya cock apa gak soal nya belum saya coba ",4
"cocok, gabikin kering..
pemakaian juga harus 2x/sehari, terlalu sering cuci muka bukan jadi bagus malah bikin iritasi sampai jerawatan juga loh, inget tuh",5
pokok nya best.. aq repeat orderrr terus.. ,5
sabun ya bgus bnggt maaf baru ksih ulsan,5
"alhamdulilah nyampe,ini yg ketiganya kalinya aku pesen barangnya bagus sesuai gambar ",5
"Edun pisan,
pengiriman super cepat

auto langganan",5
tanks lazada dan sellernya ..paket nya sudah datang tepat waktu dan packingnya rapi,5
good,5
alhamdulillah pketx sdh tiba sesuai sgn pesanan s. cmn sdkit kecewa face mitsx tertumpah lain kali d kemas dgn rapi yaa mbk. ksian kn klw tertumpah. kurirx baik ramah. mkasi lazada,5
"baru pertama x order disini Mantappp pengiriman cepet bgt 👍👍👍
Sabun nya jga ORI 
klo pengiriman cepet lg nnti aku pesen disini lg klo sabun nya abis
Makasih yaa Seller semoga sukses selalu 🙏
🌟 🌟 🌟 🌟 🌟 tuhh aku ksih 5 bintang lg jdi 10 karna tidak mengecewakan 👍👍👍",5
baru kasih ulasan barang nya udah nyampe dari kemarin sore sabun nya ORI pelanggan aku suka kurir nya ramah udah langganan makasih lazada,5
"pengiriman cepat,,semoga ccok ya next order lagi..mkasih seller ",5
udah 2x order selalu puas mksh lazada dan toko sabun nya asli jerawat yg asalnya parah sembuh ,5
mf kak baru kasih ulasan. pokonya mantulll banget sya udah brp x pesen sabun bambo dari toko ini dan semuanya sesui harapan pokonya zoss...!!!! makasih lazada maksih juga buat seller nya. semoga tambh maju dan sukses usahanya y ka... amiinnn allahuma amiinn,5
"barangnya datangnya cepet bangett🤗,pdhal pesennya minggu pagi tpi ttep diproses.baru pertama kali pesen sabunnya mudah²n cocok.trimakasih seler,moga lancar usahanya.amiin",5
"terimakasih lazada...bagus lho sabun nya ori 
next pasti jadi langganan...cocok di kulit saya yang sensitif",5
beli untuk kedua kaalinya ga kecewa cuma pas sampe kadusnya udah sobek satu tp dlmnya g knp napa,5
"barang sesuai, kondisi barang bagus, datang tepat waktu. kurirnya juga ramah. 
good 👍",5
maaf baru kasih ulasan sabun y utuh ya udah di pake lumayan enak di muka...semg sll amanah y lazada.ga kecewa pokok y mah,5
"alhamdulillah sabun nya mendarat dengan selamat kurir nya pun ramah....tapi maap mau tanya EXP nya ko di tutup pake spidol jngn"" kadaluarsa",5
"udh di trima ... mudh ""n cocok di muka ku .. makasih lazada ... makasih buat kurir yg baik & ramh banget ",5
Alhamdulialh barang udah sy terima peking rapih cepet pula kurirnya jg ramah sy udah beberapa x bli sabun ini alhmdulialh cocok pokonya memuaskan,4
"paket tiba sesuai estimasi, pengemasan rapih dan aman, produk cocok sebagaimana dideskripsikan, sip pokoknya. Terima kasih.",5
barang alhmdulillah udh bbrpa hari yg lwat nyampe tp gw cuma mau liat hasilnya dan hasilnya memuaskan 😂 gilasih 2 hari pake langsung ngefek di muka makin cerah tp bgian lain belom ya sabar aja kali ya dan ttp pemakaian rutin thx seller and thx lazada 💞,5
"pekingan sangat rapih dan kurir nya ramah semoga  langganan truss lazada 

sabun nya juga wangi bngett semoga cocok 😊",5
"terimakasih lazada sudah sampai sabunnya, pengiriman cukup lama tapi memuaskan kok😊 bungkus paket rapih tapi unik..",5
"Maaf baru ksh ulasan,paket dah mendarat dngn selamat kurirnya jg baik dan ramah dah sering belanja d lazada gak pernah kecewa semoga selalu amanah👍👍👍",5
"alhmdulilah pesanan sudh sampei terima kasih lazada.. paket utuh. dan ori bingit barangnya. 
thanks.. 😊",5
"barang datang sesuai estimasi,paking rapi dan bagus,selalu pertahankan kualitas nya",5
bgus ccok diwjh saya,5
barang sudah keterima semoga hasilnya bagus ta,5
Terima kasih sist packing nya rapi dan sabun nya sudah saya check original,5
"paket nya sampai dengan rapi dan aman
kurir nya sopan dan ramah
sabun nya enak di kulit wangi nya mantul 

semoga cocok dan semoga sukses terus ",5
"alhamdulillah udah sampe td sore,packing rapi, semoga aja cocok..terimakasih lazada (nama tokonya q lupa).buat pak kurir terimakasih ya bestfriend forever&baik banget.",5
"order yg kedua kali mendrat dengan cepat,sabunya cocok dimuka,terima kasih berkah carpet semoga tambah sukses selalu,maksih buat mas kurirnya udh langganan",5
"sdh sampai sabun nya..pengirimn cepat bgt cm 1hr, muda""han cocok biar bs langanan. kurir lumyan ramah, mksh reseler& lazada.",5
"maaf baru kasih ulasan,,, alhmdulillah udh smpe paketnya.. mudah""an cocok sabun nya dan bisa jdii langganan .. Terima kasih ka",5
"ok bgt pecking rapih pengirimn sper cpat sehari udh nyampe,  abang kurirnya jg baik barang d antr smpe rmh.  mudah""an cck sabunya biar bsa langganan,  trimksih lazada ",5
"Maaf baru kasih ulasan.. 
Paketnya sampe kemaren,  kurir nya juga baik banget.. Sabunnya wangii.. semoga hasilnya juga memuaskan yaa...  Thank lazada ",5
kuriir lemganan. seportif / amanah so pasti lancar buat toko cek barang sebelum kirim yes lazada,5
realpict semoga cocok sabun y..,5
Mudah mudahan cocok,5
Sesuai pesanan makasih semua,5
baru mau cb muda2han cocok,5
Mantul.. semoga cocok🙏,5
"barang y bagus cuma sedikit lama tpi ok lah bagus
biar bintang yg berbicara",5
sangat bagus dan lagi pesen lagi semega ajj jadi laganan😁,5
sesuai gambar dan bagus,1
sabun nya mantul banget jerawat pun langsung minggat😊mksi lazada mksih juga buat kulirnya 👍👍,5
"Pngemasan ok,dtng tepat waktu,smga ak cocok pkainya😀",5
puas tidak mengecewakan sabun nya..,5
"udah d trima mw nyoba dlu klo bagus nanti tmbah bintan
buat pengiriman ok abank kurir y baik ramah ",2
muaskan sekali 👍 jangan nyesel belanja di sinih,5
barang bagus pengiriman cepat kurirny jg ok ,5
"syuka bngets
tokonya benar2 Amanah
",5
makasih barang nya ok dan ori,5
baru pake 2 minggu udah kelihatan hasilnya..lumayan bagus semoga cocok,5
"okk bgt sabuny..nih dah yg kedua kly order..Maksh
",5
"Good deh.....tdk kecewa pokonya is the best
",5
terima kasih Lazada sabun sdh di terima dan sesuai harapan jaya selalu,5
barang nya datang dgn selamat tanpa kerusakan apa pun...cmn aku ngk tau ini ORIGINAL apa ngk,5
sabun nya ori..ok punya👍🙏,5
"brang dah nyampe,saya suka.kurirnya jg ramah,mksh lazada",5
"kurang cocok 
",2
sudah langganan d toko ini,5
"Sesuai pesanan, ok terimakasih. ",5
sangat puas,5
"Bagus dan rapi pengemasan barang nya👍👍👍
Ku",3
"barang nya sesuai dengan pesann,kurir nya juga ramah,,,terima kasih☺️☺️",5
terima kasih paketnyavudah sampai.,5
tks lazada barang nya lengkap,5
"terimakasih nyampe rapih kurirnya baik , semoga cocok 
",5
"paket suda datang
prodak nya bagus d toko ini
reccommeded pokoknya😘😘😘😘",5
akhirnya tiba jga sabun nya.lama pngiriman nya.huh.customer sya dah nnyain trs.,5
produk original.. next order lgi.,4
udh nyampe paket nya...kulir nya baik..mkasih lazada...smga bisa membersihkn plek d wajah.,4
Alhamdulillah Paketannya Sudah Sampai Tujuan 😉 ,4
"realpick, makasih lazada 
",4
Thank's😍😘 Sabun nyah Mantull Sesuaii 👌👍💞,5
"realpict,mksi lazadaaaaaa❤️",5
pengiriman cukup lama,5
maaf baru kasih ulasan...sabun nya wangi dan kulit jd lebih bersih...pertahankan trus kualitas produknya ya...thanks seller n abang kurir ny karna udh langganan,5
"barangnya sdah sampai dan sesuai dgn pesanan mkasih y mdah""n cocok 🙏🙏",5
"packing rapi, brg realpict, pengiriman lancar, kurir dan seler ramah",5
"Tks Lazada,paketanx udah nyampe.paketan utuh..kurirx jg baik dan ramah....",5
Alhamdulillah barang dh sampai dg selamat..mksh srmuanya,5
"terimakasih lazada barang dah dtg,n kurirnya baik",5
"langsung pesen dua,, paket ceper bgt datengnya... terimakasih 🙏",5
Wah barangnya bagus.. beli 2 pcs.. pengiriman cepat.. recomended,5
mksh lazada 👍👍,5
thanks .. sabunnya sudah sampai .. produk original harga juga lebih murah .,5
produk original harga beda jauh sama yg beli di membernya.. cuma abang kurir jne jutek amat😒,5
Terima kasih👍👍👍,5
barang nya sudah sy trima peking nya juga rapi 👍👍👍,5
sesuai deskripsi semoga cocok..🙏,5
"Alhamdllah..barang nya udh smpe tp blm tau kualitas ny..n cpet bnget

",5
"brngnya udh smpe,,alhmdllh sy cocok.",5
mantap terimakasih,5
lumayan nungu nyh seminggu. tenkz lazada,5
smga cock sabunya ya kak,5
dh smpe paketnyaa...mkasih yaa aq sukaa😍😍..seperti biasa kurirnya dah langganan..baik dan ramah juga..mkasih ya lazada...,5
"mantap pengiriman hari minggu tetap jalan,pket ku sampe lbih cepat,akku langganan trus deh dtoko ini,ini pembelian ke dua aku.,dan pemakaian 2 minggu lebih wajah lebih bersih,bebas jerawat😀pkonya produk ori deh",5
"maap baru kasi ulasan ,pemakaian hari ketiga jerawatnya mulai kempes dan bekas jerawat jg mulai memudar. makasihh😊😊",4
"baru ngasih ulasan di coba dulu ternyata tidak cocok tapi gak.. mksh pengiriman nya cepat.. kurir nya jg ramah2
",5
"bener"" ori,insya allah aku order lagi ,tapi tetep amanah yh untuk kasih barang yang ori,wlaupun pngiriman agak terlambat tapi gpp,puas terbayar dgn barang yg ori,dan kurir udh langganan bgt",5
"paket diterima dgn baik,saya suka terima kasih Lazada.. lain kali saya order lagi sabun bamboo nya .",5
"maaf br ksih ulasan barang nyampaik kmren.. muga ori kayak yg pertama aq bli d,teman ku.. sudah cocok pake sabun MSY ini bisa buat lganan. ",5
"Maaf br beri ulasan, Alhamdulillah paket dah sampai td sore, packingnya rapih, kurirnya jg sopan, semoga ccok soalnya br pertama x coba sabunnya.😊😊",5
