review,rating
"paket nya sudah datang. 
respon dan pengiriman nya mantap cepet sekali.
mudah""n cocok sabun nya. 
terima kasih lazada terima kasih buat seller ini.
mantap. 
",5
"packingan barang bagus mudah-mudahan khasiatnya jg bagus, maaf diposting cuma satu kena yg satunya udah dipake.top banget de buat kurir dan lazada",5
cantik deh sellernya sesuai pesanan .trima kasih semuanya okeey.,5
"disini toko favorite aku. semua sesuai, bonus juga ada. terima kasih ya.",5
"ok,brng sdh di terima",5
"Realpict pakingnya rapi,tp g dapat gantungan kuncinya",4
real pic mantap puas belanja di sini,5
Lumayan gatal2 nya aga mengurangi ,5
sabun nya sesuai pesanan moga aja cocok,5
Blm di coba.. ntr klo cocok di tambah bintangnya ya,3
"paket sudah di terima,blum di coba",5
mantap.dah buat seller nya sesuai pesenan respon juga cepet,5
paket datang dengan keadaan baik dan waktu pengiriman juga sangat baik. buat sellernya makasih! ğŸ˜Š ,5
barang nya udah dateng kurir nya seperti biasaa ,5
mayan,5
"cepet, ok",5
mantap..ada bonus nya gantungan kunci..makasi,5
"sabunya enak d pke,,,untuk kurirnya mkasih y dh sabar menuggu",5
"alhmdulilah barang dah sampai dengan baik..
",5
panuya blm juga ilang udh 2x psn,3
barang ya bagus dan sesuai makasih ,5
"sangat suka
kurir udah langganan
",5
terima kasih lazada,5
