review,rating
Lord of the ring,3
"yah kecewa sih.. pesen ukuran 17 nya 2 dikirimnya 17 dan 16 trus cincinnya cacat, untung muat walau di paksa tolong dong di benerin lagi ",5
"paket sudah datang sya coba buka cukup sih  jari manis sayangnya banyak totol2 sama bared d cincin nya  tapi ga papa lah buat harga segitu mah
terimakasih lazada kulir nya juga ramah .
",5
"bgs sih yg mata 3tp kebesaran,aq pesenya yg kecil ukuran 5kok datangnya 15 san, thanks buat kurirnya smgt trus",3
"gampang patah, bahan'y tipis",2
"""paket sudah diterima, sesuai pesanan ,TRIms seller & lazada serta kurirnya TRIms.""",5
"Cincin kekecilan menurut sy, tapi gpp laaa...bagus koq",5
beli dua patah satu,3
mantul pokoknya mksih,5
