review,rating
"saya pesen yg kuning, kenapa malah datang yang ini. saya kecewa, kalau ada niat baik saya mau minta dikirim lagi pesanan saya",1
"bagussss bgt cincinnya pas bgt di jari saya, terima kasih lazada dan kurirnya udh pada langganan semua .",5
"cincin nya bagus saya suka ...sukses selalu ya ""makasih makasih ya lazada",5
barang nya bagus sesuai gambar. seperti mas asli.dan warna emas nya saya suka banget . g kuning. pas  lgi d jari saya. pokonya the beast lah. mkasi lazada. dan untuk kurir nya . ramah. mksh mas,5
ok Bagus cin2 nya... mkasih aa kurrir,5
bagus pas ,5
bagus sesuai gambar puass,5
beli 2 knp dikirim 1... cari langganan apa cari musuh... mau berkah apa mau kutukan,1
barang udah nyampek mas mas kurirnya sangat baik,5
Asli inimah cakep nya kbangetan,5
bagus sekali,5
bagus pas d jari.....,5
ga muat sangat kegedean smpe muat sma jari suami sya kecewa walupun itasi,1
trimakasih lazada paket tlah keterima,5
cin2nya bagus pas dipake kurirnya ramah,5
Bagus bgt pas dijari akuğŸ˜,5
bagus,5
bagussssss,5
bagus,5
