review,rating
"Barang sudah sampai dalam keadaan baik, kurirnya juga ramah,sesuai gambar, realpic, dan barang nya oke banget deh... ğŸ‘ŒğŸ‘",5
"gemeshhhh, baguss",5
bagus ,5
baguuussssss pke bgttt,5
"bagussss bangetttt, maaf ga pake foto karna barang ditinggal dirumah, tapi yg mau order jangan ragu ini bagus bgt",5
bagus banget parah ganyesel mesen di toko ini ,5
real pict. next order lagiii,5
Barang nya bagus gak ngecawain ko maksih pa kurir udah kirim depan rumah,3
bagus ga nyesel beli di sini ,5
