review,rating
baguss bangttt ganyesel pokoknyaaaaa><โคโคโคโคโค,5
maaf telat ulasannya sehaja sih๐ biar kak seller nya nungguin ๐คฃ๐คฃ realpict bangt bnget ya meskipu n ada yang lecett ,5
"Alhamdulillah paket y sdh dtg.. puas bgt ma hasil y, kualitas gambar cerah.. next order lg ๐",5
"cantik fotonya
thank you",5
alhamdulillah udah nyampe dengan tepat. barang nya sesuatu bgt,5
"kecewa ...
ptoy itu mh ukuan dompet",1
paket telah di terima..prefeck๐next order lg..kurir udh lngganan,5
๐ฅฐpuas pkoknya walaupun kdg pinggirnya kanan kirinya beda jaraknya,5
"fotonya bagus dan ga kurang. 
terimakasih ๐",5
"Mantap Barangnya.. Cepet Pengiriman nya.. 
toko Recomended banget Deh",5
bagus tapi pengirimannya telat,5
"foto nya bagus 
admin nya juga ramah ๐",5
okeeMantulll,5
barang nya bagus cuman pengirimanan nya aja agak lama,5
