review,rating
"saya pesan yang sesuai pic kak yang ada Lapadz Alloh dan Muhammad.knp yang dtang beda terus ini ada patah d bawah.bagaimana ini.apakah bisa di tukar ??mohon pengertian nya .ini psanan orang kak
",5
bagus suka banget ...cantik buat hiasan..,5
Baranya Realpict Gk Ada Yang Ccat Pkoknyaaa MntappğŸ–’Next Order Lgih,5
asli reall peack bgt,5
paket sesuai gambar saya suka...kurirnya juga ramah..dan sdh saya kenal..,5
bagus hiasan nya mksih lazada ,5
"Semua barang pesanan saya sangat bagus,,,cocok buat langganan,,, toko amanah seler rama n kurir ninja sgat sopan dan sangat langganan,,, pokok nya semua amanah.... ",5
"maap baru ksh ulasan nya,baru di buka pas di lht kecil ea asli nya,kirain saya gede gitu,",5
sesuay pesanan,5
bagus dg harga segitu top deh,5
bagus saya suka,5
bagus,5
