review,rating
"sesuai eatimasi ğŸ˜ kirain tingginya sepinggang saya ,  ternyata sepaha saya ,  mksih tapi bagua",5
wlpun pengiriman barangnya lama tp brgnya bagus sekali ğŸ˜,5
bagus bgt.. dan pas warna nya soft gitu. sukaaa kk bgt,5
Aku kira barangnya besar.. trnyata kecil.. lumayan lah.. materialnya bagus.. cuma muat buku segini aja.. pengiriman nya lama kaliii,5
"bagus, anak saya sukakkk sekali, membantu belajar gemar membaca sedari dini.",5
bagus. lucu,5
buat kado jd gk d buka,5
"diterima dg baik, lengkap..gampang ngerakitnya..",5
Lucu walau agak kecil,5
barang mendarat tdk muluss...ada sedikit bagian yg pecah...,3
Cara pasang nya gmna?,5
"Bagus bgt raknya, tapi ternyata sempit space nya, jadi gabisa muat banyak buku",5
