review,rating
"aq kecewa bgt blnja di toko ini
pesan rak sepatu, dikirim tali gorden
benar2 ga amanah.
pdhal aq da byk bgt blnja di lazada
tp inilah yg pling mgcewakan.",1
ok banget pokoe,5
bagus ga ada cacat warna dan karakter sesuai pesanan trimakasih seller trimakasih lazada dan juga mas kurir nya .,5
"Baguuz bingiiit...awal'y slah ngetik.mw pesen rak tas,mlah rak sendal lgi,tp gpp...buat koleksi lgi,hihihi...mksih lazada...游땎游땘",5
mksih barang sdh aq trima.. pengiriman cpt jg.. lumayan rak sepatunya. sm  sprti di psr2 hrg nya 20ribuan.,5
pesan ny motif keropi yg dtng ko Doraemon ya,5
pket nya udah dteng real fic bnget ya,5
"Barang sudah sampek  , mkch lazada ",5
"barang datang dengan cepat cuma sayang kecewa plastik nya tipis dan sobek
",5
"Cpet banget dateng nya ..bgus barang nya sukaa
",5
minta keropi mlah dikirim helokity tapi ga apa2 lah makasih lazada kurirnya ramah.,5
Alhamdulillah paketnya sudah sampai..,5
"paketnya baru datang walau agak lama tapi barang ok gak ngecewain makasih selera makasih lazada.
",5
paket nya udh smpe maksih lazada,4
bagus tidak mengecewakan..sama apa yg aku mau..makasih,5
"bagus,,sesuai kurirnya jg ramah thankz lazada.....",5
baguss sesuay pesenan ,5
mkch kk barang nya bagus rapih mkch,5
"terima kasih,kiriman sampai tanpa cacat",5
"bagus sih tp kok barang yg datang sama semua warna pedahal sy pesan campur"" motif",5
Mantap rak nya ,5
"oke,  tp pengiriman lma ",5
Baguss sesuai pesanan...游녨,5
ok sesuai pesenan makasih,5
warna Sesuai Pokok'a keren bgt.. ,5
"datang sesui pesanan .. ok smuanya dackk 
thnks lazada",5
Barang sesuai dengan pesanan. terima kasih Lazada.,5
barang sip fn oke,5
"terimakasih pesanannya sudah sampai,,,maaf g bisa foto karena langsung tk kasih sama yg beli.",5
trimakasihhh lazada   paket dh smpe .dn kurir nya sngat rmh,5
bagus sesuai foto,5
Pengiriman nya cepet ngk ad yg rusak juga..  Makasih lazada ,5
"cakepp, sesuai pesanan",5
PengirimanNyaCepetBangetHariJum'atAkuPesenDanHariMingguNyaDatengMakasihLazada+Kurirnya游땕,5
bagus .Q puas.gk kcwa dehhh,5
lumayan bgus  ,5
Lumayan bgs ank sy sk,5
bagus... tnks,5
barang lumayan ok thanks lazada,5
ternyata kecil ..saya kira agak gede dan lebar ..asal g cacat aja GPP lh,5
gambar reel saya suka游땘游땘,5
Lumayan deh... Drpd lo manyun.... Hhhhh..,5
"plastiknya tipis,gampang sobek",5
Sangat memuaskan游때,5
lumayn bagus sa awet mksih,5
produk sesuai.. tapi pengiriman lumayan lama.. ,5
"bagusss,cepet pengirimannya mantull",5
rak nya bagus kulir nya ramah walow pun datang paket nya mlm jam 9 ...游때游때游때,5
ga pernah kecewa kalo belanja di lazada ,5
"terima kasih toko ginkai,terima kasih lazada",5
"terima kasih toko ghinkai,pesanan saya sudah sampai",5
bagus barangny cuma ko kecil ya....satu pasang aj g muat!!!tp lumayan lah,5
puas,5
bagussss,5
ok lh ,5
mantullll,5
