review,rating
"kualitas produk baik, packing baik, pengiriman baik, respon seller baik, ibu saya baik, bapak saya baik, kakak saya baik, adik saya baik, nenek saya baik, kakek saya juga baik, tetangga saya baik, semua baik, saya aja yang jahat. ",5
pengiriman lama sekali. kualitas kayu murah dan kotor dan ternyta lebih kecil dari prediksi. harusnya cantumkan dimensi di detail produk,3
"barang ckup oke, cuma gantungan besi nya saya dapet yang posisi kiri dua dua-duanya jadi pasang papan nya jadi gak simetris. sama lubang screw gantungan besi nya ada yg besar dan kecil banget jadi susah buat di screw nya. ",3
"no coment, Keren pokonya",5
Papan kayunya kurang bagus,4
kayunya g ada yg cacat.  cm item2 aja.  smoga tahan lama.  thx,5
Sudah diterima dengan baik.thanks Lazada,5
paket sdh d terima tx,5
sesuai,5
bagus.. kuauka,5
"kurang kuat goyang papan ny
",1
"Baik barang diterima dengan baik, terima kasih",5
kayunya jelek,3
