review,rating
Kurir ramah .cuma barang begini g usah di juallah . Ngrugiin orang . Barang sudah 3 tambelan saya g pake bahaya,2
"kalau jual ban yang bener harga ban emang murah tapi jangan dikirim ban kaga normal pada bengkok bengkok ,besi bengkok bagus ban bengkok jalan Nye kaya naik kuda ,jangan pada mau beli sama toko ini barang rusak dijual",1
"barang tidak meragukan lagi ,walaupun barang second tapi masih ok juga .seller nya ramah . pengiriman nya juga cepet bner. thanks lazada thanks Lex ID",5
ko ga sama kaya yg digambar si gan,5
bagus bangett realpict dehhh ga nyesel belii di sini makasihh yaaa,5
makasih bro barang sesuai ,5
Terimakasih barang sudah sampai dan proses nya cepat terimakasih,5
"barang lumayan cuma lama pengirimannya Thank Lazada
",5
lumayan..,3
ğŸ‘ğŸ‘,5
