review,rating
Bos ko barang nya gk sesuwai sama pesenan saya sayakan mesen pentil lampu kenapa isi ya barang mekapa bos ,2
"tertulis ttup pentil LED,tp yg d krim apa ini.sngt kcwa aku...klok kyk gni gmna,planggan psti kcwa",1
"pentil sepeda yg saya beli anda kirim ini...
",1
gimana cara komplen a yaa.. beli lampu pentil.. pas dibuka isinya bedak...kecewa banget. ,5
barang tdk sesuai pesanan tolong. di cek kembali...,4
"yg di pesan apanyg di kirim apa,
kacau nih",1
Sangat kecewa mosok pesen tutup pentil yg dikirim cream leher,5
"pensen pentil malah dikasih jelly glowing , pengen di tuker dongh!!!",5
