review,rating
"ga berkah bos.
kalo mau jualan yg jujur bos biar berkah.
emang masala harga ga seberapa tp klo begini caranya pembeli kecewa.",1
yg dijual ama yg dikirim beda,3
"yg dikirim kok mereknya beda, KECEWA!!!",1
"barangnya beda.. setelah di pesan gambarnya d rubah,, mda2han barangnya bagus.. sy kira flax tap ternyata taffpack..",3
"barang sudah di terima...cepat bagt naympe y...dan semoga bermanfaat dgn baik...
next order lagi kalau bagus hasil y...",5
koq ga terlalu merekat yah klo di ember yg bocor bawah nya,3
"Lakban Anti Air Bocor Flex Tape Anti Leak Waterproof 10 x 152cm
Produk berkualitas, mantap.
terima kasih HOB Store & Lazada.",5
trimakasih...blm di coba sih tp moga bagus,5
Alhamdulillah cukup memuaskan jga,5
brg sdh sampai..packing aman..berfngsi dg baik..trims,4
tetap bocor,1
barang datang bagus. tapi sayangnya tdk sesuai estimasi pengiriman.,5
barangnya  bagus.sangat puas.thanks lazada,5
maaf blm d pkai ...,5
"bagus bgt, ember yg bocor bs dpake lg, paralon pdam pun gk netes lagiğŸ‘ğŸ‘",5
sesuai pesanan..,4
trimks barang udah d terima  barangnya bagus,5
"barang gak sesuang yg datang taff tape tapi gpp lah, semoga sama fungsinya.. ",5
yang datang nya merk nya beda sama yg di iklan,5
mnta p banget,5
tolong di perbaiki dalam pengirimannya terlalu lama dan pengiriman barang selaku gagal terimakasih,5
"mantap bro, pengiriman cepat dan baik",5
"barang sdh sampai, sesuai picture",5
ga begitu nempel sih...k,3
Kecowa lemnya bleber parah,3
Udah sampe ,5
Brg udh kami terima thx lazada,5
"Pesenan sdh sampai,tp blm di pakai,semoga sesuai dg yg diinginkan.",4
Mantap,5
siolp,5
Bagus,4
