review,rating
"Sesuai deskripsi, pengiriman cepat & kurir ramah. sudah dicoba berfungsi dgn baik, sukses tuk Seller....",5
yang datang beda merk,3
"ya lumayan tp kalau kenas panas msh meleleh,makasih mas kurir",3
mantap baget baru pesan besoknya dh sampai sy ksih bintang 5 semua..trimks jg buatbpk kurir,5
sudah sampai ,5
"cakep, blm di coba",4
SDH di terima tp blm di coba,4
lengket banget.. kurirnya langganan oke,5
"barng sesuai diskripsi langsung dicoba di bak bocor  matul..benar anti bocor
",5
Barang sudah sampai.. sip..,5
barang oke mantep lah,5
"Good lock,barang ny dah sampai lebih cepat,kurir ramah",5
"rekat mantap, tapi kalau bidangnya tidak rata agak susah",5
"mantao, barangnya bagus",5
sangat mengecewakan ,5
lumayanlah.......sayang nggak elastis ya.....,5
"sesuai tanggal untuk pengiriman nya barang nya sesuai ama yang di iklan kan untuk pengiriman nya oke lah
",4
barangnya udah sampai cuma belum di coba muda2han leketnya keras g bocor lagii dan awet trimks lazada barangnya cepat datang trimks juga buat kurir yg kirim ,5
kurir baik dan ramah.. terima kasih...,5
lengket tapi kurang bekerja dengan baik,3
mantap,5
ok bgt,5
mantul,5
"barang sudah sampe dalam keadaan baik, blom d pake, mudah2an sesuai fungsinya",5
muantapppppp,5
Pengirimannya cepet dan barang asli..,5
ud pke satu rol tp msih ttap bcor....,5
merekat kuat ğŸ‘,5
ok la,5
