review,rating
Trmksh lazada barangnya mantul bngt dn bgs bngt ni.. Ga ada yg rusak atau yg bolong dn tambelan.. Smuanya ban nya bgs gan.. Sesuai pesanan ni.. Dn jg kulirnya sngt baik dn cpt ni.. Smoga sukses lazada dn maju trs usahanya ya lazada.. Trmksih,5
lumayan dari pada lu manyun,5
"terimah kasih barang sudah sampai dengan aman. 
kurirnya judes bukan kurir yg nganter biasanya. biasanya dianterin sampe rumah ini mah ngambil dijalan. kaloh ga gatau alamat rumahnya kan bisa nanya. udah beberapa kali belanja dilazada baru kali ini dapat kurir yg ga sopan judes!!! tolong ditingkatin lagi kenyaman pembeli itu penting.!",5
tidak mengecewakan makasih,5
"kcewa ban a pd bolong,berkali2 saya nambal,..kuras dompet dech jadi a",1
  alhamduliah bgus barang ntah sesui gambar,5
yang ini agak sdikit kcewa banya tipis,5
lumayan bagus,5
"Mantap selalu, suksea seller, kurir, lazada",5
"ban b,es motif beda kecewa bikira ban baru",1
Barang bagus. Saya sangat senang terima kasih,5
barangnya bagus sesuai gambar toplah..thanks,5
"ban udh sampeee,,baguuuuuussss Insya Allah order lagi",5
"Trmksh ban nya uda smpe tdi sore jm4,  ban nya msi bagus tpi uda agk tipis,  gkpplh smgk sukses",5
Barang nya cpet sampai,5
Mantulll ,5
mantul,5
ok,5
Ok,5
kouliyr ramah maksiyh buat kurir nyah,5
"Ok bgt barang nya bgs bsa bt langganan,makasih Lazada
",5
bannya kog ad paku yg lengket. tpi nd apalah untung tidk parah . ğŸ‘,3
"makasih lazada,",5
"mas tidak memuaskan,ban nya bocor.",5
Sangat kecewa ban nyh bocor bru di pasang,1
