review,rating
kecewa itu mah kaca di abg2 cuma 2000 perak tolol,5
"Barangnya memuaskan alias gak sama sekali, klo barangnya kecil jangan dijual atuh, diganbar besar pas dibuka bungkusnya seuprit,,,,tp gpp buat cukur kumis kelihatan....prikitieww",5
"Pengantar paketnya kurang sopan, klo barangnya memuaskan bnget, tolong lebih diarahkan lagi tentang sopan santun nya",5
"Seller_nya lumayan cepat dalam merespon dan juga ramah, barang nyampek dgn baik dan warna sesuai. Terus kurir_nya lumayan ramah;

"" Thank You Seller dan Lazada "".",5
