review,rating
kopernya mendarat dgn ok..brang nya bagus g da cacat..wrna pun sesuai keinginan..seller ny jg ramah... mksh y seller..,5
"what am i expecting with this one? asli kualitas nya bener2 apa ada nya. Iya, sesuai harga. Awalnya mau balikin aja tp kurir nya ngeluh ""ya gimana ya ini paket udah sampe, saya masih ada kiriman lain juga"" padahal kopernya belum dibuka plastik dalemnya dan roda nya sempet ada yg sedikit retak. but i have to accept this, krn si kurir yg ngomong gitu terus jd yaudah lah",2
sudah diterima sesuai pesanan,5
"paket x dah datang,sesui barangx.mantapğŸ‘",5
makasih barang ... bagusâ˜ºï¸â˜ºï¸,5
