review,rating
Barang sudah sampai dengan baik.  Walau packing hanya plastik saja.  tp over all unit tdk ada kendala.  smog awet. Trimakasih Seller dan Lazada.  ,4
"barangnya bagus , pengirimannya jga cepat, tapi warna barang yang dtang beda dgn yang sya pesan , harusnya warnya black ,,its oke sih krna warna yang silver bagus jga ...thks ",4
gan/sist kok warna nya gak sesuai yg saya order ya. saya order black yg dateng silver apa bisa tuker warna,5
"minta warna item dikasih silver, pesan tidak pernah dibaca dan di bales dan penjual ini ga serius. baut koper lepas 2. ",1
"barang datang sesuai pesanan, tidak ada lecet dan kekurangan apapun.",5
barang sdh sampai dgn baik. tp tidak sesuai pesanan. pesan hitam tp yg datang silver.,4
Terimakasih. Barangnya sdh sampai tanpa lecet. Packing Ok. Pengiriman cepat. Semoga awet barangnya.,5
mantaaaap broo trims lazada barang cpt kemasan rapi en bagus trims,5
Tidak sesuai pesanan. beli black dikirim silver,2
tidak sesuai pesanan. beli black dikirim silver. dan tulisan brand polo milano jg lepas,2
thank you ,5
