review,rating
"barang oke, pengiriman cepat. Kemarin pesan, hari ini sampai (pakai kurir)
barang sesuai pesanan gak kurang apapun, terdapat panduan untuk kalibrasi tapi tidak dijelaskan bagaimana penggunaan pertama kali. sehingga harus mencari video di youtube. alhamdulillah working well, hasil kamera 720p okelah, lumayan jelas. emergency landing ok. handling ok. built quality ok. jatuh dari ketinggian 2 meter gak apa2",4
ga rekomended seller. barang tidak sesuai dengan yang dipesan. kualitas seller murahan ga berkualitas. seller abal abal. ,1
tidak bisa terbang stabil,5
barang yang datang tidak sesuai dengan pesanan dan tidak berfungsi drone nya..cuma remotenys aja yg nyala.. pesanan baby DJI yang di terima Visuo battle sharks yang tidak berfungsi,5
ini gimana ya? bisa ditukar Gaak???,1
"brg sesuai gbr, kondisi baik & utuh, bungkus rapi, drone ok berfungsi semua, sayang jasa pengiriman payah brg harus diambil sendiri&tdk ada pemberitahuan padahal cod. tx lazada",5
aku kecewa dgn drone masak batrai 5 menit di pakai langsung habis aku sangat kecewa,5
barangg keren tapi saya lagi belajar nerbangin,5
barang gak sesuai,1
"susah bikin hovering nih pesawat, akhirnya saya sangga pake kayu biar diem",3
Mntap mksi lazada,5
kecewaa yg dipesan apa yg datang apaa! cukup sekali kapok dah ,1
minta barang yg sesuai,5
"BArang yg dikirim bukan yang diminta yaitu merk Vasio, apakah sama?",1
"hari ini pesan, besok nyampe..
mantap
nice product",5
"Barang sudah nyampai.
Terima kasih karena mengantarnya sangat cepat
Cuma kotaknya aga penyok",4
"Lain yang dipesan, lain yang datang. Bagaimana ini.?",1
maantaaap,5
"gagal euy
",1
