review,rating
"Paket sudah sampai. Berfungsi dengan baik.
Terima kasih",5.0
"paket sudah saya terima, tetapi saya tidak mendapatkan kabel untuk charger dan juga propeler cadangan. mohon informasinya bagaimana supaya saya dapat kekurangan pengiriman berupa kabel charger dan propeler cadangannya.",5.0
"produk sudah diterima ,kondisi bagus , dari para review pruduk bagus , cuman saat belum dapat kami coba ",5.0
"Barang cepat rusak ,  baru 2hari pake  dinamo nya pada lemah semua  ,,  ",5.0
"packing sangat beresiko rusak..gak di bubble, beruntung saya punya bagus.Makasih Laz",4.0
"Mainan yang tidak berguna, deskripsi di halaman penjualan mengatakan tidak ada rincian benar seperti home return dan tahan ketinggian",
