review,rating
"Tiba pada tanggal yang diharapkan, kemasan maayus .. kualitas suara maganda .. sulit ang pagbili untuk harga yang lebih murah, prang meron nren ako fiio m5..order ulit ako pra sa anak ko .. Terima kasih penjual dan lazada.",
"Cantik, kompak tapi tangan yang sangat tegas, menonton video dan gambar tidak berkualitas tinggi (karena layarnya kecil) tapi sangat OK!",
Produk berkualitas baik dengan harga ini dan pengirimannya juga cepat. Sangat direkomendasikan!,
Puas costumer.,
Bagus,
