review,rating
"Barang ori.... Suara bagus... Kalo mau pake equalizer harus simpan file d internal, suara saat d pake ke percepatan seperti da berisik, bluetooth berfungsi n suara ttp jernih n tidak putus... Thanks to seller",5.0
"Dos nya tidak tersegel, saya curiga ini barang bekas yang habis dicoba",3.0
good  mantab  suara  loudnessnya,5.0
"puas, barang bagus..
",5.0
Lumayan Bagus,5.0
"Baguuuussss, suara mantaaappp terimakasih ",5.0
produk berfungsi dengan baik. pengiriman juga cepat. good service,5.0
"Pemutar musik harganya sangat bagus. Desain sementara, bingkai logam, kaca depan sangat mudah untuk menggores Mika. Desain tidak tinggi, harganya murah tapi harga ini juga bisa diterima. Yang paling penting, kualitas suara sangat bagus, di luar kisaran harga, dibandingkan dengan ponsel pintar yang Anda gunakan Redmi Note 8 dan laptop, suaranya lebih unggul. Suara rinci, perpisahan putih, suara medan lebar. Layak dibeli.",
