review,rating
mantapp..  pengiriman cepat ga sampe 24jam .. pesen kemaren sore tadi jam 1 dateng..  puas Dan recommend belanja dj toko ini.. walaupun designya ga sesuai tapi tetap bagus.. tks... ,5
"Alhamdulillah pesanan sudah sampai lebih cepat dari perkiraan. sesuai dengan pesanan, bungkus rapi dan kurirnya ramah. semoga Awet deh",5
pengirimannya ceper banget makasih barangnya bagus amana sekali gak ada cacat sedikit pun,5
"Trmk brg sdh sampe sesuai pesanan, but it's oke brg tdk ada yg cacat, trmk bnyk buat penjual yg fast respons...good luckğŸ‘Œ",5
than'k you bosque beli gesper dapat dompet aku senng sxli..mkch lz..maju terus ya dan laris manis...,5
"barang sesuai dengan gambar, begitu juga dompetnya. oke....saya suka, kurirnya ramah. ",5
"barang nya bagus banget suami suka, kurir dah langganan makasih tuk penjual dan kurir nya... ",5
Barang sudah datang bagus banget.. Trima kasih bonusnya ,5
barang sesuai pesanan ku.namun gasper agak longgar d pinggang.trims Lazada,5
lumayan lah dengan harga sekian. makasih,5
"Bagus suamiku seneng banget,makasih kurir baik",5
"wow bagus barang nya ngga kecewa beli di toko ini,pertahanan terus bang produk nya, semoga sukses.",5
"real pict,kurir ramah top dech..mksih lazada",5
"brg ny sip lgkp tiada yg krg..
mntap buat pnjual nya...",5
"recomended banget , real pict dompet nya juga bagus . makasi lazada dan seler. amanah",5
pas,5
ok,5
bagus,5
kurir yang ramah dan sopan,5
