review,rating
"bau,.ya kaya kapas ke bakar",1
"pesen nya sih juice banana milki vanila 
tpi yang datang milk lovers
tpi ga ap lah cuma beda dikit rasa nya

untuk masalah pengiriman kalo aku sih yesssssss.ğŸ‘",5
"alhamdulillah mesen banana dateng strawberry
",5
"liquid sangat bagus dan murah sukses terus lazada 
jngan lupa beli di sinih yh ",5
sangat puas pengiriman cepat paking rapi...,5
"mksh seller dan LAZADA,utk kurir nya ok ",5
barangnya mantul datang dengan selamat,5
barang tidak sesuai..pesen liquid yg di kirim tempat mkn sama minum burung,5
barang sangat ok sampainya aja yg telat ....â˜º,4
wangi tapi rasanya kurang berasa,3
Maknyus deh,5
Paket sudah sampe sesuai pesanan...mksi,5
bagus bnget liqwit nya,5
pas rasa nya,5
top,5
mantav ,5
