review,rating
"medarat dengan cepat,barang pas dengan tepat,maksih gan,pasti akan order lagi",5
sya pesan mocca kok datngnya rasa jagung bakar .,1
"mantap sesuai,kurir ramah,sukses terus buat kedepannya LazadağŸ‘",5
Barang oke mantaplah,5
"mantap mantap. terimakasih lazada NinjaXpress dan kurir. 
",5
Mantap tidak kecewa rasa walaupun harga murah thx lazada..... ,5
"barang sudah diterima, dan rasanya lumayan enak, makasih lazada ğŸ™",5
kendala pengiriman,5
"makasih lazada,liquid udh nyampe sesuai pesanan",5
