review,rating
barang saya lg sampek tadi siang..  agak kecewa. soal penggiriman nya agak lama... tapi gk pa2 lah..  semoga kedepan nya gk lama penggiriman nya..... ,2
"barang sudah sampai barusan, thanks ya, kwalitas sesuai harga, dan warnanya asik sama kaya hp ku merah item wkwkwk  ",4
Pesan warna hitam malah dikirim merah. Gak apa2 deh kalo cuma warna doang beda . tapi ini saya dikasih vape rusak sama sekali gak bisa dipake . gimana ini tanggung jawabnya !!! Sangat kecewa,1
"puas lah,  semoga awet",5
"Barang rusak! 
Kek anjeng pesen disini 
",1
pas ditutup batrenya malah mati vavenya ..berati rusak dong??? ,5
Produk ok trima kasih lazada,3
mas ini barang nya rusak lo gak bisa idup gmna ini,5
brng joss makasih seller n lazada,5
"barang oke .puass 
tapi pesan ny hitam dtang a kuning semua",5
barang cukup memuaskan,5
Barang jelek jadi sampah di rumah anjirrrr,1
Rusak,5
