review,rating
apa'an nih nggak sesuai dengan gambar di gambar ada bonus liquit kok paket sudah sampai nggak ada liquitnya ğŸ–•,5
paket Podnya datang dengan packing rapih dan baik setelah di buka juga liquidnya tidak rembes. pokoknya te oo pe be ge te...trims lazada,5
"kualitas barang baik, respon penjual baik, tapi kurang baik dalam bungkus karena penyok , pengiriman mantap",4
sangat buruk banget barang tidak sesuai display dan tidak berfungsi dengan baik klo dagang yg bener bos jgn display bagus tp barang sampai tidak sesuai dan tidak berfungsi dgn baik,1
brang sesuai dan bonus liquid nya jga ok... ngebul nya jga mntap..smoga awet..... 999* lah pokok nya..,5
"saya sangat tidak puas karna baru di pake likuitnya rembes, terus ga bisa di cas, saya sangat kecewa sekali ",1
"pesan 2 pcs 1 pcs ga bisa di pakai 
pengiriman sangat lambat
packing tidak rapih
respon penjual kurang baik
",2
"barang baru datang gakk bisa d pake parahh banget udh tempat liquidnya bocor gak ada tutupnya tempat charger ruksak 
peringatan kalo barang ruksak jangn d jual bikin konsumen kecewa ",1
Pengiriman Cepat Tidak Mengecewakan ,4
barang tidak berfungsi,1
makasih lazada barang nya kepake...cuma customer nya kurang ramah,5
makasih barang nya dah sampai cuma sayang bocor terus catricg nya.,4
Baguss barang mendarat dengan mulus makasih lazada ,5
"Barangnya rusak,tdk bisa firing",5
tidak berfungsi sama sekali,1
"mantab kak barang bagus aman pengemasan ok kurir nya juga sopan bngt.
makasih",5
Barangnya ok,5
"Kurang puas dengan barang,a g bsa ngebul",5
Gak bisa di cas....bisa di balikin lagi gk barangnya eusak,5
sangat kecewa barang ngga bisa di pakai ,1
bareng rusak order warna hitam di kirim hijau sangat2 kecewa 1x aja gak order lagi kapok,1
kecewa barang baru di pake sehari udah rusak,1
tidka menyala k ,5
siiipp,5
mantaaaap,5
Mantul gan,5
nc,5
