review,rating
Sangat puasss toko tidak tipu tipu sesuai pesanan gambar yang tercantum bahanya juga bagus dengan harga yang murah. Trimakasih lazada.,5
"Barang mantap, pengiriman cepat, seller ramah dan amanah pastinya, sukses terus lazada dan seller!! ",5
barang okey..siap ngebuuul...mantap lazada,4
saya kecewa saya order vapenya yang datang malah ,1
"Mantap bosku barang jos gandos!! Pengiriman cepat kurir ramah, sukses terus bosku !!",5
"ko jualan barang bekas si, pas dibuka segel nya malah udah kebuka... terus vape nya juga ada yg retak... sangat kecewa sekali... yg mau beli dtoko ini harap pikir2 lagi",1
TerimakasihğŸ‘ Meskipun Barang Tidak Sesuai Dengan Yank Di Pesan,2
good job,5
Bagus,5
