review,rating
"mantap...!!!! paking rapih, pengiriman cepat, kurir jos TOP, barang berfungsi dgn baik, trimakasih, smoga menjadi layanan blanja online yg trbaik di negri ini, best lah pokoke",5
brng udah nyampe... tapi harus di cas dulu,5
"barang ok,cuma datangnya engk tepat pada tanggalnya
tapi tidak apa ",5
mantap barangnya bagus langsung ngebul,5
terima kasih lazada pengiriman yg cepat,5
brang bgus... ??ok pengiriman jg cepat..,4
Mantap berfungsi dgn baik kurir ramah thank u oh ea kurir kasih bonus THR TRS GAJI NAIKIN KASIAN ,5
ini gimana pesen vape ko jadi memory parah,5
barang rusak knp di kirim sih  pak...,5
"kenapa segelnya udah dibuka ,mana gak bisa di cas ini??",2
liquid nya kurang enak,5
ancurrr,5
