review,rating
"terimakasih barang dah Sampek dgn slmt,kurir ramah barang mantul sukses terus ciler n lazada semoga kedepannya pelayanan lbh ditinkatkan lg",5
"barang bagus sesuai pesanan jaga terus kepuasan pelanggan tks art sukses..
",5
barangnya mantu bgt...kurirnya jga rama tris lasada smoga mkin sukses slalu,5
"agak sedikit kecewa, saya sudah pesanan yg ke 3 kalinya barang sampe pecah",5
"tolong,  barang yang udah terkirim bisa di tuker lagi ngga...  soalnya ini ngga berfungsi",5
barang bagus.awet sesuai pesanan.,5
"barang bagus,puas....",5
gk bisa d pake ,5
Mantap... Barang sesuai gambar dan pengrmasan rapih,5
maf,5
puas,5
Good...,5
