review,rating
Maksiii. Mba bungany masih seger besok langsung berbunga..mantuu bngett,4
"bunga nya udh sampe, masih pda seger....
di kasih bonus tambahan juga. pokok nya top deh",5
masih segar plus dapet bonus juga... makasih miiin,5
"tanamannya msh segar,ada bunganya juga,makasih...",5
Manteep bener pohonnya sesuai yg di pesan dan udh gitu dapet bonus bibit sawi tanks lazada,5
"bunganya masih segar,penjualnya ramah dan ga pelit,dikasih bonus jg,thanks seller dan lazada",5
bunganya bagus berkembang lagi,5
"Kereeennnn sesuai pesanan. Walaupun saat datang, daun nya banyak yang rontok",5
Mantaf jos makasih bonusnya banyak hehe ,5
Pohonnya sudah tumbuh n berbunga trus,5
masih segerğŸ‘ŒğŸ‘Œ,5
