review,rating
"toko tidak amanah, pesan 7 kirim 5 pohon",2
"alhamdulillah mendarat dgn selamat.
krn lom ada kembangnya, jd gak bs membedakan, gak di kasih id nya. ini yg kuning yg mn ya??ğŸ¤”
mudah2an tumbuh subur, kembang sesuai dgn keinginan yak.
mksh lazada n seller, tak lupa babang kurirnya, sdh langganan.",5
"saran saya, kalau order banyak dan beda warna, beri tanda donk, biar gak ketuker.. dan beri tanah. karena pengiriman nya lama",5
"paket bunga kamboja suda di trima, sangat memuaskan. Trimakasi lasada",5
"semoga bunganya sesuai yg di inginkan,",5
"lumayan,paketnya masih kecil banget",4
"bonggolnya agak lembek kelamaan di jln
mudah2an hidup daun msh segar",5
"mksh paket nya sdh smpai 
packing lmyan rapi
tnman aman,moga bunga nya sesuai yg d psan ya",5
6 hari baru nyampek,4
