review,rating
"anak saya suka bngat
",5
bgus bngt mksih Lazada next time order lagi??,5
"bagus, licu, unik tp pengirimannyalama bgt ğŸ˜ pdhl msh d indonesia, nyampenya hampir mw 2 minggu",5
Alhamdulillah....barang ok biar pun pengiriman nya ada kesalahan tanggung jawab semoga sukses selalu mksh lazada ,4
Botol bagu murah harganya taoi kwalitaz nya ok banget,5
mantappp makasih tokohnya amanah bnget dan gk nyesel deh beli ditoko ini,5
"bagus botol susu nya, sya suka, nex order lgi....... makasih lazada, makasih kurir nya...... ",5
