review,rating
Barang sdh sampai..kecewa bgt...pesen kuning sama merah di kirimnya merah semua..padahl sdh niat mau di bikin batik kombinasi...kainnya kasar lagi,1
"kainnya kaku, gak bagus, masak jumput gak ada motif dipinggirannya biasanya kan merah darah, trus pinggirannya pink, saya terlanjur beli banyak, kecewa bahannya utuh tuh ... konsumen saya pada gak mau.. sebel",5
"Pengiriman termasuk cepat untuk ke Kota Bandung. Barangnya bagus dengan harga yang murah. Seller nya fast response dan ramah, padahal saya chat nya tengah malam... Pak Kurirnya juga Okey.
Mudah2an makin berkah usahanya ya...",5
Ya sesuai dengan harganya deh,3
cepet pengiriman nya Alhamdulillah barang wokehhh bangett,5
lumayan,3
Pokonya ⭐⭐⭐⭐⭐⭐,5
"Good, bahan OK, harga murah tp tdk murahan, bagus banget, makasih ",5
kerennnn,5
