review,rating
"realpick,,bahannya adem dn karet,,hanya ajah sdikit tipis,,,tapi its okelah sesuai hargağŸ‘#thanks lazada#",4
"mantap bgt barang sesuai gambar, istri saya seneng puas bgttt,,, makasih lazada sukses trus Dan amanah",5
alhamdulillah paketan nya sudah datang dan kurir nya sangat ramah terimakasih lazada...,5
"modelnya baguus mbak, bahannya juga bagus ukurannya pas dibadan.. makasih mbaak pengirimannya juga cepeet",3
kwalitas prudukx sangat bagus jd gk bklan kecewa beli lwt lazada,5
niceeee.... barang bagus dan sesuai pesanan,5
sesuai pesanan pengirimn cpt bngt,5
"batiknya bagus, sesuai ekspektasi",5
batiknya bagus pas d badan swsuai gambar,5
bagus ğŸ‘,4
bagus ,5
"Bajunya bagus bangt maksh lazada
",5
"bagusssss thanks 
",5
mantap,5
