review,rating
"Packing rapi, Datengnya cepet..anakku syukaak..",5
"dikira besar eh kcil,, tp gk pp anaku syuka",5
"mantap,barang datang lebih cepat dari perkiraan",5
"laptop nya bagus, anak ku suka bngt...
makasih seller, pak kurir yg udh langganan. 
sukses truss buat lazada ğŸ‘",5
pesen tgl 5 tgl 18 baru dateng.pesen warna pink yg dateng ijo.kirain barangnya gede eh ternyata cuma segede hpğŸ˜¡intinya gw nyesel blanja dsn.gk mw lg gw blanja di tk ini,5
barang bagus sesuai pesanan jgn ragu bli di toko ini,5
