review,rating
terima kasih paket nya sdh smpai...tapi dilampunya banyak goresan terlihat kusam tp smua tombol berfungsi dengan baik...makasih lazada,5
Barangnya bagus... Bisa  untuk belajar,5
real pict .mksh lazada,5
"Mainannya bagus bisa nyala,tp knp yg ngajinya suara bpk2,ank sy jd takut,trs doa2ny jg nyambung terus gk ada jedany jd bikin bingung",3
barabgnya bagus bangetz... baby boy q... suka sekali... trimakasih seller. lazada. dan pak kurir... ,5
"bagus,pngiriman ny cepat.",5
alhamdulillah tanpa cacat..anak sy suka sekali..cm ko gak bs dikecilin ya suarannya jd cempreng gtu,4
"bagus, tp suaranya keras bgt",4
Harus ngisi baterai sndiri yaelah,5
sy kecewa.tombol harus d tekan bru nyala..ky barang yg bukan baru.kurir baik.,2
"anak sy suka bgt... pas buat anak"".. dr pada mainin hp",5
mantaap benar mainanyah gakk kecewa dtang dengan selamat,5
"paketnya bagus dn anak sy suka, trima kasih lazada",5
"Kurang suka, ga ada pengaturan volumenya dan suaranya kurang jernih",3
"brang nya cepat sampai, tpi rekaman suara nya kurang jelas, agak sember",5
"bagus,",5
