review,rating
sudah diterima gamis nya bagus bhn nya tebal sangat puas respon nya tidak menunggu lama cepat dikrm.maksh siler dan lazada,5
Alhamdulillah barang'a bagus banget ada harga ada kualitasğŸ‘Œ,5
"Bajunya bagus tebal n adem, pengiriman sgt cpt, terimakasih seller, terimakasih Lazada..",5
"Pengiriman cepat, dan alhamdulillah barang sesuai pesanan dan bagus ",5
"bagusssss mantap,kurir langganan baik dan ramah",5
bagus banget ini....saya mau pesan lagi buat seragaman keluarga,5
"Mkasih Lazada datang barang nya cepet,tapi warna nya beda.gpp sih tetap aq suka",5
