review,rating
"saya senang dgn pengiriman nya tepat waktu, Abang kurir nya jga ramah..tpi saya kecewa dgn pengemasan nya tidak rapih pas di buka,botolnya lengket semua sabun nya ada yg tumpah isi nya jdi tidak penuh sprti biasanya..itu pun pas pertama buka kemasannya langsung saya cuci karna saking lengket botolnya",5
barang sudah sampai dengan baik. pengiriman agak lama,5
"Yg mana pun e comerce nya toko ini recomended !!!!
Cm sekarang agak sedkit lama aja di pengemasan ğŸ˜ŠğŸ™",5
"Paket cairan tidak di lengkapi box sehingga ketika barang sampai sudah tumpah, pengiriman sangat lama 2minggu lebih saya menunggu. Tidak disarankan untuk berbelanja disini. Sangat kecewa.",1
packagingbya safe gk ad yg tumpahh.. suka bangettt,5
barang bagus,5
"maaf baru bikin ulasan ,saya suka barangny baguss",5
ok,5
Oke. mem,5
