review,rating
"suka bgt!! seller nya ramah, pengiriman cepat, dan bubble wrap nya juga tebel. next bakal beli lagi disiniii. puas⭐⭐⭐⭐⭐",5
"Seller amanah, pengiriman cepat, pengemasan rapat karena ada bubble wrap, produk disegel untuk menjaga keamanan produk. Suka banget. Terimakasih <3",5
"real pict👍🏻amanah bangeettt❤semoga jadi langganan,,,tetap amanah yaa!!🙂",5
Original guys! jangan ragu beli disini.. makasih min,5
suka sama cuci muka nya dan barang nya sampai nya cepat😍,5
bagus banget,5
"mendarat dengan baik,kurirnya juga ramah😀 ",5
thnks,5
pengirimanya sangat cepat.. kurirnya ramah☺ sudah langganan..makasih lazada🙏🙏 selalu puas ,5
Kenapa yg elips g dkirim?!,2
"sesuai pict, pengiriman juga cepet, makasihh",5
Saya suka sama sabun nya.... ,5
Barang original dan sudah sampai dengan aman,5
"Pokonyaaa terbaik dehh, semoga cocokkkkkkk.🥰",5
cocok dimuka kulit normal jg bekas jerawat jg jerawat makin membaik👍👍👍👍,5
"pengiriman cepat respon penjual baik 
",5
pengiriman 3 hari packaging nya tebel 👍🏻 BAGUSSS🥰,5
"SUKA BANGET, BARU PESEN SEMALEM BESOKNYA LANGSUNG NYAMPE 😍",5
kok gak segel ya didalamnya..,5
"Sudah sampai :) 
Pengemasannya baik
Kurirnya pun
Terimakasih atas pelayanannya ",5
Kaka ny ramah bangeet produk nya baguss semoga cocok di akuu. Makasih yaaa,5
"Barang memuaskan,pengiriman cepat karna pakai ninja exspress✨✨",5
"barang ori, pengiriman cpt, owner nya baik fast respon juga
next bakalan order disini lgi 👍",5
"terimakasih, paketnya cepet bgt sampenya..😁",5
