review,rating
Barang sudah sampai...kualitas ok,5
"baru pemakain 1 minggu.berada di pipi agak kencang dan kering...mungkin dalam proses penyembuha.semoga sesuai harapan.thank seller,barang cepat sampai.",5
"packingan rapi,  nyampenya jg ga terlalu lama.. 
sabunnya ga berbau..  setelah dicoba 2 hr ni..  wajah memang agak kering..  moga cocok dan hasilnya memuaskan.. ",5
"masih nyoba,udah seminggu blum ada hasil",3
maaf baru kasi ulasan.. alhamdulillah hampir 2minggu pemakaian hasilnya sdh mulai terlihat.. flek hitam menipis semoga nanti bisa hilang dan mulus. ,5
"blm dicoba,semoga cocok",5
Barang mengecewakan. Tidak ada hasil. Biasa aaja. ,2
"barang udah nyampe gan
bintang berbicara
ngahaturkeun ",5
pembelian kedua.. kalo hasilnya memuaskan pasti aku jd langgananğŸ‘,5
BARANG CEPAT NYAMPE BELUM DICOBA.KURIR BAIK.,5
packing rapi baru mau nyoba smoga cocok,4
"masih saya coba, pemgantar ramah.",4
Saya baru coba mudah2an hasilnya bagus,5
makasih ,5
"terimakasih barang nya udh nympe,,  smoga produk nya cocok y ",5
semoga cocok..dan order kembali..tengkyu,5
paket ya udh dtng semoga aza cocok ,5
sabun nya kecil amat untuk harga seratus ribuan ,1
"Paket sudah di terima dengan baik,tp blm di coba,semoga aja cocok...",5
Mudah2an barangnya ampuh. Trima kasih,5
ko malah timbul jerawat ya??? ,5
"semoga cocok dg sabunx
",4
"Nipu gk sesuai dengan yang saya pesan,ğŸ˜¡",3
mash menunggu hasil,5
