review,rating
paket sudah sampai barangnya bagus dengan harga segitu ...sellernya jg baik bgt ... walaupun q salah ngetik warna tp selernya mau ngasih warna yg q minta... next time order LG ğŸ˜ ad bonus masker jg ğŸ˜˜,5
"paket udah nyampe,  sumpah kecewa banget barangnya jelek,tipiss..pokoknya ogahh mau belanja di toko ini lagi...barangggnya tipiis banget",2
lmyan lah dngan harga segitu mah.,5
"terima kasih paketnya dah nyampek, tp kok gak sperti gambarnya ya beda banget, agak kecewa",5
Baguss sipp,5
Barang realpick,5
Barang bagus untuk harga segitu. agak nerawang sedikit aja,5
