review,rating
Tebal bagus nyaman pasti langganan ini mah ,5
"warna yang dikirim lain dari yg d pesan, kalau tidak ada bilang aja ,, semoga kedepannya lebih bertanggung jawab",3
bagussssssss tapi jaitannya ada yg kurang rapih dikitttttt penjualnya bercabat banget pengirimannya bikin greget dongg nyampe 3 hari padahal bdg-crb ğŸ˜”,5
bagus dan sesuai dengan harganya ,5
agak tipis sih....sesuai dengan harga lah.... ,5
bahan yah Jlk warna yah tidak sesuai baru kali ini beli di toko kek gini !!!,5
bagusğŸ¥°,5
