review,rating
"paket'y udh smpe
tapi sy kecewa
pesen warna hitam
tapi yg dtg warna navi
dari jahitan jg ada yg bolong gt
Abang kurir'y sih ramah
makasih lazada...",3
"kegedean tp ok kulir baik bgt bintang lima deh buat kulirnya
",5
Makasih lazada.....paketnya udah sampe,5
"barang sesuai bagus,, mantap,, packing aman,, dan pengiriman nya cepat ğŸ‘ğŸ‘ ",5
"maaf telat ngasih ulasan
makasih pesanan sesuai warna dan real picture
makasih lazada",5
bagus tapi agak kepanjangan,5
saya suka persis dengan gambarnya pertahankan terus kwalitasnya,5
bagus bajunya makasih lazada,5
