review,rating
"Real pic...
Bahannya bagus, nyaman, abang kurirnya baik, sopan enak di ajak bercandanya, pokoknya puasss banget. thanks lazada.",5
lumayan lh hrga sgitu mh...di tingkat kn trs ya pelayanan ny agr konsumen seneng dn puas,4
barang nya lumayan bagus ,5
"sesuai pesanan游땘游땘tenks seller.. to abang kurir udh langganan pula,top bngd游녨游녨游녨",5
bagus cardiganx..ukuran jumbo muat d bb 70kg an..suka pokokx..bahanx jg bagus,5
bagusan okeee,5
suka,5
Udh ready alhamdulillah. Tpi sedikit ada yg gk kejahit pas di area maaf ya ketek.tp packingan rapi. ,3
Maaf baru kasih ulasan Alhamdulillah barang sudah sampai saya suka terimakasih lazada游땒,5
"bahannya adem saya suka
",5
Alhamdulillah udah sampai .. cardigan nya aku suka.. cocok...bhn sesuai dengan hrga 游녨,5
sesuai ya cuma kegedean ma saya mah.bahan lumayan baggus.,5
Makasih barangnya sesuai gambar nggk nyesal beli disini,5
"maaf Bru ksih ulasan. ,barang bagus",5
ril pik bagus,5
"cpt sampenya siang msn bsknya lngsung sampe...kurir sopan.ramah puas walau slh msn warna ga apa
",5
suiternya baguuus..    aku suka makasih. ,5
"keren gaes
",5
Bagus Sukaa bngttt,5
"sangat bagus bajunya ,, sesuai apa yg diminta 游때游때游때游때游때游때游땕游땕",5
Alhamdulillah pengiriman cepat barang lumayan,5
"oke sesuai dengan harga maupun warna apalagi bahan,)",5
agak kecewa dengan barang nya masa di pas kerah lejer nya robek tolong dong packing yang bnr di liat2 dulu apa udah ok app belum agak kecewa dengan seler nya,2
"Bgus cardigan sesuai hrg,mksh reseller n lzda",5
bahan nya pantas ,5
saya mesen warna hitam datang nya warna kuning kunyit,5
bagus dengan harga segitu游뱅,5
"mksh paket dah d terima,  bahan nya lumayan bagus, wrna sesuai pesanan 游녨",5
lumayan,3
baguss,5
real pict.. bhan teball puas bngtt.. 游땘,5
brg dh sampe mkasih kurir,4
ok sesuai dengan gambar,5
"bahan ny bagus tapi pengirimannya lumayan agak lama tapi puas dengan harga segitu
",5
baju'a bagus pas di badan...Next order lgi,5
baju pas buat bini,5
"Pengiriman ea cepat saya sangat puas .. 
Baju ea ok sesuai harga ...",3
bagus tpi bhn agk panas,4
nie pesen wrna merah dtng wrna kuning tp gpp lh.. wlupn agk kcwa.. ,5
lumayan wt harga segiti,5
"bahan tebal, bags... real pic
",5
barng nya bagus sesuai pesanan makasih lazada,5
sesuai gambar... cepet dtgnya kurir baik ramah terima kasih lazada,5
sesuai pesanan..mksh seller..mksh lazada,5
"sesuai pesanan brang y,anak sy suka...tq lazada.",5
suka bangeettt,5
bahan y panas kurang memuaskan,5
Sesuai harga ,5
Bju'a Suka bgus ,5
memuaskan..,5
sedikit mengecewakan.barangnya ada yg tdk sesuai utk warnanya. ,3
"maaf baru kasih ulasan....barang ok bagus pengiriman nya cepet lagi
",5
Barangnya bugus sesui pesannandeh游땘mksh lazada游때游땘,3
"Alhamdulillah barang sampai, pas di badanku, barang lumayan bagus sesuai dengan harganya",5
bhn nya bagus kurir nya jg udh langganan namun sayang wrn tdk sesuai pesanan. .,5
tipis bnget,5
"Bagus,,,",5
bgus saya suka,5
"ma kasih lazada atas kirimannya,tidak nyesal pesan dilazada",5
"bagus sesuai gambar tapi bahan panas
okelah untuk harga segitu.
mkasih....",5
real pict sesuai dg harga,5
bagus,5
游땘游땦,5
bgussss游땢,5
