review,rating
imut banget,3
Mengecewakan sekali dalam memberikan warna tidak sesuai dengan pesanan dan hasil chatt sebelumnya dengan penjual. Sangat tidak rekomendasi untuk membeli produknya. Tidak komitmen dengan janji.,1
barang sobek sepertinya krna paku,3
salah warna tp tdk apa2 lah,5
Bagus barangnya membantu menyetrika g nunduk nunduk lagi,5
barangx sih ok cuma terlalupendek untuk ukr panjangx jd kalo nyetrika celana panjang mesti di majumundurim ,5
"meja setrika sdh sampe,meski agak lama,tp bahannya kokoh dan rapi pembuatannya,meski motifnya beda sama pesanan,to ga apa ini jg bagus..makasih lazada dan oscar living express",5
ğŸ‘,5
"ukurannya kurang panjang,,,semoga aja awet.",4
Kiriman cepat..bagus sesuai gb dan harga,5
Alhamdulillah pesanan udah sampe....barang bagus...sesuai order...tks lazada,4
