review,rating
"parah yg datang beda bgt sama yg difoto bnr"" mengecewakan..kapok belanja di perissos..cukup jadi kali pertama dan terakhir..buat costumer lain mohon lebih hati hati kalo belanja ya..pilih kualiyas deh ketimbang harga..",5
"Aq mesen warna peach, ko malah yg dtng pink fanta yha, dah gth resleting jahitan'y yg ujung pd lepas tuch...sy jd ssh tuk sleretin tas'y...tolong yha klw mau kirim brg d""cek dulu ad yg cacat gk..???? ",3
"Barang nya jelek ngak sesuai
",1
"terima kasih barang sdh kami terima, tapi maaf sebelumnya nya hanya sekedar masukan, tolong kalau mau memberikan diskon, jangan mengurangi mutu barang. karena bisa membuat konsumen kecewa dan jera, mending kasih harga yang sesuai barang kan karuan. 

",2
Alhamdulillah barang udah nyampe bagus cocok untuk harga segitu next time aku order lagi packing rapi,5
"kualitas sesuai harga. warna saya kira pink tua, ternyata pink muda",5
warna tidak semerah di gambar,3
tas dah sampe.... maksihh lazada ,5
Alhamdulillah datang tepat waktu,5
barang nya bagus,5
dalem tasnya knapa polos ya? ga ada sekat buat taro perlengkapan bayinya,5
"tas bagus, kain kuat cocok jg untuk traveling",5
no recomended,1
tas nya bagus..sesuai gambar ..,5
Lumayan lah.. ,3
"Tasnya kecewa ...katanya tas buat baby,ternyata biasa aj ga ada sekat bt botol jg t4 pempesnya",5
