review,rating
"tas nya sesuai deskripsi, bagus nya dipaking nya ga di lipat, jadi tas nya mulus no lecek. harga nya murah karena beli pas birthday lazada kemarin,thanks",5
"barang bagus gan! ukuran sesuai dengan detail produk. Penjual ramah, respon cepat... TERIMA KASIH Gan!",5
makasih lazada barang bagus dan sesuwai dengan di gambat,5
makasih ya tasx keren sesuai gambarx ..ğŸ‘,5
mantap tas benar2 realpict n bagus bgt. jgn ragu yah belanja ditoko ini...,5
"tas nya bagus, tapi rain cover nya nggak a",5
Trima kasih barang sesuai pesanan...,5
"barang sesuai pesanan, datangnya lebih cepat. recomended banget..",5
Barang bagus sesuai pesanan,5
"sdh cocok pesanan, tapi lambat barangnya sampe",3
"kualitas bagus, pengiriman cepat bgt. Recommended seller",5
lumayan,5
