review,rating
"lebih ngemang,diameter lebih gede.maaf baru ulas. rencana setelah ada hasilnya baru saya ulass.makasih ya",5
"lebih bulat dan ketata di dadaa, awal pemakaian belum kerasa hasilnya.tapi saya cobba rutin alhamdulilah sudah ada hasil yang maksimal",5
"Ukuran Nambh gede, kenceng ugaaa",5
"mantap banget kak , hasilnya maksimal, awalnya ngga percaya tapi beneran terbukti setelah pemakaian rutin",5
"Alhamdulillah setelah 4 kali pemakaian payudaraku mulai besar, maskernya enak dipakai, adem, wangi, enak deh pokoknya,thanks sisst",5
"maaf baru ulas,sudah keliatan hasilnya",5
thanks hasilnya sangat memuaskan.. pengriman cepat dan kualitas produk sangat bagus,5
dari 36b ke 38 mantap,5
Mantap kak produk nya ,5
mantap min paketnya keren dan hasilnya mantap ,5
Paket sampai dengan aman serta bagus banget enak pas tak pakai,5
"sangat mengecewakan, order 2 dikirim 1... dikonfirmasi tdk ada tanggapan...",1
"hasilnya beneran terbukti ampuh , pas banget buat yang lagi nyari produk ini ",5
"penjual ramah, pengiriman cepat, packing rapi.",5
thannks payudara jadi lebih besar.. sangat puas hasilnya..,5
Lengkap dari pada toko lain sih kalau menurutku,5
Lengkap dari pada toko lain sih kalau menurutku,5
mantap kak hasilnya luar biasa banget keren polllğŸ˜ŠğŸ‘,5
pembesar payudara ampuh dan tanpa efek samping,5
"Paket sesuai pesanan,packing rapi,pengiriman cepat",5
