review,rating
"maaf baru kasih ulasan kak,karna saya mau buktiin dulu kak,,produknya bagus bagat ini hasil 10x pake kak,saya puas bagatt,,saya mau order lagi kak,nanti akan saya promosikan ke teman sya kak",5
"maaf kak baru kasih ulasan karna saya mau buktiin dulu kak..produknya emang bagus bangat,hasilnya memuaskan",5
"Baru pertama x pakai udh terasa kencang"" gitu,mudah""an saya cepat mendapatkan hasil yg saya inginkan",5
"awalnya ragu..sampai ngak sesuai cara pakainya tp 3x pakai udh terasa kencang & besar,saya mau order lagi kak,masih belum puas:)",5
"Makasi ya kak, produk nya manjur, jadi lebih pede depan suami sekarangğŸ¤­",5
gak ada perubahan padahal udah pake rangkaian nya ğŸ˜Œ,2
"wuisss mantap ni produk kak,,kencang & udah nambah besar trimakasih ya kak",5
"tete saya jadi padat lagi kak & udah besar juga..trimaksih kak,next order lagi",5
"beli yg k3x ngak pernah kecewa,hasilnya buat saya puasss.thank kak",5
