review,rating
yaya msn nya obat pengenceng payudara knapa yg datang obat ktiak kcewa sya. ,2
alami herbal aku habis melahirkan hasil jadi kencang dann padat meskipun lagi menyusui ini aman ko untuk busui ,5
masker nya alami banget wangi rempah tradisional dan udah ad hasil padahal baru pakai 2x dalam seminggu sudah kembali padat dan kencang best produk menurut aku tjnks lazada,5
tuh barang yg salah,5
Barang sudah sampe packing rapi. Makasih seller makasih lazada dan kurirnya juga ramah ,5
"Kalo udah ada hasil bakal aku tambahin bintangnya
(sekedar saran kalo kirim paket tolong tulisannya jangan pembesar payudara) menurut saya itu privasi",4
"paket sudah smpe dan cepet, kurirnnya juga baik..",5
smoga cpat efeknyağŸ˜˜,5
belum di coba,5
"packingnya sangat rapih,terima kasih lazada dan kurirnya sangat baik",5
