review,rating
"Mantabbb..maaf baru kasih ulasan sekarang..karna aq mau buktiin aja,apa bner  masker ini bisa buat pyudara kenceng dan besar..dan stelah aku coba pake masker slama 2 hari loh pdhal..punya aku lngsung kenceng dong,dalam hitungan beberapa hari aja udah knceng dan membesar,gmna nanti kalo seminggu mksi",5
"Maaf baru bisa ngasih ulasan hehe.Soalnya sibbuk banget.
Setelah pake beberapa kali udah keliatan perubahannya dan sangat memuaskan.Thx yaa langsung bintang 5 
hehehe....Makasi ya Seller",5
"Makasih buat seller dan LAZADA baru kali ini nemu produk yang sesuai ama ekspestasi heheheeh...
insyaallah besok saya beli lagi deh ",5
"barangnya  udh sampai  kurirnya ramah... 
tapi sayang kok packing nya  ga ada prevesi... cumn di pcking plastik  putih.
dan di paket yg aku pesen ini free kuas... tp nyatanya  ga ada. 
ini juga ga ada petunjuk  pemakaian... gmn cara  nya dan brpa lama hrus pakai masker  ini ga ada.. 

tolong di perbaiki  lgi.... 
",5
"Alhamdulillah, paketnya sudah diterima. Seneng sama penjualnya ramah banget ^^. Semoga cocok di aku dan hasilnya maksimal. thank's",5
"Sangat Puas dengan Produk nya Walaupun pengirimannya terlambat sehari tapi syukurnya sudah dapet penjelasan dari seller akhirnya jadi ngerti akunya
",5
"SANGAT Puass
Pengiriman Cepat 
Produknya Original
sipp dehğŸ‘Œ",5
