review,rating
"Alhamdulilah sampe paketnya..
kondisi barang baik tidak ada yg cacat 
bau breast gel nya juga wangi ya.dapet 2 stiker sama cara pemakaiannya lagi..debestt deh游땘游땘游땘游땘.
",5
maaf baru kasih ulasan soalnya sibuk bngt kan kemarin lebaran 游때ini baru aku buka paket nya packing rapi seller ramah respon cepet bngt pengiriman juga cepet kurir ramah pokoknya top bgt游땢mudahan ada hasilnya baru mau aku coba,5
packing oke. di bungkus satu2. di sertai jga keterangan cara penggunaannya. smoga bisa bgus hasil penggunaannya. ,5
"Alhamdulillah maksih banyak seller, produknya ampuh bikin payudara lebih bulat dan kencang. Original dech suka sama hasilnya. Makasih tutorial pemijatan payudaranya ",5
"Maaf baru kasih ulasan, paketny udh aku terima dari kemaren tpi baru mau dicoba skrng sih mudah""an cocok di aku ",5
"Paket sudah sampai dengan cepat, pemakaian hampir 3 hari, hasilnya memuaskan banget, suamiku kanget waktu main wkwkwk ,, maksih seller",5
"Kencenggg deh,, padahal sebelumnya kecil gak kyak gini,, dan sekarang hsilnya inii seneng banget dah pokoknya, makasih barangnya sesuai pokoknya realpict, kurirnya baik, sellernya ramah, makasih lazada",5
"Orderan aku yg ke 2xnya pertama pakek masker dan sekarang pakek serum gelnya,, banyak perubahan gak main2 sampek braku gak muat,, intinya pemakaian harus rutin,, thanks seller, toko, kurir dan lazada,, sukses selalu ya kalian 游땢游봅",5
"gak sia2 pilih teh pelangsing yang bener2 mantul banget, sudh yg ke 2x orderan hehe,, orderan ke 3 jgn lupa kasoh diskon ya kak hehe",5
"konsumsi di saranin sama temen, pas produk sampe langsing coba, rasajya bener kaya teh hijau lbih mendekati hambar, tapi aromanya khas banget,, suka bb jd turun, sekarang pede kalo foto2",5
"Orderan yg ke 2xnya, payudaraku lebih kencang suamiku kaget waktu liat wkwk,, makasih seller gak salah pilih produk,, sanget memuaskan pokoknya hehe",5
"pengiriman sangat cepat, respon penjual juga baik, ramah
barang real pict sangat, semoga hasilnya memuaskan
terima kasih lazada",5
"maaf bru ksih ulasan sangat puas blanja dsini packingan rapi kurir jg rmah tpi blum di coba smoga cocok dan bisa order lagi
dan terus pertahankan biar pelanggan puas
mkasih lazada",5
barang sudah sampai kk. terima kasih.semoga langsung cocok sama aku gak ngeselin belanja dtoko ini bener amarah .... ,5
sangat baik penjual sangat ramah sekali. barang sampai dengan rapi pengiriman cepat kurir ramah. makasih ya gan,5
paket udah di terima terima kasih Lazada游똂,5
"barang sesuai pesanan, mantap dah pakoknya, thks 游땕游땕",5
"tehnya sempurna, mantap betul",5
"produk mendarat dengan sempurna,, penhiriman super cepat, admin sabar banget,, makasih lazada",5
"Hai kak, paketnya sudh sampai, kurirnya ramah moga aja cocok tak jadiin langganan, mksih lazada",5
"barangnya udah nyampe, mudah""n aza cocok ya gan biar bisa pesan lagi",5
"Paketnya udh smpe tdi sore,, bru dicoba mudah2an cocok dan da perubahan ",5
"Paket sudah sampai pengiriman cepat kurir tau jalan, terimakasih gan sukses terus",5
"maaf baru ksih ulasan, baru 3x pemakaian,, udah kliatan lebih kencang,,, mantap
",5
pket Talah sampai trimksh buat seler dan kurir smgga cocok,5
"puas banget sama produknya sist,, suami saya sampek kaget waktu main hehe,, fast respon juga sellernya,, thanks ya sist 游때游때",5
"alhamdulillah barang aman,,. privasi terjaga sangat amanah penjualnya sangat baik aku suka aku suka 游땤... semiga usahamu lancar terus ya kak 游땒",5
gk da perubahan,5
"Barangnya sudah sampai gan, pengiriman cepat kurirnya juga ramah, semoga lancar terus gan 驕쥞잺驕쥞잺",5
barang sampai dengan selamat semoga bisa cocok kalo cocok saya akan pesan lag游땎,5
semoga ad hasilyh ,5
"paket sudah di terima dengan kondisi memuaskan
thankyu lazada",5
bgus brgnyh oke,5
Harus telaten dan sabar saja untuk mendapatkan hasil yang Sesuai harapan 游땕,5
Hasilnya ada peningkatan 游땤,5
"barang sdh sampai tapi belum di coba,, makasih yaaa",5
"Terbaik, thnx responnya sist
",5
"gak sia2 orderan yg ke 3xnya di kasih bonus 1 hehe tak kirain boongan,, mantul 游땤游땤",5
pokoknya mantap dah 游때,5
udah dteng dong cepet bgt游때 semoga aja ccok yaa ,5
"Wah gila produknya asli mantap, udah banyak perubahan",5
"Sangat memuaskan, maksih gan",5
Thanks sist,5
"Hasilnya sangat memuaskan kk, alhamdulillah gk slah pilih produk, mksih seller mksig lazada",5
wooww sangat memuaskan pokoknya mah,5
memuaskan 游땤游땤,5
Barang sampe semoga saja cocok,5
Beda dari yg lain lumayan top,5
