review,rating
"untung diprivasi sama sellernya, lupa minta diprivasikanl barang dititipkan ke tetanggaku soalnya rumah kosong gak ada orang, makasih gan sukses selalu ya",5
"terima kasih min, barang sudah sampai dengan aman, packing rapi, kualitas barangnya bagus, pengiriman cepat",5
"terima kasih gan, barang sudah sampai, packing aman, produk bagus, mudah didigunakan ada panduannya juga",5
puas banget sama sellernya produknya dan tentunya lazada ,5
"terima kasih gan, barang sudah diterima belum dibongkar,semoga cocok dan bisa beli lagi",5
"sudah diterima, belum dibongkar, semoga ok punya....",5
"barang sudah di unboxing, tanks",5
"tanks for your service, i'm verry happy",5
"telah diterima seperangkat alat keromantisannya gan, makasih",5
"barang sudah diterima, packing rapi, kurir ramah, privasi terjaga",5
"sudah diterima gan, mantap",5
"seneng deh pesanan sudah keterima, privasi aman banget soalnya yang nerima gak aku sendiri.",5
"barang sampai, packing rapi, privasi aman mantap",5
"aman bgt paketnya privasi terjaga
",5
sudah diterima gan. manjur banget,5
"Alhmdulillah barang sudah mendarat dengan selamat,,semoga ada hasilnya,, makasih seller n bang kurir",5
"amunisi sudah mndrat.trimkasih seler+lazada.smga berkah..
pengirman cpat, penjualnya ramah,, mksih lazada",5
"mantap pelayanannya seller dan kurirnya baik-baik. fast respon and fast delivery, moga khasiatnya sesuia",5
"sudah saya coba, sudah kencang tp blm besar, makasih atas produknya gan puas buanget aku. kalau habis mau order lagi, sedia yang banyak ya seller",5
"pesanan sudah saya terima gan, semoga manjur semoga tambah laris gan",5
"sudah diterima gan, terima kasih lazada",5
Thank you very much,5
"Barang asli dan masih segel, sesuai dg orderan, paketnya jg smpai dg cepat, smoga obatnya manjur",5
"gan, barang sudah di terima istriku, makasih atas pelayanan, makasih buat lazada",5
puas,5
mantap,5
