review,rating
"paket udah dtng,barang bagus anak aku suka cuma aku minta ukuran m ko yg d kasih malah l tp ga apa lah ,mas kurirnya sopan sukses terus lazada",5
baju bagus sesuai sm d gamabar mskh lazada kurir jg ramah,5
Bagus.. makasih seller n lazada.........................,5
"bjnya sesuai gmbr bgs dan cpt sampai kermh,mantap ...",5
Thanks you barang mendarat dengan selamat dan real pictt tapi sayang uk L nya kecil ku kira L besar,5
bagus saya sukaaa sesuai harga,5
"pesanan sdh nyame dn sesuai .. 
trmksih ya",5
Bju nya bagus,5
top,5
mantap,5
