review,rating
"Trmksihh bjunya
 Bgus real pick amnah lgi pkoknya mantappp ",5
paket sudah sampaik  sesuai dgn pesanan terimakasih lazadah,5
mhon maaf sya ksih bntng 1 krna psnannya ga sesuai tpi lmyn sih,1
"Bahan bagus, real pict, ssesuai pesanan ğŸ‘",5
bagus sesuai gambar ğŸ˜»,5
bhanya oke tp syang gk sesui permintaan mintanya putih sama hitam dtangya hitam sama merah,3
barangx beda bila kosong harusx ksih tau biar kita miih ,5
"sangat bagus, dan saya suka. ",5
baik,5
bahannya beda sm yg item ,5
sesuai pesanan..,5
"uk besar, XL ",5
"pesen putih datengnya item, baru dicuci sekali itemnya langsung pudar",3
baik,5
memuaskan,5
