review,rating
"bagus bahannya, puas beli disisni packingnya juga rapih ponakan saya sukak. selkernya baik juga love seller. abangnya yg nganter baik banget juga ",5
"Barang nya sangat memuas kn,buat kejutan sama pacar ku,dia sangat senang,bahan nya tebal bagus bangat makasi gan",5
mantap ğŸ‘ğŸ‘Alus banget bahanya nyaman d pakainya ,5
Pesanan saya Yang Seperti pada gambar yang datang Kok Beda ! Next Jangan Gitu Lagi Ia Kan Saya Mau Jadi Langganan Okee,5
mbaa pesennta stich kok yang dateng malahh hitamm polos yaaaa giman sih,2
"barang sdh sampai,blm dibuka si soalnya buat kado,trims lazada sllu jd langganan,",5
"sudah kuduga toko ini jelek, pesen stitch 2 yang dikirim doraemon 5 apa gak di cek ya yang punya toko, wes yang lain jangan pernah beli disini lagi, toko ini penipu, sudah banyak yang tipu, kalian jangan sampek ketipu",1
"yang lainnya bagus kak sesuai, cuma yg maron knpa embos kan pesannya satin yang licin  tapi bagus semua",5
"kecewa banget,pesen piama stitch malah yang dateng taddy bear..klo stocknya udah ngga ada mending bilang di cansel jangan mau untungnya doang,bulan puasa kok jualan dibohong2in ngga berkah..semoga dibales dgn perlakuanya yang tidak jujur",1
mantul,5
ngk sesuwai gambar tolong dong KK klo jualan tu yng amanah,2
kecewa saya pesan Stitch yg datang keropi mana datangnya lama sekali,3
"bagus

",5
