review,rating
Teri makasih lazada pesananny sesuai dengan gambarnya ,5
"waw keren, bgus bget, sesuai orderan dan pelangan suka bget. maksih yah tokoh ini bisa di percaya, ayo tidk kecewa pesen di sini",5
"Barang sesuai bagus pengiriman cepat,  cuma sayang baut luar ada yg copot satu ntah kmna.. 
Tapi ckup puas lah dengan harga segitu...",5
ok mantaff lah!!! ,5
alhamdulilah barang nya OK tidak mengecewakan saya puas,5
"Maaf ku kasih bintang 2,",2
mantaaaaaap. makasih lazada barang tidak mengecewakan,5
alhamdulilah ...dah sampe brng ny ..bgus bgt sesuai gambar,5
