review,rating
"Mantap banget Jam tangannya, Saya suka banget,pokoknya puas banget belanja di toko ini. Terimakasih seller, terimakasih Lazada. Free box dan baterai cadangan juga, mantap mantap mantap",5
kernlh pokok nya,5
real pick saya suka mksh lazada dan mas kurirny ramah,5
paketan ny udah nyampe barangnya bagus bngt ngk nyesel deh mksh lazada,5
"Jam tangannya bagus banget.Free Baterai pula游땘.
Untuk packingnya rapi banget,,,
Pokoknya jangan ragu untuk berbelanja fitoko Ini游때游때Terima kasih Min",5
"barang nyah sudah sampai
barang nya berfungsi dengan baik dan gratis batrai nya juga 
terimakasih lazada
terimakasih seller
terimakasih kurir",5
"Bagus banget jamx,, nggak nyesel deh. Next order lg游땢游땤游땤游땘游땘",5
"游땘游땘suka banget barangnya keren abis,,murah tapi ga murahan real pict pengirimannya juga cepet sebelum estimasi,,ga pernah kecewa belanja di lazada,,thanks lazada",5
"Barang dah sampe, packing rapih... Ada batrry tambahan pula... Thanks seller n thanks lazada... 游때游때游때",5
"Jam nya sangat bagus ,tapi saya sedikit kecewa notifikasi dari lazada kata nya dalam perjalanan ke rumah tau tau udah gagal pengiriman aja,padahal kurir sebelumnya  sama sekali gak ada kabar atau nelpon saya游땨.tapi kurir yang ngantar barang saya tadi sangat ramah游땘makasi lazada",5
"Real pict, sesuai dengan harapan, dan barang diterima dalam kondisi baik, lengkap, packing yang rapi, serta waktu pengiriman yang sesuai dengan estimasi.
Recomended product.
Recomended seller
Kurir ramah dan sopan
Terima kasih Lazada. 
",5
pas,5
"realpick untuk barang nya, suka juga untuk modelnya. jangan buat kecewa konsumen mu pak. pokoknya mantap ",5
Mantap barangnya sesuai dengan gambar kulirnya ramah lagi makasih lajaza makasih  pak kulirnya . Dhe besss pokonamah lah. ,5
Alhamdulillah pesenanku Uda sampai dgn baik pokok ya mantul banget hrs amanah ya supaya pelanggan senang 游뱅,5
"sesuai dengan pesanan, pengiriman cepat dan kurirnya ramah, thanks lazada ",5
pemgiriman tepat wKtu.. barang nya memuaskan.. ,5
"klau jam mati jngn di kirim atuh,udah di ganti batre nya ttp ajh mati
kecewa lah",5
thank u nyampe barang nya bagus ada Batu Cadangan nya lagi abang kurir nya jga Ramah baik 游땢游땢,5
"keren banget jamnya, packingnya rapi, freenya juga beneran, kurirnya juga ramah, puas banget deh 游녨",5
jamnya bagus..semoga awet,5
"barang sudah diterima , kondisi bagus, terima kasih ya",5
Jamny bgus realpict tp yg 1 ny kdng hidup kdng mati pdhl dah d gnti batre ny ttp az gtu.. ,3
jam'y sesuai gambar Bagus 游땏,5
Bagus dan puas,5
sangat memuaskan,5
picuter sesuai dngan real :D elegan semoga awet jamnya,5
sesuai sma gmbar,5
"Cukup puas, cuman sayang kecil ukuran nya, tanks lazada ",4
"Joss&packing rapi, kurir ramah-MANTAaaaaaAaap",5
"Paket sudah diterima, barang bagus sesuai pesanan",5
saya puas dengan barang,5
"sayang jam istri sy kekecilan...

",4
Barang dah sampe... Barang bagus dan pengirimannya cepat,5
tepat waktu trmksh lazada游녨游낖,5
barang sesuai pesanan,5
puas banget belanja di toko ini barang nyh sesuai游땘,5
"suka bangetg kecewa游땘mksih lazada,toko n abang kurir nya",5
maaf tlat ksih ulasan游뗵 barangnya bagus kulirny ramah+baik,5
Barang nya bagus sesuai dengan pesenan saya suka,5
Barang bagus,5
Lumayan ,5
mantap,5
Ok bgus,5
"good
",5
