review,rating
"mantappp...
pengiriman lebih cpt dari estimasi.
God service sdh jd pelanggan tetap.
seller ramah fast respon.
amanah&jd barokah bagi pelanggan.
sdh order 2x mantapp...
",5
"barang realpict, ade saya senang buaaaaanget pokoknya, sellernya paling ramah selama saya belanja online baru kali ini seller yang mau konfirm barang yang mau, pokok recomended buaaanget deh next pasti saya pesan lagi 
",5
"brng bgs sesuai gambar,  puas bgt dh pokok ny,  kurir ramah,  makasi lazada",5
"makasih lazada barang nya udah nyampe bagus lagi jam nya suka poko nya 👍😊, kurir nya juga ramah ",5
parah jelek banget,5
Jam nya bagus realpic.. anak Saia seneng bgtt.. next pasti order lagii ... ,5
 lumayan lah dgn harga segitu.pemgiriman sesuai dgn estimasi,5
"jam nya bagus sesuai yg di harapkan..makasi lazada
",5
terimaksih lazada barangnya ok banget 😊👍,5
alhamdulilah barang bagus makasih lasada,5
jam nya bagus,5
Sumpah belanja disini ga nyesel jamnya bagus banget makasih yh ka aku suka banget sama jamnya pakingnya jga rapih,5
"seperti biasa mantull jasa ,tpi dari pihak logistik nya dikirim nya agak lama ,gk kayak biasanya,tpi gk papa sukses kedepan nya🙏😁",5
makash banyak yaa...🙏😊 jam tangannya real pict...😊klo mau pesan jam tangan boleh nih kesini... soalnya jujur dan amanah jualannya...saya udh buktiin ko😊,5
Keren,5
"bagus banget
respon cepat
realpict
kurirny ramah
udah di setting lagi jamnya
pengiriman cepat banget sesuai estimasi
pokoknya the best, kalian wajib beli disini",5
seng bnr biar wlw kiriman nya cuma 1 tapi kurir nya baik mau kirim yg 1 lagi ramah pula kurir nya maksih atas bang kurir yg baik.,5
thanks lazada jam bagus sesuai dgn pesanan anakku suka,5
jamnya baguss berfungsi sempurna...pengiriman juga cepet puass blnja disini,5
"alhamdullilahh memuaskn dengan harga yang sama dngan kualitas barang nya ,, dan kurir nya pun ramahh 
",5
Bagus banget real pich barangnya sampe sesuai yg digambar pokonya gk nyesel deh belanja di toko ini sukses terus yaa:),5
thanks you,5
"paketnya udah datang cepet juga, kurirnya baik brangnya real pict sellernya juga baik,, pokoknya memuaskan dehh 😍😍😍makasih lazada 🤗🤗",5
"mantap, top bangett pokoknya😎",5
"alhamdulillah barang barang sudah di terima barang bagus, harga menentukan kualitas, seller sangat ramah dan amanah, real pict semoga maju tokonya, ni baru seller top👍👍👍👍👍👍",5
barang mendarat dngan selamat sesuai pesanan paking rapi kurir ramah,5
"respon cepat, pengiriman cepat, dan real pict mantap pertahankan🙏",5
barangnya sudah sampai tanpa cacat sedikitpun. pengemasan juga bagus. baguslah pokoknya,5
barang sesuai orderan dan tidak mengecewakan terima kasih Lazada.,5
paket udah sampai sesuai permintaan..trimakasih,5
sangat bagus jam ya,5
bagus bangettt pengiriman juga super kilat,5
"jaman tangannya keren banget
suamiku suka bgt 😘👍
",5
mantappppppp,5
sesuai pesanan pokoknya mantul. kurirnya juga ramah. ,5
Bgus bnget😍gk kcwa pokonya sler nya jga baik bnget,5
sesuai pesanan dan kirimnya cepet,5
barang nya bagus sangat memuaskan ☺️👍👍👍,5
sangatt memuaskann ,5
bgus jmnya..suka bngt,5
jam nya bagus sesuai gambar makasih lazadaa,5
Baguuussssssssss bangeeettttttttttttttttt😍 pacarku suka katanyaaa makasih lazadaaa,5
jam nya bgus sya sngat puwas maksih lazdah dan mksih juga selernya ramh cocok banget,5
packing rapih,5
Jam nya keren tapi penggiriman nya sanggat lama memakan waktu 2 minggu 😢 ,5
paket sudah diterima barang sesuai pesanan. cepat dan tepat. terima kasih👍,5
Mantul bosss,5
"trmksh brngny bgs sesuai gambar

",5
mantul da kurirnya jga ramah 👍👍👍,5
Asli barang bagus banget pengiriman cepat🤗seller ramah😊,5
mantapp realpictt bangett 😍 bisa nyala juga,5
sesuai harga mantul,5
"Makasih mas, paket sesuai permintaan😍",5
bagus banget jam tangannya gak kecewa semoga jadi langganan terus,5
"jam nya cuco bgt,real fick,mkasih ...",5
Barang bagus ok deh bwt toko ini,5
bagus banget jamnya puas belanja y,5
Tulisan GShock nya ada satu yg kebalik (g shcok ) . Tp gpp thkx lazada,4
"barangnya sesuai dengan foto,sy sangat puas belanja di toko ini,sangat rekomeded..top bangeeet dah👍👍👍👍👍👍👍",5
"Alhamdulilla jam tangan syaa kemaren sore sudah datang dan barang ny bgss.
Pokonya mantap deh Lazada nii.😸
Terimakasih Lazada><",5
bara baru sampe ke marin cept bgt cuma sehari% jam nya juga mantap salut sama seller nya respon bgt poko nya kasih binta 7. cuma ada nya binta.5😆 makasih lazada dah poko nya toop markotop👍👍,5
mantul jamnya,5
makasih brang y suka nh???,5
"alhamdulilah paketnya udah sya terima,, barangnya sesuai dan  bagus aku suka,, thanks lazada dan mas kurirnya",5
Bagus bangettt real picth sesuai sama yg digambar pokonya gk nyesel deh sukses terus yaa:),5
"bagus 
real ",5
"barang bgus sesuai orderan..mkash lazada,,,kedepannya yg terbaik lagi",5
"Maaf baru kasih ulasannya , jam tangan nya bagus dan cepet juga ,saya puas belanja di lazada",5
"pengiriman nya cepat, hanya 2 hari.... jam nya bagus,  packing nya rapi... thanks 👍",5
"barang ya
 sudah 
sampai , terima kasih Lazada,barang ya sesuai dengan gambar ,👍
",5
sempurna ponakan saya suka,5
barang bagus sesuai dengan pesanan,5
mantap,5
"real pict, proses pengiriman cepat, fast respon.",5
"Alhamdulillah paket nyh udh smpe,gaada yg lecet barang nya juga realpict, mksih lazada and seller❤️😊✨",5
Jm y bgus sesuai dgan gambar yg di atas gx kcwa lh pkok y blnja di tko ini...real pick bgt ,5
Sesuai pesanan.... Puass banget dah pokok nya makasih lazada :) amaizing,5
pesanan di terima dgn baik trimakasih bos ku,5
Jam nya bagus saya suka.sesuay dengan harga,5
"mantap inih, 👍🙏",5
"terimakasih barang udah sampai sesuai pesanan 
",5
"pengiriman cepat,barangnya baguss",5
"realpict banget, pelayanannya sangat  memuaskan dan pengirimannya sangat cepat",5
jam nya sama yang di gambar puas deh saya suka sukses terus lazada,5
"mantap
",5
alhamdulilah barangnya dah sampai barangnya bagus sesuai dengan yg d inginkan .mkasi lazada makasi kurir,5
"jam nya bagus top markotop
",5
Sangat memuaskan real pic ,5
BarangNyaa Bagusss,5
"brang sesuai trus pengirimanny juga cepet 
mntep lahh",5
Real pict👍,5
mantapp jam tangan nya,5
barangnya bagusss makasi lazadaa ,5
"makasiLazadaa barangnya baguss, sukses slalu ☺️",5
"terima kasih lazada,jam datang sesuai gambar,kondisi mulus,Nex di order lagi,real pick",5
mantap gan,5
"terimakasih lazada barang udah nyampe ,,d bungkus nya jg dgn rapi ,abang kurir nya jg baik ramah ",5
barang nya oke bgt dgn harga segitu 👍,5
"jam nya baguss bangett,, real pic pokonyaa ga mengecewakan dehh😍",5
"Barang'y udah nyampe,, makasih lazada",5
Bgus bnget,5
