review,rating
"saya sangat suka dengan ini,  

sebenernya pengen dapet kacamata tpi gpp topi dua yang satu buat temen",5
"makasih sdh sampai jam tangannya dapat bonus topi 2,tp di kantongnya ada tulisan dapat kaca mata, topi ama gantungan kunci, cuma aku terimanya topi aja 2游때",5
"pesanan nya sudah sampe dan sudah aku terima
barang nya bagus sesuai dengan gambar
dan kurir nya ramah 
makasih lazada 
thank lazada",5
"awalnya sy kira sesuai deskrip, tp setelah perhatikan baik2 ternyata yg sy terima jam tangan casio g shock protection ga 110 bukan GG 1000 yg sesuai gambar, mungkin kesalahan seller mengirim,..",2
"Thanks kak barangnya sudah sampai. Dapat topi nya 2 tapi sayang bukan yg gambar banteng. Padahal pengennya itu. Tapi tidak apa-apa kak karena terobati dengan barang yg sesuai serta bagus. Pengemasannya rapih, kurirnya ramah, adminnya ramah, pokoknya the best deh. Selalu pertahankan ya kak agar banyak konsumen yg berlangganan. Thank you so much kak.",5
"Realpict.
游녨游땕Mantap.. Next belanja lagi., pertahankan bonusan bonusan nya om.. Seller recomended.. Thankz lazada",5
"mf lupa di foto barang nya..
pakok nya mantul banget..barang datang dengan selamat barang sesuai gambar..sipp pokoknya gk nyesel belanja di sini..sangat amanah,moga sukses selalu.游녨游녨游녨",5
"Barang udah sampai,  bagus tapi gaada  kacamatanya",4
"mantap tuk topi dan kacamatanya,
beli jam tangan free topi dan kacamata.
pengirimannya cepat lagi.
terimakasi tuk lazada dan seller,
tuk seller selalu sukses dan lancar berniaganya
",5
"Barang udah sampai,cuma bonusnya topi aja,padahal aq pesan yg pertama dl bonusnya banyak,selain topi,ada kacamata gantungan kunci,dan bonus baterainya yg besar游때游때游때",5
"barangnya mantap, dapat bonus 2 topi. hanya saja warna yang di minta lain, yg datangpumg lain. jadi saya kasi 4 bintang aja. makasih",4
"mantapp ...paket y nyampe lebih cepat ...kurir ya ramah...mantap pokona,,aplgi free y gu's dpt 2 topi the best..dha bt toko lazada....",5
"alhamdulillah paket mndarat dngn mulus, jam & topinya mantul gan....  kurirnya juga ramah,,,,  sukses slalu lazada...  ",5
"Bgs bnget kacamata ny kece baday dan suamiku suka, kurir nya ramah peking nya rapih aman pkok nya mkasih lazada",5
"Sudah order kedua kalinya.. Mantappp.., ndak pernah kecewa... Recomwnded seller., pengiriman juga sesuai estimasi walau ada PSBB.. Good lazada n good seller.. Thankz. ",5
bagus jam ya manis ada kaca mata sm topi ya jg yampeya hari lusa maaf baru kasih ulasan soal ya lupa,5
Barang nya bagus,5
"thanx, pesananx dah sampai,
bagus,bonusx jga oke 游녨游녨游똂游똂游녧游녧",5
oke...mantul,5
terimakash puas banget. jam nya bagus,5
Biar bintang yg berbicara,5
mantul sesuai pesanan,5
"bagus suami aku juga langsung suka bonus kacamata + topi pula,  terimakasih lazada ",5
"Barangnya tidak sesuai iklan, yg di iklan g1000 yg datang G110, bonus topi cuma 1 yg lain 2, harusnya adil dong",3
"paketnya datang lebih cepat, kira saya paketnya datang seusai tanggal yg dikasih, tapi gpp lah yg penting oke",5
packing nya rapi..barangnya jg bgus kurir a ramah makasi lazada senang belnja di lazada tokonya amanah,5
"Alhamdulillah barang udah nyampe,pengirimnya juga ramah,barang sesuai dengan gambar produk,Terimakasih lazada********",5
bagus trus ada hadiah lagi kirain apa pas aku liat ada bonus kacamata ga nyesel deh belanja d lazada,5
Alhamdulillah pesanan sampai realpict puas banget dapet bonus topi kaca mata sama gantungan kunci kurirnya juga ramah terimakasih lazada,5
"matap barangnya bagus banget sesuai ekspetasi saya, semoga sukses selalu dan terima kasih banyak hadiahnya.. ",5
brang bgus selain ada bonus topi ada kcamta nya juga. suami seneng bnget. klu buat abang pengantar itu mh dh lnganan baik ramah pokonya blnja di sini seneng deh,5
"Jam tangan bagus banget walaupun murah tpi gak murahan
Hadiah nya pun oke"" semua
Packing rapi
Pokoknya the best lah",5
sesuai dengan pesesan ,5
"jam dh sampai,pakingy bagus kurirnya jg ramah.cuma sy agak kcwa karena ga ada panduan atau ptnjuk.penggunaan karena semua dlm posisi of.trs ktny bergaransi kok ga ada  kartu garansinya
",5
ini gimana jam 2 hari mati lagi parah ,1
Matap ada bonis nya lg!  + kacamata matapp sip   broo,5
sesuai pesanan... bagus,5
barang real pict,5
"Bagus bangat sesuai pict, suka banget, rekomen banget di olshop ini. ",5
"Alhamdulillah
Barang sampai,kurir sangat ramah,
sangat puas 
Thanks  lazada游땙游땙
",5
sukakk.. bagus jam ny.. bonusanny byk.. next order lg 游때,5
"Barang nya udah di terima jossss pokonya, thanks lazada kurirnya juga udah langganan...!!",5
"knp gambar yg km pjang sm yg km kirimkan jauuuh beda,gan,dh biasa bgt yaa,,",1
"koh ngk sesuai di gambar, sya sngat kecewa ",3
"mantap cuyyyy bukan kaleng kaleng游때 
pengiriman cepat游땕
thanks lazada
thanks leseller
",5
terimakasih gan barang dah mendarat dengan selamat tambah bonus kacamata pula...,5
"bagus,yg pasti anak saya suka,masih bonus kacamata juga,makasih gan",5
keren realkick + bonus topi dan kacamatanya keren,5
游녨游낕游녨游낕游녨游낕游똂游낕,5
"paket nya sudah sampai....
lama sampai nya..gk sesuai estimasi
tapi barang nya oke",5
Jamnya bagus tp free topinya beda ama yg digambar,4
"alhamdllh pengiriman nya cpt,,brng jg bgs dgn hrga pantastis",5
sukak bangeet banyak bonusnya laagi.....pengirimanya juga cepet next order lg lah,5
mantap jam ny bgus ..dan hadiah ny juga banyak puas pokok ny ..makasih lazada,5
puas dengan layanan dan barangnya,5
Mantab bosss,5
mantap dapat topi dan kacamata,5
"Maksih yh seler recomnded nih dapet bonus kecamata juga berkah"" ",5
bangus jam nya real pick游땘游땘游땘,5
keren banget sesuai pesan Dan cepat...good job,5
"kiriman cepat,,paking rapi,barng real matap pisan游녨游녨游녨游녨游녨游녨游녨",5
Barangnya bagus syukak游봃,5
jam tangan datang dalam keaadaan rusak jarum jam nya loss,5
lumayan bagus,5
Mantap bagus banget jam nyaa hadiah nya bagus jugaaaa makasih yaa semoga amanah trus,5
bagus semuanya berpungsi dengan baik,5
barang sudah mendarat dgn selamat dan sesuai harga. thanks lazada and seller,5
"baguss kemasannya dan barangnya berkualitas
",5
barang sesuai dgn gambar,5
bagus 游녨游녨游녨游녨,5
Sangat sangat puas.... ,5
Mantap Bonusnya dan real picture,5
terima kasih paket udah mendarat dengan slamat barangnya mantap,5
"pengemasan sanght rapi
kurirnya sopan dan ramah
free 2 topi sukes salalu",5
paket udh dateng makasih y rapi y walaupn agak lama游봃,5
"thanks sengat cepat bagus lgi bareng nya mau order lgi
",5
"barang bagus, pengiriman barang nya lama sampai nya, sedikit kecewa,",5
mantap poko nya ,5
mantap barang nya ,5
"makasih lazada barang dah sampe mantap
",5
"keren,,puas banget,..jam x bagus real pict .. bonus x dapet 2 topi.... kurir x ramah ",5
"sangat memuas kk
real pic thnks lazada
",5
puas sekali jam dan topinya bagus ada bonus kaca mata walaupun agak retak sebelah tp its ok!!!!,5
"Jamnya bagus, topinya bagus tapi kacamatanya pecah",5
trimakasih barang dah sampe topmarkotop jamnya bonus topi sama kacamata lagi makasih lazada,5
"Jam nya sih bagus,  tapi tanggal,  jam digital nya ga bisa d atur",5
baguusss suka 游땘,5
Barang oke sangat memuaskan ,5
"Jamnya bgs real pict, dpt topi 2, sama gantungan kunci... mksh... kurirnya udh langganan... 
",5
Bagus banget,5
Saya suka layanan nya,5
"barangnya bagus, dapet bonus topi & kacamata gelap. makasih banyak",5
"matul barangnya
",5
ini toko ok punya....游때游때游때,5
bguss,5
barang sesuai dengan gambar mantap lah pokok nya :),5
ok,5
"Mantap
",5
realpict,5
realpict,5
realpict,5
游녨游녨游녨,5
ok ,5
