review,rating
"mks lazada alhamdulillah brg mendarat dgn baik
semoga awet dan berkah Aamin YRA
terima kasih lazada dan tokonya semoga mkn sukses ",5
Mas/Mba Saya kan minta nya Huruf A kenapabYg Dtang Huruf K,1
Knp yg ini tdk ada dipengiriman,5
"alhamdulillaah bagus kalungnya buat harga segitu trimakasih, kurirnya dah langgan selalu ramahğŸ‘",5
"barang bagus, kurir ramah",5
Cakep smga awt hurup nya gedek banget buat ank sy tp gpp aku suka mksi lazada ,5
bgus.mksh lazada.,4
"Kecewa dengan kirimin yg beda warna
",5
"kak.saya pesan 2 kalung tp yg dtg cuman 1 kak.gmn kak?soal pesenan temen.
",5
bguss syukkaaa ,5
