review,rating
"Barang sdh diterima, kurir Ninja yg ramah, paking bagus, sdh dicoba dengan hasil kualitas sesuai harga sebab  putaran motor nggak kuat, harus digunakan dengan perrlahan dan penuh kelembutan.
Semoga awet. Terima kasih banyak lazada.",5
semoga awet dan belum di tes,5
"yg di kirim barang rusak ..ah g mutu..klw rusak 
  jangan jual dong",5
kecewa...barang rusak gak bisa di gunakan. sudah ganti batre 2x tetep gak nyalah,1
belum d coba. tapi barang mulus. paket aman.,5
"brg sdh smpk packing rapih, sangat bagus kualitas brg ini",5
"barang bagus cuma nyampe ko pecah paking nya gk rapi, tapi gk apa2 lah cuma blom d pake",5
"gampang lepas , batu asahannya. tp masih bisa diakali dilem. sudah cukup bagus..  ",3
siip,5
