review,rating
INI BARU MANTAB....PESAN...CHAT...PROSES...KIRIM...SAMPAI...BRG OK...BAGUS PACKINGNYA...MAJU DAN JAYA TERUS YA.....SO LAZADA TOO.....GBU,5
"oke n mantap ga ada yang cacat

",5
bagus. sesuai sama di foto. ada tombol on off nya juga. terus dapet gratis 1 lem nya,5
"ok,,, realpick,,,ini baru d coba",5
"belum di coba yaa,
mudah-mudahan bagus,tapi ini eagle asli,mksh",5
"barang sudah sampai 
ok ",5
"Glue gun nya ternyata merk EAGLE juga, buat yg mau beli sekalian Refillnya aja Rp. 17,000 isi 30 batang dari toko Dewi Makmur. ",5
bagus sekali 👍,5
"alham dulilah barang nya sudah mendarat dengan aman kurir nya ramah dan sopan barang nya bagus sesuay gambar


",5
nyesel itu ketika beli barang Ngak penting tapi pas barang sampe unit yg di beli ngak ada. entah pengiriman atau seller nya yg nga jujur intinya saya tidak terima mesin lem tembak nya. semoga berkah deh buat yg ambil barang saya.. ,2
"paket ny cepet sampe kemasan rapi barang ny oke sesuai gambar tp syng bonus renfil ny cuma dpt satu doang, blom d.coba sih smoga awet makasih ya toko Dewi makmur smoga makmur trs dan slalu amanah.kurir ny baik dan ramah makasih lazada🙏👍😄",5
"saya jelas pick 2x barang, harga 27rb
saya bayar 2x harga
kenapa dikirim 1 pc saja?
kotak packingnya hanya muat 1 jelas di foto
buruk sekali ini, pdhl sy sdh repeat order di sini kk
saya kecewa ",1
"Sesuai deskripsi, pengiriman cepat & kurir langganan yang ramah baik hati. Terimakasih Seller yang amanah, semoga semakin sukses Aamiin...",5
"tampilan barang ok, tapi gak bs dipakai kurang panas,masak buat lengket kan gak bs,nunguin lumer nya lama banget ada sampai 15mnt 😤😡",1
"Glue Gun sdh sampai, bahan plastiknya anti panas,sy suka, langsung test hasilnya ok.Trmksh seller, trmksh lazada & temksh kurir",5
1 hari barang telah sampai..berfungsi dgn baik..harga bersaing..smoga alatnya awet..sukses terus lazada n recomended best seller..thank's to all,5
"mantap mendarat dengan mulus, puas belanja di toko ini ssukses selalu trims color famiy lazada good kurirnya ramah sekali",5
"Barang bagus, warna sesuai dengan pesenan, sangat tidak mengecewakan , dan kurir ramah baik sopan, pengiriman pun sangat cepat, terimakasih lazada semoga sukses selalu",5
"barang diterima sesuai deskripsi lengkap paking ok kwalitasnya ok pengiriman cepat sampai trims Lazada,Dewi makmur semoga tambah makmur trims kurir....",5
Mantullll abis produk pistol Lem TEMBAKnya Ok bangettt..kualitas Ok ..kurir nya apa lagi Ok bangetttt..!!succes trus buat Lazada And yg jual produck nya  selalu lancar usahanya..:pasti order kembali di Lazada ..!!skali lagi salam succes untuk kedua2 nya ..!!!👌😎👍⭐⭐⭐⭐⭐🤝🤝🤝⭐⭐⭐⭐⭐👍😎👌,5
Maaf baru kasih ulasan..barang dah smpai dri kmaren..barangnya bagus udh saya pake..kurirnya sopan dan ramah..mkasih lazada,5
"bos barang sudah sampai belom dicoba 
saya pesan Sama lem nya/Refill nya malah datang dua pistol nya hahaha 😅 Ok terimakasih ",5
Barang berfusi dengan baik.,5
"Barang nya bagus, brfungsi dgn baik.. Cuma sayang.. Bonus refill nya 1... Hehe.. God job lah",5
Brangr bgus mntaaap ada on of nya tanks lazada...,5
Barang bagus sesuai pesann pengiriman standar.. Terima kasih.. Ttp pertaham kan performa.. ,5
"terima kasih barang sudah di terima, smoga sukses....",5
terimakasih lazada memuaskan sesuai pesanan ,5
"mksh ka barangnya bagus sesuai deskripsi,,sesuai ke inginan,,moga usahanya nambah maju,,,",5
barang nya sudah diterima ,4
"realpict  barang cepat datangnya tapi deh, tapi belum di coba mudah mudahan awet.. trim's LAZADA",5
Barang sudah diterima dengan baik dan sudah di coba bagus,5
"makasih y barang y berfungsi dengan sempurna moga aja awet,buat abang kurir y udh langganan meskipun hari minggu tetep nganterin",5
"barang bagus sesuai pesana ,,,ok",5
gak sesuai gambar stik lilin cuma 1,5
barang sudah sampai sesuai dg yg di pesan ,4
barang berfungsi dg baik walau lama datang nya,5
pengiriman lama bonus lem nya cm satu tok tega kau pdagang,1
"tuch udh gwe upload smua biar jelas ,biar pelanggan baru pd tau..barangnya sesuai dgn gambar tp ukurannya ko kecil bngt ..gwe kira gede tp trnyata kecil gt...udh di cobain sch lumayan lah....",3
Barang sesuai pesanan..mantul banget panas.. makasi reseler ga smpe 3 hari. Kmrin pesan sekarang datang memang topp lah,5
mantuil.cepat jg ya datangnya. ,5
"terimakasih lazada, sesuai ",5
trimakasih barang sudah saya terima dan sesuai dengan gambarnya tapi saya belum coba saya senang barangnya bagus dan rapi trima kasih lazada.,5
brang ok sesuai yg d pesan bintang 10 kalo ada,5
Mksh lazada dan abang kurirnya..barang bgs tp blm sy pakai.,4
kecil tapi n bagus lah,5
mantap bos quh,5
Barangnya bagus lumayanlah harganya terjangkau rapi dan kurirnya ramah  terimakasi lazada....,4
"Pkt sesuai gambar ,brng bagus nga ada yng cacat sesuai pesanan tpi syang bonus refilnya 1 coba klu 4 mantap",5
"barang sdh sampai... pengirimAn cepat & barang real pict tp blm dicoba dan semoga awet... kurir ramah
terima kasih toko dewi makmur, lazada & mamang kurir
",5
Barang sudah sampai. Ternyata cepat ya. Kurir nya ramah. Barangnya bagus packingnya rapih. Makasih lazada,5
"Saya pikir bonus refill nya 10 biji.. Teryata cuma 1..  Tidak baca diskripnya.. Jd kurang puas....
Barang ok.. Bagus..! ",4
mantul👍👍👍kecil imut berfungsi dgn baik bikin tmbah mudah kerjaanku...kurir yg biyasa antar ttp ramah..mksh lazada....👍👍👍👍👍,5
terimakasih barang sudah saya terima.....barang sesuai gambar ....sudah dicoba bagus .... matur nuwun.... pertahanan servis pelayanan ya    ,5
Mantap.. rekomded dah pokok nya.. ,5
terimakasih . Next order lagi,5
"lucu bagus,, 
",5
bagus ...sesuai gambar dan berfungsi baik..dah saya pake berulang,5
"Seneng banget barang nyampe nya cepet
Kualitas barang juga oke
Dijamin gak nyesel deh belanja di sini
Terima kasih mas kurir dan seller nya.....
",5
"barang oke,pengiriman jg oke cuma sayang lem cuma 1pcs klu bisa bonus lemnya 5pcs dong gan😊😊😊😊😊 mantap dah sesuai harga",5
"Diiklannya bonus 10 pcs lem stik, produk datang ternyata bonusnya cuma 1, gak apalah yg penting produk berfungsi dengan baik.",4
"Alhamdulillah paket sdh sampai, barang sesuai dgn deskripsi walaupun blm dicb semoga aja awet aminn... terima kasih seller,lazada dan abng kurirnya",5
mantap cepet pengiriman nya barang bagus mantap cman aga lama lemnya cair tapi bagus mantap moga awet,4
"Alhamdulillah barang sesuai pesanan, hari libur langsung eksekusi... buat nempel² tanpa harus di paku, dan ngga bikin berisik..",5
"Bonus lemnya mana gan...???
Jualan koq bohong,
Kebohongan koq si piara. Kalau mau piara,
Piara sapi atau kerbau ada untungnya.
Piara koq bohong yg ada cuma nambah dosa.",1
"udh dtg alhamdulillah, tp blm di coba. semoga bermanfaat amin. makasih seller, lazada n kurir yg udh langganan 🤗🤗",5
Klo ada kasih bintang seribu dech,5
"mantaplah, saya kira ukurannya standar yg agak besaran",4
barang bagus,5
barang sampei ka.. thnkss  baguss. smoga lancar jaya amin,5
kecewa krn bonus refill ny d kasih cma 1 biji padahal di deskripsi ditulis dapat 10 biji.,3
Paket sudah nympe cuma belum d buka semoga awet amin.estimasi tepat waktu yg d tentukan mendart dgn selamat tgl.28,5
terimakasih gan barangnya sudah sampai di rumah bungkus rapi tdk ada yang cacat dan sesuai dgn gambar top terimakasih lazada,5
top...memuaskan tks lazada sama kurirnya,5
"sesuai dengan pesanan....
cuman lemnya d kasih 1",5
barang udah sampe  mantul jd bs bikin kerajinan tangan lagi deh makasih ya buat toko dan lazada serta kurir ya,5
trimakasih><,5
barang bagus..tnks lazada,5
barang dah datang tepat waktu sudah di tes berfungsi dengan baik.thanks,5
"barang sdh diterima sesuai gmbar,.mantaap",4
barang dh smpe.udah di coba bagus thankss..lazada..kurirnya dh langganan,5
"barang ok 
baru sampe tadi sore 
pengiriman cepat,psan pagi sore datang ",5
mksih dah datang,5
"langsung di pake bikin apaan ajah,,
  mantap..",5
"mantap, bonus 1 psc lem nya, langsung tes bagus,cepat sampai dengan selamat, trimakasih",5
bagus dan lengkap,5
barang nya udah sampai Alhamdulillah bagus...,5
"t3rima kas!h atas produk barangNya,,,yang unik & mungil.Lancar Jaya👍🏽

barang sesuai iklan🙏",5
"barang datang lbh cpt sesuai .tapi lum dicb berfungsi pa ga
",5
"barang sesuai gambar tapi belum dicoba
semoga berfungsi baik dan awet",5
barang datang bagus sesuai dengan gambar😁,5
mantap sperti digambar thask lazada to seller...sukses trus ya....,5
"ternyata mungil isinya juga mungil, semua berfungsi semoga awet",5
"Pengiriman Cepat,Kurir Ramah Tamah Baik Hati Dan Barang Sesuai Pesanan Walaupun Lum Di Coba Semoga Awet Terima Kasih Lazada",5
"mantab... 👍
 
paket sdh sy terima dgn lengakap dan cepat.. 
trimakasi Penjual, Trimksh Lazada dan Trimksh Pengatar Paket .... 👍",5
"Udah seneng2 pengiriman nya cpt barang yg d terima kliatan bagus bgt.
Pas d coba malah ga biasa kya mampet gtu lem nya ga mau kluar smpe d pksa d dorong trus2an lem nya mlah kluar brbalik kblakang😤syg bgt....ga kpake....",3
"Bagus...berpungsi dengan baik juga...kurir juga baik. tapi sayang,bonus lem-y cuma 1. padahal tertera 10 batang,tapi gpp lah",5
puas banget:),5
"barang udh nyampe, sesuai dngn pesanan, blm di coba, txs",3
barangnya bagus top teh lazada ...,4
barang normal pengirimannya jg cepat..thanks lazada,5
Sesuai gambar dan barangnya bagus berfungsi dengan baik smg awet terima lazada,5
barang sdah sampai..ok,5
barang sudah sampai pengiriman cepat trima kasih lazada sukses selalu,5
"paket mendarat dengan selamat, langsung saya cobak dan memuaskan",4
"Barang sdh diterima,  terimakasih buat seller dan lazada... semoga awet bisa bekerja dengan baik",4
mantul pokoknya brg ok,5
barangnya bagus tapi belum di coba,5
mantul bos.barang bagus sesuai keinginan.kulir sip.ramah,5
"lgh di coba semoga awet ya
",5
"baik barang bagus kecil mungil imut2 bahan bagus, kurir ramah.
moga awet..  makasih lazada",4
barang sesuai dengan gambar terima kasih,5
"bagus

",5
barang suda di terima pengiriman sangat cepat. hasil barang sangat memuaskan terimakasi  lazada dan dewi makmur sukses terus,5
"barang sdh sampai kemarin sore, dg paking dlm keadaan baik trims lazada, tp barang blm sy coba semoga berfungsi baik.",5
pengiriman cepat... paket rapi... barang sesuai gambar... semoga awet... sukses slalu... makasi lazada,5
pokoe mantul ,5
Barang nya bagus pengiriman cepet sayah sangat puass kualitas nya terima kasih lazada,5
paket mendarat dengan selamat. sangat memuaskan pengiriman cepat. ,5
"barang sesuai pesanan tp ternyata kecil ya
sama lem contohnya hanya 1 btg
 tp kurirnya bagus jg..",5
barang dah sampai dgn selamat smoga bisa awett?,5
barang rusak gak bisa panas,1
"real pict, semoga awet
",5
"aku suka.
thanks",5
mantaap barang mendarat dengan mulus..packing rapih dan langsung di coba alhasil memuaskan..👍👍,5
"sempurna top,sesuai pesan an d tes dlu yaa mkch semua nya..😉😉",5
brg nya smpi dgn slmt kurir nya rama baik mksh seller mksh lazada,5
bagus,5
"Mantul dah, cepet pake banget nigh delivery nye, thx LEL ,and kurirnye , semoga berfungsi blm di coba soalnye hehhehe",5
"mantabbb, paket sdh mndarat dg aman. paking mungkin perlu bubble wrap biar lbih safety. ternyata imut cekaliii ukurannya. tks DeMak. tks Lazada",5
barang sudah diterima pengiriman supercepat..tp blm dicoba.mudah2han berpungsi dengan baik..tenks lazada,5
good,5
"Mantul,,,, barang sesuai real pictnya.terima kasih lazada n' seller. ",5
makasi paket sesuai pesanan barang bagus..,5
"barang cepat sampai, packing rapi. barang sudah d coba berfungsi dengan baik. trim's",5
bagus...,5
packingnya mantap sekali... kurir ramah.. thank lazada,5
Ok,5
mantaaaap bener barang nya sesuai gambar....,5
mantull pisan,5
"barang udah sampai, blm di test mudah2an normal. thanks. ",5
pokok nya mantab lah. packing bagus. walaupun blm ane cb nih barang..,5
"baguss .. makasih lazada kurirnya baik banget 😊🙏👍
",5
barang udah sampai.barang sangat bagus,5
"terima kasih , barang aman",5
"mantap sesuai gambar sudah di test hasilnya bagus, terimakasih lazada sukses terus",5
barang ok kurir ok mksh lazada,5
bagus sesuai harga,5
Barang mantabbb....realpic....thank u seller...kurir yes👍👍👍,5
"paket tiba,kurir ramah.",4
bagus sesuaii iklan,5
kirain gede tpi gk papa saya suka.  ,5
Lumayan bagus barang nya ,5
Alhamdulillah..iso dinggo..😍😍,5
nah bar ini barang mantap,5
tks lazada dan kurirnya.. selalu bagus cara melayaninya,5
Puas.. Barangnya oke packingnya juga rapi,5
sip bisa nyala on/of ny 👍,5
"ok dapat bonus 1 lem, pengiriman cepat sehari sampai",5
"barang sudah sampe dengan aman,,terima kasih buat kulit ny baik",5
barang rumayan,5
trima kasih,5
bagus lemnya bermanfaat banget ❤️,5
mbak kok bonus refillnya gak ad...,5
mantul dah sesuai harapan,5
"packing rapih, barang baik, terima kasih resseler, terima kasih lazada, terima kasih kurir",5
brang bgs dtest lngsung pnas..pket rpih kurir lngganan..trm ksh buat smuanya..v,5
Barangnya original bagus berkualitas,5
"mks brngnya dh dtang, kirain langsung dpt lem nya. trnyata dpt cm1 aja",5
"Trimakasih lazada barang sdh aku terima 
barang lumayan bagus",4
berfungsi top deh,5
barang ditrima sesuai dgn pesanan trims ,4
"Berfungsi 👍, terimakasih 🙏",5
Bagus. Tq ya. Spesial thanks for kurir. ,5
barang mantul....,5
"Bekerja dgn baik,, sesuai barangnya ",5
baru bisa kasih ulasam bagus rapi terima kasih lazada,5
barang telah sampai sesuai pesanan mantap.lazada,5
Baranh bagus.. kirimnya jg cepat,5
sdh sampai mksih,5
Bagus dan harga terjangkau,5
"ok barang sesuai foto, pengiriman jg cepat thanks lazada",5
makadih..barang dah nyampai..dah di coba..mantap..penguriman cepat jg,5
Thanks Lazada,4
"mantulllll bagusss 
",5
"Barangnya sudah saya terimah,lumayan menyenangkan,makasih lasada,",5
"baranh sesuai pesanan,mantap",5
Ok ..mkash brangya dh smpe,5
"bagus    kurir nya juga ramah
",5
terimakasih,3
👍👍👍👍👍👍👍,5
Barang nya sangat Bagus dan sesuai tengs lazada,4
"👍 biar bintang yg berbicara, thnk seller, lazadan kurir. ",5
"barang nya bagus..bahan nya juga..top lahh
",5
terima kasih lazada barang ok.,4
barang kondisi ok terima kasih semuanya,5
barang sesuai terimakasih,5
"barang sesuai dengan pesanan,  kurir baik dan sopan ",5
"bagus barang nya
",5
mantap bos ku mksh ,5
barang bagus real pict,5
kirain yg besar tapi gpp kecil jg bagus,5
brang dah sampai dah dicoba jossss thank lazada,5
barang bagus tapi belom dicoba kurir langgan an lazada oke,5
Bagus...sesuai harga,5
Barng mntap tpi sayng kcil tpi ga pa lh kurir ny jga ramah,3
mksih sesuai dan barang nya pun bagus,5
Mantap ....,5
"ya paket sudah di terima sudah di pake juga puas bagus terimakasih lazada 

",5
suka sesuai gambar.,5
brg sdh trima. bgs .sy suka. tq.ln x blnja lg.,5
"Alhamdulillah paket udah diterima dengan aman, makasih the best deh 😍",5
makasih lazada lem tembak udah datang kurir nya Ramah sesuway gambar ,5
"Bagus, lumayan cepat panas dan bermanfaat. thx",5
alhamdulillah barang sdh sampai dgn aman. barang sesuai dgn gambar. trimakasih..,5
top markotop dari barang dn kurirnya 👍👍,5
barang sudah nyampe.tapi belum di coba.,5
"mantap barang nya makasih 
",5
Barangnya ok banget. Sdh di coba. Tdk ada masalah. Paking bagus kurir baik. ,5
"barang udah nyampe n dah d cb...bagus..mungil lagi...pegangan tidak panas,thank y👍😊",5
"Pengiriman cepat,,, brang ok sesuai pesanan
Kurir pun ramah trima kasih bos",5
hebat..jadi ingin segala aku lem....,5
sempurna,5
besi peyangganya ga ada gak lengkap,1
brg ok semiga bermanfaat,5
barang mantap gak kecewa DECH !!!siiiiiiiiiiiiiipp!,5
bagus sekali....,5
"kirain besar,,ga tau nya mungil.",5
sesuai harapan,5
lama panasnya,3
"mantap orderan sesuai pesenan dan barang bagus banget
Thanks lazada dan seller semoga sukses selalu",5
trimkasih barang sdah di trima...mantul dan istimewaaaa....tank's lazada...😊,5
"bagus packing, barangnya jg sesuai gambar. trm ksh.",5
"oke makasi barang bagus paking rapi..
gmbar'n nyusul tar",5
"mantaf, makasi lasada 🙏🙏",5
"barang datang dengan selamat
makasih lazada and kurir",5
barang sesuai gambar....tks,5
barang bagus sesuai hambar mantul,5
berfungsi dgn baik,5
mks barang nya bgs dah sampai,5
barang nya sesuai iklan pokoknya puas banget.pengepakanya sangat rapi p,5
bagus sesuai pesanan,5
"Mantul harga murah barang bagus , di coba langsung panas sipp lah mksh lazada ya 
",5
ok..barang sdh nyampe...semoga awet,5
puas baranya bagus,5
alhamdulilah barang bagus good joob lazada,5
brang sesusai.  tp kok lem tmbak ny susah buat nyair y jd hrus di teken² dulu bru bsa,5
pengiriman cepat..langsung di coba ga ada kendala ,5
Ok bnget sangat memuaskan,5
"hasil nya puas sesuai harga
barang bisa di gunakan 
",3
"barang mataap sesuai pick
mudah²an awet
",5
barangnya sesuai gambar dan jos deh... murah meriah tapi bermanfaat... thanks ya..,5
"barang mungil,,,bagus ",3
bintang 5 pokoke.. bgs... berfungsi dg baik.. ,5
mantap barangnya sesusai pesanan,5
Barang d sampai dgn selamat n kurirnya jg ramah .,5
"Alhamdulillah lem tembak nya berfungsi dgn baik
puas lah pokoknya..",5
Sangat sangat bagus ,5
di colok langsung cair......oke barang sempurna ,5
Mendarat dgn selamat..,5
cepet bgt pengirimanya.. tumben paket dateng hari minggu.. untuk unitnya top sesuai gambar.,5
mantul berfungsi dengan baik,5
"mantulll rekomended
",5
"makasih lazada barang nya Bagus sesuai dngn gmbr, cuma wakti pengiriman terlalu llama
",5
"terimakasih sudah nyampe barang, bagus aku senang gan...",5
barang sudh samapai,3
ternyata dalamnya sederhana banget,5
maaaaantaaaaaaaapp,5
kadang keluar kadang engga lem a,2
"realpict, Refill ukuran kecil, berfungsi dgn baik😊",4
MAntap jiwaa berpungsi dengan baik,5
"alhamdulillah barang nya bagus makasih
",5
"ma'af baru post skrg..
barang berfungsi dengan baik..",5
pengiriman nya lama katanya ada bonus stik 10 pcs tapi kog nggak di kasih ya lai kmn tuh,5
alhamdulilah barang nya nyampai nya cepat.pokonya mantap,5
Kecewa kirain yg besar taunya kecil kaya mainan harga segitu mah nggak sebanding dengan barangnya,2
"barang dah sampe dengan selamat..thanks lazada
",5
Sesuai harapan mantul...,5
barangnya mantap pengiriman nya cepat 👍,5
Murah tp berkualitas,5
Barangnya mantul berfungsi dengan baik,5
barang bagus penggiriman cepat ,5
bagus dah saya coba sesuai gambar dan permintaan,5
"alhamdulilah memuaskan good luck lazada N seler... pertahankan kualitas mu
",5
Alhamdulillah barangnya dah nyampe.makasih,5
mantulll bosss,5
Lumayan .... bonus nye cuma 1 bukan 10 ,5
bagus...paking ok.sesuai.. semua normal dan berfungsi dengan baik,5
"Real seperti fotoh,pengiriman cepet sehari...JakBar.",5
kirain besar..ternyata kecil tpi gpp bagus..blom d coba,5
barang udah smpe trs udah d test dan ok poenya sesuai harapan,5
barang sesuai pesanan..,5
udah d trima mksih lazada,5
kecil,5
sesuai dgn pesanan terima kasih lazada,5
tembakanya bgs,5
pengiriman sangat lama..tapi barang mulus,5
produk bagus ..respon penjual sangat baik,5
"Keren, gak ada yang cacat packing rapi. Tapi belum dicoba alatnya, semoga memuaskan. Txs",5
mantul poko nmh sesuay. tpi blom di coba si,5
pengiriman cepat.tenks,5
mantaabbb semoga awet lem tembaknya,5
"Pengiriman Cepat, Barang sesuai Pesanan",5
"barang bagus sesuai kecilnya dgn harganya,kurir ramah",5
barang bagus tapi kok bonus refill nya cuma satu ya...! ,5
lumayan..lah,5
Alhamdulillah sudah sampe...cuma sayang refilnya cuma dikasih satu,4
"dah di trima, berfungsi cuman bonus nya gak ada",1
"Barang bagus, packing rapih, goodseller juga",5
sesuai gambar.... bagus... ,5
belum dicoba ,5
kiriman da diterima mksh semua,3
meskipun lmbt barang ny👌tp blm d coba.,5
INi alhamdulilah bagus,5
barang sesuai pesanan cuman bonus lem stiknya cuman dikasih satu tp ok lah,5
lumayan bagus,5
maap baru kasih ulasan berpungsi dengan baik,5
mantap,5
barang oke.,5
seler kereeen mantaap... mkasih boss,5
alatnya sih panas..tap kok ga keluar2 ya lemnya...🤔,5
bagus sesuwai gmbr,4
"Mantap, imut",5
pengiriman cepat .dan banyak manfaatnya,5
"Barang sesuai gambar, kurir sudah berlanganan.
Lumayan buat nempelin barang yg rusak.Tq lazada",4
mantul pas barang y,5
bagus sich.cuma blm sy cba,5
barang bagus sesuai harapan..thx lazada,5
Barang sesuai pesanan pwngiriman cepat mantaaap,5
good job,5
ok,5
bagusssss ,5
"real pict
",5
bagus,5
bagus,5
Mantap ,5
bagus,5
mantap,5
Memuaskan,5
mantul,5
sesuai,5
bagus,5
ok...,5
👍👍👍,5
bagus ..,5
Mantul lur,5
"mantap 😊
",5
TOP BGT,5
cakep 👌,5
👍,5
Bajus,5
Bagus,5
real pict,5
barang ok,5
"mantap



",5
gut,5
ok lah,5
Cucoo....,5
ok,5
"lumayan
",5
good,5
siippp TOP,5
bagus.,5
"siiip

",5
bagus,5
Bagus. ,5
toop deh,5
mkci ya,5
puaass,5
bagus...,5
good,5
bagus,5
goods,5
