review,rating
"Ini mesin kecil yang bagus. Saya sudah sering menggunakannya, mesin ini membantu saya menghemat lebih banyak waktu untuk melakukan pekerjaan rumah",5
Digunakan untuk pembersihan pemeliharaan di apartemen 2 kamar tidur kami. Sangat nyaman dan mudah digunakan!,5
"Sangat senang dengan kekosongan ini, mendapatkannya untuk membersihkan mobil saya, tetapi ternyata sangat berguna untuk membersihkan sudut-sudut dinding dengan tiang yang dapat dijangkau dengan mudah !!",5
"Bekerja dengan sangat baik dan pembersihan cepat, menghemat lebih banyak waktu.",5
Vakum sangat kuat untuk ukurannya dan sangat ringan. Istri berpikir itu hebat dan sangat bahagia sejauh ini.,4
Dukungan pelanggan sangat bagus.,5
ketika saya menerima produk ini saya sangat puas dengan pembelian saya.,5
sesuai terima kasih,5
Sempurna,5
