review,rating
"trimakasih kasih lumayan cepat datenya.. 
smoga cocok .. buat kurirnya juga trimakasih ",5
"baru pertama kali belanja di lazada..pengiriman lumayan lama.. 
tapi sebanding dengan produk pesanan yang saya terima .. 
penjual mengemas pesanan dengan rapiiiii dan aman
toko recommended ya inii
inshallah bakal langganan lagi ğŸ™ terus amanah dan ramah seperti ini ya kak sis â¤ğŸ¥°",5
Alhamdulillah brng nya udh sampai,5
Bagussss packing rapih barangnya jg baguss,5
trimakasih saya sukak,5
