review,rating
Barang nya sesuai pesanan ..blm bisa kasih penilaian buat produk nya karna blm di coba ...kurir nya baik2 makasih lazada,5
udah dicoba seksli... smoga ada hasilnya,5
"sangat puas mba tpi lom ada perubahan sich
",3
"pengiriman sangat cepat, produk blm dicoba. ",5
"alhamdulilah barangnya sudah sampai,packingnya rapii bgt aku sukaa makasih yaah",5
"barangnya bagus,packingan nya juga rapi,pengirimannya cepat dan kurirnya ramah ",4
"dingin dipakainya.., tp ga hilang tuh kantung mata dan mata pandanya!",3
"brang ok,mdhanya aja cocok..",5
moga cocok,4
good,5
