review,rating
"bagus,sesuai pesanan.packing  good.smoga cocok untuk saya.",5
ini pesanan saya yg kesekian kalinya di bioaqua tapi untuk produk ini yg pertama saya pesan. semoga memuaskan juga sama dengan produk yg lainnya bioaqua.,5
"mantappp, mantappp, mantappp, mantappp, mantappp, mantappp, mantappp, mantappp, mantappp, mantappp, mantappp, mantappp, mantappp, mantappp, mantappp, mantappp, mantappp, mantappp, mantappp, mantappp, mantappp, mantappp, mantappp, mantappp",5
"terimakasi paket sudah sayaterima kemasan bagus ,baru saya coba kurirnya baik dan sopan ",5
"belum ada efek setelah lebih seminggu dipakai
",3
"hasilnya memuaskan sesuai dengan gambar terima kasih lazada terima kasih BIOAQUA
",5
"maaf baru kasih ulasan...barang sesuai gambar,dan mudah""an hasil ny jg gak mengecewakan ia..",5
ğŸ‘,5
