review,rating
"Toko gk amanah kalo stok habis kan bisa chat dulu,, main kirim2 aja,, pesen apa yg di kirim apa!!!!! 

Semoga berkah tuh uang!!!! ",1
barang udh diterima semoga awat,5
barang sudah sampe...walau telat sehari...tp barang real pict....warna pun sesuai pesanan...nggak mengecewakan...mksh seller...kurir sudah langganan,5
kecewa banget pesan warna hitam & merah datang warna pink 2 dua nya.  ,3
"real pick,. pengiriman lumayan cepat, kurirnya ramah dan barangnya bagus,.. 
thx lazada",5
"pengiriman cepat,  sesuai gambar",5
bagus sesuai pesanaan..kurir ramah... pengiriman cepat,5
bangus banget ,5
"gelang nya bagus banget,,,,,",5
"brg bgs,walau wrna nya ga sesuaiğŸ¤’",3
liontin nya g bs msuk,5
lumayan keren,5
Baguuuus banget tidak ada cacat..p0k0knya tidak mengecewakan....pUas bnget...,5
makashi barang udah yampek ,5
bagus,5
