review,rating
"On time
Packing rapi
Ga nyesel deh hhhhhh
Tingkatkan trs ya bro/sis",5
"terima kasih lazada ,kurir nya baik sudah langganan.ğŸ˜€",5
saya gak ngerti maksud promosi ini....yg datang cuma warna hitam aja 1pcs....saya COD . saya bayar fuuuulll,5
barange bagus dn mantap,5
barangnya bagus .sesuai dgn yg di gambar ğŸ‘,5
Bagus banget anakku seneng banget,5
"bgs gelangy, kurir ramah & sdh langgnn jg",5
bagus barang nya ok,5
sayang sekali yg hijau kurang real pict ya.. jd saya sedikit aga kecewa,5
"bagus,,,",5
mantap,5
suka,5
