review,rating
"saya suka, saya syuka...",5
Kiriman cepat packing rapi barang ga ada cacat cuman belum di coba karena ga ada baterai nya. Kurir ramah pokoknya Amanah terus lazada ,5
"paket sudah dtang lbih cepat dari estimasi, barang relpick, kondisi sempurna semuanya, kurir dh langganan, best seller sma kurirnya,",5
mksh top sesuai pesenan,5
trmksih lazadah ank sy suka mainan tembakannya,5
barang bavus kurir ramah,5
"Top lah, keren ada lasernya. Mantap",5
Bagus pistol ny cuma dapet batere nya,5
