review,rating
",d bungkusnya cuma sama plastik trus d kardusin,untung aja gk pada penyok ni kuali,,barang mah bagus,lumayan tebel mudah2an aj gk lengket,,kurirnya baik",4
"Packingnya rapi dikasih lapisan kardus, aman sampai dirumah.
Langsung test bikin Nasi goreng.
Mantap jiwa...",5
"barangnya bagus, kurirnya ramah pokoknya mantullah trims lazada",5
mantul deh kulir nya juga rama benget...,5
"Bagus wajannya anti lengket, terima kasih Lazada...
",5
sangat bgus...kualitas ok.....barangnya cantikk ,5
"ya.. Alhamdulillah, barang sesuai pesanan..
kl bisa pengiriman nya dipercepat waktunya ğŸ˜Š",3
Bgus bgt Smg g nempel,5
"maaf panci nya penyok dikit jadi mama saya marah sama saya karna penyok ,, ",5
