review,rating
"Barang bagus dan packing rapi,terima kasih.",5
"Pesananan sudah sampai tepat waktu, very fast respon, Very recommend seller dech … puas belanja disini, produk nya bagus-bagus & keren, The best,100% original 
Thanks 
",5
"berfungsi walaupun kurang rapi hasilnya, sesuai harga lah",3
"berfungsi dengan baik, meski warna yg dikirim bukan pink, gpp lah yg penting berfungsi.
terimakasih seller",5
"Alat cukurnya berfungsi dgn baik
Pengiriman jg sgt cpt
",5
barang yg dipesan sesuai dengan pesanan dan berfungsi dengan baik. ,5
ok,3
"Trm ksh tuk kurir a yg rmh... barang a jg aman, berfungsi dgn baik..mantab ",5
