review,rating
"Maaf ulasanx lambat 
Soalnya bru d'coba.. 

Mantab bang tendanya sesuai harapan 
Walaupu nunggunya lamayan lama 22hri tpi tapi sangat amanah 
Saya sangat puas.. 
Trima kasih banyak banggg 
Moga sukses",5
anak saya sangat suka... terimakasih lazada ,5
terima kasih lazada dan penjual. di gambar bisa di jadikan 2 tenda. tapi ternyata cuma bisa di jadi kan 1 tenda. perkiraan saja. tenda utama dan tenda penutup bissa di pasang 22 nya secara terpisah. berdampingan. ternyaata tenda utamamanya tidak ada besi almunium penyangganya lagi. tapi keseluruhan puassih. 1 lagi. resleting tas nya macet jadi saya rusak dan ganti kepala resletingnya lagi. ,4
"barang sdh sampai tapi belum sempat di coba, mudah2an sesuai harapan",5
