review,rating
makasih seller real pic barangnya dan bonus gas kaleng juga.kompornya bagus..kurirnya udah langganan nganter..ramah kurirnya.,5
"Alhamdulillah bagus kompor portabel nya, udh lnjut pemesesanan kedua krna temen2 juga ikut mesan 😂 . thanks seller, kurir, dan lazada nya .",5
sesuai pesanan,5
"mantap barangnya, ninja cepat & pasti tidak spt expedisi sebelah",5
bagus brng yh sesuai pngiriman yh cpt.mksh yh lazada,5
bara oke.capcuss pula.cuma 3hr,5
"baru. pertama kali coba...dan wow mantap jiwa...
barang aman n no cacat...joss pokoke",5
