review,rating
deameter ring nya kebesaran,2
pas bgt d mesin cuciku thanks lazada...buat Abang kurirnya terimakasih udah langganan malam pun d anterin,4
"ukuran ringnya tidak sama dengan yang di pesan, yang dipesan ring 23cm, yang dikitim ring 27 cm. bagaimana cara penukarannya?
",5
tksh toko dan lazada...barang sesuai deskripsi...,5
mantep barange sopan kurire... trmksh,5
ngecewain bgt ktnya ukurannya 23'5 g taunya mlh kegedean dicant jg g dibls kecewa,1
ukuran yang datang tidak sesuai dengan yang di deskripsikan,5
oke,5
