review,rating
alhamdulilh barang dah datang...cuman pesen warna biru...yang datang warna merah....tapi ga apah apa lh...,5
"datang nya cepat,  di kemas nya bagus rapih,  barang nya juga bagus banget gak ada yg cacat..  makasih lazada..  ",5
Paket ny udh nyampe dngn selamt udh di coba matang sempurna makasi lajada makasih seler puas blnja di toko ini.Smga awet makasi makasi mas kurir ny ramah ,5
barangnya oke imut bagus. tp sayang masa iya bru di pake 1x mau ke 2x udh ga bsa masak nasi tiba2 mati dn ga brfungsi... sayang banget uang 150rbu jg. hadeh saya kecewa banget...,1
mksih paket ny udh datang matul,1
Terima kasih Lazada...sedikit kecewa..pesan Biru datangnya merah,5
"packing rapi, kurir Mentap...! ",1
"magic com nyh rusak g bisa berfungsi .susah mau  tukar jga banyak  klik ini itu lgi. 

",5
"barang sudah sampai,sangat cepat,kurir ramah. moga awet barngnya ,terimakasih lazada",5
Paket sudah saya terima dengan aman dan kurirnya juga ramah...saya puas..terimakasih lazadA..,5
trimkasih lazada,3
Maantap....  ,5
barang sesuai pengiriman cpt. mantapğŸ¤—ğŸ¤—,4
megikom ya udh sampe bgus dn cepat tks smua ya,5
mejikomnya udah saya terima bagus banget terima kasi lajada sukses selalu,5
cukup bagus sesuai harga mksih bos,5
bagus,4
