review,rating
"barang sudah di terima dengan baik,pengiriman cepat sekali..semoga berfungsi dengan baik ",5
Alhamdulillah mendarat dgn selamat barang nya rilpic,5
barang bagus cocok buat langganan seller ramah,5
mantap trmksh seller kurir & lazada,5
"pengiriman cepat,pesan kmrn hari ini dtg barang ok ga ada cacat thanks ya",5
Bagus banget...makasih lazada,5
Mantap memuaskan... ,5
barang bagus,5
"Kualitas bagus,harga murah. Pasti langganan . Tetep amanah ya seller",5
barang bagus paking nya rapih pokoknya ngga ragu deh beli d toko in.bakal jd langganan,5
ini pesanan ke dua kali nya.. alhmdulilah tdak mengecewakan,4
bagus sangat,5
"Sumpah sih ini bagus banget.
Recommended buat toko ini.
Sukses terus ya ğŸ™‚â¤ï¸",5
"Bagus, mamak aku suka makasih:)",5
mf br sempat kasih ulasan. barang sdh di trima dan yg pasti coustmr puaaaaaaaaassss...,5
maaf baru kasih ulasan.. order yg ke 2x alhamdulillah ga mengecewakan respon seller nya jg baik,5
allhamdulillah barang yh sampai sangat cepat,3
trimakasih barang nyampe ga ada cacat,5
bgus smoga awet,5
"Wih mantap seller gilogilo, semoga di beri kelancaran dan keberkahan ğŸ‘",5
"Sangat bagus model dan kwalitas
",5
penyok,5
