review,rating
"Alhmdulillh wrn'ny sesuai psn'an sy
Cm brng'ny agk penyok, kardus'ny sampai bolong, untung brng'ny bs di bnrin, ya wlopun msh klhtn penyok'ny tp gpp dehh mdh2n awet buat msk nasi
Buat kurir yg ngirim hrs lbh ht2 lg dlm pengiriman, hrs bs ngebedain brng yg rwn penyok sm yg ga, jd sampai tujuan dgn slmt & aman 
Trmksh buat kk seller yg udh baik bls chat sy dgn baik..",5
"alhmdulillh pket nya udah datng cumn gak sesui dengn pesanan pesan warna hiju ko datng warna hitm ,gak aplh yang pesenan cpt dtng nya mksih lazda",5
"barang nyampe tp agak kecewa, kardus ok tp isinya penyok, mungkin dari tokonya.....
low kurir 游녨游녨游녨 ",3
"barang mendarat dengan sempurna, ga penyok, Saya suka, kurir nya Baik,  beberapa x belanja, barang selalu aman.",5
syukaaaaaaaaa...brg bgs,5
kan saya chat warna nya kak sebelum di keep katanya ready warna hijau ko di kirim hitam sih ,5
"paketnya udah d terima, dn udah di lihat magic comel nya tp sayang tidak d bungkus dgn bubble wrap sehingga barangnya ada yg penyok, mungkin pada waktu pengantaran jadi barang berantakan",4
pengiriman cepat. Cod lg. bagus banget,5
"Barang datang dengan bagussss, seller terpercya, gax masalah soal warna yang penting barang beneran datang, sukses selalu seller, kurir ramah, terima kasih seller, terima kasih lazada",5
barang sdh saya terima kurirnya ramah tp saya kecewa barang nya ga d bungkus bable wrap cuma kardus biasa aja,3
"barang bagus sesuai gambar
nyampenya cepet sih harusnya dateng nya hari ini atau gk besok eh ternyata datengnya kemarin
kurir ramah 
the best lah lazada 
thanks lazada dan toko nya",5
Walaupun yg dateng  ga sesuai pict untung yg dikirim warna biru jdi ya suka aja coba klo wrna lain psti dah ngamuk ahahaha,5
saya kasih ulasan apa. sedangkan barangx saya gak terima. dan jujur baru kali ini saya gagal dalam penerimaan barng,1
"Alhamdulillah bagus gak peyok. 
",5
"Alhamdulillah ,realpict ,kondisi rice cooker nya bagus ,pengiriman ok ..respon baik ..makasiih 游녨游뱅",5
Oke mantap ,5
"pengiriman cepat,kurang suka sama pengemasanya gak pake bubble warp ",4
kecewa pejyok,5
"pesen hijau,datang biru .ga papa mudah 2 an awet.",5
"sip,,,!!!",5
barang sesuai pesanan...kondisi baik..mksh,5
kecewa gk sesuai gambar pengennya warna ijo mlh yg dteng biru tapi gpp lah yg penting g cpet rusak,5
bagus banget,5
kecewA bangt ga sesuway minta ijo yang dateng item..ga jelas..,5
barang nya real fict puas banget pokonya ,5
real pict tapi packing kurang bagus,3
"barangnya bagus mndarat dngn selamat..
",3
"bagus barangnya, respon cepat juga good job",5
"Sampai nya cepet bingitzz, nasinya jga tanek.. Wenakk lahh",5
Sdh langganan . Thankyou,5
游녨游녨游녨游녨游녨游녨游녨游녨游녨游때游때游때游때游때游때游때,5
mesin hijau dateng ungu ,3
pesen green yg Dateng biru.a.tapi ga papa..mkasih,5
"bguuussss plnggan sya ska mksih yah,perthnkn dn sllu amnh,",5
barang nya pas di buka ternyata penyok dan juga tidak sesuai gambar yng sya peSan,1
"barang dah sampe dgn utuh n berfungsi baik, tq",5
mantul pokonya..,5
"terimakasih semua memuaskan, jgn ragu berbelnja disini y 游땕游땕游땕游땕",5
semoga awet,5
sayang nya warna bedaaa pilih hijau dateng biru,5
"alhamdulillah sangat puas dgn barang nya, terimakasih sudah tidak mengecewakan pelanggan dgn baik游똂",5
paketnya cepet sekali sampenya...kualitas product bagus sesuai pesanan...thx lazada,5
Mantap barangnya udah sampai dengan selamat... Terima kasih lazada... ,5
Barang bagus dan pengiriman cepat,5
barang ok,5
游녨游녨游녨游녨游녨,5
