review,rating
"penyok kanan kiri,rice cookernya jg tdk terlalu panas,masak pagi,sore udh berair dan bau/basi..di chat,jawabnya nggak jelas...",1
"Pada saat buka rice cookernya malah penyok, dan pengirimannya lama, dan respon dari penjualnya terlalu lamban. kalau tidak saya ingin dikembalikan uang saya dan produk saya kirim kembali. dan pada saat saya coba rice cooker untuk masak nasi malah tercium bau kabel dari dalam luar rice cooker. Mohon untuk segera ditindaklanjuti segera. ",2
"ini gimana sih mba/mas? saya pesan kan sanex 1,8 liter. qo diantar nya merek votre 1,2 liter??? tolong dong saya mau retur aja deh.. gak sesuai banget",1
"paketnya dah sampel y,makasih lazada ma kurirnya,sbnrnya sy psn ni BRG web putih tp yg datang malah web merah tp gk ap2 sih,yg penting brgnya mulus bagus ttp suka ko.",5
"barangnya bagus,,,,tp pas tak liat dibelakangnya penyok,,,haduwww,,,gmn sih,,,untung aq sabar nek gk sabar tak kembalikan ",5
berfungsi dengan baik,5
"masa baru dipake seminggu dah rusak gimna si, kecewa banget ",1
berfungsi dengan baik,5
