review,rating
"barang sudah datang pesanya 2 liter tapi yang datang 1,8L",5
barang tidak sesuai dengan gambar seperti di atas. tapi gpp brg tsb nyampe dengan selamat dan tanpa lecet dan penyok thk seller Dan lazada.  semoga sukses selalu,1
respon cepat barang sesuai realpict kurir ramah polll ..makasih lazada,5
"barang sesuai,bagus semuanya, pengiriman cepat,kurir ramah",5
"barang diterima ukuran 1,8 liter, uraian spec yg saya pesan ukuran 2 liter. ",5
Barangnya bisa d pakek...kurirnya ramah..,5
Brg sdh diterima tetapi body barang nya ada sedikit penyok,4
"Semoga awet , barang bagus",5
