review,rating
"pembelian ke 3 kalinya dalam waktu berdekatan...mudah2an semuanya baik2 saja...
pelayanan kurir yg ramah dan komunikasi yg lancar sebelum pengantaran barang...thank u lazada dan buat toko yg ramah",5
Kondisi laptopnya bagus. Spec nya juga sesuai deskripsi. Makasih yaa,5
"barangnya realpict , bagus dan sampai dengan selamat.. terima kasih. so far puass deh..",5
sangat bagusss... suka deh pelayanan nya... respon seller gece...,5
"Suara jelek, gk bisa main game dewasa... ",2
Luar biasa barangnya mantaappp.,5
