review,rating
mantaul... biar binrang yang bicara,4
"barang mendarat dengan selamat aman dan sesuai foto... 
namun sayang barang nya kecill.kirain besar..
cuman muat buat hp dan rokok aja.

tapi gpp mudah2 an toko nya semakin jaya di lazada .aaamiin...
deskripsinya harus lebih jelas dan lengkap dong
mana lapisan saku kecil ke kege tipis banget... tipisssssss banget...mudah sobek kayanya...",2
"thankyou bosku..barang sesuai pesanan sudah diterima..pertahankan kualitas dan kepercayaanya...
next pasti sy order lg..",5
bagus,5
"barng y mantap,, sesuai dgn harapan . ",5
barang udh nyampek tapi sayang ke kecilan barang nya ndk muat but muat dpet ma hp,4
tas nya ternyata keciill,5
mantap banget,5
"barang sudah sampe,sory telat kasih ulasan barang ea mantap dah",5
bagus sesuai harga,5
"Barangnya udh nyampe,bagus sesuai harapan,kurirnya jga ramah sukses lazada ..",5
acan di buka,5
mantab,5
Baguss,4
