review,rating
"Laptop sudah di terima, smoga awet, tapi knapa saat buka office ( word, excel dll) dia minta product key yah? ",5
Respon penjual kurang. Dipesan tanggal 27 Maret baru dikirimnya tanggal 30. Tapi pengiriman lumayan cepat. Sampainya tanggal 1,5
"lumayan lah, laptop tipis, layar lebar, core generasi 10th + nvidia. buat grafis, edit video, pemetaan lancar, tinggal tambah ram aja. semua oke ga ada cacat.",5
"core i5 gen 10, ram 4gb, 512gb ssd, geforce mx130 2gb, (layar blm fhd cukup mengecewakan karna tidak ada deskripsi), pengirimin hanya berupa kotak laptop kurang safety utk pengirim satu hari, mohon utk diperbaiki untuk pengiriman, semoga awet, amin ya allah",4
"Delivery cukup cepat, packaging bagus, produk bagus berfungsi dengan baik. Thanks Lazada.",5
barangnya cepat sampai sesuai tglnya dan di terima dlm keadaan baik.Terima kasih lazada,5
"sesuai expektasi dan ket. tinggal upgrade ram, slot ramnya ada 2 jadi bisa di upgrade",5
"pengiriman cepat, kemarin sore Transfer n pada siang harinya sudah sampai.
",5
Keyboard nya tidak berfungsi dan barangnya saya kembalikan,5
"barang mantulğŸ‘, packing rapi",5
mantap,5
