review,rating
"barang bekas, dan kondisi body lecet, cas tidak bisa di gunakan, pengiriman lama, peking kurang aman",1
"Barang sudah mendarat tpiKepala charger ga ada.
",5
barangnya sesuai mantap 游녨,5
"hr senin lusa sy kembalikan laptopx, makasih atas atensix",2
"produk sesuai deskripsi,  semoga awet,  makasih ya.. ",5
Body lecet parah nihh...Harga secound tinggi,1
"barang ok lengkap semua fungsi normal recom banget , fast respon mantap pokonya",5
"semuanya cepet, apa lagi pengirimannya loh cepet banget dari jakarta ke lubuklinggau cm 3 hari aja, smua save, harga miring udah dpt spec sgitu, thanks ya seller",5
"pesanan sudah sampai tadi sore 游땘游때 real pict pokoknya . recommended pkoknya blnja d toko ini . semoga barang nya awet 
",5
"Pengiriman Mantul, cepat banget. Sejauh ini lancar, semoga awet. Terima kasih.",5
"bagus游땘, awal nya ragu tapi alhamdulillah kualitas lumayan dapet tasnya juga, seller ramah chat di respon kurir juga nlp sblm ngirim top lah pkoknya游땕游땕",5
"leptop yabg baru kemarin saya terina kondisinya engg benar,  waktu di nyalakan hidup tapi ketika mau di matikan malah engg bisa,  dan sekali bisa mati sampai sekarang engg bisa hiduup lagi. 
gemana ini ibu/bapak....
saya beli mahal2 kok begini,  kami komplin dengan leptop ini",5
"Alhamdulillah.. barang bgus , kondisi normal semua.. Drive lengkap windows jga brfungsi dengan baik...
puas banget",5
"Barang sesuai pesanan dan sempat ada masalah di pengoperasiannya. Tapi sdh tetkendali pihak sellernya langsung merespon dan mentutor dan mengarahkannya. 
Seller Cepat Respon
Kurir Goog Job Cepat
Lazada Ok.  Mksh All",5
sesuai gambar dan tepat waktu mudah pembayarannya,5
Maaf baru bls..Pesanan sesuai deskripsi...Respon cepat...Kurir baik dan cepat...Thx...,5
pokoke top dah lazada,5
"kecewa,tdk sesuai harapan saya,untung masi bisa terpakai",3
"Alhamdulillah barang dah nyampe,,,makasih lazada",5
barang bagus,5
"Barang bagus, sampai saat ini belum ada masalah dalam pemakaian. Agak baret sedikit di belakang dan depan tp gak masalah. Seller sangat responsif, mau men-tracking barang yg hampir tidak jelas pelaporan pengirimannya. Pokoknya recommended bgt. Jgn kaget kalau dgn tipe sama di toko sebelah harganya lebih murah. Itu wajar karena di toko ini Ram-nya lebih besar.",5
"barang sudah terima dengan baik,pengiriman cepat,paking rapi dan aman saya suka,barang berpungsi dengan baik.recomended",5
"Penampilan laptop baik, software cukup banyak, fungsi keyboard, usb port baik.Baterai awet, tapi chargernya model USA. Semoga awet.",5
"Pengiriman cepat dan tepat sesuai alamat. Packing nya rapih, bagus, dan aman. Barang juga sesuai pesanan. Namun untuk produk sedikit kotor dan terlihat tidak seperti produk baru. Tapi overall bagus semua kok.",5
sangat memuaskan sekali walaupun tasnya merk-nya beda.... barangnya bagus dan mulus....terimakasih lazada,5
"Puas dengan barangnya, sellernya juga inisiatif cuma buat 1 partisi, jadi aku tinggal shrink dan buat partisi baru 游녨游녨游녨",5
paket sesuai. bagus,5
"sudah sy coba, semoga berfungsi dengan baik dan awet. terimakasih seller",4
"maksih Bu 
laptopnya mantap
packing nya rapi 游땕游땕 dan kurirnya ramah bngat
langganan  deh游때游때游때",5
"Barang bagus, bungkusnya rapi
Ada tasnya juga 
Sukaa",5
Makasih seller paketnya sdh sampai hari ini....bagus dan semoga awet......,5
"barang sesuai pesanan., respon dan pengiriman cepat.,",5
"kirain br gx tau nya second,,kecewa sih,,tapi mau gimana lgi,,tanggung resiko,,",3
bismillah semoga Awet ,4
Trimaksih lazada barangnya sdh sampai,5
"Laptop nya ada goresam pada bagian luar nya, selebihnya ok

",5
alhamdulillah paket laptop idh sampae ,5
good seller,5
Barang udah sampai bungkus rapi dan pengiriman cepat.. cuma kok untuk 2 USB sebelah kiri gak bisa ngebaca.. tuochpad nya jga gak bisa.. trus kaki dudukan nya gak ada satu,3
pokok nya sippp lah,5
"sudah saya terima paketnya ,tapi belum dicoba ",5
"untuk seler yg jual lenovo thinkpad x131e superdury [ AMD DUAL CORE/4GB DDR3 RAM/320 HDD.hardisk tidak keditek,sehingga tidak bisa di instal kembali",5
"mantap .
",5
"bagus,mantap dan ok punya",4
"Leptopny
Ga bisa  di idupin,sy mAu b
,Balim",5
