review,rating
"tidak sesuai gambar...
jelek",1
"timbangannya jelek ngga bisa angka nol harusdipencet2terus baru angka nol,tutup buat batre ys rusak /miring jadi susah buat nutup pokoknya kecewa tidak sama dengan ygdi iklanin tolong kalau jual barang yg bagus dong",1
"Alhamdulillah , paketan pun udah sampai dgn selamat terima kasih ya buat seller nya dan abang kurir nya sukses buat lazada ya sm seller jg sukses selalu ",5
"tidak bisa d pakai...  
",5
sengaja ngambil pengiriman Medan biar sama2 medan.smpe 3 hr stlh trf n dichat baru direspon dan diproses.. jd nya total nya 5 hr dggu.lbih cpt brg dr luar kota. ,5
"terima kasih seller dan lazada, sesuai pesanan, cepa sampai dan kurir ramah, berfungsi dgn baik jg",5
mantap sesuai gambar semua berpungsi...,5
"bagus banget 
kalian harus beli disini",5
Good product,5
"Udh dicoba, semoga awet ",5
"Mantap,sesuai pesanan",5
"barang sesuai dan berfungsi dengan baik


",5
mantap bagus,5
mantab betull,5
brgnya bgs berfungsi dgn baik..kurirnya ramah...mksh  y,5
baru smpet ngsi ulsan brng ea jereeee3n,5
Paketanya k mana ka belum saya terima... Tanya satpan juga ngak tau... ,1
barangnya okee .. dikasih barerainya jugaa ... sukses terussss,5
Kecewa bgt.....gak bisa nyala.....,5
sesuai dan berfungsi baik,5
makin hari makin naik ya boss harga nya.. ,3
