review,rating
barangnya sudah sampai dengan keadaan baik... ,5
"alhamdulillah paketan sudah smpy, makasih lazada tapi ga tau rusak ngga ny nih soalnya pesanan orang g bisa dibukağŸ˜",5
"Ttoooppp llaahh ,,,fungsi baik,,cma pking hrus lbih tebal,,ada penyok dibagian bwah depannya karn ke timpa,,yg lain mmaannttuuull deehh syukron ",5
barang bagus recommended banget barang masih mulus dan tidak lecet,5
"timbangan dah sampai dgn selamat 
dah di tes bagus akur 
sampai LBH cepat",5
Alhamdulillah paketnya sudah saya terima terima kasih Lazada kurir nya baik dan ramah,5
kurang propesonal uda cat minta yg 15 kg di kirim 5 kg,1
agak kecewa,3
"bagus cuman ada yang bengkok, bengkok sedikit mungkin dari pengiriman, tapi gak masalah ",5
