review,rating
"maaf...baru ngasi ulasan, Barang sesuai pesanan...kurir ramah,lbh cpt,makasih pak kurir,lazada,juga seller...tp brngnya blm d buka...",4
alhmdllh paketnya sudah sampai dengan aman terimakasih lazada Indonesia ,5
"barangnya bagus,cepat sampe, tp gmn ya cara kirim kartu garansinya ",5
terimksih lezada ,5
Timbangan yg datang tdk ad bautnya yg d bwah. Sangat mengecewakan. ,1
puas...,5
good job ...barang nya sesuai bgus ,5
barang ok saya udh pesen 2 kali timbangan.y berpungsi semuah,5
timbangan sangat bagus...terima ksih lazada,5
"sip...barang sesuai pesanan dan pengiriman cepat.
semoga tambah sukses lagi",5
timbangan bagus dan ori sesuai deskripsi,5
Mantap,5
