review,rating
mantaf,5
"Pket nya udah di terima tpi blum di coba mudah""an sih akurat ..yg nganter nya udah langganan mkasihğŸ™",5
"alhamdulilah paket udah nyampe,,dan sudah di buka...barang bagus sesuai gambar sudah d coba akurat",5
Sesua uah beli yang kedua kali ini ,5
"Barang sampai dngn slmt,, 
 Real pick n kemasan rapi,, 
Buat tokonya semoga sukses sll n buat ninja express semakin sukses,, buat kurirnya smg sehat sll,, 
Terima ksih buat semuanya,, ",5
mksih lazada udh sampe barang yh,5
trmksh brng nya dh nyampe.puas deh,5
makasih lazada ,5
mksh lazada mantuuuul packing rapih barangnya jg okğŸ˜,5
mantullll gannnn sya ska sya suka,5
Sesuai,5
Bagus... Sangat memuaskan,4
sesuai pesanan. puas.. makasih...,5
lumayan,5
Ok Lah,5
mantulll,5
