review,rating
sabun Tsuki  sudah aku coba 3 hari hasilnya lumayan  makasih lazada ,5
"pesanan dah sampai.....sabun kecil, sengaja g langsung kasih ulasan mau coba dulu....lumayan kk kurir ramah游때游때makasih lazada游때游때游때游똂游똂游똂
",5
"kata nya beli 2 geratis satu,, tpi udh bayar 2 yg dateng malah satu,, boro"" gratis satu ga amanah banget jdi orang,, nyesel beli di sini...merasa ketipu sma iklan nya",1
"Packing sangat rapi,  sesuai pesanan,  mas kurir udh langgangan,  makasi lazada N kurir sukses selalu y ",5
"barang dah sampa!' dan peng!r!man cpat... 游녨游녨 maks!h lazada sama selernyaaa. mudah""n cocok barangnya g' ngecawakan.",5
"terimakasih kak suka sekali sama sabunny, ini sudah k 2x saya order, kurirny jg rama terimakasih lazada, pengirimanny jg cepat,,,",1
"Alhmdhlilah Udah nyampe sabunya, semoga cocok,, kirain sabun nya Gede gk tau nya kecil bnget y游때",5
payah.. gak ngefek sama sekali.. ,1
mksih yah kak sabun tzuki nya.. syang nya sayang ktannya beli 2 gratis satu ya udh de ng pph 游땴,5
"blm d coba,,",5
"Real pick,  packing rapi mas kurir baik sopan,  makasi lazada N kurir smoga sukses selalu ",5
tdk ada perubahan ,1
tidak amah ko sya beli 2 di kasih satu.katanya bebas ongkir,1
Barangnya sampai sesuai dengan pesanan..,4
"barang suda sampai,blm bsa krim testi karna baru pkai 4 hari,kalau suda ada hasil di krim testinya",3
"terimah kasih sabunya sudah sampai,,, semoga cocok驕쥞잺驕쥞잺",5
游녨游녨,5
