review,rating
"Cepett bangett sampainya,sesuai gambarr,bagus bangett,next beli lagi:) Produk original enk dipakai, pengiriman cepat. Harga terjangkau
",5
"Terimakasih pelayanannya sangat memuaskan 
Semoga selalu jadi langganan
Tingkatkan terus ya kak",5
"Makasih banyak yah kak..
Selalu puas belanja disini.
Sesuai dengan orderan saya semua.
Pertahankan terus pelayanannya yah.",5
"Barang sampai lengkap Gak ada yg kurang, Selalu langganan, Packing aman, Dan selalu amanah, Harga murah dan berkualitas, Respon penjual baik",5
Komedo keangkat semuaa recomended ğŸ‘ŒğŸ‘Œ,5
