review,rating
"bener"" g amanah
saya pesan yg 100 ml malah di kasih 60 ml
tolong ya klo mau di kemas di cek dulu atau klo yg 100 ml g ada kan bisa kasih tau dlu
bener"" g bisa di percaya & g bisa di ulangi lagi buat belanja disini",3
"Sempet kaget krn koc beda kemasan tp pas bca tulisan kemasan baru..  Owh oke,  di coba dlu mudan2n cocok nnti pesen lgi...  Thanks",4
Bagus real pict dan kurir nya langganan tapi pengiriman nya lama overall bagus ,5
"Diketerangan ditulis isi 100 gram,tapi ko yg dateng barang nya isi 60 gram.",5
oke lah. cuma sekarng kemasannya udah baru,5
