review,rating
"Barang realpick dan hologramnya juga yang original bukan KW kaya sebelah recomended banget nih toko, wajib langganan! makaciiiiii yaa kak🥰",5
"Maaf lama, mau liat hasilnya dulu ternyata bener original hasil memuaskan banget seller tanggap packing aman 🥰 mantull tull",5
jadi makin putih dan cerahh 😘thanks u ya seller creamnya Original ,5
"Respon cepat product ORI, pelanggan saya pada order semua wow banget deh belanja di sini",5
"gausah di raguin lagi pokoknya THE BEST quality
seller ramah cepet tanggap klo di chat best seller",5
