review,rating
"allhamduliah paketnya udh dtng paknganya raph mudh mudhan cocok d pakenya mksh kak mksh lazadaa semoga jd langganan,,",5
Paket udah sampai.pengiriman cepat.kurirnya ramah,5
"pesanan ok... semoga cocok
kurir ramah , sukses slalu",5
"siippp barang sdh sampe. tinggal di coba,pengirimannya juga cepat.thanks courier & sellerğŸ‘.",5
ok semua oke,5
trimasih ljada neng uhdah nyampai,5
lumayan,5
bagus barang sesuai apa yg di gambar,5
"Packing rapih?Barang sesuai,,semoga cocok buat muka saya?",5
