review,rating
"terima kasih pesenan nya dah nyampe,,paking nya rapih bgt,untk kurirnya ramah bgt,,pokonya  is the best untk lazadağŸ™ğŸ™",5
parah banget baru kali ini saya pesan kayak gini tonernya tumpah tutupnya gk rapat jadi tinggal setengahnya saja.kurang teliti ngeceknya,5
"paketnya udah kterima.. toner nya wangi packing rapih dan aman. kurirnya profesional .. semangat ya bpa kurir , pengiriman cepat cuma 2 hari. sellernya the best. lazada sukses slalu. trimakasih",5
mksh lazada brg ud nyampai tp mf knp tumpah ,5
Good... Tidak pedih di mata,5
Tonernya bgs g da yg cacat mulus.paking rapi.enak d pakenya.mksh BK mksh lazada ,5
siip..,5
Sip,5
