review,rating
"skrg transfer, besok nya sudah syampai rumah paketan nya. packing nya juga oke... alhmdllh mendarat dgn aman di rmh n mesin pumping bisa di gunakan (tidak rusak). pumping nya enak bgt, ga sakit. buat working mom ini recomended bgt, pumping harga murah tapi ga murahan, kualitas oke bgt n perahan asi semakin bnyk. mksh lakamudo",5
Alhamdulillah.. Paket cepat juga dtangnya.. Barang pesanan aman dan masih rapi.. Barang pesanan sy jg dalam kondisi tersegel dan berfungsi dengan baik.. Terimakasih... semoga laris dan lancar usahanya ini..insyaallah... Amiin..,5
terimakasih akhirnya barangnya sudah sampai kemarin setelah menunggu 5 hari ğŸ˜Š semoga bermanfaat barangnya.. belum sy coba alatnya,5
"barang sudah sampai, sesuai pesanan tp dus penyok sampe sobek bagian bawahnya.. Belum dicoba karna nunggu lahiran, moga aja gak ada masalah & awet.. ",4
"Pengiriman barang sesuai tanggal, Produknya sesuai gambar dan berfungsi baik...Lazada memang terbaik",5
terima kasih barang sudah di terima dan cepat... langsung berguna terima kasih agan dan terima kasih lazada,5
barang nya sesuai dgn deskripsi lumayan bagus...pengirimanya jg cepat sekarang pesen bsok nya langsung sampe. terimakash lazada,5
sesuai dengan gambar ,5
barang bagus & berfungsi dgn baik,5
"saya minta dikembalikan uang atau tukar barang. tidak menyedot sama sekali, daya sedotnya lemah.",1
enak di pakai gk sakit waktu nyedot dan awet,5
Bagus banget nyampe tpt wktu,5
brg ok.. bgs.. mudah pakai,5
"Pengiriman cepat,belum dicoba karna masih 2 bulan lagi melahirkan,semoga bagus dan berfungsi..",5
Pengiriman cepat barang sesuaI packing aman semoga awet,5
Berfungsi sempurna alhamdulilah.. trimakasih ğŸ™,5
mksh y..brg mendrt dgn slmt dan good product lh,4
pokoknya Top bgt ,5
"Barangnya sesuai gambar,  pengiriman cepat",5
