review,rating
Maaf baru ngasih ulasan lahamdulillah walau agak lama ngerakit nya tp jadi juga... Bagus barang nya mudah2an bertahan lama dan kurir nya jg ramah walaupun  gak ada orang d rumah d tlpn dititip ke ttngga... ,5
Lemarinya ok. Anakku suka banget. Real pict. Sellernya ramah. Makasih kaka. Pkonya jgn ragu beli di toko ini. Recommend seller. TOP. SUKSES TERUS YAH KAK.,5
well received! manual for installation wise quite clear ....,5
ga pernah kecewa dg barang2nya pira,5
puas banget terima kasih ,5
Terimakasih,4
Bagus barangnya dan lumayan simpel cara merakitnya. Akan coba order produk lain nanti,5
"barang bagus,walaupun sempet salah kirim,tapi kesalahan dari ekspedisi nya yg salah tulis resi.
untungnya pro design aktif dalam komunikasi,seminggu kemudian barang dikirim dengan baik.

produk sesuai dengan ekspektasi,rakitnya juga gak sulit.
terima kasih",5
"bagus banget barangnya, kokoh dan designya cantik",5
"ngerakitnya aja yang butuh waktu, overall baguuuuuuuuuuuuus dan ga ringkih .
Repeat order for another item .",5
barang bagus sesuai didiskripsi pengiriman tepat waktu makasih gan,5
Bagus barangnya tapi pengirimannya lama. Mungkin kedepannya pake expedisi yang bagusan,5
"sesuai gambar, bagus",5
okay bngetttttttt,5
ngasih saran untuk setiap kayu ditandai nomor yang mana aja dulu untuk dipasang.,5
terima kasih paketan sesuai diskripsi,5
"mantap , tks 👌",5
pengiriman lamaa bangett,5
Ok,5
pengiriman km....,4
"bagus, murah  & simpel...thanks seller & lazada.",5
"brg sdh diterima, blm dirakit, mudah2an bagus tdk ada yg cacat",5
ok,5
