review,rating
"jumbo banget, saya bb 100 masih longgar... 
barang bagus gak ada lecet. kurirnya lun sabar nungguin dan ramah.. top dah.. ",5
"udah sampai, soal pengiriman cepat sekali,, jumbo bangets aq suka,,,ya meski kebesaran tp aq suka dr pada kekecilan...g nyesel order disini..next time order lagi...",5
Uk x memang wow banget...brangx real pick asli besar uk x ...brang dtang tidak mngecewakn...terimaksih lazada,5
"barangnya udah datang cepet banget..
barangnya bagus realpict.
maaf belum ke foto ..
cukup pas dibadan aku .. 
makasih .. semoga amanah iya kak 
bakalan order lagi deh ",5
