review,rating
"Bahannya gak panas walau agak tipik tp anakku suka, warna sesuai yg diminta, tq lazada, semoga sukses.",5
"barang datang, tetangga ku langsung mau titip belui juga, langsung aja deh tak belikan lagi disini, bagus katanya",5
"awalnya agak ragu karna harga murah, tapi setelah lihat rating toko nya jadi yakin, dan ternyata barang nya bagus alhamdulilah",5
"aduh sumpah bagus banget.. kirimannya juga cepet, abangnya sudah 3 kali sama, makasih lazada, saya sangat puas banget",5
"sudah sampai dengan selamat, sudah di cek ga ada yang cacat atau rijek, suka banget model nya bagus2",5
"walaupun murah tapi kualitasnya jempolan neh, mantull dah , kaya nya saya mau jualin aja deh barang di sini...",5
"terima kasih barang sudah sampai, dan saya sangat suka sekaliii, bakal beli lagi deh ini mah, abang nya juga ramah dan sopan",5
"enggak nyesel deh beli disini, suka banget...realpik. kiriman juga cepet, lebih cepet dari tanggal yang di tentukan",5
"bagus bgt,,syuka...",5
bahannya bagusss,5
Sukaaaaaa bgttttttt,5
"bagus modelnya kekinian. harga nya masih aman buat kantong hehe, makasihhhh",5
"bagus sesuai gambar, dan sesuai harapan juga",5
lumayan buat harga segini..mau beli lagi model lain ah,5
bisa dinilai dari bintang aja yah hihihi,5
"sesuai gambar, bagus kok",5
"ke dua kalinya beli disini, dan masih sangat puas, tidak kecewa",5
"pesan senin selasa udh sampai, mantap.... untuk barang nya juga cakep, dipake nya bagusss",5
"baru kali ini belanja barang nya sesuai, real pic, baguss",5
"baru kali ini puas banget beli di lazada, barang nya realpic dan kirimannya cepat sampai",5
"alhamdulilah sampai dengan selamat dan ga ada yang lecet, asli nya bagus kok , recomended lah",5
"sangat sesuai dengan gambar nya. dan lumayan cepat sampai nya, kurirnya juga ramah",5
"pantes lah dapat bintang lima, tidak kecewa",5
alhamdulilah sesuai pesanan semuanya.. barang juga bagus sudah di cek ga ada yang lecet,5
ğŸ˜˜,5
