review,rating
Bahannya tipis tp okelah sesuai,5
kurang bgus bhan,1
kecewa gak ada ikat pinggangnya,3
bhn nya tipis ga ada ikat pinggang nya..tp ta apalah saya syuka..lain kali lebih teliti ya...makasih lazada,5
"Barang baguuus bgt , sesuai sma body akyu tp kho ga ad sabuk'a yah ? gpp ttp ok kho .. thanks lazada ",5
Barang bagus cm tangannya yg sebelah jelek pd bintik2 merudul ,4
"sangat puas...
mas nya ramah dan sopan,ğŸ‘ğŸ‘
mf mas nya udh kebingungan nyari nama saya. ",5
mantap ccok dipke tpi gaada ikat pinggangnya.tapi gagapa,5
"bagus , real 
oke lah dengan harga segitu",5
"terimakasih lazada,,baju ny pas sesuai gambar,,biar agak kegedean dikit gpp lah",5
good,5
