review,rating
setiap x saya ngambil baju ini selallu menyenangkan sakses selallu lazada kutir ny jg baik rama uda langganan lagi maksihhh,5
alham dulillih sudah 4pasang aq bli baju ini smuanya bagus bahan tebal dingiiin mantul pokok nya kurir nya jg uda langanan saya...maksih kurir...,5
okk makasihhh kak...wah langganan banget akohbd toko ini thank's lahh real pict bangett puassssssss pkok nya buat kurir punnn....aku udh next order yah kak..mudah*an membuat aku puas lagi,5
alhamdulillah udah datang pengirimannya cepat pas di buka bajunya istimewa makasiih lazada,5
sangat suka,5
sangaaaat senang planggan saya jg sukaa mkasih lazada mksh kuriiir,5
lazada memang OK... real pic..,5
"bgss bgt baju nya real pik pas bgt sama AQ
.gak kebesaran gak kekecilan..tnx lazada",5
"Sy pesen pink d kirim ny merah hati,gmn si, d komen'n blg ny merah hati,ini bukti pesen'n sy pink",5
barang bagus...,5
Bahan ny tbal melar bagus..cuma ukuran ny agk kebesaran dikit ..mksih lazada,5
"sangat suka, sayangx kebesaran, tp TDK masala, akan saya jual kembali",5
mantappp,5
mantap,5
