review,rating
Ga salah pilih ssd samsung. memang harga agak mahal tapi benchmar kecepatan juga paling tinggi di kelasnya. Bagus,5
"barang sudah sampai dan sdh berfungsi dengan baik... thx lazada, reseller dan kurirnya... mantab deh pokoknya..",5
"Produk diterima dengan baik, belum dicoba tapi puas karena pengirimannya cepat. terimakasih",5
kencang banget lancar jaya,5
produk rekomendasi banget....,5
"Sesuai Pesanan, Thank you!!",5
Instalasi produk tanpa kendala dan dapat berfungsi dengan baik.,5
"brg oke,  speed mantap.  ",5
"Barang yg diterima sesuai dengan spek yg disampaikan, proses instal os lancar dan cepat",5
keren,5
mantap,5
