review,rating
"bagus bgt kyk emas bnrn游때游때游때mantul,,,,",5
"barng bgus sesuay gmbar tapi sayang kurir nya gk bisa antr krmh sprti biasa.
skrng stiap ada brng yg dtng sllu di suruh ambil di rmh tmn nya mna rmh ny jauh lagi游땓游땓",5
Alamdulilah barang udah sampe dan sesuai dengan pesenan dan kurirnya baik dan ramah makasih lazadah ,5
"sangat kecewa sekali sama kalungnya gk bisa dipake,dah lama baru diantar trus kalungnya gk sesuai digambar,jelek amat gk bisa dipake ",5
"kalungnya bagus ,,, tapi ko gk ada bandulannya yah ,,, tolong diteliti yah 
",5
knapa barangnya gak sesuai gambar saya sangat kecewa mana yg pesen ukuran 45cm malah d kasih yg panjang gak cocok lagi sama barangnya kalo bisa mah mau d tuker lagi sama yg d gambar,5
mantap dgn harga sgitu barangnya mantul aku suka.. mas kulirnya baik dn sopan,5
teryata kecil banget.katanya 45cm panjangnya.kok ga sesua dgn yg ada difoto,5
Bagus adik ku seneng sekali游땕游땕游땕,5
barang ny 0ke bangt makash ,5
"Yehhhh uda nyampek pket aqu,, asli cuantikk Thanks azzam kalung 游때游때游땘游땘游땘mudah쑏an awet bsa pesan lgee kurir ramah sopan santun. 游땕游땕",5
sangat kecewa kalung nya patah,5
"lumayan harga segitu, bagus barang nya",5
barang sudah d terima sesuai ke inginan makasih lazada kurir sudah langganan ,5
Terimakasih cantik sekali.. Cepet juga pengiriman nya..,5
"Kalung nya bagus banget kaya bnr"" emas asli.  Iya walaupun lama datangnya.  Tapi aku puas ko.  Makasih lazada kurirnya juga ramah. ",5
"Bagus kalung nori nya, terima kasih lazada,, kurir nya juga ramah",5
Bguss bgt.. Aq suka aq suka mksih lazada,5
"nangis bangat saya suka,, Terima kasih lazada dan kurirnya,, ",5
Makasih barang nya abagus kurirnya ramah makasih lazada ,5
Bagus kaya emas asli,5
Brangx bagus sprti d gmbar,5
mantuuull bngiitt...thanks seller dan lazada,5
bagus modelny,5
sangat bagus rel PIK sesuai gambar sya sukaaaa sippp,5
knpa gk ad liontin ny,5
"kaya. asli bagus
游땕游땕",5
aku kecewa bgt masa kalung nya putus gmn inh th ga bnr harusnya di periksa dulu sebelum di kirim ,5
bagus bgetttt游뱔游땘,5
bagus bbgt sesui dengan gambar nya mksih 游땘游땢,5
baguss.... mksih 游똂游똂游똂游똂,5
barang y bagus kemasan y rapi terimakasih lazada,5
suka bnget real fick pertahankan y ,5
mantap bagus bgt,5
bagus banget,5
"bagus sie cuman paz d'pke gatel, ternyata alergi, hhu游땞游땞游땞",5
bagus seperti realnya thx lazada,5
persis emas asli makasih ya lazada,5
bagus.. suka,5
"suka banget maksi lazada , abang kurirnya juga ramah aku suka aku suka ",5
"kalung nya sih cantik, tp kok warnanya agak kemerahan ya ... ",5
suka bgty,5
godddd,5
syantik,5
