review,rating
"allhamdulillah keren selalu
ngak nyesel belanja di lazada
seller cepat tanggap,Real pict 
kurir baik makasih lazada good luck yaa",5
barang oke....gelang nya bagus banget aku suka tp rda kecewa cincin nya gde banget ...rda bda sma d gambar ,4
bagus gelangnya real pict,5
ok bgt dapat bonus juga,5
bagusss..realpict..kakak sellernya baikk..kurirnya juga ramah..sudah 4 kali order di toko ini..jangan ragu belanja disini tokonya amanah kok..terimakasihh..lain kali order lagi kakğŸ¤©,5
"Alhamdulillah..udh sampai pesanan AQ..bagus sama kaya yg di foto,, walaupun gelang nya kekecilan..tapi aq suka mksh ya lazada..dan bang kurir nya udah langganan",4
"ok realpict..  mksih buat pa kurir yg udah ngnterin paket nya.. jgn bosenÂ² ya hhe.. 
tetap semangat buat pa kurir nya ",5
Gelang nya mna kok gak ada ,5
bagus real pick. tapi maaf cincinya lupa pake,5
maaf baru kasih ulasan barangnya bagus saya suka semoga aja awet barangnya,5
"bagus banget tapi sayang cincinya kegedean
",4
"terimaksiii barang sudah sampai lucu lucu , dapet bonuss lagii semoga cpt abiss bisa repeat order lagi",5
kurang puas..soalnya warnanya kuning bnget..dan cincinnya gak muat..padahal saya beli satunya muat..ukuran 19,5
terima kasih lazada â¤ï¸,5
Cincinnya pas banget ditangan. Untung udah aku ukur sebelumnya. Jadi pas. Ibuku kira aku dari toko emas belinya karna warnanya mengkilap banget kek emas. Pokoknya aku suka deh. Love it. Semangat terus keluarin yang bagus bagus.. ^_^,5
baguss banget sumpah &free cincin..  smoga gak cepet lunturr.. ,5
bagus sih sesuai gambar cincinya kebesaran n kemasan sobek .mohon diperbaiki kemasannya jgn sampe sobek,5
"real pict, gk pernah kecewa beli di toko ini",5
oke v ccinnya g sama yg d gambar,3
barang mantap..kurir ramah..top markotop pokoke,5
untuk yg lumayan,5
"gelang sm cincin nya bagus cantik bnget sesuai gambar...mksh seller mksh lazada
",5
bagus,5
biarkan bintang yang bicara,5
barang sesuai sukaa banget,5
gelangnya beda sama yg digambar tapi lumayanlah ,5
Bagus banget thank you seller,5
bagus  !!!,5
real pict,5
