review,rating
"Barangnya udh nyampe..pengirimannya cepat,tapi sayang di Pesan ini datangnya itu..semoga lebih teliti lgi y kk...makasih y kk",5
paket nya uda yampe super cepat bgt Uda sering belanja dsni Uda langganan belanja dsni dan sllu puas . baru pesan kmren Uda yampe skrg . cmn sehari . mksi lazada sesekali dapat gartis boleh lah . hehehe . ,5
bagus sekali,5
"paket telah sampe, pengiriman cepat,masker green tea lagi dicoba semoga cocok dan khasiatnya bekerja..sellernya ramah thanq ya ",5
masker greentea nya Uda yampe . pokok nya GK nyesal bgt packing nya super rapih bgt GK pelit . saya GK bisa ngomong apa LG biarlah bintang yg berbicara  . pokok nya wajib beli dsni LG ,5
the best mask.. ,5
"pengiriman cepat ,next order disini lagi klo udh abis",5
"kasih 3 bintang aja dulu, karena baru pemula belanja disini",3
udh dipake nyaman banget pokok nya sama masker nya,5
"terimakasih seller glumory, paketannya sampai dlm keadaan yg sangat baik, dan pengirimannya cepet banget, seneng deh
terimakasih lazada ğŸ™",5
"Produk bagus, Kemasan rapi",5
"barangnya sesuai dgn pesanan, bagus",5
