review,rating
"sudah sampai,,tapi belum di pakek,,semoga cocok yaa,,",5
Recomended babgetsss... Setelah rutin pake masker ini jerawat kabur..muka jdi lebih bersih dan bebas minyak...,5
Sebenarnya udah pesen dua kali ini..dulu jerawat bentol2 gede merah...sekarang dibabat habis semua ama citosan..dan sekarang baru mau pake lgi nih.. thanks seller and lazada,5
"Pengiriman cepat top. sebagai cowok gue juga minder muka penuh jerawat, ini mau coba dulu, kalo cocok ya boleh lah lanjut",5
Udah 1 Minggu masih blom ada perubahan y,5
"Maskernya bagus,, baru dipake 3kali ,, wajah halus, jerawat mengecil n komedo juga hilang... trimakasih",5
"Paket yang udah sampe ini baru pertama kali pake semoga cocok,kl cocok next inssaalloh order lg yg paling senang itu pelayanaya responnya cepat dan ramah pula",5
"Mantap originalnya dan barang juga langsung di kirim. Thanks yaa semoga bisa langganan di sini terus, terimakasih",5
"Ternyata betul citosan diminum juga dapat menghalau jerawat dari dalam, makasih seller bakal beli lgi deh",5
"Gampang pakenya...hasilnya jg bagus d kulit..minyak pergi, jerawat hilang
Masker ini susah larut..tp kalau sdh pakai, bikin ketagihan...kulit jd cerah jg",5
Mulai ada perubahan sedikit demi sedikt mudah2an hasilnya maksimal thank's lazada semoga sukses / kurir baik dan ramah mohon dipertahankan,5
"Makasi ya seller jerawatku pelan2 jadi kering,tinggal ilangin bekasnya aja",5
kok kecil banget ya kak klw di pake masker gk bisa kentel,5
"Bagusssâ¤ cuma lg proses pemakaian, blm bisa nilai hasil nya tp good lah pengiriman cepet.",5
mantull...jerawat makin berkurang..cpat ngempesin jerawat ku yg baru numbuh..rekomend bgt dah,5
"produk ok .. segel .. ori
mungkin di aku kurang mempan yaa udah mau habis 10 kapsul jerawat masih ada",5
udh nyampe cepat banget... smg cocok...,5
"belum dcoba sih, tp sepertinya bagus. tq",5
"ok mantap,, respon dan pengiriman sangat cepat.
mudah mudahan masker nya cocok",5
god job seller ramah pngriman cpt.. smga cocok,5
