review,rating
"real pick, tapi mangkoknya ngak sesuai ekspetasi ku, nyatanya kecil banget, tapi ngak yg penting maskernya, tapi kok kalau maskernya di pakai wajahku jadi gatel"" semua gimana?, masalahnya apa ya?? ",4
"Alhamdulillah pesanan yang kedua kali nya tidak mengecewakan Syukron ka jazakillahu Khairan 
packing rapi kulir nya ramah ",5
"Makasii barang nya sudah sampai,,makasii buat kurirnya udh lngganan bngett❤❤❤sukses trus buat toko ini❤❤",5
"Alhamdulillah tokonya amanah sekali, awalnya kecewa karna pas buka paket cuma ada satu botol sedangkan saya order 3 botol tp pas sya komplen seller nya ramah bgt sya suruh order lg dan kekurangan nya di kirim alhamdulillah terimakasih kak sukses terus 😇",5
"good
",5
"masker dah datang,tapi mangkok nya kecil banget tapi g papa deh terimakasih ya",5
gk ada mangkoknya.  cmn kuas doang. ,5
"ῥᾄќἔҭᾗẏᾄ ḋᾄђ ḋᾄҭἔᾗʛ мὄʛᾄ ƈὄƈὄќ
ҭᾄῥἷ q ṩὗќᾄ вᾄᾗʛἔҭ
ќὗʀἷʀᾗẏᾄ ʝὗʛᾄ ʀᾄмᾄђ ὗḋᾄђ łᾄᾗʛʛᾄᾗᾄᾗ ʝὗʛᾄ",5
secepat kilat wow seseneng itu🥰,5
ok lah barang cuma 2 hari doang smpe pngiriman cpt .abang kurirnya udh langganan baik ramah trmaksh,5
bagus bangett,5
semoga cocok..,5
smoga cocok ya.mksih buat kasir nya ramah banget.the best..insyaallah order lgi,5
"maskernya cocok, baru 3 hari pake muka udah keliatan bersih 👍👍👍 makasih seller dan lazada ☺️☺️☺️",5
paket sudah mendarat dengan selamat. Terimakasih🙏,5
Memuaskan lah intinyamah dan beneran isi 30 kapsul tuh engga nyesel lah,5
barang nya bagus.. pengiriman cepat 👍👍,5
sdh aq pake 2x...enak...,5
barang sesuai tapi ko katanya free kuas tapi tidak ada..,5
Makasih Lazada 🤗,5
"sudah smpai,,pengiriman vepat semoga cocok dimuka ku",5
kok gk ada kuas nya ya...,5
puas bangtt 😍. makasih ya ga ada yg kurang. malah lebih 2 kapsul. gabakal nyesel belanja di toko ini  bakal order lagi kl udh abis 😊,5
barang bagus realpick,5
Gda perubahan malah kering hitam dan gatel ,5
sukaaa bangetttttttt😍🤩🤩,5
isinya pas 30👍smoga ajah cocok di muka saya😅😅makasih lazada❤❤ga pernah nyesel beli disini 😅😅👍👍,5
"Alkhamdulillah barang sdh sampe dgn cepat😁😁,makasih lazada😁,,makasih jg buat abang kurirnya ramah..😁😁",5
pakett Udh Sya Terima Mksi Lazada,5
tak sesuai ,1
"Suka sih,pengiriman cepet banget,peking juga bagus tapi isinya cuman 28 kapsul kurang dua kapsul..tapi yaudah lahh gapapa",4
"mantulll
tp ko kulit wajah ku agak nglupas yaa..  apa emg bgtu..   dan berasa ada gatel ruam ruam gt..  ",5
"baru kasih ulasan, facking rapi datang cepet kurir ramah dan udah langganan juga cuma sayang barangnya blm aku pake tkt aja make nya",5
bagus sesuai pesanannya katanya isi 30 kapsul tapi aku hitung jumlahnya malah 31 kapsul ya bgs deh wkwk semoga aman dan hasil memuaskan😻,5
agak kecewa sih soal nya lambat sampai kerumah nya tpi barang nya bagus dan cocok sma muka aku makasih lazada,5
maaf saya kasih bintang 1 krna brg nya gk ORI soal nya kapsul nya kempet bgt gada isi nya klo yg emg bnr2 ORI itu isi nya padet dan warna nya pekat,1
"penipu di gambar na dapet mangkok SMA koas nya tapi malh GK ada
",1
"enak banget kak .. jerawat lgsg kering padahal baru 1x pake loh ....
mksih yaaa ... mdh""n usahanya makin lancar dan amanahh ... 😊😊",5
Mantap banget diberi bintang okee. Terima kasih banyak kerjasama,4
"alhamdulilah paketnya udah dateng saya tunggu tunggu dateng juga udah dipakenya Satu Kali kulitnya langsung Putih Dan abang kurirnya baik sopan tapi datengnya lama saya juga nunggunya satu minggu sukses Terus 
",5
"Maaf baru kasih ulasan,,,
Alhamdulillah,,,, barang sesuai gambar dan packing ya rapi terus datengnya juga cepat, pokoknya ngk kecewa belanja d lazada.
Dan yang saya suka kurir ya ramah,,, abis dah kenal sih 🤭🤭🤭",5
Barangnya bagus. Pengirimannya cepat. Bisa mengurangi bruntusan dimuka saya. Kurirnya ramah. Pokoknya bagus deh.,5
"Barang dah nyampe sesuai pesanan, kemasan rapih terima kasih lazada,terima kasih jg buat maskurirnya..  ",5
"Barang bagus dtng dngan selamat,,,,tapi kok ngga ada mangkok nya yh padahl saya pilih kuas+mangkok,,,tapi mangkok nya ngga ad,,,,,,,,,,,,aneh nya kok masker nya bau bnget sihh ,;,,,,,,,emng bau nya ky gitu?",5
barangnya sudah saya terima. kurir ny ramah. baik. dan barang nya baik. terima kasih lazada 😊 semoga semakin sukses ya,5
spirulinanya cepet nyampe..botolnya disegel👍 tapi cuma di kasih kuasnya gak pake mangkoknya padahal butuh mangkoknya tapi gpp segitu juga udh murah banget.blm aku coba masker nya semoga berqualitas tinggi yah sepetri tampilannya,5
"spirulina yg daya terima warnanya memudar.sepertinya saya ditipu. karna yg selama ini saya beli, warna dari bubuk spirulina hijau lumut dan baunya tidak amis",5
paket uda sampe. kemasannya botol masi disegel. ok. isinya pas 30 pcs. semoga muka q cocok.. makasi kak.. ,5
alhamdulilah paket mendarat dngn slmt..paket ny sesuai..toko ny amanah ni..tetimksh.amanah terus yaa .lanjut pesanan ke dua,5
alhamdulilah sudah sampai.sesuai cuma blm di itung ada brapa biji kirain mangkok nyh besar tahu.nyh kecil tpi ist oke lah,5
"maaf ya kak baru kasih ulasan,masker nya datang nya dengan selamat dan packing nya rapih pokoknya besst lahk😍",5
mantap bosqu,4
toplah pokoknya ✨,5
"maskernya bagus cocok di muka aku, kurirnya jg udh langganan. pasti ntr klo udh abis bkln bli lg disni",5
"semoga cocok dan mksh banyak buat owner dan  lazada... pengiriman cepat dan barang aman amanah, aturan pakainya suka2 sendiri aja ya... hehehe",5
"maskernya udh sampe, barangnya bagus. isinya 102 jadi bonus 2 masker, cuma pengirimannya lama but it's oke la!🥰",5
nyesel langsung beli dua botol🥴bau nya bikin mual baru pakek sekali udah nyerah.tapi belum tau reaksinya bagus atau tidak.pengiriman juga lama.,3
"Alhamdulilah masker nya udah yampe jm3 sore.
Mantap lah mudah2n cocok aja biar jadi langganan
Trimakasih LAZADA.
Trimakasi mas kurir semoga sehat selalu..",5
"uwwuu suka banget sama barang nyaa😍😍 pengiriman cepat,kurir baik,,,bagus banget si ini tokoo pengiriman lebih cepat dari perkiraan.barang sampai,gak ada yg kurang,dan semua varian sesuai dengan pesanan.
masker Spirulina nya dikasih bonus 1 kapsul
kertas minyak nya lebih dari 50 lembar
masker oat nya ternyata dikit banget😅,sesuai si karna 5gr😂
bakalan langganan deh sama toko ini😍❤️",5
"Sedikit Kecewa,Katanyaa fre kuass tapii pas dtng Masker nya doang!",2
"gk jelas, mangkuk sma kuasnya kaga ada, cuman maskernya doank. ",5
"gk sesuai pada gambar ,cuman maskernya saja, gk ada kuas sama tempat",5
maskernya bau,5
suka banget,5
realpict ada tambahan 4 lagi😍,5
" B aja sih 
pertama kali pake puyeung mau muntah 
",5
Kurang mangkok nya tapi gak papa terima kasih lazada,5
pket y sudah saya terima semoga cocok biar bisa jadi panggangan kurir nya jga ganteng baik lg😎😘😘😘😘,5
"maaf baru dibuka paket nya, intinya aku suka semoga cocok",5
masker nya kw. jangan sampai kalian nyesel muka kalian rusak. saya nyesel sudah pesen. untung belim parah,1
realpicht♡.,5
"pengiriman cepat dan pengemasan rapih juga kurir ramah dan barang sesuai pemesanan,terima kasih,,,",5
Terimakasih lazada semoga cocok.. 😍,5
alhamdulillah paket nya dtng kmrn sesuai sama pesenan saya suka bgt sama masker nya,5
dah nyampe..mantap,5
Barang sesuai mantap ,5
"terimakasih Lazada🙏, untuk Abang kurirnya baik bgt👍👍😅",5
"packing rapi isinya juga pas sesuai pesanan, pengiriman cepat 👍",5
Terimakasih👌,5
"bagus banget maskernya,baru pake satukali semoga cocok,pengiriman cepat",5
"mendarat dengan selamat, packing rapi, Sesuai pesanan, Makasih",5
"Paketnya udah nyampe. Semoga cocok, terimakasihhh",5
thxx youu mendarat dengan slamat packing cukup rapihh smoga cocok dehh ya ,5
sesuai 😍😍,5
kurir nya ramah pengiriman juga memuaskan packing rapi suka pokoknya ^^,5
"packing rapi,cuma blm di coba dan ga tau hasil nya,semoga bermanfaat ya, sukses trs lazada 🥰🥰",5
"Alhamdulillah barang nya udh dtng,mksh lazada mksh buat abg kurir nya☺️",5
"Baik pngirimannya,  sesuai, 30 biji... Semoga cocok",4
"saya sukaaa maskernyaa ,,pngriiman cepatt ,,hrga mrah kualitas bgus",4
"paket nya udah sampe,,kapsul nya kurang 1 butir.",5
"aku uda pake 2x sma ini,  bagus si,  kalo abis pesen lagi lah huhuy.  aku sma pacar aku syuka.. ",5
Alhamdulillah brangnya sampe:),5
"lumayan, cuma ada kuasnya aja mangkoknya gk ada.. ",4
maksih... akhirnya sampe jg masket yang di tunggu2 ....realpict bgt,5
"terimakasih Lazada barangnya udah nyampe, isinya juga pas 30 kapsul dan hasilnya juga memuaskan ",5
makasih lazada paket nya udah sampe . sesuay lagih bari ejeng patuker ge 😊😊😊😊,5
barang nya udh sampe lumanyan memuaskan gk kapok deh belanja di sini😍🙏,5
langsung eksekusi semoga mukanya jd rada kinclong dikit,5
"Alhamdulillah paket sudah nyampe,, isi nya di lebihin 1,, mudah""an ccok,, mksih seller",5
oke sih tapi aroma nya.. bau banget kurirnya jg ramah,4
"packinganya rapi💦 kurirnya baik ramah langanan kurirnya😂mudah""an cocok dengan saya maskernya😊",5
Alhamdulillah pesanan nya sudah sampai dan hasilnya sangat bagus tapi saya g suka dgn aromanya saja,5
"tidak mengecewakan 

",5
paket nya sudah saya terimaaa sama aristyaa barusn ,5
bagus pas30,5
Alhamdulillah udh nympe smga cocok,1
panas di muka,2
"relfic bagus bngt aku suka
",5
barang nya bagus pokoknya.. ,1
"Masker ny yaa memuaskan,,,wajah aku jg lngsung bersih,,tp cyng gak dpt kuas ny",5
"gada kuas ya isiya cuman 30
",5
"smoga cocokk,, aminnn",5
mksh kk brg ny dh nympe cepet pula pengirimn ny ....smg ccok y kk ,5
makasih lazada maskernya udah sampai dengan selamat dan dengan waktu yg cepat😉,5
sangat kecewa banget pesanan nyah tak sesuai pesanan!,1
bagimana cara memakai maks nya,5
paket dh smpai..mks lazada,5
alhamdulilah barangnya sampe tapi g ada kuasnya,3
"maap baru kasih ulasan skrg,reallpict❤️",5
paket udh sampe,5
top markotop pokoke,5
Alhamdulillah barangny sdh smp bru di cobain jadi blom ad reaksi ap²??ktany free sm koasny tapi ko g ad y!y sdh lah g apa thanks lazada semoga cocok di kulit semoga g kecewa,5
"bagus makanya beli LG
",5
"bagus makanya beli LG
",5
"ALHaMDuLiLLaH DaH SaMPai ORDeRaNNYa , MaaF TeLaT NGaSi ULaSaNNYa 🙏",5
gk kuat sm bau nya .  but ok,5
coba dulu yah,5
pokoknya ga nyesel bli ditoko ini memuaskan hasilnya,5
muka gw pake ini jadi beruntus banyak,2
"packingnya rapi,kurirnya baik",5
Sangat memuaskan..... kurirnya juga ramah baik,5
"Mksh lazada top bgt👍👍👍👍👍👍


",5
"trimksh,, kurir ya ramah ",5
sesuai harga semoga cocok,5
terima kasih lazada paket udh sampe mf bru kasih ulasan.... barang nya bagus...,5
"Makasih realpict , abang kurir nya juga ramah makasih moga kurirnya jadi langganan terbaik😊",5
"mngkk nya encit bngt wkwk.
pengiriman cmn 2hari",4
makasih barang datang sesuai yang diinginkan,5
baguss lah mantul untuk harga segitu,5
"dikira mangkok nya besar, ternyata kecil... Tapi ttp bagus ko ☺",5
buat samsung j2prem ada ga gan,5
"alhmdulilah paket nya udah datang semoga cocok buat mas kurir nya terima kasih udah nganterin malam""👍👍👍",5
sy kasih bintang 3 dulu y.. soalnya saya blm prnh pakek jadi sy blm tau hasil nya entr kalau sy cocok sy akan tmbah lg bintang nya,3
bagai mna in..z pesan dua isi 30..kok cuma 1 botol isi 30 yg datang..trus 1 pesananku bagai mna in..sudah di bayar 2 paket yg datang cuma 1 paket..kecewa😡😡,5
"Bismillah 
Alhamdulillah tidak mengecewakan, barang bagus pengiriman nya cepet syukron kak semoga rezekinya makin lancar🤗🌷",5
"barangnya sudah sampai bbrpa hari yg lalu,, maaf bru ksih ulasan barangnya sesuai dgn pesanan mksih ya.... 🤗🤗🤗🤗",5
"pesanannya sudah sampai dengan tepat waktu... saya kasih bintang tiga soalnya saya pesen 30 kapsul + kuas, terus saya pesan satu kuas lagi. tapi hanya datang satu kuas. dan kapsulnya juga cuman 29 bukan 30. tolong lebih teliti ya...",3
"paket tlh sampai tp syngnya kuasnya tdk ada pdhal pesan masker+kuas+mangkuk , makasih dengan mas kurirnya",3
"Maaf baru smpt ksih ulasan 🙏 paketnya Uda mendarat dengan baik no cacat rapih pula nd sesuai request thx u 🤩
Abang kurirnya ramah baik mpe rela nungguin gw yang gak ada dirumah posisi lagi dirumah mertua 😂😂 pokoknya thx u juga bwt Abang kurirnya 👍",5
"semua oke sesuai gambar, semoga kasiatnya juga bagus udah d coba semoga cocok, bisa buat langganan, sukses lazada dn toko kurirnya udah biasa 👍",5
kereenn produknya.. meskipun murah.. tapi barangya gx murahan.. muka kinclong setelah maskeran... 🙏🙏,5
Tokonya baik ramah banget kurir nya juga tapi saya belum coba produk nya dan belum di buka paket nya semoga cocok deh aku promosiin di tik tok ok ,5
"terima kasih buat pelayanannya .😊kurirnya ramah baik sopan lagi.
   saya puas dengan barangnya tidak mengecewakan sama seperti ynk ad di gambar terima kasih",5
"Terima kasih kk maskernya bagus banget,, kurirnya juga ramah, dichat langsung respon,,,, Terima kasih lazadaaaa,,,, sukses terus yaaa🤩",5
bagus tapi ko ga nam bah putih ba saya kecepatan dan kuas juga ruksak maaf saya ga kasih foto nya tapi saya bener baa dan tong jangan 1 mi ggu dong ma itu lama dan kurur nya baik okkk ,3
makasih lazada spirulina masker wajah nya sudah saya terima dan buat ninja expres selalu cepat kirim barangnya dan barang sesuai dengan yg di gambar,5
"blm di buka..blm sempet maskeran..
pengiriman cepet..kurir pun ramah..klo cocok belanja lagi dsni..pertahankan ",5
utk masker nya baru dua kali pemakaian hanya saja blum ada perubahan kulit saya blum terlihat cerah ,5
"barang agak lama ngirim nya , tapi sesuai pesanan , paket nya juga rapi , pokok nya ngak nyesel deh beli di Lazada ,",5
paket udh datang mangkuk nya jg ada kuas nya juga agak kapsul nya jg pas 50 intinya bagus banget saya senang thanks lazada,5
"barang ea udh datang .. sesuay dengan gambar .. bagus banget .. dan juga rapih engga ada sma skli keruksakn 
",5
"Masya Allah, kak maskernya bagus banget cocok di mukaku yg berjerawat, pemakaian seminggu udh ada perubahan, mukaku lebih putih bekas jerawat pun memudar, nanti kalau ini habis mau order lg..
Makasih banyak kak..",5
"mksh lazada barangnya sudah smpe bagus dn mangkoknya mungil banget aku suka, smga cocok dh spya bsa order disni lagi, mksh juga buat abng kurir nya baik dn ramah sukses trs lazada..",5
"real pict bgt dah👍😉,tp aku kira mangkuk nya gede atau sedeng lah trynta unyu bgt ya,tpi ga pp harga sgtu cocok deh. smga cocok dikulit aku ya🤗",5
Masker ny sih bagus pake sekali jga langsung keliatan bersih.. Tapiii bauu masya Allah gak tahan bau ny doang... Tpi the best lah.. Mksh lazada.. Kurir jga baik ramah😊,4
paket nya udh terima..sesuai bnget gak pernah kecewa...makasih lazda...makasih juga buat si amang kurir nya udh langganan,5
pengirimannya cpt banget kemaren pesen hari ini langsung nyampe barangnya pun bagus sesuai gambar gk salah deh belanja ditoko ini amanah banget,5
"Barang sudah sampe pengiriman sangat cepat..
Aku kira dapat koas sama mangkuk nya..
Salah baca kali yah😂",5
"Pengirimannya Cepat, Barang juga Tidak Ada Kekurangan, Kurir Nya Juga B Aja Ga Jahat Ga Terlalu Baik Juga
",5
"produk baik,baru coba juga semoga cocok biar langganan teroos😊",5
barang nya bagus bnget memuaskan wajah saya juga jadi glowing👍👍👍,5
"good dah ,pengantarn cepat bat",5
bagus pknya😇,4
Barang iya sangat baguss....kurir nya langanan,5
Maaf baru berikan ulasan barang nya bagus dan ada kuasnya juga,5
mantaaappp pengiriman cepat kualitas okeeee❤❤❤❤,5
sangat bagus,5
mantap pokoknya kaga mengecewakan,5
"paketnya dah smp  ,tp  blm  says coba   kurirnya  ramah ,kemasannya  rapih .mksih lazada ,mksih  reseller. ",5
gak php banget packingan rapi trs jumlah kapsul nya juga 100 jadi sesuai pesanan suka banget!!😋🥰🥰,5
𝚒𝚗𝚒 𝚔𝚊𝚝𝚊 𝚝𝚊𝚗𝚝𝚎 𝚊𝚔𝚞 𝚖𝚊𝚜𝚔𝚎𝚛 𝚙𝚊𝚕𝚜𝚞 𝚔𝚊𝚕𝚊𝚞 𝚊𝚜𝚕𝚒 𝚐𝚊𝚔 𝚋𝚊𝚞 𝚐𝚒𝚖𝚊𝚗𝚊 𝚜𝚒𝚑 𝚜𝚎𝚕𝚕𝚎𝚛 𝚙𝚎𝚗𝚐𝚒𝚛𝚒𝚖𝚊𝚗 𝚕𝚊𝚖𝚊 𝚔𝚞𝚛𝚒𝚛 𝚐𝚊𝚕𝚊𝚔,3
sesuai dengan yang dipesan,5
"Nyesel saya belik nya terlalu banyak karena bauk nya yang bikin saya gak tahan dan sekarang mubajir ☹️☹️,,teruss kapsul nya cuman 95 kurang 5 lagi,,kalok bisa barang nya saya kembaliin ",5
"sesuai malah ada bonus dua kapsul
saya sudah 3 kali pemakaian tapi masih belom ada hasilnya mungkin aja masih belom yahh😇
bdw itu bisa diminum? khasiatnya apa ya kalo di minum",5
alhmdlh  pket  dah  dteng   peking ny  rapi  and  mkch  abg kuriny  yg  rmh   bget  dah  jd langganan  kta  mkch lazada,5
Pengiriman cepat peking rapih kurir nya juga ramah tp 1 syang masker nya bau banget pas saya pake sampe muntah2 saking bau nya,2
"Pelayanan sangat baik,prosesnya cepet,kulirnya sangat ramah..Trimakasih lazada,seler dan kulirnya pertahankan pelayanan nya.ok",5
"maaf baru kasih ulasan barang nya sdh sampai sdh saya coba 3x mudah""hn cocok,tpi g ada merk nya di botol nya mksh",5
"barang datang dengan selamat,tapi gatau kulit saya yang sensitif gatau apa nya sesudah pakai itu 2 kali langsung reaksi gatal"" dan beruntus ",2
"packing baik,tp pas di pake maskeran gak ada efeknya gth kalo yg biasa pake pas masker mau kering itu ke wajah serasa kenceng yang ini mah engga malah B aja",4
"pesanan sampai dengan selamat, pengiriman gercep ga pake lama, ga pake mikir, ga pake otak wkwk pokoknya cepet bin fast lah. paling murmer diantara yg lain. thx lajandah dan thx buat yg jual🍌💦",5
"👍 sudah ready, 100 butir 1 kuas, ada yg kosong 1 tpi gpp lah mksih.",5
brg nya bgus pengemasan rapih hanya aja terlalu lama bru smpai tpi tk apalah punya sndiri kalau pesanan org jngn smpai kyk gni lgi😊 kurir baik ramah jga thks lazada,4
"Mksi, masker spriluna ny bgs top. Kapsul ny jg lebih. Mksi 😘😊",5
"maksih kak paket nya dah dateng peking nya rapih komplit di lebihin lagi kapsul nya mksih yh kak,abang kurir nya ramah,,smga amanah trus yh kak smga sukses☺️smga cocok",5
sesuai dengan keinginan,5
Bagus mkasi,5
"Real pict bngt😍bru mesen semoga aja cock,tpi syg ada yg ga penuh tpi gpp lah😊",5
ini yg kedua kalinya saya beli bagus,5
"Udah nyampai barang ny ,packing rapih,mudah""an cocok buat sy...kurirny ramah.mksh lazada",4
"Barangx Udh nyampe,di bungles rapih banget,
kurir yang anternya pun tanah ",5
"barang nya sesuai,terimakasih😘",5
terimakasih brng sdh smpai,5
"sangat puas, packing rapi,cepat datangnya,pokoknya sangat puas sekali",5
"masker nya bayi
",1
"masker nya udh dateng packing nya rapih kurir nua baim,terimaksih .
",4
ok mantap Barang sesuai,5
Belom dicoba,4
barang realpict tp pas dipke ko gatel yah,3
"paket sudah sampai,maaf ya baru kasih ulasan
makasih lazada isi nya ada 32 udh di tambahin 2 biji....
kurir nya udh langanan,sopan,sabar makasih",5
barang bagua isinya juga sesuai top dah,5
bau masker nya pengen muntah,2
mantap sesuai pesenan 😍,5
bagus banget,5
Masker ya bau bgtt gk kuat sma bau ya jdi gk pernh d pke,5
"real, sesuai pict👍🏻👍🏻👍🏻👍🏻👍🏻
",5
barangny mntul,5
bagus sesuai gambar paking rapi abang kurirnya juga ramah trimksih .,5
di gambar ad mangkukny begitu dtg gk ad mangkoknya aduhhh kecewa sih😒,5
saya menerima paket dengan baik,1
alhamdulillah.. hatur nuhun kulir,5
"alhamdulilah udah nyampe Ok makasih ya 
",5
"Udah datang kak makasih, tapi kalo mau komedo ke angkat harus pake tisu ya kak? ",5
kemasan ok .. cuma bau banget sih . EMG dri bahan apa .. ,5
trimakasih paketnya udh smpe,4
mksh barang ya dah sampai lengkap...,5
Alhamdulillah muntappp bgt maskernya next order lg....,5
"trimakasii kakak💖
",5
barang sesuai pict👍,4
sesuai pesanan makasih,5
"Cepet parah pengirimanya, masker pas 30kapsul+kuas nya lucu. Kurir dah langganan:)",5
makasih kak barang nya udh Dateng ,5
terima kasih barang nya sudah sampe degan aman,5
Ok sesuai pesanan😍,5
sesuai pesanan alhamdulillah:),5
"Makasih kak sesuai dengan pesanan, ",4
"barang udah nyampe ,tapi pengirim nya lama,tapi gpp barang nya bagus sesuai pesanan makasih LAZADA",3
sesuai sm di ptoto,5
suka bgt deh pokoknya ga mengecewakan 🥰❤️,5
paket udah sampai mksih seller mksih mas kurir.. ,5
"maskernya real,, toner nya beda sama di gambar.😒😒😒🙄🙄",5
Bagus banget.. terus pas di itung itung bonus 2 Spirulina makasih...,5
sdah smpe mkasih lazada,5
asli sih Bagus banget jadi putih muka nya 👌,5
suka banget maksi lazada,5
"udah sampe, makasih lazada sesuai pesanan",4
"unit OK, fungsi OK, pengiriman cepet OK, sang pengirim OK jg..",5
><,5
lope 5,5
ok,5
mantap,5
p,5
Ramah dan cepat pengirimannya,5
makasi brg nya sdh dtng maaf agak telat respon nya😊,5
bagus,5
bagus❤,5
Top,5
👍🏿,5
sipp,5
Sesuai ,5
ok,5
jooos,5
pesanan sudah saya trima..Tapi saya kecewa sya pesen 2 paket tp mangkok dan kuas nya tidak ada.. ,1
"barang udah nyampe,kurir ramah.terima kasih...",5
Biar bintang yang menjawab ,5
cepat sampai nya ...good,5
planggan aq suka,5
"Paket'y udah dateng, cpt bgt, barang sama kya d gambar, mudah""n cocok",5
Alhamdulillah barang sudah sampai dan barang nya belum saya buka jadi mudah mudahan cocok ,5
Mantul dah barangy sudah sampai CPT dtngy bang kurir udh Langganan saya,5
"TOP Aja lah,,,memuas kan dan sesuai dgn harga....trims",5
"Barangnya dh sampe maaf baru beri ulasan,barangnya bagusssssss",5
produk okee,5
Lumayan baguslah... Sesuai harga. ,5
Katanya ada kuas sama mangkuk nya tapi ini nggak ada sih kecewa banget seller nya juga judes banget,1
Recomended! pengiriman cepat ⚡,5
ini masker nya emang bau nya begitu yah?,5
pengirimanya rapi kurinya baik ramah,5
okee bngtttt thanks lazada and seller,5
Blm di coba mksih ya buat lazada  maaf baru di kasih ulasan ya,4
realpict tpi pengiriman agak lama,5
barang sesuway top pokonya mah.,5
"makasih pengiriman cepat
",5
agak Tak sedap bau nya,2
"pesanannya sudah sampai, barangnya bagus sesuai pesanan",5
"barangnya sesuai, tpi syang muka ku gak cocok make ini",5
"uh mantul, mksi lzda mas nya enak di pkay.. moga ccok dikulit ak ya,, mksi mas kurirny lngganan 
🙏",5
wah masker y oke mama kita aja suka soal y cocok bagus....pokok y gx kecewa lhk ,5
mantaap bagus,5
"Wangi maskernya gk enak bgt,,gk kuat dengan bau nya",3
barang ga sesuai kok ga ada koasnya ,5
"terimakasih paketny udh datang ,,Abang kurirny baik

",5
ok . tpi blum di coba,4
biar bintang yang berbicara ☺🙏🏻,5
kesekian kalinya order ga nyesel,5
masker ny bgus muka aq jd kenyal dan mengecilkn pori pori itu mmng bner bru 3 x pemakaian sii,5
"Bagus barangnya sesuai pesenan tpi blum tk pakek semoga cocok di muka ku 
Kurir ramah baik",5
sesuai pesanan,5
"real pict bngett,kurirnyaa jga baik,mksih lazada",4
barang cepet dtng lumayan kurir ramah,5
Barangnya uddah nyampe. tpi ga ada mangkuk sama kuas. ,5
isinya pas bgt 30 tu +kuas ny jugk best dh😍,4
bagus barang yah .. tapi bauu yah doang bikin muall,5
"Semoga cocok, bru di cb sekali blm, bau ohh... Tpi bagus kok, cpt jg smpai y, kurir y ramah mksih",5
realpick 😍,5
Sangat Bagus,5
"cepat sampainya,barangnya bagus dan isi sesuai.trimakasih ....
",5
sudah sampai🥰,5
Ini expayet nya kapan yaa?,5
Suka. mangkok by kecil isi nya lebih lagi,5
isinya cuma 49 kurang satu kapsul,3
ok bagus banget pokonya recommended,5
"Maskernya bagus, toko amanah👍",5
Mksh lazada barang sudah sampk .maaf baru ksh ulasan ,4
"bagus banget, baru satu kali pemakaian udah tampak banget cerah gitu. thanks buar penjualnya",5
mantap cocok baru 3x pemakaian udah ada efeknya,5
bagus kok sya dapat bonus nya ni 6Bini trmksh seller👍,5
"belum dicoba si tapi semoga cocok ya,pesenannya sesuai sama yg difoto",5
"oke terimakasih ,masker spirulinanya bagus pokoknya ok deh kurirnya juga ramah ga ada yg rusak .",5
katanya 50+2kapsul.tp isi ny ttp aj 50 gk ad tmbhny 2..tp y sudh mksh untk lazasa,4
maskerny ok ,5
mkasi sesuai gmbar. tapi baunya gk enk y,5
"Terimakasih paket sudah sampai dengan selamat , free mangkuk beneran dan kapsulnya lebih 2 jadi 102",5
mantap terimakasih lazada ,5
"makasih lazada paketnya bagus dibungkus dengan rapih 
",5
barangnya sesuai pesanan,5
oke kak sesuai kok realpict🎉🎊,5
Kurirnya kurang sopan banget bukan barang saya tapi saya suruh nalangi. ,1
barangnya dh smpe mksh lazada,5
"barang nya udah sampe ,realpic makasi lazada",5
"barang oke,tapi di muka aku ga cocok malah beruntusan",5
"packing aman sesuai pemesanan,semoga cocokk okeyy",5
realpic barang'y semoga ccok masker'y di wajah saya dan kurir'y juga ramah thanks Lazada 😀,5
lumayan,5
realL pich,5
barang sdh nympk...maksh lazada,5
Bagus.👍👍👍,5
Thank lazada and Wiko store,5
barang nya sesuai😘,5
good banget💗😘😘😘,5
thanks lazada.. 👍,5
2 kali beli dan ga nyesel sama sekali keduanya memuaskan,5
mksih brangnya sesuai ,5
ga ada mangkok nya sih,5
makasih lazada 😊,5
terima kasih??? barang oke..,5
"sudah nyampe makasih
",5
paket sdh smpai kira'n ada kuas'y trnyt masker doang its oke lh,5
bgs...q suka mksi sukses trs...,5
barang nya udh sampe sangat bagus maksih kak barang nya no tipu² dah pokoknya ,5
"Allhmdullilah udh yg saya pesan udh dateng,  tp kok gk ada koas nya,  dri gambar nya dapet koas yah",5
barang nya sangat bagus ,5
barang nya udah sampe kurir nya ramah makasih lazada . ,5
Makasih barang sudah sampe,5
sesuai gambar mga ccok,5
belum ada perubahan diwajahku :(,5
"Paket uda dateng, makasih peking rapi, abang kurir nya ramah😊 smga cocok. ",5
bau banget beda sm yg biasa saya beli. gaakan beli lagi deh disini,5
kurir nya ramah pengiriman cepet makasih yah untuk reseller nya ,5
bagus banget  smpe hilang bekas jerawat makasih banyak❤️,5
sangat bagus. makasi,5
sesuai gmbr,5
Maskernya wajahnya emang ada tapi kurang lengkap bannya saya kecewa banget kak😭😭,2
bagus bagus bagus,5
barang dab dateng kemarin.sesuai sama pesanan.kurir juga ramah.thanks lazada.,5
Semoga cocok mkasih lazada,4
trimksih kak.. barangnya dtang ya cepat bnget dan kurirnya juga ramah. brngnya juga bgus. 😀😀,5
