review,rating
"bagus , berfungsi dengan baik , pengiriman cepet , rekomendasi dah beli disini ğŸ‘",5
"Alhamdulillah, Barang nya touch down dengan mulus, cepet banget nyampenya, kurirnya ramah, seller sangat responsif dan komunikatif, saya sudah menerima dan mencobanya, trust me, itu work !! terima kasih banyak gan, recommended langganan nih, semoga barangnya awet. ga ngerti lagi deh mo ngetik apa, biar bintang 5 yang menjelaskan kualitas seller.",5
"recommended seller
respon cepat barang original pengiriman cepat
sangat memuaskan dan langsung bisa di pakek
sangat worth it",5
"mantap banget deh lancar jaya, kurir nya good ",5
"packaging aman. Barang original.
Adata menggunakan chip Sk hynix.",5
bagusss,5
"barang sampai tepat waktu, packing rapi, barang berfungsi dengan baik",5
Plug and Play! Performa laptop jadi lebih maksimal! Terima kasih!!!,5
"epic, rekomen asli!! ",5
"work gan, di Asus K46cb",5
mantap barang sudah di terima dan terbaca ,5
istimewa Sesuai estimasi pengiriman 3hari,5
"Muantap, cepat dalam penanganan.... terima kasih, Sukses Selalu",5
"Barang di bungkus dengan sangat rapi, dan RAM nya berfungsi dengan sangat baik.",5
brng mantap,5
"barang sudah dipakai di laptop dan tidak ada kendala,",5
barang oke,5
lumayan,5
"Barang diterima baik barusan. Tapi masalah ketika memori dipasang keluar screen biru sebentar, tidak bisa masuk ke windowsnya dan kembali restart berulang-ulang. Kalo pakai memori yg lama gak masalah. Memori sama DDR3, Laptop HP G42-372TU. Saya untuk Upgrade dari 1GB ke 4GB. Gimana solusinya?",5
"barang cepat sekali sampenya, luar biasa",5
