review,rating
bagus banget topi nya aku suka tanks lazada abang kurir nganterinya magrib2...,5
"terimakasihh barang nya sudah sampai, sesuai kyk di foto bagus bangetttt",5
makasih kak barangnya bagus banget. sukaaa. next order lagi,5
Topinya baguuus. Barang ya okeeee makasih gan ğŸ‘ğŸ»,5
bagus,5
bahan bagus mantuuul topinya,5
baguuus bangeeet pengen beli yg warna lain lagi ah,5
real pic gak mengecewakan nanti mau order yg lain lagi. makasih seller,5
bagus topi real pic.seller ramah kurir ramah tanks lazada,5
