review,rating
"alhamdulillah barang nya sdh sampai walau agak lama,dikemas rapi,kurir nya baik...terimakasih lazada.. 🙏",5
"produk BAIK, packing SUPER AMAN, pengiriman SUPER CEPAT, pelayanan pengirim dan penjual SANGAT RAMAH, TERIMAKASIH BANYAK. MANTAP",5
"menyebalkan, kapokkkk pedagangnya ngga bisa baca dan gagal paham...minta warna warni....dijwb okey....eee malah krmnya satu warna pink pisan...ingin sukses kooo begitu pelayananya.",1
"mas kami pesenya warna hijau kok datangnya wrn salem, gimana ini ditukar bs ndak ",5
Paket udh dtng dgn selamat chating seller di tanggapi dan amanah.kurirnya langganan bg Muhamad arsyuddin yg amanah...lazada mantul dan sekdes selalu,5
mantap sesuai pesanan,5
bagus sesuai pesanan....,5
"topinya sih bgs cuma kekecilan, da nunggu lm. ",5
terimaksih barangnya sudah sampai.cocok langsung di pake.,5
mantappp,5
