review,rating
Kecewa gambarnya gk sesuai yg di inginkan.  Udah mah lama pengiriman gk sesuai lagi.  Kapok belanja ditoko ini,2
"real pick , mantappppp",5
"pesan tlsn orang tua yg dtng laen pdhl wat tmn,kecew tmn gw",5
Uwoooww ternyata kurir nya mantan ogut hahahawowkwkwkwk,5
gmna sih kok gambarnya tidak sesuai di foto yaa,5
real pict banget gak nyesel deh belanja disini,5
"kiriman cepat,,barang nyaman di pake..mantap",5
mantap bagus kurirnya ramah,5
MANTAP,5
ga bagus,1
"makasih lazada paket udah nyampe bangus bangat
",5
