review,rating
evergreens mantul,5
syukkaaa bgt....pengiriman cepat...sesuai gambar..sesuai juga sama harga,5
barang bagus paketan cepat datangnya,5
beda warna pesanan...,5
tidak sesuai warna minta kuning 2 malah hitam semua...kecewa sangat beratttttt,5
barang tidak sesuai dengan pesanan. pesan warna kuning yang diterima putih,2
"barang nya bagus..sesuai gambar walawpun pengemasan nya sedikit kurang baik
",5
"pesen warna kuning yg di kirim kok hitam...
lain kali lebih teliti donk...",5
Realpict,5
"okey good brg bagus, ",5
mantaap ndezZ,5
