review,rating
katanya elite.. kok di kirim spirit kak !! :(,3
"tidak sesuai dengan jadwal,tapi bagus, respon bagus,Peking rapih",4
"barang bagus,kemasan ok,kurir takde ngambil sendiri ke jne",5
Bagus stiknya sama pengirimanya tepat pada hari dan packing nya juga rapi,5
"thanks,stick nya bagus semoga awet ",5
stick nya bagus tp belum di coba,5
bagus setik nya mantappp,5
"barang tidak berfungsi
",1
udah sampe barang nyah mksiih lazada semoga awet  blm di buka si gmnh batangnyh ,4
ok barangnya,5
sesuai pesanan,5
Thanks lazada..barang sudah sampai dengan slamat,5
