review,rating
"udah beli yg ke dua kalinya,barang bagus .cepat sampainya, paket seperti yg pertama beli dikardusin jg.pokoknya g kecewa beli ditoko ini. untuk poto lupa melulu dipotoin.",5
"paket rapi di kardusin, pengiriman cepat,tp barang belum di tes,semoga kualitas bagus,mau jadi langganan klo memuaskan....",5
tolonggggg jngnn rugikann pmbelii. ini klanjutan.nya gmn . aku pesan stick kok yg dateng memory,5
mantul banget barang ok,5
"produk bagus sesuai gambar.harga murah.kualitas ok.
g kecewa blanja disini.",5
Mantap pengiriman cepat,5
"SANGAT BAGUS& PUAS.. WAT LAZADA PEDAGANG SEPERTI INI YG HARUS DI JADIKAN CONTOH WAT PEDAGANG"" GAK BERMORAL DI LAZADA..... MESKIPUN STIK, Y BLOM DI TES SM SY.. TP SY YAKIN BAIK.. DR SEGI   PESAN WARNA AJA SDAH SESUAI ...
",5
Stik ok n nyala smua,5
bagus pokonya,5
