review,rating
Nice.. Sesuai Pemesanan Makasih Lazada,5
"mantul 2x pesen dsini, ini mau otw pesen yg ke 3x nya",5
mantap barangnya dan  oke bangett nih ,5
"sudah mendarat, tapi blm di coba diterima dlm keadaan mati.. hrs di cass dlu. smoga aman dan berfungsi dgn baik",4
aku beli nyampenya 4 hari (ke Bali).  dus nya sudah tebal jadi aman walaupun saya ngga beli yang pakai dus sticknya. didalamnya masih dilapisi bublewarp... ,5
stik sampai dengan tepat waktu dan tombol fungsi semuanya,5
"berfungsi semua,cmn analog nya kurang enak dan tidak dapet dus nya 😅 trus belom tau awet apa tidak nya.",5
"Stik langsung konek, dah dicoba semuanya berfungsi dg baik, dah dipakai sebulan masih bagus, semoga awet lebih lama",5
mantap oke sesuai,5
yg 1 nya analog nya eror ya wajar sih barang seken di perbaiki tpi kita ini beli pake uit tolong sebelum kirim di cek dlu .,2
"Barangnya  bagus gak ada minus apa apa pokoknya josss ,, cepat kurirnya ramah. ,,, Saya kasih uang okir lebih lagi ",5
"bagus cuman sering mati nggk kyk stik layaknya,",2
"dsni isi 2 pcs knpa yg dtng cuma 1
tlong dkirim lg yg 1 nya",1
"alhmdullih brangx udah nyampe, sekali coba lngsung conek, semoga awet ..",5
"pengiriman cepat packing rapi sesuai pesanan , mantab lah mataharu game ",5
"mantap ...... mantul ..
    penjula nya ramah ",5
mantap,5
"gan mana silicone nya kok gak ada? walaupun barang bagus kalau gak lengkap tetap aja mengecewakan gan.. hati"" gan... ",3
"Cepat banget pengirimannya. Pakingnya oke, barang yang datang sesuai sama yg diiklankan. Semoga dualshocknya awet, thank's matahari game.",4
"Analog tolong di tingkatkan  dan di cek lg sebelum.  Pengiriman,..  Terima kasih ",3
"bagus berfungsi semua , semoga awet",5
"Barang bagus walaupun gak ad kerdusnya,,berfungsi semua,",5
stik lumayan bagus,5
"Sdh bagus pengiriman nya tapi ada 1 buah yg rusak analog nya,, mohon periksa kembali jika di krim",4
"Ini yg kedua kali order,,barang mantap..pengiriman cepat,,RECOMEND banget...",5
mantap,5
alhamdulillah barang normal ..!!,5
"stick PS3 nya kok gak lngsung konek
",4
stik y blm d coba krna PS3 y blm sampe. ,5
barang bagus,5
"Satu kurang bagus.cara gantix bgmna
",5
"Pengiriman cepat, barang bagus seperti yg di foto, moga awet ;)",4
Barangnya baguss tapi ga dapet usb nya,4
okkk,4
mantap ,5
"pengiriman cepat, sesuai foto, stiknya juga bagus, thanks ",5
