review,rating
"trimakasih banyak paket sudah sampai. 
pokoknya mantap. ",5
"Barang sudah diterima dan sesuai spesifikasi yg ditawarkan, terima kasih lazada terima kasih central tas dan terima kasih kurir",5
"Produknya oke, bagus lh pokok nya. Cuma ada perbedaan sedikit dari yg digambar ada corak n motif nya lalu pas dateng itu polosan. ",5
rekomen deh tasnya bahan bagus,5
biarlah bintang yg bicara,2
"Alhamdulillaah... bagus..., anak suka. Paket rapih... kurir ramah.",5
maaf telat responnya....barang sesuai smoga semakin dtingkatkan kwalitas barangnya...makash,5
"Q suka dgn brngx gk mngecewakn dgn hrg segitu tasx muat bnyk
",5
Alhamdulilla barangx bagus pengiriman cepat tepat waktu .....terima kasih Lazada ğŸ™ğŸ‘,5
Bagus,5
