review,rating
brgnya udh smpe. packing nya rapi. brg sesuai gmbr.  real pict. bhan oke. ngk mengecewakan lah. thnks kak.. i like it.. ,5
Thanks lazada tas nya riel pich banget aku suka cuman warna nya kurang suka tapi gak papa tas nya bagus,5
Gimana sih kak aku minta ya kan warna merah kok dikasih coklat padahal kan udah chat ish tapi enggak papa lah lain kali lebih teliti lagi ya ,5
"Ini ke 2x aku order,bagus murah berkualitas dan fast respon.. recomended pokoknya.",5
puassss bgttt udh langganan,5
makasih lazada barang nya DA di terima bagus ga ada yg sobek sesuai gambarğŸ˜Š makasih juga buat kurir nya baik dan ramahğŸ˜Š,5
"alhamdulilh barangnya udah nyampe  baramg nya bagus aku sula banget kurirnya ramah makasih lazada a

",5
"kualitas bagus,kurir ramah,smga awet",5
"udh di trima makasih 
",5
terimakasih atas barangnya sudah sam,5
"Barang nyampe nya cepat, kualitas ok bgt. Terima kasih, senang belanja disini",5
"sesuai pesanan, packing rapi.",5
alhamdulillah barang sudah sampe tas nya bagus ,5
bgus bgt tas ny topp lazada moga makin suksessss,5
"suka,bahannya bagus sesuai harapan",5
"aseli bagus bgt , besar pula ,kurirnya ramah mau nungu,sukses terus yah ",5
kebesaren tasnya sangka tasnya sedang menta warna coklat di kasihnya item ,5
Bagus bahannya tebal ,5
"jempol pengirimen jg cepet bgt 
",5
bagus murah,5
barang saya terima dengan bagus. bahan tas nya juga bagus,5
"paket datangnya cepat barangnya bagus sesuai dengan pesanan, terimakasih lazada",5
bagus!!,5
Mantul ,5
mantap,5
