review,rating
"Barang diterima dengan baik, dus dibungkus bubblewrap, semua berfungsi, tidak ada kendala saat menginstal driver, performa tidak diragukan lagi semua game rata kanan. Harga sangat memadai waktu 12.12 kemarin. Tidak rugi membeli vga ini. ",5
"paket sudah terima dengan baik, bungkus bubble wrapnya rapi unit semua lengkap, cuma kardus agak penyok dikit diujung tapi gak mempengaruhi unit vganya yg di dalam, tinggal test drive aja
terimakasih nvidia dan lazada",5
"Pengiriman cepat, barang sesuai, packing aman",5
Belum dicoba soal nya masih ngumpulin part nya hehe ,4
