review,rating
"gak sesuai gambar, di gambar ada lampu samping nya juga, tapi pas sampe gak ada",5
"mengecewakan, barang datang tidak sesuai, tidak Ada lampu sampingnya, hnya senter depan, menyesal saya beli",5
senternya berfungsi dgn baik tapi tdk sesuai gmbr....?..... ,3
knp saya pesan gak sesuai pesanan saya dtng nya maaf klo bisa teliti dulu sebelum kirim Krn yg akan kena dampak nya nm baik Lazada sebagai tempat pemesanan nya....,5
"Salah kirim senter,saya beli t6 cob yg d kirim xml2.bagaimana ini kok bs terjadi",1
"barang berbeda dengan yg digambar, ngak ada lampu tengahnya, agak kecewa",5
barang sesuai psnan.ok. cepat smpe expres siip lah,5
kacau bulpnya cuma xpe bukan t6,5
mantul,5
