review,rating
"paket sdh diterima tapi barang salah kirim , pesan rak handuk  yg dtg rak piring , gimn ini.. minta di  tukar bisa ",5
bintang yang berbicara ,5
wBarangnya sdh sampai cm kecewa barang tdk di kemas hnya Dia Aslinya sehingga ada yang penyok sbnrnya realpich tapi jd cacat gara gara gk di kemas baru kali ini pesanan tanpa kemasan,5
"order tgl 9, sampe tanggal 20, udah gitu mur nya kurang 2 buah.",3
mantap gak kecewa,5
"Trimksih tuk barangnya dah sampe dgn cepat,sesuai dengan gmbrnya,mantul deh pokoknya",5
"barang sudah diterima dgn baik, sesuai dgn pesanan ",5
sudah diterima cumaa belum dpasang mudah2an berfungsi dengan baik..sukses terus untuk seller & lazada,5
ok,5
