review,rating
kecewa saya beli 2 saya bayar yg datang cuma 1..buat pembeli yg lain bijaklah dalam memilih seller masih banyak seller lain yg jujur dalam berdagang..biar adil bintang 2 saya rasa cukuplah.,2
saya tidak menerima rak handuk.. sementara uangnya sudah dibayar 115rb harusnya yang datang 2 barang rak handuk dan rak sabun..ini yang datang rak sabun saja mohon ditindak lanjuti.. kembalikan dana atau dikirim rak handuknya..tadi saya tanya kurir katanya hanya 1 barang saja,1
mudah merakit y tp hrus d bor dlu tembok y buat sekrup agar guat..tp ya slesai juga... rekomen. brang bgus minimalis. thks lazada,5
"alhamdulillah paket dh di terima,wl packing sederhana dn kardus penyok2,blm sempet di pasang,mudah2an awet",5
"pengiriman cepat bgt. pesen kemarin skrg sudah datang. makasih seller makasih lex expres.  barangnya bagus. sayang ga bisa upload foto epek jaringan. 
",5
barang nya yg ini ga ada saya ga iklas 7turunan kalo ga dikirim lagi ....,1
thanks seller barang nya sudah sampai datang nya cepat banget ğŸ˜Š,5
"barang sudah sampe,bagus.realpict pengiriman cepat,hatur nuhun seller,hatur nuhun lazada",5
barang bagus..,5
Sesuai pesanan. Respon cepat ,5
paket mendarat dengan sempurna,4
Barang bagus.... pengiriman cepat... Lazada ok... ,5
Tq Om... Rak gantung sudah diterima dgn baik... Semoga tambah sukses.... ,5
sdh diterima tapi belum dipasang semoga tidak ada masalah,5
Barangnya bagus sesuai contoh,5
belum dbuka dan dpasang mudah2an ga ada kendala ataupun bisa digunakan ,5
mantap,5
senang,5
