review,rating
"rak handuknya bagus sesuai,,pengiriman cepat sesuai estimasi..kurirnya ramah..terima kasih",5
makasih. barang dah nyampe dalam keadaan baik.makasih lazada.makasih Abang kurir yang semangat malem2 masih mau nganterin...makasih dan sukses semua,5
terimakasih lazada maafbaru kasih ulasan...barang oke sudah saya pasang makasih bt mas kurir ,5
Awal nya buat tempat handuk tapi kok bagus juga d buat rak tempat susu ğŸ˜€ ,5
"Barang sudah sampai, sesuai dgn gambar, belum dipasang mudah""an kokoh dan awet",5
"kualitas barang sangat bagus sesuai dengan harga, cuma sayang bautnya kurang, teliti dulu sebelum packing ya...",4
"barangnya mantap, kurir ok, ga cacat trims lazada",5
over all good lengkap,5
"Alhamdulillah barang sudah sampi, Trima kasih ğŸ™",5
