review,rating
"Sprei nya bagus, ga terlalu tipis, bahannya alus, realpict, jaitan untuk guling agak kurang sedikit rapih, selebihnya bagus untuk harga segini. thanks lazada. kurirnya baik.",5
"sesuai psenan.. ,realpict. aku suka😍😍😍😍😍😍bahannya lembuttt bgtt.... , puas pkonya gk d bkin kecewa... ,kurir ny udh langganan,mksih lazada mksih abang kurir🤗👍🙂",5
alhmdllh seprainya baguuus banget trimakasih semuanya.,5
"Alhamdulillah bagus seprai nyaaa, mkasih seller.",5
OK bangettttt bhanya halus banget tebel sesuai..  Gambar lah ngak kecewa dechh ,5
Sangat bagus ukuran nya sesuai yng d pesen bhan nya lembut😍😍,5
"barangnya bagus lembut dan okeee
",5
"bagus sekali sapreynya .. cuma lama pengirimannya.. 
bosan menunggu smpe pasrah , soalny kelamaan dalam perjalann.
kualitas bagus",5
"saya puas banget dengan barang nyaa sesuai real bangett bahan nya adem😍😍 cepat sampai nya dan kurir nya ramah..
enggak nyesel dehhh dan tak sesuai yang di bayangkan 😍😍
terima kasih lazada
lazada selalu dihati",5
assalamualaikum terimakasih seller bahan nya bagus ga nyesel deh beli di toko ini barang datang sesuai pesanan hordeng pintunya gede hordeng jendela juga gede sangat memuaskan ,5
paket nya sudah mendarat dengan baik 😁 kurir nya pun ramah..senyum terus 🤭.. seprai nya bagus..bahan lembut.. trimaksh seller .. trimaksh lazada 🙏,5
"alhamdulilah pesanan dah dateng. sesuai pesanan anaku sukaaaa bgt. mksh lasadaa & kurirnya jg ramah. pesenan bru dateng,q lngsung pesen lg buat sodara muda2han jg susai pesanan sma kya sya ",5
sangat bagus dan sesuai pesanan..gak mengecewakan..saran aja motif doraemon lebih banyaj lagi dan gambar nya berbeda biar bisa pesan lagi..terimakasih 😊😊,5
"brngnya bagus,packing rapi,sesuai dgn keinginan,kurirnya ramah,ga kecewa pesan di lazada,,mksi lazada",5
"uwuu><😍,,,,,,,Maaf gan baru kasih ulasan 😁,,Spreynya Asli bagus, sesui gambar 😍,dan ukuran sangat jumbo 💚Ngg nyesel deh beli disini 😁,cuma sayangnya bahannya tipis kali ☹️,tapi gpp karna sesuai harga 😃,,,sebenernya saya dari sebelum lebaran pesen disini udah 2x tapi saya batalin, karna saya ragu mau pesen nanti takut ngecewain,,, dan akhirnya saya mencoba pas dipasang emang uwuuuuuu banget 😍😍sukses terus buat seller.. ",5
"Alhmdulilah barusan aj nyampeny. Suka bgt real pict, sengaja sklian beli no 1 gede bahany jg bagus
saya doain smoga laris yaa mba",5
Masya allohhh bagus bangetttt....di kira bakal ngecewain ehhh malah bikin ketagihan.....#pengen belli lagi,5
jangn ragu2 buat belanca Dsini karena gilakkkkk sopreinya bagus banget ya ampun💕💕💕 sprei dan hordeng yg aku pesan itu cantik banget bagus no ke ndala pokoknya TOP MARKOTOP lah...makasihh 😍😍😍 penjualnya juga ramah banget ya ampun😍😍 ,5
"baguss lembut seprenya.. aq suuuuuukaaaa... makanya mau pesan lagi nichh... 
😀😀😀..trzzz toko nya ramahhh lagii.. pengirimannyaa jugaa cepatt pokoknya superrrr ookk dechhh",5
yes cinta banget bahan nya tebal dingin. murah tapi gak murahan. pokok nya cinta banget sama spray nya. ilove you lazada. kurir nya ramah langgangan🥰😘,5
"Saya suka bahan spreinya, murah tapi berkualitas. Saya tidak menyangka juga akan smpai secepat ini.
krna biasa kalo ke kampung saya yg ada d Kendari Sulawesi Tenggara estimasi nya biasanya 5-6 hari. sy pesan d lazada baru 3 hari udah nyampe barangnya. Dan memuaskan pas liat pesanakanku real pic. Semoga toko ini dan lazada akan tetap seperti ini yaa semoga sllu amanah 🥳😇🙏🥳",5
"bahan bagus banget,tebal real pic,,pertahankan yah untuk kualitas nya seperti ini terus,,kurir nya ramah baik,,tanks lazada dan davina88,,sukses slalu,buat yang mau belanja disini jangan ragu yah,cus tambah k troli ny",5
"paket nya sudah datang, Bagus banget seprai nya saya sukaa.. 😘😘 buat mas kurir sangat ramah ..selebih nya toop lah.. 😘😘👍👍",5
alhamdulilah... paketan nya sudah sampai dr kmren... mksh seller and LAZADA bahan nya adem banget pas di cobain.... oke banget next order lagi yg hello kitty blm punya.... 😊 mksh.... ,5
Mntap bahannya tebel gk kecewa,5
"alhamdulillah barang nya sdh nyampe real pic sesuai pesanan packing nya juga rapi aman tdk lecet sdikipun kurir nya juga baik ramah sopan sdh langganan.., good job pertahankn yah pokok nya klo pelayanan nya bagus kayak gini saya mau terus belangganan di toko ini...!!! 😍",5
"paketnya sudah sampe dengan cepat, barang mantul banget, udah langsung di pake, kurir juga udah langganan.
makasih seller",5
"alhamdulillah barang nya sdh nyampe real pic sesuai pesanan packing nya juga rapi aman tdk lecet sdikipun kurir nya juga baik ramah sopan sdh langganan.., good job pertahankn yah pokok nya klo pelayanan nya bagus kayak gini saya mau terus belangganan di toko ini...!!! 😍",5
"paket baru sampai pengiriman cepat kemarin saya pesan hari ini sampai , ini ke 2 kali nya aku beli disini selalu suka warna nya jg cerah tp disayangkan sarung guling hanya satu gpp deh mksh seller,kurir dan lazada 🌈",5
"mantep setiap blanja d lazada slalu sesuai yg d pesan sama yg d gambar ,,pngiriman'y pun cepet bgt ,,slalu berikan pelayanan yang terbaik untuk pelangan ,,sukses selalu",5
"seprayy lumayan lah bahannya, tapi sayang jaitann di sarung bantalnya bener""cacat karena sobek , tapi untuk pengemasan rapi, kurir juga ramah.",3
"seprei nya bagus realpic,bahannya pun lembut,kurirnya ramah, pkokx syuka banget, seller tingkatkan teruss😊",5
"astagaa sumpah bagus banget, bahannya lembut. pengirimannya cepat, ga nyesel order disini. next untuk yang kedua kali bahkan seterus nya saya order disini lagi, pertahankan yaa😍🤗",5
Barangnya bagus makasih,5
"sangat memuaskan lah, bahan nya adem lembut bagus bangetlah good",5
"bagus banget pkonyah jangan ragu beli di sini pakking rapih,insyaallah bkal jdi langganan🤗mkasihhh",5
"alhamdulillah mendarat dgn selamat
hasilny memuaskan",5
"pengiriman cepat, Seprainya bagus cuma ada noda kuning nya gurat panjang, dn gk tahu klw d cuci ilang apa nggak, sarung bantalnya juga motifnya beda banget gk sesuai, udh gitu warnanya agk pudar, tapi cukup bagus",3
"Bahannya bagus, tpi gambarnya gak sama seperti contoh, bantal sama guling ya gak ada gambar doraemonnya, gak kayak contoh gambar",3
"Bagus spreix bahanx tebal&gk ada yg cacat,pengirimanx jg ok.saya suka bget,alhamdulillah selama belanja di lazada gk pnah mengecewakan.",5
"suka bangeeet bahannya bagus adem, and pokoknya aku suka doraemon. awal di cuci luntur tapi lama2 gak ko.  hehe pokoknya rekomend buat teman2 semua ",5
"Paket udh nyampe tpi sayang kurang 1 ga ada sarung gulingnya,, 😭😭😭
Kurir ga mau antar ke rumah alasan ga ada no rumah padahal kan bsa tanya2",3
"Buagusssssss Buangettttt Sepraiiinya,saya puas sama pelayanannya,kurir juga ramah👍👍",5
barang sampe cepet  sprei nya baguss. . kurir sangat sopan ramah dan ternyata teman sekolah saya dlu.. ,5
"realpick bgt,,, saya suka",5
sarung bantal yh kurang satu,5
bagus wrna nya realpict,5
mantull bngt aku suka sekali jangan ragu beli disini amanah bngt tokonya😻,5
sangat memuaskan bahannya lembut dan realpict😍 puas pkoknya belanja disini. makasih seller🤗,5
seprehnya bagus kandel..👍👍,5
"suka bnget sma seprai Doraemon x makasih lazada kurir x baik sopan, maaf nunggu di depan rmh agak lama😁makasih👍👍",5
"datengnya cepet , 1hari langsung sampe
bahannya tebal ukurannya juga oke gambarnya sesuai yang diinginkan. good lazada
kurirnya langganan juga 
",5
"barang bagus bgt real pick makasih seller N lazada , bahan adem pokok y puas bgt , next mw pesen lagi ",5
Allhamdllah barang datang dengan rapih dan sesuai pesanan... Terima Kasih lazada selama ini sya gk prnah di kecewakan.... Top banget lazada... ,5
"aku suka bahanya lumayan lah...doraemon sesuai pesanan..tp sarung guling cuma2...pengiriman juga cepat
",5
"Alhamdulillah barangnya real pict 😍 barang sesuai psenan,,ukuran nya sesuai,,sarung bantal nya 2,sarung gulingnya 1 pkonya puaslah,,thankss lazada😘😘",5
"Harga murah tp gak kalah kwalitasnya sama yg bermerek, bahannya adem, sesuai dengan di gambar, pokoknya saya sangat puas sekali, kurirnya juga udah langganan,udah hafal deh😊",5
" kak gmna sih ini masa sarung bantal guling y cma 1 , terus tali guling y jg cma 1, tolong donk cekin lagi sblm barang di packing, jgn buat customer kecewa kak, biar barokah jualan y.",5
"sma seperti di gambar nya😍 bagus banget suka suka suka,, pengiriman cepat,, kurir Ninja nya baik😊 ",5
kecewaaaaa nya di yg HELLO KITTY .. barang nya rijek sobekkk😭😭😭 kalau yg motip DORAEMON BGUSSS.. mau di tuker males ribet nya .. ,3
alhamdulillah brg sdh smpai...barangnya realpic bahannya bagus..adem..pokoknya puas deh👍👍..tq   y lazada...,5
"makasih ya , barangnya udah smpek . pengirimannya juga cepet bnget , gak ada seminggu barangnya udah sampek . ",5
"uuhh udh 2x beli alhamdulilah gk pernah kecewa bahan nya juga bagus bgt ,seneng deh klo penjual jujur bgini sukses terus ya bwt Devina88 and lazada😍😍",5
"Alhamdulillah Paket Udah Nyampe Cepet Banget Pengirimannya Pesen Kemarin Sekarang Udah Datang Realpict Banget Barangnya😍😍Belum Sempet Dipasang Seprenya Soalnya Mau Dicuci Dulu😂Kurir Nya Pun 
 Ramah 😁Thx Lazada",5
"Maaf baru kasih ulasan, padahal paket udah dateng dari kemaren, Alhamdulillah sprei nya realpic sesuai dengan harga, cantik banget, lucuuu, saya sukaa❤ tidak mengecewakan.",5
"paket sampe kemaren sore, langsung cuci, hari ini baru pasang  ,jagoan cilikku suka banget lihat gambar2nya, 
kualitas tipis tp lumayanlah buat ganti2 sprei 😊",5
Mantul..mantap betul bagus banget saya puas...bahan lembut..semoga gak luntur..makasih lazada and reseller..👍👍👍👍 pengiriman cepet banget kurir nya ramah,5
"terima kasih LAZADA paketx dah aq trima,puaaaas banget dgn sepreynya..mg makin jaya y ...Aamiin😇😊😊😊",5
"Alhmdulillah bhn ya lmbt sesuai lh sama harganya pokonya saya suka bangeeeut.
dn maaf baru smpt komentar.",5
"Trimakasih Lazada. Bahan nya lembut dan bagus harganya murah dan terjangkau.
Saya kira cuman spreinya doang, eh ternyata sama sarung bantal nya juga. Waduh puas bgt deh. Thx lazada is the best..👍",5
"sprei nya bagus banget, pengiriman nya juga cepet",5
"seprai nya bagus . bgt
makasih lazada
",5
Alhamdulilah sesuey pesenan moga amanah terus biar tetap menjadi pelanggan terus jngn sampe mengecewakan pertama bagus pas ke2 kalinya gagal barang nya .,5
"Alhamdulillah barang udah sampe,, pakking yang rapih barangnya bagus sesuai dngan gmbar... 🙂 🙂 pkonya gk sia-sia pesen di lazada..

Makasih.. 👍👍👍",5
"alhamdulillah paketan sudah diterima,  bahannya bagus,  puas pokoknya,  walaupun dagdig dug sama expedisinya",5
"Alkhamdulilah paketan dah datang...sesuai gambar dan spreinya lumayan sesuai harga .Pokoknya puas deeh...makasih lazada ...


",5
"terimakasih produk bagus..cuman syg sargul nya dapat 1 aja..tpi nggak pp ttp yg lain ok...
pengiriman jg cepat...",5
Seprai nya bagus tapi jaitan nya tidak rapi dan kayak gag selesai... Dan jasa pngirimannya itu lama bnget,5
sukaaa bngetttttt,5
"alhamdulillah brng smpe dngn aman ngk ada cacat sedikit pun banhnya lembut,,,seller rmh mksih lazada",5
bahan ok .brg Dtg lgsg q cuci g luntur cm bhn agak tipis ok lah untuk hrg segitu .kurir dh langganan ,5
sesuia gambar pesan doraemom datang y juga doraemon udah yg ke 2.x q pesan puas dah bhn y juga adem mksih lazada ,5
barang mantul fokonya suka bnget,5
"spreiii nya bagus sesuai gmbar,,anak saya suka,,,pengiriman nya jga cepat,,terima kasih lazada",5
saya puas bgt dgn sprei nya pokonya sesuai ..bhan bgus adem warna dan motif saya sukaaaaaa bgt makasih lazada,5
alhamdulillah sudah smpai. barang bagus sesuai.   pengiriman cepat dan si abang nya juga udah langganan . best ,5
Paket sdh landing & sdh langganan jg di toko ini mksh sis sukaa next psn yg keropy mksh jg bwt mas kurirnya,5
barang udah diterima thanx kualitas oke tuk harga segitu cm anak saya nyari sarung guling satu lg gk ada😊,5
alhamdulillah sprei ny real pict lagi makasih lazada pengiriman ny cepat bahan jg bagus ini order yg kedua kali ny 😍,5
" bagus sih bahan nya adem tpi agak tipis yah sesuai dengan harga ok lah,di sarung bantal nya ada yg sobek dikit lain kali perhatikan lagi yah☺️",5
"gimana sihhh, aku pesen 2 kok datengnya cuman 1? pokoknya gak mau tauu, gimana caranya paket yang 1 harus dianter lagi !!",5
alhadullh paket udah dateng dan bagus persis kaya di foto anak sy suka banget kurir ya juga ramah pokokya enggk nyesel belanja di sini makasih lazada semoga selalu sukses terus,5
puuuuuuaaaassss bangeeet.... y allah senang na amanah seller na .. dan kurir na dh langganan... kalo ada bintang 10 aku kasih deh 10 bintang... dan langsung d pasang loooo,5
Sepreinya bagus bahannya pun tebel suka banget deh makasih lazada juga kurirnya pengirimannya cpet lah😍,5
saya suka banget recomended babget pokonya saya sampe pesen lagi sekarang bahan nya bagus real pict banget pokonya ,5
Barang sesuai harga semoga kedepanx barang semakin berkualitas trims lazada dan terimaksih buat bpk kurirx udah langganan orangx ramah,5
"real pict,,, pengiriman cpt,,,recommended bgt...thx lazada,,,thx seller & thx abng kurir nya",5
"Sprei nya bagus, ukurannya juga besar, tidak mengecewakan pokoknya😊
Terima kasih
Kurir nya saya suka, baik, Ramah juga😊",5
real pick banget 😍,5
"gila ini toko udah bahan jelek gulingnya cuman satu gambar mitipnya acak2 gak karuan,baru kali ini belanja d lazada kecewa bgt,jgn mau belanja d toko ini barangnya sangat egk bgt,gw jadiin lap  😠😠😠",1
Bahanya bagu$ jadi full bintangnya $aya $uka walapun agak Terlambat datang bahanya ok maka$ih ya kak ,5
"alhamdulilah paket ny datang dan sangat amat suka sekali sprei ny
hatur nuhun lazada tetap amanah ya",5
"alhamdulillah paket nya uda sampai,cept banget,dan barang nya bener² real pict,cantik banget,next order lagi pasti,makasi yaaa,amanah banget toko ini,kurir jg ramah..🙏🙏🙏",5
"Kameranya lg rusak mknya gak nulis ulasan ,,barangnya bagus pgn beli lg nanti klo ada yg gambar the cars,bahannya jg adem gak nyesel deh mksh lazada😘",5
saya sukakkk bgt.  reaal pict bahan tebal dan adem.  gk nyesel beli nya. tpi sarung bantal saya kok satu ya,5
"Alhamdulillah pket yy udh smpe td sore. 
Cpt bgt pengiriman yy. 
Seller yy jg ramahh.. 
Poko yy rekomendasi bgt. 
Sprei yy jg bgusss... Real pict.. 
Next order lg ah.. 
Mksh atas kerjasama nyaa... ",5
"syukaaaaaaaaa banget ,bahan lembut BANGET walaupun hrg murah to kualitas gak murahan terloveeee ♥️🥰h"" ",5
Bagus bgtt ank sy suka bgt sm seprai nya.. Tp sayng kurir nya cerobo.. Hampr slh ngasih paketnya untungnya aku tanya dulu.. ,5
"Paketnya udah nyampe, maaf ga bisa pake foto hp nya eror. Seprai nya bagus, suka bangeeeeet.. harga murah tapi ga murahan. Dikira licin, tapi engga. Mantul deh pokoknya. Terimakasih lazada, seller & kurir🙏",5
"sepreinya bagus, sesuai gambar, kainnya juga halus semoga warnanya ngak luntur yahhh. kurirnya juga langganan😁",5
mantullll........,5
Pengirimannya cepat kualitas barang spray halus bagus trima kasih bt Davina 88 pertahankan terus kepuasan konsumen/ pelanggan.  Trima kasih Lazada dan kurirnya yang sudah langganan. ,5
Bahan dan kurir Ok,5
ternyata kasurku ukuran no 2. jd longgar DECH... tp bahan lumayan adem. motif nya lucu banget. thx seller n lazada. kurir ramah,5
"sepre nya lembut dan jahitan nya rapih,  pokok nya bagus pisan lah..  terus tingkat kan kualitas dan paling utama jujur dlm usaha nya ya..  ",5
"barang nya. bagus saya suka ,penanan sesuai dgn gambar ,,,terimakasih lazada",5
Toopppp banget sesuai pesanan,5
"seprenya bagus,bahannya adem.sesuai gambar.tpi bahannya bagian bawahnya,ada gurat"" gitu.kya ngebrudul..kayanya harus lebih teliti lagi deh kak selernya.",5
"Alhamdulillah paket udh smpe, barang y bagus, mksh Lazada ",5
sarung bantal sama sarung guling ny ngk sesuai sama yg ada di gambar 😢 kecewa ,5
"Seprey nya bagus bahan nya Rebel
Jahitan jg rapi..
Pokok nya mantap deh
Terima kasih toko devina88
Semoga sukses terus",5
"barangnya udah nyampe di rumah dengan selamat dan sesuai sama gambar, dapet sarung bantal sama guling tapi lainnya panas tapi Alus. Alhamdulillah terimakasih yaaa",5
Kualits okk...  Bng kurir ok profesionl...  Penjuual reS pon baok Makasiii davina 88 cm pngrimn lamaaa kt bng kuri krn mau akhir tahuun,5
"baguussss bangetttty dah pokoknya gak nyesell lo belanja disini
kurirnya juga ramah thanks lazada dan sller🙏",5
"Bagus bgt sprei'a suka deh, mksih ya buat seller'a trus ttp kya gini selalu amanah. Dan maksih jg buat lazada enk deh klo bang kurir'a udh langganan mh gx ribet. Hnya sja ada yg kurang tali buat bantal guling'a krng satu tp gpp ok lah🤗",5
barang nya sdh nyampai bagus real pic sesuai pesanan good job 👍 hbis ini saya mau order lagi thank you lazada,5
"Bagus sprey ny sesuai gmbar, lumayan tebel dn lmbut bhanny... Pengiriman ny cepat kurir ny jga ramah makasih lazada tetap jdi langganan terbaik ku... ",5
Seprai nya bagus....bahan nya jg tebal...anak saya  sangat suka..makasih...kali ini ngak kecewah belanja di sini.rencana mau pesan lagi....😊🙂🙂,5
"buat yg lain gausah ragu order d toko ini,rekomended bangett,sprei ny halus keren banget pokoknya,next order lagi disini,kurirnya juga udah yg biasa 😊😊",5
Wah😍Tadi ny takut banget takut barang ny gak bagus dan mudah pudar😞tpi pas di bukak asli nya cantik banget😍kurir ny ramah bnget pkok ny puas deh Mksih Lazada😍,5
"sy suka skli sma sprei ny realpict bgttt,, kmarku jadi tmbah cantik.. yah walaupun agak tipis sprey nya tp sy sukaa😘",5
"Puas tapi kurirxx gmw msya d'sruh ambil ndri ..
Saya lo pesan barng buat beli bukan minta kurirxx mulutxx kasar",4
"barangnya bagus, packing rapi cepat pengirimannya,  kurirnya jg ramah, terimakasih reseler n lazada. ",5
"lngsung datang 
langsung saya cuci
dan ternyata gc luntur ank q suka😍
3 bintang dulu ya karna baru pertama order😀",3
"Sbnrnya udh dr kmrn paketnya nyampe,tp krn kali ini kecewa jd mls diulas...bahanny panas,agak tipis,dn ga sm dgn sprei yg sblmny sy beli,pdhl dr toko yg sama...kualitasnya berbeda.",5
"seprei kedua dari davina 88😁
suka sih pas bngt sma kasur aku tapi warna nya cepet pudar ,belom pernah dicuci aja pudar aplg udh di cuci
",4
Alhmdllh paket udh dng mksih lazada saya suka brang sesuay penanan ditambah kurir nya baik banget👍👍👍👍👍👍p0k0 nya sip buat lazada,5
realpict 👍,5
thanks paket smpe mksh lohh. pket sesuai estimasi bagus real pict thanks lazada dan sellernya,5
biar bintag yg berbica,5
Biarkan bintang yg berbicara intinya puas banget trimah kasih lazada dan pak kurirnya😘,5
brang na bgus pngiriman na uga cpat pkok na puas nggk nyesal blanja dsni mkasih lazada,5
"wow cantik lembut seprainya super jumbo, terima kasih SMG sukses selalu amin 🙏😍",5
bagus sesuai pesanan. makasih ya lazada,5
"barangnya bagus bangett
bahan nya tebel,kurir nya juga ramah.
makasih lazada 🙏🙏🙏",5
"Spreinya bgus, kainnya tebel",5
alhamdulillah real pict sesuai gambar sampai nya juga cepet 3 harian,5
"spreinya bagus,,,pengiriman juga sesuai dengan pesanan,,,",5
produk oke..bahan adem sesuai pesanan motifnya...terimakasih seler dan juga lazada ,5
"paket udah sampai,, pengiriman cepat,, barang sesuai pesanan bagus bahan'e,, makasih 🙏",5
"Mantap banget, bahannya ademm",5
"sesuai dgn gambar sesuai dgn harganya juga, bantalnya kecil",5
Pesanannya sudah sampai sesuai estimasi.barang bagus.paket rapih.kulirnya jga ramah..pokonya top semua deh.,5
alhamdulilah barangnya ready cepet bgt baru juga mesen kemarin seakarang sudah sampai pokonya gak nyesel beli dilazada harga murah bahan bagus banget gak kecewa pokonya,5
barang baru sampai. pengirimanx agak lama. spreix bagus.kainx adem. cuma kainx agak tipis.pesan 2 minta random ga bisa. tp tetap ok kok..kurirx ramah.. makasih lazada,5
"alhamdulillah 2x order seprai rumahannn tdak mengecewakan..
jaitan ny rapi.
bhann ny jga lmayan bagusssss..


smga sukses truss ya toko + tkang jait ny..
kualitas no 01 cciiinnnnn 😁😁😁
",5
order k dua kali.ny tp kali ni kcewa knp tmpat tali sarung bantal guling .ny gx ada lobang.buat masukin tali😑,4
harga murah tapi kualitasnya gak murahan ..barangnya ok banget ..aku suka banget ..thanks KA .😍😍😍,5
mf barU kasih Ulasan..paket udah sampai kemaren barang nya bgUs sya suka langsung sya pakai...makasih Lazada...kurir nya baik dan ramah,5
"bagus, bahan nya juga lumayan tebel 
pokoknya puas bngt, harga murah kualitas bagus.. 
terims kasih lazada, sukses selalu  👍",5
"top 
asyik belanja di toko ini 
udah 2 kali order 
insyallah tidak mengewekan 
pelanggan saya jadi senang😘😘😘😘 
",5
"product oke.
cuma jasa pengiriman ninja itu mgkn lebih cocok ditambah turtle.. ninja turtle.. 
kerjaan lambat. dan pengantar paket sungguh gak ada tata kramanya.. 
sampai depan rumah malah bertanya kamu siapa kamu siapa!
gak ada sopan santun.

untuk seller product mantap.
",5
Seprai nya top markotop ...abang kulir nya baik suka becanda  udah langganan gk nyesel  beli d sini sangat terpercaya deh makasih 😍💝💝💝💝,5
"mantap pesanan sesuai, pengiriman lebih cepat karna melalui NinjaExpres thanks Lazada, silahkan di order kaka. 😂",5
datang nya malem banget seprei nya lumayan bagus lah dgn harga segitu sarung guling nya kecil belom di coba tau cukup tau kaga mau di cuci dulu,3
Sprei bagus dan nyaman di pake .. cuma sayang sarung guling ny cuma satu .. tapi bagus bngt bgtu datang bsok ny langsung di pake .. terimakasih seller dan lazada ..,5
bahan nya dingin asli bagus lebih bagus bahan ini dr pd merek ledy ross mantul di pertahan kan yah kualitas nya😘😘,5
"baguuuusssss bangeeeetttt ..... ud bli banyak, nga mengecewakan..... makasiiiii lazada dan pa kurir ny yg ramah ",5
"Brang nya bagus warna nya cerah cuma syang jaitan d sarung guling nya ga rapi sma sarung bantal nya kecil
Untuk packing rapi bgt sampe"" aku susah buka nya😂",5
"Alhamdulillah barang sudah sampai, sesuai dengan gambar Alhamdulillah, mudah""an gak luntur",5
Memuaskan sekali Trimakasih kk sesuai pesanan semoga berkah ya tokonya laris banyak peminatnya amiin. ,5
Alhamdulillah barang sampai sesui pesanan pokonya bagus lain kali mau pesan lagi yg hello Kitty Nya ,5
kyakny sprei asal jdi ni msak jahitan bntal sm gulingny serbutan gk diobras sekli jhit aj cpet rusklah spreiny jg gersang pnass emmm mklumlah hargany jg murah,5
"spreinya lumayanlah sesuai hrga..pengiriman jg gak trll lama. terimakasih seller, terimakasih lazada",5
"bagus sesuai d gambar, makasih lazada

",5
bahan nya tipis bngt benang nya merudul n admin nya kurang respon tolong lah lebih ditinggkat kan lg n lebih disesuai kan lg dngn harga ya biar consumen tdk kecewa  n pengriman nya juga lebih ditingkat kan masa hmpir 2 mingggu kurang lebih baru nyampe hari ini ... ,3
bagus banget bahnya jg cocok.sayangnya sarung bantal guling nya 1.tp gpp saya suka banget makasih lazada,5
"bagus kak, orderan kwdua, smoga awet, makin sukses kakk",5
barangnya dah nyampe real pic makasih lazada kulirnya jga udah langganan  😊😊,5
syukaaaa bngett.  thank you lazada 😊,5
suka banget realpict sesuai gambar dan sangat puas belanja di lazada🥰 makasih yah!!,5
"cantik , lembut sangat puas
",5
baranya bagus anak saya suka,5
barang nya bagus bgt...halus....terima kasih lazada....si kecil suka bgt....,5
Alhamdulilah paket nya udh smpe realpict n suka bgt...😁,5
"sangat memuaskn
",5
bagus barang nya sampe skaligus tiga biji. mksh lazada,5
barangx bgus ...kainx tebal🥰🥰,5
sangat puas😍 the best pokok nya thankz!!!!!!!!!!,5
paketnya udah sampe.. tp kecewa barangnya ada yg sobek,3
pesanan yang ke-4x nya alhamdulillah gak pernah kecewa selalu sesuai terimakasih seller dan lazada,5
bagus real pic sesuai pesanan packing nya juga rapi saya suka good job pertahakn yah 👍,5
Lama baru kasih ulasan,5
MANTAP BOS KUH....,5
"bahan bagus ,kain tebal,lembut gk panas",5
bgus,5
"maaf baru kasih ulasan,,,seprai nya sesuai gambar suka bgt,,,mudah mudahan awet ga luntur,,makasih lazada",5
gmna ini tali bntal guling nya cuma sebelh.trus sebelh nya mau pke tali apa?brang ok sesuai sama harga,5
"Barang packingnyabrapi, kurirnya baik 
Cuma ga mau ngnter sampek rumah.. Jauh kali ak ngambil/cod nya.. Pdhl ongkir mahalll ",5
mksih...om kulir ea baik banget mgib magrib anteriin pjet..dh langganan bgt..mksih lazada..cft banget lgi.dtg ea,5
"bagus ka, tidak mengecewakan",5
"Mantul pokok nya, gak mengecewakan 👍",5
maaf bru kasih ulasan seprai ya bgus dah halus gk da cacat makasih lazada dah kasih yg terbaik,5
langsung di pake pas banget di kasur y..anak ku jg suka banget..,5
Barang udah di terima.,5
real pict seprei nya aku suka ,5
"real pict.. puas banget.. bahan bagus. dinginn.
",5
spreinya bagus ga pns jga.,5
sprei nyah bagus❤,5
Syukaa bangettt Seprainya langsung gw pke maksihh yaa,5
bagus bahan sepreinya thx seller smoga makin jaya n makin bnyk langganannya,5
"paket nya mantap,kurir ramah banget",5
Sdh 2 kali order g pernah kecewa pengirimanpun cepat trimakasih Davina 88...😊😊,5
Barakallah paket mendarat dengan selamat Syukron lazada 🤗🤗💞,5
"Trimaksih , barangny sesuai dgn yg di gambar",5
bagus seprei nya tebal bahannya. tidak mengecewakan. terima kasih ya kak. ,5
paket sudah di terima.. makasih ka  ,5
mantullll bgt dah ,5
bagus bgt..aku suka....😊😊😊😊,5
lumayan. sesuai harga.,3
barangnya dah Dateng sesuai yg di inginkan makasih Lazada saya mau pesen satu lagi,5
Suka sekali bahan nya lembut bagus luar biasa. Sampainya juga cepet..  ,5
real pict trimakasih.,5
bagus bnget real pic ,5
pengiriman cepat sprai sesuai pesanan mantap dan ini sprei tertipis yg kupunya 😜,5
bangus realpic,5
"tolong kalau mau d kirim d cek dl, barang rijek gitu d kirim",1
😍😘😘,5
"mksih lazada maaf bru bru ulasan, lupa krena sibuk",5
"bagussss 
bahannya adem syukaaa dehh
silakan di order guysssss ",5
bagus,5
bagus,4
sesuai,5
top markotop 👍,5
