review,rating
barangnya ok br dtg lgsg diucek2 tinggal di pake.....trima ksh lazada,5
"Spreinya oke..,bahannya adem,,harga murah tapi gak murahan..sipp deh pokoknya",5
"Bgt,,, makasih lazada ngga pernah kecewa belanja di lazada aku suka bgt Ama barangnya 😊😊😘😘",5
alhmdulillah sesuai.... bagusss.. next  order lgiii,5
bagus sesuai gambar.aku suka.kurirnya juga ramah.,5
pengiriman ny cpt kurir ramah dan bahan ny adem..thx lazada,5
"mantul...otw order lg tiap bulan pasti
",5
"barang sesuai pesanan,,thank lazada 😊",5
respon cepat pengiriman cepat barang bagus,5
biar bintang yg berbicara ,5
paket nya sudah sampai.. ank saya suka banget.. makasih lazada.. ,5
"sangat puas, pengirimannya juga cepat tq lazada
blm pernah nyesal blnja dlazada👍👍",5
"Sesuai pesanan, packing rapi kurirnya juga ramah",5
sangat puas,5
"Sesuai pesanan ,bahan lumayan agak tebal...",5
"trimakasih lazada puas banget pkok nya, gambar sesuai kain nya dingin bgt, ntar order lg deh",5
"Sgt baguss ank sya suka bgt, mksi lzd",5
Bagus bhan juga adem thanks lazada,5
"Terima kasih barang sudah sampai, hanya saja d sarung bantal ada yg cacat, tapi gpp bisa d jahit.. ",4
Alhmdulilah paket sudah sampe.. Smoga aja ccok trimakasih lazada n seluler ,5
"Alhamdulillah bgs,wlupun td ad insiden ketggalan tp kurirny baik dan mw blik lg utk ngmbil paketny.",5
udah aku trima mksh🤗🤗,5
lumayan bagus kok dg harga segitu😍😍 love doraemon deh pokoknyaaa.....,5
Bagus Sesuai Gambar,5
bgus mntul bngt,5
makasih lazada barang ny lumayan bagus...ank saya suka😋😋,5
Mengecewakan..pesan ukuran 180 di kirim 160..jadi ga bisa dipakai..karena ga muat,1
Bagus... Siip bngt. ,5
alhamdulillah barang sudah sampai saya suka dan cocok buat d juwal lagi.... trimakasi ,5
Sesuai harapan walaupun dtgnya kmlman,3
Makasih aku suka skali 😚😍😍😍😍,5
Tq paketanya dah sampe sesuai harga.,4
MANTUL 👍👍,5
produknya home made ya ..oke bagus sesuai pesanan bahan adem...terimakasih,5
"Realpictt banget, sukaaaaaa😍",5
Kualitas produk sngat bgus. Trmhksh😊🙏,5
"puas sis sesuai gambar
",5
paketnya sudah sampe barangnya sesuai bahannya adem ga nyesel deh blanja di lazada top banget,5
"keren bgt.... bhaannya juga cucokk... suka... 
pengiriman cepat 24jam nyampe😍😍",5
paket baru dateng 😊 alhamdulilah sesuai gambar realpict dan tidak mengecawakan 😂😀😀suka bgt😀😀 ,5
bagus...mksh lazada....,5
"bahannya bagus kok :)
aku suka :)",5
sprei nya bagus lembut apalagi murah banget pokok nya the best lah😁😁😁,5
bagus sesuai ekspektasi ,5
bagus banget real pict lagi😉,5
terimakasih lazada saya suka banget sm barangnya real pict pokoknya👍🏻👍🏻👍🏻,5
saya suka...  bahan lumayan real pict sprei no. 1 di paket buat matras no. 2 lebih rapi ,5
puasa bagat seprei bagus terimakasih ya lazada,5
"barang oke manteepp... 🙏🙏🙏🙏💖
kurir nya gacor bngt lucu. 😅😅",5
bgus sesuai maksih davina n lazada..,5
lumayan bagus seprainya makasih lazada.,5
Barang nyahh baguss interrnasionall manteppp,5
bahanx adem bangettt ,5
"Mantap, pengiriman cepat",5
real pict jadi ke tagihan belanja di lazada,5
barang bagus realpict... ,4
Sprei nya Mantul...,5
Barang sesuai dengan pesanan.. ,5
Sumpah bahannya bagus bangeet.... ,5
bagus pecingx ,5
"gan. saya kasih bintang 2 dulu, sarung gulingnya kurang satu, tolong di kirim ulang gan",2
makasih lazada sepreynya bagus pisan pokonamah puas pisan belanja di lazada,5
Mantap.. memuaskan.. warna tidak luntur..,5
"Cantik,,tapi sarung guling nya kurang 1🤣🤣🤣",5
makasih lazada barang dah dateng sesuai pesanan,5
"Cepat bngt brang smpe nya,bagus n tebal  kmren psan eh bsok nya smpe",5
karakter sesuai pesanan bahan lumayan 👍 terimakasih,5
"Sempurna bagus bnget maksih lazada dan kulir ya baik.
",5
"Alhamdulillah  barang udh sampe. 
Sesuai pesanan",5
"Brang nya bgus kk tidak mengecewakan ,,,Bru pesen kmrin udh smpe makasih lazada 😘😘",5
bagus sprey nya tapi sayang sarung guling nya cuma 1 sarung bantal nya 2,5
top banget pokoknya puas buat semuanya,5
"Terima Kasih brgnya sesuai dgn Di gambar... 
Baguslah brgnya, cuma pengen yg bahannya lembut.... ",3
"alhamdulilah pesenan sy udah sampe, barang nya bagus.. terimakasih lazzada.. ",5
Spreinya bagus bahanya jga lmbut pngirimanya jga cpt trimakasih lazada jga ninja  ,5
"mksih pket dah sampai,seprenya bgus sesuai",5
Bagus😍😍Makasi lazada,5
"thnx lazada, thnx juga seller brang nya bagus, dan pengirimannya juga cepet😍😍",5
trmksh brg sesuai gambar. trmksh lazada,5
alhamdulillah bagus. sesuai dgn gambar,5
bagus kak❤️❤️,5
woy....keren bagus banget sesuai gambar dan lembut bahannya,5
mksih brang ya udh smpaj lazada.....,5
"bahannya Bagus,, keren
",5
"brgnya ud nympe.. 
bahan bagus 👍
tks ya ",5
mantul mantap betul lazada gk pernah kecewa kalau saya pesan,5
mantull sangat,5
"barang y ok buamgett,,Bhan pun enjoy adem wt d pke tdur,,Sy slalu puas blnja d lzda Mksh kk
",5
Aku suka banget sepre nya sesuay yg d gmbar mksh LAZADA kurir nya jga ramah,5
"barang sesuai pesanan bagus bahan nya , tanks min 🙏🏻",5
mantap dan cepat oce lasada,5
"bagus ,,cost saya suka",5
sudah sampai,5
bagus banget sy nggk kecewa terimah kasih Lazada ,5
Bagus,5
😘😘😊,5
"barang sesuai foto, pengiriman cepat, kurir ramah",5
bagus sesuai gambar,5
"oke.. 
barang realpict.. 
thanks lazada",5
sprei nya bagus semoga pelangganku suka,5
trimakasih bahanya bagus bangat,5
bagus bahanya ,5
"puas bgt bhan ny bagus , lain kali saya akn order lgi",5
bahan nya bagus,5
makasih Lazada Barang Nya memuas kan dan sesuay keinginan😍😍😍,5
suka banget seprenya bahannya tebel halus juga,5
👍,5
good,5
"barang bgus bgt
",5
mantap gan barang dah sampai pas sama yg di harapkan,5
barang datang sesuai pesanan,5
bahan nya bagus cocok lah untuk harga segitu,5
Realpict. cman pengirimannya lama sekali,5
bagus barang ny saya suka bnget relpict pekingan ny rapi..👍👍👍👍,5
Baguss banget bahannya lembut... ,5
"lama banget datang nya, sangat kecewa
",1
bagus sesuai gambar,5
Bagus bnget sepre ny realpic dah pkok nya,5
👍🏻👍🏻👍🏻👍🏻👍🏻👍🏻👍🏻👍🏻👍🏻👍🏻,5
bagus realfic bahan nya juga tebel lumayan lah ,5
barang nya bagus ok lah Good..👍🏻👍🏻,5
real picture:),5
"Spreine bagus realpick, trimakasih lazada",5
Poko nya okeh lah..,5
sepreinya bagus suka bangett bhanya jga adem mkasih lazada,5
Sudah sampai thanks,5
bagus sesuai pesanan aku suka bgt...,5
trimaksih lazada  spreinya bagus,5
real pict . 😍 makasi lazada 😘,5
"Barangnya sudah smpe alhamdulillah bagus...
Makassih lazada",5
"Bagus, sesuai harga",5
alhmdllh baragy bagus puas bgt deh  ,5
"Bahan lumayan  warna sesuai terima kasih lazada 
Kurirnya ramah..",5
Lumayanlah👍,5
"baguusss bagus aku suka,,sesuai dengan pesanan makasih lazadah dan abang kurirny ",5
seprenya alhamdulillah lumayan,5
"bagus halus

",5
alhamdulillah paket y udh nyampe mksiih lazda.. suuuukaaaa bangetttt... lain X order lgi,2
maaf baru kasih ulasan seprainya sesuai psenan makasih mas kurir makasih lazada n seller,5
Cantik spreiinya..,5
sangat bagus maaf ya baru ngasih ulasan ternyata pas dikasur saya,4
sangat bagus keliatan indah seprie sesukai tapi mana sarung guling satu lagi . . .,5
sprei nya bagus sangat memuaskan belanja dilazada,5
"Mantap sprei nya...tebal,bagus...trima kasih seller,ttp amanah.",5
"lumayan bagus, tp aku suka warna hijau !!!",4
sippp mantap,5
"Spreinya bagus,halus dan tebal... great",5
gak perlu foto. biar bintang yg berbicara.. ,5
sprei nya bagus..maksih lazada..kurirnya kenal baik sopan,5
terima kasih barang nya sudh sampai sesuai pesanan,5
Seprai nya ok bguss bahanya juga. Gx bkln luntul pokonya puas bgt pengiriman lumayan cepet lh ,5
"barang bagus untuk harga segitu, abang kurir nya kasian bela belain hujan hujanan.",5
bagus sesuai pesanan.bahan lembut mudahan gk mudar warnanya,5
kainya halus warnanya bagus ukuran pas ,5
Cocok sesuai gambar,5
"seprai nya bagus anak ku suka mksih lazada 
",5
lumayan bahan nya aden,5
bahan alus.realfix bgt gada yg cacat sama sekali pengiriman nya cepet... pokoknya is the beast,5
alhamdulilah sesuai pesanan,5
Sesuai harga....,5
keren.bagus bahannya.anak saya suka trims ya......,5
kainnya lmyn bagus,5
Barang y mantap bagus sekali maksih.👍👍👍👍👍,5
bgus saya suka,5
mantaaaaap amanah trus kak ,5
"cantik 
bagus juga lumayan dengan harga segitu",5
mantul tul tul,5
bagus. memuaskan banget,5
"barang nyaa udah nyampee sis, memuaskan banget baguuuuss...👍👍👍",5
biar bintang yg berbicara,5
bgus bgt suka❤️❤️💕,5
bagus dan adem kainya,5
"Alhmdulilh brang ny bgus tp ko srung bntl ny gha ada gmbr doraemon ny, tp gha ap2 lh mksh lzda,, ",4
"trimakasii seler ny ramah.. pesaan 3.. 3*nya sesuai pesanan.. 😍
bakal langganan ini mah.😁",5
bagussss bangett,5
"makasih kk seprai ny saya suka bnget, puas dah belanja d lazada . thank ya kk senang bnget pkokny",5
"kirain biru laut ternyata biru langit, tapi gpp aku suka😍 trimkasih😘",5
Makasih paketnya sudah sampai pngrimannya cpet bgtt 😊😊😊,5
brg x lmyan bgus sesuai lah sama hrga sgtu mh,5
biar bintang yg bicara.mksh,5
Bagus pokonya syukaaa,5
"seprai nya bagus ,anak sy suka ..mksh ",5
bagus banget suer ga nyesel beli😍😍😍🥰,5
"sesuai dengan harga

",4
bagus barang nya makasih,5
Bagus sesuai pict😍😍👍👍,5
seprainya bagus lembut n memuaskan..terimakasih lazada dan sellernya..smga sukses terus.,5
❤❤❤❤❤❤❤❤❤❤❤,5
ihhhh suka banget. Bagus sekali lembut bahan nya. nixe aku order lagi ya ,5
"bahanya bagus bgt..TKS saya puas bgt
",5
bngus bnget,5
mantep dah poko ya terima kasih lazada.,5
bagus dengan harga segitu ,5
"bagus sesuai gambar, cma emang ukuran kecil ya untuk bantal, gulingnya, jdi gak kepake deh",5
sangat Bagus 💙,5
"bagus,,pas ukurany",5
"memuaaaaaaas kan pokok ny,  dh k 2 x pesan,  gak pernah kecewa,  nex pesan lagi",5
aku suka sprei nya lembut,5
Bagus bngt datengnya juga cepet bangett langganan deh pokoknyaaa,5
yes seprei  n bangus.. sesuai tar mu order LG.. ,5
Bagus bgtt dehh 😍😍,5
barang bagus keren bahan halus.. pokoknya suka.,5
barang bagus tebal .. kurir ramah pengiriman cepat,5
makasih kiriman nya pesanan ku sudah datang... 😍😍,5
"oke banget dech sepreinya,,,g nyesel dech.terima kasih",5
bahan ok aku suka thnkz lazada,5
"barang bagus sesuai gambar, anak ku suka ga nyesel belanja di sini, terima kasih lazada.
",5
barang yh bagus pengiriman cepet kulir yh udh langanan👍👍👍,5
mantap sesuai pesen'n costemerkh puassss,5
"terimaksih. barang bagus. kurir juga ramah.
",4
"bhn adem,bgs bgt..anakku suka,trmksh..

",5
ok lah... berniat ingin beli lg sih... ,3
"mantapp, anak saya jadi betah dikamar ,thanks lazada thanks seller love that",5
Bagus seprainya anakku suka... ,5
barang dah sampe cepet sekali pengiriman nya mantap lahh,5
baguuus👍🏻,4
saya suka sprei nya makasih lazada,5
"pengiriman cepat, bahan lumayan tebal, gambar ok mudah² tidak luntur saat dicuci",5
bagus bang3t,5
terimakasih sdh dataang.. Alhmdllhhh....bagus spreiny ....,5
kesikian kalinya barang sesuai ..  bagun  kurirnya ramah.. ,5
bagus bgt.. Gabakall nyesel,5
Barang Mantap sesuai pesanan,5
murah meriah.tp kualitas bgus ,5
"Alhamdulillah  sprei dah datang...bagus ..puas
sukses selalu .trims semuanya.",5
"yg ini bahannya bagus adem..
klo gitu bisa buat langganan next order lg",5
Real pict😉,5
seprai nya bagus udah saya pake. mksh lazada. ,5
"bagus, bahan nya juga lembut,
 makasih lazada
",5
Sprei yh bagus baget,5
"maaf baru kash komentar dam rating, barang'a bagus, lumayan buat harga segitu.. mantap 👍",5
"Mksh lazada seprai ya Bhn a lembut dan adem,bagus pokoknya",5
"Walau pengiriman nya lama tp Realpict banget sprei nya bahan nya halus,  lembut. ",5
Sudh berapa kli order d toko ini.. Barang nya slalu memuaskann👌👌👍👍👍👍,5
bahannya adem next time aq mau order lagi,5
"bahan tebel, halus, dan bagus pokoknya puas belanja disini, pengiriman juga cepat ",5
"sprei karakter doraemonnya bagus banget aku suka,,sesuai gambar..thank seller",5
Barang bagus..pengiriman lumayan cepat..ok ,5
kira sarung guling nya 2 trnyta 1,5
"THANKS YOU BINTANG 10 KALO ADA
KURIRNYA MANTAPPPPP",5
Barang mendarat dengan mulus,5
Bahan oke .rapi,5
"Barang nya bagus dengan harga segini mahh, kurir ny ramahh,  makasih lazada ",5
sangat bgua n puas,5
bagus barang ea ,5
barang nya udh smpe v gk ada buat bantal guling nya jualan yng amanah dong,3
"Sngat puas bgus
",5
mantap barang dateng sesuai sama pesanan.. terima kasih..,5
Top responsive,5
bagus sekali ukuran pas no 1 jos lh,5
"bagus bangettt, realpict dan kainnya adem",5
"Paket sudah diterima, pengiriman cepat, barang bagus puas",5
puas bangeettt dengan barang nya,5
luntur seprei nya,5
Gk nyesel👍👍👍👍,5
Lumayan bhannya😊,5
bagus dan tebal kainnya,5
"barang oke, terima kasih.. semoga tokonya sukses selalu! 🙏",5
bagus spreinya tp sarung guling cuma 1 dan makasih kurirnya ramah,4
seprainya bagus like it deh 😍 buat kurirnya ramah and top deh 👍😍,5
okeeeeedeh siiìp banget 👍👍👍👍👍,5
bagus..bhn sesuai harga...motif sesuai gambar,4
bagus bgt pertahankan ya kak 😍,5
bagus spreinya ...,5
"sprei real pic,bahan halus dan adem,sukaaaa,rekomended,pengiriman cepat,rims lazada...",5
"realfict banget sangatt memuaskan
mksih lazada",4
sprai nya bgus bngt puas deh,5
relpic bgt gambar.n,5
makasih yuhuuuu paketnya mendarat lebih cpat,5
Keren murah lagi di pasar aja harganya kalah murah👍,5
Sesuai pesanan. Barang bagus. Thanks seller,5
"Good bhn adem


",5
"sesuai gambar,",5
barangnya bagus pelanggan nya suka,5
suka sekali real pict bangett . bahan nya enak pokonya terbagus ... sukaaaaaaaa,5
Kk ada yg motif keropi,5
"Bagus suka pi ga tau kalo dah d cuci luntur apa tida
Mudah2 barangnya awet",5
"murah tapi ngak murahan,, lembut banget,adem nyaman du pakai",5
bagus banget bhan nya adem banget pokok nya gak nyesal lah,5
puas barangnya bagus pokoke top deh,5
bagus sesuai pesenan,5
"Ini sihh Kerennnn👍👍👍
Makasih🙏🤗",5
"Bagus kk, sesuai dengan deskripsi yg dicantumkan. Trima kasih kka ",5
is okk bagus bagetttttttt,5
terimakasih...barang nya top bnget,5
"Sepreix bgus, pengiriman tpat wktu.
kurirx jga ramah",5
kualitas bagus puas banget dgn barang  respon juga cepat,5
"bagus bahan tebel dan tdk luntur...
",5
Sangat memuasa kan ,5
ademmm bagus..,5
sprei ny bagus bahan topmarkotop pecking rapi ga nyesel beli ditoko davina88 sukses sllu,5
puas. terimakasih lazada,5
mf bru d ulas. makasih barang ny bagus cocok sma pesenn.. makasih lazada dn bp kurir ny,5
kerennnn bangettt,5
"spreinya lembut banget dan gk luntur lagi
anakku jadi makin nyeyak tidurnya",5
"Gk tau nympe ny kmn gk trm brng ny tau"" lporn ny udh d trima,  jdi hrs psn lgi deh",1
"kasih bintang 5.
seprei nya bagus ,bahan nya lembut


",5
"bahn nya halus, mantap sesuai gambar 👌",5
makasih kk sprey nya bgus bget 😍😍,5
lumayan tp ko guling nya satu kn biasa nya 2,4
biarkan bintang yg berbicara,5
Is the best pokonya mantull,5
bagus real pic barng nya,5
Pas mau beli sih aga ragu... Tpi pas pesen datang nya bagusss... Bahanya halus... Cocokkk bangett,5
Allhamdulilah gk kcewa... Mantap..,5
order.ke 3 x sllu puas,5
"mantul deh mau psen lg mudah""an puas juga",5
Seprei bgus aku suka cma sedikit kecewa jaitanny kurng rapih dan g d obras ,4
"maaf baru kasih ulasan nya,bahanya bagus thank ya lazada,kulir nya juga baik ",5
"makasih lazada ,barang lumayan halus cepet nyampenya",5
barengnya oke. real fict.. ,5
"suka banget sprei nya , pas di kasur juga ,, makasih yah 
",5
"Mksh ya spreitnxa bgus bngetttt
     Sya suka""😊
Mksh ya buat kurirnxa rmah",5
recomended buanget asli cntik nya bahan ny gx klh sm yg bermerek...,5
trimakasih lazada..sprey dora emonnya dah sampai..sesuai dg pesananan..aku suka😍,5
Bagus bahannya adem😍,5
"bagus sepreinya, g nyesel, kurir dah langganan, ramah ..",5
matul banget,5
Bagus barangnya gkk kecewa deh dipakenya adem gkk panas,5
bagus aku suka sesuai gambar.,5
top markotop poko nyh,5
maaf br ksh ulasan spreinya bagus sesuai harga mksh,5
"Bahannya bagus , barang nya dtng lebih CPT top markotop bagus tenan",5
Barang nya bagus tapi syankk sarung guling nya cuma satu.,5
bgs bgt mksh lazada n kurir ny baikkk..,5
Bgus sesuai gmbar,5
"bagus ,,lumayan buat ganti ganti",5
Sesuai permintaan dan barangnya bagus.,5
Bagus.. gak kecewa.. ,5
barang nya bagus👍,5
bagus realpict,5
"kain y bagus,,,ini buat tmn aq, dia suka😘😘😘",4
Untuk warna dan gambar ok bgt klo untuk Bahan kurang adem .....Tapi ok untuk harga cocok lach ,5
seprei nya bagus aku puas makasi lazada.😘😘😘,5
Bagus 😍😍,5
mksih bgus,5
bahan dingin.sesuai gambar.tidak mengecewakan..terima kasih..,5
mantullll... walau pun bahan nya tipis tapi lembut lebarrrr... pas buat kasur ku.. ,5
"Sprey ny bgus,seauai pesanan pkok ny,trimksh",5
alhamdulillah sesuai pesanan,5
Murah..tp lumayan...bsk2 beli yg agak mahalan mngkn lbh bagus lagi,5
"best seller,, 2x order puas,, realpict,,next order Lg seprai karakter lain🤗🤗",5
Bagus sesuai gambar..buat abang kurir ny mkasih udh langganan😁👌,5
Bgus realpict,5
Bagus suka ,5
bagus bngt. ganysel dehh😍😍😍😍,5
"Alhamdulillah spreinya sdh sampai, spreinya bagus, tebel n warnanya jg cerah, makasih ya...",5
"sprei nya bagus, ada yang kotor c sedikit to Alhamdulillah bisa d cuci terima kasih... ",5
Sdh sampi brgnya Terima kasih,5
"Alahmdulilah.. Pertma order di tko ini.. Sngat"" memuaskan.. Trima kasih lazada.. ",5
maaf br ksh coment barang bagus sesuai real pict,5
barang bagus ga kecewa deh .........,5
Barang sdh di terima. Sangat memuaskn. Kiriman lebih cepat dr estimasi,5
"barang sudah diterima, tp belum liat barangnya mudah2han sesuai dengan ekspektasi...
",5
suka bnget sprei nya bahan nya tebel 😊 ,5
barang ok sesuai pesanan,5
"Ngak ngecewakan,bagus banget. terimakasi Lazada. ",5
jgn ragu blnja di toko ini asli realpick dan g nyesel pengen nambah lagi maksih ,5
"suka sama seprei ya
",5
bagus bgt realpick,5
"q senang akhirnya paketan q tiba bagus g nyesel de
",5
baguss teball,5
"Puas bangeett

Bahan adem dan ga luntur...

Di tunggu karakter LOL nya ya kak

Makasih",5
sprei nya bagus 😻 Konsumen saya suka bangettt 😻terimaksih yah kk pertahankan kualitasnya 🤗,5
"bgus sesuaii pesenan 
tdk luntur pdhl lgsg d cuci",5
Lumayan bagus,5
Paketnya udah nympee...barang nya baguuu,5
"SUka sma sprei nya,makasih ya .maaf bru kirim ulasan😁",5
"bguss bahannya adem,makasih kakaaaa",5
"Packing bagus ,barang bagus sesuai hargax ,TKS lazada.",5
"Barang nya sudah sampai ,,,terimakasih",5
bagus sprei nya ini bru pas ga kaaya kmren pesen sprey datengnya karpet,5
keren sehari sampe barang juga bagus makasie ya Lazada ,5
Sprei ny bagus sesuai lah dengan harga😘😘😘,5
Kecewa bahan nya tipis,1
Sesuai harga lah..👍,5
sangat memuaskan..recomended bgt pokok nya,5
Bagus lumayan lah buat ganti mah,5
Seprei nyh bagus aku suka.  😍,5
cantik x seprai ny ,5
barangnya bagus,5
Bahan nya lembut .cocok buat di pake sesuai dengan ke inginan nya ,5
"barang sesuai gambr..dan sesuai pesanan
",5
"bagus,  cuma pengirimannya lama",5
Barang dah sampai... Bahan halus dan adem... Kurirnya sopan dan ramah banget... Makasih lazada....,5
"Bagus , murah lagi,, mantap,,,,",5
real Pict Lah. pokoknya Mantul,5
bagus banget😍😍😍 ktagihan pngin beli lagii,5
Sprei nya bagus bgt,5
"Bahan nya bagus 
",5
seprenya jga bagus kurir nya jga baik,4
"sangat puas produk bagus, pengiriman cepat 👍👍👍",5
Sepreinya real pict asli cantik banget,5
"jangan ragu deh beli disini 
barang nya realpic 
dan bagus",5
Sesuai gambar thxyu,5
lembut bgt seprainya anak saya suka,5
mkasih lazada sfrey nya bgus  sua pngn bli lgh ,5
bagus lah seprainya tuk harga segitu sesuai kantong....,5
Mantap harga murah,5
sdh diterima. realpict sesuai harga,5
sesuai barang bagus sesuai harga...,5
suka banget produknya bagus😁😊😊,5
Bagus sesuai sm harganya...,5
suka bnget ,5
barangnya bagus lembut n tebal sesuai gambar n hrga..in baru jualan namanya😊trm ksh lazada,5
Seprai karakter nya bagus..lembut pokok nya is the best..,5
"Mantull cakep pokoknya
Next time mau order lagi",5
sprei bagus...persis yg ada di iklan ..top buat lazada...,5
Ini udah yang ke 2xnya pesen dan ga kecewa,5
Mantul murah tapi ga murahan 😘 ini yang ke 3x,5
"mantap top bgt ,gk luntur ,bahan lembut,rekomended 
buat yg mau cari seprai",5
Biarkan bintang yg bebicara,5
"lumayan, cuma kenapa ya biasanya standard 1 set sprei tuh 2 guling 2 bantal, kenapa cuma 1 hemmm...",5
Terimakasih..bahan lembut..ukuran pas,4
alhamdulillah Baru aja Pertama Kali order puas banget... Sprei nya super duper bagus ,5
lumayan dwngan harga segitu...  bagus tebal... ,5
"barangnyaa keyen cepet pengiriman
",5
Puas banget deh... Terima kasih lazada... Terima kasih ninja express,5
Bagus sh tp sarung guling'y cuma satu sh,3
bagus sesuai gambar mksh lazada,5
Bagus banget,5
tidak sesuai gambar,5
Bagus banget barang nya sesuai lah dgn harga nya juga ,5
Puas x dgan hrga sgtu dpt brag berkualitas. Thnkz lazada n Davina 88.,4
"sarung gulingnya pendek bngt 
sarung bantalnya jg kecil nian bantal anka saya.gak.masuk",2
"cukup bagus bahannya, mudah2an tdk luntur dicucinya......",4
"terima kasih pesanan saya sudah sampe dgn cpt,ank saya suka dgn sprei doraemon nya",5
Spreinya bagus real pict .. ,5
"Alkhmdulillah barang sudah sampai.,.bagus cuma sarung gulingnya kurang satu..lain kali lebih teliti",4
bagus saya suka tidak mengecewakan,5
Seprai nya bagus halus makasih 😊😍 suka sekali,5
Sangat puas..pengiriman cepat.seler ramah,5
pengiriman cepat..sprei nya baguss..anakku sukaa...,5
pkett udh nympe ... ssuaii pictt bhannyah adem ... makasiih seLLer & Lazada ...,5
"bahan nya bagus, sesuai foto, pengiriman cepat, kurir ramah. ",5
Sangat okeeeee,5
kereeeeen aku mau order lagi ,5
Sumvahh puas banget mau order lagi..ini mah harga kaki lima tapi kualitas bintang 5,5
Makasih paket udah diterima ,5
Barakallah mksih barang sdh datang and sesuai gambar,5
Bahan adem.. Ngga luntur.. Murah lagi.. Tp sayang sarung bantal kecil.. Recommended seller,5
Sprai nya mantap bagus bahan nya 😊,5
"Bagus bangeeeeeetttt. 😎😎
",5
"Sprei nya bagus, anak saya suka...  Terima kasih.. ",5
"spreinya bagus, bahan adem. mantap deh......
pengiriman cepat kemarinnya pesan besoknya udh datang.",5
"Alhamdulillah yg ini sesuai, bahan nya bagus",5
"sprai nya bagus banget, sesuai pesanan
",5
"Spreynya bagus, dg hrga sgtu cukup puas dg brgnya.. Dicuci jg gk luntur!!",5
sesuai gambar 😚,5
Mantaaap banget,5
realpict.. ,5
"Saya sukak, sesuai gambar😊😊",5
"Bagus , real pict",5
"brng bgus..sesuai gambar .puas dech
",5
luamayan lah,3
"Trimakasih paket nya udah nyampe, dan barang cocok sesuay gambar.. Ga ada yg kecewa",5
"Seprai nya baguss bangettt anak saya sngat syuukaaa...

Kurirnya ramah karna udah langganan",5
Bahan adem..dah sya pke...sya cuci gk luntur juga bagus pokoknya sesuai ma digambar thnk y,5
sangat memuaskan terima kasih 🙏🙏,5
bagus. dan sesuai pesanan,5
barang nya sangat memuaskan,4
bahan bagus lembut sesuai dienkripsi ,5
"real pick ..
trmksih lazada",4
Suka bangeeeetttt...,5
"good sesuai gambar, bahanya lumayanlahh sesuai harga ",5
Sprei ny baguss. Sesuaii pesann. Mksiiii lzda,5
ksih bintang ajjjj,5
Aku suka sama spreinya dan bahannya juga adem,5
"Alhmdulillah...paketan dah xmpek,sesuai harga kain lmayan lembut,mksh lazada",5
barang sesuai harga,4
REcomended bgt,5
"Anakku suka....makasih lazada
",5
"Bagus,bhnnya halus ,mdh2n aja g luntur ,pokonya puas skl.",5
sangat memuaskan sekali,5
"Barangnya bagus,,,anak saya suka",5
Barangnya ok saya suka banget .Nggak ngecewain belanja dilazada.thanks,5
Real picture,5
maaf br kasih ulasan seprey bagus bahannya adem halus trimakasih sukses trus,5
sesuai dengan pesanan🤩terimakasih lazada walaupun agak telat pengirimannya🤩,5
mantuuuulll,5
Untuk harga semurah itu okelah spreiny jg realpict aku suka bgt . ,5
"seprai nya bagus bangeeeeeeeeeeeeeeeeeeeeeeeett aku suka warna nya,cantik😊😊😊",5
barang sesuai pesanan.pengiriman sangat baik respon penjual sangat baik,5
baguuuuuuuuuussssssssss👍👍👍👍👍👍👍,5
Bagus sih sesuay gambar semoga aja ga luntur,5
"Puaslah belanja d sini. Wkwk gak nyesel sumpah, mknya aku mesen lagi, 😘😘",5
"sprei kekecilan



",5
"makasih lazada...barang'a sudah sampe,bagus dan ngga lama lagi 😊",5
terimakasih,5
Bagus sesuai pesanan,5
"Sesuai pict,bahan bagus g murahan",5
"Bahan nya bagus adem gambar nya juga lucuuu , pokok nya syukaaaa ... Terima kasih",5
real pict...,5
Bagus relpic...,5
bagus bget cman karetnya terlalu pendek bahan oke jahitan oke pky is the best,5
bagus sesuai pesenan.,5
"khu suka banget seprainya,, 😍",5
Memuaskan sangatt.trmksh lazada.kurir ya ramah.barang sesuai gambar,5
bgus ank sy senang,5
"Lumayanlah,tapi sarung guling nya ada yang gak ke jahit",3
"sangat bagus
",5
"puas bahannya bagus anak sy jg suka,untuk kurirnya mksih dh antar wlwpun baru pertama antarnya..",5
"asli inima murah tapi bagus banget, recomended pokonya gaakan nyesel",5
mksh suka bngt nexz time order lagi😘😘😘,5
Agak tipis ..tp terima kasih kakak ,3
bagus banget thankz lazada ,5
"Sprei nya bagus bgt adem kyk sprei bermerk lain nya🤣🤣 
Makasih lazada",5
Ok...tpi sarung bantal gulengny ko 1 y.,4
bagus dàn sañgat cantik kualitass oke,5
Sesuai dengan pesanan,5
Biar bintang yg bicara,5
mantap x ..,5
bagus. bahannya tebel. gk luntur,5
Suka sekali... 👍👍👍,5
Mantul pak Eko....suka bgt dan bahanya lumayan .😍😍😍😘,5
Aku mau pesan lgi ka.. barang nya bagus memuaskan sprey nya ,5
👍👍👍,5
Mkasih lazada barang sudah ready bagus banget aku suka cuma kegedean aja 😊😊,5
bagus bget seprei nya sesui dengan di gambar bahan nya juga lembut trima kasih lazada dan pa kurir,5
Terima kasihh.pemesan untuk kedua kli y sangat bagusss and sesuai...,5
makasi untuk penjualnya,5
Bagus banget sama ama digambar,5
"Bsgus banget😍 saya suka, sesuai pesenan
Makasih lazada makasih davina 88,semoga sukses",5
terimah kasih,5
