review,rating
"padahal kasurnya Queen Size. uda beli yg tinggi 30cm tapi belum menutup dengan sempurna sampe bawah. untuk bahan ini bagus banget kok nggak tipis, dan adem, pilihan warna nya juga banyak ",5
"Bahan dingin, no geser2 sprei nya, harga murah, baru 1 kali dicuci semoga dicuci berikutnya kainnya ga brudul ya.. cuma sayang bahannya tipis, seandainya bahannya lebih tebel pasti tambah bagus..
Proses packing dan pengirimannya cepet..
Terima kasih",4
"Bagus bahannya adem kyk harga 400an, ga brudul jg abis dicuci, cuma sayang banget aku dapet yg ada sobek kecil di pojok. Lain kali QC'nya lebih teliti yaa. Krn libur jg jd lama, dr lebaran order dan baru sampe kmrn siang. thanks",3
keren bagussz,5
ud repeat order bolal balik.sukakğŸ˜,5
"sangat bagusssss,mudah2an nyenyak tidurnya",5
"Bagus ga nyangka sebagus ini. Mana adem bgt lg. Minus nya cm 1, TALI GULING NYA tolong masukin donggggg susah tau masukin tali nya -,-",5
Overall ok tp sarung gulingnya kecil bgt,5
"Mesen yg tingginya 30cm, tp pas diukur cuma 20cm ..",3
Bagus untuk harga semurah ini. Alus kainnya,5
bagus,5
adem bahan spreinya recommend deh,5
"bahannya halus dan adem, warna sesuai gambar
nggak nyesel beli. next time order lagi",5
sprey nya oke,5
Jenis Kaiin Jatuhnya di Kasar/Lemvut d Foto,2
Bagus cuma saya salah pilih ukuran wkwk ,5
