review,rating
"bagus bangett gx nyesel deh belanja di lajada alhmdulilah setiap pesan gx pernah kecewa , kurir ya baik udah langganan 

makasih lajada ",5
"KECEWA pokonya, ukuran di deskripsi 45cm x 95cm.
nyatanya cuman 35cm x 77cm, beda jauuhh
barang dalam kondisi kurang bersih, banyak bulu2",2
"bantal nya bagus... halus banget... trus ukuran nya beneran besar, ukuran Xl. sm pjg spt guling. seller nya respon cepat dan sm2 ramah nya dg kurir. puas, tq... soalnya buat hadiah pasti yg nrima hepi",5
bgus lah saya suka mksh yok,5
"apaan di bilang bantal gede di chat, datang2 bantal untuk anak ini mah, padahal udah saya tanyain di chat.",2
bagus bantal y saya suka trmksh lazada ,5
lumayan bagus utk harga segitu. terimakasih lazada,5
jelek bngt kecil bngt kecewaaaaaaa,5
lumayan lah harga segitu,5
Lumayan tapi bantal nya kurang tebal kurir nya ramah makasih lazada ,4
"kurirnya aneh, tiba"" pengiriman gagal ",5
mntap..bntal bgus..terima ksh.,5
Trima kasih seller dan juga lazada.. Barangnya lumayan bagus sesuai dengan harganya,5
"pesanan sesuai, bahan pun oke.. terima kasih
",5
"barang ya bagus tdk mengecewakan,saya suka,terima kasih lazada",5
"bagus
",5
ğŸ‘,5
baek..,5
