review,rating
"g' bisa pake',batre soak,wifi g' bisa konec ke hp,udah download isdv cam g' konec download goplus cam pun g' konec juga,maaf kali ini saya kecewa,harganya sih murah,tp kalo' g' kepake' kan mubazir duit nya,jadi tarasa mahal..",1
"barang udah saya Terima tapi batrenya drop, kalo sambil di charger nyala giliran charger di lepas mati gak mau nyala, padahal udah di charger selama kurang lebih 1 ½ jam",3
Makasih ya bos paket saya sdh sampai dgn aman dan terpercaya,5
yah lumayan aja kameranya semiga awet,5
Kardusnya rusak batrenya yang uda ada di dalem itu dropp tapi kualitas gambar okelah....dan di bagian layar kemeranya itu ada yang baret2 gitu sesuai dengan harga...tapi gapapalah adik saya sukaaaa......♡♡♡,4
"barang rongsokan..pengiriman sudah lama pas dtg barang rusak pula. layar putih, batrei kalau dilepas dri charger mati...sangat jelek",5
lumayan lah harga segitu paket lengkap thankz lazada,4
"kasih satu bintang aja lah,
karena saya sedikit kecewa,
karena WiFi nya Sam kabel data ny,
ngga bisa di gunakan,
tolong di perbaiki,
biar banyak pelanggan,
Terimakasih",1
"camera tidak konek dan tombol wifi sama bawah sudah lecet , jdi kecewa belinya.",5
"paket Baik Dan barang lumayan memuaskan 
sesuai dgn diskrifsi ",3
kecewaa camera tidak bisa di gunakan...  ,1
" barang ok tapi untuk wifi di kamera tidak conect
",3
"brg lumayan,,, tp susah konekin wifi nya",5
ga sesuai di gambar,1
keren,5
