review,rating
batang dah nyampe tpi sayng barang jelek bnaget  tipis dan lingan bnget saya beli di toko sebelah harga lebih murah batang bagus dan dapet tali nya lgi.... ,1
"Barangnya sdh tiba walau cukup lama nyampainya, saya puas dgn barangnya, sesuai harapan, trmksh LAZADA & 87OLShop..sukses selalu ya...pokoknya barangnya mantap deh....saya sangat puas, kurirnya juga baik dan sopan",5
kecewa kok ga ada atas buat narok hp nya ,5
"kecawa banget, ga sesuai dengan Gambar, lain yg d pesan lain yang datang. baru kali ini gw belanja barang ga sesuai",5
"trimh kasih.barang sdah sampe.
cepet barang y jga oke",5
"Produk bagus, sesuai dengan gambar dan tidak ada cacat, namun produk agak ringkih..",4
"Barang sampai dalam 3 hari, kondisi barang aman dan berfungsi dengan baik. Mantul..",5
mendarat dengan selamat thx.,5
"makasi....barang dtg dg slmat,bgus,sesuai.mas kurir jg ramah.",5
"paketnya sudah sampai... 
pengemasan rapih kurir ramah.... terimakasih lazada",5
Mantap barang bagus cepat sampai ,5
bagus ko pertahankan,5
mantul,5
Produk oke,5
mantap ,5
