review,rating
semoga braketnya kuat walau kecil,5
"sampae dgn selamat,,,",5
pengirimannya super cepat pesen kmaren bsok sampe dan barang tidak cacat bagus makasih LG dan LAZADA,5
breaket nya tidak saya terima. 2kali order yang dapet cuman 1pc breketnya,5
"bagus, kecil tapi kokoh",5
good,5
pengiriman nya cepat dan kurirnya ramah,5
barang sudah tiba dengan selamat meski sampai pada malam hari,5
Bracketnya belum di terima gan..,5
Mantap bagus. Gratis pula,5
knp tv nya blm nyampe..???,3
ini malah lebih cepat,5
"Mantab LG.. thks for the gift.
",5
"Dapet free, oke bgt dah",5
Mantap ,5
Mantap ,5
Mantap ,5
Mantap ,5
