review,rating
"ok mantap,cm pengiriman aja agak lama,tp kl barang mulus dan aman..",5
"barang datang sebelum waktu yang telah ditentukan.....gambar oke tapi tidak paket paking kayu was-was takut jelek
.. sementara mah oleh lah",5
alhamdulillah barang udah nyampe dengan selamat dan bagus rapi pengirimannya pake packing kayu lg dan setelah di coba alhamdulillah gambarnya bagus  terang & jernih terimakasih lazada,5
Alhamdulillah barang pesanan datang dengan aman dan semoga awet terima kasih lazada... selalu menjaga kwalitas pesanan..,5
"bagus, hanya kurang antena luar.
pengiriman cepat, barang packing kayu aman tiba sampai manado dengan baik. trimakasih ya, sukses terus",5
"Alhamdulillah..barang mendarat dengan selamat
kurir ok bangat dan ramah..dan estimasi pengiriman lebih cepat dr yg di tentukan...游녨游녨 the best dah buat semua.. thanks lazada and seller",5
"Puas,senang pengiriman sangat cepat lebih cepat dari perkiraan,packing sangat baik, kondisi unit sangat aman,saya kasih bintang 5 utk pengiriman,utk unit tv 40inch di hrg 2jt Top banget kwalitas bagus +tv box hrg 200rbuan Uda jd smart tv.thx Lazada,thq Changhong.
",5
"paket salah kirim. solusinya bagaimana ya.
saya pesan Tipe L40H2 ada VGA nya, yg saya Terima Tpe L40H1.",5
"Barang mendarat selamat (paking pake kayu), pengiriman cepat sesuai estimasi dan barang OK mantap, semoga awet, trima kasih lazada, trima ksih seller trima kasih kurir. Puas pokonya..",5
"mumer mantap,tp memang ada keterbatasan fitur,tp wajarlah hrgbya juga sangat bersahabat.
jgn ragu,sikat
",5
"barang sudah sampai.. hasil bgs.. tidak ada cacat.. mudah2 an garansi nya bisa belaku.. 
",4
"Sudah sampai dengan baik tidak kurang satu apapun 
Packingnya juga safety pakai kayu 
Gambar,warna good banget 
Puas banget 
Tq changhong dan lazada",5
"thks kak, barang nya aman, bagus , cuma sayang di pengiriman nya lama sampe 1 minggu cuma ya its ok, karna gratis ongkir,",5
"paket sampai dengan selamat, packing rapi, aman dibungkus pake kayu juga, hasilnya memuaskan, Recomended Seller.",5
"Barang yg diterima sesuai pesanan dan ini tv led 40 inch termurah dgn kualitas bagus, pengiriman dipaking  pakai kayu jd aman. Tetapi untuk pengiriman agak lama setelah 5 hari barang baru dikirim.",5
" Tv nya bgus, packing nya ga pake kayu tapi alhamdulilah aman, semoga awet",5
barang ya sda smp jombang jatim. Thaks lazada,5
"Mantul paket dateng dengan cepat, barang oke..packing aman pake kayu, top markotop deh..",5
"pengemasannya bagus, kurir nya jg baik bgt


",5
"barang bagus, gambar jernih, pengiriman cepat dan aman",5
"Bagus & murah,kekurangannya cuma di kualitas suaranya aja kurang ngebass meski udah disetel,yg terbiasa pakai merk polytr** atau toshi** akan terasa bedanya.Kalau kualitas gambar lumayan oke.Pengirimannya mantap pakai packing kayu 游녨",5
"Alhamdulillah nyampe TV nya di  Sumbar, barangnya/TV ny ok 游녨游녨
Cuman kurirnya ngk ngantar ke rumah di suruh jemput ke kantornya",5
"sudah di tes mantap,langsung setting ke PS4 ",5
Langsung di test main PS4.. muantaaappp gambarnya..,5
ok bagus sesuai pesanan nyam rmh dgn selamat,5
"Barang ok ,cepat sampai sesuai janji.sudah tes bagus.",5
ya sesuai lah tv aman tanpa kendala terima kasih penjual,5
pesanan sampai dengan selamat. terima kasih. ,5
"terima kasih, sampai dengan selamat",5
"mantep bnget 
pngirimn aman pke paking palet 
barang mendarat dengan aman",5
"barang sampai dengan selamat, overall ok, mantab, semoga awet. nice seller",5
mantab poolll,5
TV nya bagus sampai dengan selamat kemasan nya bagus Peking kayu. ,5
siip bangeet. ,5
Mantullll bosss,5
barang dikemas bgs tepat waktu,5
thanks lazada..barang sdh nyampe...walaupun agak lama...ok siip deh...,5
Terimakasih barang sudah sampai packing rapi pake kayu barang bagus semoga awet..,5
akhirnya barang sampai ..packing bagus...produk bagus...semoga awet,5
pertahankan 游녨游녨游녨游녨游녨游녨,5
mantap 游때游때 semoga tahan lama 游때游때,5
unit sudah sy terima dgn kondisi sangat baik.... cuman ada syngnya breket zoonk..... ,5
"barang cepat sampai.
terimakasih",5
mantapssssssss say,5
"harga tidak sesuai dengan promo cicilan 0% 12x dengan pembayaran kartu kredit, tagihan kartu kredit tidak tetap full payment.",5
"pengiriman cepat barang Bagus, antenanya harus bli sendiri",5
mantul kali,5
"terimakasih lazada..tv nya mantap, pengiriman cepat sampe dan peking nya pake kayu aman. ",5
mantap,5
mantaaapp,5
mantul,5
mantul,5
