review,rating
bagus aih barangnya..cuma mohon lebih dicheck lagi sebelum dikirim karena ada cacat seperti pecah pada kacanya.,3
"alkhamdulillah yang ditunggu akhirnya datang juga..   8 hari terhitung lama pengirimanya... barang kondisi bagus cuma kurang teliti ja,dikaca lingkaran beda warna yaa..  thank's ",4
Lampu kaca ada y retak atau sumbing.terus btg yang hitam ada goresan lurus..tolong usaha juan brg dlm kondisi y bagus pas nyampai ke pembeli sehingga pembeli merasa puas,2
Produk yg dikirim tidak sesuai pesanan dan cacat karena packing sangat jelek. Terpaksa dikembalikan. Pengirim ke seller yg seharusnya gratis dikenakan biaya tambahan oleh J&T. Dana sudah dikembalikan.,1
"varang bagys hany lagi ada pecah bagian kacany mohon ada pemberitahuan untuk reseller pada kotak kemasan utk barang yg mudah pecah/pecah belah HARAP JGN DIBANTING
agar pelanggan tidak kecewa terima barang yg rusak.apa lagi pengembalian barang sangan sulit dan melalui prosedur yg bertele2",5
Barang bagus packingnya juga bagus dan dikirim lebih cepat dari yg dikira. Rekomendasi buat yg lain.,5
"manntap barang nya murah dan kualitas baik, packing rapih, buat penjual baik",5
Mantap barang sesuai pesanan... ,5
Mantul,5
bagus sesuai yang diinginkan,5
"barang sesuai gambarğŸ‘
terimakasih lazada",5
"tks, mantap",5
Barangnya bagus sesuai dengan gambar... makasih,5
Barang ok,5
"lampunya bagus dan kurirnya baik cz udah langganan.
",5
"Barangnya bagus banget, mantapppğŸ‘",5
mantappp,5
