review,rating
"barang sdh smp dngn selamat, dikms dngn rapih  dan sngt cpt. sangat puas kurir baik. terima ksh lazada.",5
barang sdh diterima dan sangat memuaskan. terimakasih abang kurir terimakasih lazada.,5
"alhamdulillah barang dah smp ketiganya bagus, abang kurirnya ramah. toko amanah. terimakasih lazada",5
"Barang sudah sampai sesuai pesanan, cuma blm di coba  ja, thank's seler dan lazada, pertahankan mutu dan kwalitas pelayanan ",4
sdh sampai tp blm di hidupkan,5
mksh pkt nya baru yampe,4
Baik barang sdh di terima sesuai spesifikasi terima kasih ğŸ‘ kemasan mantap,5
"Bagus

",5
Bagus,5
ga dapat lampunya ia sist,5
produk ok,5
