review,rating
Mantabbbbbb,5
Alhamdulillah udh dtg paket nya..blm saya buka soal nya tg suami plg..ini tu dpt murah LG pas bli nya jam 00.00 ..mksh lazada mmg top n met ultah n moga ke dpn nya LBH baik n LBH baik LG..,5
"Hebat !
Fast Delivery, pesan minggu, senin pagi nyampe.
dalam 23 jam barang di terima. sesuai #24HD.
awal nya sempat ragu beli barang gede gitu kapan nyampe kiriman, beli barang kecil aja bisa 3 hari baru terima. Tadi sore baru di pasang dan berjalan normal.
RECOMMENDED !!!",5
"Ac Mideanya sudah dterima, WoW bnget, cepat kirimnya ... tks ",5
Ac nya dingin banget recomended seller terima kasih ğŸ™ ,5
Mudah mudahan awet AC,5
sudah sampai & sedang d pasang. moga2 g ada masalah dg barangny. trimakasi lazadağŸ™,4
sudah diterima dengan baik,5
"produk sampai dalam keadaan baik, wkt pengiriman termasuk cepat di masa pandemic ini",5
