review,rating
"bagus sih sesuai gambar warna nya juga sesuai tapi kok keterangan nya di sini bisa di pakai bolak balik trus ada saku dalam. 
tapi yg di kirim ini kok gak bisa di pakai bolak balik trus gak ada saku dalam nya. 
sama pengiriman nya lumayan lama.",4
cakep bnget pas bnget di bdan aku bhannya jg memuaskn mkasih ea lazada & jg nine angel store tlah mmbrikn yg trbaik,5
"Kedatangan barang cepat, kualitas barang bagus, tetapi ada kekurangannya yaitu barang tidak sesuai dengan yang digambar. mohon ditingkatkan lagi untuk gambar harus sesuai dengan yang dikirim",3
jaketnya bgus,5
Warna yg dateng nggak sesuai gmbr..... ,3
"barang bgus, hanya agak beda sdkit dgn gambar",4
jket tdk sesuai dg yg d gambar tp baguz kok yg d krim...mksh ya,5
kerenn..,5
good,5
