review,rating
barang nya bagus sesuai dgn gambar dan pesanannya... pengiriman agak lambat tdk apa yg penting skrg sdh sampai... terimakasih lazada ,5
tampilannya aja bagus.pas lg dicoba keluar api.tolong diganti secepatnya masa baru beli udah rusak nh blender.trimakasih ,5
alhamdulillah pesanan sudah diterima rapih dan sesuai..kurir nya top bgt dan ramah.terima kasih lazada ğŸ¤—,5
mohon maaf blendernya retak,3
bagus...semoga awet...mskasih buat si abang,5
"Paket udh sampai tpi syg gk di bungkus apa""
Untung gk da yg rusak ",5
biar bintang yg berbicara. mantap bnget deh,5
mantap gan blender nya. mesin nya juga halus bnget. mantap untuk pengiriman juga cpt bnget,5
lumayan lh mf baru kasih ulasan ,5
jelek bareng di terima malah retak bikin kecewa,2
lumayan lah dengan harga segitu,5
"blender nya bgus tapi belum d coba
mudah"" bagus dan nyala ya.mudh""an juga awet blender nya",5
bagus,5
