review,rating
Smua ok barang ny peking ny sgt rapi..cuma smlm aq coba blender cabe kok kaya mau angit dr mesin ny..tp gpp lh smua ny aq suka...mksh kk smg jd langganan ya,5
"Saya hanya mau tukar ,, choper bumbu basah kepala mesin tidak cocok di mesin blendernya,, mohon info segera,, sementara yg lainya ok,, lalu gimana ini? mohon info segera  ya",5
"Barang sudah saya terima dengan packing yang sangat bagus dan aman, langsung saya coba buat menggiling merica dan ketumbar dan hasilnya sangat bagus. Recomended seller thanks Lazada",5
Barang bagus.. semuanya berfungsi dengan baik.. semoga awet,5
gk berfungsi,4
mntap,5
