review,rating
"sesuai keinginan walau kardus rusak gpp yg penting isinya mulus,blm di coba mudah""berfungsi dg baik n awet tuk abang kurir terimakasih",4
"barang nya jelek ,,,udah coba buat giling daging tapi baru dipakai sebentar mati..klo barang udah rusak jangan dijual dongg....jadi gak kepake,,dan bahanya yg digiling jdi mubazir kan.untuk abang kurirnya baik ,ramah bintang 5,,tapi klo alat penggiling nya bintang 1 jelek,kecewaaaa",1
di tunggu2 akhirnya datang jg.bagus aku suka .sudah aku tes mesinnya nyala .bungkus jg rapi .kurir jg baik dan ramah .cuma pesanku lain kali aku pesan tepat waktu .thank you lasada .,5
"sangat memuaskan.. barang oke dan sesuai gambar...
kurir juga ramah..
packing juga rapih dan aman...
terima kasih lazada..ğŸ˜˜",5
"barang sdh datang, walaupun kerdusnya penyok tp masih ok ....semoga awet...kurir ramah ...",5
"alhamdulillah barangnya udah sampai, ga ada yg belah, belum dicoba, mudahÂ²an berfungsi dgn baik",5
kemasan bagus barangnya juga bagus pengiriman cepat sayang kurirnya ngga sabar,5
Riil pict..suka ijo..dapet ijo alhamdulillah..di.coba idup,5
paketnya suda datang dan barangnya bagus.,5
bagus sesuai pict n pakking rapi..mudah2an awet...,5
barang ok,5
biasa,2
