review,rating
"Alhamdullilah barangnya bagus, puas belanjanya.makasih lazada, seller dan kururnya. Semoga sukses selalu...",5
"barang nya dah sampai paking nya rapih  , langsung d coba berpungsi baik , kurir nya ramah , dah langganan trimakasih lazada",5
"rapih ud pake bublewrap msih pke kardus didalam lg, isi aman dan bisa dipake puas sekali. semoga awet. thx lazada ",5
mantap...... rilfic deh makasi lazada ma pak kurur,5
maaf baru kasih ulasan barang dah sampai kurirnya ramah,5
"Hand Blender syntrox, barang realpik udah d tes barang berpungsi moga awet, paking aman dobel kardus + bublle krap makasih seller n lazada",5
peking nya rapih..mantul pokok nya.semoga awet yah..,5
mantaf.. sesuai cuy..,5
barang udah nyampe TPI sedikit kecewa ternyata gk ada wadah toplesnya..,5
barangnya oke,4
barang udah datang. sementara bintang 3 dulu ya krn blm dicoba,5
kalo bisa kasih bintang 10 saya kasih bos,5
terima kasih barang sudah diterima.,5
puas bingit sesuai dengan pesanan,5
Mantp tapi blom di coba,5
alhamdulilah paket saya terima dengan baik. suka. belum di coba si.. tapi semog awet..,5
baguuuuusssss,5
"mantap barang meluncur dengan baik,,udah di coba juga bagus mantul rekomendasi banget ",5
barang bagus sesuai pesanan,4
bagus berfungsi dgn baik,5
mantap lazada bisa cod jadi makin sering belanja barangnya sip normal,5
barangnya bagus...tp blm di coba,5
barangnya udah sampe dan bagus,5
"good real pict,thanks good luck lazada",5
Barang sudah diterima dan semua berfungsi.,5
terimakasih barang sdh sampai sesuai gambar.smoga awet dan bermanfaat,5
"bagus , semu berfungsi dgn baik",5
"siiiippp
",5
Ok.,5
Barang bgs,5
seep,3
