review,rating
Alhmdullilah brangy dh dateng seperti di gmbar,4
"keren pokoknya, packing barangnya bagus, gak ngapokin lah belanja di sini, sellerny gercep, barang dateng lebih cepet ,",5
"Paket datang Tepat waktu ,  di bungkus rapi Menggunakan kardus dan bubble wrap. 
Kurir ramah dan seringnya telp dulu unt konfirmasi
Terimakasih seller n lazada",5
"sesuai dengan orderannya, barangnya jg bagus... pengirimannya cepat. estimasi tgl 10, tp tgl 8 sdh sampai di tempat",5
saya mintanya uk 70-120cm kok yg dikirim panjang banget uk 105- nggak tau brp!! ini besinya bs dipotong ngga ya,2
mantap barang bagus,5
oke sih ni produk...gampang banget tinggal disesuain lebarnya.rencana mw untuk dibawah wastafel berhub blm jahit yah sementara disimpan dulu..agak lama sih pengirimannya krn pake JNE dr 28 des 2018 nyampenya 22 jan 2019,5
barang sdh diterima sblm estimasi makasih,5
terima kasih barang nya sudah datang,5
barang ada yg rusak/ pecah karena di pak pkai kardus yg besar dr barang jdi brgnya bergeser geser dlm kotak,2
"Barang bagus, ok, tapi KECEWA karena yg dikirim ukuran 100, padahal saya pesan ukuran 70, jadi mubazir barang yg dibeli ga kepake ğŸ˜­ğŸ˜¢",2
"kecewa.. gak bisa dipasang. pesen uk 70 malah dikirim uk 100 mana bisa masuk. barang si sbnernya bagus,, kokoh tapi sayangnya gak sesuai pesanan jdi gak kepake.",5
barang lecet. mungkin karena waktu di packing di gabung dengan kepala shower ,1
"barang belum dibuka, mudahan sesuai harapan..",5
maaf telat comentnya.good jobb no coment bintang yg bicara thanks lazada,5
"yess,, udh nyampe beberapa hari yg lalu, lama  bgt pengiriman nya tp bagus koq, sangat puas",5
nice..... praktis..... ,5
Barang tidak sesuai dengan gambar,3
bgs....,5
manfaat,4
