review,rating
"Alhamdulillah salep nya manjur 
Gatal "" alergi ku langsung sembuh 
Terima kasih seller, lazada n kurir ",5
ğŸ‘,5
"Maaf baru kasih ulasan alhmdllh salep nya manjur 3x pke gatal nya sembuh
",5
alhamdulillah berkat menggunakan obat ini gatal saya hilang dalam 3 - 4 hari sembuh....,5
"Pengiriman lama
",4
pakainya udh sampai barangnya tp kecil banget ya,5
barang sudah datang sesuai pesanan...mudah2an sembuh,4
"slow respon, sama tangerangnya paket hampir seminggu sampainya.. ",3
"paket belum saya terima .disini ko mlah .ad konpirmasi paket sudah saya terima . gimana sih ,,pokoknya saya mau barangnya cpt dkirim ke saya engga mautau. ",1
mantul,5
ga diragukan lagi...sembuh semua gatal,5
barang sesuai order kwalitas menyakinkan.,5
