review,rating
datang dengan cepat sesuai pesanan okeh makasih,5
"barang bagus banget, hp jadi keliatan mewah loh, trims seler",5
"mendarat selamat, request warna hitam yang tiba navy blueğŸ˜…",4
ternyata barang nya kegedean kirain not 6 pro dan redmi 6 pro sama ternyata tidak barang kegedan akhirnya gak kepakai dah.,3
barang lmyan bgus buat harga segitu.pengiriman cepat,5
"mayan walaupun gk kepake, salah order tipe tp gk bisa tuker, sia"" dah case nya",3
barang bagus sesuei gambar,5
"barang bagus lurrr sesuai gambar , seller cekatan",5
"Ok, sesuai orderan. Ada lecet dikit tapi gk masalah. Gk keliatan. 
Overall mantul.",4
"Cocok, meski pesan warna hitam yg datang biru,, gpp lah",5
bagus sekali,5
"Barangnya Sesuai gambar,  pengiriman rapi dan cepat",5
kegedean gan,3
keren banget,5
Barang sesuai dengan pesanan dan kualitas barang sesuai dengan harga yang ditawarkan,4
Mantab... ,5
bagus,5
