review,rating
Terimakasih paket sdh saya terima dgn kondisi baik. Sesuai gambar alhamdulillah tdk mengecewakan. Tingkatkan terus pelayanan kepada customer.,5
"Barangnya udh sampai.. Sempet emosi karena lama bgt ga dikirim2, ternyata warnanya kosong tp konfirmasi warna pengganti (Tan) ga kalah bagus..
Kedepannya sebaiknya dicek dl ready tidaknya barang biar konsumen ga nunggu.. overall OK",5
kecewa dari warna aja sih pesen warna Tan yg dtg item....pdhal brhrap bgt warna nya Tan biar smaan gtu sma yg punya anak saya biar couple'an walaupun beda mo,4
kurang rapi barg dan packingnya,3
Gak bisa berkata apa apa lagi barang nya semua cantikğŸ˜,5
bagus..murah,5
bagus bgt harga murah pun bagus nyaman di pakai â™¥ï¸â™¥ï¸,5
"lumayan sesuai dengan harga
",4
"No 37 nya agak kebesar, tpi kalau soal sepatunya bagus, sesuai gambar.",4
mkasih lazada.sepatuny bgs...,5
"sepatu sesuai pesanan, cukup bagus untuk harga semurah itu",5
real pic.  thanks,5
"ini lumayan, kurir baik dan ramah dan sabar.. bintang nya buat kurir ajalah..",5
bagus kok murah lagi,5
"sepatunya bener bener bagus, semoga awet ",5
"Barang yang saya trima beda dengan di gambar .. pengiriman sangat lama , payah gk niat jualan",1
yg ini gak sesuai pesanan jelek dan lecet,1
real pick,5
realpict,5
