review,rating
"pengemasanny rapi..
bajunya sesuai harga..bagus tapi baju tunik nya tipis banget sudah saya kompirmasi ke admin..katanya emg dari dasar nyaa..
agak puas deh..berbelanja di sini",5
"alhamdullah memuaskan, semua barang yg saya order lengkap, dan tidak ada yg rusak,semuanya bagus
order pertama kali alhamdullilah puas, semoga orderan yg berikutnya tdak mengecewakann. terimakasih LazadağŸ¥°ğŸ™",5
Ickhh gmna c ini L tvi kecill biasa gx pernah gagal ini gagal,1
Bahan adem... bagus kurir dah biasa lngganan.. makasih.. ,5
"Mantul,.,. Dapat harga murah meriah tapi ga murahan",5
barang bagus.... anakku yang sd suka.... terimakasih....,5
bhn tipis,3
Bagus,5
