review,rating
cukup besar dan rapi,5
"kipas nya bagus, sesuai pesanan, Kipas nya gede, tapi angin nya kurang kenceng, mau mesem lg ah yg 15 wat X ajah angin nya kenceng,",5
"Barang sesuai gambar, berfungsi dgn baik,
Cuma packing cum kresek doang, dan pengiriman cukup lama. Diluar itu, mantap lahh... ",5
produk sudah diterima dan packing bagus dan rapih serta tidak bohong sesuai dengan gambar dan pesanan.. saya sangat rekomendasi banget dengan penjual ini游땙,5
Bagus.... Siap pake...sdh dipasang,5
Barang sip tdk bermasalah.. Kurir juga sip di siplin,5
"Mantep lah anginnya, apalagi klo malem lumayan bisa bikin masuk angin游때游때游때游때游때",5
"PARAH.... WAT YG BLOM BELI JANGAN BELI DAH... BISA DAH HILANG DUIT ,,, JENGKEL PULA... KIPAS, Y SICH NYALA.... CUMA MUTER, Y TERBALIK... LAMA LAMA KABEL, Y MELINTIR.... MELEDAK DAH.... PARAH U JUAL BARANG... BIKIN RUMAH GW KONSLETING....",1
"mksh lazada brg'y mulus , packing 'y rapi smga awet.",5
perkiraan aku kipasnya kecil eehh taunya kipasnya lumayan besar游뱂游뱂游때游때游녧游녧游녨游녨,5
keren kipasnya mantul banget kurirnya ramah banget thanks lazada ,4
berpungsi dgn sempurna ,5
barang udah sampe dan terpasang mantul deh,5
pokoknya top kipasnya kencang moga awat ,5
Fast Respon N Recomended Seller,5
"angine nya sepoy sepoy.
pelan tpi pasti.
baguslah dengan harga segitu.
terima kasih lazada.",5
enak adem ayem tentrem,5
paking rapi.. barang ok... ,5
kipas rusak di kirim kecewa saya,1
Alhmdulillah barang bagus...cukup puas,5
terimakasih Lazada,5
"Barang oke,  tapi kardus penyok.  Mohon diperbaiki lagi",5
"berfungsi dengan baik, anginnya gede, pengiriman cepat,puas banget
",5
"ke-4 kipas berfungsi dengan baik, terima kasih",5
Cocok anginnya sonaaaaayyyssss,5
MANTULLLLL ,5
sedikit pecah..tapi g papa anginnya kencang...,3
"barang bagus,recomended",5
brg diterima sempurna   blm coba pasang sih smg kwalitas baik y ,5
kipas ny bguss..,5
alhamdulilah paketnya udah nyampe bagus angin nya lmyan kncang,5
barangnya bagus sesuai expetasi,5
mantul,5
mantul,5
ok.,5
mm,4
