review,rating
Baguss di rambut aku warnanya masuk.tp hrs beli 2 lagi biar makin kliatan..,5
"barang cepet datang & sesuai juga warna yg aku mintağŸ˜thanks seller, lazada & kurir sukses sllu...",5
saya beli yang caramel kenapa datangnya bleaching? percuma dong gk bisa kepake ,2
Suka sya sm wrnanya ,5
"puas,  bafang sesuai pesanan",5
"Maaf terlambat kasih ulasan.. 
Saya sangat puas belanja di lazada pengiriman tepat waktu dan pesanan sesuai. Tks lazada",5
"Alhamdulillah lebih cepat dari estimasi, sesuai pesanan,pakingnya rapih,pak kurirnya baik bakal jd langganan ni terimakasih lazada...",4
 blum coba tapi bagus ko soal nya bleacing ya blum nyampe ,5
"Paket dh aq trima, sesuai pesann ok deh",5
