review,rating
"Barang sudah sampai. Sesuai yg di harap kan.. 
Terimakasih lazada. Ini orderan yg ke 2.. semoga kedepannya selalu real pick.. trimakasi buat Abang kurir nya..",5
makasih lazada dompete mantap aku suka banget jozz,5
baik pertahankan jaga kualitas,4
alhamdulillh barang bagus sesuai dngan gambar ,5
keren banget.... ,5
"waw sesuai dengan gambar..barang di bks rapih dan kurir nya pun ramah ..pokoknya top deh 

",5
dompet keren sesuai gambar thk laz,5
"barang bguss,,  real picture,, pngiriman cepat..  terima kasih..  ",5
"bagus
",5
