review,rating
"Barang lengkap, semua sesuai pesanan dan alhamdulillah jam nya jg berfungsi dengan baik ..
Lucu dompetnya mungil tp simpel jd ringkes ..
Seller jg ramah & fast respon, mantapp",5
"lumayan bagus lah sesuai dengan harga...warna sesuiai dgn yg diminta, pengiriman cepat. kurir ramah dan baik. terimkasih",5
Kecewaaa....aku pesan dompet 2 kok yg datangnya satu ....mna udah byrnya 2 ....tolong dong ka kirimin satu lagih amanah dong kak klo dagang . Pokonya g mau tau saya udh bayr 2 barang.,1
"Bagus banget dompetnya real pict, bahannya bagus buat harga segini, gk nyesel deh beli di sini pkonya mantap banget 👍",5
"pesanan nya sudah sampai , sesuai yg dipesan dn baguss udh order kedua kali alhmdulillah sesuai tq seller dan mas kurir🤗✨",5
"sedikit kecewa sih soalnya tengah tengah dompetnya bolong tapi sesuailah sama harga nya . untuk pengiriman nya cepat mamang kurir nya baik
",4
"makasi dompet nya realpict ya lumayan harga sgitu bisa dapet dompet,cuma pengiriman nya aja aga lama",5
bagus bgttt😍,5
"Realpict,  suka.. ",5
sangat murah dan bagus,5
realpick deh pokoknya,5
Thankss..😍😍😍,5
kedua kalinya dan gk kecewa,5
"bagus saya suka, proses pengirimannya cepet sekali",5
"allhmdllh brangx sesuai dgn pesan,kurir nya pun ramh dn baik,...",5
ok real pick terimakasih lazada,4
Ada harga ada rupasih 🙃,3
Aslinya bagus😍,5
"barang nya realpict,pengirimannya juga cepet",5
"barang nya sdh sampai sesuai dengan gambar
barangnya bagus banget
thanks Lazada 👍👍",5
barangnya bagus banget pertahani ya kak,5
"packingnya rapih,dompetnya bagus cuma saya pesen warna item sama merah yg dtng item semua",4
"terimakasih lazada barangnya sudah sampai, sesuai dengan realpict harganya terjangkau kualitas ok. 
walapun pengirimannya lama tapi gapapa puas sama barangnya terimakasih 😇☺",5
"dompetnya realpict, ga ada cacat baguss.
thanks lazada 😍",5
alhmdulilah paketnya udh dtng kak dan brngnya bagus sesuai permintaan..maksih kk,5
dompet nya bagus bingittt ga nyesel sumpah,5
 pengirman sngat cepat.aku suka sekali realpic,5
"bagus sih
tapi kok ada bolongnya dikit 
",5
bagus dan realpict bangett,5
"kualitas produk bagus, dan real pict.. pengiriman cepat, dan pengemasan nya rapih :) thx ka :)",5
"maaf telat .. barangnya baguss,,lumayan untuk harga segitu..
",5
alhamdulillah puas bngt. mksh lazada,5
dompet nya lucu banget Alhamdulillah sesuai pesanan hanya warnanya saja yang lebih gelap dari gambar mungkin efek cahaya tapi ga masalah,5
"barangnya bagus. lumayan banget buat kalo mau kemana2 males bawa dompet gede2. pengiriman cepet, ternyata kurirnya tetangga ku dulu hehehe mksh",5
Alhamdulillah barangnya udah sampe...makasih buat tokonya pengiriman nya cepet...buat kurir dan lazada makasih..cuma ada sedikit kecewa kaya ada yg enggak kejait gitu bawahnya... tapi gpp overall bagus aku suka...sesuai sama harga🤗,5
"Suka banget sama pelayanannya, packingnya, semuanya deh. Untuk seller dan kurir Semoga makin lancar dan bertambah rezekinya. Selalu amanah yaa",5
pokonya bagus bagus pake banget nggak jelas pokonya belanja disini😍 sudah 2 kali belanja disini dan selalu sesuai pesanan semua🥰sukses terus tokonya🤲,5
"Alhamdulillah...dompetnya bagus,real pict saya suka kurirnya jga ramah dah langganan. Thanks Lazada & seller",5
"alhamdulilah barang sampe dengan selamat, barang sesuai dengan harga, pengiriman lumayan aga lama.... tapi ga apa lah.... 👍👍👍👍",5
thank's Lazada brg nya realpict sesuai lah dengan harga nya syuukkkaaaa bgt 😍 meskipun agak lama pengirimannya hampir mau 1 minggu . ,5
baguuss bahan nya rapi jahitan nya murah harga nya tp kece cm kok g ada tempat koin aja tp tetep suka joa🙏🙏🙏,4
"seharusnya dompetnya dipacking yang bagus jangan hanya dikasih selembar kertas , untuk dompetnya sendiri bagus",4
"dompet nya bagus warna jg sesuai amanah buat tokonya&buat mas kurirnya baik ramah,trima kasih lazada",5
dompet nya bagusss bahan nya bagus sesuay gambar cuma sayang pengiriman di kurir JNE nya lama di batalkan terus ini baru nyampe malem jam 21.00 pas udah tidur kecewa pokonya sama Abang kurir nya ,5
"Paketnya sudah datang makasih lazada, barang nya pun tidak ada yang cacat sedikit pun dan jaitan nya rapih,kurirnya sangat ramah.",5
"Barangnya bagus, pengirimannya cepat dan kurirnya sopan🙏🏻",5
"Pokoknya senang banget belanja dsni,  barangnya realpict dan kurirnya baik banget, ramah dan udah langganan sama kurirnya. Thankyouu buat tokonya,  kurir dan lazada semoga makin sukses🙏😍",5
"Mantul,,,",5
"dompet nya bagus gak ngecewain aku order sudah dua kali seller ramah respon cepat sukses terus kak aku sangat puas,tapi yg ngecewain  mang kurir nya gasopan minta ongkir nya di tambahin pdahal di aplikasi sudah segitu.",4
alhamdulillah puas barangnya sudah sampai sesuai gambar dan sesuai lah dengan harganya.thanks lazada 🙏😊,4
dompet Yach bgus bgt suka bgt😍😍sesuai pesenann sy mksh ..kk. toko Yach amanah gk nyesel blnja ditoko nie mksh lazda🤗🤗🤗,5
"Yeayyy dompetnya sudah sampai. Bagus, simpel dan real pict 😍 pengemasannya juga baik dan kurirnya juga ramah banget. makasih, semoga makin sukses 😊",5
syuka syuka syuka syuka syuka syuka syuka syuka syuka syuka syuka syuka syuka syuka syuka syuka syuka syuka syuka syuka syuka syuka syuka syuka syuka syuka syuka syuka syuka syuka syuka syuka syuka syuka syuka syuka syuka syuka syuka syuka syuka syuka syuka syuka syuka syuka syuka syuka syuka syuka syuka syuka syuka syuka syuka syuka syuka syuka syuka syuka,5
barangnya sudah lama sampai..tapi baru ngasih ulasan.bagus sih sesuai harga..kurirnya juga baik.okelahhhh,5
"sukak sama dompetnya, realpict sekali, udah gitu cepet sampai lagi, terus nyokap jadi ikut2an beli sekarang 🤭 tetap seperti ini ya tokonya🙏",5
"terimakasih RK Fashion,lazada dompet nya bagus,sesuai pesanan,lucu,udah gitu harga nya murah meriah😍😘💓untuk kurir makasih jg udh nganterin paket sy sampe keujanan🙏next order😉",5
"bentuk luar nya kecil ,tapi pas buka dalemnyaa Muat semuaaa ,Kartu dan uangku tersusun dengan rapihh ..Terimakasih harga murah tapi barang tidak murahan .. 😀🤗",5
sesuai pesenan terima kasih lazada smoga toko nya slalu amanh ya terima kasih buat abang kurir nya uh mau nganterin,5
"asalamualikum saya suka sekali dengan hasil nya ,bahanya bagus dan lbentuknya lucu,pokoknya kau suka banget deh 💝😁",5
"thankyou bgt...barang udh nyampe 100% realpict dan diterima sebelum estimasi, pokonya worth it bgt deh untuk harga segini..thankyou seller",5
"puas banget da, pengiriman cepat juga, packing rapi, kurir ramah. recomended banget buat blanja di tokoh ini. mf nggk sempat motoh, keburu diambil sama yang punya. ",5
"untuk dompet seharga Rp.10.200 tidak mengecewakan bahanya bagus, warnanya sesuai sama pesanan saya dan saya sebagai konsumen sangat menyukai",5
Real pict...sesuai pesanan...thanks Lazada,5
"bagus banget , rekomendasi pokoknya , kurir juga ramah bakal jadi langganan nih gk kecewa sama sekali",5
"mantap barang sesuai pesanan, pengirimannya cepat, kurir nya ramah, penjual fast respon dan barang realpict... ngga bakalan nyesel deh belanja di toko ini",5
"respon penjual nya baik sekali, harganya juga murah, sangat terjangkau, kualitas nya lumayan. untuk harga segitu sangat baik. pertama kali beli tidak di buat kecewa.. suka sekalii terimakasih",5
"bagus pisan ey tapi ada jaitan nya yg lepas😔 
tapi ga masalah tetap suka ko ,lain kali di cek lg yg teliti ya ka biar konsumen ga ada yg kecewa😊😊👍",5
dompet nya udh sampeee sblm waktu estimasi nyaa seneng bangett tapi ada bagian yg rusak di pinggir nya tapi gpp tenkyuuu mas kurir dan lazada serta seller✨😁,5
"Dompetnya bagus, cakep, sesuai sama yang digambarnya. Harganya juga cukup murah. Packingannya juga rapih. Cepat sampai barangnya. Kurirnya juga ramah. Pokoknya ok deh 😁. Yang penting semoga awet. Aamiin. Good luck ya 👍🏻",5
maaf baru kasih ulasan kecewa banget gk sesusai di gambar dompet nya sangat kecil gk ada resletingnya lagi bisa jatuh buat naroh uang,5
Terimakasih Lazada n seller.. Dompetnya bagussss 👍😊 Sayaaaa sukaaaa.. Datang dompetnya lebih cepat dari estimasinya.. Semoga berlangganan.. 😍 ,5
"Maaf baru bisa ngasih Ulasan, barangnya bagus realpict pengirimannya cepet dan kurirnya udah langanan",5
alhamdulilah relpick.sesuai harga yah dan kurir udh langganan bgt tepat didepan pintu .terimakasih lazada,5
Dompet nya Bagus ga ada yg rusak sedikitpun pengiriman juga cepat pokonya puas deh belanja di sini😃,5
"Alhamdulillah beli dua dan gk bikin kecewa, warnanya juga sesuai. Makasih Saler, makasih kurirnya. Ini aku juga lagi pesen lagi",5
REALPICK  mksih lazada udh bbrpa kli psen d lazada brang nya ga mngecawakn..barang mndarat dngan cpat packing nya rapih  selerr nya jga ramah??mksh LAZADA,5
makasih mb dompetnya dah dateng maaf baru ngabarin bahanya juga Bagus puas banget intunya makasih buat lazada ,5
"packing nya rapih banget , cepet juga dateng nya , untuk dompet nya alhamdulillah ga ngecewain. makasih yaa 🥰",5
baguus realpict ... sesuai warna nya .. aku suka... lope lope pokoknya mkasih seller & lazada💕💕💕💕,5
"pesanan cepat sampai, kurir ramah, harga sesuai dengan barang, di kemas dengan rapi real pict banget, pokonya saya suka😍😍😍 terimakasih lazada",5
alhamdulillah dompet nya sudah dateng. pakcingnya sangat rapih sampe susah dibukanya karena begitu raihnya. dimpetnya lucu imut bahannya juga Bagus dengan harga segitu. alhamdulillah tidak mengecewakan terimakasih lazada ,5
alhmdllh paketnya sudah sampai dompetnya Saya suka sesuai lah dengan harga..Dan kurir nya juga ramah trima kasih lazada👍,5
real pict rekomen bngt deh) maaf baru ngasih ulasan><,5
pokoknya barang bagusss bangett mantullll 😍🥰🥰 seller ramah sopan dan kurir juga baik terimakasih lazada ,5
Terimakasih dompet nya bagus bahannya enak kurirnya ramah sekali Harga nya pas waktu sampainya sesuai 😊 ,5
makasih lazada dan seller pesanan saya sudah sampai.. bagus sih dompetnya tpi bawahnya kurang ketutup jdinya berlubang,5
"Alhamdullillah dompet ya bagusss,,, memuaskan aku suka banget dan kurir ya baik, makasih lazada,,😊😊Maaf ya baru kasih ulasan ya soal ya saya sibuk banget,, 🙏🙏",5
"Mav bru kasih ulasan barang'a sampe dengan cepat dan barangnya jg lumayan g nyesel deh bli ini lain kali bleh pesen lagi...
Kurirnya jg ramah packingnya bangus ",5
"paket sudah smpai
aku suka 
rekomen bgtz sma pelayanannya 
pengiriman jg cepat
mas"" kurirnya jg ramah pake bgtz",5
"Alhmdulillh bagus saya suka,,  semoga lazada tetap memberikan pelayanan yg bagus dan kasih kwalitas bagus juga ",5
dompet nya bagus banget dn bisa buat gantung kunci jadi klo keluar rumah GX takut hilang trus kurir nya orang yg biasa antar walau ke malam an masih tetap amanah makasih buat kurir nya moga yg antr ttp mas ya sol ramah dn amanah,5
"paket udh sampe lumayan cpt lah dateng 4hari, kurir ramah, barang cocok lah untuk harga segitu, thanks lazada",5
"dompet nya bagus realpict, pengriman super cepat sehari udh nyampe, kurir nya udah langganan, makasih lazada",5
"asli saya suka,,..cepet pula nyampenya ,kurirnya baik ..mkasih ya lazada emang sllu mmeberika yg trbaik",5
"makasih real pick banget deh dompetnya,,, sesuai yg aq mau, thanks lazada.. 😊
 
dan mksih buat kurirny yg ramah dan stiap fia yg ngnter alhmdulillh  barangnya sesuai truz ",5
"Maaf baru kasih ulasan. Dompetnya bagus😍reall pict bgt,alhamdulillah baru pertama kali belanja diLazada tidak mengecewakan. Terimakasih Lazada😊",5
bagus sesuai dengan gambar dan pesanan,5
barang nya bagus sesuai pesenan maksih lazda ,5
dompetnya baguss.. real pict ,5
barang nya bagus bangettt,5
kerenn sesuai,5
pesen abu datang pink:( gpp si ttp bagus :),5
Bagus banget dompet nya lucu sekali😍,5
barangnya baguus..toop pokonya😍😍,5
"bagus,, saya syuka warna yg d pesan sesuai dengan keinginan thks lazada
",4
recomendedddd guys❣️❣️,5
Makasih seller maksih lazada puas sma dompet nya pelanggan aku jga suka🥰,5
pengirimannya cepet bngt 🤗barang nya realfict sesuai bangt sama yang aku pesen😍,5
"wahhhh dompetnya bagus banget🤗
saya tidak rugi beli dilazada🥳👍",5
"barang udah nyampe tapi Peking nya gtw bgt kotor jadi barang nya lecet,kurir baik ",5
realpict....oke,5
barang sudah diterima dg baik.mantul,5
Nice bagussssss........... Sekali,5
paketnya udah dateng..real pect..keren..kurirnya ramah..terimaksih lazada🙏,5
bagus gak ngecewain pokoknya ♥️✨🥰,5
"dompetnya lucu, ada gantungan2nya gt😄
",5
"alhamdulilah bgus barang nya thx lazada,wlaupun murah tapi gak murahan real pic",5
"suka bnget sm warnanya, real pict😍",5
alhamdulillah bagus jngan buat kecewa yah🥰 insya Allah saya beli lgi semoga slalu amanah,5
Bagus no cacat 👍👍,5
"Sesuai harga,kurir nya juga ramah",5
bagus dan terjangkau,5
"real pict barangnya ,cocok lah utk hrga sgtu, yg pnting krtu2 pda aman snua,slot kartunya jga banyak,.thx lazada,abg kurir nya jga ramah",5
"brg ny bagus top bangeet, tp aga kecewa jaitan ny krg rapi,,, tp ga pp deh saya sama kk saya suka, mksh lazada... ",5
"alhmdllah baru smpai dompetny, lumyanla sesuai dgn hrgany.. mksh lazada, dan kurirny jg sdh lnggnn saya",5
bagus tapi agak tipis punya kk saya warna salem tua tbelan tp gpp lah ...pas bwt d masukin tas slmpang,5
brng sesuai gmbar mksh lazada gk kecwa sma hrga sgtu ..pokok y gk nyesel..mksh jga buat abng kurir y😊😊😊,5
sudah sy trima dgn baik paketnya. dompetnya jg sesuai dgn apa yg sy inginkan. trimakasih ya. kurirnya jg ramah.,5
yey dompet aku udah sampe suka bgt sesuai pesenan sama persis kaya di gambar udah gitu respon penjualnya cepet bgt lope lope pokoknya ♥️,5
bagus ga nyesel blnja ditoko ini,5
👍👍👍 bagus bngt dompett nya ,5
"dompetnya bagusss, saya suka",5
"bagus banget realpict pokonyaa, makasiiii..",5
realfict banget,5
baqus ko barangx🙏🙏🙏,1
"bagus bngt udh bli 2x kualitas nya ttp bagus, tpi harganya berbeda yg ini lebih murah tpi gpp yg penting oke👍",5
dompet nya bagus realpic 🥰,5
bagus bangett lucuuuu realpict poko nyaa mkasi😙,5
barangnya realpict bngt....mantul deh pokoknya thanks y lazada......,5
mantul abis brangnya.  sesuai gambar.  gak nyesel blinya,5
"Barang bagus sya suka tp klu bisa pengiriman harus di percepat.
",4
sesuai bangt,5
lucu dompetnya unik :-),5
cantik imut gemesss,5
Bgus dompt nya 😍😍😍,5
"barang nya bagus banget dan sesuai pesanan, pokok nya ",5
Bagus bgt dompet nya 😘😘,5
bagus bangett thank lazada,5
dompet ny bagus,5
"dompet.a bagus, tp susah di buka mngkin krna msh baru, pengiriman capt sehari lngsg nympe, mksh lazada",5
barangnya bagus kok sesuai dengan gambar,1
"Maaf baru kasih ulasan... dompet nya bagus, warna sesuai yang di kirim, kurir ramah. thank lazada",5
sip barangnya bagus gak ada yang cacat,5
bgusss bangttt sesuaii dengan yang di photo mksh lazada🙏💗,5
"Alhamdulillah sesuai pesanan, next order lagi semoga selalu memuaskan😊",5
bangus trima kasih,5
"bagus sesuai gambar,next order lagi..",5
baguslah sesuai dgn harga segitu,5
thk,5
barangnya real dan bagus,5
Cantik.pas buanget,5
barang bagus .. sesuai imut banget suka dehh,5
Bagus ii ngg nyesel nnti order lagi ya,5
terimakasihhhh baguss,5
"Bagus sih cuman gasuka aja kurir nya gajujur lebih2in dr total, padahal tanpa digituin bisa kasi sendiri kok.  ",4
"produk baagus  cuma ada yang bolong
selain itu bagus semua
barang lengkap
seler cekatan 
makasih lazada and seller bakal langganan😘",5
"bagus realpict, tpi bahan nya tipis sesuai lah sama harga nya, minus nya gadak tmpat penyimpanan uang koin",4
"alhmdulilah barang nya udah nyampe,, dan sesuai pesanan,, mkasih lazada & mksih juga abang kurir nya,, belain ujan""n nganterin pesenan sya.. udah langgan ramah baik,, sopan lgi.. top dech..",5
Alhamdulillah pesanan udah smpi  tp sayang g ada tempat koin. tp gpp semua bgs n kurirnya jg baik udah langganan mksh lazada. ,5
"dompet ny bagus banget😍😍😍saya suka,,pengiriman ny lama banget...agak kecewa dkt...TPI gpp la barang ny bagus😘",5
"pesan wrna biru muda tpi yg dateng wrna salem, untung wrnany bagus jdi g trlalu kecewa, terimakasih😊",4
barang nya ok.abang kurir nya jga baik ramah maap blm sempet di poto dompet nya.soal nya dompet nya lgsg di ambil sma kk aku,5
"alhamdulillah sudah sampai. barang realpict. recommended bgt pokoknya. kurir ramah, pengemasan oke .",5
Paket nya udah nyampe tp ko aku mesen warna hitam sm Pink ko dikirim nya malah dua2 nya warna nya hitam sih padahal aku dah ngomong dikirim nya jangan sampe salah kata nya ok tp Kenapa salah gini sihh nyesel tauu 😑😒😒,2
kurir nya ga ramah masa barang asal narik dia sendiri yang tau alamat die yg mareh ... barang lumayan lah dengan harga segitu,3
alhmdulilah barng sesui dengan gamabr .kiriman nya juga lumnyan cpt gak lama .poko nya gak nyesel deh belanja di toko ini .,5
"dasar kurir koplok,, kan ada no hp tertara 
di kirim ka orang lain emank sama namana tapi liat no hp,",5
"alhamdulillah barang datang dengan baik,  sesuai gambar,  dan pengiriman cepat .. pokok lazada toop dehh...  uda langganan juga mksh 😊😊",5
"Alhamdulilah barangnya sudah di terima,maaf baru kasih ulasan makasih lazada barangnya bagus dan aku suks",5
"Alhamdulillah barang'a da sampai domper'a cantik ni da kali kedua sya beli , kurir'a jga ramah . Terimah kasih lazada pertahankn ",5
"Alhamdulillah real pict 👍👍,Nex order lg thanks seller dan lazada 😊",5
barang nya bagus sesuai pict,5
"Alhamdulillah...dompetnya bgs,thx lazada.kurir dah langganan,thx for all the best.

",5
"bagus, real pict",5
trimakasih kk langganan deh,5
KATA TEMAN SAYA BAGUS WARNA NY SESUAI DAH TIDAK ADA YANG RUSAK SEDIKIT PUN POKOK NY AMANAH BANGET DEH😚🥰,5
komplit gk ada yg kurang pas 16pcs thankyou,5
mf bru ksih ulasan...brangnya bgus sesui gmbar dan wrnya mksh lazada ..dn mas kurirnya baek,5
trimakasih recomend banget,5
"Bagus barang ya, agak kecewa soal ya datang ya lama tpi gpp kurir ya ramah ko. ",4
sesuai pict👍👍,5
"dompetnya udh sampe. maap baru ngsih ulasannya skrng.. barang oke. cma bahan tipis tpi segitu mah pas lah sama harganya.. 
suka lucu dompet nyaa.. makasihh",5
bgs bnget sesuai dengan gambar dan pesanan,5
"barang nya sudah sampai,alhamdulilah sangat memuaskn dengan harga segitu,realfic bangett,makasih seler",5
maaf baru ngasih ulasan soalnya sibuk banget... dompet bagus banget saya suka banget.. udah itu kurirnya ramah sekali. terima kasih lazada sukses terus... ,5
"sudah 3 x pembeli dengan jumlah yg gak sedikit, sumpah barang nya real pict banget, harga sgtu tapi barang nya gak kelihatan harga sgtu ",5
barangnya sudah sampai..sesuai gmbr lumayanlah buat harga segitu..pengiriman cepat kurir ny juga baik trmksh lazada 😄,5
thq kak barang nya real pick ya .. untuk pengemasan sangat simple sih hehe tp gpp thq banget sudah smpe dengan selamat .. 😗😗,5
map baru kasih ulasan.dompetnya bagus tebal lg tapi sayang kenapa ada jaitan nya g rapih yh terus dompetnya jadi bolong lagin.kurirnya ramah lg,5
"Paket dha sampai td siang barang ya sesuai la ya ma harga realpict jg ma gmbr pengiriman ya lmyn cpt jg mksh tuk seller,mksh lazada & mksh jg wat mas kurir ya  Alhamdulillah sllu snng belanja d'lazada 😊",5
"dompet nya realpict banget, tapi lagi"" di buat kecewa sama abang kurir nya, masa harganya 16rb tapi minta nya 17rb, bukan masalah selisih harga nya, tapi abang kurir nya gak jujur aja, di bulan suci begini masih gak jujur aja ",5
"bagus, sesuai dgn gambar dn salut dgn abang kurir mlm"" + hujan""an msh sempat""nya untuk mengantar. trmksh(:❤️❤️",5
"Guys siapapun yg ingin belanja ketoko ini saya harap urungkan niatnya sebab saya merasa ditipu memang harganya gak seberapa tapi caranya saya kecewa. saya pesan 5 barang yg datang cuma 2 barang keren kan???? tapi pas di komplen si toko gak terima merasa bener toko dia. lucuuuuuu 
",1
realpict makasih ya ka dompetnya imut2 ,5
"Kerennn real pict, mamah saya suka👍👍",5
"dompet nya bagus,lucu sy suka tp sayang pesen warna apa datang warna apa tp gpp si sy suka dompet nya makasih lazada



",5
"agak kecewa soalnya bagian bawah dompet nya bolong, jadi terpaksa aku bawa ke tukang jahit agar bisa di perbaiki",3
"barang nya sesuai dengan pesanan Terima kasih sukses selalu buat lazada dan abang kurir nya juga ramah

saya suka banget barang nya.. ",5
"alhmdulilah sampai detik ini gk pernah kecewa blnja di lazada, kurir nya baik makasih buat smuanya lazada ",5
"Barang bagus, kurir ya juga baik Gak nyesel deh belanja di lajada memuas kan, barang ya juga cepat dtng, pokoh ya gak nyesel belanja di lajada",5
"Barangnya bagus sesuai di gambar,oke lah harga segitu,buat kurir nya jga baik dan ramah,makasih lazadaaaa😍",5
Barangnya bagus tp knp sy mesen warna kebiru2an gitu ehh ternyata yg dtng mlh Pink tp gpp lah mksh lazada dah mas kurir ☺️🙏,5
dompet nya bagus keren saya suka..tapi tulisan korea nya jafi kerea..itu ngledek aph gimna..wwkwkwk sory canda,5
Terima kasih lazada dompet nya mantul kga kecewa deh belanja di lazada dan terima kasih juga buat abang kurli nya.,5
"bagus bgt,tp dipemberitahuanya uda diterima kemarin padahal datang nya skrng hmm,mksi toko ini amanah bgt sm barang nya,😇terus kaya gtu😇💪",4
good bgt dompetnya syg g kefoto langsung di bawa adek,5
"makasih kak barang udah sampe,bgus sesuai gambar 👍",5
bagus aku suka dan kulirnya ramah,5
Aaaaaaa suka banget dompetnya real pict pengiriman juga cepet,5
Bagus sekali😍😍 saya suka saya sukaaaaa😍😍,5
"bagus bgt dompet'y,,cm lamaaaaaa bgt pengiriman'y..biasa kurir baik ramah",5
Sangat kecewa ,5
bagus banget👍🏻,5
"mantap dech ⭐⭐⭐⭐⭐
",5
"Lucu banget ak suka ❤️,gemoyy gitu",5
".barang nya lumayan bagus buat harga segitu mh
 cuman pengiriman agak lama",5
real pict sesuai pesanan🤗,5
suka banget real pict,5
"pengiriman agak lm,tp brang bgs kok,mksh y",5
Bagus banget real pict😍,5
"Bagus , saya suka....puas ngeliat nya",5
"Alkhmdllh.... paketan udah dtang,  brangnya lumyan bagus. aku suka banget trimakasih lazada,um kurir'y jga ramah",5
"cream yg ini beda dgn yg saya beli di toko lain,,kya gak ori..stlh aku pakai kok muka saya gk ada perubahan malah perih,panas sama gatal dan bruntusan..skrg sudah pemakain satu minggu msit ttp aja gini..malah kriput gk karuan",5
"Dompetnya bagus, sesuai gambar harganya jga murah pokoknya puas deh belanja di sini😍😍😍",5
untuk penampilan sesuai gambar.. hanya bagian dalam kurang bagus si.. tp klo hanya untuk nyimpan kartu sih ok.. kualitas sesuai harga..,4
"Thank lazada, sejauh ini sih lumayan sesuatu harga kualitas lumayan bagus warna sesuai yg diinginkan hanya saja saya kecewa dibagian bawah nya bolong dikit tapi yaudah si sejauhnya baguss🤗",5
"alhamdulillah paket sdh sampai,bagus ",5
"Uwahhhhh bagus banget real picture ,cepat banget sampai nya , terima kasih seller dan lazada , makasih pa kurir nya juga ",5
"sesuai gambar , bagus memuaskan pengiriman nya juga cpet , trimakasih lazada 🤗",5
Realpic barangnya asli gk mengecewakan... Hrga murah tp gk murahan & cpt smpai nya + kurirnya baik& ramah,5
"uuuuwaahhh barang nya cepet banget sampainya baru kemarin pesan tadi pagi udah sampai , bagus banget real picture, packing rapih terimakasih lazada dan seller ",5
"mungil, bagus, suka aku.. thnks ♡ pengiriman cepat bngt",5
"real pict dompetnya bagus,kurirnya jg udah langganan tapi sayang pengirimannya lamaaaaaaaaaaaa bangeeeeetttttttttt",3
"bintangnya 4 ajah cz dompetnya kurang sempurna cz ada bolongnya dikit dua""nya lg bolong sama warnamya pengen item tadinya satu tapi duanya abu.. tapi tetap suka bangettt sama modelnya bagus..lucu... ttp suka pokonya..",4
pengeriman cepat dan bagus dompetnya aku suka gak nyesel pesen disini nanti mau order lagi warna lain dan kurirnya juga ramah makasih lazada ,5
"bagus barang nya.kulir nya kulir lex jadi gak nyampe rumah kebiasan
saya ngambil nya harus jalan lagi mana jauuh ",5
"thanxyu lazada, duh dompet nya lucu banget di bayangan akutuh biasa aja namannya harga segitu, ehh tau2 bahan nya lembut, terus gantungan nya itu lucu duhhh super duper terkejut aku😍 dan pengirimanya sesuai perkiraan cepet banget, kurir nya juga ramah, thanxz lazada semoga selalu amanah",5
"terimakasih pesanan sudah sampai
saya kira dompet nya sedang e kecil ya, kurir baik terimakasih lazada",4
"Dompetny bagus bangettt sesuai dengan gambarny pokony gk kecewa makasih LAZADA,,,kurirny jg udah langgan lg makasih😊😊",5
paketnya sngt cpt datang nya barangnya rapih dan kulirnya ramah tq lazada:),5
dompetnya jelek banget beda sama yang difoto bikin orang nyesel aja pernah blanja di TOKO ini,1
alhamdulilah dompet nya lucu saya suka..lumayan buat nyimpan kartu atm ma ktp..buat bang kurir nya maaf yah tdy dtg k rmh gx ada soalnya pda tdur jdy gx dnger..thanks lazada ,5
Barang dh nyampe kemasan rapi real pict...aq suka wrna ya jga sesuai permintaan top lah bt kurir ya top jga mksh lazada,5
thx barang realpict pengiriman sesuai,5
"Barang bagus banget, saya suka 
Alhamdulillah tidak prnah kcewa..
Barang jg sesuai dngan pesanan.👍👍",5
barangnya mantul sesuai gambar,5
bagus sekalii,5
mantul bahan nya ,5
"dompet nya realpict suka bnget terimakasih swmoga menjadi toko yg amanah 
kurir nya juga baik",5
"dompet nya bagus banget, pengiriman cepat 😊",5
intinya gapernah ngecewain 😍,5
"udah 3kali beli disini gapernah ngecewain, barang nya realpict bangetttt😍",5
bagus dompet nya real pict suka pokonya😍 sesaui banget lucu simpet juga ngga terlalu besar pokonya cocok lah 👍😍 pengiriman nya juga cepat sesuai estimasi 👍👍,5
makasih lazada dompet nya oke.. aku sangat suka,5
"dompetnya bagus,kurir ramah pasti",5
Alhamdulillah puas🥰☺️☺️,5
barang nya bagus bngtt😍,5
Cantik dompetnya aku suka😊,5
makasih lazada barang y cantik lucu lg,5
"sesuai harga, aku suka. kurirnya juga ramah",5
bagus banget,5
dompetnya cocok bgt,5
"mantul bgt real bgt , pokoknya love bgt 😍",5
suka banget😍😍,5
"mayan lah, love-!",5
