review,rating
"Barang lengkap, semua sesuai pesanan dan alhamdulillah jam nya jg berfungsi dengan baik ..
Seller jg ramah & fast respon, mantapp",5
"Thanks seller entah udh orderan keberapa tapi slalu puas ..
makasih ya kurir nya juga udh langganan.",5
"mantul..sangat sesuai gambar terimakasih lazada dan mas kurir walou panas"" san tetap amanah sukses terus y",5
"paket dh mendarat barang realpic,kl cm wt simpan uang sm kartu ok bahan bagus resleting tebal,tp kl untuk simpan hp ukuran vivo series g muat terlalu sempit,tp barang ok pelayanan ok kurir ok👍👍👍terimksh sukses trs smg sllu amanah wt lazada,toko,penjual N kurir👍🙏",5
dompet nya lucu cantiik,5
"barang bagus, gk ngecewain... sukak dgn harga segitu👌
kurir ok, cocok dehh",5
Harga terjang kau .dompet nya bagus .😊makasih ,5
minta lain warna malah wrn item semua tp gpp lah bgs sesuai harga,5
bagus banget dompetnya realpict sesuai pesanan,5
"digambar kelihatan besar tapi...aslinya kecil,,tapi... gak papa saya suka kok,,❤️💓",5
biar bintang yang berbicara karna bagus mantap semua suka dompet nya makasih lazada,5
"brangnya bgus lah, dgn harga segitu, mkasih lazada sukses sll, buat mas kurir jg mkasih",5
"barang dah smp..dg slmt tnp cact..bgus pula..mksh lazada...jd langganan.....
",5
"pesanan sudah datang MAAF baru kasih ulasan, barang yg bagus banget ...
Saya suka banget .....😘😘",5
tasnya bagus dan kurirnya baik ramah.. top deh lazada..,5
"barangnya udah nyampe, lumayan lah sesuai harga, kurir udh langganan, thanks lazada",5
realpict bnget. pokoknya😍😘 deh,5
"barang sesuai pesanan thx lazada kurirnya jg ramah&langganan
",5
bguslah sesuai harga...,5
Mba gimana sih saya pesen 6 warna beda beda ko yang Dateng pink semua udah pesenya banyak lain kali di cek dulu donk,5
"ini gimana pertanggungjawaban nya , paket gak dateng , lain kali kalau kirim paket harus teliti pesennya apa aja , di bayar udah tapi dompet nya gak di kirim aneh !!!!
",1
"ini entah orderan keberapa pokoknya selalu puas sama dompet nya 😘😍
cust saya pada suka .
pertahankan kualitas produk nya yaa dan proses pengemasan sampai pengiriman TOP BGT 👍👍",5
"bagus dompetnya,,cmn buat hp gk bs kegedean hpnya😁😁😁",5
alhamdulillah paketnya udah sampe.. pengirimannya juga cepat.. sesuai pesanan lgi.. terimakasih lazada,5
bagus,5
"bagus bgt untuk harga yg super murah,, tp sayang baru beli dompetnya hilang entah kemana😭,,pdhl aku suka bgt pas buat naro hp Oppo a37",5
alhamdulillah barang sampe.. padahal baru kmarin pesen eh skaranh udh sampe aja. kurir nya sudah langganan. makasih Lazada,5
ke 3 kali nya aku pesen barang bagus sesuai dengan😍 yang di pesan dan beli di sini gak akan kecewa😊,5
".  pengiriman lumayan lama,  bahan oke banget.. 
Cuma aku ga trlalu suka sma model seleting nya akhir nya aku buka dan aku gnti pke gandulan doremon..  Overall aku puas banget...  Thanks seller and lazada",5
"Terimakasih ka.., paket pesanan sy sdh sampai, & bagus jg dompet biru ini sama sperti dompet ungu & orange yg sy pesan sblm yg biru ini ka.., & kurirnya baik jg ramah.. Selamat sukses RK Fashion & Lazada..😍😍👍👍",5
"thx lazada barang sdh mendarat dgn bagus,sesuai dengan pesanan,gk ada yang rusak pula,thx Lazada&Seller",5
"Terimakasih Lazada paket pesanan sy sdh sampai & bagus jg semua pesanan sy di Lazada.., & kurirnya jg baik.., selamat sukses Lazada...👍😊",5
"Terimakasih ka.., dompet yg sy pesan sdh sampai & sngt bagus dompetnya sesuai dg yg sy pesan & inginkan.., serta kurir pengantarnya jg baik.., selamat sukses RK Fashion (Lazada) 😍👍🤗",5
saya mesen 10 dompet panjang cuma di kirim ke sis cuma ada 9 dompet panjang sisa kekurangan 1 dompen lagi kemanahin saya mau pulangin dompet sisa kekuarang dari sis kalau dagang harus jujur dong supaya pelanggan enga marah sm sis ,2
"paketnya sampe & ga ada yg kurang , tokonya amanah ..
nanti langganan beli di sini lagi , makasih ..",5
dompet nya bagus cm klo buat hp ga masuk pdhl sy beli biar bs muat hp hrs d paksain baru masuk hp terlalu pas ukurn dompet nya.,5
"pengiriman y agak lama ,tapi sesuai pesanan , kurir y ramah,kurir y jg  udah langganan,makasih lazada,makasih seller
aku kasih bintang 3 dulu ya ,😊",3
"kalo,,DOMPT yg ini mah gak di Ragukan lagi....Udah prnah psan 3 warna,,,Suka sx,,,Bhan nya lembut dan menurut saya imut..😘😘😘😘Suxses Slalu",5
dompet nya cantik manis pas d🍎 aku tank lazada cocok jadi langgananku shopping.kurir ramah bay.🍒🍇🌶🍅🍓🍉🍎🍊🍏,5
"memuaskan ,pesanan sesuai ,packingan rapi,trimakasih lazada,trimkasih seller,trimaksih jg buat mas kurir",5
top  top banget  2 hari langsung nyame  dompet nya bagus aku sukaaa banget  cukup     buat nyimpen hp     kartu poknya  mantep    makadih pa kurir yng ramah  N sukses tuk seler dn lazada🖒👌,5
terimakasih Lazada...  paket ny sdh smpai bungkus ny rapi tp warna ny tdk sesuai dgn pesanan... bahan ny relpic.. yg di pesan 5 warna yg datang merah semua...  buat abg kurir nyb baik krna sdh langganan,5
"paketan sudah sampai lebih satu hari dari waktunya
barang sesuai pesanan aku suka
kurir baik ramah sudah sering antar juga jadinya kenal",5
Suka bgt sm dompetnya,5
"mayan harga goceng.. icikiwir
",5
"dompetnya real pick bngt sellernya juga ramah ,,jangan ragu belanja d toko ini",5
"bagus dompetnya,Sipdah😆",5
bagus next order lagi,5
udah sampe thx lazada. warna pink ny kok aga keunguan hehe gpp..warna sesuai pesanan,5
"cocok lah pokok nya,, thanks good 👍",4
bgus bnget mksih lazada kuriny juga rma.. ,5
alhamdulilah barang nya sudah sampai.. dompet bagus kurir nya juga ramah tq lazada,5
syantik bangetzzz cepet lagi sampe y,5
Barang nya dah nyampe barusan sesuai harga dan kurirnya ramah dah langganan..trim Lazada,5
udah di gantung donk..makasihh ,5
pouch kartu nya sangat bagusssss....sayang aja datang nya di lipat jadi 4...,5
mantul. makasih lazada. ,5
bagusss dompet nya.....trimsss buat bang kurir yg udah bolak balik antar paket nyaa ,5
"Alhamdulillah paketnya sdh sampai, sy suka banget dompetnya bagus, psn kmren hr ini sdh dtg, respon n pengiriman nya jg cpt, kurirnya ramah sdh sering antar paket ke sy, mksh seller n lazada, smg kedepan nya terus lbh baik dlm pelayanan ke pelanggan n konsumen lain nya, sukses ya",5
"barang telah diterima . pengiriman cepat ,paket dikirim dengan rapi dan  bahan recomended sesuai ekspetasi . terimakasih ",5
"makasih seller...barang nya dh smpe,sesuai yg aq pesen..TK mengecewakn🤭🤭barangnya bagus dngn hrga segitu .aq suka mksih ya seller RKFashion,mksih jg bwt ms kullir nya dh langganan😄",5
"paket nya udak meluncur.. semua warna sesusi pesanan. tpi bingungnya yg orsnge, masa oramgd ngasinya merah trus?? ",5
dompet nya sih lumayan tapi sayang kga pas buat taro hp sya .sleting nya terlalu kecil dompet dikira sya dompet nya pnjng muat naro hp sya.,4
"ke dua kalinya aku pesen di sini,  aku pesen 3 bagus semua gak ada yang rusak ataupun sobek, bagus , sesuai dan gak bakalan nyesel beli di sini sesuai lahk dengan harga, respon seller baik banget, kurir ramah banget ",5
bagus aku suka sesuai pesanan tapi agk kcil ya dompetnya tpi gpp ttp suka pngrimn cpt kuril rmh respon pnjual baik,5
Yg ini saya mintaknya di campur warna. Kenapa di kasih item semua kk.. Lama banget pula datangnya paket,5
"barang nya bagus realpick,tpi sayang saya di ksih nya tali nya yg hampir mau putus
lain kali sebelum di packing di cek dlu ya",4
Trimksh dompetnya dh sampe cepet pengirimannya n sesuai gmbr...trimksh juga lazada n kurirnya...🙏TOP pkoknya,5
Yeeayyy..barang bagus dengan harga segitu sangat waowww..puas banget belanja disini..thanks lazada..,5
"dompetnya bagus,, real pic.. makasih lazada",5
tas nya ok sesuai pesanan g mengecewakan pokonya puas,5
Alhamdulillah realpict. Cuma kecil aslinya 😁. Tapi wajarlah sesuai harga,5
alhamdulillah smpe.m walau agak lama.  tapi paham mungkin lg pada cuti,5
maaf telat barangnya bagus,4
"sy kira dompet'y agk besar, g tau'y kecil hp sy g msk",5
👍👍ok dn bagus tpi sayang GK muat buat hp saya.,5
bagus realpic,5
puas bagus barang nya,3
memuaskan. bahan nya bagus,4
cantik kata pelanggan saya 😊,5
"tasnya cantik dn imut cocok buat tempat hp dn mksih sama kuriny yg mngantar barangny dgn baik
",4
barangnya bagus dgn harga segitu👍,5
bagus aq suka,5
"cakep barangnya,memuaskan.",5
g muat d hp,5
barang nya Bagus banget mamah aku suka banget😍😍😍 makasih juga buat mas kulirnya😇,5
not bad lah..,5
"dompey nya bgs
",5
bagus sesuai gambar dompetnya terimakasih lazada,5
"tengkyu,realpic...",5
g nyangka ini dompet hrg murah tp dompetnta lumayan bagus.. bahannya elastis... cuma pengirimannya lama...,5
Harga murah banget tapi kualitasnya mantap👍👍👍 tapi sayangnya dompetnya buat hp oppo gak muat tapii gpp.. puas banget pokoknya dengn produknya,5
ikrain kecil ternyata besar jg...alhmdulilah..syg cuma beli 1...semoga g naik harga ya haahaaa mau beli.lg,5
kirain sy dompet y tebel kya pernah aku beli ternyata tipis bgtz ya sudahlah terimakasih buat kurir y,2
sudah sampai dompetna..bagus dompetna..trims buat tokona yg dipesan sesuai dgn pesenan..utk lazada masih sama dgn pengantarna mbak2na..sukses buat 22na..,5
barang bagus dan keren ,5
alhamdulilah..dompet nya bagus..pengiriman jg cepet..terima kasih..,4
barang nya sesuai terimakasih  lazada ,5
Bagus saya suka...Pengirimannya jg cepet. Trmksh lazada...,4
"Lumayan sesuai harga dan berguna,untuk kurirnya baik sudah berlangganan,sampe hapal rumah'nya mksh👍",5
"barang sampai kemarin.. nitip tetangga, karna akunya g dirumah. dengan harga semurah itu. g percaya. terimakasih lazada, terimakasih abang kurirnya yg ramah dan sabar.",5
bagus bagus banget walo harga murah tapi gak murahan pokok nya oke banget gak kapok trimakasih selera semoga laris manis tengz juga buat abang kurir nya juga lazada 👍👍👍👍👍👍👍👍👍,4
"Barang sampe dengan baik, sesuai pesanan,, respon seller baik,, makasih buat seller,, lazada,, dan kurir nya yg udh langganan nganterin barang.. ",5
"barang sesuai pesanan,bungkus rapi,kurir biasa langganan ngirim,top dah toko nya....makasih ya lazada",5
buat kalian yg lagi cari dompet kecil bagus keren dan murah....aku merecomendedkan beli dompet ini..pokoknya lumayan bagus dan murah banget loh...ga nyesel deh....,5
"maaf br kasih ulasan,barang bagus cm kl untuk hp vivo series g muat sempit kl hny untuk uang sj bagus bahan jg bagus👍kurir ramah tank's lazada",5
alkhamdulillah suka bgt...,4
mf baru di ulus ya mf bgt barang ya mantap sama yg di gambar ya trs bg kulir y jga rama da biasa makasi lazada,5
Paket ny udh nyampe puas banget am dompet ny bagus banget dengan harga sgtu cocok buat djual lagi warnanya uga bener semua mksh lazadakurir ny uga baik ramah,5
aku sangt puas sekali dengn barang nya bagus.. kurrir nya baik ,5
"sgt kecewa kirain panjang dompetnya g taunya kecil beli tp g ke pake nyeseeel banget sy pesan ,,low cr gini cm ngabisin duit dan bikin mubajir kecewaaa banget ",5
"pengiriman lumayan lama ya,ini baru kali pertama saya belanja di Lazada biasa nya klo di olshop sebelah Mak 3 hari nympe ",5
sesuai dgn gmbr trimksih lazada,5
bagus terimakasih lajadda,5
"aku kn minta hitam sama merah,ko yg di kirim 2 2 nya hitam,uchhhh kcwa",5
paket dh nyampe kurir ny dh biasa anter. mksh lazada,5
"good..👍👍👍👍👍👍buat kurirnya sangat baik.
",5
lama pengiriman nya,5
"bagus bgt real pic barang dtng sesuai pesanan
recomend bgt bt toko ini
pengiriman cpt, kurir ramah",5
💕💕💕💕💕💕💕,5
dompet nya bgs,5
"pengiriman cepat,seller jg ramah,produk baik,makasi",5
barang nya bagus .....gak kecewa blanja di sini ....,5
"dompetnya sih bagus tp hp aku gk masuk 😴
",4
Dompetnya cntk bgt mn murah lg Mksh Lazada 👍👍👍,5
Bagus untk hrga semurah itu...,5
Barang nya bagus sesuai sama yang d gambar . Tp kecewa nya sleting nya pendek . Jdi ga bisa masukin hp ,5
"realpich,  brng sesuai yg d poto tdk mengecewakan, mksh bwt kurirnya udh langganan,, mksh jga lazada. 
",5
"Barangnya bagus, dan warnanya sesuai banget sama yang aku pesankan, pokonya mah cuco, terima kasih lazada🙏😋",5
paket nya udh dateng mskasih y bapak kulir bli d lajada barang nya sesuai pesenan .asik nya udh jd langanan sukses sllu buat lajada.. ,5
"assalamualaikum,barangnya sudah sampai tapi tidak sesuai permintaan putih kirim biru tapi gpp,barangnya lumayan bagus dgn harga murah makasi",5
mf bru kasih kbr tasnya udah nyampe tpi kekecilan d lihat d gambar aga besaran dikit tpi ga apa2 semoga sukses mksh abang kurirnya yg baik,5
dompet ny sudah sampai..ku kira agk tebel ternyata tipis bnget tp gk apa2 deh ku suka warna nya.thnk lazada,5
trmh ksh lazada.brg sesuai apa yg sy inginkan.pengiriman CPT.kurir baik dan sbr wlwpun muter2 nyari alamat rmh tp kurirnya ttp sbr🤗,5
"Dompet'y bagus untuk kurir'y baik dah langganan sih tuk Lazada tingkatkan kualitas produk...pengiriman jg cepat
",4
"bagus, alhamdulilah udh sampe barangnya, cepet bangett pengirimannya pesan kemarin malam hari ini sampe, pokoknya puas deh belanja disini>< ",5
makasih buat lazada barang ny udah datang walaupun kecil lumayan lah buat kepasar walaupun ga ketemu ama kurir ny tp makasih ya,5
bahan nya bagus tp sayang ternyata ukuranya kecil ..kurirnya baik udh langganan...trima kasih lazada,5
"allhmdulillah paketan nya sudah sampai
dompetnya jg bagus aku suka mksih Lazada mksih abang kurirnya jg ramah baik",5
"Alhamdulilah dah sampai paket nya , Terima kasih  ,pengiriman nya cepat , thanks untuk toko dan kurirnya Terima kasih Lazada",5
Maaf bru kasih ulasn.dompet yh bagus sesuai d fto dn harga yh.mksh lazada slu kasih yg trbaik pd pelanggan yh.,5
Maap br ksh ulasan mksh lazada barang nya bagus sesuai Poto kurir nya baik dan jg ramah Mantup banget,5
sngt bagus tas nya sy suka bngt br x ini belanja sngt memuas kan jd pengen belanja lg makasih lazada ,5
"barang nya baguuussss😉 mas kurir nya udah langganan, makasih mas kurir bela2in nganterin barang walau ujan2an...",5
"Harga murah 
Tapi kwalitas nya oke
Dlm nya ada puring nya
Saya pesan semua wrna
Alhamdulillah pas
Gak ada yg kurang
Pengirimannya juga cepat

Makasih ..",5
"Barang sampai skrng belum diterima, di lazada udah diterima aja kurirnya gak jelas sudah di WA tetap gak ada respon jadi males belanja di lazada, baru kale ini belanja kecewa bgt. ",5
"Barangnya sdh kami terima.
Barangnya bagus sangat memuaskan.
Pengirimannya pun sangat cepat, dan mas kurirnya juga ramah sekali. Pokoknya puas deh........
",5
"Keren dengan harga segitu ,, pengiriman cepat dan kurir Sangat ramah terimakasih ya pak kurir dah sering nganter kerumah",5
"Suka banget bagus banget dengan harga segitu cepet pula,, yg paling seneng sama kurirnya dah langganan sangat ramah suka banget sama kurirnya ",5
bagusih sayang ga bisa random jadi warnanya sama semua,5
 bagus kak bahan nya lumayan,5
order yg ke dua tetep puas..,5
"lumayan buat kepasar ikan dibawa"" 😊",4
siiiiip barang nya bagus smoga toko nya slalu amanah trus ya abang kurirnya jg ramah ,5
Bagus syuka ,5
barangnya sampe dan bagus,5
"pokonya is the best, sesuai pesenan👍",5
"bagus real pic, datang sesuai pesanan
mksh seller & lazada",5
barang.nya bagus sesuai gambar kurir.nya juga baik udah lngganan ,5
"barang bagus 👍👍👍👍👍👍👍👍👍👍👍👍👍👍👍
",5
puas banget,5
biasa aj tas nya..,5
"Pouch hp nya bgs saya suka ,sesuei gambar,kulitnya juga baik.mskasih Lazada",5
"real pick sllu puas blnja di lazada pengirimannya  cepat 
",5
lumyan tq ...,5
"mantaf sangat luar biasa makasih lazada
",5
brg bagus pi agak kecewa,5
puas dan bagus barang nya,5
makasih lazada top deh...,5
Alhamdulilah barang sudah sampai kualitasnya bagus kurirnya ramah mksh... 😊😄,5
sesuai san Bagus tapi ga muat buat tempat hp kekecilan mksh lazada n kurirnya pengiran nya cpt sekali aku suka... ,4
kak klu kirim barang mohon dipriksa yaa karna ad dua yg sobek 😔😔tapi dompetny bagus🖒🖒pak kurinya baik ,3
"makasih dompetnya kaka, gak nyesel deh langganan disini. cuma yg ini rada kecilan tpi gpp lah, next bakal order lagi",5
pket nya cpet kurir nya ramah karna udh biasa. dompet nya jga bgus tpi syang sya psen 3 tpi warna nya sama ajh. ,5
"Alhamdulillah, cpt smp dompet ny, terima kasih",5
"Alhamdulillah, barang sdh diterima dlm keadaan baik, tidak ada cacat, lumayan dompetnya buat sehari”, dan pengiriman jg cepat, kurirnya baik, terimakasih kurir dan seller ",5
"Bagus bangetttt barangnya, sesuai pict 
Harga nya juga murah taoi barang gk murahan, kurir ramah krna udh langganan, mksh seller bang kurir n lazada😊",5
"alhmdulillh brang sudah mndarat,pngirimanya bnr"" cpt.brangnya realpict pokonya top markotop deh,sesuai psanan pula.mkasih seller & pak kurirnya...",5
Pengiriman sangat cepat sampai. Barang bagus jahitan rapi. Hanya ukuran kecil ya. Yg akan datang mohon ukuran diberpesar spy masuk Hp yg 5.3 inchi dan uang kertas yg diluruskan,5
"Bagus saya suka. Hanya ukurannya kecil ya. Kalo bisa kedepannya ukuran diperbesar, spy HP 5.3 inchi dan uang kertas lurus bisa masuk",5
"sudah tiga kali pesan,  bahan bagus semua sesuai gambar,  pelanggan ku pun banyak yg pesen. suka. 
makasih lazada
",5
Bagus persis kya di gmbar kren..mksh seller nn lazada..buat abang kurir nya sprti biasa dh langganan..,5
Sore saya pesan dompet ini 3barang tapi dikirim lewat paket cuma 1 barang saya rugi 2 dompet. Gimana ini.  Warna dompet pink. Sehrsnya sesuai dgn pesanan saya 3 barang ,5
SORE saya pesan dompet ini 3 barang tp di kirim lewat paket cuma 1 barang rugi 2 barang lagi. Dompet warna  orange sehrsnya sesuai dgn pesanan saya 3barang ,5
Dompet nya sangat bagus dan memuas kan lah harga murah kwalitas nya sangat bagus pokok nya mantaff banget ,5
Makasih lajada barangnya sd sampai lumayanlah barangnya sesuai harga maaf br kasih ulasan jarigan tdk bagus dan kurirnya baik dan sopan,5
"Barang dh smpe 2 hari yg lalu,maaf 🙏baru ksh ulasan,barang sesuai di gambar,bwt mas kurir'nya kurang ramah..mksh Lazada tetep slalu pertahan'kn kwalitasnya y,jgn mengecewakan pelanggan😉",5
puas bgt deh bagus!cuma sdkt aja kecewa krn minta hitam dikshnya navy!tp btw bagus bgt aslinya ga nyesel belinya jg ,5
"Dompet sesuai pesanan,,, pengiriman nya Cpat cuma 2 hari barang udah dtng barusan sore,,,thanks lazada",5
maaf baru beri ulasan.. barang ny bagus sesuai gambr pengiriman cepat kurir ny baik ramah maksih lazada,5
"realpict...keren. resleting lancar...good seller.
kurir good.",5
bagus dompetnya 😍,5
Keren lah pkoknya warnanya cantik...trimksh tk toko...lazada n kurirnya..🙏👍,5
barang oke.... ,5
Bagus dompetnya tp hp ku ga masuk (samsung A10)😭😭,5
"realpict asli ga nyesel,, harga Murmer kualitas ga murahan... syuka bgt pokoknya ☺️☺️",5
d chat minta warna navy sama warna merah malah yg datang navy 2-2nya ,2
alhmdllh paketnya udah sampai. lumayan dompetnya bagus juga dgn harga segtu,5
teeimakasih lazada..,5
👛dompet bagus banget makasiya lazada👍,5
alhamdulilah paket nya nyampe.. pas ada 20 pcs. terima kasih.😄,5
harga segtu okelah.... mksh,5
"paket ny udh dtng ,suka banget ....mksih lazada ",5
"mantul,  Bisa d jual lg",5
lumayan bagus tidk ada cacat aku suka,5
bagus lah dngan harga segitu mh....,5
"Alhamdulillah, barang nya bagus pengiriman cepat, untuk harga segitu udh bagus.
semoga sukses yh.",5
"terimakasi seller, terimakasi lazada,terimakasi ninja ekspres. sesuai orderan ",5
"pas sesuai pesanan dan harga,good kurir good seller",5
Alhamdulillah barang sesuai realpick👍,5
barang bagus banget,5
"Alhamdulillah udah dtng sy suka sekali pokonya bagus ga nyesel kurir nya juga ramah 
",5
"murah si murah tapi dompetnya sobek dalemnya
",5
"Yeay paket sudah sampai,kurir nya jga ramah,dah langganan makasih lazada",5
bgus bhn lentur tdk kaku..,5
Paket dah nyampe. Bagus aku suka..makasih. abang kurir nya baik,5
"mksih lazada suka sekali,krn hrg tdk akan bz mnipu😍",5
"mf ya bru ksh ulasan.
brangnya ok realpict. makasih seller, makasih lazada.pokonya top deh",5
"murah tp gk murahan, bermanfaat pokonamah",5
bagus bngt aku suka,5
"bagus

bagus",5
alhamdulilah paket ku sudah sampe bagus sekali dompetnya aku senang pas klu buat hp,5
bgs realpict,5
barang sesuai harga lah,4
"bagus bahannya modelnya saya suka 
pelanggan saya juga suka
trima kasih... pengirimannya jg cepet",5
"Puas bgt, semua sesuai pesanan, makasih seller dan kurir, good job 😍",5
"pokoknya sesuai mantul ,mksh jga buat kurirnya",5
bagus sesuai gambar mksh y lazada moga2 awet dompet nya y,5
Alhamdulillah paket nya udah sampe bgs... And kurir nya bk udh biasa nganter paket k rmh... ,5
mantap sih sesuai di posting,5
"bagusss...sesuai deskripsi.goodlah poko'nya
",5
bagus banget dompet nya,5
Kirain gede bgt tasnya ternyata kecil naro hP sempit gak muat bnyk kurir udh langgan tks lazada,5
realpict bgs...mksh lazada&seller.as kurirnya baik,5
alhamdulillah paket nya dah dtng.. barang okeh pengen beli warna yg lain nya  jg.. thanks lazada,5
"Realpick, semua sesuai pesanan. Abang kurir nya ramah banget, makasih",5
"ini order yg ke 2..  bagus banget kak 
sayangnya mak.cuma 5 ga bisa lebih",5
"bgusss bngt dompet hpny pc ukuranny ma hp aku,mksih lazada",5
"Kurir ramah, barangnya bagus banget bener-bener real pict",5
"barang realpick bagus banget.. alhamdulillah
kurir jg ramah krn sdh langganan
semoga berkah",5
brg bagus gk mengecewa kan costumer suka ,5
"pengiriman nya cepat banget, pesen kemaren hari ini udah sampai",5
Lumayan sesuai harga tq lazada,5
"top deh pokoknya,murah tp gk murahan,mantulllll",5
Alhamdulillah paketnya dah sampe real pict,5
bagus dompet nya sesuai sma gambar nya tpi hp samsung a 10 s ga muat,5
"barang oke sesuai harga, ",4
"bagus, barang nya sesuai gambar",5
makasih lazada dompetnya udah diterima ,5
pesan dompet yang ke 2 kali nya..dompetnya sesuai..makasih,5
bagusss...😉😉😉,5
real fick👍,5
bagus,5
brang alhamdulillah bgus,5
kalo yg ini bgs,5
bagus 👍,5
d,5
Realpick.. Dompet nyaa lumayaan dgn hrga segitu.. ,5
Sll bkin puas plnggan saya juga pada suka trims...,5
"Kerenn dompet nya, warna semua sesuai pesanan, harga murmer kualitas goooddddddd 👍💕",5
Mantapssss....bossss...sesuai..bintang yg bicara... ,5
"barang sesuai gambar dan baguss...
syukaa..
kurirnya ramahh..",5
keren banget,5
cepat pengirimanny,5
barang bagus sesui foto,5
alhamdulillah barang datang sesaui pesanan kak 😇,5
dompetnya bgs sesuai dngn harga kurirnya juga ramah  mksh lazada ,5
dah 3 kli oder ttp memuaskan..,5
dompet nya bgus bgt sesuai gambar lagi mkash lazada,5
paket nya sudah sampai bagus realpict makasih,5
mantul pesenan ke2 mendarat cepet....makasih yaa sist....,5
mantep  sesuai dgn pesanan nya.,5
mksh brg real pict.. mu order lg ahh. kurir nya jg ramah 😊,5
sya psen aksesoris gelang tpi yg dtang dompet dluan ,3
puaaaaaaaaaaaaaaaaaas  baaaaaaanget,5
"Mantul udh jd langganan.warna sesuai pesanan
",5
Mantap Kaka say realpic banget..😍😍😍,5
dompet nya bagus pisan...ga nyesel dh belanja d lazada😀😀😀😀,5
bagusss pengiriman cepat .trmksh lazada....,5
sangat puas belanja disini.. makasih kk,5
realpict.. tpi sayang lama banget datangnya paket,5
terima kasih walau pun agak lama tapi memuas kan,5
makasih barang nya bagus bgt seseay di gambar ga nyesel pokonya jangan ragu tuk order ya say..,5
bagus bngettt,5
"belom di buka v thanks barangnya udah sampe
",5
mantull.sesuai pensanan,5
"sudah brlangganan.. pkoke pol bgt 
buat lazada sukses
",5
"Kereeeennn dg harga murmer, tp kualitas mantul,, next time insha allah order lg",5
"paketane udah datang,, barang ok, warna juga sesuai pesanan,, thx lazada ",5
bagus sesuai pesanan dan harga mumer ,5
udah sampai bagus barang nya dan cpt lah ,5
ag kcewa pesenya yng bda2 warna.yng dtang mrah smua ,5
"dompet nya bagus saya suka 
kurir nya jga ramah baik hati",5
"Dompet nya bagus,,, walaupun murah tp tidak keliatan murahan,,, puaaaasss bangett",5
tengkyu 👍🏻,5
Mksh pkt nya sudh smpy,5
bagus..realpict..,5
dompet ny bgus lh dgn harga segto Mh kulir ny baik ramah solan Mkchhh lazada,5
barangnya realpict☺️gk nyesel belanja disini👍,5
Tooop banget dompetnya,5
realpict ,5
bagus😊,4
Good ,5
bagus sesuai harga,5
sesuay gambar,5
ok,5
👍👍👍,5
baguuuss,4
Barang bagus sesuai pesanan😊 ,5
bagus banget barang ya ..gak nyesel belanja d'toko ni ,5
dompet nu catik bngt mksiih,5
realpic 😍,5
lumayan,3
Top👍,5
"kurang bagus
",5
bagus dompet nya tapi mesen wrna orens yg di kirim wrna merah tpii gpp model nya bgus sesuai hrga,5
"Dompetnya bgus bnget,untuk hrga sgitu murah vpast d kantong,gampang d bwa pprgian,mksh lazada",5
bagus b as nget,5
"Ini bagus banget, ga nyesel ko",5
"sangat sesuai dengan di gambar bagus banget luar biasa dengan harga segitu, kusuka😍",5
Lumayan lah bagus...,3
"mama saya suka banget bahan nya kaya lembut lembut gituh
",5
bagus... penguriman cepet ... ,5
"Puas pokok ych belanja dsini,kurir ych jg ramah",4
mksh lazada dompetnya bagus bgt realpict.dtangnya tepat waktu.,5
"Aku suka sekali dompetnya,",5
"barang ok, sesuai pesanan..!",5
seneng bgeeet sesuai degan motif psananya,5
"pesanannya sesuai,dijual lagi langsung pada beli, terimakasih lazada",5
"Barang sesuai pesanan,sangat memuaskan beli di toko ini.",5
kirain dompetnya besar ternyata kecil tp lumayan bagus,3
Keren saya suku jujur ,5
saya suka dengan dompetnya bagus banget,5
Mantull Pouch Nya Kayak Kulit Sintetis Gitu Hehe Lumayan Lah Kalo Buat Di Jual 20rb,5
bagus terimah kasih lazada semoga makin sukses,5
"barang sesuai gambar. pengiriman Cepat.. love you lazada
",5
barang nya oke sesuai pesanan pengirimanya juga cepat mksh lazadah,5
"suka ma dompet'y,bgus",5
cantik mungil suka deh.. ,5
"saya sangat puas atas dompet ya sangat bagus sekali 👍👍👍👍👍👍👍  
",5
"bagus ,ga kecewa",5
bagus ko.. ,5
baguus amanah,5
mintanya oren kok d kasik nxa merah,5
barang oke ..murah lagi ,5
tas nya bagus kurirnya jg ramah,5
"hp ga muat resleting ny pendek maaf br sempet ksh ulasan 
kurir langganan 👍🏼",4
dompetnya bgus bahanya jg tebal ,5
Bagus Realfic,5
bagusya maap bru ulas,5
siiip....nant ak order lg,5
bgus sesuai,5
