review,rating
gak sesuai dengan yg di order kecewa...gak nyalahin lazada tp reseller nya yg gak punya barang nya to masih di pajang,1
"maaf gak pakai foto, sesuai diskripsi lapak anda. bekerja dg sempurna di tv saya. packing jg rapi menggunakan bubble warp. recomended seller",5
tidak sesuai pesanan,1
remot tv serba bisa tidak bagus tidak berfungsi dengan baik No good,1
ok barangnya,5
"kata nya sama Batre , tapi ko gak ada . .",4
remote berfungsi dg baik.pengiriman cpt dan kurirnya pun ramah.tks lazada,5
tob bingits mantul trims kak,5
tob bingits mantul trims kak,5
