review,rating
"produk yg sangat""baik ",5
"mantap.. langsung connect.. terimakasih..
",5
"barang sudah sampai, dan gak bisa digunakan sama sekali.
saya mau tukar
dan ini bukan merk COOCAA, TAPI COOOAA.",1
sesuai ekspektasi saya.. memuaskan 😁,5
"barang oke ,langsung pakai ga usah ribet setting..untuk tv coocaa saya tipe 32E360 packing oke,recomended lah pokoknya..thanks EKKA OLSHOP& LAZADA",5
"barang sdh di terima , abang pengirimnya ramah , langsung di coba joss ",5
"Bagus dan sesuai harapan bisa langsyng dipake menggantikan remot yg rusak pas krn merk tv dirumah memang coocaa , packingnya rapi di double wrap. Recommended.",5
gimana donk ini barang sampe tapi gga bisa di pakai... harus gmana yaa... baru kali ini blanja lazada dpet barangnya jelek... tolong donk ini hrus gmana... jadi sampah dan buang2 uang jatohnya... gmana mau d tuker caranya...,1
"BARANG RUSAK KOK DJUAL !!!!
GA AKAN BERKAH JUALANNYA MAS/MBA, TOBAAAT TOBAAAT ",1
mantap lsng bs pake,5
barang bagus sesuai dgn tv coocaa sgala type...terima kasih ekka olshop & lazada,5
suipppp....langsung bisa dipakai.... tanks lazaadaa,5
"intinya belom pernah kecewa,,,,mksh lazada.puas bgt,,barang packing rapih ",5
Barang Bagus dan cocok dengan tv saya. ,5
"trimakasih barang sdh sampai,paking aman..",5
casingnya pecah sebelah tombol menu...gk d cek dl sblm dikirim...padahal utk packingnya rapi...,2
bos ni remot ko kg bisa di pake ... di pasang batre malah panas remot y ... sya mw teker remot y,1
"remot nya mati ga sesuai pesanan,ga bs di pake",5
Barang bagus dan pengiriman cepat ,5
berfungsi dgb baik,5
Mantap sesuai  pesanan,5
mantul,5
cocok bgt barang bagus kurier juga menyenangkan,5
"Alhamdulillah paketnya udh sampe,remotnya akur cocok, makasih lazada",5
cocok sekali bagus,5
Maaf saya kasih bintang 3 soalnya volume nya gak berfungsi... Jadi sedikit kecewa,3
"barang rusak, packing jelek",1
"Mf gaes,remotnya tdk cocok ga bs di pake,harus komplain kmna kah..????",1
"barang yang di terima tidak sesuai dengan gambar yg di post, dan tidak cocok",2
