review,rating
Sangat kecewa barang ga sesuai pesanan sehingga tidak bisa dipakai baru kali belanja ditoko ini sangat jelek kecewa kecewa disaat posisi lagi krisis,1
"bagus, bisa dipake jg ke tv lg led.... mantappp.. ",5
Remotnya Bagus bisa di pake di TV china merk Nagoya,5
"Allhamdulillah barang udah nyampe""sellernya juga ramah"" makasih lazada moga brngnya awet",5
"brg tidak sesuai.tidak berfungsi.tidak bisa d pakai ..sngt kecewa.seller gk respon sama sekali
",1
Remot nya bagus real pict,5
Barang g bisa di pake,1
barangnya berfungsi semua ,5
mantap bisa lgs d pake tp sayang beterai hrs beli dl. ,5
saya salah pesen untung ya yambung apa tv satu y,5
barang salah kirim...KECEWA....,3
