review,rating
Unit keyboard tidak bisa digunakan/Rusak,1
"paket sdh sampai kondisi baik dan berfungsi dengan baik, ya walaupun sy hrs mencari konector USB agar bisa di koneckan ke hp gpp sy suka",5
"barang sesuai dengan pesanan, pengiriman bisa terbilang cepat karena barang sampai 3 hari setelah pemesanan padahal barang dari luar negri, pas di cek semua tombol berfungsi dengan baik",5
"makasih,barangnya sudah sayah terima,pengirimannya cepat
sekali lagi terimakasih",5
remot dah sampe sumpah ga nyesel barang berungsi dg baik keren...keren...,5
mantapp..semua berfungsi dengan baik..keren nih sangat membantu..thanks hob store & thanks Lazada..,5
ok tp masih bingung gunainnya,5
"sorry baru ksih ulasan, produk berfungsi dengan baik.. mantap",5
ok sesuai dengan apa yang di pesan pengiriman cepat,5
"kok yg dikirim bukan rechargeable battery?? kecewa nih


",5
barangnya bagus n pengiriman cepat...,5
"oke siip,bagus,,lancar jaya",5
Pengiriman cepat barang berfungsi dengan baik ,5
Bagus..semua ok,5
mantap. connect sm stb indihome juga ğŸ‘,5
"maaf baru review,  barang bagus pengiriman cepat... tanks lazada",5
Mantap berfungsi dengan baik...topmarkotop,5
blom dicoba sih...mudah2an beefungsi dg baik..,5
"Cepat dan tanggap, nice",5
Sdh di pakai dan fungsi dengan baik,5
berfungsi dengan baik,5
untuk pengapusnya ga pungsi,5
mantap,5
Ok... ,5
