review,rating
mantappp.... langsung dipakai remote nya langsung konek... sesuai dengan harapan good seller pokoknya... Thanks,5
"Bagus, sesuai pesanan",5
Alhamdulillah remotenya bisa dipakai dan barang baru..mksh ,5
barang y ud smpai  ...sesuai dengan gambar saya suka mksh y lazada ,5
"Good barang mendarat dgn baik,  bisa lgs digunakan,  trims ya",5
"Barang sesuai dengan pesanan, kualitas bagus dan kecepatan pengiriman baik.",5
Barang bagus d coba lgsg Nyala...mantap... Mksh lazada... ,5
Remotnya bagus..kurirnya juga ramah..pertahakan itu semua y..mksh,5
Semua berfungsi dengan baik.terimakasih,5
ok ,5
Good,5
Bagus,5
