review,rating
"sesuai dgn digambar!
semoga awet brgnya!!",5
bagus cuma baterey tdk tahan lama pakai sebentar sdh mati ,5
ok gan brng sesuay psanan sngat puas,5
hanya pengiriman saja yg lama... barangnya so far bagus,5
"pengiriman kurir JNE lama dan harus di tanya2 baru di kirim
produk sangat kecewa lampu led mati dus basah cacat akibat kurang rapi packing hanya kantong kersek hitam biasa jadi barang basah tembus dus hancur",1
opak kenadal,4
mkch alat cukurnya dah smpk brg bagus dan langsung berfungsi dgn baik.,5
barang udh sampai bagus tapi blom di pake mudah2an udh bagus,5
