review,rating
bagus lumayan dgn hrga segitu..,5
"tidak mengecewakan
",5
barang sudah sampai sesuai.pesanan,5
"Barang sudah sampai, barang sesuai dengan yang di gambar, packing rapih cuma rada penyok dus nya mungkin karena ke gencet barang yg lain, pengiriman cepet, makasih... Smoga awet... ",4
"tks
",5
udh lama datangnya barangnya.. saya sangat kecewa mesinnya ribut sekali.. sampai telingga sakit dengarnya,1
"thanks lazada, barang bagus pengiriman nya jg cepat sya cukup puas, cuma sya kn pesen nya warna merah knapa yg dteng warna item. . saran sya lain kli lebih teliti lgi. . untuk yg ini sya ksih 3 bintang ",4
mesin nya bagus cma cpat panas gx ppa lah dengan harga se gtu tpi tolong rapih kan bungkus nya lain x karna ke jaya pura sangat jauh takut nya mesin mati...,5
"Barang nya bagus saya suka..tapi yg paling mengejutkan adalah gunting nya sangat sangat tajam sekali,sampai sampai memotong satu helai rambut pun tak bisa ğŸ˜‚ tapi nggak papa lah..mesin nya oke banget mantap deh, thanks for Lazada",4
"Barang bagus sesuai pesanan,,,, saat ujicoba pemakaian siiip, tdk mudah panas.  Thanks lazada,, tingkatkan terus pelayanannya dg brg yg berkualitas",5
barang cepet nyampe terimah kasih ya! cuma warna idk sesuai dgn  yg dipesen tapi ngk apa2 lh yg penting barang ny bagus,3
barang tdk sesuai rusak lgi gk hidup lgi klw jualan yg benar donk. ,1
Ğ½ÏÏÑƒ ĞºÎ¹Ğ¸g Ğ½Ğº-900. Ñ•Î±Ğ¸gÑ‚ Ğ¼Ñ”Ğ¼Ğ²Î±Ñ‚Ï… .Ñ‚ÏÎ¹ Â¢Ñ”ÏÑ”Ñ‚ ÏÎ±Ğ¸Î±Ñ•??,5
"wlaupn warnany beda,aq tetap suka..love lazada.",5
ok thx lazada,5
bagus.. normal semua.. cuma agak cepat panas.. disetel dulu screw voltnyabaru agak mendingan. ,4
Barang bagus buat harga segitu. Dan isi sesuai gambar. thanx,5
Standar sesuai hrg,5
barangnya udh sampai... lumayan bagus...,4
Barang bagus cuma pesen warna merah yg datang warna hitam,2
barang bagus ful seperti gambar puas pokokny,5
"pesen 2 yg satu rusak,,kardus ancur,,kualitas kok makin menurun padahal saya sudah langganan",1
"Pesan Warna Merah yang Datang Biru, Kacau Sellernya 
Minyak. nya jg Tumpah lagi ",3
Barang ok tpi pengirimanya lama bngt,2
"barang bagus v warna tidak sesuai.
v ya sudah lh.cuma warna doang ini.
tanks lazada",4
"barang berfungsi,, Alhamdulillah sampai dgn selamat",5
slah warna,5
Very good,5
good,5
bagus,5
Bagus.. ,5
