review,rating
"Alhamdulilah paket sudah mendarat 
Blm di coba tajam apa tidak,mudah""si tajam
Peking rapi
Kurir nya ga jujur
Bukan masalah uang kembalikan nya tapi kejujuran nya yg penting",5
"minta/pilih warna hitam kok malah dkasih warna biru,, untung biru itu warna favorit saya jdi saya maafkan lah",4
"Saya sangat kecewa baru kali ini belanja d lazada barangnya rusak kyk gni,biasanya gk pernah kecewa sma barang2nya,tp ini barang rusak",5
"makasih lazada.gk yangka baru pesan kemaren eh gk tau nya hari ini nyampe.cepat&rapih pekingan nya..
jadi makin seneng pesen di lazada.",5
Barang ny kondisi dngan baik udah dcoba hidup dngan yg dharpan sesuai dngan yg digambar cum beda warna aj dipesan warna hitam malah wrna biru,5
"barang sesuai pesanan, datang lebih cepat dari estimasi,, Terimakasih lazada, Terimakasih abang kurir.. walau hujan tetap diantar.. puas bangeet belanja di lazada..  
",5
"barang real pick,kurir jug baik.....mksh seler",5
"barang nya sudah sampai,sesuai lah pokonya gk nyesel
",5
"kasih Bintang 5 soalnya bapak aku suka
",5
"Barang bagus, cuma pengiriman nya lama hampir 3 minggu",5
mantap barangyah,5
"Sy pesen warna hitam datang nya biru
Bukan buat sy punya pesanan pelanggan sy
Omong nya ada tinggal pesan..pembohong
Jujur aja klu ga da wrna hitam
Payah
Jd sy kena komplen",1
Paket udah sampe..barang aman & komplit ...mudah2an awet,5
sesuai pic mantul,5
barang bagus timakasih lazada,5
dus penyok dan rada rusak. packing tidak aman. cuma lapis plastik kresek. tidak pakai bubble. next time harus pake bubble supaya gak rusak lagi. tks,2
dus penyok dan rada rusak. packing tidak aman. cuma lapis plastik kresek. tidak pakai bubble. next time harus pake bubble supaya gak rusak lagi. tks,2
barang bagus semua. aq ajukan jempol dech buat (klik to buy) aq ksih lima bintang . semoga tmbah sukses yaa... buat lazada top buanget...ğŸ˜ŠğŸ˜Š,5
mksh ya,5
"saya kecewa bngt beli mesin ini,,,ga membantu sm sekali,,cuma buangÂ² duit aj,,mesin saat d pakai matiÂ²an..mesinya lemah klo ada yg bilang mesinya bagus dan sangat membantu itu cm hoaxxxxxx . .â˜¹ï¸â˜¹ï¸",1
"kecewa saya pesan warna hitam,di kirim warna biru..jualan ga jujur..klau emng ga ada warna hitam nya apa salahnya konfirmasi sma saya",3
"kayak barang retur dikirim ke saya,kardusnya rusak sobek semua,sudah di isolasi sana sini,tlg dong hargai custumer",1
Duss nya sdh penyot2 tapi barangnya bagus sih cuma di gunting aja saya nga puas nga tajam jadi mesti beli gunting lagi saya. Tapi cepat pengiriman n kurir di lazada semua asyik2. ,3
"bru 2hari psan hari ini sudah sampai 1hari lbh awal dr tgl estimasi, packing rapih dan berfungsi dg baik. tengkyu lazada n seller",5
Box agak rusak. barang gada yg cacat Good. bonus ada. langsung gua coba lumayan Bagus gampang pakainya hanya saja mesin cepat panas baru pake 15menit doang langsung panas.,4
"barang sampai dengan selamat n tepat waktu, cuma kemasan nya agak sedikit kecewa.. kayak barang usang dusnya",3
kurang puas jlk bgt barangnya...apalagi dusnya dlm keadaan rusak kaya jual barang bekas sumpah... kecewa berat,2
saya belum coba nanti saya liat hasilnya,4
"paket sudah saya terima
",5
cakep aja,5
agak kecewa karna barangnya sampai lama trus alat cukurrx aga miring,2
"barang sdh sampe dgn selamat, ada harga ada kualitas ",4
"barang bagus dan mulus.... 
dgn harga murah dan lengkap dgn ukuran potongan rambut...",5
barang lumayan bagus...sesuai harga..,5
"barang sudah d terima gan, thanks yaa",5
Mantap hanya 3 hari udah sampai di jogya.kondisi barang normal.,5
"Barang bagus,kondisi baru dan teman pun suka",5
"Brg berfungsi dg baik,
Overall good",5
Ada bonus ikat rambut yang suka dipake anak2,3
Yg dtang warna biru...tp bagus brangnya..,4
Baguz sesuai gambar,5
mantaf barang sudah sampai di tangan dengan selamat,4
barang sudah terima. terimakasih. ,4
sangat membantu untuk merapikan rambut anak ,4
"barangLg dah nyampe, hanya sajaGa packingnya tdk rapi",4
produk bgus berfungsi dengan baik.lngsung dipakai pngkas rambut  untuk orang tua,5
"barangnya datang sesuai dgn yg di inginkan, packing rapi, kurirnya ramah lingkungan ",5
dusnya bonyok,1
"mkaaih lazada
",4
saya pesen warna item yang dikirim merah :(,4
terima kasih tiba dgn cepat ,3
semoga lebih bagus packingnya,1
"pengiriman nya lumayan cepat,,,
tp sayang pesanan tdk sesuai dgn pilihan warna nya.",3
cepet nyampai pokonya,5
Tidak sesuai gambar,2
dah di coba lumayan lah,3
mudah2an awet,5
pesan hitam yang datang biru,3
pengiriman cepat barang sesuai gambar mantaaaappppp,5
"tajam...
mangkas jdi cepat...",4
bagus dan terpercaya,5
pesanan kurang jeli tidak sama yg d gmbar item yg d kirm biru tollong donk d tliti lg tanks,2
bagus,5
yes,5
"recomend,,",5
Baguus,5
Sip,5
Bagus,4
Ok,5
Bagus,3
bagus,4
lumayan,5
