review,rating
bra pesanan sudah mendarat tapi agak kecewa krn yg sy minta warna cream yg datang warna merah saya paling tdk suka warna merah..  tapi ya sudahlah,3
bagus bahan nya adeem,5
sesuai cuma minta wrna merah dtng pink ,5
saya sangat puassss ini lg pesen lg 6 ,5
"nyaman dipakenya,,,,bahannya halus,tambah sexi pokoknya,,,,",4
warna yang salah diterima,1
bagus tp TDK semua pesanan minta UK.34B dikirim  34 A.thx seller,4
barang nya sudah sampai.. bra nya cantik saya suka.. ,5
"Saya kan pesennya warna cream kenapa yg dateng warna merah ya,tpi gpp lah.",5
"Bagus, tp talinya kyknya beda, tp gpp.mksh",5
cpet paketan nya,5
real pic. ,5
bagus .. Cepat.. lain kali beli lagi ğŸ‘,5
Busanya besar bgt.. ,2
terlalu lama proses pengirimannya,5
