review,rating
"Produk berkualitas, barang yg dikirimkan sesuai, pengiriman nya cepat, admin nya ramah, bakal repeat order nih.
thanks seller ",5
"Wah barangnya udh nyampe nih. Thank you Bebe. Paket lampu lampbond lengkap, pengiriman cepet, harga terjangkau bgd alias murah.. Kualitas lampu juga OK.. kluarga di rumah juga bilang terang lampunya bagus. Mantabz.",5
"Terima kasih kak.. 
barang ok, pengeriman cepat.. respon penjualnya juga cepat.. recomen bangett buat jadi langganan..",5
"lampunya sangat terang, pengiriman cepat, pelayanan ok",5
"Sangat memuaskan  belanja disini, lampu sudah saya tes semuanya nyala, produknya bagus ",5
