review,rating
"mantap lampu LED hannochs nya sesuai gambar, meskipun Watt nya kecil tapi terang nya lebih dari lampu LED 8 Watt yg lain , pokoknya top deh, packing nya juga super aman ğŸ‘, gk ragu lagi kalau butuh lampu LED di sini ğŸ‘",5
mantul... barang diterima dalam kondisi baik... lampu nyala tersng seperti 10 watt... puas bgt pakai produk baru dari hannochs ini... thank seller n' lazada,5
"Terang warna natural, sejuk",5
lumayan buat penerangan teras rumah cuma cahaya kurang Putih ,5
"pengiriman sangat cepat, respon seler super cepat, lampu nyala semua, pertahankan,,, mantab,,,,",5
Ok nyala lampunya...,5
test nyala semoga awet,5
nah ini baru mantap ,5
nah ini baru mantap ,5
barangnya sampe dg selamat.. semoga lampu nya ok.. pengemasan terjamin bgt,5
Lampu nyala terang sekali untuk 8w. Sangat memuaskan... ,5
