review,rating
"Sengaja lama di beri ulasan, soalnya saya mau coba dulu obat nya, ternyata manjur banget, sekarang Alhamdulillah berat badan saya naik 3 kg, dan obat nya pun Masi bnyk, semoga setelah obat kianpi pil ini habis berat badan saya makin bertambah..
Terimakasih kianpi pil",5
paket y udh nympe,5
sdh sampai barangnya ori,5
"pengiriman cepat
",5
makaci gan barang udah saya trima... original... ,5
paketnya sesuai dengan gambar real pict... top top top... moga cocok.. mksh yaa Lazada and seller! ,5
"tutup botol y ke buka, jadi gk yakin ",5
smoga ajah cocokğŸ™,5
