review,rating
"thanks banget ya kak produknya sangat membatu ngk nyesal deh belinya mahal"" asal hasilnya kyak gini sangat memuaskan 游땕",5
asli sesuai gambar hasilnya jangan diragukan lagi deh 游때游똂,5
"Suplemen nya enak awalnya takut minum spirulina karna saya liat juga buat masker, tapi pas di jelasin dan ngasih kepastian lansung saya minum, dan hasilnya memang benar-benar memuaskan skali  游땕游똂",5
Namnya aja suplemen penggemuk terpercaya ya iyalah hasilnya sangat memuaskan游땕harga ngk masalah yg penting hasilnya sesuai dengan harga :)游똂,5
"100% keren deh produk ori hasilny juga ori dong. 游때Aku order lagi kak,, tpi kali ini buat adik ku:)游똂",5
"Memang Ok deh produknya,, sesuai sama yg di judul,,Suplemen penggemuk terpercaya游땘recomended bnget deh buat yg lain:)游똂",5
"Harga mahal asal produk kualitas nya Bagus ngk apa"" trimakasih ya kak:)aku bakalan order lagi. 游똂",5
Lapor min Bb aku udah nambah 8kg skrng aku bakalan langganan di toko ini deh. 游땕游똂,5
"Ngk nyesel deh belinya mahal"" hasilnya memang sesuai dengan harga. 游녨游녨游똂",5
"Bb ku bertambah. 游때Thank's ya kak produknya benar"" ori tiensi. 游땕游똂",5
keren dan ngk ngecewain sedikit pun游땘游똂游때,5
ngk ngecewain sedikitpun游땕游똂,5
Bb nambah  游때游때游때,5
