review,rating
"makasih Vitamin C 250mg udah diterima n sesuai, makasih yaaa seller, kurir n lazada ğŸ‘",5
Alhamdulillah dah sampai vitamin C nya... fast respon dan pengirimannya cepat banget ... terimakasih seller dan Abang kurirnya ,5
"Terimakasih barangnya sudah sampai sesuai pesanan terakasih tingkatkan keamanahannya 
Jaga kualitasnya ",5
pengiriman cepat.. packing aman..produk sesuai..good seller.. recommended,5
"Alhamdulillah, barang dtg dan kurir baik",5
barang bagus,5
Sudah yg ke 3x belanja diaini. Pangiriman cepat dan packing bagus,5
ok sudh diterima. sesuai,5
Respon dan pengiriman cepat.. packing rapi.. barang ok.. mksh,5
"bagus suka bgt
",5
barang cepat sampai sesuai pesanan.... ,5
"paket sdh sampai packing rpih ,,, thanks ",5
