review,rating
"Setelah konsumsi rutin berat badan saya sudah nambah, produknya ori tersegel rapi. Pengirimannya cepat. Makasih ka",5
"Setelah coba konsumsi  nafsu makan saya jadi nambah, semoga berat badan saya juga nambah ya kakğŸ˜…terima kasih",5
"Alhamdulillah paket sudah sampai, semoga nafsu makan saya nambah",5
"Barang sudah sampai dalam keadaan baik, paketnya sesuai, kemasan rapi terimakasih seller",5
"Pemeckingannya oke banget, produknya ori dan real pict, the best deh..",5
Barangnya original terimakasih kakak,5
"sellernya fast respon bngt.. produknya ori, kemasan rapi, pengiriman cepat",5
"Barangnya original, packing rapi pengiriman juga oke, cepatğŸ‘Œ",5
"Makasih..paket nya udah sampai , barangnya juga sesuai dengan gambar",5
