review,rating
Saya pesan lengan pendek kenapa yang dateng lengan panjang????? Harusnya admin lebih teliti lagi sebelum kirim ,1
terima kasih barangnya udh nyampe pas ukurannya di adik aku bahannya lumayan bagusss harga terjangkauu pokoknya mantapp rd collectionn bakalan langganan terus di sini 🤗🤗🤗🤗🤗🤗🤗🤗,5
terima kasih udah saya terima barang sesuai yang saya pesen pengiriman cpt makasih juga buat mas kurir ny udah langganan buat lazada juga makasih,5
barang sesuai hargaa mantappp makasi RD collection,5
kemeja ya sangat bagusss...,5
lumayan dgn harga segitu.... cpt bgt nyampenya trimaksih ya,5
lmyan bgus pngirimn cepet bgt,5
"mantul deh pokoknya gx nysel blnja d toko ini 
",5
barang nya okke...  nyesel kalo ga beli di sini,5
"ok barang sudah sampai dengan aman
makasih lazada
sesui gambar",5
barang nya sesuay dan cepet sampai,5
CPT sampenya mksih lazada,5
"masyaallah mantul kemeja nya, makasih buat selernya udah amanah banget dan makasih jga sama abang kurir nya ramah bangett mkasih jga sama lazada.",5
"Terima kasih RD barangnya udah nyampe
",5
"paket nya dh dtg,,kemeja nya bgs sesuai dgn gmbr packing nya bgs gk ada yg cacat pknya suka bngt,mksh lazada mksh a dudi setiawan ",5
kalo ngirim barang di cek dulu sy pesan ukuran XL yg dtg malah bukan XL tdk muat kecil di bajunya tdk tertera ukuran..apa memang di bikin begitu...tapi yg satunya tertera ukuran XL tp agak seret...tdk spt biasanya XL yg sy beli di toko. Terus di apain baju itu ya....mohon jawabanya kenapa kok beda pengirimannya. trm.,1
barangnya udh nyampe pengiriman super cepat pesen skrang bsok dah nyampe kualiataass ok sesuai harga next order lagii makasiii RD collection tokonya amanahhh peetahankan 👍👍👍👍😊,5
"paket sudah mendarat baju bahannya adem..sesuai iklan mantab tokonya amanah, suka..tingkatkan terus makasih seller dan lazada",5
makasih paket udah saya terima makasih buat toko nya baju nya relpic bangat saya suka suami saya pun suka makasih buat lazada Kuril nya ramah,5
"baju nya bagus sesuai harga nya....
cuma pengiriman agak lama tapi gak jadi masalah...makasih lazada
",5
"barang udah sampe, bahan sih y bagus, cuman syng bgttttt masa ukuran XL sama aja ukuran s jadi g ke pake",3
"Bajunya sesuai mantul,makasi lazada kurirnya ramah",5
Alhamdulillah udah Sampek barang bagus banget sama pokok barang nya sama di foto,5
semoga lancar juanya dan sega banyak yang minat dengan produknya,5
untuk barangnya sudah sampe.. mantap dach.. sesuai orderan. dan ukurannya juga sesuai apa yg di pesan.. terima kasih lazada,5
"Maaf baru ngasih nilai.,baju y aku suka suka suka banget..bahan y adem dipake y enak ga panas.puas deh poko y blanja di sini😘 kurir y ramah....👍👍👍👍👍👍",5
mantap,4
mantap betul pengiriman cepat barang sesuai ... semoga bisa jadi langganan ... thx buat kurir good job,5
"mantul...
barang bagus sesuai yg di tawarkan
pwngiriman cepat ..
terima kasih seller lazada dan kurir",5
mantapppp..barang nyaaa bagussss bangettt seller nya amanahhhh...terimakasihhh untukkk seller nyaaaa🙏🙏🙏,5
"trimakasih Lazada barang sudah sy terima,kemasannya bagus pakingnya rapih dan sesuai pesanan sukses ya...Lazada",5
kerenn bagus sesuai gambarrr... ini udh orderan yang kedua gua beli di seller ini.. puasss bangettt ,5
Alhamdulilah paket udh dateng maap baru kasih ulasan. ini real pict nyaa bahannya adem tapi ukurannya harusnya L jadi XL kegedean dibadan Abang saya:( tapi gpp masih bisa dikecilin. Mas kurir nyaa juga sering kesini udh langganan. pokonya makasih seller makasih lazada makasih maskurir,5
alhamdulillah barang nya tlah mendarat..walau pun telat tp alhamdulillah hasilnya sesuai gambar..trima kasih lazada dan kurir nya ..sukses selalu ,5
Brang nya sdah sampai.... Sesuai pesanan.. Kyrir nta juga baik yg biasa.. Langganan. Terimakasih lazada dan toko nya.. ,5
"saya pesan 2pcs yg datang 1pcs, gimana inii
tolong pihak LAZADA, pesanan saya tolong d lengkapi. 
tolong pihak RD COLLECTION, telpon saya d angkat
biar jelas",1
"Maaf buat kurir yang nganterin paket yang satu nya salah saya tidak memesan sepatu tolong kalo ngantrin paket liat alamat yang benar,, saya cuma pesan kemeja",5
"Pengiriman cepat, paket sampai langsung dibuka dicek. Ternyata bajunya bagus gak ada cacat sedikitpun , real pict , ukuran sesuai .. mantap ",5
"Sumpah sangat kecewa sekali pesen kemeja yg datang legging cewe,,,gimana sih ini ??!!!!!
kata nya mau bertanggung jwb tp mpe saat ini tidak ada tanggung jwb nya sama sekali...
bikin nyesel aja sih,,dn tdk mau belanja kedua x nya lagii....😠😠😠",1
"barang lumayan sesuai harga, tetapi jangan beli disini respon kurang baik dan penjual sepertinya buta warna saya beli hijau dikirim BIRU dan tidak bisa dikembalikan.
Coba liat ini warna apa?
Admin lazada, semua custumer lihat warna apa yg dikirim? 
Toko gak berkah mengecewakan pelanggan.",1
"sesuai dengan yg saya pesan,,,sip bahan bagus dan adem di pakai,,👍👍👍dan sangat cepat pengirimanya,,,terimakasih lazada ",5
saya pesan lengan pendek tapi yg dtang lengan panjang😂.. kalo ukuran bneran d kirim xxl.. cuma pengiriman lama skali🥴,5
"Real Pict ✨ Bagus Banget Kemeja nya Bahan Tebel, Lembut Lagi Bagus dehhh pokoknya nggak nyesel saya beli disini🤗 Thanks For Seller, Kurir, Ninja Van ID & Lazada Indonesia ❤️",5
Alhamdulillah kualitas barang nya bagus bahanya lumayan adem packing nya sangat rapi pokok nya the best lah insyaallah gk bakalan kecewa.,5
Alhamdulillah bahanya lumayan bagus gak terlalu ngecewain hee🤭 ini baju yg pesen pacar aku😅  pokonya pacar aku suka banget😘 makasih lazada,5
bhan sih bagus adem .. cuma warna ny gx sesuai keinginan .. kya bkan green . trus ada noda pula . lain x cek dulu ya sblm pngiriman ,5
ok pesanan sya udh nympe maf bru ksi usulan barang ok paking rapi kulir yh jga rmah thnk lazada sukses truss. ..,5
ini gimana saya pesan biru dongker smua karena buat sarimbit kluarga. gimana bisa balikin gak biar warna smua biru dongker. karna saya mau sama an sama anak saya. ,1
warna dah cocok.tapi meret di kantong nya itu gak pas.yang k psan ada meret kantongnya.yang datang (0)meret.tapi gak apalah lumayan....,5
"sumpah kecewa aku pesan kemeja lengan pendek di kasih lengan panjan.
Ukuran pun salah aku mintak UK XXL di kirim XL😡😡",5
"baju nya sangat bagus bahan nya lembut,tidak tipis dan yg pesan sama saya sangat suka,di pertahankan ya kualitas nya😊",5
bagus sih tp sayang ukuran l nya kecil,5
paketnya sudah datang kak😍 realpict dan bagus. terima kasih buat lazada dan abang kurirnya😚,5
mantappp bosku👍,5
Kecewa banget barang ga sesuai sm pesanan q dan yg tambah parah sdh barang ga sesuai msh tetap dgn harga  barang yg aq pesan.  Pokoknya kecewa bgt! ,2
"baju nya sih bagus GK tipis GK tebel juga, saya pilih XL karena suami pakenya XL, eh pas di cobain kayak ukuran L..jadi buat yg mau beli mending di lebihi size nya..sayang jadi GK kepake next time ntar di lebihi size nya overall bagus",4
"mksh lazada puas bgt, pokoknya makin percaya dg lazada",5
terimakasih barang udah sampe  lama banget bahan nya jga kurang cocok  tpi Ok lah kurir sippp makasih lazada,5
"bahan nya terlalu tipis,  kurir nya mah ramah asyik karena udh kenal ",3
barang ya bagus cuman sya yang salah pesen kekecilan ,5
"tidak memuaskan.pesan XXL yg datang ukuran l ya tidak muat di pakai.lain kali kalau jualan Di lazada yg bener,jgn buat lazada dan konsumen kecewa.",1
👍👍👍👍👍👍,5
brang nyh Sudah smpe. mkasihh lazada,5
oke.👍👍👍👍💖,5
"Pas banget! Sangat puas, terimakasih",5
memuaskan 😇,5
"terima kasih lazada.. barang sudah sampe.. kurinya juga ramah.. masih.. sukses. 

",5
bahannya lumayan bagus .. semoga makin sukses buat lazada,5
"alhamduliliah  paket sngat cpet cuma hri..sesuai pesenan bnkus ny jga rapi mkasih lazda
",5
"kereen, produk sesuai pesanan, cepet sampee. thks",5
barang sesuai,5
mantap dh.. ,5
barang nya bagus pas ukuran nya thank you lazada ,5
"lumayan lah ,agak tipis bahan y",5
"kemejanya mantap,nggak kecewa belanja di sini",5
"Pket dah datang ,  kecewa banget  masa ukuran xxl  kaya ukuran L,  toko penipuan ni mah,  ",2
bagus kemejanya ,5
good sesuai harga,5
Barang nya oke,5
Barang nya oke,5
barang y matulllll ,5
bagus bajunya smg awet,5
"barangnya sesuai gambar.memuskan.kurirnya udah langganan lg.makasih Lazada sukses terus.

",5
"barang bagus pengiriman cepat,makasih lazada.. ",5
"bajunya bagu
",5
Terimakasih barang dah aku trima...,5
"bagus, adem,serasa baju 200rb",5
cocok bngt....,5
lumayan sesuai pesanan.kurirnya ramah.,4
Bagus bajunya,5
barang bagus,5
Kain tipis.,4
"makasih ka, real pict ",5
kereeenn ..   bagus bangets. ,5
"alhandulillah,walaupun aga telat pengirimannya nyaman dipake😊",5
"Ttimakasih lumayan lah buat lebaran kupat
Mantap ",5
terima kasih LAZADA is the best poko.a kurir.a jga udh knal makasih😊,5
bajunya ok..suami ku cocok..malah suruh psn lgi😊bahan nya lmbut halus...?,5
barang barusan dateng iya alhamdulillah tdk mengecewakan lumayan lah harga gtu☺☺,5
Mantul.terima kasih lazada ,5
👍👍👍👍👍👍👍👍,5
"barang oke, terima kasih",5
paket sudah sampe dengan cepat,5
"kerja bags Suami saya suka,,  😊😊",5
terimakasih baju'y bagus customer ku suka..,5
mantap gaiss ... puas ,5
maaf baru ngasih ulasan barang y bagus ga ngecewain poko y 👍,5
👍🏻👍🏻👍🏻👍🏻,5
lumayan sesuai pesanan 👍,5
"trimakasih lazada,barang nya bgus,bhan nya bgi lah seimbang sama harga nya",5
Mantap kemeja y,5
barang sampe Cepet.. tapi ko mesen.a lengan pendek yg nyampe lengan panjang.. tapi gpp barang.a bagus ,5
gambar lain dtng lain..nmbor pun salah.mntk 38dtg 39😒,5
barang mantap trimakasi lazada,5
barangnya bagus kurirnya ramah sesuai gambar.mksh lazada.,5
sesuai pesenan,5
baguss bahan nyaa okee warna sesuai pengiriman telat karnaa lebaran tapi ngga pp mendarat dengan sempurna kurirnya ramaahh sekali ,5
"Untuk om kurirnya :) semangat om, panas2 gitu dia rela luangkan waktunya demi pekerjaan ini :) menggunakan motor dari sungai lilin ke peningalan bukannya dekat :) dan juga dengan kondisi baranf bawaan sangat lumayan banyak menurut saya,. Tetap semangat omm :) ",3
"Baju sudah datang tepat waktu, kain tipis ternyata ukuran L kecil nggak muat di badan jadi ya nggak kepakai mubazir.",3
"Mksh brng ok bagusss ,sesuai psnan ,mksh buat lazada dan buat kurir y sopan dan ramahhhh🙏🙏🙏🤝👍👍👍👍",5
"pas banget di badan suami sayaa yang minimalis.. dikirain agak gede... kurir ramah, pengiriman cepat. tks",5
baju bguuus ..lumayan dg harga sgtu .cuma kyknya ukuran kcil yah XL nya kcil ....kurir ramah..penjual ramah mkish lazada,5
"Bajunya pas bgt, bahannya sesuai lah sama harganya",4
"keseluruhan bagus semua bahan ny yg pling lembut warna green..
tp gpp.. semoga suami ku suka. tks lazada dan sellernya kurirnya jga pandai..cpet ",5
real pict good buat baju nya pengiriman supeeeer cepat makasih resseler makasih lazada dan mas kurir nya,5
"Alhamdulillah barangnya udh nyampe, cmn agak kecewa karna pesan 3 warna berbeda, tp yg datang malah warnanya sama semua😐 tolong seller dikonfirmasi lg🙏",3
"maaf.y kk...baru ngasi ulasan... bajunya bagus sesuai dgn yg d gambar...bhannya tebl pelanggan sya sangat suka 
kurirnya udh langganan. sangt baik makasi lazada makasi abng kurir...",5
trimakasih jga bwt toko RD kemeja.. smoga jdi langganan,5
barang sudah.nyampe.packing rapih.kwalitas bahan lumayan bagus.trima kasih lazada,5
"NYESEL BGT PESEN DISINI ASAL KIRIM PESEN WARNA NAVY DIKIRIM ITEM DAN UKURAN NYA L LAGIII
GAK AMANAH YAAAA",1
"maaf baru kasih ulasan barangnya bagus dan sesuai gambar,,,, buat kurirny makasih ya sukses slalu lazada😍😍😍😍",5
"Saya kecewa klo emang barangnya ga ada gak usah dikirim,pesenya kemeja lengan pendek dibawain lengan panjang dah gto kecil lg.untuk penjual lsin kali diperhatiin dong jngn asal kirim z....",3
aduhh...resiko brng murah ternyata pahit yoo....warnanya tidak sesuai gambar...hitam jernih....ekh yg dtanng hitam kusamm...seperti baju yg tak laku...berbulan2... ,2
"Alhamdulillah barang nya bagus,nyaman dipakai,pas ukuran nya,sesuai dengan keinginan. Arigatogozaimashite.🙏🙏🙏🙏🙏",5
bhan nya jlek ..  dan gak sesuai di gambar saya pesen tngan pendek di kirim malah tngan panjang kecewa bngt,5
"Terimakasih kemeja nya bagus,  abang saya suka😁 dan trmksh lazada saya blm pernah kecewa beli di lazadaa😍🤗",5
"agak kecewa, dari tiga kemeja yang dibeli, hanya ini yang tidak sesuai orderan, dikirim yg slim fit padahal 2 kemeja lainnya pas",2
"Alhamdulillah barangnya bagus, kli saya lengannya pendek ternyata datengnya panjang, tapi gpp kok tetep bagus",5
mantap kemejanya cuma beda warna sama yang pertama order is ok gpp lah bahan bagus...makasih lazada dan seller ,5
kualitas nya mantull bener Terimakasih buat seller toko dan lazada semoga awet. buat kurir gasspoll terus ojo ngeluh mantap deh,5
"baju ok lumayan,cuma pengiriman lama banget seminggu lebih!seller slow respon!!!kurang puas dengan pelayannya!maaf cuma ngasih bintang 3",3
bahanya lumayan..cuma kirain abu2nya muda ke yang di poto ternyata abu gelap..jasi gk bisa copulen sama gamis aku..tapi gk apa2 lah mayan,5
"maaf baru kasih ulasan,baju nya good bngt😍bahannya juga tebel gak nyesel belanja di toko ini🤩thank you lazada😍",5
"alhamdulilah baju ny sdah smpai dari kemaren, cmn baju ny gc muat kak jdi gc bisa di pakek, barang sesuai sama gambar, kurir ny baik, makasi ya kak",5
"maf baru kasih ulasan baju nya bgs nyaman di pake cocok buat suami q makasih lazada kurir nya jga baik n ramah moga awet ya baju nya
",5
maap baru kasih ulasan celana ny bagus sesuai pesanan trimakasih lazada kulir ny baik sukses terus y,5
agak telat kasih ulasan tp saya suka dngan produk dan abang kurirnya..respon cepat dan barang real..sehat selalu,5
gimana saya pesen ukuran 3Xl yang datang malah ukuran M kecewa banget beli di sini,2
Alhamdulillah barang sudah sampai...tpi sayang bahan diproduk sama beda..yg hitam beda bahan dengan pink..lebih bagus pink,5
"mf baru kasih ulasan,barang nya bagus,jaitannya rapih.sesuai dah dengan harga segitu mah,ga kecewa👍",5
baju ok..sesuai pesanan..sayange seminggu baru mpe..mkasih...petugas jasa pengiriman sopan baik..mksih lasada,5
barang y udah dateng tp blm di buka ga tau cocok apa ga mudah2an sih cocok  kurir y jga udah langganan,5
"Barangnya bagus, real picture, tidak mengecewakan belanja disini, pokonya tunggu orderan selanjutnya...😁😁👍👍👍👍👍👍",5
"baju kemeja warna hitam kain nya jelek panas ,yg warna green bagus padahal satu merek kok bisa beda kain nya.tlong kok jualan yg jujur.udh kecewa belanja d toko ini",5
"sangat mengecewakan size XXL dipakai sama dengan size L sempit, bahan nya pun jelek jgn lah belanja di toko RD cukup ini yg pertama dan terakhir.",2
Paket udah di terima pakingnya rapih barangnya ok thanks toko seller untuk lazada mantul ,5
Aku pesen 2 dikasih item smua padahal sudah chat dari awal buat notice beda warna karna di pilihan gaada biasa nya di Merchan lain bisa disini engga kecewa lah,1
kecewa... pesannya lengan pendek yg dikirim lengan panjang semua... ukuran xxxl seperti ukuran XL biasa... boro2 muat di badan.. baru masuk lengannya ja udah sempit... Bru ni kecewa belanja di lazada... ,2
"alhamdullilah paket sdh dtang,,tp lama bgt,,,1 mnggu lbh,bru dtang,,,,barang lumayan lah,,,kurir nya jg sopan.mkch lazada,,,",5
"Di tulisan nya baju pendek, pas di buka baju panjang, tolong buat penjual, lebih teliti lagi dlm ngemas paket nya, buat bahan nya sh lumayan bagus, trimakasih",4
alhamdulillah barang nya udah nyampe pengirimannya cepat dan barang nyapun bagus pokok nya saya suka,5
"luarbiasaa bahan ya bagus gak nyesel dehh..
pesen ya tangan pendek yg dateng tangan panjang gpp ttp oke dan keren trimakasih toko trimakasih ladzada terimakasih kurirnya",5
barang nya sesuai pesanan saya sangat suka dan kurir nya baik dan ramah makasih lazada saya sangat puas dengan hasil nya,5
barang pesanan saya tidak sesuai saya pesan kemeja tangan pendek dan size xxl reguler tapi yang datang kemeja tangan panjang dan size nya L walaupun di lebel size nya xxxl tapi real kameje nya size L saya sangat kecewa dengan penjual tidak teliti dalam mengecek pesanan pembeli,2
bagus sesuai dgn hrga'y mksh bwt seller & lazada lain kali tolong pengiriman'y jgn trllu lama gini mksih,5
"Mf baru sempet ngasih ulasan 🙏,, Alhamdulillah pkt nya udh keterima tdi sore.. bajunya bagus realpic 😍🤗,, kurirnya juga ramah dh lngganan 👍👍,, sukses trus buat lazada & tokonya ♥️♥️",5
alhamdulillah akhirnya nyampe juga  paket nya walaupun sedikit mengecewakan di bahan nya agak tipis tapi ttp bagus klo di pake,5
barang nya sudah mendarat bagus bnget bajunya dengan harga segitu mah ..trim lazada yah ..,5
sangat mengecewakan order lengan pendek yang dateng lengan panjang dan bahannya sangat jauh dari pict.. ukuran XXL seperti ukuran L.. kecewa toko tidak amanah,1
"kemaja nya da sampai barang nya bagus sesuai dgn gambar. kurirnya juga uda langgana pokok nya top deh, ",5
Kecewa.  Masa yang di kirim kemeja anak.  Kalo sekiranya gx ada konfirmasi dulu geh.  Penjualnya amatiran,5
"barang ga sesuai minta lengan pendek yang Dateng  lengan panjang gmn sih,kalau jualan tu yang teliti ",1
dah sampe paket nya tapi ibu saya yang ngambil langsung harga total 57 duit nya 70 kok kembali nya 2 ribu yaudah deh gpp ,5
sudah diterima. untuk harga segitu lumayan bagus. real pick. kurir ramah dan sopan. mantul...thanks...,5
"kameja sudah saya terima,sangat sesuai pesan dan  sesuai gambar, terima kasih Lazada semoga lebih memberikan peningkatan untuk kamu yang selalu memakai jasa LAZADA",5
Kain lumayan sih. Cuma pesen warna nevy. Yg datang Hitam.,5
Alhamdulillah paket nya udh smpe bagus sesuai pesanan . Kurir nya jga ramah... ,5
paketan rapi.pengiriman cepat.pokok nya mantap..makasih kak.,5
mAaf baru smpet kasi ulasN. barng lumayan bagus untuk harga sgitu pas juga di badan. kurir juga rmah. trimakasi lazada n seller.,5
sya gk suka ya kurirnya msa namanya di profil sya sudh ganti mlh ksh k org lain... mna warna bajunya gk sesuai,2
"alhamdulillah.. paket uda sampai, bajunya bagus, realfic, memuaskan, ngak nyesallah belanja di toko ini, terima kasih lazada. ",5
"Baju'y bagus dn adem,sesuai pesanan mksih lazada",5
"map kak baru ngasih ulasan,baju nya pas sesuai ukuran,suami ku langsung suka,ok tidak mengecewakan,buat lazada trimakasih.",5
"GILAAAAAAAA PENGIRIMAN NYA CEPET BANGETTTTTTTTTTT!!! gak pake nunggu lama, pesen kemaren sekarang dateng. tapi barang belum di cek sih. :v ",5
mantuk pokok nya realpic👌👌,5
"barangnya bagus, respon penjual cepat, pengiriman cepat dan kurirnya ramah banget top bgt deh terimakasih semuanya",5
Alhamdulillah barang datang nya cepat kurir nya ramah tapi baju nya kekecilan untuk ukuran L segitu ,5
Baju ny bagus... Cma satu yg salah mnta kmeja lengan pendek di kirim yg panjang tpi gk pp tetap suka kok ,5
kalau yg L ini bahan bagus,5
hatur nuhun pisan lazada paketna tos dugi prosesna enggal,5
Beli 2 kemeja.. Pertama order: warna Hitam size Xl & Abu2 size Xl.. yang datang dua2nya Hitam.. 1 Xl : Benar.. 1 nya M : jadinnya tidak di pakai..  kenapa bisa begini ya... 😁,5
hihihi baju ya kebesaran kirain L ga bsar tpi gpp lah dri pd kkecilan makasi lazada sukses trs kurir ya juga baik sopan pokeke is debes lah👍,5
Sayaa puasa dengan kemeja nya.. Top bgt deh belanja di lazada.. Makasih lazada.. Kurir mya ramah bgt. ,5
Maf baru kasi ulasan barang nya bagus banget puas belanja d toko ini kulir nya juga ramah uda langganan makasih lazada,5
paketnya dh nympe bgs sesuai psnan.tp ga tau bhnnya lntr apa ga.slnya blm d pake.mksh lazada.dan kurirnya baik ramah.,5
Psan realpick sesuai sm harga nya. Tpi cm ada kesalahan kecil sya psan size. (L) yg dateng malah size(xl). Trims penjual & lazada sukses selalu. ,5
"alhamdulillah barang nya bagus sesuai gambar sama harga nya juga, makasih lazada adn kurir nya juga udah langganan😊😊😊",5
sebenarnya sedikit kecewa karena ordernya warna hitam tp yg datang hitam kemerahan bukan hitam pekat seperti di gambar.tp  bagusnya order hari ini besoknya datang.terimakasih lazada..,5
"mkasih lazada,.barangnya sesuai Ama yg difoto,.ga rugi deh beli disini,.kurir nya juga udah langganan,.baik sopan lg,.pokok nya the best lh",5
Alhamdulillah paket sampai.. Pelayanan nya bagus. Barang nya super. Gak ngecewain. Kurir nya pun yang langganan.. Terimskssih,5
alhmdlh barang udah sampe maaf sy telat ngasih ulasan... barang sesuai yg di gambar bahan y sesuai harga trimaksh lazada,5
"mksih lazada brang y sesuai gambar,dan pengiriman y cpt,apalagi kurir y sangat baik,dh langganan lgi...
",5
Alhamdulillah barang Sampek dengan selamat'.. bajunya bagus sesuai dengan yg di foto...kurirnya juga ramah,5
"awalnya sy berharap dgn ukurun 3xl itu sdh cukup pas utk badan sy krn ukuran tsb cukup pas utk ukuran badan sy, tp ternyata perkiraan sy salah...ke 3 baju yg sy pesan tsb masih kekecilan utk badan saya.....akhirnya cukup sy gantung saja bajunya...sayang sekali.....3xl harusnya
 pas.....apakh hrs 4xl...?",5
"kecewa.kecewa..tidak sesuai prediksi bahan kasar pkoknya dgn hrga sgtu sngt tdk cocok skli..
lht ulsan pda blng bgus kog di saya bginia kyk kemeja 30 rbuan..seller respon baik kirain bgus taunya haduhhh..pusing",1
makasihh ka barang nya udah nympi dari tadi kulirnya jga baik dan rapihh ngebungkusnya..bahannya jga oke ka makasih😉,5
"allhamdullilah suami saya suka,tapi warna hitam nya kurang hitam,jdi agak pudar,slbh nya udah mantap bgt deh ",5
"sekali pesen saya langsung 3 baju alhamdulillah sesuai yang diinginkan saya ,,bajunya bagus, packingnya jg rapih, datangnya jg cepet,,, saya kasih bintang 5 ",5
makasi dah nyampe..sangat mmuaskan 😊,5
pengiriman lambat hampir dua Minggu.bajunyA okelah harga segitu...makasih ,5
" maksih ..ya barangnya dah diterima dgn baik ..kemejanya pass  lumayan bangus untuk harga sgtu.. paking rapih...makasih jg buat abng yg anter ya.. sukses sllu

",5
"maaf telat kasih ulasan nya,barang sudah sampai dan sesuai sama pesanan kurir juga ramah terimakasih lazada:)",5
Sesuai yg dgambar mantap lah.pengiriman juga cepat,5
ukuranny kecil xxl kaya ukuran L,3
"mantap realpick,packing juga ok lahh pengiriman cepet bgt,kurir baik udeh langganan pokonya bestt seller bbgtt dahh👍🙏",5
Gk bisa upload poto. By the way barangnya bagus sesuai gambar.. Penngiriman baik kurir dah langganan ngademin. 😍😍😍 recomended bgt ni toko,5
"Mf blm sempat poto, baju nya bagus pake bgt banget kak, pertahankan kualitas nya ya kak, adik saya suka. Pas di badannya. Padahal sempet takut klo kegedean ternyata pas doang 😁",5
"3xl nya gk sesuai 3xl sama kayak XL biasa di ukur"" dngan baju yg lain, trnyata di deskripsi pun gk ada detail ukuran 3xl, yg ada detailnya cuma M,L, dan XL,
Kenak akh pesan 3 pulak gk muat ",3
maaf telat ngbrinya.bajunya sesuai gambar.bhnya lumayan la tuk Gonta ganti😁.sy puasss.pertahankan lazada semoga sukses sllu.,5
kemeja nya keren bngt...murah tapi gak murahan..ISTIMEWA...thnk lazada kurir dan seller nya...moga semakin maju,5
lumayan bagus...,5
wah keren pokonya baju nya ga nyesel,5
xxl kecil bgt hadeh,5
bagus bnget suka deh,5
barang yg sangat baguss😊😊,5
tks bjunya mntp,5
barang sudah di terima.... sesuai peusanan nya... ,5
sesuai harga.  ,5
sangat sangat kecewa.tidak bertanggung jawab.penjual terhadap konsumen.,1
Barang bagus... Sesuai pesanan,5
"Aduh gk bisa baca apa, dikertas paketnya putih 2 tapi setelah dibuka ko zonk 😕yg putih berubah jadi maron 😟😟baru ini kecewa belnja dilazada gimna mau pesan lagi jadi kapok dehh tidak amanah, klo memang tidak ada waran putih jgn dikirim kek ginikn jadi kecewa bangettt 😢😢😢",2
trimaksih sesuai pesanan ,5
"barang udh di terima👍
mantap👍
kurir nya jg udah  sering  kemari
pokoknya sesiai pict dan harganya",5
woww wooowww kemejaa nya krenn.bangtt . sumpahh.deh bahan baguss .nexxx pesen lgii ahhh . dann respon nya baguss bgtt,5
Alhmdllh barang dah nyampe..tpi sayang saya minta lengan pendek mlh di kasih lengan panjang,3
"maaf Bru ksih ulasan,,cman bahan ny aj yg tipis klo yg lain top lh,,tpi gpp lh buat harga segitu hehe",5
"barang bagus sesuai pesanan..pengiriman agak lambat tolong dipercepat lagi biar gk terlalu lama menunggu??
",5
"alhamdullilah paket nya sudah sampai terimakasih Lazada...respon yg punya toko juga sangat"" baik👍😄",5
Mantulllll😍,5
"Brg Mmuaskan, Bahan Ssuai lh Sma Hrga:) 🤩Packing nya Pn Rpih👍",5
"barang bagus bang,, mkah lazada
",5
Barang nya g sesuai sy pesan warana hitam yg datang warana biru dongker yg jujur dong julan gmn sihh.,5
"Lumayan buat harga segitu, cuma L nya kecil jadinya ngepas sama suami saya tapi gpp, kurirnya ngga sabaran",4
"ini pengiriman salah pesen kemeja yg dateng celana cewek ini gimana cara komplin nya o
",5
gila bahan nya adem,5
"fkt sdh d trima,,,pngrmn cpt banget,,cma syg bhn nya tipis..",5
ukuran XXL masih seperti ukuran XL,3
Sesuai pesanan ya wrn marun,5
bagus banget💓💓,5
"maaf baru kasih ulasan barangnya bagus sesuai dengan yang ada di gambar,kurirnya juga ramah 😍😍",5
barang mendarat dg selamat,5
mantul barangnya,5
"ok..kmjay bgus,,adik saya suka,,perthn kn..y..😉",5
Real pict bajunya sangad bagus,5
"kain nya tipis, terus aku curiga baju bekas.soal nya kenapa bau farfum.?. ",2
"alhamdulillah barangnya udah Smpai,,, mkasih lazada ",5
terima kasih Lazada kemejanya Bagus suamiku senang,5
"oke banget kemejanya, amanah penjualnya",5
baguss sesuai gambar,5
"bagus sesuai gambar,babang kurir nya pun baikk sekalii TOP BGT dechh....🙂🙂",5
pesen 2 lengan pendek yang datang lengan panjang hadeh....,3
alhamdulilah baju nya sagat memuaskan poko nya mantull bgtttt....,5
"kancing bajunya beda dgn yg d gambar, tpi lumayan lh dgn harga segitu.",5
realpict bngttt bgus bngtt sukaaa.... ,5
"realpick, tapi agak kekecilan
terima kasih lazada😊",4
Keren abis ,5
suka bgt baju nya thanks lazada ,5
"Terima kasih barangnya sudah mendarat dengan selamat, realpic anak saya suka ",5
