review,rating
gambar dan asli nya sama kaka terima kasih,5
ok terima kasih lazada pesanan barang nya sudah sampai,5
sudah sampai,5
sukses selalu ya kemasan rapih,5
bagus dan cepat poko nya top deh,5
super cepat pengiriman nya 2 hari sudah sampai aja makasih ya,5
sampai dengan cepat dan pengiriman aman,5
bubble nya banyak banget jadi aman ke packingan dan rapi,5
kemasan bagus dan rapih fan respon nya juga cepat,5
berfungsi dengan baik gambar dan deskripsi sama,5
warna sesuai pesanan dan puas bgt belanja di sini,5
raket nyamuk nya sudah nyala ya,5
raket nyamuk nya sudah bisa di gunakan dan sudah nyala juga,5
Sudah nyala makasih seller,5
senang bgt rasa nya pesanan saya sudah sampai,5
terima kasih lazada td siang barang pesanan saya sudah sampai,5
akhir nya yang di tunggu2 datang juga makasih seller barang mau saya coba gunakan dl,5
packingan aman dan bubble nya juga tebal banget jadi barang tidak rusak saat pengiriman,5
barang bagus semoga awet dan pengiriman juga cepat makasih seller,5
