review,rating
alhamdulilah terimakasi barang nya sudah datang di kira sama semprotan wadah nya tapi ga apa makasi ya kk,5
"alhamdullilah barang sudah saya terima. 
langsung saya coba di semprotkan 
kutu busuknya mati.mantap lah.",5
barang nya dah sampe paking bagus seler ramah barang bagus udah sy coba tumila nya pada mati makasih lazada,5
"alhamdulillaah barang udah Aya terima dg keadaan slmat,dan alhamdulillaah jga kutu kasurnya pda mati stelah d semprot.trimaksih basmix terima ksih jga lazada.",5
obat ktu busuk nya manjur pada ga ad mungkin mati,5
walaupun barang dateng lama tapi obat ampuh juga,5
"sdh 3x sy beli disini, bagus dan cepat pengirimannya.. tks seller..",5
makasih barang dah nyampai pas sama barangnya sprti yg di pasang belum saya coba smg manjur ,5
Makasih paket sudah d terima kurir nu pun ramah makasih lazada ,5
"belum di coba ,,,mksih lazada",4
sdh sy coba.mmg ampuh utk bunuh tumila.smp kecoapun kaburr..thanks lazada...,5
kemasan nya rapi bagus cukup memuaskan trima kasih lazada,5
bagusss,5
TOP,5
lumayan,3
