review,rating
"barang udah sampai,dan ini orderan yg kedua, bagus cocok soalnya dimukaku, jadi lebih cerah dan jerawat juga mulai berkurang
thanks lazada and seller sukses terus dan pertahankan qualitasnya ya",5
"best local product i've ever try❤
bruntusan berkurang bangettttt,packagingnya niat sangatt sukaaak ❤
bakal repurchase kalo ada diskonan lagi hehe",5
"maaf baru kasih ulasan, produk sampai dengan selamat packing super rapi dan aman as always pake kardus dan masih di double bubble wrap 
doakan cocok ya soalnya tonernya cocok di aku semoga essence nya juga",5
"datengnya lumayan lama, wajar sih karena kemarin belinya pas lagi sale gede 8.8😔
semoga bisa ditingkat kan lagi pengiriman nya😔",5
emang bener bener yah beli di lazada! Blm pernah mengecewakan!❤️🥺 apalagi beli 1 pcs brg aja packaging nya rapih banget gak lupa dpt brosur dri si produk nya! Bakal langganan N’Pure🥳🥳🥳😍❤️🤗,5
"Cuma kotaknya penyok, untung pake bubble wrap jadi produk aman. Di coba dlu yaa, kalau ada hasilnya kasi bintang 5 👌🏻",4
"barangnya udah sampe kaaa☺☺☺,,,, ini botol ke 2, cepet abiis ga kerasa ditambah pemakaian baru dua minggu pakai tumpah🥺🥺😭😭😭 pokonya selalu suka prodak n lure💞💞🥰",5
Alhamdulillah mendarat dg aman. Awalnya khawatir krn dusnya penyot tapi alhamdulillah barangnya aman. Packingan tetep ok plus buble wrap,5
"pengirimannya lamaaaa banget plis, pake ekspedisi lain kalo bisa",5
bsicmaoa0as gskdkqnsyrbt anciabauxjs hdhdkamshz ❤❤❤❤❤,5
"keren banget pengirimannya tepat waktu, bentukannya cair banget si tapi bagus kok",5
Produk diterima dalam keadaan baik hanya saja pengiriman yang lama.,5
Sesuai pesanan tengkyuuw moga cocokk,5
"suka bgt, akhirnya dtg.. ORI loh.. packing rapi bubble wrap plus dus 💓💓💓 aman.. cepet pula kemarin order besok langsung smpai.. bkalan langganan beli di lazada🥰 mana promo diskon pula. thanks lazada .. thanks Npure💕🙏💕",5
repurchase kesekian kali nya ❤❤❤,5
"semoga cocok, terimakasih",5
terrrbaikkk,5
Packagingnya beneran niat jadi bagus dan gemes. ,5
"thank you! pengiriman agak lama tapi gapapa. produk bagus, udah repurchase 2x🤩",5
"Cocok dong, teksturnya cair dan cepet meresap dikulit, ngga lengket sama sekali bener bener ngecalming jerawatku, setelah pakai ini tekstur muka jadi lebih halus setelah 2 minggu pemakaian jerawat jadi jarang muncul, tipe kulitku sensitif oily acne prone dan gaada masalah sama sekali setelah pakai ini recommended, nanti akan repurchase lagi",5
thankyouuuuuuuu lazadutt n seller paketan aku udah sampe mudah mudahan coxok ya,5
first timee cba produk  ini...semoga cocok seperti kaka kakanya (selama ini baru pake toner + facial wash + serumnya aja) mereka mantulll bgt..  repuchase berkali berkali.....love npure,5
"baru mau nyobain essencenya, semoga cocok..
klo tonernya udah cucok meong..
masih menanti day creamnya juga yg masih OTW..

buble wrapnya tebal, mantullah..
",5
"Essence nya bagus Dan memuaskan, recommend untuk yang mau Coba skincare produk lokal. aromanya juga tidak terlalu menyengat, cepat meresap",5
"produknya original. dapat harga promo sale 7.7.
sering2 adain promo ya lazada.. 
minus ekspedisinya aja. Jgn pake JNE dong lelet banget. thx ",5
Kalo pengirimannya mayan lama. Tapi penting peoduknya aman plus aku suka bgt sama packagingnya ga cuma gambar tapi packaging serumnya gilasi bisa bikin pelanggan jadi makin tertarik sama produk. Semoga cocokkk hehehe 💞💞,5
gila sih ini pengemasan sama pengiriman nya cepet bgt cuma sehari semoga aja cocok karena emng udah penasaran bgt sama si npure ini... ,5
Paket sampai dengan selamat! Cepet juga! Makasi Lazada!! Belum dicoba si hehe semoga cocok. Thankyou seller❤️,5
"paketnya cepat sampe mudah mudahan cocok di muka aku terimaksi lazada dan seler ,buat kurir nya juga terimaksi sangat ramah ",5
Paket sampai dengan selamat meskipun box nya jadi penyok-penyok (Lazada please treat the parcel carefully). bismillah semoga cocok!! ><,5
"mf Bru ksh ulasan, udh seminggu pke essence sm tonernya jerawat udh jrg nongkrong di muka wkwk ,mnrt sy untuk mencerahkan blm keliatan hasilnya di sy,lbh suka essence nya drpda tonernya,soalnya tonernya pas dipke aga panas gtu di bagian muka sy yg sdg iritasi,tp allhamdulillah muka sy gknpa² si",5
"bagus banget sih ini pertama kali nya aku cobak semoga cocok diaku. pemakaian pertama ada jerawat didahi terus dipakai ini langsung kempess jerawatnya
",5
"barang sampai dalam kondisi baik, packingnya super aman banget. packing dus + bubble wrap. pengiriman cepat sampai. harga di lazada jauh lebih murah dari toko sebelah. belum cobain produknya, tapi semoga cocok di wajah aku. rekomen belanja di sini.",5
"Maaf ya bintang 5 dulu, nnti kalo cocok aku tambahi jadi bintang 10 hahaha. Barangnya aman tanpa lecet kerna di bungkus buble wrap tebel, packnya lucuuuuu gemess jadinyaa, baru pertama coba, semoga cocok sama kulit aku yg gradakan kaya jalan belum di aspal 😂😂",5
"suka banget sama essence npure ini pertama kali coba karna kaka aku ternyata aku cocok banget , bakal repurchase? of course ❣😘 ",5
"first time cobain ini dan ternyata FA safe, seneng banget. semoga bisa cepet nyembuhin jerawat² aku selama dirumah aja ini.
semoga cocok dan repurchase terus.",5
pengirimannya lumayan cepat. karena aku dah cocok sama tonernya yg cica aku penasaran dong sama essence ini semoga bisa nyembuhin bekas jerawat aku,5
"baguss bangett pekejingnya
niat bgt emg npure ini😍
semoga essence nya cocok ya di aku
soalnya tonernya udh nyoba cocok.
nextime belanja lagi apalagi diskon gini😍",5
"Alhamdulillah sampai dengan selamat, pertama kali nyoba essence ini semoga cocok deh karena pakaiannya tonernya cocok. Terima kasih atas promonya",5
"baru ngasih review hihih baru pertama kali coba, enak sih bikin kulit kenyal, moga aja cocok .. thanks n'pure thank lazada 😍",4
"pelayanannya bagus bangett, baru kemarin beli udah sampe rumah hari ini. semoga cocok yaaa #supportlocalbrand",5
"Saking cintanya sama produk npure yang cica series dan mumpung lagi sale, beli lagi buat stok yang kebetulan essence nya udh mau abis 🥰",5
"yeayy essence nya udah dateng, teksturenya cair tp bkm dicoba semoga cocok. pengiriman cukup baik. full bubbblewrp terus dikasih box juga so aman jadinya",5
"aku make ini tuh kaya ada bau amis"" gitu... tapi sumpahh mukaku enakan dong pakai ini, kayak nya aku lebih cocok pakai essencenya daripada toner nya.. thanks yaaa! semoga makin di tingkatkan lagii kualitasnya 🥳",5
"sudah sampe dari 3hari yg lalu, tapi di sistem baru sampe hari ini, jadi gk bisa ulas langsung.
udah di coba dan enak banget di kulit, gk lengket dan kulitku jadi gk terlalu berminyak, sukaaa banget ",5
pengiriman cpt..barang udh pasti ori..kotaknya baguss..agk sticky dikit..tp okelah..smoga cocokk.. 👌😁,5
Bagus bangeet produknya packingnya juga rapi tapi pengiriman dr ninja expressnya super lamaaa hampir 8hari padahal biasanya cepet,5
"ini botol kedua...lumayan, lembut di muka, udah pake paket cica series, walaupun msh blm habis jerawat nya, lumayan, pelan2 membaik...",5
"pertama kali beli produk lokal brand ini, tergiur flash sale nya, emg dah ngincer lama juga sih, hehe. moga² kita berjodoh ya. wish me luck",5
Lumayan lama dtngnya... tapi packing nya sesuai makasihhh npure ♥️♥️♥️,5
"cepat banget nyampenya, goodd
tapi belom di coba,  semoga cocok.. thank youu",5
"bgus bgt, cepet nyerapnya, gk ada bau jg.",5
"Pesanan sudah datang kak dan sesuai request pesanan juga, pengiriman agak lama. ",5
"produk sampai dengan selamat, dibungkus bubble warp rapi pokoknya. penjual juga ramah. pertahankan❤",5
Original dan sampai dengan selamat,5
"Baru mau nyoba, semoga cocok. pengirimannya aja yg agak lambat. ",5
ori aman semuanya okei baguuss bgt dah pake kmrn!!,5
"Baru mau mencoba mudah""an cocok ya😉",5
"Packing rapi, barang sampai tepat waktu, nggak sabar mau cobain semua, terima kasih
",5
"packing nya super skli,smoga cocok dimuka ku",5
Thanks paket sudah sampee :'),5
"Packaging aman, pengiriman cepat, baru dipake semalem udh enak paginya. ",5
"re purchase kesekian kali nya, love love love",5
Baru pertama kali coba semoga cocok 😊,5
sesuka itu sampai beli lagi 😘😘😍,5
"sangat puas, kemasannya rapi banget, cantik lagi
",5
Suka banget sama serumnyaa😍,5
Semoga cocok🥰,5
"Thankyouu kakk udah datengg , semoga aja cocokk ❤️",5
"masih sama, aman, thanks npure",5
overall this is really good 💖,5
"Barangnya bagus baik , udah cocok sih ga akan ganti ganti fix !! ",5
packaging nya gemes bangettt🤠🤠🤠,5
essensnya semoga cocok ini kali pertama nyoba,5
"sudah 2x order,,, toner & essence nya cocok diwajah saya,,,thx u.

",5
alhamdulillah sampai walupun agak lama tapi gapapa. semoga cocok produknya dikulit aku. ,5
aku beli lgsg 2 biar ga takut kehabisan hehehe. enak dan nyerap di kulit ku 🥰,5
Paket sudah sampe. Packing rapi dan waktu pengiriman cukup memuaskan,5
botol kedua ..dan semakin membaik ..,5
Paket lengkap cuma pengiriman agak lama,5
Baru coba sih. Pengiriman cepet sekali,5
semoga bermanfaat utk kulit sensitifku. expedisinya lambat 1 minggu baru sampe,5
"belum dipakai sih, semoga bermanfaat.",5
"essencenya lucu bangetttt 😍, boxnya juga lucu parah. Ini pertama kalinya aku beli produk yang boxnya se cute ini sumpah. Mudah""an cocok di aku ya, kalo cocok aku dengan senang hati bakal purchase lagi 😊😘",5
recommended seller cepat respon . produk ori . cocok di kulit aku ngilangin bekas jerawat dan bruntusan . good produk 👍🏻👍🏻👍🏻👍🏻,5
"packaging kardus cukup besar padahal cuma beli 2 pcs, dapet brosur produk. pengiriman cepat, beli minggu malam, rabu pagi nyampe",5
"mantap! baru bayar kemarin siang besok siang nya nyampe donggg😻 packaging nya lucu jugakkk , Fix sih kalian hrs beli guys! ",5
"sudah diterima, suka bgt, packing jg rapih, aman. kurir udh langganan, semoga cocok dan bisa trs jadi langganan..
",5
Barang diterima dgn baik. Pas bgt mau beli pas liat di IG lagi diskon. Smoga cocok di kulit saya. Thanks seller. ,5
"Buat aku ini terlalu cair tapi so far belom berontak sih muka gw. Pas pake juga enak kok di muka, gak perih samzek. Cuman lama di expedisi aja
",5
"bagus, muka lbh bersih",5
terimakasih lazada paket nya udh sampai ,5
awal nya coba coba eh malah jdi beli terus apalagi diskon terus makin kalap deh ini aja lagi pesen ke 2x nya wkwkkw ,5
love love love terima kasih 😍😍😍,5
recommended 👍,5
"pengiriman cepat packing aman , pake seminggu keliatan pori2 mengecil",5
"Packingnya safety banget keren, pengiriman cepet
",5
"barang sudah sampai, semoga cocok",5
"barang sdh diterima,, meski awalny tdk lengkap.. trims y",5
pelayanannya baik cepet sampe jg,5
Sukaa,5
pengiriman cepat dan packing baik.,5
Gemes,5
ori.. pengiriman juga cepat ,5
ih sukaa sama packagingnya lucu banget,5
"smoga cocok, jd bisa order lg",5
Suka sm npure adminnya baik pengiriman cepet💛💛,5
"packing rapi, datengnya cepat, kurir ramah, produk bagus",5
Udah kedua kali beli inii karena sebagus ituu rek kalo lagi jerawatan😭🤍,5
"datengnya cepet,
semoga cocok pertama coba",5
semoga cocok,5
npure ma kwalitas gg di ragukan lg ..best lah,5
Produk diterima dengan sangat bagus dan asli. Packaging sangat rapih. Terima kasih,5
packagingnya rapi dann aman bgt. semoga cocok. thankyou seller ,5
barang nya bagus pengiriman cepat. thank you seller ,5
Produk original. Pengiriman sangat cepat ,5
semoga cocokk 😍,5
Paket dalam keadaan baik,5
"Bagus bgtt, pengirumanny jg cpt",5
alhamdulilah yg ditunggu udah datang blm dicoba semoga cocok ,5
kemasan bagus ,5
"packaging nya lucu banget, barangnya kecil juga. semoga bagus pas dipakai😁",5
ini cepat banget nyembuhin jerewet2 natzkal hahhaha coba aja kalo ga percaya ak lho smp beli 2,5
aman 👌🏻💯,5
baru mau coba essence nya karna liat review sebagussss ituuuuu. semoga cocok di aku,5
"Suka sama tekturnya yang ringan dan cepat meresap, semoga cocok ",5
"sesuai gambar
kualitas baik",5
barangnya sih original tapi yang bikin jengkel itu pesan tanggal 4,3
baru maau mencoba semoga cocok ,5
Guudd bangettv,5
semoga cocok belum pernah pakai,4
barang sudah sampai,5
Bagusssss banget,5
Good,5
lucu,5
good,5
niceeeee,5
mantapppp,5
❤️❤️,5
