review,rating
paketnya sdh dtg.. dikasih bonus.. tempat sampah mobil.. puas deh.. hanya kamera mundurnya blm dipasang harapan kl sdh dipasang kondisinya hrs bagus.. dan bisa digunakan.. terima kasih yah.. ,5
"Alhamdulillah barang sampai dengan selamat, tinggal pasang",5
pesanan sudah saya terima peking bagus rapi belum saya pasang mudahan hasil baik ,5
"barang dah sampai terimakasih bonus sarung stirn
 ya

",5
"bagus berfungsi dengan baik,  semoga awet. ",5
Alhamdulillah bagus. sesuai order. ,5
