review,rating
"barang ok realfict,kurir nya ramah dah langganan",5
kecewa.. minta putih biru d kasih warna bgitu.. kalau gak ada stok knapa gk chat aja biar dibatalin? malah ngasih tulisan diselipin di paketan ğŸ˜”,1
"paketnya udah sampai walaupun kemarin sempet ggl kirim tadi nya mau di batalin tpi kasian sama anak saya.. kalau dari JNE suka gitu ggl kirim tar di lanjut lagi besok nya,, barangnya sesuai pesanan mksh seler mksh lazada.. lain x JNE harus lebih cekatan.. ",5
"Makasih ya kak barang nya sesuai adek saya suka, kurir nya juga ramah, sekali lagi makasih ya lazada",5
anak2 sangat suka....maksih lazada,5
Ngga nyesel lah bgus pengirimn nya jga cpt bgus ngga nyesel dah ,5
barang sampai sesuai pesanan,5
bandunya bagus anak saya suka,5
Mantap,5
