review,rating
"mksih barang nya sdh sampai
yg dipesan brng nya cocok
tp sayang tidak pakai kotak
pak kurirnya langganan saya
mksih y pak, mksih juga ya kak",5
"baguss banget, pengiriman cepat",5
"uwaaa,aku sneng bngt ps pket ny dtng,wangi+ packing ny juga rapih bngt,smpe emosi aku buka nyağŸ˜",5
"Barangnya Bagus, Penataannya Rapi , Kurirnya Ramah, Pengirimannya oke lahğŸ‘",5
"sesuai pesanan, tapi kok tutupnya kayak ngelopek gtu ya? tapi gpp lah yg penting paket saya datang dgn selamat. parfume nya wangiiii bangtt",5
