review,rating
"bahan nya tebal dan adem, mantapppp",5
"Pengiriman baik
LAZADA Jg Baik karena sy sering belanja di lazada kurir sangat baik.
tetapi saya SANGAT KECEWA DENGAN PESANAN SAYA. SAYA MINTA WARNA COKLAT. DI KRM WARNA cream. INI YG SAYA SUDAH PUNYA 4 UKURAN M NYA KO LBH GEDE DARI BIASANYA KAYA UKURAN L. ukuran L di ganti dgn sampel M di kertas gantung
SANGAT KECEWA. GA TAU WARNA
Mas,alah bahan bagus sesuai harga warna dan ukuran yg jd mas,alah
Terimakasih untuk Lazada dan Terima kasih untuk kurir
Padahal sebelumnya udah saya minta di Periksa sebelum di packing.

BISA DI TUKAR GA BOS 
ONGKIR SAYA GANTI
DARIPADA GA KE PAKE",2
bagus mantapppp . wajib beliii,5
"mantap real pict,....langsung order lagi ini mah.",5
bagus ,5
"ukuran tdk sesuai , yg ukuran M ",3
"Lumayan lah... Tks LAZADA, Kurir dan Seller.. ",4
bagusan bagettt.. bahan nya lembut dan ademm,5
Mantap.barangnya..,5
