review,rating
"Tidak sesuai dengan di photo..
Pesan warna drak grey yg dtg abu-abu tua..
Bahan tipis, jahitan asal, panas dipakainya..
ini sama dgn yg harga 60 ribuan, kirain bkl beda tryt sama aja..
Knp dilazada tdk ada pakaiyain yg bagus kebayakain buat asal-asalan, klu produk lain oke tapi produk busana parah, masukan aja buat lazada",1
"pertama saya beli d sini sesuai dengan gambar yg tertera,
trus sya pesen lagi kok brang ny gg sesuai dengan gambar melenceng sangat jauh 
ok gg pp lah tak kasih B 5 
lain kali tlong d cek ulang klow mau ngirim apakah sesuai dengan fto yg tertera ap tidak ",5
"bajunya bagus,cuma yg mengecewakan yang satu beda dari kawannya..padahal sama kemarin aku pesan.lain kali di perhatikan y sis baik2 order costumer",5
barang ini tidak sama dengan fotonya. tidak bagus,5
Cukup bagus dengan harga segitu. Karna ada harga ada kualitas.,4
"Bagus sich , tapi kenapa saya pesan warna hitam abu ; malah di kirim warna abu hitam kak, bisa di tukar kah,?",5
aku pngn yg grey tuh ada itemnya ini kok jd full grey semua ,1
parahh sekali. bahan sangat tipis. bahas seperti kain umbul umbul. nyesel belanja disini,1
Ya Lumayan lah dengan harga segitu,4
"Bahan bagus, tp sprt seragam pekerja hotel. gak cocok utk ke kantor. ukurannya terlalu besar.",5
"alhamdulillah pssenan sudah smpai,tpi cayang messen ukurn m dtangx L",4
barangxa bagus sesuai yng d gambar pengirimanxa jg cpat... terimakasih lazada...,5
kainnya tipis,3
yah... lumanlah dengan harga segitu,5
sangat bagus gk kecewa makasih lazada,5
Males gua mau belanja lg minta ukuran m datangnya Jambo g sesuai harapan ,5
trimaksih lazada brng bgus realfic pkok'y mntaap,5
alhamdulilah sesuai pesanan.trima kasih LAZADAğŸ˜˜,5
"pengiriman lambat, quality produk standar",1
bagus,5
