review,rating
sangat sangat kecewa udah pengirimanya lama 15 hari eeh barangnya nga sesuai sama pesanan kapok banget belanja di toko ini,2
"Barang tidak sesuai dgn yg di pesan, gaush di beli kalo produk yg ini salah kirim produk dan lama pula, admin ny slow respon lagi ketipu jadi ny
lama nunggu tapi barang yang nyampe berbeda!!! 
gaush beli deh temen2",1
"proses sangat lama dan di kasih barang yang berbeda. mohon untuk pembeli harap berhati hati, jika anda ingin membeli, lebih baik tanyakan terlebih dahulu barangnya tersedia atau tidak. jika pesan anda di jawab oleh bot dan di suruh menunggu, lebih baik anda cari toko lain. mohon untuk lebih cermat dalam membeli ya. untuk penjual jika tidak niat berdagang lebih baik anda tidak sudah berdagang. karena percuma, hidup anda tidak berkah jika berdagang seperti ini. mudah mudahan ini sebagai pembelajaran sesama ya, terimakasih :)",1
pesan dr tgl 30 mei baru diantar td,2
Sedikit kecewa....msen ap dtng'y yg bgni......,3
"barang bagus Peking rapi ,cuma pengiriman lama banget sampe 6 hari ",5
lama datang barangnya tapi buat jernih tv nyah,5
"Tidak sesuai pesanan tapi gak apa-apa karena kualitas gambar cukup bagus, makasih ",4
"dtng tidak sesuai, yg dtng mlh yg kotak ",4
antena nya beda sama yg di pesanan,5
barangnya bagus .makasih lazada,5
barangx bagus..tdk mengecewakan ..makasih lazada,5
mksh,5
