review,rating
"Antenanya sampai dengan baik, tapi fungsinya jelek sekali, di tengah kota cuman dapat Indosiar dan SCTV dengan kualitas gambar yang sangat buruk",2
"Tks barang sudah diterima, tapi belum berfungsi dengan baik, hanya tertangkap TVRI saja, mohon sarannya.",5
kecewa ga bisa d pake di tv ku  huuuhhh ,1
"barang bagus , sesuai gambar.. tapi kualitas nya biasa saja, tak ada beda nya dengan antena biasa..
",5
"kurang cocok untuk daerah yg emang susah sinyal karena ini antenna indoor, klo daerah sinyal bagus pasti gambarnya bagus ga ngelag2 ",5
"Jernih, untuk beberapa chanel sih ada yg kabur tp so far all jernih.
Mulussss",5
"tetep Gak bagus gambar nya !
masih mendingan yg lama, 
akhirnya tidak terpakai !!",2
"Barang sesuai, untuk seller mungkin lebih diperhatikan untuk pengirimanya ya. ",5
hampir sempurna,5
Bagus n berfungsi... Terima kasih ,5
"barang bagus sesuai yg di inginkan, moga aja berfungsi dengan baik",5
"barang diterima dengan baik, masih dicoba mencari sinyal yg bagus",5
