review,rating
"maaf hasilnya kok tidak bagus ya,gimana cara masangnya",5
parah barang nya rusak ,1
"produk sampah, tidak berfungsi sama sekali. penjual penipu.
tolong lazada agar ditegur.",5
"mf baru ngasih info,,,lumayan antena nya semua cenel da gambar nya,,,lucu antena nya kyk kipas tapi jempol siiio dh..mksh y lancar orderan nya...",5
terimakasih barang sudah sampai gambar bagus jernih gak kecewa,5
"kurir     ramah  baik      barang   bagus pokoe
jos  dah   blanja di  lazada ğŸ¤­ğŸ‘",5
Mntp pesen kmarin sore. Sekrng udh di tngan. Tks lzzdda. Mntul,5
"Sory agak telat ulasan ya, barang sdh sampai paking rapih, ok",5
Alhamdulilah barang nya udah datang tp msh bingung cara pake nya ,5
"barang cepat sampai, thanks",5
"barang nya bagus, hasil gambar jernih, tp nggk ada channel luar nya/ada tambahan yg lain? ",4
lumayan,5
