review,rating
"GOOD , SELLER AMANAH, THANKS PUTRA JAYA ",5
"packing rapi,sesuai estimasi,kurir langganan thxs lazada",5
"Paket sudah diterima sangat memuaskan,  barang realpick sesuai harapan dan sangat bagus,  pengiriman cepat dan resfon seller sangat baik,  kurir baik dan ramah,  terimakasih untuk Sellers Karya Tiang dan Lazada. ",5
"bagus boz ku... mantap,  packing juga rapih... tq
",5
packing rapihh aman top dahh,5
sesuai harapan semoga awet....,5
blum aku buka kayak baguslah. ,5
"sesuai harapan, salahnya gk psen 2.
sya kira bakalan cukup",5
"barang ok to blom dipasang thx
",5
"ok.
",5
bagus,5
"Barang bagus bgt, harga murah, packing rapih, pengiriman cepet.. mantap pokoknya",5
Sesuai dengan gambar... pengiriman cepat... ,5
Barang sdh datang terima kasih lazada,5
ok,5
