review,rating
"Respon penjualnya cepat,baik. Barangnya sesuai deskripsi,
Gambar lumayan baik.
Namun maaf,  kami tetap  pakai antena yang lama saja (daerah Cibitung). 
Mungkin pada daerah yang lain, antena ini lebih jernih.

Terima kasih.
",5
"gambar tv-nya biasa aj.gak ad istimewanya.gak jernih msh ad semut.
",5
Daerah Balikpapan sulit dapat siaran,3
Alhamdulillah barang sudah semoga awet tp pengirimannya agak lama ,5
"belum dicoba, mudah2an berfungsi dengan baik",5
terimakasih paket kami telah sampai ,5
"kwalitas produk memuaskan, mantap",5
"ok...
",5
