review,rating
barang sesuai dengan gambar cuma saya bingung ngclisi ulang batre nya maklum (saya) manusia jadul hehehe,5
Mantap bagus paking rapih sayangnya saya baru pake 1 minggu sudah rusakğŸ˜€ lumayan untuk harga segitu tenks,5
gimna cara pake nya ba,5
Alhamdulillah barang pesanan saya udah sampe,5
Barang datang sesuai pesanan,5
makasih pesanan sampe dngn ramah kurir ny,5
mantappppppppp poolll,5
"Barang bagus ga mengecewakan, suaranya jga ngbas bgtt pokoknya ga nyeselğŸ˜Š",5
kak punya aku status nya udah di Terima. tapi aku belum Terima barang nya ,5
"alhamdulillah sampai bisa langsung digunakan suaranya bagus ngebass,,fast respond rekomendasi bgtt",5
Suaranya baguss ngebass mantuullll mkash bangettt seller lazadaaaaa fast respond,5
"kecewa
",1
