review,rating
"mf duluan agak kecewa bangat,masa 4 di pesan cuma 1 yg bagus selebih nya bocor semua jd sia2 pesan segitu,klo yg kemas bagus dong mbak,jd buat kecewa aja,ğŸ˜”",5
"sesuai tetapi sedikit kecewa karna barangnya, ngerembes 1 isinya tinggal separoh ",2
kecewa barang ny bocor,2
Mantul mntap betul,5
"yaaa ngga ori, serbuk bener, tapi cairan putih aja alkoholnya kebanyakan. ",2
makasih lazada barang ya bagus sya suka....makasih jga kulir ya yg rama ,5
Alhamdulillah ketemu yang ori yg ada bulir2 didalem tonerny makasih lazada,5
ğŸ™‚,4
