review,rating
"Kecewa,, tumpah.. Tinggal sisa segitu,, udan nunggu2 pas ktrima gini knyataan ny.. Pdahal saya udah wanti2 ngcht k toko ny agar jgan ampe tumpah ky yg kmren pesen sepaket.. Tp haduhhh.. Mdah2n d ganti.. 😥",3
Udah langanan disini udh gk kehitung brapa x order dsni krna toner y bnr2 ori dan nyengat dn dingin.jgn diragukan blnja Sani ,5
Udah langanan disini udh gk kehitung brapa x order dsni krna toner y bnr2 ori dan nyengat dn dingin.jgn diragukan blnja Sani ,5
"pket udh saya terima tp isi y tumpah semua g ada sisa sama sekali tolong lain kali d perhatiin lg.....sangat kecewa
",1
real pic kmsan rpi smg cocok,5
iya barang sudah sy terima tapi salah ' yng sy pesen toner hn tapi yang di kirim sabun paya tpi g pa2 tpi lain kli jngn gitu gi,5
Alhamdulillah akhrnya pesanan aku datang jg udh order yg kebrapa lupa pokoknya blnja disini ori dn amanah,5
Alhamdulillah toner hn yg ditunggu datang jg hmpir 1 bulan menunggu ready jg udh gk bs pindah ke toko lain udh langanan ditoko ini beautyholic shop.beda ditutupnya aj tpi isi nya sama dn ori nyengat dn dingin.smga slalu amanah y,5
Barangnya muantul,4
Alhamdulillah udh order yg ke2 x toner hn disini dan ori jg kualitas y sesuai jgn ragu pokoknya pesan di beauty shop.smga jd langanan y sis dn amanah trus,5
"Alhamdulillah sesuai pesanan toner y ori dingin dn nyengat,pokoknya is the best blja dibeautyholic shop udh langanan dsni.jgn ragu toner y bnr2 ori",5
"Alhamdulillah barang nya ori ,,, pokonya bakalan langganan deh ",5
Pokoknya dijamin ori toner hn y udh kesekian x blnja disini amanah bgt.,5
Ko tutupnya beda sih ga kaya saya bli setiap membeli seperti biasanya.,5
"tutup botolnya warna kuning ga disegel pula takut ga ori
",3
pesenan yg sekian x ny,5
Toner ny kya kw..soal ny pas d pke g dingin g menyengat,2
Tuner by ok ORI lg mksh,5
mudah²an cocok,5
"sip lh buat lzd dan toko ny

",5
"orderan yg sekian x ny
seller ramah
kurirny pun baik
ttp prthankan kepuasaan konsumen
thanxs lazda",5
Baguss... ,5
Bgs bgt,5
tks lazada,5
