review,rating
"Warna gambarnya agak pudar,Terus ga ketutup semua,Selebihnya oke,barang nya bagus,ga penyok kayak kebanyakan yg komen",4
Bgus brgny sesuai gmbr..tp ko g ketutup semua y..jd mikir mikir LG mw dipake..g terlindungi semua bdnnya.,3
"barangnya sdh sya gunakan... barangnya sangat bagus, cantik d lhat, dan sesuai dengan yg d gambar. terimakasih",5
"mantafffff,,,casingnya bagus banget,,pengirimannya cepat..terima kasih
",5
"bagus banget realpict.tidak mengecewakan.thanks lazada.
cuma kurirnya aja sedikit nyebelin",5
"makasih lazada barangnya bagus sesuai sma gambarnya , kurir nya ramah pula , pertahanin ya lazada , saya puas belanja di lazada gak pernah mengecewkan .",5
"Terimakasih lazada.
 Barang di kemas rapih.dan sesuai dengan pesanan saya.. ",5
bagusssssss ,5
kurang suka ga ketutup semua plus penyok di bagian tombol'y,2
saya suka bagus bgt,5
"pengiriman nya ngga sesuai pesanan, padahal saya mesen yang antique white malah dikirim yang lain",1
"Lumayan sihh,  wlwpun penyok dikit pas tombol on of nya,  tpi ttp bgus",2
"Case nya sangat bagus sekali
Kurirnya ramah lagiğŸ¤­ terima kasih lazada",5
"bagus banget sesuai gmbr,,pokok y puas..trima kasih seller trima kasih lazadağŸ™",5
sumpah kerennnnn bnget â™¥ï¸â™¥ï¸â™¥ï¸,5
yakayakayakaya Aya........yayaaaahhhh,5
barangnya bagus datengnya,4
Casing nya bagusss bgt aku suka Mantul minâ¤ï¸â¤ï¸â¤ï¸,5
bagus banget,5
bgus cesing yh mksi y lazada,5
case nya baguss.sesuai gambarr juga.mksihh lazada,5
"samping bawah barett parah,jd jlek ",3
Barang sudah di terima kurir ramah,5
mantap skali lazada..,4
Realpict,5
barangnya bagusss sesuai sama gambarnya lucuu bgd lagi ..,5
"terimakasih lazada,paket rapi dan sesuai pesanan",5
"barangnya bagus, belanja di lazada selalu memuaskan",5
Lumayan bagus,3
bagus suka,5
jelek...,1
relpict,5
