review,rating
Pengiriman cepat ..... barang sesuai pesanan.....barang aman karna terlindungi berlapis2.... pokoknya mantap pisan,5
"Bismillah.... alhamdulillah pesanan ku sudah tiba, packingannya Masyaa Allah double"" jadi safety banget.
Sutil dan spatulanya good quality serta keras gak letoy.
Insyaa Allah brkualitas juga kalau dipakai masak.
Terima kasih yah kak.",5
Barang sudah d terima dengan baik cuma jepitan nya agak keras. Blm d coba apakah kuat utk menjepit. Harus pake tenaga utk menjepit. ,3
"Packing aman, sesuai pesanan. Packing agak lama. Sesuai pesanan.",5
"sesuai deskripsi.. bagus kuat
. semoga beneran nggak nggak meleleh.. kurir ramah langganan..",5
produk ORI IKEA.. good product..,5
"cocok di gunakan barang jg bagus, recommended lah",5
