review,rating
"awalnya saya tertarik beli karena liat gambar.sepertinya bagus dan kuat.tp ternyata bahannya sangat tipis dan mudah penyok.
jualan kalau mau banyak pelanggan dan jangka panjang mending yg real pick 
karena pembeli akan memberi ulasan sesuai barang yg diterima.",1
barangnya sudah dipakai ternyata meletoy besinya tidak kekar..,3
sangat2 mengecewakan.pesanan ngk sesuai dengan yg di inginkan..klo jualan yg benar dong ,5
"terima kasih barang sudah sampai , barang sesuai pesanan.
",5
puas keren,5
