review,rating
Thanks.. Paketan sudah diterima sama ibuk saya d rumah.. Aman sentosa. Rekomended.. Terbaikk.. Thanks NNC Shop,5
"barangnya bagus dan packing nya rapi ,makasih",5
Jgn beli barang ditoko in I penipu barang apa an nih peyok  pesen y apa di kirim y apa rugi gua malah tip is jelek  lgh  took penipu,5
alhamdulillah barangnya real pict gak lecet sedikit pun pengirimannya juga cepet.kurirnya juga ramah gak nyesel deh belanja disini luvv banget dahğŸ˜,5
mintanya happy call yang di kirim HC penipu,5
"Nnc shop thk'z puas belanja d sini
Thk'z lazada",5
bahannnya tipis gk sesuai gambar...bisa di tukerkan gk?,5
"Alhamdulillah pancinya bagus ,
Terimakasih lazadağŸ˜",5
"pkokx puas bngt, pacingx rapi. ckup 5 bntang aj ya",5
"barangnya bagus cuman gak ada tutup kacanya

",5
ini gimana susah di buka di pakein nya gampang tapi di bukanya susahh,2
makasih barang ny udh sampai dgn mulus....buat kurirnya the best,5
biar bintang yang berbicara....,5
thanks gan sangat memuaskan..seperti yg dipesan,5
"Barang sesuai pesanan kurir ramah, trims lazada",5
Terima kasih lazada barangnya bagus,5
mantap,5
