review,rating
"Barang diterima dalam kondisi packing sangat baik dan isinya sesuai dengan yg dideskripsikan.
Cuma ada sedikit masalah ketika mau cek segelan botolnya, ketika tutupnya dibuka segel sudah terbuka dan lepas.
Biasanya segel menempel dgn rapi dan kuat, untuk membuka segel pun perlu sedikit tenaga untuk menariknya.
Setelah saya amati keadaan bagian dalam tutup botol masih bersih dan semoga memang isinya masih utuh.
Saya pemakai produk Meguiar's jadi cukup tahu bgmn produknya dikemas rapi dan untuk hasil pemakaian perawatan kendaraan sangat memuaskan.
Senang berbelanja di toko ini, semoga selalu sering menghadirkan diskon-diskon produknya.
Recommended Seller nih.",5
"memuasakan, sesuai pesanan, respon seler cepat. meguiar tak bisa d ragukan ",5
"Sesuai yg diharapkan , namun belum dicoba produknya... semoga tidak mengecewakan",5
cepet dan original ,5
"mantappp sellernya barang lgs kirim, barang sesuai. good lah pokoknya",5
"packing rapih mantul jiwa dah. 
",5
"recommended seller,barang ori packing rapi buble wrap dan kardus",5
"mantap barangnya sudah sampai, kualitas terjamin",5
"murah banget pas promo, barang meguairs ga usah diragukan lagi...",5
Packing rapih pengiriman agak lambat,5
