review,rating
thanksyouuu lazada you are the best,5
"brush nya kecil"" banget kurang memuaskan",3
kuas nya bagusss murahh lg mantep pkonya,5
sudah sampai barangnya,5
sangaaat puasssss....,5
sukses buat lazada,5
"barangnya bagus, selalu memuaskan beli dilazada",5
"barangnya bagus, selalu memuaskan beli dilazada",5
selalu memuaskan beli dilazada,5
aku kira besar rupanya kecil tapi lumayan lah untuk harga segitu ,4
trimakasih barNg sudah sampai,5
datang nya lma tapi lumayan bagus,4
sudah diterima  dengan baik ,5
"pengirimannya baik, barangnya juga sesuai. bintang 5",5
sangaat cepat pengirimannya,5
barang sesuai yang digambar. top,5
"sesuai pesanan, dan fast respon",5
seller ramah dan fast respon,5
"sesuai, pengiriman tepat waktu, kurinnya baik",5
langganan  selalu ditoko ini,5
sangat sesuai dan tepat waktu,5
bagus,5
