review,rating
"untuk yg ini saya ke tipu pengiriman lama giliran datang bukan produk yg d pesan poko nya saya ketipu kecewa banget buat tenen ""jgn beli produk ini cukup saya yg ketipu kurir nya juga ga ada komfirmasi ke saya kalo barang mau d datang apa coba yg di kirim cram harga 5rb an satu kata kecewa banget  pennjual nya ",1
pengiriman keliru tp g dikembalikan mintanya bintang 5 padahal sudah 3bulan lebih,5
tidak sesuia pesanan..barang mau sy kembalikan..tlg dong..yg cermat.. asal kirim..,3
"bagus banget
",5
