review,rating
"paket udh smpe,huuuh baru kali nie beli d lazada sangat kecewa,pesan wrna biru yg dtng merah,merah mah udh pnya,ga mau beli lg lah",5
"alhamdulillah barang nya dh sampai dan bagus
   gk da yg rusak
pokoknya puas deh belanja di lazada
    dan makasih juga yg abang kurir semoga sehat slalu..ğŸ¤²amiiin

    ",5
dapet warna merah... bagus juga buat gantung baju bayi atau daleman...hehe trims ya ğŸ‘,5
"lumayan,, lakh dengan harga segitu..
tp sayang pesen nya warna biru tpi datang nya warna merah,, tp gpp.. makasih buat kulirr nya 
makasih lazada",5
gantungan bayi y minta warna biru yg datang warna merah ,5
"bguss bgtt suka suka
",5
"terima kasih atas pengriman nyah saya puas
",5
"bahan mudah rapuh hati""",1
ya lumayan lh untuk hrga sgitu,4
makasih BRG dah SMP hangernya sesuai gambar wrn nya pun hijau bagus...tuk kurir makasih,5
mntp meluncur dngn slamet mkch lazada,5
Realpict,5
puas,5
