review,rating
"petisnya yummy.
pdhal tokonya di deket rumah. tpi hrs beli online krna skrg tinggal di Depok demi keinginan makan lontong mie khas Surabaya ",5
"karna di Kalbar gak ada aku cari asli Sidoarjo ,,,,, mau bikin tahu Tek Surabaya hhh,,,kangen masakan Jawa ,,,manteb pokoknya",5
tempatnya pecah satu ,3
"barang di terima dalam kondisi baik. cuma pengiriman agak lama untuk Bandung - Surabaya setelah 4 hari.
",5
"Sedaaappp buat cocol tahu, cemilan dalam mengikuti anjuran pemerintah berdiam diri dirumah ğŸ‘Œ",5
terimakasih kurir ramah barang sesuai pesanan,5
Mantaaaap,5
"biar bintang yg berbicara. mksih seler, lazada. ",5
kualitas tidak di ragukan ğŸ‘,5
