review,rating
"maaf br kasih ulasan soalnya tak cb dl barang dah dateng warnanya bagus tp sayang yg satu kayak udah dipakai,kurirnya dah langganan",4
Barangnya kayak udah pernah dipakai.. Kecewa sayaa,1
henna nya bagusss bangett...pengiriman nya cepet sesuai estimasi....maaf ya baru kasih ulasanğŸ˜...terima kasih buat abang kurirğŸ˜,5
"pas d buka kemasannya penyok,, untung henna nya masih aman, warnanya jg bagus.",4
"packing rapih seler baik kurir baik hena raninya bukan seperti yang biasanya.....
",5
