review,rating
"keycaps ilang 2, saya minta key nya dikirim dibales thumbs up doang.... untung masih berfungsi
lain kali double check paketnya sebelum dikirim
walopun cuma 2 key tapi tetep aja klo jualan tuh yg bener",2
"paket sudah sampai
bagus & sesuai pict
tapi kekurangan nya kaki nya patah satu & packing bubble wrap nya sobek 

tapi tombol berfungsi semuanya
ksih bintang 4 dulu soalnya ada kekurangan 🙏",4
"Barang mantap, walau pengiriman lama, mungkin karena lagi pandemi, saya maklumin, ga masalah. barang berfungsi, warnanya statis sih, tapi gpp, kualitas barang lumayan, walau plastik tapi feel-nya lumayan solid, tombolnya juga lumayan lah ya, intinya sesuai harga, cuma ada beberapa bagian cat yg kurang rapih, saya sudah cantumin fotonya, terus bagian bawahnya juga bagus, ada teksturnya gitu, ada karetnya juga di bagian bawahnya, biar ga licin, bisa ditinggiin juga keyboardnya, biar ngetiknya enak, kabelnya lumayan tipis tapi ada teksturnya gitu, pokoknya overall mantep lah, harga segini, lumayan. ps : buat yg gak tau cara nyalain backlightnya, tekan tombol ""scroll lock"" yang ada di pojok kanan atas.",5
"rusak sudah patah dibujungnya, saya kecewa bisa ditukar dengan yang bagus gk, ",5
"maaf , udah komen jelek, ternyata murni ketidaktahuan saya, LED nyala semua...pencet scroll lock...maaf ya sudah saya ubah ke bintang 5",5
"barangnya bagus matapp ,packnya juga rapihh , sayang ad beberapa tombol yg mencetnya harus di teken bangtt ,dan pengiriman agak lama ,gpp deh mantapp pokonya👍👍",5
mohon tolong dicek terlebih dahulu atas barang yang rusak dikirim ? katanya di cek dulu sebelum dikirim,1
"keyboardnya bagus, walaupun kemasannya nggak terlalu bagus, dan beberapa tombol di keyboardnya cuma blank (warna putih doang). tapi worth buat harga segitu. makasih 🙏🙏",5
"barang oke kualitas sangat bagus, tapi pengemasan barang sangat lama, saya maklumi karena masa pandemi seperti ini",4
"Alhamdulillah keyboard nya datang dengan selamat ga ada yg rusak dan berfungsi semua, bisa nyala jg anak saya suka, thanks seller n lazada",5
"keyboard terkelopek saat barang dibuka, bagian tombol F1 tidak dapat kembali normal setelah ditekan, sisanya barang dalam keadaan bagus, terimakasih Lazada sudah mendengar keluhan konsumen",5
wow tidak ada kecacatan,5
top lah 👍👍,5
"barangnya sesuai pesanan, berpungsi dengan baik, terimakasih gan..",5
BARANG MANTAP BANGET,5
"ok keyboard normal bagus, hanya saja pengiriman lama sempat awal nya di batalin oleh pihak lazada nya, ga tau produk kosong atau gmn, ini yg ke 2x nya pesan allhamdulillah bagus",4
"Alhamdulillah... barang sudah mendarat dengan cepat, selamat, mantapp.. fungsi normal semua.. terimakasih Lazada makasih mas e kurir.. sukses selalu buat semua.. 

",5
"Barang berfungsi baik, tidak ada lecet, pengemasan juga oke, ga ada masalah kok...sesuai pesanan",5
"Packing nya rapi gak ada kerusakan
Berfungsi dengan baik",5
anjay mantap,5
"mantull,,,,👍👍👍👍",5
"Barang baik, worth  lah, sesuai dengan harga",5
worth it beli nih👍,5
"barang nys udh sampai, mantap lagi",5
"sangat bagus,dan murah sekali",5
sukaa bangeeeeett😍😍,5
"keren bang warna-warni sangat menarik 
",5
"saya kasih bintang 2 dulu,,,karena saya pesan keyboard dan sedotan .. malah yg datang cuma sedotannya doang tp status pengiriman terkirim semua ... gimana nih...moga ada respon cepat dr adminnya...pengiriman lama...",1
"Sangat puas dengan hasil pemesanannya kakak😊.
Bingkisannya rapi, pengiriman cepat, kurir ramah, dan pesanannya sngt bagus, brang tidak ada yg cacat. terimakasih kakak😍",5
"Sudah diterima dengan selamat, pengiriman cepat, barang berfungsi dengan baik, pokok nya the best dah",5
mksh lazada keyboard nya bagus banget. ga nyesel deh beli di sini.   pengiriman nya juga cepat kurir ramah,5
"Worth it untuk harga kurang dri 100k.
keyboardnya berfungsi dengan baik, no minus.
kalau ada yang maki"", cek review sbelum beli sama baca deskripsi.",5
"barang Bagus, Berfungsi dengan baik dan Normal walaupun, Pengiriman nya agak Sedikit lama, yaa mungkin Karna lagi Pandemi gini jadi lama Pengiriman nya",5
"barang udh sampe.... pengirimannya juga cpt banget. terus barang nya real pict. semua berfungsi dengan baik. kurir nya juga ramah... puas pokoknya
",5
Sudah mendarat nii alhamdulillah bagus dan menarik bisaa di atur nyala dan matinya lednyaa lumayan lah untuk hiburan hehe ,5
"barang udah sampai, kondisi bagus tapi lampunya gak nyala.next sebelum di kirim di coba dulu,kasian pelanggan nya😔",2
"recomended dah mantaaap 
sangat puas , kalau mau nyalain lampunya klik scroll lock ya , di keyboard nya ada tulisannya",5
"mantap lah, sesuai harga gan dan bagi kalian yang ga tau nyalain RGB nya, clik aja tombol SCROLL LOCK ><",5
"╚»МĂŃŤĂР«╝ semuanya berfungsi, pokoknya top markotop deh keren banget asli recommended sii ini mah, ayo yg lain juga jangan ragu kalau mau beli keyboard ini.",5
"Mantap, Barang Sampai Tepat Waktu, Tombol Work Semua, Lampu Nyala, Jari Nyaman kalo ngetik. Saya liat ulasan lain lampunya lebih terang entah efek dari lampunya yang terang atau dari kualitas kameranya saya kurang tau, Tapi buat saya No Problem ga terlalu terang juga gapapa seng penting masih bisa dipake+mulus hehe...  Thanks Min  👍🏼",5
"pengiriman cepat,barang bagus,cuma ada minus patas sedikit di bagian pojok kanan,tpi masih berfungsi👌👌",4
"barang sudah sampai tapi keybord tidak berfungsi lampunya, tolong saya minta di tukar dengan produk yang sama ",1
Gimana nih bisa di tuker GK masa barang baru eror pengiriman sih cepet kurir ramah tapi barang GK sesuai yg di harapkan malah rusak,1
"barang sampe dng aman, kurirnya juga baik hati dan tidak sombong, terus keyboardnya nyala"" wkwk, kalo mau nyalain keyboardnya tinggal cari tombol SCROLL LOCK , jangan norak ngapa udh beli malah gatau nyalain lampunya wkwk",5
"baru pertama kali beli di lazada ini, tapi barangnya bagus banget dah, terus itu lampunya juga nyala, pokoknya bagus banget",5
Mantaplah,5
pokoknya puas,5
barang nya oke bagus ,5
Mantap berpungsi semua.  Gak nyesel bli disini.  Trima kasih,5
"tombolnya agak keras, sesuai dengan harganya.
untuk kalian yang ngeluh keyboarnya ga nyala, tekan tombol gambar matahari",5
Alhamdulliah Barang yang sangat bagus sebagus bagus nya Terima Kasih banyak lazada sekali lagi Makasih,5
keyboardnya ..bagus .. minimalis .. tp lumayan keras tombolnya di bandingin sama merk keyboard yg dulu saya pakai,5
"kecewa sumpah, udh nunggu agak lama, pas nyampe barang gk nyala, gk nyambung. gk berfungsi dengan baik, rusak. makasih ya :) ",1
keyboard nya bagus berfungsi sebagai mana mestinya tidak mengecewakan recommended seller deh good job 👍👍👌👌,5
"Keseluruhan bagus sih kualitas yg baik untuk harganya yg murah tapi, tombol spacenya agak rusak yg dateng ehhehe...",4
pengiriman lama tapi udah mendarat barang aman no cacat tanks semua lazada.toko.dan kirirnya biarpun pengiriman lama,5
"barang sesuai, pengiriman cepet",5
empuk ...kaya pnya dia..suka keren pokoknya...,5
"barang sudah trima, cuma agak kecewa gk sperti digambar lampu led nyala, saya minat karena ada lampu lednya nyala, ini mati sm aja keyboard biasa ok trmksh Lazada",5
"tampilannya oke, tapi klo dipake ngetik agak-agak gimana gitu. tombol spasinyaa kadang nggak kepencet. tpi, overall bagus buat harganya",5
"maaf baru kasih ulasan,Keyboard nya mantul..rekomended sekali untuk harga segitu..tombol agak keras waktu pertama pakai.kalau sudah lama pasti jadi empuk kok...kurir juga ramah..pengiriman cepat ...RGB keren..tombol fungsi semuahh...Buat kalian yang ga tau cara hidupin RGB nya,cari tombol scrool lock yg ada gambar lampu nya...2 kali blanja disini MOUSE dan KEYBOARD...Thanks👍👍👍👍👍",5
"oke pengiriman lumayan packing rapi tanpa cacad ,barang ketika di coba keren tanpa kendala pokoknya jangan ragu lah buat beli di toko ini ",5
"secara keseluruhan baik dari penjual dan barangnya baik dan bagus, cman produk yang saya dapat keyboardnya bisa berfungsi bisa tidak berfungsi",4
"mantap, barangnya mendarat dengan sempurna, setelah di cek, ternyata baranya aman, dan setelah dicoba barang berfungsi dengan baik, dan juga kualitas barang sangat oke.

Terima Kasih👍🏼👍🏼💚💚",5
semuanya bagus aku sukaaaaa pengirimannya juga cepet datengnya mulus tanpa kerusakan apapun dan lampunya juga nyala suka beneran,5
"barangnya bagus tidak mengecewakan,terimakasih",5
"Trusted.. Fungsi Normal, Sesuai Pesanan, Keyboard Istimewa",5
sorry ya bintang 2 solanya lampunya GK nyalah kecewa banget,2
keyboard nya gk nyala dan gk jalan,2
"produk sangat baik, semua fitur dapat berguna sesuai fungsinya",5
"mantappp kaliiiii, gak nyesel beli disini recommended lah pokoknya ",5
"tks all, work 100% N Im very satisfied
",5
"keyboard tidak berfungsi,, pingin tuker barang atau kemblikan uang,, ",2
"barang oke, pengiriman 2 minggu? barang inden? wkwk ngakak di chat gadibales",4
"Bagus keyboardnya semoga awet... Kurirnya lama, penjual cepat responnya ",5
kurir sangat ramah..ganteng..top..barang ok..,5
"bagus,sampe nya aga lama,rekomend,belom di coba,semoga awettt",5
Nicee.. barang berfungsi,5
2 keyboardnya berfungsi dengan baik.hanya pengirimannya yg sedikit lama. ..terima kasih.,5
bolela dengan harga sgni mantap,5
"kurir ramah,keyboardnya nyaman sesuai yg digambar,walaupun lama tapi gpp lah worth it 👌",5
mantappp lah pokoknya 💯,5
barang ok sih cuman kok patah ya bang.bang sekarang malah GK bisa nyala,1
mantab sesuai pesanan dan berfungsi semua,4
ntaps gan buat ukuran harga segini,5
"packing bgs,tapi barang gak sesuai lampu lighting nya ga Ada yg nyala,apakah tdk di test dulu sebelum dikirim,bagaimana ini ?",2
"good lah pokoknya, barang sampe dengan selamat 😇",5
top cuma sayang warna nya ga berjalan ,5
"barang ok,  mantap",5
mantul barangnya,5
REALPICT 👍 GOOD QUALITY IS THE BEST KA 🙏😎,5
"Buat yg bilang lampunya g nyala coba deh teken tombol scroll lock, sama yg bilang cuman 1 mode warna, ini kan backlight bukan RGB, kalo RGB baru bisa ganti²",5
mantap oder ke 2 kalainya  cepat sampainya jos tanks lazada dan kurirnya,5
sesuai dengan pesanan ,5
Sesuai dengan pesanan . Terimakasih,5
Good sesuai sm hargaa,5
barang tidak sesuai barang tidak bisa nyala ,1
"awalnya gx nyala karna gx tw buat ngidupin lampunya, trs di lihat sambil mikir akhirnya bisa, skalian mw share buat yg blm tw biar tw,, keyboard real pict, pkok ny sesuai banget recommended yg mw beli oc👍😊",5
"KEYBOARD GAK NYALA DI JUAL GIMANA NIH ? , YAUDAHLAH YG TERJADI BIARLAH TERJADI , BIAR DI TANGGUNG DI AKHIRAT ",1
Kecewa ! Banyak tombol yng tidak berfungsi.. sangat kecewa. Lampunya doang bisa nyala. Tombolnya banyak yang gak berfungsii... SANGATTT KECEWA :(,1
"lama anjrit dikirim baru H-1 nya sebelum batas pengiriman paket, tapi barang oke sih mantap, tanks ka",3
"pengiriman amat sangat lama
dan saat ditanya customer tidak diberi kepastian hanya dibalas dengan emoticon
responses penjual juga kurang memuaskan
mohon diperbaiki lagi untuk pelayananannya agar tidak mengecewakan ",3
"saya pesan 2 item (keyboard & tumblr) tpi yg dtg cuman keyboard, saya chat minta refund tpi g direspon dengan baik",3
mantul....respon saller cepat,5
"mantap,barang ga ada yg cacat,bagus,tolko nya amanah,wajib bli d sni,semoga semakin sukses",5
makasi byk dtng dengan baik,5
"barang oke, pengiriman parah lama banget hampir 10 hari",4
Bagus Sayang agak Terlambat ngirimnya,4
"barang seauai harga, kemasan ok, kurir ok, respon penjual ok, pengiriman lumayan. terimakasih kepada semua yg bertugas",5
"Barang bagus banget , pengantaran cepat sekali ,respon baik ",5
Barang ya bagus cuman tadi agak binggung untuk yalain lampu ya buat kalian yg mau yalain lampu ya cari tombol yg gambar matahari di atas pojok kanan ,5
barangbsudah sampai bagus..aku kira mini ya ternyata panjang seperti kiboard untuk komputer jd nggak bisa masuk tas laptop,5
"Masih lebih nyaman keyboard votre yg harganya setengah dr harga ini. Menang warna lampu doang, selain itu pencetan kibot + multi touch nya dibwah standard.. ",3
"Barangnya bagus, cepat sampai juga, mantap",5
Datengnya keyboard versi arab wkwk,5
"Barang macem apa ini ketikan keyboardnya ngaco,mau minta return pasti gaakan bisa karna gaada kertas buat returnnya,payah👎🏽👎🏽👎🏽👎🏽",1
Mantaf sesuai pesanan,5
Gak bisa digunakan gan .. kalo jual barang yang bagus bagus ajaa atuh .. jangan yang rusak malah dijual .. nyari yang halal halal aja bossss,2
barang nyampe dengan selamat dan berfungsi dengan baik cuma dalam kondisi kebasahan kardus rusak parah sekian terimakasih,3
"Cukup bagus. semoga Awet yah.
Saran dikit. Tolong lebih rapih lagi dalam packingan barang nya. ",4
"keyboardnya kerass..gk enak di pake main gameee
ngeklicknya sekali bisa tiga kali ke pencet..jdi susah buat main",1
"Alhamdulillah barang sampe dengan selamat rapih semua sesuai gambar thanks 
",5
maaf untuk penerimanya atas nama siapa yaa? soalnya sampai saat ini barang belum sampai. tapi keterangan sudah di terima,1
"Dah nyampe barangnya,sesusai ama pesenan,bang kurir nya juga ramah",5
"barang udh lama nyampe udh lama, barang bgus keren👍🏼👍🏼",5
"barang nya cacat, lampunya tidak bisa menyala,
gimana ni bg,
kecewa saya kalo gini ceritanya",1
"barang bagus dan berfungsi, tapi warna keyboar berbeda dengan yang saya pesan",3
alhamdulillah 🙏🏻,4
wish ga nyesel beli barang ini . barangnya keren bagus ajib . wajib di beli,5
"Gilaa dah mantap, barang mulus, kurirnya juga ramah",5
warna hitam tapi ganyala lightnya bisa di tuker ga ya??,2
"nice bgus, ngk nyesel belinya,, mntap jiwa",5
"barangnya bagus 
semoga awet lama terimakasih",5
barang sampai dengan aman. tapi belum di cobak.terimakasi ,5
Mantaap... Biar bintang yg bicara 👍👍👍,5
"barang sesuai mantap GK mengecewakan
",5
"Pengiriman cepat,  semua tombol berfungsi baik thanks lazada,  seller... ",5
"bagus, semoga awet, thanks",5
"paketnya sudah di terima tepat waktu dan kondisi mulus berdungsi dgn baik tidak ada kendala. 
kurirnya juga ramah. 
makasih lazada",5
Barang dah datang tapi ko kardus nya kondisi sobek ya? knapa itu bisa terjadi? 😡,2
"Barang oke, tapi blm di coba, semoga berfungsi dengan baik",5
Bagus bisa di pake,5
tombol ctrl nya ilang satu gmn tuh?,2
barang sudah sampai belum di coba,5
"Barang dan kurir'a keren smuah !!!

Thx...",4
"assalamulikum gan lampu nya ga jlan RGB nya
",5
not bad lah yaa dengan harga segitu walaupun sellernya sombong,4
"pengemasan sangat rapih, barang ok, memuaskan, pengiriman tidak lama. mantul 👍",5
keyboardnya bagus,5
"pesen dari 29 mei, datengnya 9 juni :) ",5
the best lah pokoknya,5
Mantap lah barang nya topmarkotop,5
"pengiriman tepat waktu, kurirnya juga ramah. keren deh pokoknya",5
"mantap berfungsi dengan baik
",5
mantaf barang sesuai fungsi,5
bagus!!! ,5
Mantep lah recomended seller cepet bngt dateng nya kyboard ga ada kendala semoga awet.. Untuk kurir emg langganan bngt ,5
"barang bagus sesuai dengan gambar, ajibbb lah pokok ny. ",5
Mantapp jadi serasaa youtuber,5
keren lumayan buat harga segitu lah,5
"PAKET RUSAK
TIDAK BISA DIPAKAI
KEYBOARD PATAH
TGL 31MEI 2020",1
manteb banget sesuai di gambar👍👍,5
bbbbbaaaaagggggguuuuussssss beeeeeetttt recomend ,5
no minus kang mantap,5
Bagus brng nya cmn pengirimnya lama melewati batas estimasi ,4
barang sangat bagus dan sesuai,5
bagus kualitas batangnya tdk mengeceeakan,5
packing rapih tidak ada yang cacat barang bagus lah sesuai harga kurirnya ramah mantap deh pokonya,5
"bagus banget, ",5
barang sudah sampai packing rapi dan tombolnya enak banget ,5
mantap pokoke lah,5
Produk bagus,4
lampu nya ga nyala,5
produk gue sukaa rekomended seller tpi gua minta warna putih di kirim warna hitamm bagusss lahh,5
lumayan keren lah,3
ada cacat pecah di ujung tapi masi bisa fungsi normal,2
ashiap keyboardnya,5
"manatppn, smoga awet, kurir udhh kompk",5
"paket sudah diterima dalam keadaan baik, pengiriman cepat juga. kurir profesional. thanks yah.",5
sangat kecewa dgn produk nya lmpu LED nya gk nyala,1
memuaskan,5
bagus. 👍,5
"barang pecah, kapok belanja di sini, nggak akan mau lagi saya belanja di sini",1
"barangnya gak sesuai, lampunya gak menyala, gak ada hedanya dgn keyboard yg 30 ribu.",1
mantul bung hehe ,5
"lampu tidak bisa ber ganti ganti secara otomatis,lampu menyala  hanya 1 type.",2
"Mantul terimakasih 
 lazada",5
nice ,5
"BARANG MANTUL  BOSS,,,LANJAY",5
bagus,5
barang mantap kurir nya baik ,5
brang ok,5
mantap,5
"bagus,barang aman,lampu di jamin nyala,memuaskan lh
",5
"Good,barang mendarat dengan selamat",5
"is the best

",5
barang eror,1
"keyboard nya kg ada lampunya???? 
",5
Masa ini kok keyboardnya tombolnya keteken 2,5
jos banget sesuai dengan pesanan ,5
sukaaa banget slur,5
"saya kan milih nya Yang warna putih ko knp dateng nya warna nya hitam 🤦
",5
"baguss bangettt,,sama skali gak nyesel",5
pesan 2 yg datang cuma 1,1
pengiriman cepat .barang fungsi dgn baik,5
ntaps lah👍👍👍,4
"brg sesuai diskripsi
puas banget
semoga sukses",5
warna putih mintanya datang hitam,3
oke. pertahankn,5
mantapp lahhh pokoknya,5
sangat keren walau pengiriman terlalu lama,5
"walaupun kotaknya bonyok tapi barangnya aman
",5
Alhamdulillah nyampe juga..proses lama..hehe,5
lumayan lama sih pengiriman nya tapi barang berfungsi dengan baik,5
"Alhamdulillah barang sdh datang, tp sayang tdk sesuai estimasi kelamaan nungguin,
tp so far good",5
barang Mantul......,5
ini sih whor it bgt hagra murah tpi g murahan mntp deh 👍👍💯,5
Bagus 👍👍👍,5
bagus aku suka,5
"Beberapa tombol rusak/tidak bisa, ",1
Bagus terimakasih,5
barang kualitas jelek sering doble klik,1
BARANG RUSAK KOK DIJUAL? KADANG SUKA GK MUNCUL KLO DIPAKE NGETIK,1
kurirnya ramah barang nya work it,5
maaf dikasih bintang 1 krn pesanannya 2 dikrim 1. tolong dikirim sisanya yg kurang. terima kasih,1
terimakasih lazada sayah senang berbelanja di sinih ,5
mantap bosq,5
"Barang Bagus sesuai dgn Harapan,, 
salam Sukses Lazada",5
lampu led redup,3
"barang diterima dgn ok, sesuai deskripi packing ok, abang kurir juga ramah",5
barang sampai,5
alhamdullilah barang nu oke ,5
barang bagus hanya ada pecah berlubang di sampingnya ,3
"Kerenn bet
",5
"barang nya baguss sih tapii pengiriman nya tidak sesuai durasi

",4
mantap jiwa,5
"barang ok pengiriman juga ok, tapi kalo ngidupin led nya Scroll lock nya juga ngikut idup",4
"bagus
",5
mulus boss,5
God,5
mantapppp,5
bagus,5
ok mantap,5
barang sesuai pesanan,5
keyboard bagus...anakku suka...mksh,5
spasinya agak rusak mungkin pas pengiriman ada masalah,3
"Barang bagus, nyampenya cepet juga. mantap",5
barang.y oke..anak ,5
BAru kasih ulasan baru sempat...makasih yah kak udh sampai barangnya bagus tdk ad yg rusak,5
Kenapa ya keyboard nya nyalanya kadang kadang dan jarang ,3
barang bagus tapi pengantaran lama mungkin karena psbb,5
barang mantul...,5
Barang bagus...bgttttttt,5
okey barangmya langsung d coba,5
mantap gan barangnya bagus banget udh dicoba tombolnya bekerja semua terima kasih banyak ya,5
keren.. walau agak lama dtgnya,5
"mantap, sesuai gambar, cuma kotaknya ada bagian yang koyak, tapi gak apa, barangnya aman",5
lampunya ganyala,1
"barang bagusss, tombol okee, hidup semua, fix, aman dan terpercaya......... ",5
matap paketnya bagys,5
"Ko pas dateng , malah kaga nyala sih ga sesuai gambar",5
mantap.. nyala.,5
"ERROR KEYBOARD NYA,BARU JUGA PAKEK ",5
"barang nya bagus, tidak mengecewakan
",5
"barang nya bagus
keren ada lampunya
",5
"baguslah buat harga dibawah 100k mah
",5
"Bagus, barangnya aman mantep dah",5
Mantap skill gaming ku meningkat,5
mantullll,5
Barang nya sangat bagus ya ererere,5
barang sesuai packing rapih pengiriman juga cepat the best lah,5
"Overall bagus sih, cuma masalahnya klo ngetik keyboard agak keras jdi kurang nyaman buat gaming",4
"mantappp,tombol bisa semuanya ",5
gangecewain dah pokoknya,5
Lumayan bagus tapi ada 1 tombol di tekan gk mau balik tapi gak papa dah ,4
bagus rekomen,5
"APAAN KEYBOARD NYA GAJLS, DIPENCET GITU, PARAH BANGET ",1
mantap pokonya,5
tidak bisa di pakai di windows 10.,1
mantaaaaap...barang sesuai pesanan...,5
alhamdulilah pengiriman cepat barang gak da lecet ama dkla makasih,5
"thanks, very Cool.",5
"alhamdulillah barangnya sudah sampai dengan selamat, bagus makasi lazada. ",5
"mantaaap.,....terimakasih lazada
",5
"Rekomended bos, apik barang e",5
barang bagus!👍🏻,4
Barang sdh diterima sesuai estimasi pengiriman dan packing rapi. Belum berani buka paket takut ter,4
"barang bagus, keren, sesuai digambar... mantap gannn",5
ntaps..sesuai pesanan,5
"Barang sesuai dengan gambar, pengiriman cepat, kualitas oke",5
Sangat memuaskan tengkyu,5
sangat puas,5
keyboardnya eror gak bisa dipake ,1
Mantap barang sesuai pict,5
"lampunya gak dak bisa hidup
",5
"terima kasih Lazada, dan kurir, barang sudah sampai dengan rapi dan memuaskan",4
"Mantul dah, barang nya oke ",5
Mantap gan empuk gk brisik..,5
Kok ga mau hidup ya rgb nya ..mohon dong di tindak lanjuti ,2
keyboardny bagus banget✌. ,5
mantap sesuai di gambar,5
Tulisan di setiap tombol kurang jelas,5
"LED nya gk nyala bang
",5
Gak hidup lampu nya,5
"Barang datang dengan selamat, berfungsi normal, joss",5
mantap,5
Lumayan,5
good bgt,5
sip deh,5
barang bagus sesuai dengan yg di pesan,5
bagus bangett. seperti di gambar. gak nyesel beli ,5
"barang udah sampe , pengiriman yang lama,fungsi semua
",5
bagus keyboardnya. mantap,5
Benar2 keren,5
"termantul, barang sesuai dengan gambar, recomended seller, terbaik dahh",5
"mksh lazada barang bagus dan rapi bungkusn
ya",5
Lumayan dgn harga segitu👍,4
pas..mantap deh..👍👍👍👍,5
"sesuai pesanan, keyboard keren sekali",5
agak gecewa lampu warna warninya gk nyala,3
belum di caba ,5
tks,5
"okei
",5
gud,5
the best lah pokoknya,5
keren,5
mantabbbb,5
keraaad asli.. empuk juga keyboardnya,5
"- paketan tidak terlalu rapi

+ barang memuaskan sesuai dengan foto",5
Mantap barang sudah sampai dah bagus ,5
epic tenann,5
kecewa sangat2 kecewa...lampu2 y tidak menyala,5
"barang'y bgus...
semua berfungsi...
makasih yach...",5
lampunya g bs nyala,5
barang mulus keren pokoknya,5
mantul,5
Good vibes,5
keren,5
"Barang sangat bagus dan aman tidak ada kendala, tp untuk responya sangat kurang ",3
bgus,5
Mantap ,5
mantap bg,5
WADEFOK!,5
puas,4
oke ,5
"bagus
",5
mantap gan,5
mntp,5
"mantull
",5
bagus,5
mantaps,5
gg,5
Good,5
good,5
"bagus
",5
ya,5
mantap,5
gudd,5
"ok bnget
",5
"nicd
",5
bagus,5
"baguss
",5
👍👍👍👍,5
nicee,5
👍🏻,5
muantap,5
mAntaffff,5
mantap lah,5
Mantap ,5
mantaapp,5
mantapppp,5
mantapp,5
sipp awrt,5
ntabz ,5
p,5
nice,5
mantap ,5
top,5
mantab,5
joss,5
bagus,5
ok,5
