review,rating
sangat mengecewakan. barang lecet semua. serasa barang bekas. peot dibagian belakang. sangat amat TIDAK RECOMMENDED.,1
"Pesanan sudah diterima, mendarat dgn mulus, Packinya rapi, barangnya bagus, realpict Dan sesuai dgn pesanan. Sudah dicoba Dan berjalan lancar, semoga saja awet.
Terimakasih Seller, Lazada Dan Kurrir, semoga usaha kalian lbh sukses lg, tentunya Jaga kepercayaan.. Mantap lah... ",5
"cukup memuaskan barang sesuai deskripsi dan berfungsi baik. cuma ada satu qc ditingkatkan. mother board tdk pas pada tempatnya,sehingga USB  port land tdk bisa masuk. tp no problem bisa dibeberin. trims seller hanya untuk kurir blm Ok. ninja Xpress sangat lambat ",4
"Cpu Udh Saya Coba, semua berjalan Normal dan Speak sesuai diskripsi.. namun casing ada luka bagian depan, mungkin akibat ketumpuk..tp gpp terima kasih pngiriman cepat dan Ongkir ny yg bkin jozz gandozzz... ğŸ‘ğŸ‘",5
"puas hanya sj pengirimannya terlalu lama dan lewat dr waktu yg di tentukan

",4
"Kualitasnya lumayan Bagus d
an processornya cepat,Resolusi bagus 
",5
"kecewa,,, steker nya gak bisa dipakai (rusak),
casing belakang nya penyok.!!",3
mantap,5
