review,rating
barang nya bagus saya suka.. ,5
barang sudah sampai kak bagus original dan bpom baru pakai sekali di bibir lumayan kurangin bibir pecah peccah,5
"barang sudah sampai alhamdulillah ga ada yg kurang, original packing rapih pengiriman juga cepat semoga cocok kalo cocok mau langganan disini soalnya murah dan original",5
lazada makasihh banget ya bibirkuu ga kering lagi dan alis lumayan agak tumbuh sedikit barang nya bener bener original pengiriman juga kilat seneng banget,5
pesan nya vaseline dkrm vaseina,1
Kmasannya mini tapi gapapa lah.  Smoga aja cocok dan bermanfaat,5
"maksii kk 
buat kurir nya poko nya 1000 likeeee top",5
mini ,1
bgssssss,5
