review,rating
Ka makasih barangnya udah sampai cepet banget original juga. bibir jadi lembab dan merah. love bangett,5
koq vaseina bkn vaseline? ,5
"gimana sih paket ku ga nyampe rmh tapi di lazada nya udh ada pemberitahuan paket ku udh di terima, lain kali di tingkat kan lagi ya mba... untung aku blm bayar ",2
paket udh nympe tp belum di coba ,5
ğŸ‘,5
nipu barang sampai sekarang udh satu bulan GK Dateng dateng,1
baru coba moga cocok di bibir yaa,5
Knpa ini vaseina yaa bkn vaseline? ,3
"Ku suka, tpi mini banget yahh",5
mantap,5
bagus,5
