review,rating
"barang bagus dan packing rapih, pengiriman juga cepat,, pokok nya puas sekali,, seller nya juga ramah.. selalu langganan.. ",5
"cakep bngt ovennya udah langsung dicoba dan bagus hasilnya.tapi aturan dapat loyang nastar malah dapat loyang kue yg kotak,tapi gak pa"" lah tetep Ok,mksh ya seler,lazada dan mas kurir nya",5
barang udah sampai dg selamat...packing juga rapi n kurir juga ramah...semoga awet di pakai'y..terima kasih pazada,5
"sellernya fastresp bgt .
boleh cht tanya2 dulu sblm order .
pngiriman cod tapi ttp cepat bgt sampe .
barang sampe dgn mulus .
packing aman rapih bgt+ bubblerapp .
barang aman no penyok2 .
sesuai pict .
real bonus loyang juga 3pcs .
barang ga kecewa sesuai harga .
trimakasih",5
"sesuay barang nya pakingan rapi, maksih lazada",5
"alhamdulillah paket dh dtng , packing bgus dus x doble d tmbh bubblewrap juga , blm d coba , tp yakin psti bgus juga , thk lazada , seller n mas kurirx,.. ",5
"barang bagus, packing rapi, pengiriman cepat, seller ramah ... nice 😄",5
terimakasih  lazada  pesanan ku sesuai  d  gambar mantul  ,5
bagus sesuai pesanan,4
mantappp,5
