review,rating
antungnya sesuai pictðŸ˜aku suka banget pengiriman nya juga cpt ðŸ˜kurirnya juga ramah terima kasih sellerðŸ˜˜ðŸ–¤,5
"barangnya kok gk sesuai saya kn pesannya kn warna glod kok yg datang warna silverðŸ˜¡klok mau kirim liat"" dlu warnanya ",1
Masa kiri semua.. Kecwa.. ,5
realpic dan cuantik..makasih lazada seller dan kurirnya,5
barang nya real fict banget cuy ðŸ˜,5
Jelek banget Sumpah....Masa baru saya Coba mau Pake langsung patah ???iiihhh Kesal amat Sumpah Jelek ðŸ˜ðŸ˜ðŸ˜ðŸ˜ ðŸ˜ ðŸ˜  kecewa Pkoknya,5
sangat memuaskan trma kasih barang real pict sesuai. pengemasan rapih & gercep bgt. very good pkoknya,4
maf baru kasih ulasan bnerÂ² bgus dan packing ny rapih yg sukanya lgi dpet gantungan konci doraemon Tnks smga ttep jdi tko yg bgus dan terpercaya Tnks LazadaðŸ˜˜,5
"Kecewa dengan barang yng dikirim kesaya,  anting sama posisinya sebelh kiri, tidk sesuai gambar
Jd aneh makenya. 
Lazada tolong ditindak lanjuti ke penjual agar pelanggan setia lazada tidak kecewa",5
kecewa bngt sih sama sama bentuk nya k kanan kan jdi gmn gtu pakenya juga untung pelanggan ku gamarah ,3
"bagus banget anting nya harganya murah tp barangnya bkn murahan...suka banget beli di toko ini,pengiriman cepat,respon penjual ramah,kurir nya baik bet...",5
real picture sesuai dengan pesanan.....thanks lazada dan kurirnya,5
"bagus cuman, kurang detail lagi tindiknya",5
Alhamdulillah barangnya uda sy terima ..Cantiq..saya suka...kurirnya jg ramah ..Thx ya Sukses slalu ..,5
"kak gimana sich, kok anting-anting kanan semua, dicek lagi donk kalo mau kirim barangnya,,, akhirnya gk dipakai",1
Inii jugaa patah manik2 nyaa. Mau ngereturn kasian di mamang kurir nyaa. Ah yaudah deh. Biarin ajaa. Lain kali di periksa dulu yah kaa. Sekalian buble warp nya di cukupin takut nya rusak di jalann..  Tapi yah mau begimana pun nama nya costumer butuh hasil yang memuaskan ,4
"maaf baru ngasih ulasan br ad wkt,paket y dh nympe barang y jg ok kulir y pun d bilang knal ea kenal tp ad sedikit kecewa dngan kndisi barang anting y patah sebelah jd syang g bs kpake.... mhon sblm d pack d periksa dl biar pelanggan g kecewa kmbaliiii.... ",2
baguss ke 3x beb aku pesen bagus banget dan cantikkkkk... awet jugaa dipakenyaaa sampee 3bulan lebih,5
"anting nya bagusssssssssssss , pengiriman cepett , kurir nya juga ramah karna udh langganan .. makasihhh lazada ðŸ˜",5
saya sagat2 kapok setiap beli si toko ini selama kecewa tapi saya tetap mau pesan ini terakhir kali g akan sya pesan lgi ke toko ini,5
iih cepet bnget kmren order hri ini udh nyampe makasih bnyak ya dpat bonus lagi...tq u so much....pertahankan ya nexst order lg,5
"Bagus antingnya pngirimannya jg cpet bnget
Prasaan bru pesen kmrin tdi siang dh dateng
Mantul pokonya 
Thanks lazada seller abng kuriiir
Smoga sukses slluðŸ‘ðŸ‘ðŸ‘ðŸ‘",5
"tp sayang antingnya yg 1 gak ada pompoknya..
padahal saya buat dijual lagi...
tp gak pp..lain kali tolong diperhatikan lagi ya..
terima kasih..",5
"anting nyh bguss pengiriman gk lama suka pknyyh sma anting nyh kurir nyh jga ramah Thanks you ðŸ˜‰ðŸ˜‰cocokkk ngk gatel di telingaa
",5
"Hitam setelah beberapa hari aku pakai..  Telinga jadi ikutan hitam deh..  Hufpt..  
Pak kurir the best slalu",2
"terimaksih,maaf ya bru kasih ulasan sampainya si bru kmrin,pengiriman termasuk cepat 1hari . overall good bangett ..syukaaðŸ˜˜ðŸ˜˜ðŸ˜˜",5
"sesuai pesanan,respon penjual baik ramah pengiriman cepat,trimakasih untuk bonusnya juga,kurir ninja langganan, baik,sopan kadang suka ditalangin dulu kalau saya sedang tdk ada drumah, trimakasih kak trimskasih lazada ðŸ™ðŸ˜Š",5
paket dach sampai antingnya bagus walau agak beda yg satunya tp masih bisa dipakai makasih lazada seller dan abang kurir,5
"mksi lzda,brangny udh sya trima, abng kurirny juga baik rmah sopan,engga kucem mksi juga buat abng kurirnyðŸ™",5
saya merasa kecewa barang nya baru juga mau di pake udah patah lagi mungkin bahan dari kawat jadi jelek cuman bagus bentuk nya aja,2
anting Nya baguss realpict,5
brang cocok dgn gambar   bgus mksih  yach  ,4
produk bagus thanx juga buat abang kurir ,4
gak kecewa order disini . super bagus .. prosesnya gak lama ,5
"yg satu nya patah
",5
anting nya bagus... top markotopðŸ‘ðŸ‘... pengriman cpt.. kurir ramah,5
ini bagus pokonya ðŸ˜‚ aku suka,5
bagus ngga kecewa pokok nya,5
datang juga.... cantik sekaliii â¤â¤,5
bagus cuman gede di telinga aku,5
"anting nya bagus tp syg sebelah kiri semua,lain kali mohon teliti dulu sebelum dikirim ya kak.trima kasih",5
maaf baru kasih ulasan.. jmpol dech pokok nyaa.. ðŸ‘ðŸ‘ðŸ‘ðŸ‘ðŸ‘ðŸ‘ðŸ‘ pengirimn cepat kurir nya pun ramah sangat.. ,5
"anting nya bagus cuman, yang 1 gak sepasang kiri kanan, agak kecewa soal nya gak bisa di jual lagi",4
makasih kak aku sukaðŸ˜»,4
iya oke saya suka,5
lumayan bagus ðŸ‘ŒðŸ»,4
"lama...
brang nya potong ...
sry lupa pict",2
aku gak bisa pakai,5
"kecewa Banget Sumpah,Baru DiBuka Eh Udah Patah Kaya Gini,Nyesel Banget,iya So Harganya Murah,tpi Kan gak Harus Rusak Kaya Gini Barang NyaðŸ˜’",1
"Sangat sangat kecewa Ini Gimana si baru di buka kok udah putus.
baru kali ini beli di lazada mengecewakan
",1
ANTING PATAH KOK DI JUAL . BARU BUKA SEGEL PAS MAU DI COBA TEPO BANGET .. GIMANA SI KALO JUALAN YG BENER DONG.,2
gmn ni Bos...waduhðŸ¤¦ko Kya gni dtng y kecewaðŸ˜­ðŸ˜­anting y Kanan semua klo mau dagang tolong yg jujur broo..teliti dulu sebelum dikirim ..,1
"Anting nya bagus ,tapi kenapa untuk srbelah kanan semua ,sedangkan yg sebelah kiri di pakai seperti itu tdk sesuai lingkaran telinga ðŸ˜¢ðŸ˜¢",3
masak yg satu hadapx beda... gmn sih... lain kali di teliti dulu,5
"Antingnya bgus tp gmpg patah,",4
bagus say makasih,5
"AaaaðŸ™Œ ini udah ke2 kalinya order dan memuaskanðŸ˜ ndk ngecewain sama sekali,, bakal jadi langganan kayaknyaðŸ˜˜",5
"Maaf baru kasih ulasan,ini gmna yaa saya udah ma pesen bnyk tapi anting nya pada gak awet giliran mau dipke malah patah mulu udah ke 2 kali nya iniii ",5
syg cepet luntur,4
barang sesuai gambar.trims lazada,5
"Brng sesuai gambar semoga awet dipakai dan tdk luntur, terima kasih lazada utk dan pengantar paket semoga sukses",5
" Yaah Ampun ...Kurirnya Jahat Amat yaaah ....dia Nyari"" alamat Gk ketemu akhirnya dia Yg Pake ..Saya belum Terimah Juga Lazada jdi saya Mohon Yaah Tlng Bilang sama Kurirnya itu .Trimah Ksh ",5
"bagusss , semoga engga karat  dan luntur. sukses terus yaaâ˜ºï¸ abang kurirnya jga yg langganan . top markotop laa pokoknyaâ˜ºï¸",5
Anting ny patah kcwa mnah punya plnggn lagi.. Lain kali klo mau ngirim brang kaya anting gtu di pakein dus kecil atuh jdi aman biar pun di timpah ma yg lain ny.. Nie mh di bungkus ny pake koran doang kaya mau bungkus mendoan ...ðŸ¤¨,2
"sangat2 kecewa tolong kalau mau kirim dipriksa kembali dicoba2 duku jangan asal kirim,, telinga itu kanan kiri, bukan kiri semuaðŸ˜ ðŸ˜ ðŸ˜ ðŸ˜¡ðŸ˜¡ðŸ˜¡ðŸ˜ ",5
Paket nya dh dtng mksh lazada  anting nya bgs SMA Kya di gambar pettahan kan ya pko nya bgs dech mksh Abang kulit nya sangat ramah langganan lg,5
"barangnya sudah sampe,antingnya bagus...kurirnya juga ramah..sangat puas langganan lazada pertahankan terus yah..",5
barang ny bgus sesuai gmbr...pokok ny mh top deh buat lazada...mksh lazada,5
biar bintang yang berbicara ðŸ˜˜ðŸ˜˜ðŸ˜˜ðŸ˜˜,5
reall pict bagua banget,5
". maaf baru kasih ulasan,agak kecewa beli 2 pasang yang satu pasang lagi gasa ma ngadep kiri duaduanya",5
"barang nya bagus , tpi sayang yg dikirim kanan sama kanan ga sepasang , lain kali lebih teliti seller ",3
"bagus c
tp gmpng patah
q baru tekan sdikit z dah patah
y sesuai lah sma harganya",4
"maaf telat ngasih ulasan 
Alhamdulillah barang nya bagus kurir nya baik 
Poko nya puas banget mksi lazada",5
"baru ulas,baru keluar notifikasinya soalnya. 
saya kecewa barang saat datang melengkung""beletot an semua parah pokoknya ",1
"sedik keceawa .. tp tdak apa2 dengan harga segitu mah.. abang paket nya kaya nya udh tau cri2 rmh sayaðŸ˜‚ makasih lazada
",3
"alhamdulillah barang nya sdh nyampe real pic sesuai pesanan packing nya juga rapi aman tdk lecet sdikipun kurir nya juga baik ramah sopan sdh langganan.., good job pertahankn yah pokok nya klo pelayanan nya bagus kayak gini saya mau terus belangganan di toko ini...!!! ðŸ˜ ",5
"alhamdulillah barang nya sdh nyampe real pic sesuai pesanan packing nya juga rapi aman tdk lecet sdikipun kurir nya juga baik ramah sopan sdh langganan.., good job pertahankn yah pokok nya klo pelayanan nya bagus kayak gini saya mau terus belangganan di toko ini...!!! ðŸ˜ ",5
"antingnya bagus si cuma aneh aja yang kanan besinya ada disebelah mutiaranya yang anting kiri besinya dibelakang gitu, tp bagus si masih bisa dipake",4
barang saya terima kurir ramah anting bagus gak ada yg lecet mksi lazada,5
sangattt jelek,5
lumayan .. ðŸ‘ðŸ‘ðŸ‘,5
"barang bagus realpict, cuman aga regas mudah patah anting nya jadi klo mau dirapetin itu harus hati""â˜º",5
antingya bagus saya sukak,5
ok bagus barangnya,5
gas bagus luntur,1
"thanks lazada dan tokonya ...
saya pesan utk teman saya Dy suka sekali..
",5
bagus bgt suka,5
bgus sih... tp pke sehari lngsung hitam,3
barang nya bagus banget,5
"the best!!semoga  kedepannya juga tetap TDK mengecewakan, contrast untuk lazada yang sudah sering banget belanja Alhamdulillah barang selalu real!!ðŸ–¤ðŸ–¤",5
"peket dah sampe ,anting y bagus ,terus pengiriman y cepet sekali mkasih lazada ,buat kurir y  sangat""ramah",5
"saya kecewa diminta yg silver satu..yg di kirim gold kedua nya...dan brng kecil TDK serupa dngn gambar
",5
antingnya ok sesuai realpict harga murmer pengiriman cepet packing rapih padahal cuma satu makasih toko dan lazadaðŸ˜Š,5
"anting nya kurang bagus pas aku pakai patah belakang nya,langsung ak buang aj ke tempat sampah'y maklum lah anting murah",2
"antingnya bagus cuma kho pas dibuka blom dipake udah langsung patah , tapi gpp deh untung bisa di lem lg ",5
barangnya udah sampai tapi belum sempet di bukak soalnya lagi sibuk banget jadi gak sempet ya mudah mudahan gak ngecewain ajah lah yah,5
Makasih lazada akohh sukaðŸ’ž,5
Jelek. Rugi belinya. Matanya hilang satu trus dipakai sehari aja udah luntur. ðŸ˜ qmsyonggg....langsung buang deh,5
"Mksh kk cakep bngt,  tp padahal yang satu minta wrn gold tp putih smua tp gpp bagus ko mksh kaðŸ˜˜ðŸ˜˜ðŸ˜˜ðŸ˜˜ðŸ˜˜",5
"mubajir ðŸ˜¥soalnya pas  dipasang  
copot dari besinya 
gk  dapt dipake  dech 
lain kali  las San nya  lbh erat 
mksh ",3
"Pket nya udh smpe,aku ska brng nya sesuai yng di gmbr tp synk ada yng bda dkit dr anting nya yng stu lurus yng stu agk bengkok gk sma tlng lbh teliti lg ea mba klo krm nya jd gk bgus di pke nya lu u,tp aku ttp ska kok mksh lazada,smga smimn susez",5
"bru ksh usulan kenap anting patah di jual.. jngn mentang2 murah
bru x ini kecewa blnja di lazada 
pants cpet bru psen kmren udh dtng bsok ny 
tp hsil ny rusak kecewa bngt",2
kalo anting ini mungkin saya kurang cocok saya kasih tetangga biar gk mubazir...kurirnya baik karena lngganan,5
"sy bingung gmn cara pakainya,antingnya ga bs jepit ke kuping,baru kali ini sdkt kecewa ",3
Bagus tapi  ga ada tinik nya satu kecewa,5
bagus tpi patah,3
bagus banget,5
"bagus,cuman pengirimannya gilaaaa lama bgt lebih dari 1 minggu,ga suka.",3
mantaps realpic... ,5
kurg puas dg brgnya,5
cepet anak sya suka,5
anting nya sih lumayan bagus tp knpa patah ,5
aku suka bagus.. lama aja pengiriman nya,5
Seneng banget puas sesuai pesanan ,5
"Sangat buruk ya barang nya, sy beli 3 patah semua sebelah kiri nya, mau sehati hati apapun, emg itu bahan nya rapuh banget",1
"Alhamdulillah paketnya udhh datang bgs pula,abang kurirnya baik dan ramah pokoknya seneng bngt mkshh lazada",5
"agak kecewa sih barang nya sampai ku coba palah patah ,tp yah ga papa ,mungkin ini bukan rezeki ku.",5
"syaa tidak menerima barang.sangat kecewa tulisan sudah diterima tapi tidak ada.baru kali ini sya kecewa belanja dilazada,udh nunggunya lama bngt lgi.",1
"Gimana sih anting yg di kirimiin sebelah lain?? kan malu kalo mau di pake nya,.kalo nggak niat jual jgn di jual atuh,",5
suka dgn antingnya cakep tp sayang antingy gk ada pencekopnya. jd mudah lepas kurang kenceng d pakenya,5
brg nya bagus ini sy beli yg kedua kali semoga awet. yg antar org nya jg baik. sy puas terima kasihLazada  sukses selalu,5
"paket nya udh sampe
tp kok kiri 22 nya ya
jd pas di pke gk sesuai 
seharusnya kan bentuknya kedalam 22 nya
ini yg 1 nya keluar jd gak bagus di liatnya",5
good EaringðŸ¥°ðŸ¥° thankyou. ,5
lumayan bagus,5
"barng nya path,,knapa d kirm aja",5
"alhamdulillah realpict, suka)",5
bagus rpih. ,5
"baguussss sumpahhhh
",5
gmn sih ko pas dtg udh patah gitu..tolong yg amanah klo jualan saya Mau dikirim ulang pokonya,5
mntulðŸ‘ðŸ»ðŸ˜Š,4
"maap baru kasih ulasan, barang sampai dengan aman barang nya real pict, kurirny juga ramah, ",5
"barangnya sudah smpai trimakasih,sesuai pilihan,terimakasih seller dan abang kurirnya jg.",5
paket nya udah nyampe bagus lagi sesuai sama pesenan makasih lazadaðŸ˜Šmakin berkah lazadaðŸ¤²ðŸ¤²,5
mantap pokoknya kak makasih. ,5
"sukaa banget sm antingnya,, realpicðŸ˜˜ðŸ˜˜ðŸ˜˜",1
Anting nya bagus tapi sayang baru aja di buka dari plastik nya eh udah copot kaya gtu haha,2
Sukak bgtðŸ¤© Allhamdulillah realpict & memuaskanðŸ˜kurirnya yang pasti ramah & sopan trimakasihðŸ¤—,5
"bagus bgt ni yg k sekian kli nya blanja d sni,makasih lazada,,,
next belanja lagi",5
"bagus antingnya tapi g tau cara pake nya
ðŸ˜ðŸ˜â¤ï¸â¤ï¸â¤ï¸â¤ï¸",5
bagusðŸ‘ðŸ‘ðŸ‘ðŸ‘ðŸ‘ðŸ‘,5
barangnya bagus kakðŸ˜,5
"lumayan buat barga segitu
puas dech ...cepet lgi pengirimannya

",5
manthuuullll anting nya,5
bangus bnget anting nya saya ska.. makasi lazada ..kurir nya jga rmah sya dah langganan jga sihðŸ˜Š,5
"mksih kak pket nya udah dteng kemarin , bgus banget anting nya .",5
"Thanks, I Like It>.<",5
"anting nya bagus cpt jg smpe nya,abang yg nganter jg udh knl bgtðŸ˜„",5
syukaa bngt sma antingnya.. ðŸ˜˜,5
Ganempel anting nya juga malah melot2 ampun dahh,5
Paket ea udh dtang mksih lazada bgus bnget,5
"psanan diteerima
kualitaa produk baikk
kecepatann pengiriman baikk
puass blnja disini

",5
"barang nya bagus sekali,abang kurir nya Juga Baik",5
Tadi dateng brg nya. Tp pas di liat anting nya yg kiri dua dua nya jd klo d pake ke yg kanan kebalik anting nya gk sma. Kecewa bgt,5
anting nyk bgus.. glng kaki nya uga bgus.. klung nya uga bgus cmn klo klung nya kurang berkilauu...  mksi ya buat smuanyaa.   ðŸ™ðŸ™,5
bagus anting nya gak bikin gatel telinga,5
"saya kecewa banget, saya pesen warna silver yang datang warna gold. Tolong yah lain kali packing bener2",5
"Alhamdulillah selalu tak pernah kecewa setiap belanja di lazada udah beberapa x di sini...
makasih Lazada...",5
bagus . seemoga tidak berkaratðŸ˜Š,5
Barangnya bagus ,5
"barang'y udh dtg sesuai gambar & kurir'y ramah, thanks lazada",5
"makasih , aku suka bgt , cuma pngnnya tadi aku gold dapetnya silver 
",5
"suka bangt anting nya
makasih resseler ðŸ¥°ðŸ¥°ðŸ¥°ðŸ˜˜ðŸ˜˜
kurir nya langganan jd baik bgtt ramah lagii",5
anting2 nya uda nyampe cantik sekali  cck  AQ suka kurir sopan puas blanja dilasada,5
pesan 2 x malah kanan 22 nyaa..haaddeeuhh...,2
"sesuai gambar,bagus ",5
barangnya cepat dr perkiraan..terima kasih,5
"terimakasih lasada,",5
sesuai pesanan pengiriman nya juga cepatt nextt order lagiiðŸ˜˜ðŸ˜˜,5
"paket dah tiba , barang'y Ok thank LAZADA & Abang kurir'y",5
"Barang Nya Realpict ,. Tapi Synk PAS Mau Dipake Patah 22 NyaðŸ˜¥ðŸ˜“ Karna Terlalu Tipis JepitanyaðŸ˜‘  ",3
anting ya bagus maksi lajada,5
anting ya gx bgus bkin kuping sya skit ...n wrna bru di pke brpa hari dah kuning,2
baguss aku suka:),5
cantik amaaatt anting ny,5
Baguss bangettðŸ˜,5
trima kasih ka.. paketnya sudah sampai.. realpict bgt.. saya sukaðŸ˜Š,5
cocok sesuai gambar...  mudah mudahan gg cpet luntur ðŸ˜ŠðŸ˜Š makasih lazada...  ,4
Lumyan cntik brng Ny dngn hrga segitu ,3
"kecewa bnget...barang nya ngga sesuai,wrna nya pun agak gelap tidak mengkilat...tp ngga ap lah sesuai harga nya",5
ðŸ‘ðŸ‘ðŸ‘,4
I Like It,4
bagus .. sesuai gambar .. makasih lazada,5
realpict suka bangett sama antingnya..,5
barangnya jlek barangny patah,1
"anting nya bagus, tapi susah makenya..",5
lumayan bagus untuk harga sgitu,5
baguss bngt,5
barangnya sesuai dgn gambar makasih lazada,5
puas banget...,5
maaf ya kak ini saya belum terima brang kok tulisannya brang sudh d trima ya,5
Barang bagus maksih,5
ye Udah datang anting ya Real Fik banget ,5
"barang ny baru aj saya mau pakai udh patah

",5
gmn sih mbk ntong nya sama 2 nya ,1
terima kasih lazada kemasan rapig dan barang sesuai yang di harapkan,5
bagus banget,5
Cantik anting y.. Maksih lazda,5
kondisai barang patah..   mungkin krna packing ny gk aman..  gak pakai kardus. ,2
Gmna ahh ga bnrr ini kanan semuaaa kecewaaa bgt,5
"trmksh ,barang sdh sampai dan bagus",5
real pict mksh seller n lazada,5
Thxyuu sesuaii pesenan ,5
antingnya bagus,5
makasih lazada barang nya sesuai dengan gambar.. kurir nya juga ramah... sukses terus lazada ðŸ¤—ðŸ¤—,5
biar bintang yang bicara ðŸ˜,5
barang bagus puasa saya mksh lazada mksh kurir sudah antar barang sayang,5
Sudh d trima lumayab,5
klu yg ni salah warna emang okey terima kasih sayang lazada,5
Thank'sðŸ‘ðŸ‘ðŸ‘ðŸ‘ðŸ‘ðŸ™,5
"Maaf baru kasih ulasan, alhamdulilah antingnya baguss.realpic harga terjangkauu..  ",5
"realpict sangat, ",5
Mantullll Maksihhh lazada ,5
anting nya bagus,5
"packingnya rapih, kurirnya ramah dan sering banget dia yang anter. terimakasih lazada",5
"itu anting"" kok sebelah kanan semua gimana hrs memakaix",2
trmksh kk... sesuai pesannn... pngirimn juga cpt,5
bgus.nanti pesen lagi yg gold,5
bagusss tapi mata nya ilang satu ,4
anting nya bagus banget.. aku suka,5
"Bagus sih antingnya, cuma antingnya masa sebelah kiri dua duanyaâ˜¹ï¸",3
Baguss aku syukaaa ,5
Kecewa bangett baru sampek di lihat dalem nya patah kaya gthu bikin males beliÂ² lagi ,1
"Bagus banget anting nya pertama nya mah ga tau cara make nyaðŸ˜ kurir nya juga ramah, baik ",5
"jelek .sehari hitam brubah
",2
Minta gold satu silver tiga kenapa yang dtg silver satu gold tiga!,1
mau saya kembali kan antingannya semua sebelah kanan gimana mau di pakai,5
"mksih lazada.barang nya udh smpe
cepet bnget deh dtng nya
ðŸ˜ŠðŸ˜ŠðŸ˜Š",5
Bgus,5
reall pict,5
pertamanya bagus eh... setelah seminggu ko jadi hitam yah cewa ah...,5
reacl pict udah 2kali order slalu benar bakal next order lgi,5
"maafðŸ™ baru kasih ulasan
makasih ya lazada barangnya real pictðŸ˜˜",5
Baru mau dipake eh langsung patahðŸ˜ðŸ˜¡,5
baru nyampe tapi barang udah patah aja gmna sih. kecewa!,5
brg sesuai gbr ok dech mantul,5
"pas bngt pket bru nyampe,,blm di bka",5
bagus si..cuma caranya it agax susah..kurang kencang ..alhasil di pakenya..copot trs.,5
okeh,5
lumayan barang nya kurir nya juga baik,5
Realpict gak nyesel deh poko nya ,5
makasih anting y dah sampe saya suka bngt real pick abng kurir y juga baik mksh,5
terimakasih untuk kurir dan tokonya,5
bagusskaaa barangnyaaaa aku sukaa â™¥ï¸,5
"suka bgt.. brang bgs, pengiriman cepat ",5
"Anting nya jelek ðŸ˜¡ blom di pake udah patah smua hiasan nya. Nyesel beli di sini,jadi ga ke pake.",1
Real pick sesuai pesenan ,5
maksih lazada barangnya bagusðŸ˜»,5
trmksh seler brg udh ditrm dtgnya cepet,4
brng nyampe. di tmpat. langsung hancur.  parah,5
bagus bgt si asli gaboong,5
"Gimana si masa dikirimnya kanan senyawa kecewa jadi gakepikiran buat apa kanan semua 
",1
"barang bagus sesuai gambar 
",5
bagus si tapi klo dipke ko copot trs,5
"cantik klo aku yg make.hehe
",5
realpict kerenðŸ‘ðŸ‘,4
ga bs makenya...  ngegantung terus ga bs nempel ditelinga,3
anting nya bgus bgt terus sesuway permintan lg,5
real pict bgt,5
barang nya bagus packing nya rapi terimakasih,5
gx kepake warna nya luntur,5
Saya suka makasih kak.makasih jg buat kurir nya yang ramah....,5
anting nya besi belakang nya terlalu panjang dan terlalu lebar pas mau di kecilin mlh patah hadeeeh,1
relpict saya suka maksih buat lazada ,5
lumayan memuaskan,4
anting ny di pake sakit,5
"real pick bgt sesuai pesanan,kemasan juga rapiðŸ‘",5
barang udh nympe dan bagus bngtt aku suka anting anting nya ama kalungnya bagus,5
pokoke ðŸ‘ðŸ‘,5
Lumayan lah,4
"bgus bgt sy suka, mksh buat lazada",5
lumayan bagus sesuai gambar mksih ,5
nggk sesuai masak anting nya sebelah kiri semua jadi Nya nggk bisa di pakek.,5
kecewa anting nya ke bawah trusðŸ˜­,5
bagus deh suka suka suka ,5
lumayan lah,5
Barangnya bagus kak ,5
wow bagus banget sampe tiap hari aku gak lepas dari anting ini,5
Aktingnya baru di pake sehari patah hemmm. ,1
sukakk bngt intinya,5
"sesuai k inginan..trimakasi buat lazada..pkky kurir y T O P jga




      

",5
Brang nya bgs,4
Barang busuk plastik maenan karatan nyesel ,1
kurang,2
bagus..,5
Bagus realpictðŸ˜ƒ,5
anting nya bagus..dua duanya kekirimðŸ˜˜makasih ya kakðŸ˜˜,5
"bagus anting nya,ga ngecewainnâ˜º",5
"bagusss sesuai relpict 
",5
"brangsesuai hrga ,kurir ok",5
bagus sesuai gambar..kurirnya baik,5
"Bagus bgt, sesuai apa yg diinginkan. terimakasih",5
barang sangat memuaskan sist,5
Barangny bagus pengirimanny juga lumayan cepet kurir by ramah makasih lazada and sellerðŸ‘Œ,5
sesuai dngan barang nya bagus,5
"yg dikirm beda warna , karatan juga",1
barang ny ok tp agak kurang kenceng jd klo d pake copot,5
"Ok banget dh pkok nx
",5
barang realpict...,5
anting ny bgus sih.tpi sm aq kegedean,5
"oke,barang nya cepet datangnya",5
barang udh smp tp blom di pakeðŸ˜,5
tipis besi nya.. mudah2an ga alergi,5
Terimakssih. Sesuai dengan pesanan,5
yg satu antingnya patahðŸ¥´,2
"baru mau dipke dah ptah blakangnyaðŸ¤¦yg seapsangnya jg satu dah ptah 2,,gman mah dpke toh!!!",5
Sesuai gambar,4
sngat jlek..kecewa ,1
barangnya bgus sesuai barang ,5
"jelek, gmna x make ny, tdak sesuai di gambar bagus Klo di pake",1
"bagus barang nya..
tapi kegedeaan..jadi gk bisa di pake..",5
"brg nya sesuai yg d pesan,thanks Lazada
",5
bagus sekali anting nya,5
lumayan bagus ðŸ˜ðŸ˜,5
sesuai pesanan makasih,5
satunya patah,5
"brng sdh di trm ,,,tuk kurir nya baik ramah",5
"tajem antingnya, kurang suka",5
Bagus cuman pengiriman lama,3
"Ok, sesuai gambar",5
Gatal ditelinga,5
Barang sesuai pesanan cepat sampai kurir ramah,5
"Brg nya udh sampai, sesuai dengan pesanan ",5
masa kiri 22nya,3
"Baguss pokoknya ,, puass bangett ",5
antingnya bagus tpi tidak cocok di kupingku ..tpi g apalah ..mkish y lazada n mas kurirnya.,5
Kecewa ..seller kurang kontrol pesan 2 pasang.. Tp yg sepasang kiri smua ,3
Barangnya bagus cantik ,5
ga bisa mkenya,5
"realpic barangnya cuma pengirimannya lama sangattt,, tpi gkpp makasihh lazada",4
lumayan bagus barang nyaðŸ™ðŸ™,4
"anting nya bagus, realpict, tpi sayang lngsng patah ajj jdi gk bisa d pke, d buang ðŸ˜",4
"sesuai harga, baru dipake yg sebelah patah",5
sesuai gambar makasih semua nya,5
bagus ðŸ‘ðŸ‘ðŸ‘,4
barang nya ox kurir ny jg ramah . Mksih lazada sukses slalu,5
kurang suka anting nya,4
makasih lazada .tidak sama.sekali.mengecewakan ðŸ˜,5
"makasih lazada datang nya sesuai.ke inginan buat mas kurir nya makasih mlm"" sempetin.datang ðŸ™ðŸ˜‡
",5
"kebesaran hihi
",5
Kurir'y ramah yg biasa nganter.. Cuma barang'y gak sesuai... ,2
"anting nyah bagus, sesuai
",5
mf baru ksh ulasan barang realpic ðŸ‘,5
bagus banget saya sukaaa,5
mantap sesuai pesanan,5
bagus mantap sesuai pesanan,5
Bagus real pict...  bgus banget kurirnya juga baik,5
cepet patah yaaa hmm ,5
bagus makasih seller,5
sesuai pesanan,5
anting.a bagus cuman gk berkilau warna nya agak kekuningan kusam kya brng yg udh lm,5
bagussss v permata nyy ada yg copot,5
"brg nya dah dtng,alhamdulilah bagus,kulir nya ramah,mksh lazada",5
"barang nya bagus,sesuai gambar",5
"maaf yaa,,trnyta gampang patahðŸ˜",1
"kecewa tdk sesuai dngn pesanan

",5
"udah keterima barang nya bagus,kurir. nya baik sopan mksih lazada",5
"anting,y patah jadi gak kepakeðŸ¥º",3
"bagus bgt anting nyaa kurir nya ramah bgt,kalian hrs mampir ke toko ini yuuðŸ˜˜makasih banyak",5
sakit di pake nya,5
apaaan nih anting nya bisa patah!!! merugikan,5
baguuusssss,5
"anting nya bikin sakit,kalung nya udah karatan dan bau:(cincin nya sakit karna kekecilan:(",5
"sedikit kecewa,krena warna ya tidak sesuai, gambar,tapi sy suka ko ,,mksh buat kurir ya ðŸ˜Št",4
"antingnya bagus ,realpict
pokoknya klk beli disini gausah ragu dijamin pasti bagusss",4
"bgus bgt .thnks lazada
",5
bagus banget aku gk kecewa.....tpi sayang pengiriman nya lama,5
kecewa baru mau di pake eh malah patahjadi di buang deh ga kepake,5
barangnya sesuai makasih ka,5
ðŸ˜¬ðŸ˜¬ðŸ˜¬ðŸ˜¬d pke bru 3 hari udh patah,2
"bagus aku suka. kurir nya juga baik
terimakasihðŸ˜Š",5
bagus aku suka,5
"ok,sesuai pesanan,barang bagus dgn harga bagus jg",5
sangat bagus,5
akuuu syukaaa,5
Realpick..suka bgt sama semua barang nya,5
bgus sesuai gmbar,3
realpict mksih,5
Jelek barang y.. ,5
baguss sin barang nya tpii kok sebelah lagii copot ,3
"beli kerabu ama kip rambut,,dapat bonus bros kemaren.belikan untuk ponakan,,seneng kali dia",5
Ok barng ya,5
pesanan sesuai gambarðŸ˜» pengiriman barang cepet bangettðŸ˜šðŸ˜šmakasih lazada,5
"bagus sesuai gambar, cepet bgt sampai nya
",5
sangat memuaskann ....mantap,5
moga awet warna nya,5
mf bru ksh ulasan.anting ny sh bgus tpi.ga nempel di tlinga nya jdi mrosot kbwah trs,5
Wah.. Anting jejer nya bagus juga.. Tanks Lazada,5
lumayan tapi gk bisa di pake lama2 pengaitnya longgar copot mulu,5
"cepat patah,,,, ",1
"kecewa blm jg dpke udh patah,,,ðŸ˜ ",5
"siiip bagus
",5
kurang paham make nya ,5
barangnya sudah sampai saya sangat suka makasih lazada,5
bagus sih cepet lg pngrimanya,5
sudah keterima pesanan nya ,5
