review,rating
bagus trima kasih lazada,5
"mantap gan pesanan anting punya istri saya,,,pokoknya GX kecewa deh,,pesan d Lazada,, semoga sukses selalu buat Lazada,,",5
bagus c. anting ya tapi ga sesuaiy gambar kirain beneran kesil lucu tapi yata ya ni mah gedeu bageut ya tapi ga papa lah makasih ya lajada,4
bagus banget enggk nyesel kurir ramah,5
antingnya sebelah patah... kenapa kaya gini sih bru prtama pesan ko pesananya patah sih. ,1
barang dikirim tidak sesuai pesanan,2
Barang nya berantakan pada patah dan tidak sesuai dengan pemesanan barang nya ğŸ™‡,5
"MKS lazada puasss SM angtny mirip bangt sm emas asli 

",5
"lumayan,, cuman warna nya aga kuning banget",5
"sangat bagus..Alhamdulillah brg yg sy pesen tk pernah zook..top lah lazada
",5
bagus antingnya,5
masa anting nya besar sebelah ukuran nya g sama....,2
kecewa pesen nya apa yg dateung modell apa yg bener donk,5
saya kecewa anting nya tidak sesuai gambar,5
Ko yg d kirim beda..,5
sy kecewaaaa brg nya patah minta di gnti dong brg ny,2
barang bagus terimakasih,5
bagus,5
ok,5
