review,rating
"barang ORI , mudah2an cocok ... ",5
"sy pengguna sabun Erha,mantullll banget.barang ori,kemasan pakai wrapbubble,seller baik,kurir baik,pokoknya ga pernah nyesel beli erha.makasih semua dan kurir yg baik.",5
mantap dah barang pesan an nya bener bener aman kemasan ny di balut dng bubble . dan semoga krem buat kki pecah pecah ini ampuh  .... thanks ,5
"baru ptma x coba , semoga cocok. dpt spatula & plester. makasih.",5
"mantap... diskonnya gedein lagi dong, hee.. bayar senin dini hari kamis barang diterima",5
