review,rating
"keren banget sumpah, maen game gak lag, ram nya gede internal memory juga besar, sangat puass, tab buatan prancis dr dulu memang bagus,harga terjangakau,pengiriman super cepat 1 hari sampai, packing rapi super aman",5
"ahamdulillah sampai dg selamat, bungkus rapih, bubble wrap, dpt anti gores jg kereen. Tks",5
"mantap pengiriman cepat, barang ok sesuai gambar dan deskripsi. thx gan",5
barangnya sesuai pesanan yp kok an3h ya pake gsm lain gak bs internetan,5
barang mantap sesuai deskripsi,5
