review,rating
maaf baru kasih ulasan soalnya hp nya masih dicoba ternyata bagus sesuai gambat semuanya berfungsi dengan baik,5
Barang Dah Sampai Mantap Peking Rapih Harga Mantap Hape Bagus Moga Awet Deh.... Makasih Lazada N Toko Pokokya Zip....Deh,5
"Produk lengkap dan kondisi mulus...pengiriman jga cepat...udh 2 hari pemakaian sejauh ini baik2 aja
",5
Suka banget. Lucu soalnya,5
"mantulll..
semua lngkap..
suara wokeh ..
camera lmayan..
dh bli aja bt akooh mah mantullll..
bt abang kurirny gk usah d tny krn dh lnggn 4 jempol bt abang kurirny",5
hpnya lumayan.. tapi kecewa krn minta merah koq di kasih hitam. ,2
"paket sudah di terima
barang ok
",5
normal jaya...hpnya bagus udah di pake anak saya,5
sdah di test. hidup semua. thanks lazada,5
"Bagus hp nya mungil. 
Kurir nya jg ramah. ",5
Kecewa barang tidak sama dgn pesanan,5
bahus bgett hpnya.. suka sekali,5
barangnya sudah diterima...sesuai gambar ...mudah mudahan awet dipakai nya,5
"hp sudah diterima dengan baik,, trimakasih",5
"barang bagus, kemasan rapi kurir ramah,oke lazada.",5
mantul. mudh2an kedepannya lbh bgs lagi,5
"barangnya bagus, bentuknya unik, membungkusnya juga rapi☺",5
kenapa hp nyh darurat terus sinyal bagus tapi darurat terus,5
So far So good,5
Brangx bgus trbungkus rapi q suka bnget mksh kazada,5
"barang sesuai pesanan. tq lazada
",5
"ya meski kecil ,tapi puas ,sesuai pesanan.terima kasih .maju terus lazada.",5
cocok...tidak ada kendala...barang bagusss,5
Mantul lucu & unik,5
"Brang bagus , sesuai pesanan .
Terima kasih lazada",5
"bagus, demen mak ane, ma kasih ye",5
mantap,5
tks,5
mantap,5
