review,rating
"sesuai dgn gambar, istri Sy duka",5
"alhamdulillah mendarat dengan selamat,,,terimakasih lazada bungkusanya rapih manteplah...",5
sampe 3 hari cepat .. hp bagus .. tp syang mnta wrna putih di kasih hitam gpp deh yg pnting hp smpe fungsi .. mksih seller & lazada,5
barang di kirim warna hitam saya pesan warna putih karna saya malas tukar dan nunggu lama lagi jadi saya kasih bintang 4 aja ini udah syukur saya masih mau kasih reting sagini pengiriman sih cepat ,4
barang bagus sesuai,5
barang baru sesuai pesanan,5
barang cepet sekali nyampenya.. hp bagus sesuai deskripsi.. josss.. ,5
"barang bagus, dan cepat sampai. sesuai dengan yg di deskripsi
",5
minta warna white d kirim ocean blue,5
Pesen biru datang hitam... Parah,1
"Mantap barang dan kurirnya.. 
",5
Mantap,5
thx lazada....hp nya mantul,5
Barang tlh mendart dengan sempurna...,5
memuaskan....,5
"Pengiriman cepat, tapi barang yg diterima tdk sesuai, saya pesan warna putih yang datang warna biru",4
"barang sampe sesuai pesanan, ",5
siipppppp,5
mantap,5
