review,rating
barang original .....puas banget mantap makasih jd id .......klo pengen bagus lagi harus di perbarui perangkat lunak nya ke versi yg skarang di jamin ngga ngelag2 lagi ,5
"barang ori,bagus, sesuai gambar, respon cepat & ramah, pengiriman cepat tanpa kendala, oke deh.

jangan ragu beli disini. recommended!!!",5
baguss juga lumbayan mau pesen lagi ah,5
Mantap. Rekomnded seller. Ni lagi nunggu kiriman lagi dari Agan. Tolong di cepet di proses ya. Thanks,5
"pengiriman 24 jam barang udh ditangan,barang masih segel.mantap semoga awet....",5
"yg dipesan  tipe L512 
yang dateng tipe E445 
lama lagi...sampe jenggoten nungguin barangnya datang",5
mantap..bisa langsung dipakai dan bagus,5
"sudah kami terima dan sesuai pesanan,  dan sangat ceoat kirim,  terima kasih sangat puas",5
hp nya bagus cuma suranya jelek sm youtub g bisa d buka tp oke lh buat harga segitu mh makasih,5
mantull original,5
sesuai pesanan,5
sy senang sekali beli hp ini.enggak kecewa beli hp ini.masih disegel pula,5
matap jiwan,5
ok lumayan,5
