review,rating
oke sip udh nyampe,5
barang ok pengiriman pun cepat packing juga rapi.. buat kurir nya ramah dah langganan pula.. sukses terus buat toko nya... suka bngt sma hp nya,5
"Paket sudah dtg untuk hp msh d cas untuk kartu nya udah kadaluarsa gmn nih dpt ganti rugi gx? 
Makasih untuk seller n lazada jg untuk mas kurirnya makasih byk",5
mantap. top pengiriman nya cepat banget recommended seller ,5
"mantap sesuai pesanan dan dapat gratis kartu xl. 
",5
alhamdullah barang nya sudah sampai dgn selamat...hp nya bagus.kelengkapan nya cukup.packingan nya jga rapi..pokoknya tak rugi deh beli d toko ini.mkasih jga buat lazada.,5
"sorry baru kasi ulasan
barang bagus packing rapi nyampe dg selamat tp kamera agak kurang ya wajar harga segitu tp jaringan lumayan ngebut lah",5
cpt terkirim...kondisi bagus masih di segel...tapi trnyata kamera nya jelek banget masih bagusan yg R6...,5
"barang mulus , cepet banget paket nyampenya , recommended banget pokonya",5
hp bagus... berfungsi dng baik. ,5
"pengiriman cepat,kurir baik, kualitas barang insha Allah awet ,#BagusssKok , terimakasih",5
"mantull..kurir ramah baiik
",1
"Barang bagus, kwalitas oke. Top banget. Jangan ragu untuk pesan di toko ini.",5
Memuaskan,5
