review,rating
tidak sesuai dengan gambar (tidak ada tulisan uv3r...display angka kabur (di angka kadang jelas terbaca kadang angka putus-putus),2
"Baru sampe via JNE, semoga baik2 saja dan bagus tdk ada cacat,makasih buat seler dan lazada",5
"packing sip barang aku coba bagus,sesuai harapan, kirim cepat makasih lasada ok banget JNE",5
kecewa sama barang nya masak iya kecil banget kayak mainan anak anak sih mana gak berfungsi jgak ,5
bagus baik pokok nya jangan ragu lagi sma lazada,5
"tidak sesuai dengan gambar, display angka buram",2
"Barang ok, tp baterai g awet",5
"barang nya cepet nyampe, tapi suara nya kenapa putus putus yah",1
barang di terima sesuai pesanan,5
"Mantab.... terimakasih seller, barang mulus mendarat,  sesuai gambar...sukses seller... sy puas",5
ok,4
"good
",4
