review,rating
"Telah di terima dengan selamat, kurir ramah dan koperatif. Produk lengkap, dan berfungsi dengan normal. Terima kasih Lazada dan seller.",5
"paketan tadi sore datang sesuai pesanan sdh saya coba sdh ok..

",5
"barang barusaja sampai, untuk kelengkapan memang lengkap, body ht bagus tidak ada yg pecah, namun ketika saya transmit, setelah selesai berbicara & sudah melepas PTT, Si HT ini masih transmitt, jadi kita sudah melepas PTT masih transmitt. tolong seller TP-LINK STORE ketika akan mengirim barang elektronik terlebih dahulu dicoba apakah fungsi dengan baik/tidaknya. saya kali ini sangat kecewa. ",2
"mantap radio nya... pokoknya gk kecewa
",5
mantap bos.....trima kasih,5
mantap.. ,5
"Barang bagus, tapi pengirimannya lama.",4
"super sekali idah ke 2x order, barang mantap",4
