review,rating
"cepet bgt sampe nya,,kmrn pesan hri ini sampe,,kualitas produk bagus,expired nya juga msh lama,,good deh pko nya,next order lg past",5
"Makasih lazada barang dh sampe maaf baru ngsh ulasan makasih jg untuk abng kurir y ujan"" dh mau nganterin ",5
"Barang sudah sampai cepet banget sblm estimasi. packing rapih, makasih seller semoga lancar bisnis online nya",5
Barang sudah sampai packing rapih ini pesenan yg ke 2 memuaskan. terima kasih seller,5
"masih lma expd 
pengiriman n pengemasan baik
trimksh",5
"mantap cepat pengirimanya,  ğŸ˜",5
pengirimannya cepatğŸ˜Š,5
Anaak saya sukaaaaaaaaaa,5
packing rapi kurir baik dan ramah semoga berlangganan krn anak sy suka ..,5
makasih dedek nya suka bgt sama cemilan ini makasih lazada ,5
Mantabb... produk ny bagus sesuai pesanan..baby ku suka,5
"mantuuuul,cm tingkatkan kerapian dlm pngemasan",5
