review,rating
"suka banget sama kemasanya mau pesan lagi ah kesini, engga nyesel beli, ex masih lama lagi, jadi engga hawatir, bagus bagus bangus deh",5
"Ada yg penyok kemasannya, mungkin ini disebabkan pas pengiriman. Ok semua, pengirimannya jg cepat. Semoga ank saya suka. Respon seller jg cepat. Lain kali belanja ditoko ini saja. Terima kasih seller dan lazada 😊",5
Barang sudah sampai dalam kemasan yang baik terima kasih,5
sip deh popoknya puas bangetttt,2
"sudah datang, buat makanan anak saya semoga selalu bisa order disini lagi",5
"pesanan cepat sampai, harga lebih murah, expired masih lama, produk lengkap.. puas belanja disini.. makasih yaaa",5
langganan deh ,5
bagus langganan terus,5
"Sesuai pesanan, packing rapi... ga ada yang kurang...
untuk pengiriman nya ga lama",5
mudahan cocok buat anak saya,5
allhamdulillah brg mendarat dgn baik,5
Langganan terus deh ,5
"alhamdulillah amanah, smoga ttp amanah, love it",5
bagus sesuai pesenan tp agak laama,5
Selalu enak tp packing pada penyok ,5
"Sllu langganan , krn anak sy suka banget yummybite . ",5
sangat rapi,5
packing aman cuma aga penyok,5
Joss,5
mantuuull,5
