review,rating
"sdh smapai dgn selamat.... brmg blm di coba ,, dos nya agk sdkit penyot2 tpmudah2n tdk mempengaruhi isinya. thx lazada",5
"Semua berfungsi baik, ini garansi distributor, colokan chargernya pipih, dan tidak ada kabel data dalam dus. ",5
trimakasih..peket nya sudah sampai..cepat dikasih bonus tripot mini.,5
"Barang sesuai ,komplit..makasih bonus tripotnya
Bagus lg kl sudah includ mmc nyağŸ˜
Tp blm di coba",5
kualitas baik. tidak diragukan lagi. ,5
barang sudah terima ..pengantaran cepat..barang kondisi baik,5
"Barang tiba dengan selamat, no cacat dari dus sampe isi dalamnya. kualitas foto and video oke punnya. thanks seller",5
"barang mendarat dgn oke, ",5
Barang diterima dalam keadaan baik,5
