review,rating
"bahannya adem... kualitas bagus,harga murmer. ga nyesel deh,pokoknya recomended banget. ibu aku pasti suka.. thanks lazada...ok ",5
"alhamdulillah pesenan cepat datang,tpi agak kecewa ko ada noda gitu yah kaya minyak di cuci juga ga bisa hilang",1
terimakasih lajada,5
"packing nya bagus banget rapih,bahannya juga adem enak makasih min",5
alhamdullilah realpic mksih smga amanah,5
"Sedikit tidak sempurna,tp untk harga segitu ok lah...",5
terimakasih paket dah nyampe,5
barangnya udh nyampai bagus  banget saya suka makasih lazada ,4
"paket rapih sesuai pesanan...terima kasih.
",5
mhanthapppp posannn,5
"barang bagus pengiriman cepat ,kurir nya juga ramah",5
barang bagus hanya kurang besar..pengiriman cepat ninja selalu ok..trims lazada,4
"Barangx lumayan bagus dgn hrg segitu, Cuma atasx gk ada rendrax",5
masih baru atau rongsokan nueğŸ˜­ğŸ˜­,5
"alhmdllh pket dh smpe,bguus mukananya,cmn bawhannya kurang panjang .kurirnya dh lnghann.mksih lzda ",5
