review,rating
"alhamdulillah barang udah sampe, bagus realpict sesuai ekspetasi ğŸ˜,kurirnya juga ramah.
terimakasi kak semoga sukses selaluğŸ˜Š",5
"sepeda y bgs sesuai pesanan mksh seller lazada semoga makin laris, kurir y jga ramah",5
lumayan sepedah nya pengiriman juga cepet sedikit penyok keranjang nya tapi semua oke,5
"anakku senang sekali sepedanya sudah sampai
barang sesuai gambar, seller recomended dan fast respons
jauh dri estimasi sudha sampai
thx seller, thx lazada",5
"barangnya bagus banget deh,.  saudrq suka cma pekingnya kurang rpi jdinya keranjangnya penyok",5
alhamdulillah..sepedanya bagus.. keren anak saya suka ,5
Barangx ok tp kcl....,4
"barang ojeh bgt,packibg rapi",5
