review,rating
"Barangnya baguss..  Sesuai gambar cmn pengirimannya agak lama... 
Terimakasih LAZADA🙏",5
"Barangnya sampe cepet, pdhl estimasinya sampe hari sabtu, hari kamis sudah nyampe . Pelayanannya ramah dan fast respon, kualitas barang jg memuaskan, bahannya lembut dan empuk ..",5
"barang dtng tdi siang,,kurirnya ramah dan sopan,,karpetnya lngsung saya anterin ke teman coz itu pesanan teman..alhamdulilah teman suka,ktnya lembut dan enak bt d tidurin...makasih ya adzkia shop,,next time order lg",5
"sesuai dgn perkiraan...pokonya adzkiashop35 
top...top...top bingitt
jdi pingin psn lagii 
terimakasih lazada...sukses terus.",5
"Barang nya bagus bulunya lembut, pokoknya ga kecewa. Cuma lewat satu hari dr hari pengiriman, sharusnya tgl 19 sudah sampai,tp sampai tgl 21. Tp gapapa ttp puas bgd. Makasih lazada and makasih adzkia35. ",5
"barang bagus,sesuai pesanan,dtg tepat wkt dan respon penjual sangat sangat baik banget. recomend banget",5
Pesanan tidak sesuai. Saya pesan motif mickymouse fullset warna biru tapi yang datang motif hellokitty standar dan warna pink. Mohon untuk dibenahi kembali sistemnya. ,1
barang kurang bagus pada rontok bulu bulunya pada terbang jadi ga di pake di lipet lagi di bungkus kecewa,2
produk sangat memuaskann harus beli lagi,5
"Pngiriman cepat,  bhan bgus lembut alus tdk kasar,  next order lg diadzkiashop35 mksih mksh..",5
"pengiriman barangnya lama melewati esrimasi pengiriman, barang yg diterima bagus, bahanya lembut, tpi pada rontok dan bantalnya cuman nerima 4 pcs, tidak fullset,,
tqpi gpp deh dari pihak Lazada bertanggung jawab qtas kekuranganya dan diganti dengan voucher..
untuk kedepanya usahakan harus sesuai promo nd aktualnya..
",3
"Pengiriman nya lama hampir 2 minggu, BTW barang nya sesuai pesanan n bagus",5
pesen yg fullset dateng yang standar😠 gimna nih ka apa bantalnya bakalan di kirim lagi? kalo ga di kirim lagi saya rugi dong? ya saya bisa maklumi mungkin bnyak yg order mungkin lupa yg bikin kesel ini di chat cuman d baca ajah!!!!!,1
Bagus pengiriman juga cepet,5
Ko punya aku blm dateng juga y..padahal aku pesan dr tgl 13.tp sampe sekarang blm sampai juga..gmn nih,1
"ALHAMDULILLAH SUKA BANGET ANAK SAYA ,INSYA ALLAH NANTI PESAN LAGI BUAT ANAK SAYA YANG LAIN DAN BUAT DIRUANG TV THANKS YA ADZKIA DAN LAZADA SUKA BANGET DAN RECOMENDED SELLER",5
"TERIMA KASIH ADZKIA35 SAYA JADI REseller adzkiashop35 selalunya pastinya sangat memuaskan terima kasih adzkiashop35,barang rapi,kualitas ok,pengiriman cepet,sukses selalu ya,",5
"Bahan nya sangat bagus dan halus serta nyaman sekali untuk di tidur in,ga menyesal belanja di lazada.",2
"bantalnya cuma 2, mungkin lupa, tolong yg 3 lagi segera di kirim",4
"Barang sudah sampai. Kualitas jahitan kurang rapi, penulisan nama tidak sesuai pesanan.
",3
Sesuai pesanan...,5
Harusnya lebih tebal,3
"Busanya tebalin dikit lg donk, biar puas pelanggannya..",4
Min minta nomer wa dong buat reques gambar dan warna terimakasih,5
"Pesanan saya mna? Sudah hampir seminggu blm juga dikirim. Katanya mingu ini lah, sabar lah, Tak sesuai estimasi. Tolong mbk yg jujur jualannya..",1
Saya suka sekali,5
Mkasi adzkia bgus bnget kerjasamanya bersama lazada...,5
"Makasi adzkia,kerjasamanya bgus bersama lazada,top bgt..",5
,5
