review,rating
"saya pesan 2 playmates, yg sy terima cuma 1, baru sy urus tpi chatng lama sekali balesny, baru kali ini kecewa belanja via Lazada. ",2
"pembelian ke 2,barang sesuai pesanan, bahannya tebal dan empuk, pelapaknya recommended sellerğŸ‘ ",5
mantap dan bagus tikar nya,5
"barang sesuai pesanan, gambar lucu, gak ada cacat, empuk, pelapak recommended seller",5
barang ok tqs seller dan lazada,5
alhamdulillah brng nya dtng memuas kan mau psn 1 lgi,5
nga nyesel barang nya bagus,5
"barang sudah diterima,bagus sesuai gambar,puas !",5
murah tapi syg yg di kirim salah motif. mau retur males yaudah deh gpp thanksss lain kali lebih teliti,3
barang bagus.... mantap...... seller juga oke. pengirinan aja lama..... tapi sesuai karena murah ongkirnya. harga barang dan ongkir termurah se lazada.  sukses selalu buat seller dan lazada,5
bagussssss.mau order lagi ah,5
tikar nya bagus banget .. makasih Lazada..,5
bagusss,5
best lh,3
