review,rating
Kereen bgt pesan tgl 11 smpe tgl 13...cepat proses na n kualitas na jg bagus pokokna keren bgt dech ga nyesel... 2 jempol dech...,5
"bagus, sesuai yg dipesan,adminnya ramah, kurirnya ramah.. good lah.. cm kurang rapi aja jaitannya... tpi bagus semua2nya",4
"Untuk memesan nama,silahkan melakukan pemesanan &  transaksi tim admin kita akan chat via nomer hp,untuk menawarkan modelnya mau diganti atau engga & mau ditambahkan nama atau engga,terima kasih happy shopping adzkiashop35",5
Bisa cod dong...,3
Cod dong ,4
