review,rating
trimah ksih banyak sesuai gambar suka sekali + syantiiik bngett bulu2nya.. mksih Lazada selernya jga baik bngtt pokonya gak ngecewain deehh.. ,5
bahan'a bgusss.... tebal... realpict dech pokoknya... cuman kecewa d pgiriman saja yg sangat lama....,5
baru unboxing paket surpet nyaa ..waw sesuai yg d pesan ..lembut bgt bahan ny ..lumayan tebel ...thank u ...,5
"Mksh ya kakak kasur nya udah dateng bagus tebal lembut puas pokok nya alhamdullilah mendarat sampai tujuan dengan rapi , pengen pesen lagi ntar kak",5
"saya pelanggan setia adzkiashop35 kalau beli karpet bulu karakter di toko adzkia35 pastinya selalu memuskan pelanggan arisan saya,terima kasih adzkiashop35 dan lazada RECOMENDED SELLER",5
"terima kasih adzkia shop35 tetep jadi yang terbaik ya produksi karpet bulu nya,RECOMENDED TOP SELLER POKONYA",5
"RECOMENDED SELLER TERPERCAYA DAN BARANGNYA SANGAT BERKUALITAS RAPI MODELNYA DAN JAHITANNYA ,THANK YA ADZKIA35 DAN LAZADA",5
"karpet DAN PELAYANAN sangat bener bener memuaskan pokonya RECOMENDED SELLER TOP DEH ADZKIA35 DAN LAZADA,THANKS YA SUDAH KIRIM PAKET YG MEMUASKAN,LANGGANAN ARISAN SAYA JADI TAMBAH BANYAK,GARA2 AMBIL KARPET DISINI",5
",RECOMENDED barangnya sangat bangus POKONYA TOP BANGET,harus dan wajib beli ditoko adzkia35 dan lazada,DIJAMIN MEMUASKAN",5
"Suka banget karpet nya
Pelayanan nya pun sangat ramah
Udah 3x pesan semuanya barang oke
Tkasih lazada
Tkasih adzkiashop 35
Insya allah ntr pesan lagi ya
Sukses terus",5
saya suka sekali sesuai fto tidak ada yg cacat.. terimakasih.. walau ada hambatan karena harus po dulu untuk pembuatannya tp semuanya sesuai plus namanya jg bisa pesen gratis,5
sesuai gambar tapi bantal kurang banyak,5
"Knpa bantalnya cuma 2 guling 1 sedangkan di gambar bantal 5 guling 1 telapak 2 keset 1...
Sya gx mau tsu sypingin kumplit barangnya.. Mna buat arisan ...sya mau pesen lg jg takut kecwa lg",2
"Kasurr'a baguss bgtt, langsung order lgi",5
gak sesuai gambar.bantalnya cuma dua sama guling satu.tp ok lah.kurirnya juga baik .thanks lazada,5
"anak saya suka sekali terima kasih banyak adzkiashop35 dan lazada ,thanks ya",5
sesuai gambar.. bagus tebal dan cepet sampai,5
kasih bintang 5 soalnya anak saya suka ,5
"Gk ada keterangan dape bantal 2 guling 1.
D foto nya dapet bantal 5 tapi pas dateng cuman dua payah
",2
"Saya kasih tiga bintang dulu, d karnakan pesanan saya belum dateng jga , baru lewat 1 hari sih dari waktu estimasi yg d tentukan..",3
"RECOMENDED SELLER ADZKIA35 DAN LAZADA,THANKS YA SUDAH KIRIM PAKET YG MEMUASKAN,",5
"mksih gan..karpet sudah sampai.. puas ssesui pesanan.
tks gan",5
Keren.... Ramah... Bagus bulunya... G nyesel deh,5
karpetnya bagus trimakasih,5
Alhmdllh...bgs ank saya suka.,5
"kecewa banget gambarnya full bantal tapi yang dikirim cuma satu,,  ini gimana yah bu tolong donk kalau bisa yang lainya di kirim lagi bantal""nya",1
"OK, lembut, anak-anak sukaa. Tp kecewanya krn pesen da nama, tyt yg dateng ga da namanya. Pengiriman jg agak lama. Tp it's OK. Tq seller n lazada",5
"Barang tidak sesuai gambar,tidak ada bantal kakinya, barang lama datangnya. Bahkan melebihi waktu estiminasi",1
"karpetnya bagus sayang knpa GK fullset...
trus bulu nya rontok geli nempel2 di muka...
",4
"THANKS YA ADZKIA SHOP35 BARANGNYA SANGAT MEMUASKAN TERUS DAN SANGAT PUAS TERUS UNTUK BARANG2 KALAU MESAN DISINI PASTI PUAS,RECOMENDED SELLER",5
Kalau di cicil pembayaran cicilannya gimana ya?barang datang baru di bayar cicilan pertama atau gimana,1
Barang tak sesuai yg dipesan.,5
bguuusss Kasur.n.agak lama sih tp gk pp bguuusss,4
kirain bantal nya pulset ,5
bagus bgt,5
bagud,5
Mantap mksh gan cm pengiriman lama tapi mantap syg hape camera dpan rusak jd g bisa uploud gambar,5
Sist bisa pesen sesuai keinginan gk?? Dlm artian memilih karakter y tidk terfokus pd gmbar yg tersedia,3
barang ny jelek,5
"di kira bulunya tebel,tp lumayan lah",4
bagus banget karpet ny....halus tdk luntur,5
pengiriman tidak sesuai estimasi lamaa ..tapi karna kurirnya sopan ramah..oke lah 3bintang ,3
terimakasih..harga paling murah..dan d antar smp rumah dg cantikk..dapat nama pula..,5
wrna sesuai pesanan tpi blm d buka soalnya orderan orng,4
reapon pelayanan baik dan ramah. barang sesuai pesanan dan sesuai waktu yg ditentukan. senang berbelanja di sini. semoga berkah dan bisa lanjut di lain kesempatan.,5
"Brg nya dh smpe, saya suka saya suka mksih sist,  bhannya lmbut alus pula,  buru blnja dilazada,  ga nyesel pokonya deeuh  ",5
good,5
👍👍👍👍👍,5
"Tp ga nambah lg kan ini full set kan,,,",5
"berapay bak tebal karpetnya,  bsa mnta keterngan nya ya lengkap",5
bagus,5
cicil bs gk? ktbln ny brp n bantL ny ad berpa?,5
Saya mau pesan hellocity wrna pink trs pkai nama keisha athaya salsabilla,5
Ka aku mau nanya ini cara cicilannya gimana ?,5
Bisa bayar di tempat gan,2
Itu ukuran nya gede apa ga? Bantal nya ada brp?,5
memuaskan,5
"Selain beda harga, Bedanya fullset & standar apa ya  ??",1
