review,rating
"makasi barang sdh nyampe barang sesuai pesenan n bagus suka deh, trimakasih lazada dapat gratis ongkir nya",5
mungil sih.tapi bagus.anti slip.ok dech,5
sesuai bgt bhn lembut packing ok...ğŸ˜˜ğŸ‘Œ,5
Barang sesuai dengan pesanan dan Terima kasih lazada ,5
bagus barang nya cepat pengiriman nya mksh lazada,4
"mksh,brg bagus puas bgt.
",5
Udah beli kedua x.... Good walau lama nyampe nya.... ,5
"barang bagussss , mantapppppp",5
good product thanks,5
Bgus warna cerah lmyan tebel bwah ny karet jd gk gmpng ngegeser,5
