review,rating
alhamdulillah barang nya nyampek dengan sempurna ....saya suka . tetap amanah ya,5
barang bagus tebel makasih seler. topdeh,5
barang sesuay pesanan dan pengirimannya cepat gx kecewa lh pokoknya lain kali mau pesen lg  makash lasada,5
Mantulll,5
"Mksh Untk barang, cuman belakangx Polos Yaa...
Kain Lumayan Tebal, yaa sesuai harga sih...
Mksh Buat Pelapak, Mksh Lazada, Mksh Ninja...",5
barang sangat cepat sampai nya dan bahan juga tebal bagus lah...!!,5
tealpic bingiiiit thank laz and seller juga kurirnya langganan...mantul lah pokona mah...,5
keren hoodie nga suka,5
Bagus pengiriman cuma 2 hari huhu tengkyu seller,5
Ukuran Tdk sesuai dengan Yg di inginkan,3
maksih banyak lazada sweter nya top markotof.,5
"ok bgt
",5
mantapp,5
