review,rating
barang tiba kondisi  dus sesuai dengan yg saya foto dan mati ga nyala,1
mantap sesuai pesanan,5
bagus,5
lampu led dgn kamera oke.  trim's lazada n sellers. ,5
"Barang sampai dengan baik, sudah dipasang dan berfungsi dengan baik.....terima kasih",5
"kecewa banget....kok g lengkap ..kartu memory g di kasih...sdh mahal bikin kecewa
",5
map buat ninja. kok saya bli Camera cctv bolham lampu WiFi y ga muncul y,5
"KK barangnya SDh dteng to gak bisah nyala yg bener
tolong bantu nya kk",5
bagus sekali  dan berguna,5
kenapa pesenya bolam dianter nya kaya gini,1
oke pungsi,5
Barangnya Cepat sampai...ini sudah pemesanan ke 2......bagus dan canggih,5
harus punya wifi dirumah ,5
