review,rating
"kirain IP camera yang ad menggunakan Kabel Rj45
sekalinya hanya menggunakan Wifi kamera aj untuk koneksinya.
jdnya gk bs saya gabung dengan NVR

semoga awet dh kameranya",5
barang sedikit mengecewakan.....,1
cctvnya gak mau conect2..padahal wifinya ,1
"Barang bagus..walaupun beda dikit dgn yg di gambar, sudah berfungsi dgn baik...smoga awet ya...tq...recommended banget.",5
"Barang bagus, bisa terhubung dengan NVR...mantaappp",5
"sdh datang dan saya puas,gambarnya jernih,cuma agak lama pengirimanya,ya mungkin dari luar",5
kenapa tidak bisa conect ke wifi ya.. jadi blm bisa dipakai mohon petunjuk...,5
mantap,5
"Topp, barang sesuai iklan dan cepat sampai",5
mantappp kali . . gak rugi . . mau pesan lagi ,5
sangat ok,5
