review,rating
top markotop jam nya bagus tapi talinya kecil kurang gede tp ga pa2 aku suka makasih lazada dan buat kulirnya dah langganan,5
Makasih paket datang tepat waktu kurir ramah sucses lazada,5
"Pngiriman maju 1 hr, brat <110gr, gelang 1.7cm, tanpa strap canvas, d ajak wudlu ngembun.. smoga awet...",3
Barang sudah sampai dan sesuai pesanan.. Thx,5
ngk sesui dngn web size kecil tali rante kecil agak kecewa sih....namun apa daya....,3
"terimakasih barang sdh terima 
kurir jg ramah",5
lumayan sesuai harganya,5
