review,rating
"Produk sudah sampai, packingan rapih barangnya juda Bagus sesuai yang di poto kualitas sesuai dengan harganya, dijamin tidak akan mengecewakan",5
"Packing oke..barang sesuai pesanan penjual  responnya baik Dan ramah Bagus dehu pokokknya, pengen belanja disini Terus dehh",5
"barangnyaa udahh sampai pengiriman cepat, dari pertama pesan langsung dikirim. barangnya Bagus suka dehh pokokknnyyyaa",5
"kualitas produk sangat baik, produk original harga produk sangat baik, kecepatan pengiriman sangat baik, mmmmmmmuuuuurrrrraaaahhh bbbbbeeerrrrkkuuuaalliitttaaasss",5
Pengiriman cepat pokoknya mantul banget dehh,5
"paketan sampai cepat banget pengirimannya, barangnya memuaskan tidak ada cacat sedikitpun",5
"aaajjjiibbb banget baranggnnyaa, pengirimannysa juga cepat , respon nyyaa juga baik",5
Produknyaa pada mantuulll semuuaannyyyaaa,5
Sangat memuaskan kakk... semoga bisa jadi langganan terus,5
"Puas sama barangnyaa, packingnyaa rapih gak ada  yang lecett",5
Ini okkee Bangett siihh barangnya...ga ngecewain kemasannya juga Aman rekomen banget,5
"Terimakasih barangnya sesuai pesanan, next nantii bisa order lagi",5
kualitas produk sangat baik,5
mmmmaaanntttuuull,5
yaaampun bagus banget bener² super bagus,5
Mantap banget,5
Alhamdulillah baranggnnyyaa baaguuss mmaanntuul sekali,5
