review,rating
"saya pilih yg biru...tapi yg datang tak ada di pilihan.penipu
",1
gak sesuai pesanan....order hijau yg dtg silver..,5
"paket udah kita terima.  paketnya sesuai dengan gambarnya. cuma warna aja yg beda dari pesanan. klu boleh tolong diteliti lg biar sesuai dengan pesanan. semoga sukses selalu ğŸ™ğŸ™
",5
"Jam nya ga sesuai warna, mau nya warna hijau yg dtg warna kuning",5
jgn dagang bohongi pembeli jam batere di bilang automatis........,1
"ga sesuai gambar mesen warna apa yg dateng warna apa ,mana pada baret jam nya hadeuuhh kecewa",1
"pesan warna hijau gold eh di kirim warna kita .. pembohong ini jualannya 
.",5
saya suka sesuai dgn pesanan.,5
tdak sesuai dengan potonya,3
"Udah datang kemarin cuma pesen yg biru dtangnya kuning,katanya automatic ternyata pakai batrai ",3
