review,rating
"kog yg dikirim warna hitam.
bukan nya sya pesen nya warna coklat.
barang tdak sesui pesanan....",3
"barang tidak sesuai pesanan..
tolong dilihat orderan saya..
besok² agar lebih teliti dengan orderan..",5
"gk sesuai pesanan lain yg d pesan lain jg yg dtg sungguh kecewa 
ini namanya udh membodohi
",5
"Saya sangat merasa kecewa, barang yang saya pesan bukan jam yang sesuai dengan keadaan yang aslinya. Akan tetapi beda jauh dgn yg d jual. 
MERASA TELAH DI TIPU OLEH PENJUALNYA",5
"toko penipu itu mah, brang tdak sesuai dngan gambar kapok gk bkln bli di toko itu lgi, laen kli klau jualn yg bner donk. ",5
brg sdh dtg tpi yg dtg brg rongsokan bli jam mati klo jualan yg bnr dong kapok oesan lgi jga,5
kecewa tali jam nya gak sesuai gambar,5
kecewa tidak sesuai gambar.tapi ngak apalah harga nya juga cuma 20rb,5
"Pesanan tidak sesuai dengan yg di minta yg di minta tidak sesuai jadwal kecewa berat

",5
Sudah ok,5
