review,rating
Terima kasih pesanannya sudah sampai dalam keadaan baik....dari ketiga alat setelah diuji coba berfungsi dengan baik.... utk kopi bubuk cremanya agak tebal... tapi untuk kapsul nespresso dan dolce gusto cremanya tipis... tidak sama dengan video demonya...mungkin baru pertama dicoba,5.0
Selamat mlm Dear.. paket mesin  kopi Hibrew sudah tiba smlm dgn aman n mulus. tq.. tp maaf dear.. Baru sempat Beri ulasan.. wow.. bagus banget mesin kopi Hibrew.. modenya cakep n mewah terlihat.n jg berfungsi dgn baik.saya seneng. hehe.. thank you so much seller lazada.success always ,5.0
"Barangnya dtg pada keadaan yg aman dan bagus. Sangat suka dengan coffee machinenya, soalnya dia bisa untuk capsule dolce gusto, capsule nespresso dan ground coffee. Recommended :) ",5.0
Ok cukup bagus barangnya.,5.0
Pengiriman cepat dan barangnya oke,5.0
Sangat bagus! Dikemas dengan baik. Mudah dimengerti manual. Kopi gratis bagus juga! Beli yang bagus.,
"Ia bekerja seperti yang diiklankan. Ini menerima nespresso, nescafe dolce gusto pods dan kopi bubuk. Mengejutkan itu",
Memang bekerja dengan baik DG dan Nespresso-size pods! (belum dicoba meskipun dengan kopi bubuk). Sangat sulit daripada membeli mesin tipe eksklusif. Sangat direkomendasikan!,
