review,rating
Barang tidak sesuai harapan saya minta warna putih di kasihnya warna biru.....sikap kurirnya juga kurang sopan. Saya tidak suka warnanya dan mau saya kembalikan !!!,1
 saya pesanya warna PUTIH malah di kirm warna MERAH. KECEWA. lain kali kaih tau klau wrna yg di butuhkn ga ada ..,5
bugus 👍 Semoga awet thx ,5
kasurnya bagus... sampe ibu kosku pgn beli jg hahahahhaha... thx toko dan lazadanya...kurirnya jg slengekan alias doyan guyon.. hahahhaaha,5
"Pengen ny warna putih,
Tapi yg di kirim biru,
Klo putih kaya ny ga panas di banding warna biru,
Makasih aj dh dri pada bt",3
"Barang datang dgn selamat, pengiriman sesuai estimasi, kurir sangat ramah, dan barang nya sudah saya pakai, saya sekeluarga sangat puas dgn harga yg murah dgn barang yg sangat bagus. Terima Kasih Oscar Living dan LAZADA.",5
"Dalam estimasi yg ada di notifikasi saya,  barang seharusnya saya terima tgl 16, namun sampai sekarang belum keliatan wujudnya berada dimana",1
Barang belum saya terima sampai sekarang padahal sudah transfer dari tgl 13 des 2017 bagaimana ini?saya kecewa dengan pelayanan nya,1
Horeeee pesanan saya sudah sampe cepat dan tepat' bagus sesuai barangnya makasi LAZADA memang okeeee,5
"Makasih lazada & seller. Barang udah nyampe tadi siang dianterin jne. Barang bagus & berkualitas. Kurir juga ramah.
Semoga barang nya awet yah. Biar bisa jadi langganan. Pengiriman Lumayan cepat. Recomended seller dah pokoknya . ",4
"Kasur sangat nyaman digunakan. Tetapi, memakan ruang untuk menyimpan kasur ini karena ukurannya yang tetap besar jika dilipat.",4
"kasur cukup empuk dan lebar, namun panjangnya agak kurang sesuai, dan warnanya juga tidak sesuai.
cukuop memuaskan",4
"Produk sesuai detailnya hanya saja pengiriman di hari terakhir estimasi pengiriman padahal pemberitahuan barang dikirim langs setelah pembayaran.. 
Makasih lazada.. terus tingkatkan pelayanan nya.. terutama pengirimannya..",5
Puas dgn layanan yg kbetulan pembawa paket ktemu dijln... Dan lgsg sy terima dan bawa sndiri krmh... Puas dgn lazada. Jaya selalu,5
barang udh sampe...pi TIDAK SESUAI pecenan,5
"maaf baru kasih ulasan, barang sudah diterima dan sejauh ini dipakai enak2 aja, ngga kempes, bahan bagus dan adem",5
BARANG SUDAH DITERIMA. PEMESANAN DARI TANGGAL 14 DESEMBER DENGAN HARGA 199.000 RUPIAH. ESTIMASI TANGGAL 19 DESEMABER DITERIMA. TAPI BARU DITERIMA TANGGAL 29 DESEMBER... KUALITAS BARANG LUMAYAN MUDAH2AN AWET..,2
"Pesan PUTIH UNILAND sesuai yg ditawarkan, yg dikirim warna KUNING TANPA MERK, bahan atas jg agak kasar sepertinya kualitas juga tdk sama dg Uniland... Stelah baca semua ulasan sebelumnya ternyata sy orang kesekian yg dikecewakan krn masalah yg sama, sepertinya seller tdk belajar dr keluhan tsb & tdk punya komitmen utk menjaga kepercayaan & kepuasan customer, hal terpenting dlm bisnis jaman now!",2
"walau telat dua hari dari estimasi, tapi cukup puas dgn pesanan kali ini
kasur enak dipakai, lumayan tabal, nyaman, praktis
gak nyangka bisa sampe ke medan ni kasir dgn free ongkir
salut untuk packing dan pengiriman lazada",4
Suka banget sama kasurnya. Bahan kasurnya juga gak panas. Pengiriman cepat. Pokoknya suka banget. Makasih lazada,5
Terima kasih Lazada & Oscar Living. Barang sesuai deskripsi dan datang lebih cepat dari estimasi. Sukses selalu untuk Lazada dan Oscar Living.,5
"Terima kasih lazada barng sdh sampai sesuai dengan pesanan ,bungkusan rapih mudah di buka ,kiriman cepat sampai ,hri ini pesan 2 hari langsung sampai pada tujuan ,kurirnya ramah dan sopan ,tks lazada semoga sukses selalu good job.....",5
"Cepat sampai, barang sesuai gambar dan harapan, packing mantap, kurir ramah. Makasih seller n lazada.
Pesan lagi ah...",4
"Maaf min, saya tadi salah nulis alamat, tapi saya uda terima email sama lazada udah dikirim, kirakira bisa dirubah lagi ngga alamatnya?",5
sangat keceea,5
barang sudh sampai sdh saya terima. tp saya pesan putih yg dtg merah haduhhh....,5
"Kecewa, pesan warna putih yang dikirim warna marun.
Kasur nyaman digunakan.",3
"kasur nya bagus....
pengiriman jg cepat..

maaf dulu lupa ngasih ulasan",4
"Produk OK, pengiriman cepat. Thanks seller & lazada. Maaf ulasan baru sempat skrg.
",5
"Barang Diterima baik, packing OK, kwalitas OK, estimasi wkt sampai tempat.",4
"Kasur tebal dan ringan,, melebihi ekspektasi saya,, good Job",4
Barang SDH di terima dgn cepat dan bgd,5
"Packing rapih, sesuai harapan. Thx lazada",5
"Brg sampai cpt (sehr) ..sesuai diskripsi..smg awet, thkssss",5
"Kualitas kasur bagus, tebal ringan, pengiriman cepat, sehari sampe. Untuk ukuran bisa berdua sih tpi kyaknya agak smpit. Boleh d tukar gk ya?",5
"Bagus, pengiriman cpt sampe,",4
Barang lumayan bagus.,5
Kasurnya empuk dan hangat tidak panas ternyata,5
bagus walau agak tipis.,5
"bagus sesuai harga dan kualitas
",5
bagus.  barang nya sesuai harga nya dan pengiriman nya pun cuma 1 hari thanks lazada ,5
"Fungsi yg cukup memuaskan,thanks ya Lzd..",5
bagus banget,5
Barang sesuai dengan pesanan,5
Lumayan bwt alas kalo pas pijat di rumah,4
"Biasanya saya kl order lazada 1hr smp tp ini udh 3hr blm smp"" jg ya.. Pdhl mao dpke",1
barang ok... packing kurang rapi,5
"Barang ok pengiriman agak lama..
Warna tdk sesuai d gambar putih polos yg datang cream bunga2..",3
"Kasur nya bagus, emang lagi di cari mantap",3
tidak sesuai dengan fisiknya...bukan merk Uniland,1
sedikit kecewa karena beda warna walaupun barang sampai dengan baik,4
Kiriman cepat.. Murah...bagus... Tks.,5
"empuk tapi kuat, cuma sayang tali nya agak mengganggu tampilan",4
"Kenyataannya, macam kasur abang2 keliling. Warna kuning gading, pinggiran biru. Gak bagus. Nyesel",1
Estimasi 14-20 sih tp sekarang udah tgl 19 klo gak dtg gimanaaa,1
"kasurnya empuk, ada bantalannya pula.. puas lahh.. terimakasih seller",4
"Top barangnya, cepet pengirimanya the best dech",5
ok bgs .seperti yg saya mau gak kecewa deh pokoknya!,5
Sesuai dengan harga.tksh,5
"Pengiriman cepat,barang oke,cm beda warna dari yg di pesan,tp gpp lah buat tidur ini....",3
Barang belum kunjung datang...,1
"Saya suka kasurnya, thanks LAZADA",5
Barang sesuai dgan gambar.... Kwalitas memuaskan,4
"Ukurannya pas buat anak kosan 
Kasurnya enak empuk 
Terima kasih banyak gan
Sukses selalu :D",5
Kiriman cepet sampe nya...barang oke oce...mantap,5
Tidak sesuai dengan motif yang ditampilkan,1
"Saya order satu hari lgs terkirim pekingan rapih bagus sesuai standard, tapi sayang gak sesuai sama yg digambarnya ya, pesan wrn putih dikirim wrn gold bunga², tpi it's okelah, tpi lain x disesuaikan gambar dengan fisiknya ya, thankyu...",3
"Barang udah sampai dengan selamat,cuma sehari udah sampe, lebih bagus dari ekspektasi ane, recomend, thanks",5
Barang sudah sampai pesan kemarin pagi hari ini udah sampai rumah.. Puas banget dan pas buat dua orang.. Terima kasih oscar living terima kasih lazada☺☺,5
"Oscar Living  melakukan pembatalan sepihak,karana menolak dikenakan biaya kirin tambahan yang tidak tercantum diklausul penawaran awal... padahal sudah dilakukan pembayaran",1
biasa,5
mantap,5
,3
bgusss,5
top,5
Recomended,5
"Barangnya  bagus, thanks Lazada",5
,4
"Sehari langsung sampe
Semoga awet ya kasur nya",4
KLO ke Cikarang gratis ongkir juga donkk,5
Bisa ga bayar malam besok sore sudah sampai tempat,4
"Pengiriman cepat, jahitan rapih, Kasur sesuai ekspektasi saya... thanks Seller n LAZADA...",5
,5
