review,rating
bibit mangga SDH datang tapi saya kecewa sb pengemasannya kurang rapi jadi daunnya pada rontok tinggal daun yang tua aja,2
"terima kasih paketx memuaskan dan pengiriman jga cepat
paketx dikrm via JNE, 3 Hr sampai tujuan.
sgt disayangkan, knp NinjaVanID, tdk seperti JNE.
10 Hr baru sampai tujuan",5
Paket sudah di terima mudah-mudahan buah nya sesuai dengan gambar kalau tidak berarti kalian durjana,3
pohon sdh d terima masih seger mudah2an bisa tumbuh subur dan cepat berbuah.  makasih lazada makasih mas kurir untuk tokonya top dah,3
"alhamdulillah... pengirimannya cepat &
pohonnya sudah saya tanam di pot.
smoga cepat berbuah. heheheee..
thanks ya.
moga usahanya lancar.
",5
brangnya cpat smpai dan msih sgar,5
kecewa pojonnya patah,5
"pohonnya sedikit layu, semoga tumbuh dan berbuah lebat",4
"bibit mangga nya seger bgt..
pasti berbuah lebat nnti nya aamiin",5
makasih smg pohon nya tumbuh sesuai gambar,5
terima kasih bibit dalam keadaan baik,5
bibitx mati,5
pohonnya mendarat dengan selamat..msh seger..smoga tumbuh dengan sehat ...thanks abang JNE yg sudah anter kerumah...,5
Barang sudah diterima dalam keadaan baik masih segar mudah-mudahan cepat besar terima kasih Lazada,5
bibit y ok semoga tumbuh subur y... ,5
perlu waktu,5
"suka sm pohonnya, mudah2an berbuah lebat dan tumbuh subur",5
datang nya cepat pohon nya masih seger semoga buah nya lebat,5
"sesuai gambar ,puas lah dengan barang ya,terimakasih lazada",3
bibit dah sampai bagus sesuai permintaan,5
respon penjual sama pengiriman nya cepat...pohon nya juga bagus...,5
pengiriman cepat...cm sehari..barang msh utuh..mksih seller,5
"bibit segar, semoga tidak berubah buahnya.",5
Sippp,5
