review,rating
barang sampay respon seler cepat pengiriman cepat sangat memuaskan ini yg ke 2 kali terimakasih,5
paket sudah sampay dengan baik pengiriman cepat  terimakasih buat kulir dan lazada ta lupa untuk seler nya,5
"alhamdulillah.. paket benih nya dah sampe walau agak lama di pengirimannya..
tinggal di tanam,semoga bisa tumbuh subur
seller nya ramah fast respon...",5
terima kasih pesanan telah sampai,4
trimakasih barange realpic makasih bwat seler dan lazada,5
"lg di tanam, belum tau hasilnya..",5
"Mantabs, barang sesuai pesanan",5
"Pengiriman sudah sampai bagus kurir y jg ramah sopan,,, march lazada",5
Sesuai ,5
sssip,5
