review,rating
Nyampe rmh kondisi msh seger bgt...makanya order lagi...nyicil beli satu2 bakalan jadi langganan cz pohon seger2 bagus ukuran nya juga gede thx yaaa ,5
"Baru kali ini kecewa dengan produk yang dikirim. seharusnya pengepakan pakai tanah basah, agar tanaman tidak kering. ",5
sesuai pesenan packing nya rapi.....daunnya msh seger....smga tumbuh subur....,5
Daun y kering tp mudah2 bs tumbuh deh klu bs tanah y ksh air br basah bru dbungkus plastik jd bs than lama,2
"packing oke, pohon ny masih hidup, langsung pindah tanam... 
",5
alhamdulillah calon mertua saya senang.,5
"Pohon salam nya juga cilik, bisa dihitung lah ada berapa daun. Tapi bagus karna dteng masih seger",4
"pohonnya kecil, tapi pohon datang dengan segar",5
terimakasih,5
Alhamdulilah tanaman nya udah nyampai kurir ramah mksh lazada,5
"udah nyampe,,tp sudah layu,,mudah2an bisa tumbuh",4
