review,rating
alhamdulillah paket sudah mendarat trimakasih mantap,5
alhamdulillah pohon nya sudah sampai  n masih seger.. semoga cepet besar n berbuah... terima kasih..,5
"bibit msh segar, matur nuwun seller & kurir",5
Alhamdulillah paket sudah diterima. Kondisi pohon alpokat kurang seger (mungkin karena pengiriman jauh).,4
"saya senang bibitnya sampai dalam keadaan hidup. walaupun lambat memberi ulasan itu dikarenakan saya ingin melihat perkembangannya setelah d pindahkan ke media yg lebih besar.  Ternyata tetap segar. klo lewat JNE cpt sampainya.Trims ya.
saya akan pesan lagi",5
"alhamdulillah paket diterima dlm keadaan baik,  msh segar daunnya pdhl udh 5 hari perjalanan packingnya bagus ",5
"bibit sdh nyampe dan kemasan sangat rapi di tambah bonus bibit lagi... makasih Lazada
",5
maaf baru kasih ulasan...barangnya alhamdullh masih seger mudah mudahan tumbuh dan berbuah,5
jos,5
lumayan bagus bibit nya msh subur cuma y daunnya patah dikit aj,5
sdh sampe msh segar,4
"bibit msh segar, packing rapih bgt... recommended pokoknya...",5
