review,rating
warna gak sesuai kak..,4
"sesuai pesanan...
nomor juga sesuai..saya suka ..semoga lancar bisnis nya..

",5
"barang bagus kualitas ok diksih surat didlm nya,游때 pengiriman cpt kurir jg dh kenal sering antar ksni hehe,,
tapi pas""an bgt no 39 soalnya 39 kcil.
saya biasa pke no.37",5
Maksasih barangnya smapai ..sedikit penyot dusnya..mungkin krna oengirimnnya...tp brang aman puas bnger游땢,5
Mkasih ka barangnya real pick....bagus banget..waluoun dus nya penyok ga aapa2 asl jangn barangnya aja游때,5
Pelanggan saya suka barangnya.....terimakasih selalu memuaskan barang nyaa...,5
Pass bnget ukurannya warnnya juga lucu.hehe..yerimakasih yaa,5
Pass bnget ukurannya warnnya juga lucu.hehe..yerimakasih yaa,5
Pass bnget ukurannya warnnya juga lucu.hehe..yerimakasih yaa,5
Pass bnget ukurannya warnnya juga lucu.hehe..yerimakasih yaa,5
Terimakasih puas belnja d sini,5
Good seller,5
Makasih sangat reao pikc pengirimnanya cepat,5
Terumakasih barang sesuai pesanan....ponakan q suka sama.barangnyaa驕쥞잺,5
Maksih barangnya udh sampai...siip.sesuai pesnaan pertahannak respon baiknya,5
Wah maksih seler barangnya baguss ...sedukit penyot dusnya mungkin di oengirimn,5
Maksih lazada barangnya udh sampai....suka bnget sama sepatunya驕쥞잺,5
Maaf baru kasih ulasan baru sempat游때游때barang. Sampai..sesuai oesanan bagus..pokonya toop markotop游땑,5
Pokonya bintang ynag berbicara...puassss bangeetttttt....cepat ramah lagi游땢,5
Waahh barangny bagus ka sesuai gambar..cepat lagi sampai nya,5
Waahh makasih kaaa..barangnya samapi. Bagus banget游땕游땕游땕,5
bagus,5
