review,rating
sepatunya bagus bgt realpict... udah senang bgt pas datang tapi biasa pake 38 kali ni ambil 1 nomor lebih  39 ternyata tetap aja tak muat jadinya muat dg anakku,5
"sayang sekali jaitannya lepas disisi kiri sama sisi kanannya juga, walopun cukup bagus realpict barangnya jadi agak kecewa 
",2
cakep ğŸ¤—,5
"makasih mojang trendy barangnya real pict, dan makasih juga buat lazada pengantarannya cepat",5
Sory baru sempat kasih bintang ,5
"maaf baru d ulas, barangnya bagus suka banget enak d pakai. seller nya ramah konfirm warna hitam uk. 37 habis, pokoknya ga nyesel walaupun ganti warna. terimakasih lazada seller & kurir nya... ",5
"barang nya mendarat dengan rapih boskuuuh ,mantap boskuh gk nyesel pokonya ..realpic sesuai dengan poto thanks lazada .. ",5
"Bagus sesuai pesanan, kurir sangat ramah,  makasi lazada N kurir sukses selalu y ",5
barang nya sudah sampai realfic Terima kasih lazada,5
barang nya sesuai pic..bagus,5
"pemesanan cepet....barangx juga bgs.mudahan awet ya dipake,
thanks lazada",5
real pict,4
