review,rating
"barang bgs, sesuai, cuma sygnya order dah mpir seminggu Bru diproses, jd dtg lmbt. Bang kurirnya baik bgt.",4
"puas....blnja di lazada
",5
bgs v nngguny lm bngt,4
lumayan lah buat harga segitu . gak kcewa.  aku udah 4 kali beli di fairooz,5
terima kasih.. lumayanlah harga segini sesuai aslinya.. buat ganti sehari2 ke kantor,5
maaf baru ulas... cocok banget pokonya...mksh lazada ,5
rielfict.. tp syang 39 biasa nya cukup ini kecill bnget kurir nya ramah ,5
"pkok nya bgus, dngn hrga sgtu",5
"sepatunya realpic alhamdulilah pelanggan aku suka
",5
"no 40 nya kekecilan, kurang gde. ",3
"puas banget sepatunya sesuai,pokoknyağŸ‘ğŸ‘ kurirnya juga ramah ",5
barangnya bagus.....sampe cepat.kurirnya ramah,5
"sepatu ya smp dgn cepat,cm sepatu ya biasa aj,tp lumayan lah buat ganti""",5
puas sesuai dengan pesanan,5
barang sesuai dengan harga...makasii lazada..,5
