review,rating
alkmdulilh dh sampai pesanan. ct bngt psen kemrin udh dteng tadi.kurir ramh sesuai pesanan mksih sukses trus,5
"الحمدللهpopoknya udh smpe ,sprti biasa paking rapih dan kurir ramah ,.. thanks lazada Dn mas kurirnya",5
bagus,5
alhamdulilah pempesnya dh dateng cepet bgt udh 2× pesen di toko ini ga pernah kecewa mantul deh pokonya makasih seller  n pa kurir,5
"alhamdulilah udh nyampe pempesnya,,,cepet bgt nyampenya sesuai bgt deh pokonya top deh,,,makasih seller n pa kirir",5
"Barang sdh diterima dgn baik.
Goods.. tingkatkan pelayanannya agar lbh baik lagi.
Terima kasih.
",5
pesanan sdah smpai..mksih seller or kurir nya ramah.sukses selalu,5
"realpict,dan amanah pengiriman super duper cepat",5
goooodddd,5
brngnya sesuai pesanan trimakasih lazada...,4
mantap,5
mantul,5
