review,rating
"mksh,,barang sesuai gbr, kwalitas brg ok, pengiriman cepat n  kurir ramah,,",5
"barang sudah diterima..tapi sayang cara pengepakan kurang bagus... 3barang gak ada yg gak penyok..ada yg lepas juga dari las nya,.",4
Barangnya sudah datang sama yang saya pesan pertama saya sekarang beli dua lagi jadi 4 Saya mau beli lagi Barangnya bagus sekali sama yang di gambarnya sama yang saya pesan barang yang mantul oke punya Terima kasih Lazada,5
Barangnya bagus sekali saya puas dengan dengan layanannya kurir nya juga bagus memuaskan Terima kasih Lazada,5
katanya mo di kirim ulang ???,2
"lampu udah sampe kemaren Bos,,mantab barang smg fungsi dan awet..",5
mantap,4
barang bagus,5
barang ada yg rusak,3
"barang sudah sampai, pancing oke tpi 2 buah kaca pecah, dan ada beberapa baut yang longgar",3
barang sudah datang ...tapi sayang banyak yg penyok dalam pengepakan,5
makasih ka barang nya bagus banget ...thanx lazada,5
barang sesuai yg saya pesan,5
barang sesuai harapan dan keinginan...masuk proses orderan selanjutnya.mkshğŸ‘ğŸ»,5
"Trimaksih gan...pesenan dah nyampe,,barang sesui pesenan,cepet bnget nyampe nya",4
"bagus, packing aman, pengiriman sesuai estimasi",5
makasij barang nya dah nyampe dengan selamat makasih lajada,5
puas barang dtrima dngn baik ,3
