review,rating
bagus banget asli nya...aman ga ada cacat...,5
"Alhamdulillah paket sdh sampe dg selamat.
packing rapih dan sgt aman, kualitas barang (TIDAK ada yg rusak), sesuai pict, pengiriman lbh cepet dri perkiraan awal, kurir baik.
soo.....mantul lah buat pelapak dan JNE dan om kurir.
pertahankan dan tingakatkan kualitas barang dan pelayanan",5
"Barang sdh diterima dan sangat baik, terimakasih. Kami mau beli banyak apa bisa ?",5
sangat bagus dan memuaskan,5
"kurang memuaskan, penjepitnya gk terlalu jepit dan ada yang patah",5
bagussssssss,5
"yang kemaren atasnya pecah pengirimannya yang benar karna sekatang mau pesan empat lagi tapi harus ati,, pengirimannya ya",5
"produk bagus, harga murah diskon 50% 
pesan 2pcs, tp sayang yg 1 nya pecah tp 
Alhamdulillah bisa lgsg di retur",5
"agan maaf ni kacany pada pecah ni minta ganti dong
",5
super sekali... cepat sAmpai Dan packing sangat aman,5
bagussss,5
oke mantul,5
"Packing bagus, delivery cepat. Produk jg bagus. ",5
barang bagus....siap jd,5
di packing sangat rapi.  paket cepat sampainya. kualitas bagus,5
barang dah smpai.. ok..  tapi cara pasang kaca nya gimana...?  tak pas dg pengait kawatnya,5
terimakasi lajada barangnya dah sy yerima dengan mulus,5
"Packing Bagus , Tapi tempat lampu ada yg Rusak atau pecah.Tapi yasudah lah gak papa.
Terima kasih",5
mantul,5
