review,rating
"Beli 1 dapat 2
harga murah,voucher ++
delivery cepat
kualitas bagus,sangat terang
sudah dites keduanya normal",5.0
NiceğŸ‘,5.0
"Nicron adalah yang terbaik, harga terjangkau di luar sana dan tidak memberikan apa-apa selain yang terbaik. Sangat menyukainya.",
Semuanya berfungsi dengan baik sesuai harapan. Goodlight untuk HARGA & diskon untuk frontliner sangat dihargai. Mencari untuk membeli lampu Anda di masa depan. Terima kasih nicron!,
"Menerima pesanan saya dalam kondisi bagus ..... Kasih Kartu Terima kasih dari nicron ..... Nicron benar-benar menghargai pelanggan mereka, mereka menjawab semua pertanyaan dan permintaan saya.... Yang nicron n4 terlihat dan terasa kokoh ..... diuji baik dengan eneloop baterai AA isi ulang saya dan kedua item berfungsi sempurna ..... ibu Saya suka yang kecil, ringan dan terang ..... cocok untuk digunakan di rumah dan sebagai cadangan fl ..... secara keseluruhan bagus sekaliâ™¥ï¸",
Napaka ganda ng item sulit na sulit at hindi ka manghihinayang sa binayad mo dahil heavy duty at lifetime mo magagamit..salamat po seller,
"Senter yang sangat bagus untuk rumah! Senter kuat hanya menggunakan 2pcs baterai AA ganda! Hanya untuk menambahkan, bahan yang digunakan sangat tahan lama. Harus punya!",
Sulit na sulit para sa harga nya ..... mas maliwanag pa sa maglite pro ko ..... mejo nag iinit lng un body pag matagal naka pada ..... pero over all its good .... tidak menyesal membeli barang ini ......,
Sangat puas! Produk bagus dari nicron.,
